,text,time,score
262,"We have been together for a year and 3 months. She is an amazing girl and I love her, she does make me happy. We live long distance (over seas) waiting for the wedding (not planned yet) in order to move in together. 

About a month or so ago, I did something that made her mad at me, it's not super serious is my eyes, but I can understand why it's a huge deal for her... Some background information, she has major depression and doesn't express her feelings or her thoughts well. I am naturally an outgoing cherful person. 

 Anyways, she has not talked to me normally since I did what I did, I have sent many many messages about how I am sorry and how I didn't know she would get this mad etc... I even made a video to show her how much I didn't mean it and how much I care about her.... About a week ago, I was able to get her on the phone, and I tried to explain my self and how I honestly didn't know she would be this mad about what I did, her response is that I should have known and that she pretty much won't forgive me. She won't give me a straight answer as to if she wants to still be with me or not.... Everytime she messages me now it's about something bad I did. 

I am not sure if she wants to be with me or not. I am confused as hell. I want to talk to her, but every time I send a message she sees it and doesn't respond. I have come to a point where I think she just doesn't care anymore about me. She is very stubborn and won't listen to anyone, it's actually taking a toll on my emotional health and mental health... I don't know what to do because I am at a loss for thought.. her best friend and sister even tried understanding from her and she won't tell them anything... 

I know long distance is hard thus why I am being patient hoping that living together might change things.. I feel like in the future will just be a series of this stubborness.... I don't know what to do.... Should I just move on? Should I keep Fighting? I made a promise to her that I would always be there by her side and always be patient when she is in her depression mode... I feel like if we were to break up, she would be devastated and so would I... Please give me advice...",05Dec2017,4
265,"

Sorry, this will be long. 

So I'm a freshman at a big state university (29,000 undergrads). I came here because it has a good reputation and a lot of people really love the school and it has a nice campus, and at the time I didn't know what I wanted to major in specifically and it has good programs in many things. 

I've been here for a while and I really tried to put myself out there and make connections and friends. I tried to befriend my roommate but she's only interested in her high school friends. I lived in a dorm to try to make friends there, but no one talks to each other in the dorm at all and I hardly even know any of the girls' names despite trying. 

I joined two clubs. One, I was in for a while, but it was a big workload with no payoff, and didn't facilitate friendship, so I quit. The other is a club sport and I really enjoy it. There are a few girls in there that I am acquaintances with and I do enjoy this club. 

I attend a church and it's okay. I haven't made any friends there though. 

I just spend a lot of my time feeling sad, lonely, and depressed. I don't really feel homesick necessarily, I just miss being around people who love and care about me. I find myself losing motivation for my schoolwork or even to try to make friends because I feel so sad and that my efforts aren't paying off. 

So I talked to my parents about transferring schools. I figured I would have to stay through the spring semester and then I wanted to move home and commute to a much smaller 4 year school. They said they didn't want me to commute, and I either needed to stay here for another semester and transfer straight into another 4 year school and live there, or come home and go to community college for this spring semester. 

I feel so bad about this because I feel like a failure. I feel like I failed socially and I failed my parents, because I had a big scholarship to that community college but I turned it down to come here and now I'm not happy here. They were all for me coming here though. My parents are afraid I won't be challenged socially at home, I guess. But I don't want to stay here and be miserable. And I will have to transfer or my junior and senior year so eventually I will be challenged socially again and have to live on campus/at an apartment with roommates again. 

I just feel like I need some time at home to regroup and get back on track mentally. 

Any advice? 

 ",05Dec2017,2
266,"I'm currently in 9th grade at a German ""gymnasium"" and have had since the beginning of the school year this really, really, REALLLLY severe english teacher. She is so severe that I once had a panic attack in her lesson, and have had panic attacks on a regular basis ever since (yes, because of her.) . I have also passed out once, also in her lesson. 

I have spoken to the director about this, but they did nothing to change the situation, they just ""talked"" to her (which really didn't change the situation at all). 

Is it normal for a teacher to treat her students like shit and for the director/school lead to not give a f*ck about their students' mental health?

",05Dec2017,3
267,"Hey guys, so as the title says, I got mono and it’s pretty much fizzling out. After I recover, when would it be acceptable to make out with someone? I’m a first year uni student so it’s hard as hell that I can do shit but I also don’t want to make someone go through this.",05Dec2017,3
268,"My girlfriend just bought a 4 month old tabby kitten and moved him into our house! I've never owned a cat. I want to make sure this cat is raised properly! What should I do? 
",05Dec2017,2
269,"It’s not anything important, it’s just a shitty minimum wage job, but there is some deeper meaning for my wanting to return.

Yesterday I posted to r/rant with an, to be honest an article because of how damn long it was, but in short I explained that I disliked being a part of these few wealthier parts of the world. The majority of the world suffers and I can’t bear to stand idly by and just watch.

I worked a bit South at an Outback in the kitchen as a Line Cook. They were kinda desperate so I was like sure when looking for a job. They’re super genuine and caring, at least most.
But that’s a quality that a lot of people in the struggle have. They are understanding, often more patient, and just more “real”. These modern ‘sanctuary’ cities and some of the people are bubbled in.

I’m 18 and just started community college, and near the beginning I was actually kinda trying to pay for it myself even though it’s damn near impossible at this point. CC is still reasonable so I kinda felt the urge to fund it myself.

His argument is obviously valid. I need to focus on my education and should take advantage of not being required to work and go to school. 

It’s just been too long that I’ve thought this way. Practically everyday for the past 3,4, or 5 years, I can’t remember exactly, i constantly think about every but me. 
I’m not trying to say I’m a saint of some sort but it’s actually a sort of guilt I can’t control. But I embrace it because I believe global poverty is almost unacceptable with the amount of innovation we now have.

I just don’t really know where to go.",05Dec2017,2
271,"Generally how long am i suppose to take to ask a girl wich i've never meet in person? I usualy wait a few days but some times they might just want something more casual but there's no way to know that right? 

EDIT: this particular girl I've meet on a tinder like app but I've done the same thing with girls that my friends introduced, chip chat for a couple of days and then we meet in person, by the way I'm seeing this one this week :p I guess I'm too anxious (actually I'm sure of this but wtvr)",05Dec2017,2
272,"Hi guys, i do a study with not a lot of people (around 70 in a year) so everyone knows eachother. I've been talking to a girl (at the university and texting) for a few weeks and i think i like her. I really want to ask her out, but when i am at school i notice that we are never alone. How should i ask her out? with some people around (which can be an embarresment for both), just text her (which is not very personal imo) or wait for 'the moment' (which will probably never happen)",05Dec2017,5
273,"Hey guys. I didn’t know where else to post this. Let me know if there’s another sub that this fits in. So I might be in denial. But I wanted to know if I was an anorexic. I lost my job recently and yesterday, the only thing I had to eat was 4 cookies. The whole 24 hours. Today I can’t get out of my bed. My head is still hurting from yesterday. N it’s not that I don’t want to eat. It’s that there’s nothing to eat. I don’t really have an appetite but my goal weight has always been 135. I don’t want to be skinny. I want to be bigger. ",05Dec2017,3
277,"The reason I am asking is that I find it to be a condescending response to a person explaining themselves.  Really, I probably *don't* fully ""get what a person is saying"" unless I have lived their lives, and what I mean to say instead is that I believe I have understood their *words* well enough to respond to them.  But ""I believe ... to them"" hardly rolls off the tongue.

Any ideas?",05Dec2017,2
278,"I'm in a sticky situation and I'll keep it as short as possible. 

A girl who works in my office and I (we are totally platonic) have started to arrange to move in together. As two young people of the opposite sex this is always inviting questions about our relationship being sexual and/or romantic. This isn't the issue.

The issue is that I have met a girl (who I also work with) who is interested in me romantically, as am I towards her. I haven't told her that I'm very close to moving in with another girl who works in the same office. I can imagine if me and the girl who I like end up dating (it seems to be going that way) I know things will get complicated due to me living with another girl. I would never cheat or betray her at all. I just don't want things to get complicated down the line. 

Could anybody give me some advice or input please? ",05Dec2017,2
279,"So i’m 16 years old, and found that I had toooo much leghair (like absurd too much, everyone said it also once they saw it)  

So I was like I should shave it off so it grows back (but not as much as it is now since it’s veryyyyyy long) so I started shaving and damn it’s so much it takes alot of tike so I only did one upper leg and already got tired because of how much I have.

I could use a clipper but that makes alot of noice and I don’t really want anyone in the house think that I shave my legs since it’s really something you shouldn’t do, anyways is there anything I can do?  Because this feels so dumb and annoying I have 1 upperleg shaved and other parts just hairy...",05Dec2017,2
280,Yeah so I was wondering if you bois think it's a small price to pay to sacrifice one of your two kidneys for the sake of rocking the latest model of the Legendary daemon? After all one is more then enough to do the job.,05Dec2017,1
281,"*Names have been changed.

My family is a complete dramatic shit show. I am 21 and the youngest of eight kids. None of us are full blooded siblings, with the exception of my brother Marshall, who is 29, and my sister Madonna, who is 23. They are the main reason I'm writing you, as well as our sister B, who is (I believe) 35.

My brother Marshall is engaged to a woman, Ariel, who is barely a year older than me. They have a daughter who is two months old.

Before Marshall was dating Ariel, he was seeing a girl named Lara, who is as of writing this, 26 and the mother of a three year old boy. They were absolutely in love, he was going to propose to her, and he fucked that up. I don’t know exactly how he did, seeing as this is all ancient history and they split up at least six years ago and everyone decided that I was “too young” to know. 

He was introduced to Lara by our sister B, as they were all working together and Lara and B were friends, and through B, Madonna was friends with her as well. To this day, they are still friends with Lara, even though Marshall and Lara have not been together for years. This has caused many issues, for a few different reasons, along with the fact that Madonna has not had the chance to meet his daughter because she lives well over an hour away and does not have a car, and he refuses to make the trip to her himself so that they can meet each other.

It should be stated that of Marshall’s sisters, he has to be mad at one of the three of us. It has always been Madonna or B. I have no clue why he’s never mad at me. He should be. I call him a jackass to his face, I don’t bend over backwards to be in his good graces, and I’ll call him out on his shit as I see fit. In spite of all of this, I have always been his favorite sister.

Marshall is paranoid that Ariel will find out that the day of their first date, he was making plans to get back together with Lara. Obviously those plans fell through. Because of this, he has:

Let Ariel believe for the first year of their relationship that Lara was our cousin, and not his ex-girlfriend, after the two met at Madonna’s baby-shower a little over two years ago.

Fed her stories of Lara being a crazy stalker ex that won’t leave him alone, and that our family callously allows around because I guess we’re assholes or something stupid like that.

Said stories have made Ariel (already diagnosed Bipolar) paranoid about Lara to the extent that it amuses me. Why would you be paranoid that she’s going to steal your man when he refuses to see said person, and you’re engaged and have had this man’s child? Never mind the fact that you think someone would even try to steal him from you. The man is not a prize. Thinking he’s worth stealing is like thinking a pebble is a diamond. I guess this is where the phrase “One man’s redneck racist homophobic misogynist trash is another man’s treasure” comes in.

Refused to go to B’s wedding earlier this year because Lara accidentally received an invitation when she was not supposed to be invited. Lara rsvp’d no, and he still refused to go to our sister’s wedding. She has no wedding pictures with him in them and this hurts her a lot because she’s all “family is the most important blah blah blah emotions emotions feelings”. As are most of the women in our family. Me, not so much.

On top of all of this, because of a comment from Lara congratulating Marshall and Ariel on the birth of their daughter, Marshall and Ariel are no longer going to come to our family Christmas gathering. In the group chat for Christmas, Madonna brought up that she knew exactly why they weren’t going and that it was ridiculous.

You see, the comment on Facebook was made SEVEN WEEKS AGO and Ariel apparently just saw it yesterday. In conjunction with that, Lara is staying with Madonna because she was evicted from her apartment and literally had nowhere else to go. Put those things together and this makes Ariel think that everyone hates her, no one wants her around, she isn’t a part of the family, and everyone would prefer if she was replaced by Lara, and that no one wants her to come to family Christmas. Never mind the fact that Madonna is not even coming to family Christmas as the day we are having it is a mandatory work day for the retail store she works in.

My brother also compared Madonna being friends with Lara would be like him being friends with one of Madonna’s exes – specifically the one that is currently on trial for multiple counts of statutory rape (which is even more disgusting when you figure in that he’s about forty right now and was 35 when it happened), and who has served jail time for attempted murder. Who did he attempt to murder? Madonna.

Our brother compared hanging out with his harmless ex to hanging out with one of the most despicable human beings I have had the displeasure to ever meet.

In addition to this, Marshall has stated that Madonna is no longer family, no longer his sister, is not allowed around his daughter, will never meet his daughter ever, if she is around he will not be around, nor will his daughter be around. The words “Restraining Order” were thrown around as well.

It has also been stated that anyone who has Madonna around will be blacklisted from seeing him and his family, essentially forcing the family to choose between the two.

Madonna and I have not had a good history. She abused me as we were growing up. Emotionally, mentally, and physically. I would come home from school and only leave my bedroom to go to the bathroom or to get food, or in the later years, go to work. She abused our mother in much the same way, although she never attempted to kill our mother. She has since grown up and apologized, and has changed drastically since she had her daughter, and as such I have decided not to dwell on the past too much. I have not forgiven her, nor have I forgotten, but I don’t allow it to affect our relationship nowadays because she is a much different person. She knows I hated her with every fiber of my being, has mentioned it to my older nieces (fifteen, fourteen, and almost thirteen) in an effort to stop them from hurting each other. Even with all of this, she still called me last night, asking for help. Knowing that I was much more likely to be unsympathetic to her. Knowing that I could either not answer or tell her to fuck off. Knowing that it was much more likely that I would not care in the slightest. I respect her for this.

I know it is taking me a while to get to my point/question. I have a few. Obviously, the more broad “what do I do?” question that everyone has in dramatic situations. I also have more specific questions that I would like advice for:

I have no interest in being in Marshall and Ariel’s wedding anymore. They’re getting married in September. I’m one of her bridesmaids and I have already spent money on buying my dress, and I’m apparently supposed to start a Facebook event page for the wedding, but I have no interest, no desire, no care to be in their wedding. I have felt like this since I found out that he was refusing to go to B’s wedding (I was a bridesmaid in her wedding as well), and have felt this increasingly through the planning stages for their wedding, as I’m also feeling that Ariel is going to turn into a Bridezilla and I’m not a masochist. The above drama that I’ve listed is the last straw for me. How the hell do I get out of being in this wedding without causing our mother a heart attack?

How do I confront my brother about this? None of this sits right for me. I am not an emotions person, but I would like to continue my life in the good graces of our mother, as I still live with mom and dad because I can’t afford to move out, and I would like to continue being allowed to see my niece. However, I do not care if my brother is upset with me. Unlike my sisters, I don’t worry about whether or not I have the approval of “King Marshall of Turd Mountain.”

*

EDIT: My brother has since then accused my sister of being on drugs, and has stated that the man who tried to kill her should have finished the job. I am more resolved than ever that I do not want to be a part of that wedding. Please give me advice.",05Dec2017,2
282,"okay so a little bit of back story. about two years ago i had this friend, we’ll call her Francine. me and Francine were close in middle school, but fell off when we got into high school. Francine started dating my ex, and became a total bitch to me and has hated me ever since even though i didnt do anything. 
So Francine had this friend, we will call her Sarah. Francine and Sarah were friends before I met Sarah, but they werent super close or anything. 
One year later, I met Sarah and we became best friends really quickly. even still she tells me all of her problems and confides in me about her relationship struggles, etc. 
Over summer, i hung out with Sarah pretty much everyday, and she didnt hang out with Francine at all, so i thought they were not really friends anymore because Francine had this other friend that she was close with. Sarah even told me personal shit about Francine and would talk shit about Francine to me, even if I didnt bring her up.
So me and Sarah are close, but lately she has been hanging out with Francine more because they have classes in school together and Francine is no longer friends with the girl she used to be best friends with. I feel like Francine is trying to get closer with Sarah because she has no friends anymore and maybe even to make me upset. Ive even found out that Francine confides in Sarah and tells her her secrets and stuff, so I feel like maybe Francine and Sarah are closer than Sarah tells me, which bothers me.

Whenever Francine and Sarah hang out , I try not to get upset or angry and I havent talked to Sarah about how i feel about them hanging out because i know it is not fair of me to tell her not to be friends with Francine. But at the same time it bothers me because Sarah, my best friend, hangs out with Francine, and she KNOWS that me and Francine dont like each other. it even bothers me that Sarah talks shit about Francine to me, because i just feel like she is being fake and probably talks shit about me to Francine too.
Today, while Sarah was hanging out with Francine, and she texted me something snarky, so I felt like Francine was influencing her to talk like that to me and I did not appreciate it. It does tick me off that they hang out together and I have started to pull away from my best friend Sarah because I dont want to be vulnerable and have Sarah telling Francine all of my secrets and problems. 

I dont really know what i should do anymore but  I feel like Sarah is kind of fake, but I cannot tell if she is more fake to me or Francine. Its not fair to me or Francine that we are both being roasted behind each others backs, but Sarah has been my support for like a year now and i appreciate her. 

I feel like if I talk to Sarah about it she will get mad and just think that I am being petty because i dont like Francine. I just dont like feeling liek my best friend might be going behind my back and exposing me to someone who dislikes me.

Any advice?",05Dec2017,2
283,"Long story short i belong to a muslim family and my siblings were arranged marriage 
so they found out that am in a relationship 
parents came said we need to talk then a long conversation
(am not bringing that girl to this home/u know how girls are these days/blah blah) i really love her and she loves me too
so basically its like family or relationship  
any advice would be appreciated 
",05Dec2017,3
285,i’ve got no one to talk to and i hate therapists basically looking to see if other people have felt like this at this age  ,05Dec2017,1
286,"This last week, I participated at a debate tournament. During my second round of public forum, I debated against this super cute girl. We were both second speaker, so we did the main debating against each other. After the debate, we talked for a little bit, then parted ways. When I got home that night, I sat and regret not getting her number (or talking to her more). Fast forward to this week, I found her name on the debate ballot. I tried finding her on social media... and I did. I am now here, and am wondering whether or not I should message her. Should I? Is this creepy? Have I crossed the line by trying to find her through the debate ballot? Am I looking too deep into this?",05Dec2017,2
287,I recently started therapy and I am a couple sessions in and been given an official diagnosis of a slight anxiety disorder. I tend to be in my head and overthink everything a lot so this made sense but how do all deal with your anxiety?,05Dec2017,3
290,"Live in a cold city where the Fire Department needs help keeping it clear of ice and snow. This little guy needs a name. Here's the list I made:  

* #1 Best Hydrant to Pee On According to DogYelp.com
* Harvey Firehydrantstein
* Sex On Fire Hydrant
* Hydrantasaurus Rex
* Baptism By Fire Hydrant
* Earth, Wind, &amp; Fire Hydrant",05Dec2017,24
291,"Hi reddit, 
First time poster EVER. HOW FANTASTIC. I’ve always had body image problems, even as a little girl, but in the past 2 years I went from 125lbs to 190-200 (i fluctuate in that area). A lot of it has to do with my depression and anxiety getting worse around that time. I also started drinking alcohol a lot more. Mentally I’m doing better as I’m back in college for the first time in several years, but so far it’s the only positive change I’ve made. What has helped you, guys? ",05Dec2017,5
