,text,time,score
0,"Sophomore 15 years old, have a love interest but she's 2 years older, says I'm too young. What can I do to seem older/chill and get rid of all the sophomore shit?",05Dec2017,2
2,So most people would say I like to be with people and I would agree. I feel kind of empty and useless if I'm not in a group. I think it's harming some relationships because I come off as attention seeking and won't leave them alone. Is there a way to  move past that?,05Dec2017,2
3,"I'm seeking advice on whether or not I should let a work colleague move in with my husband and I. Rentals in our town are so expensive and few that people are currently on wait list. Also my husband and I rent a 3 bedroom house with 2 spare bedrooms. 

 

I've already discussed it with my husband and at first he was unsure, however he doesn't mind and likes the idea of having some help us with the rent &amp; utility bills and he also reckons it will be good company for me. As my husband works late most nights.

 

I however am unsure. I'm conflicted as I've somehow got it in my head that married couples don't house share. We're not desperate for a house mate, as we can afford to pay all our bills.

I've looked at the positives which include that we have money coming into to pay some rent and bills. There will be someone there to look after place if my husband and I go away.

 

However the negatives are, my husband and I won't be able to walk around naked like we sometimes usually do. Also won't be able to go to the bathroom with the door open. And sex won't be able to be as loud as it usually is.

 

However if he was to move in, would there be some kind of ground rules? What's the best way for these sort of things to work?",05Dec2017,2
4,"I feel like I jinxed myself. Now I'm at a loss because he is the most unhappy dude ever. He's a 50-60 year old white guy (I'm a 22 year old African American) who is always grumpy and yelling. My friends keep telling me to get him a dildo, but I figure someone this unhappy deserves a good gift even if he is kinda shitty.


I have no idea what he likes other than his kids and yelling at people. I tried to compliment him on his shoes once and he told me he ""fucking hated"" them. Awesome. I would ask around but it'd be too obvious, and I've given you guys literally all I know about him so we're all in the same info boat.



So yeah, what do I get an old white guy for Christmas?",05Dec2017,7
5,"I may sound like a horrible person because deportation would be cruel. However, I fucking hate this woman. For 20 fucking years, I have had to deal with her bullshit and mistreatment of my family especially my mom (her sister). So she has been in the states for about 18+ years and it has never occurred to her to apply for citizenship until now. Well, my mom is the only one with citizenship out of her 8 siblings. So she asked my mom to sponsor her. Funny, she is nice right now but just 1-2 weeks ago she would not answer my mom's texts and calls. She yelled at my mom because my mom asked for help paying for my grandmas plane ticket to the US. My mom managed to get her a green card (only wants to visit) because she has not seen my aunts in 18+ years since they've been here. She didn't want to help foot any of the bills just like she ended up making my mom foot the bill for my grandpa's electric wheelchair. She doesn't want to pay for that she would rather spend money on alcohol, parties, live mariachi to play at her parties, and concerts (all of which she never invites my mom to unless she wants her to help pay for the food). So she ignored my mom so my mom was going to apologize to her like a puppy.  She always does this she would not invite my mom to dinners or events like birthdays and exclude her because my mom ""doesn't drink"" is ""too goody good"" since my mom does not like to get drunk and act a fool and drive drunk home at like 4am.However, as soon as she wants something she leeches onto my mom until she gets what she wants. Needs signature for a car? Calls my mom. Needs social security to work? Calls my mom. She even stole my mom's social security at some point without her permission. My mom found out she was shoplifting and confronted her because she would be held accountable because that is technically her identity and it would fall on her record. After she was caught shoplifting she got angry that my mom stopped letting her use her SSN. So she had my grandpa and the rest of the family yell at her and call her selfish. Even though my parents let her live rent free with my uncle and my cousins in my house for years to help them get on their feet. Treats me like shit too. Every time she sees me she makes fun of me calling me skinny, anorexic (I'm not), and ugly. She thinks its funny to pull my hair too. Hence why I try to avoid going to her house and avoid her like the plague. I don't think I will deport her since my mom would end up paying to get her back and I do not want to harm her in the process. But I have been fantasizing about it for years. Sure her husband is cool but her kids are following in her exact footsteps.  She is finally trying to get her paperwork together and is now always at my parent's house trying to get them to help her. Today, she would not leave until she got their taxes (they are going to sponsor her).  Than got I have their taxes (I needed to fill out my FAFSA) and I am a few hours away at college. My dad was going to pick them up tonight but I am at the library ""studying"". So he will have to pick it up tomorrow. She got upset he was not going to go tonight and was going to drive up here herself. I would've loved that. I am thinking of ways to sabotage the taxes (i.e remove necessary paperwork) to slow down the process and give her hell. Any ideas? What would you guys do? Am I justified to be this pissed?",05Dec2017,2
6,"Hi, I have a father who doesn't support me in becoming an entrepreneur. I have explained to him that I don't want to borrow loan to go to college because it made more sense for me to learn from a good successful CEO friend of mine while working a job, building up my business and stay on the positive note-financially wise.

I have explained that business will take time just like how it takes 4-6 years to get a Degree. But he still don't support my decision and wants me to borrow loan and go to college because he ""thinks"" that's the way to go since everyone is doing it and that is his proof. I give him proof of my multi-millionaire business friend but his ears are shut off. 

Every day he does what it takes to say negative things about me in front of me and friends. When friends that have the same mindset as me speaks for me, he backs out. 

I'm considering moving out. 

What are your advice?",05Dec2017,2
7,"This guy, Chris, is a frosh and has a one sided friendship with me, where he thinks we're friends, i'm not. The dude is a nice kid but annoying at times. We're on the same team, he's struggled to make friends, but he just doesn't know when he's not wanted. So he'll tag along with me and the people i talk to at times.

Yesterday after our game, i invited my friends Jake and Tony to my place after we passed for food, Chris tagged along even though i only invited Jake and Tony. We tried ditching Chris multiple times or to get the hint, but his dorm was on the way to my place so he tagged along. I gave my friends refreshments, Chris had one for the first time but took forever to finish it (i offered him soda, but he wanted to try it), pretended to be wasted, and was rude to whoever he talked to on the phone. He took an hour to finish it, when we were just trying to get him out of my apartment.

Like i get he wants friends, but he clearly doesn't know boundaries, but none of us have the stones to tell him. Tony has a class with Chris, and told me Chris sat next to him and took Tony's friend's seat.

I think he assumes we're inviting him to our team next semester. If he were a better player i would make the case to invite him, but he's frustrating to play with, so much so that i've lost patience with trying to help him. We keep hinting that he's not welcome, none of us want to tell him because he's a kid and has no friends.

Is it better to ignore/ghost him or should i tell him straight up he isn't welcome and needs to actually talk to other people to make friends?",05Dec2017,2
8,15 year old male if that helps.,05Dec2017,12
9,"So the tl:dr of my issue is that I was diagnosed with dysthymia a while ago, my best friend of 6 years that I’ve always told everything to and spent almost every day with was the one who drove me to see a doctor about seeing if I had depression, fast forward 6 months and she has said that she can’t take the negativity and toxicity anymore and doesn’t want to be around me.

Now for some more details. She told me this three days ago and since then I’ve spoken to her a few times trying to repair the friendship but I seem to have only pushed her away more. I don’t know if she’s doing this because she’s completely fed up with me and doesn’t want to be close anymore, or whether she’s doing this all to help me get better and be a happier person.

I’ve made an appointment with a doctor to get a referral for a psych and to see if I need meds for coping with the feelings I live with daily, I’ve also put in plans to take up sport again in hopes that I’ll find a sense of purpose in my life again.

Mainly I’m asking for advice on how to approach this situation. She seems really upset and over me. I know I have to focus on bettering myself right now, but I can’t seem to get the thought of losing such an important friendship out of my head. 

Any advice would be greatly appreciated",05Dec2017,2
11,"Its been a while since she rejected me, I’ve accepted that I have a lot of feelings for her because I felt like tearing myself apart in the period that I was trying to get rid of them.

Questioning why I have this much feelings for her and why I still have them seems to make me like her more, even though we rarely see each other and even more rarely speak.

I shouldn’t have feelings like this for someone at this age, nothing good will ever come out of them, it will only weaken me, especially since that person didn’t want to date me.

She just wants to have fun, as do everyone in college I should be like that too but conditions made me turn out different.",05Dec2017,2
12,0,05Dec2017,1
13,"Last August I wrecked my ankle and since then I've pretty much become a hermit. I was out of the country for 7 months to live with my family - I didn't speak the language there and most American websites like FB were blocked. 

I was really social before then and now I find myself feeling anxious in social situations. I was extroverted and now I feel drained in the rare moments when I'm with people. 

I find myself becoming socially awkward. My ankle is still not better which makes me even less confident in myself. I use crutches to get around. ",05Dec2017,38
17,0,05Dec2017,1
18,"Hi r/advice

I recently posted on this subreddit about my situation. Long story short, I was found violating school conduct (laundry room theft) and am now put on disciplinary probation. Because of this, I had to resign from a campus position that I'd worked for the last 2 years. The timing of this situation is bad. I recently got a really awesome job offer that does background check.

I checked with my school and they said my disciplinary record cannot be shared with people outside the university without my consent. I checked with the school police and they said I have no criminal record (no arrest, no conviction) and companies only look for county police record. I talked to my ex-supervisor and we are on really good terms (he invited to grab coffee sometimes before this semester ends).

Rationally, I have nothing to be worried about. But I constantly have this intrusive thoughts about having my offer rescinded and then I will lose everything. I have constant anxiety and my mind is never at ease. I also miss my job and the people I used to work with. I miss living on campus as well.

Any advice on how to overcome this difficult time?",05Dec2017,2
20,"I got blackout drunk the other night and somehow managed to get a turd on floor in the hall. This is not like me, and ive never had anything similar happen. I dont drink like this often, and i dont see it happening again. It wasnt a big one but still. I shit on the floor.

Anyways, the dude was a hell of a champ and apparently took care of it before i even woke up. I feel terrible because no one should have to deal with that, and i wish he would have woken me up so i could take care of it so that it was like it i didnt even happen but he said he didnt want to wake me up.

What can I do to pay this dude back and appreciate him being hella cool about his roommate literally crapping on the floor.",05Dec2017,10
21,"(Context) So I don't have many friends, especially other guys, and I'm not super close with any of them.  One of my friends, who is a girl, DESPISES Owen, my only close-ish friend.  I only learned this recently, when she told me to my face that she hated him for being ""different"" and ""annoying"". (Apparently, She didn't know I was close with Owen at the time.)  She went on to essentially say that when he tries to make friends, it pisses her off.
I understand that not everyone gets along, and that's perfectly fine, I'm not going around saying you have to like all of my friends.
What really made me mad is that she constantly defends someone who has bullied me for the past 6 years, and refuses to even listen to my side of that story, saying he's a really nice guys and all that. (to clarify, the bullying is never physical, but he goes out of his way to ostracise me from the community, and since I go to a small school it's really effective)

So basically she hates Owen for being different than other people, which I can relate to and that really hurt me as well.  It was also really hypocritical of her to say all these things after defending a such a jerk.

Now she's freaking out because someone told her I was mad and I have no frickin clue what I should do.  
On one hand I don't want to end my friendship with this person but on the other hand I should defend Owen and I am pretty mad at her for what she said.",05Dec2017,2
22,"I (15m) have a really close friend that's 15 (Female, we'll call her Ashley) and she had a family friend's son (17, we'll call him jim) over the summer which used to come over to her beach house (while she was alone) 


Now she told me that first it started out as just a summer relationship that they would drop when the summer was over. However, Ashley was really naive and when Jim said he was ""in love"" with her she believed it. She explained to me that slowly Jim started getting more and more sexual and that the first time it got really significant was her first story, here is how it goes. ""Around mid July I was on the couch eating a candy bar in the morning still in pajamas, she was watching TV when Jim sat on the couch with her. He slowly started trying to make moves like putting his arm around her or kissing her or simple things where it wasn't out of the normal/she was ok with, but then all of a sudden he put his arm up my shirt and I said no. He stopped at first, but after a couple minutes he tried again, and again, and again, and after many times I couldn't stop him anymore. and I stayed silent. Nothing more besides 'small' things happened that day."" 


Now in between the first story and the second story more things have happened but she doesn't think they're significant so the second story goes like this, ""we were just chilling on my bed, just hanging out not kissing, not doing anything and all of a sudden he started reaching down my pants even though I kept saying stop then got up whipped out his dick, and I just kept saying I don't want to see that and please stop, and he took a step closer and I just pushed him away and he stopped.""


This fucking psychopath won't stop emotionally abusing her besides the sexual harassment, every other day he's either saying he loves her and that they're friends, but some day's I swear he act's so weird. She made me listen to her talking to him after he called and he had the most monotonous voice saying hey and nothing else, and she has to say whats up and he'll usually responding playing a game. Then it will be quiet for a solid 30 seconds. It's so creepy. He says he's like this because he hasn't had a girlfriend before She's had enough but she's scared. He has a car and knows her address, but doesn't want to tell her mom. 


I feel like I need to do something. I can't just drop it. She's acting like it doesn't matter that it even happened. She keeps saying she got over it, but most of the time I see her crying/really upset because of him. what can I do without her mom/parents knowing and if I can't do anything, do I tell her parents.",05Dec2017,5
23,My penis is above 5 inches long. It's about as big around as a toilet paper roll. so how can I give a woman a mind blowing orgasm with my size?,05Dec2017,2
29,"I need help and some advice. It's funny because I know what I need to do but I just can't bring myself to do it. I don't know if this is called procrastination well yea maybe it is but there are so many things I want to do but I'm so fucking scared that the fear or procrastination just stops me in my tracks. 

I have movie ideas but I won't fucking write a script. I just can't bring myself to do it. I have read so much that getting a script picked up is almost impossible so I guess that just adds to the fear and I don't do it. I have a title page from 2015. It's going to be 3 years and I have not written shit. 

It's just not even the screenplay its whenever I get an idea I get this fear of failing that I self-sabotage myself. How do I get out of my own head? Fear of failing is funny because you are scared of failing so you don't do anything thus you just failed. The thing you are scared of is what you are working for. It's insane thinking but I am in this trap and I can't seem to get out.

What do you do when your #1 enemy or the person that is standing in the way of what you want to do is you? I know what I need to do. I know how to do it, I just can seem to actually do it. So now my new shit is reading on ""productivity and procrastination"" which I just read was another form of procrastination. The ""study or research"" phase that just never ends and you end but doing nothing. I feel like I'm screaming inside, crying inside, really just going insane inside while on the outside I'm just on auto piolet doing my bullshit job that I just complain about but really do nothing to change. 

Any thoughts?",05Dec2017,2
30,"My best friend just got dumped by his girlfriend and I really like him, what should I do?",05Dec2017,3
31,"My mom has always been abusive. She gets into these moods where she won’t do anything and sits on the couch watching shows all day (she’s a housewife) She used to love having power over my sister and I. She used to give away dogs to punish us, smack the sh*t out of us for extremely simple things. One time she promised my friend and I that she would take us swimming when I was 7, she then fell asleep and since I was so excited to go swimming I tried to calmly wake her up...she woke up angry and pinned me to the ground smacking me as I was squirming and crying. This was just one example I can count 30+ similar encounters. Apart from all this which happened 5 years ago, she’s been nice to me and has been a good mom. But the past few months she has completely gone back to her old savage ways. 

Today my sister and I got into a fight which was instigated by my sister, who knew I had stuff after school yet made every excuse to stall from getting home to punish me. I got mad and called her the B word, she told my mom, and when I got home that’s when it began. She legit would stop and go on her phone to text her friends, go back inside the school, and do anything she could to be an a*s.

I enter the house with my mom right there, no questions asked she immediately starts slapping me while yelling at me. I try to explain my case but my mom results to more yelling and smacking and screaming shut up every time I try to even talk. Now her abuse doesn’t hurt as much as it used to unless she slaps my face. After yelling at me for 15 minutes, talking about how I will have no Christmas, and threatening everything I have (xbox, money, etc) I decide I’m done with it and put my earbuds in. My mom runs over to me, rips my earbuds out, and slaps me 3 times extremely violently in the face...This is when I lose it, I grab her biceps and start power housing her backwards to show my power while yelling about how I’m so done with her shit and what happened today wasn’t my fault. She storms off with my earbuds and hides them elsewhere. Keep in mind this was self defense and I never hit my mom (and probably never would) but instead simply pushed her back after she violently face slapped me 3 times in a row.

I have no idea why she has been so mad and there has been built up tension, she’s been treating my sister extremely nice. My father is being treated just as bad by her. She tries to bully us and do anything she can to get a reaction. The reason she yanked my earbuds out and decided to get physical was simply because I stopped giving her a reaction to her petty threats. Me calling my sister the B word and my mom punishing me as bad as she did was not because of the fact I called her a B word, but simply because my mom has been extremely grumpy and angry with me lately and she wanted a reason to punish me. 

Yesterday night she went into my dads room and ripped his fan out of the wall, slamming the door shut, and sleeping on the couch. She purposely woke him up and she knows he has trouble falling asleep without a fan so she took it. The reason for this is because earlier that day she mad a big deal about herself ordering the wrong thing, and after arguing with the manger and whatnot, my dad stepped in saying she was embarrassing him making a big deal over nothing. Yes she will literally make a mistake then try to punish others out of...embarrassment? I really have no clue why she does this.

A few things to note: 
-I suspect she has a mental disorder since she gets into moods and shifts mood extremely quick.

-she has been sent to jail in the past for destroying my dads old fan with a hammer

-my left ear and that general side was extremely red from the slaps

-no marks were on her arms

-she has always been like this and I’m just older and stronger so I can actually deal with it, ever since I was about 5 she has always been very physical

-she picks between my sister and I and is very nice to one of us and sh*ts on the other, weird.

-I need help I have no idea how to handle the physical and mental abuse, I’m about over weight and my mom always shames me despite me going to the gym and eating healthy. She always only looks at anything bad I do.

All responses appreciated, I am 14 (male), any advice for how to handle this, and what I could expect if I were to tell a school counselor about the abuse.",05Dec2017,2
