,text,time,score
87,"Just to begin even though english is my first language I suck with punctuation and whatnot. 
My problem is that I say awful things and do awful things without thinking about it. I will say offensive things and jokes and people always get mad at me and ask why I said what I did and to be honest on everything i have no idea why. I will do really annoying things to people and every day i always ask myself why I keep doing the things I do and that I should stop but the very next day I do them once again without even thinking about it. People always say to me, “think before you speak or act” but to be honest it happens before I can control it. It makes me so upset that I have this nonexistent filter and some of the worst things I have ever said are because I just blurted them out. I say something or do something offensive and then after a couple of seconds I realize what I do and I start to panic and apologize frantically. Am I just a bad person or is there something wrong with me?",05Dec2017,2
88,"Warning: sorry if this is long and annoying... I ramble and bottle stuff up so this is just a huge spill.

-

I really dislike my height sometimes. By sometimes, I mean most of the time where it feels like it’s consuming me. Constantly comparing my height to others and thinking about it is what I mean by consuming me...

I’m about 5’1.5 ish and I really really wish I was shorter. I’m already on the shorter side for females. But, I constantly feel like I need to be shorter in order to be a “cute” and “petite” girl. I think talk girls are super beautiful and all, but I feel like I’m just suppose to be short... growing up I was ALWAYS the shortest in my class. Every class I was the shortest there never was a girl shorter then me, and then in middle school everyone was hitting puberty and then reaching there general “max” height, but I keep growing... no longer being the shortest girl and heading on the path to be average height or taller scares me because I never was. It took me so long to finally love and embrace my shortest height structure and now suddenly I’m on the track of growing and it feels like I just wasted all that stress... I know I sound unreasonable since I’m not even super tall, but I’m scared I’ll end up tall as one of my grandparents was around 6’0 and one of my oldest sisters is 5’8...

I also feel like because I’m Chinese, I am suppose to be “short and tiny”. This isn’t true I know, but I feel like I’m suppose to be like this. I love going to china, but whenever I go it’s makes my height issues worse because all of my relatives are either my height or shorter. 

I constantly am obsessing over height. It’s to the point where if I meet someone the first thing I notice is there height and jot down a guess of their height in my head. I’ll compare myself to people based on height and always think “I would be actually cute if I was just shorter by xx much”. It’s so bad that I look up character and famous people’s height to compare myself even if I have no idea who they are...

I just wish I was shorter or at least could stop growing... I know I sound unreasonable and that’s why I hate this issue I have even more because I know it’s unreasonable but I always think like this. It’s sounds a little more dramatic typed out I think, but I’m always thinking about height some days...

-

TL;DR: how do I stop obsessing over my height? 

Height obsessions:
• feel like I would be cuter and more attractive if I was shorter
• sometimes think that I need to be shorter to fulfill a stereotype pushes out for Chinese
• always comparing my height to people and even characters at this point 
• not use to the idea of not being the shortest
• feeling like I’m set on a path to end up tall or taller

I️ don’t even care if these thoughts go awhile all the way, I’m just tired of constantly thinking this way.",05Dec2017,3
89,"The title seems a little broad so here's the deal: I'm a 19- year old male and currently in college.  I'm bored of getting high and playing xbox so I'm looking for possible hobbies I can get into instead of smoking weed because it gets expensive and makes me lazy, any advice at all would be appreciated, thank you!",05Dec2017,2
90,"I am in my 4th year of business school and I applied for the mentorship program at my university. Basically I got paired with a business professional who is the ""mentor"" and I am the ""mentee/protégé"" and we have meetings once a month.

I missed November's meeting because I had a mental breakdown in my professor's office, which involved talking to the associate dean, and then I got sent to a counsellor. There was no way I could have contacted my mentor because I didn't realize what was happening to me... After I calmed down, I followed up with an email apologizing that something unexpected happened and could not make it to the meeting. It's been a few days already and my mentor has yet to reply to me... I later emailed the director of the mentorship at my university and this is what they said to me:

*It is difficult through email to understand “ I was not in a condition to do so”? I would reach out one more time hoping to arrange another meeting and to explain why you were not in a position to cancel the meeting. Not communicating prior and having people go to a meeting place only to not have someone show up has probably damaged the relationship moving forward. You will have to keep trying but accept the consequences if she is unwilling to proceed.*

I don't know who else to ask for help/advice and I'm totally lost on what to do... I understand that I cannot just say ""sorry"" for missing a meeting especially since my mentor made time in her busy work schedule to meet with me. It basically just sounds like I wasted her time for not showing up. I don't want to mention that I've been going through some mental health problems, since I believe that is very personal. I also don't want to use my mental breakdown as an excuse for missing the meeting, but that's what it sounds like and I can't change the fact about that... Please help :(",05Dec2017,2
91,"I (26M) have recently got a job as a general manager of a restaurant. Ive mostly worked BoH and some FoH when needed. The owners chose me with no experience over more ""seasoned"" applicants. Just looking for advice and motivation as i am very nervous even after my first two weeks.",05Dec2017,2
92,"Last July, I tore ligaments in my ankle and I'm still on crutches. All my guy friends graduated and are in NYC or the West Coast. Meanwhile I'm still stuck in our collegetown. 

I'm 22 and still a virgin. I don't want to use Tinder and lose it to someone I barely know. My ankle makes it hard to socialize and meet people like I used to. 

It's really sad but the only guy I see all the time is my physical therapist. I fantasize about him but it'll never happen. For years I've resisted guys' advances but since my injury I've realized life is too short to deprive yourself. But I also want to sleep with a guy I like, and right now I dont have consistent people in my life. 

What should I do? I'm so sexually frustrated. 

",05Dec2017,1
93,"It's really bad...
I have friends, but every time when I'm in a situation with people I don't know 2 things happen, I keep to myself and don't talk at all or if I'm with my buddies ill just stay close to him and say a few words here and there.

I want to drop this bullshit. how am I supposed to do anything like this? all replies are appreciated.",05Dec2017,2
94,"I (17M) a very close friend (17F) who was sexually abused 4 years ago and doesn't want to address it very much. She feels like she would be stressed out and doesn't want to deal with the complications it will bring to her life. She did mention though that she had told a therapist about it and they didn't report it! That sounds INSANE to me. But apparently she wanted to do it in confidence and feels like maybe the therapist thought she had gotten through it (this was like last year).
Anyways I told her I really feel like she should seek legal action with this because then she can get professional help with it once it's out there. As it is now, she can't really get much help.
But I told her I would respect her desire to not do anything about it officially for now and that she could come to me if it ever becomes a problem in any way or she just wants to talk about it.
It just really sucks because it was a family member who is now living with her for an undetermined amount of time. Nothing has happened, but he's just been kind of a jerk. 
I just wanted to get more opinions on what to do about this. If I left something out (which I likely could have) just ask and I will tell you what I know, but I don't know everything. Thanks.

tl;dr - read the title. I decided to respect her decision. wanted another opinion on it.",05Dec2017,2
95,"I’m starting a band with a few friends. We’re Sophomores in high school.
We have an electric guitar player, a bass guitar player, and a drum kit player.
What are some pro tips we can get to start off?",05Dec2017,3
96,"I will be graduating with my BA in Psychology in 2 weeks. I am enrolled to begin classes for a Masters of Education in School Counseling Program in January (3 year program). I have filled out my FASFA, bought my parking pass ($250), scheduled 2 semesters worth of classes- I am all ready to go. 
However, I have been dealing with anxiety/depression for the entirety of my college experience. I am a perfectionist, and that makes college extremely difficult. I used to handle the stress of exams moderately well, as my drive to receive a 100% on them motivated me to study in extreme amounts. This kind of life is not easy to maintain, and naturally, after 4.5 years, I am burnout.

As exam week approaches, my anxiety is in full swing. I do not want to deal with this for another 3 years, but I also don't want to be stuck in a job I am not happy with. It seems as though each time I have been stressed this semester, my thoughts have gone straight to ""I'm not going to grad school"".

What should I do? Should I suck it up and continue on with grad school? Or should I call it quits after my BA?

Notes: If I didn't go to grad school, here are my potential career options:
-Teacher (I could get my license online in under 6 months. My entire family is teachers, so I have an ""in"" in multiple districts)
-Preschool teacher (I currently do this as a part time job)
-Gymnastics coach (I am a former competitive gymnast and I am still extremely passionate about the sport)
",05Dec2017,2
97,"Sorry if this is extremely long I’ve never seeked advice on this Situation to anyone before and would appreciate any feedback
My sister and I do not share the same mother but we do share the same father who I believe is the reason my sisters mother distances herself from my father and I. In the year 2001 I was graced with a little sister  when I was only 5 years of age. I have only one photograph of the two of us which saddens me deeply because we were both very young at the time and comparing then from now, a lot has changed. I remember being told by a relative that when word got out that my father had gotten someone pregnant that he wanted to get rid of the child and that he wasn’t ready for another one, which led me to believe this is where things started to go downhill. Things were rocky but only okay at the start after she was born. We ended up going to the same school together for awhile and she’d walk past me there without even acknowledging who I was which led me to believe that her mother hasn’t been telling her the truth, but at that young of age it’s a very complicated matter to tell to a child. I’ll always remember going into school one day and being told that she had moved out of the town we lived in to somewhere far away and thought to myself will I see her again? Now the years have gone past and I’ve turned 21 this year and she has turned 16 and I don’t know what to do. I believe she’s not been told about me or my father and what we really are to her. Either her mother is waiting awhile to tell her so she can grasp the situation at a better age or that she’s told her and maybe she’s just not bothered? I’m not putting all the blame on her mother as my father is no angel,  the years have been rough to him as a result of it. I’ve recently found her mother on Facebook and it’s been on my mind to message her but I just don’t know what to say, what if she’s not ready for the past to be brought up yet Yano ? I don’t wanna intervene at this time in their life cause it’s some heavy shit really finding out you’ve family members you haven’t seen since you were only a baby, but on the other hand maybe she has told her and they’re waiting for either me or my father to come back into their lives again. Her mother’s parents still live in the town I do and I always think about leaving a letter to give to the mother about how I feel and it’s not right that someone else is being punished for my fathers actions. I came into a bit of money recently and was thinking about leaving some of it in a letter and leave it at her grandparents house with her initials on it for Christmas, they’d surely have a guess who it is. 
So reddit that’s my long story and I hope you’ve read up to this point where you could show me how to deal with this Situation, thank you ✌️",05Dec2017,2
98,"So I went to health services at my university today for an unrelated reason and the nurse practitioner and I got on the topic of birth control because I take the combined pill. 

She told me that women still ovulate on birth control but I've always been told the opposite, even by my OBGYN..

Do you ovulate on birth control pills?",05Dec2017,2
99,"I currently am a freshman at a Top 10 University in the US. Honestly I am having a really great time here; I have a lot of friends and while classes are tough, I am so excited for all the opportunities I can find through the ample resources available to me.

But almost every day I question if I made the right choice attending this school. My parents are paying $65k a year, and I feel so guilty about it. I realize that I am so privileged to have such loving parents that are willing to spend so much money on my education. And I realize that I am so privileged to even have this issue. But I cannot stop thinking about how I had cheaper choices yet chose this school. I cannot stop thinking about how hard my parents/grandparents (immigrants) have worked to earn all that money, and how much of it I’m spending on an education I could have gotten for cheaper elsewhere. I spent two years working at a grocery store in high school for minimum wage, and so I realize how hard it is to make that sort of money. I feel so damn guilty knowing that my parents are spending more on my education than some people can make in a couple decades. I feel like this money could have gone to better causes, and it’s eating away at me constantly. I really like this school but there’s always an urge in the back of my mind to transfer to a cheaper institution. I’m studying computer science, so I have a good feeling I could get a great job out of college with my degree - but at the same time, it could be said that I could find a job with a computer science degree from a much cheaper school. But I also made such great friends here already and I have a feeling I won’t be nearly as happy at another university. I’m so torn and I feel like I may have made the wrong decision, but it also feels like it’s too late now. Any advice would be appreciated",05Dec2017,2
100,"My wife and I live in a 1000sqft apartment (Co-op), on the third floor that we bought outright in May. Our downstairs neighbor is a widowed older women in her 70's that has been really difficult to deal with since we moved in.


Within the first day or two we had been bereted for where we were parking (We just didn't know which spot was ours yet). She compained we were 'walking too loud', our TV was too loud and she could hear everything we did and said. Our TV doesn't sit above 30-40 most days and when its up louder its normally outside the alloted 'quiet time' hours of 10pm-8am.


Initially we would apologise and adjust what we did however the complaints didn't stop and it just seemed like everything we did was wrong. Here are a list of the larger complaints and what we have done to fix them:


* When we would take baths her drain would back up and overflow into her shower. We immediatly stopped taking baths, drained our water slower and allowed a plumber to come in and deal with the issue by ripping out our walls to replace some pipes.
* I Installed a new AC unit for the apartment. This was done all legally and with the correct permits which have been inspected and approved to our local regulations. Aparently since I did that her electrics have been flickering and she is having constant power issues. This is nothing that we directly have caused since our electrics are on a complete separate curcuit (separate meters), and we are having no power issues of our own.
* I drive a large red pickup, and she drives a brand new car. Our parking spot is next to hers and it seems like everytime I pull up she is watching from the window to make sure I don't touch her car with my door. She has complained about finding 'red paint' on her car even though I have never touched her car with my door ever. This caused her to near demand I park somewhere else. 

There is also a laundry list of small menial complaints that I have been told to deal with. This has resulted in some cases near daily banging on our door, screaming from the balcony up at us, and being accosted while trying to leave or just check the mailbox,  with more complaints and issues and we are both entirely done with it.


The reason for making this post is that tonight she banged on the door and my wife went to deal with it. Our neighbor was livid, shouting because her drain was backed up again with no fault of our own, we were just running the bath water. She started screaming at my wife and getting in her face, wouldn't listen to what she had to say, which ultimately ended up with my wife telling her to call the management, that we weren't going to deal with her anymore, and shutting the door in her face.

&amp;nbsp;

**TL;DR - Older downstairs neighbor is making constant complaints about menial things or things we are not the cause of and blaming us constantly for them, to the point where it feels like harrasment, and it is annoying to live here.**

&amp;nbsp;

What can we do? Does this qualify for harassment? 



*edit: Thank you for all the replies. My wife and I have called the management agency about this. They told us to just keep sending her complaints their way and they will deal with it. Its just encouraging to know that we aren't being unreasonable.*",05Dec2017,2
101,Please help text 9709785095,05Dec2017,0
102,I need both but which one should i get?????,05Dec2017,2
105,"I came down with a cold the weekend before starting a new job. Today was my first day. I got through, but it was rough. I have a couple concerns, would appreciate your advice: 
- worried my coworkers are going to be grossed out by me. Even on a subconscious level, this isn't the best first impression. Trying to dab at my nose instead of blow it, but I can't help the coughing much.
- proving myself vs getting better faster. Under different circumstances, I would stay past five, even bring work home (despite being hourly -- I want to seem 'on my game'). But, sleep is vital to getting over this thing. 

I was a temp at the company for 7 mos, and I got great recommendations from my supervisors for this permanent job at the company (I am in a different department than I was in previously). I know the company well, but a lot of the people in this department are new to me. 

It probably goes without saying - I'm taking all the OTC meds. Haven't gone to the doctor because it's only day 2 of this cold (I try not to take antibiotics unless it's very necessary - but maybe in this circumstance, I should get on it??)


Thank you in advance! ",05Dec2017,2
107,"Hello friends! I'm sorry if I missed someone asking a similar question before. Also sorry this is a bit long and sort of rambling.

Here's my situation: I graduated this past spring with a BA in history. I love my hometown of Charleston, SC, where I grew up, went to school, and currently live, and I decided after graduation that I wanted to stay here and try and find a job and make a life. I signed a one year lease for an apartment with two of my friends and basically gave myself a year to figure things out. I had a part time job at a local medical museum for nearly the past two years. It was a temporary job that ended almost two months ago, and though I really enjoyed it I was happy to have the opportunity to explore different things that I could do with my life. I've been doing freelance painting and sewing work since then and looking for other local historical jobs. I love painting and I'm pretty good at it, but I don't think I really have the entrepreneurial drive to make a career out of it. Being away from my old job made me realize that my original goal of having a career in museum work is one I want to pursue, but I think I definitely overestimated the demand for cultural heritage sector employees in Charleston. Our whole touristy Thing is local history, ou can't swing a dead cat without hitting a historic house museum, and yet no one is hiring. Though it's only been a few months into my ""gap year"" of sorts, I've started to come to the conclusion that after my lease expires I'll probably have to leave town to find work. Even if I did find a job before then, my friends are graduating after this year and scattering to parts unknown, so I won't have anyone to split the (shockingly high) rent with.

I'm one of those people that tries to solve all their problems with elaborate excel spreadsheets. I made one in which I assign point values to different desirable qualities in a place I would want to live, and then it adds them up and ranks different cities. I put in basically every place I could think of, and even when I try to rig the scoring against it New York basically always comes out on top. I've been reluctant about the idea of living in NYC because I hate being cold, I get overwhelmed in crowds, none of my friends would be there, and moving so far away seems expensive and a huge hassle. Lack of snow and low cost of living were ranked pretty highly on the spreadsheet, but New York makes up for those things in points with it's public transportation and multiple major museums, among other things. 

The more I've been thinking about it though, the less horrible of an idea it seems. My mom is from Brooklyn and my dad is from Manhassett, and most of my extended family still lives on Staten Island. I spent a lot of time in the city as a child so I at least have some familiarity with the area. I'm really into genealogy, and my family has lived in the city since they immigrated in the 1880s; being the fifth generation to live in New York and seeing where my ancestors lived would be super cool. I could spend more time with my elderly grandparents and my aunt (and her awesome cats). I also don't drive, and that would be totally normal in the city. If I did move, I think I would like to live in Brooklyn. It seems like it would strike a good balance of location, price, and culture that I'm looking for. 

TL;DR: I'm a giant weenie scared about making a huge life change. Will someone please either play devils advocate and poke holes in these plans or assure me that it seems like the right choice?",05Dec2017,2
108,"My best friend's girlfriend and I are good friends but now we're in a fight because I said something that offended her on purpose when I was mad. Now, whenever I try to talk things through with her, she will avoid me and I have put no blame on her even though she is the one that did something rude. Also, my best friend is taking her side but he says that she's being stubborn to me but won't stick up for me with her around. What should I do in this situation? His girlfriend is known for starting drama wherever she goes and not letting things go",05Dec2017,3
109,"I have absolutely no clue if this is the correct place to post this, but I haven’t been able to find anything else that fits the description. So my problem is a mental mind block. Something inside me that makes me unable to focus. It’s not ADHD or anything, as I have never been diagnosed, and doctors say I appear healthy. This “mind block” is most noticeable when I am doing something that requires quick and critical thinking. Like playing games such as Counter Strike Global Offensive, or League Of Legends. Anybody have any suggestions on what I should do help focus more? Thanks in advance ",05Dec2017,3
110,"So yesterday, I missed my chemistry final exam. I’m not worried about passing the class because I was already going to fail it and am going to have to take it again.  Do colleges typically expel students for missing the final?  How will failing by a long shot affect my gpa compared to just barely failing?",05Dec2017,2
