,text,time,score
165,"I have burned so many bridges and fucked myself out of a better career because of my social awkwardness, and now the contacts I do have I have no courage to talk to anymore, so I tend to dissociate a lot, And I hate it

what can I do at this point because small things like them telling me to ""relax"" or ""stop acting like that"" sets me off on a dissociative anxiety attack where im staring at a wall for 45 minutes internally ranting about how worthless I am and that maybe the ones I pissed off are right",05Dec2017,2
166,"Recently I saw an r/askreddit post asking what habits that we usually ignore are red flags, and someone mentioned the neglijation of hygiene is one big sign of depression. Looking back now, I've been doing that for years. I've lost my will to maimtain myself long time ago. Thinking about it, adolescence is the saddest period of my life. I've never been this stressed or sad. I barely even smile now. This disease really scares me, yet I feel like it's nothing I can do.",05Dec2017,2
167,"Hello there,


Recently I was burgled and the Police have been terrible. Also, over the years my partner has had 5-10 phones stolen and it's so frustrating knowing the thieves are getting away with it.


My question is, are there any microchips I can buy that can be securely and discreetly fastened to phones, sat navs etc that if stolen could be traced?


Thank you",05Dec2017,2
169,"So let's call him Dude. So Dude and I are really similar, like long lost twins similar. There are a few special moments between us where we laughed really hard, and that one time where he stared at me for ages. I also catch him staring at me and looking away really quickly, and he showed me baby photos of him once. Dude also tells me some important personal secrets, like who he hates and why, and that his dad doesn't get payed a lot (My mum and his dad both work as construction workers.). There is also this one time where we made a small bet, and he teased me about it because I lost, which led me to slapping him very lightly. He was laughing really hard.

So Dude found out I like him. I panic, because when my previous crushes found out I like them they avoided me like the plague. But Dude didn't. Dude actually stayed the same. He just acts a little shy now. He also looks at me and looks away quickly from time to time. All my friends think there's a 50/50 chance because he also has eyes on another girl - let's call her Dudette.

What does this mean? I'm really confused!",05Dec2017,2
170,So i have found out that my ex girlfriend from a few years ago has come upon some hard times a good friend of hers killed themself and has put my ex in a hard situation to my understanding. Her and i arent on talking terms and havent had a conversation in almost 3 years now. I have her blocked on facebook and have ignored the occasional message over the years. However ever since i found out what has happened i just cant handle it im losing sleep over it im so scared that she will hurt herself. Its all becoming too much for me just not saying anything. I dont feel as though me contacting her will do any help as i dunno where she stands with me but i just have to do something. i  know my girlfriend will not understand the situation. I just want to know shes ok and i cant bare not doing anything any longer and i dont know how to even bring up the situation with my girlfriend.,05Dec2017,2
171,"Long story short, my friend T has had bad vision for the 6+ years that I have known him. He’s an amazing friend of mine, I love this guy, he’s like my brother almost. But over these years, his vision has been getting much worse, and doctors have told him that his eyesight is just gonna keep getting worse with the more time that passes. Him and I have bonded very closely over video games more than anything. That’s all we do, that’s all he does. Video games are our lives. But with his deteriorating eyes, he soon won’t be able to do any of that. He won’t be able to play his games, watch movies, or even see his own mothers face. And I breaks my goddamn heart that this is happening to him.  I want to be able to help him through the experience of having no ability to see things anymore. But I don’t know what to do. I’m utterly clueless as to the first thing to do when it comes to helping him.

Is there anything that I could possibly do to help make sure he still has an enjoyable life? I’m absolutely scared to death that he might just give up when it happens and he can’t see for the rest of his life. I don’t want him to give up. I need help. I’m lost and worried for him.",05Dec2017,13
172,"So as I have said in a previous post December 3rd was the anniversary of my mum dying. 
Every year till now theres been a lot of messages of well wishes and support etc, but this year only 3 people seemed to remember. My GF, my best mate who was with me when I found her, and a friend of my mums from donkeys years ago.

I know everyone has their own lives but I didn't even get a message from my brother or his partner or my sister (sister different mum but even so.) 

My house mate never said a word and I just feel ive found out it takes seven years for people to forget.

I'm trying not to be angry with people over it because I know its very selfish, just feel a little abandoned and more concerning I feel like people have forgotten mum who was there for a lot of them.",05Dec2017,2
174,"Google Timeline showed my phone staying in the same car and driving erratically around London for 6 hours after I was dropped off, until my phone was taken out the car and into a block of flats at 6am. 
Could I be wrong and it isn't with the driver?
Is there a way to get Uber to share the trips he made following dropping me off? I could the compare his destinations with the destinations my phone traveled that evening, and surely that would prove or disprove whether he has it or not. Thanks in advance",05Dec2017,2
175,"Every morning my friend pulls up next to my house to pick me up for school. It's usually around 6:30am so it's still pretty dark out. 

This morning, two of my neighbors were walking their dog while my friend was pulling up. The one lady had a bright pink jacket on, so my friend could clearly see her and made sure not too get close to her. On the other hand, when she was pulling in, the man, of whom was wearing a fully black outfit, was walking in front of the car and was VERY CLOSE to have gotten hit by my friend's car, though was not. 

My friend said it was very hard to see the man because of how dark it was outside and the man's clothing. He was very startled and looked mad. I got in the car and my friend was terrified/scared. We drove off and the man started walking up to the car looking enraged/very mad and pointing at our car, as if he wanted to scream at us. We kept driving and didn't stop.

He was not hit, but was very close to. 

My friend was crying in the car, scared that he'll take some legal action. Is this possible or are we just overthinking the situation? 

Please help.",05Dec2017,1
176,"I'm 25 and I've been working at a start-up for just over three years. I don't want to go into too much detail (because I'd really rather keep this anonymous) but it's my absolute dream job - it's niche, I'm passionate about it, I get to travel a lot and I love everyone who works here. 

The only problem: I work right next to my ex-girlfriend. At the beginning of 2016, about a year after I started, we began sleeping together. We were pretty serious for about six months, sneaking around and making sure no one else at the office knew what was up. (Disclaimer: I'm pretty sure everyone knew.) 

Anyway, fast-forward to now. We broke up under pretty messy conditions and have been stuck in the absolute-fucking-worst cycle since. For the past year and a half, we'll follow this pattern:

* Phase one: We've broken up. Both of us do our best to snap out of any affectionate habits and act like normal colleagues. 

* Phase two: This is the shittiest one. One of us will start dating someone else. This is usually followed by a lot of passive aggressiveness from the other one, maybe a bit of drunken shouting. 

* Phase three: Somehow, someway, we make it through phase two alive. We're on good terms, we're chatty, back to being normal pals. 

* Phase four: We're such good pals that we go for a drink. One thing leads to another and we wind up back at the beginning until one of us decides to call it again. 

This has happened again and again, to the point where I feel like it's stopping us from living our lives. I think we're both obsessed with (maybe a bit in love with) each other, but it's making us completely miserable. 

The best thing would be no contact for a long, long time but we both love our job. What do I do?",05Dec2017,2
177,"I've been staying with my 94 year old grandfather this week. He and his wife are on the rocks. I've noticed he seems happiest right before sleep. He's never tried any drugs other than alcohol, and always follows the letter of the law, as a former judge. But I fear he'll leave this world without ever taking a step outside to appreciate it. I think he must fear death, having seen so many of his friends die, and knowing that he's quite possibly next. Maybe he's sad to leave, to not see his grandchildren grow up. 

I want him to see the other side. DMT has a way to give answers, as a form of communication with an almost alien consciousness. An introduction to a sort of meta reality. I think he'd have great epiphanies, and may even look forward to, or welcome death. He might reflect on his life, and die a happy man, knowing that he's lived well, and excited for the next phase of the journey. 

Do you think I should broach the subject with him? I've raised the topic of drug law reform earlier this week. I asked what he thought of giving heroin to addicts, and he stayed silent, considering. So I know his mind is completely open to reason. But he's also extremely stubborn and principled in his ways, and I really don't know if he's ever even had a chance to properly consider the farcical nature of reality. That none of us had any say in our existence or know a damn thing about what it even is. He's not really a spiritual man in that sense. Although I don't know. Maybe the answer is to just have a spiritual discussion with him, and ask him outright what he thinks? I want him to be happy, I want him to look forward to the next life, to the next mystery. He's a rationalist, an athiest, a very funny and wise man with a prodigious memory. I just want to make his experience on earth a better one. Anyone have any thoughts or experience on this subject they'd like to share?",05Dec2017,2
178,"So to clarify.
I have never been interested in school or studying and been more of a do what you enjoy and so on. Gone to school because of the social pressure and pressure from my father. (currently in 11th grade) 
I have been working as a chef since summer and i really like cooking and making people happy through that. Lately i have been feeling really like if i quit school and went after my dream (studying different food cultures abroad and opening a restaurants while being the head chef).
So in conclusion i want to abandon my current school and chase after my dream by enrolling into a culinary school and then working abroad... Any Thoughts?
",05Dec2017,2
179,"I'm currently a third-year Computer Science major at university. I started out my first year as a bright-eyed student looking to be the BEST computer scientist in the world (genuinely shooting for the moon here).

However, at the end of my second year, (while I was doing pretty well w/ a 3.96 GPA) I realized that I did NOT want to be a code monkey for the rest of my life. With this realization, I started reading and exploring until I realized that I wanted to become mega-rich by starting my own business.

With this realization, going into my third year, I notice that I'm not putting NEARLY as much effort into school (because it's not what I want) and my grades have been suffering. I don't even really want my CS degree. I'd much rather go out into the real world get my hands dirty with a business of my own.

Many people around me have been saying that I should take the extra 2 years to finish up my degree before trying anything, but I dread the thought wasting so much time on something I'd rather not do.

In conclusion, I'm thinking of taking a gap year because that's essentially dropping out without dropping the credits I've earned. This way I can venture out to attempt at a business (with the pressure of time). What do you all think?

TL;DR I don't want to finish up my CS degree, I'd rather take a gap year (that way I can come back to uni if I must) to try starting my own business. Thoughts?",05Dec2017,2
180,"I’ve only been here a few months. It’s a screen printing place where we make crappy shirts for family reunions, small businesses, 5k runs and things like that. 

The job I had applied for was either a press operator (one running the machine that prints the shirts) or a quality inspector. But when I showed up my first day they changed their mind and made me the person who coats and “burns” the screens. 

If you know nothing about screen printing, all you have to know is that I do everything with a certain thing before passing it off to the press operators to print with. And it’s miserable. 

People are constantly demanding things from you. Work piles up for me faster than I am able to finish it at times. And other times I finish everything I’ll have the entire day within and hour and struggle the rest of the day finding stuff to keep me busy. 

Furthermore if you stay overtime and try to get a head start, it doesn’t help. It doesn’t matter if I finish a job 3 days or 3 minutes before the printers actually need it. Something I finish today may not be needed tomorrow, this week, or even next week. You work your ass off but make no progress. 

Within the few months here, I’ve received a dollar raise just for working so much overtime. So they apparently think I’m worth something. So should I try to just leave this job or ask for a different position. At the point I’m not as worried about pay as I am having a job that feels fulfilling. 

",05Dec2017,2
181,"**EDIT* 14/14 shift schedule or 9 to 5?** 

I'd love some feedback from the community. Deciding between two jobs of comparable compensation and benefits.

14 days on would be away from home, sleeping on-site. 9-5 would be home everynight but commuting twice a day.

I am single with no kids at the moment.",05Dec2017,2
183,"So I haven't been too happy lately and feel like I could benefit from talking to someone, but I don't think I can feasibly afford therapy if I'm working entry level and haven't moved out of my parents yet because of money. 

Even if I could afford it, I work ~10 hours a day and it takes ~90 minutes to commute home, so obviously no professional would be working by the time I'm out. How do other people manage this?",05Dec2017,2
184,"hey everyone,
so I have a selection of medical problems which makes employment almost impossible.
as a result I am on PIP and ESA (disability money) and my other half family hate me for it.
from what i can understand it is because they don't think I am disabled but just faking because I am lazy which is disgusting.

i have problems with depression anxiety asthma ibs and with the discs in my spine wearing away and some crushing the nerve root on my back.

when we go out they actually wait for me to leave the table before taking family photos.
one of them doesnt want me in his house and the other doesnt talk to me

the one who doesn't want me in his house has 2 daughters and the other day one came up to me and said.

every oppurtunity behind my back they insult me but to my face are friendly.

im at my wits end with these people and lets keep in mind the 3rd sister was cheated on but hey ho if he comes back they will all welcome him with open arms.

my depression and anxiety is at an all time high and i don't know what to do.

what do you think 
",05Dec2017,16
185,"GFs father recently bought a new house where he finished the basement for rental. He preferred family or someone he could trust and offered me the place. Discomfort started as soon as I moved in. Within 20 minutes of me arriving to the house he is downstairs trying to make small talk or just walking through the basement as he built a small storage closet for his things. He constructed a full sized separate entrance into the basement which has a small hallway. His storage closet is in this hallway an my “apartment” is separated from it by a door. I don’t see the reason for him to walk through my apartment to get to his things. The other door goes upstairs into his kitchen which he left the lock for on his side. He could go outside and down the basement entrance to get his things an not disturb me, but doesn’t. I have been living here for about a month now and he still has frozen meat in the basement fridge, which he said he would remove as it is for my use. On numerous times, he has walked downstairs while I’m in the shower and proceeds to knock on the shower door to confirm it is me in there showering, which is kind of annoying. On the rare days he doesn’t come downstairs, I can hear them open their basement door and listen, as to confirm I’m downstairs. What got me really upset was when my GF, his daughter, came over one day and stayed the night. He called her the next day not knowing I was with her and told her she could not spend the night over with me and she must respect his views on religion and marriage, and his house. It is funny because he lives with his new (unmarried) GF and they have 2 kids. Now my GF took great offense to that and does not even want to hang out at my place, because she has to always be reporting in upstairs. I try to spend as much time out of the apartment, and usually hang out at my GFs mothers house which she lives with. My GFs mother is a sweetheart, and I have I have stayed over in her house and shared a bed with my GF and she does not mind. We shared the confrontation between my GF and her dad with my GFs mother to see what she thought about it. She feels he needs to be more realistic being that we are almost 30YO and we are not in the 18th century anymore. She has offered me a spare room in her house but I do not know if this is the right thing to do. I have been grateful for this family taking me in, in a sense, and the only reason I took any of their offers is to save money to hopefully buy a home come spring time. Not sure what to do. Am I overreacting about all the lack of privacy? Not sure if taking the spare room is the right thing to do, I feel i am in peoples way and maybe I should just get my own place at the expense of not saving much and getting a home in a couple years. Or maybe I should just deal with the lack of privacy and just pay rent for storage basically and spend as much time out of the apartment. ",05Dec2017,2
186,"So I was offered a job welding for 17.00 an hour. I was suppose to get more but I didnt do so hot on the test because of my nerves. 

Full time. And overtime. 12 paid holidays off and 401k. Drive to work is 25 min. And is about $7.00 more than what i make now on the hour.

Youd think “Why arent you jumping on that!?!”

Well the building doesnt have any built in ventilation system. All it has is garage doors that open up during the day.

Im more worried about the health risks of welding in a not so good ventilated area.

Advice?",05Dec2017,1
187,"This guy is just really hard to read. Or maybe I'm blind. We chat just about everyday, but theres always been quite a lengthy silence between responses, maybe a day sometimes. But he does start up conversations if i stop texting. Anyway, we finally met up about a week ago, and I think I'm being ultra paranoid because its stayed the same. We kissed and made out. A part of me feels maybe he didn't like my body or something like that... Also i noticed he commented a few flirty things on a certain girl's instagram in October and again in November (before we met up but we had been chatting since September)... But he's been flirty with me so, I shouldn't see it as he's not interested right? Because hey, he's single so he's allowed to do that.. It just stung like a bitch to see that. He has said that ""he would totally be with me"" and I wonder if there's anyway I can be like ""what the hell is going on dude?"" without having the ""what are we"" talk because we aren't anything yet. Hes just hard to approach and basically I just want to know if he's still interested in seeing me or not, without sounding like i'm taking this all too seriously (which i am lol!). He doesn't text much, I think he'd be much more receptive on the phone but he's pretty busy, I'm not keen on springing a call on him. Ahhhh frustration!!!! No lie, I'd be shattered if I didnt hear what I wanted :( but I can't keep wondering",05Dec2017,2
188,"The title covers it pretty well, but I want to make sure the whole situation is understood.  After finally finishing school with two bachelor's degrees, one in business, one in a foreign language, and a masters degree in the same foreign language, I am 25 and about 2 months ago started my new job.  It is a work from home position in sales.  I had plans to move to a new city in the next few months.  

Well, I honestly have a lot of trouble performing my expected duties and have increasing anxiety thinking about how I am not performing the job up to the expectations of my employer.  I am not happy about it, but am also having trouble changing anything.  I do not want to quit, because I am terrified of disappointing my parents and being 25, unemployed, and living at home after a failed attempt at starting my first job.  

I really believe that this is not the right career for me, but I do not know what to do.  I don't want to leave the job so soon, but do not know how much longer I can last.  ",05Dec2017,2
190,Okay so how exactly would you guys dress to an interview at Walmart? I'm aware this probably sounds like a dumb question but I've never actually had an official interview. Interview is actually at 10 and if theres anything you bois might advise me to do or say that will increase my likelihood of getting the job that would be cool.,05Dec2017,5
191,"So my little brother is studying aboard, I really think he's extremely depressed to the point that he can't focus. He forgets his stuff all the time, his phone, his wallet, his ID in public places like the bus or the university and it happens more than once a week I know it's not normal to forget these important stuff or leave them behind.  His very best friend here at our country was diagnosed with a really serious condition that will affect and change his life forever and I think this is really affecting my brother strongly, add to that university pressure and being alone in a foreign land..  He told me he went to doctors but they all thought he wants bills to focus in his study!!!  He's a very brilliant young man, and I'm really sad I can't help him, any advices please?!",05Dec2017,5
192,"So I live with my parents and my boyfriend [18] Also lives with us. Ive know him for over 8 years and have always been close but my mother is making things hard for everyone. My mom is the type of person who believes everything has to be about her and if not she gets a fit.  Now ever since my boyfriend started to live with us my mom has become a not so nice person. She will yell at more because I haven't done her laundry  (I normally do all the laundry on sunday) and by Tuesday it's filled back up with loads of clothes. If I haven't cleaned the bathroom she yells at me again. She complains that my boyfriend doesnt do anything whwn he will hwlp me clean or do laundry. She complains he stays in our bedroom all day, but when he does come out our dog tries to bite him and my mom doesn't do anything or he is out in the living room with her and she doesn't acknowledge him at all so he would rather be in the bedroom were he can do something without worrying about her or the dog. My mother coupons because she can't legally work anymore and has yard sales on  Saturday and always wants my boyfriend and I to help her at 5 in the morning to set up. Granted we have to be up a few hours later for work, it gets very tiring. My dad goes to work and when he comes home he does nothing but sit on his butt for the rest of the day. He doesn't clean up after himself and mom doesn't say anything to him. She doesn't help clean up,she doesn't do her own laundry, and all she does is sit confront of a computer. My dad is a lazy person who thinks that just because he works from 6am to 330pm he has a right to do nothing. Now I'm a full time college student with a part time job. I stay up until 2 in the morning doing work and studying but I get yelled at constantly because my mother believes that I'm her slave and haven't done anything. My boyfriend works full time and he is starting college in january. All the stuff my mother is now doing has put strain on our relationship( mother-daughter) and my relationship with my boyfriend. I've tried talking to her but everything I say seems to go in one ear and out the other. What should I do.",05Dec2017,3
