,text,time,score
28,"6 months ago I was able to come off antidepressants, it was a two year journey to where I am today. For the last few months everything has been going great, I thought myself out of the dark Valley but here I am again. 

Over the last three days I've been feeling rotten. No joy, unable to accept affection and just angry all the time. I would lash out in anger at everyone around me, until my wife realized what was going on and found someone to help, and that was when I learned it was depression.

Work has been the same a usual, and I have actually been enjoying it more lately, but when I'm home I'm just down, and angry, but things at home have been better than usual, with my son back in school and my wife having finished her training and started working again.

The only thing that seems to bring me level is my daughter, but that is probably oxytocin from her love of cuddles and hugs. 

I don't know what I need but I'm trying to reach for help before I start lashing out again.",31Oct2020,1
29,"

[View Poll](https://www.reddit.com/poll/jll57m)",31Oct2020,1
30,My daughter (16) wants to kill herself. I love her. Her father loves her. She has never been abused. I don’t know her pain. What do I say to convince her to live?,31Oct2020,1
31,"At my old school I was one of the most popular kids because i was funny. Everyone liked me but no one would hang out with me aside from a few good friends, now I just play Xbox with them and maybe hang once a month. All the others are still seeing each other and they include some of my good friends too. I’ve asked many of the kids at school to hangout but they refuse to. They make excuses or whatever, I know they just don’t want to but idk why. Whenever I do see people hanging out it’s either 2 or 3 people or a large group of people. I know why I do not get invited and it is because whenever they  hangout especially the big groups either it’s one gender or they only invite their crushes. That’s it and I’m ugly and chubby. I hate it even my bsf can’t convince them to invite me (I’ve asked him once or twice) so I’m basically screwed. I am still good friends with them and I think they still like me but at this point I do not know. Please give a bit of advice",31Oct2020,1
32,2 years ago i was shot and ejected from a car. Its messed me up oretty badly mentally and physically. I cant seem to move past it. There were 3 of us in this car. All of us got ejected.. we all survived. But the ine person who im stoll close with after we went through this just told me to get lost and that i bring him down constantly talking about it. I just wanted a support system.. why does this stuff happen....?,31Oct2020,1
33,"So this is my first time posting on this sub. I'm having an extra shitty day today. Been 24 hours and tears have been constant. I can't seem to open up to anyone but since no one knows about thid account of mine, I'm okay sharing how I feel. 

I really just need some uplifting thoughts and comments. Or anything good that happened for you today. Anything wholesome. Literally anything positive before I lose my mind.",31Oct2020,1
34,"2020 been a rough year for a lot of reasons, and because of the events that have unfolded a lot of people have been suffering with bad mental health as a cause of it.

Here are the Tips: [10 Tips to Maintain Good Mental Health During the Pandemic](https://mix.com/!W3rWBYiK:10-tips-on-maintaining-good-mental-health-during-the-pandemic-%C2%BB-arcane-lost_?utm_source=copy&amp;utm_medium=web&amp;utm_campaign=article_profile&amp;utm_term=button)",31Oct2020,1
35,"Still going
I challenge y'all to do it with me

I'm proud that you went to therapy today. Even if you still don't know how you're going to go to school again, that's ok. It's not your fault that you feel helpless. There's nothing wrong with you that you don't know what to do. It's ok.",31Oct2020,1
36,"latelyi havent been feeling like mytself you know. ive had soome stuff going on. but today i managed to brush my teeth, eat and to take a bath and i feel really good about myself that i managed to do that. it feels like thats step one for me you know",31Oct2020,1
40,"Whenever I feel overwhelmed I really only have reddit to go to. I’m not surrounded with the most understanding or supportive people. And I don’t feel like I have any close friends I can talk about this to. I guess for a long, long time things have been unbearably hard. I genuinely can’t remember the last time I have gone to bed with a clear mind and weightless chest. It’s hard to even fall asleep. It’s even harder being awake. I live in a very stressful environment at home, abusive father and all that. And where I’m from, I can’t do anything about it. Anyone I’ve ever told this to doesn’t really.. understand. They don’t think it’s that serious. So really... every time I try to open up it only makes me feel even more alone and alienated, it’s all a cycle that I cannot outrun. I’m too scared to have hope for the future, because what if every hope I have shatters again? I just want these days to end quick. I want to at least be able to rest and eat and breathe. I want to feel somewhat safe. I don’t mind not being happy, I just want to live peacefully.",31Oct2020,1
41,"-Today’s the first day I’ve brushed my teeth in weeks
-Can’t remember the last time I showered, I smell like death
-I’m up 250 pounds
-My face is riddled in acne and even more acne scars
-I don’t remember drinking water at all this year, my hands mindlessly grab soda or juice boxes
-The healthiest thing I’ve eaten this week was a strawberry smoothie, which was followed by two burritos, a burger, and pepsi 

Please anyone just help me find motivation to take care of myself. I don’t have the energy to do anything. My mind tells me that this body isn’t worth taking care of, and that bottle of water should go to someone more worthy. 

I want to set a better example to my little sister. I want her to be healthy and take care of her body. I want her to be happy; the opposite of me. 

I don’t know what to do or where to start. Again, if someone can help me find motivation, I’ll be so appreciative. 

Thanks all.",31Oct2020,1
