,text,time,score
0,"Background (can be skipped) I feel I have always struggled with depression but after my father was killed by a drunk driver, it became severe. Within a few months of his passing I got a divorce from my abusive partner and was living alone with no one visiting or talking very much to me at all.

I remember feeling like I was dying from the inside out emotionally and feeling like a zombie day in and day out while everything tasted bland too. I was unsure where to focus my thoughts on to escape the memories of the night I received that call. In fact I was unsure about everything, myself, my life, my future, my desires, or if I would ever feel what it felt to be ""happy"" again even for a moment.

One night I was on the floor, fatigued, just browsing the internet searching depression and hoping some website would have something ""more"" for me, not just the definition of depression. I was desperately looking for something that would ease my thoughts even for a fleeting moment, I was just so worn out and wanted to feel something else.

(backstory complete)

Well during those very low moments where I searched the internet for help I came up empty. What I found was pages of depression definitions and suicide hotline ads but what I was looking little things to help me along this difficult journey through depression, anything! I was depressed and desperate. Yes, I knew I needed therapy but was still struggling on accepting his death, it was so sudden that it didn't feel like he was gone so I couldn't speak about it but ended up going later on down the line. 

Once my heart started I went on a search to look for things that can help me with all my individual struggles that came from depression. 

&amp;#x200B;

* I found that pet therapy helped me significantly, more than I could explain in a few sentences
* Youtube meditation videos did not help me but oddly enough those deep sleep hypnosis videos put me to sleep like a baby FINALLY despite me not even having an interest or belief in hypnotherapy. Those videos made me focus myself in random beautiful places and it worked with my anxiety, depression, and grief.
* I would struggled with insomnia, had a hard time going to sleep, and woke up throughout the night. I found that a natural tea helped me fall sleep on my bad days then the youtube deep sleep video helped me go back to bed everytime I woke up
* Podcasts help me while I was working to keep my focused when my mind wanted to sink or if I was about to cry
* Taking advise I thought was stupid ended up working like waking up and going to a mirror (yes I felt silly) and telling myself ""I love you and It's okay"" I realized even I struggled to tell myself that but that's all I wanted to hear from someone. It was a healing process to hear it from myself
* Buying myself a nice outfit made me feel good for a moment and helped me talk a look at other things I wanted to jazz up like my hair or bathroom

Things like these! That is what I was looking for, small things to help along the way. It's a lot of work to get through depression but I truly appreciate having these tricks to rely on or cycle through

&amp;#x200B;

As I am farther along in my journey I have become inspired to create a website where it's just full of these tips, resources, books, or whatever misc things have brought sunshine in other peoples world. It took a while find small things that worked for me.

I hope to have enough options on the website for that one person browsing the internet searching for that ""one thing"" that will ease their mind and heart for just one moment 

&amp;#x200B;

(Your help comes in) What is your input? Also, what are some things that have or continue to help you with your depression?

&amp;#x200B;

&amp;#x200B;

Thanks, sorry for the typos as well :)",31Oct2020,1
1,"Since September last year it has felt like my world is completely collapsing in on itself, Dad diagnosed with stage 4 cancer, dropped out of university to be closer, multiple health concerns, had to start seeking help again for PTSD, waited months to be referred and I've been referred to CBT for depression as I am too depressed to work through PTSD.

My depression has been getting worse and worse, often thinking about hurting myself and how pointless my life is now my Dad is going to die sooner than expected, living is painful and Ive been struggling to keep my mood regulated and its taking a toll on the people around me. I've found myself snapping about every little detail and being incredibly rude and short with my partner. It makes me feel horrible and more depressed. 

What can I do to help being overwhelmed and losing my patience with people I'm close to? What can I do in the meantime while I wait for some CBT? What can I do to not be such an asshole to the people I love? I feel like I have no love for myself and I am turning into a monster",31Oct2020,1
2,"I have a D in math.

We’re a little more than halfway through the semester and I’m a sophomore taking 3 weighted classes. I have had 2 tests in AP Calc so far and failed both. I have never ended with a B before, forget a D. Now it would be a dream come true to end with a B. Even though all my other grades are A’s and one high B, all I can think about are different ways to kill my self. I know this sounds dramatic, but you have no idea of the pressure I’m facing in one of the top 100 high schools of America with Indian parents who think depression is a pathetic joke. I know they love me, but they just don’t get it. Every time I feel happy, I remember the position I’m in and just feel nauseous. The only thoughts I have before I fall asleep are thoughts of my future, and whether I will have one. I used to be a popular guy, now I don’t even know some of my best friends because we haven’t been in touch for 7 months. I can’t game either which used to bring me joy because my parents just want me to focus on school. Online school is just so fucking tiring. Sorry this is so long, but who am I apologizing to, no ones gonna read this",31Oct2020,1
3,"Girlfriend (2 years) just got admitted to a mental health hospital a few days ago (21, F, long history of depression with additional medical issues yet to be diagnosed). What I know so far for sure is that I can leave messages and she can call during her ""free time"". I doubt that they allow them to call people outside of the clinic frequently. Anything that I can do to help make her stay just a bit more bearable? Anything that I can add to those messages (if they get to her) that she would appreciate and I would be missing? Are they even allowed any info on the outside world for their tenure there?",31Oct2020,1
4,"Today coworkers were talking about their future. In my line of work, (health care) people are constantly leveling up into other roles. I can't relate to this. 
   When people talk about their future plans i simply can't see past 32 (i'm 31) 
  My idea of a hopeful future involves being killed in a freak accident ideally within the next 18 months.",31Oct2020,1
5,"So in my 24 years I didnt have a friend, or any stable relationship. All my jobs I got written up at, I hate family, I hate everything about me. I doubt this post will be seen by anyone. I was promised so many things by the end of 2020 and not 1 of those “promises” happened. Everyone is moving and I’m at a stand still. I wanna see the end already, it’s not fair that I’m suffering. I’m so fricken bipolar that I  can’t stand it anymoreI HATE MYSLEF SO MUCH FOR EVERYTHING I HAVE EVER LET MY DUMB 🍑 DO!!
I can’t ever be happy, no matter how much I try to be happy I’m never happy. There’s nothing good on my past, there’s nothing to look forward to, there’s nothing to live for.",31Oct2020,1
6,"I just want to die, I don’t feel good enough anymore, I have no real friends they are all fake, nothing that I have materialistic makes me happy my family relationships sucks, I just can’t I try so hard to stay motivated in daily life but I can’t, everything is losing meaning and in all seriousness I don’t want to do this anymore. I’ve felt like this since middle school and I’ve always toughen it out because “it’s gonna get better” and no matter how “better” my life seem to people on the outside I just can’t find any meaning within myself. I tried killing myself today and I couldn’t even push myself to do it. I want to die so bad, I hate myself in every way possible, I can’t stand myself no matter how much I try and I can see why I have no friends I wouldn’t want to be near me if I was another person. Please please please can I get hit by a car tomorrow morning or something because no matter how hard I try I am to much of a coward to end it. I want to go to sleep and never wake up I feel so tired in a way I’ve never been before tired in a way sleep can’t fix. I wish I had a better life I wish I could make actual friends, I wish I could love myself but no matter how hard I try I can’t. I have no motivation to do anything anymore... Jesus this is turning into a rant.",31Oct2020,1
7,No matter how much you cry or hurt someone will love you. No matter the wrong you've done you'll be forgiven. No matter who you are you have meaning you have purpose,31Oct2020,1
10,"My ex made me feel worthless. Cheated on me. Hid me from everyone. Never gave me any validation. She Destroyed my self esteem. 
Idk... I just wanted to feel loved. Yeah I know I know, it’s cheesy whatever hah. 

I think I’m a hypochondriac, im 20 and I’m terrified of covid... Healthy too. Hah I can’t explain it. I don’t see any of my friends anymore. I just am by myself (not counting immediate family) every day. 

I mean honestly... I sometimes think I probably would have probably killed myself by now if it wasn’t for my family.. mainly my mom. But still. I just feel so alone. Now more than ever.

I’m a downer, I know",31Oct2020,1
11,"I am not sure how this all works. I recently was diagnosed with depression. I don't know the words to describe exactly how I feel but it almost feels like nothing. I have never experienced not being able to get up or shower. I have never lost passion for things that I truly loved. I feel alone more than I should. My friends and boyfriend don't live near me. This season of life sucks. I am seeing a counselor but I don't know the words to say so it is a lot of silence. I lost my job last week because of how my depression was affecting me, but I don't have the courage to tell anyone the truth. I am embarrassed by this awful illness, and I don't even know how to talk about it. I check in on those around me but none of them do the same for me. I give so much, but get so little. I feel like complaining about that makes me selfish. I am trying to keep my head up and find the things that give me glimpses of hope. I asked four people to safely hang out with me tonight and all four of them said no. I feel like I'm not valued or wanted in any friendships. I wish I had people who lifted me up and encouraged me. I'm stuck by myself in my room. Right now I am sitting in my room typing this post with full knowledge that there's a chance no one will see this. I don't even know what I'm expecting. A friend or advice maybe? I just want to cry in the bathtub for the night. If anyone manages to read this all the way, I am sorry for my rambling.",31Oct2020,1
13,"I'm worried this might violate the subreddit content, if so I apologize.

I  was wondering if anyone would appreciate a blog that help job seekers  with mental illness find work opportunities that accommodate their  particular difficulties.

I have an  opportunity to write creatively as part of my current role and wanted  to do something close to my heart and meaningful to the community.",31Oct2020,1
14,"Hello everyone,


I (24F) have been suffering from depression since I was 12. I’ve had a good hold on it since I was about 16 but ever since last year I’ve been having more trouble. I went to the doctor and got back on medication, although it was a different one than the last round since I couldn’t remember what I was taking before. A few months ago I went back to the doctor because I’ve gotten worse, I have been having a difficult time getting up to go to work. She put me on a new medication to take with my old one, this resulted in me being so exhausted I would sleep for 12+ hours and still be exhausted, I was confused, dizzy and having trouble forming words and thoughts. Before this I took a part time position at my work instead of being a casual employee. They knew about my Mental health problems before putting me into the part time position. Needless to say I was having some trouble coming in and I followed the directions on my management and opened a file with our workplace health dept. for advise and help. I got medical forms for my doctor to fill out (this costs $85, which since I’ve been having trouble going to work I don’t have the extra money for this expense, it also took them over a month to send me said forms) and then it took them MONTHS to get back to me after I had them filled out only for them to tell me they are closing my file because I’m in treatment already (medication and therapy) before I even got a response to my medical forms being filled out my manager terminated me from my part time position (after not following the proper procedure, the union also failed me here so I am filing a grievance and considering contacting the human rights tribunal) This ended up leaving me MORE stressed and MORE depressed as I am still having the same issues and now my manager is wanting me to get doctors notes for missing work (since my case with workplace health is closed, she has emailed me to “check in” even though she hasn’t contacted me once since this all started) even though I JUST had this form filled out that says I suffer from panic attacks and Major Depressive Disorder. I literally do not know what to do. I’ve spoken to my doctor and she just wants to try another different medication but I literally cannot go to work right now. It’s not that I don’t want to go to work, it’s that I can’t. I’m debating going to the hospital but I’m afraid they will just turn me away because it’s mental health. I feel so lost and hopeless. It might be better if I just disappear. I have no money (I don’t even have my half of rent, $750 and I’ve already asked everyone I could to borrow) I have no food. I worked so hard to get my career and now I’m throwing it all away because of my stupid brain. 

Sorry for the long backstory, has anyone been to be hospital for mental health? What was your experience? We’re you taken seriously and admitted or did they just wave you away and say to follow up with your GP/family doctor?",31Oct2020,1
15,"Requesting advice from mainly women, but anyone really I guess: I was hospitalized for depression about 5-6 years ago for about 10 days. I remember I could bring my own underwear, but I was told not to let them do my laundry or it would get stolen, and I remember they let my family bring me paper back books, but I don’t remember anything else. Is there a rule about bras that have wires? Can I bring anything else like hair ties, shampoo, or an iPod for music? Sometimes I get anxious when I’m with company and listening to music helps.",31Oct2020,1
16,"So my problem is rather weird, I feel depressed and suicidal because i dont have a lover. Since teenage i have not been close to my dad and mom (not their fault, i come from a strict closed minded culture) and i am a single child with no siblings and that's why i have always looked for external emotional bond, and having someone emotionally close heals me like magic, without it i am suicidal and depressed, i had a breakup 3 months ago and it has left me devastated, now being emotionally alone, i am broken.. i overeat junk food, depressed, suicidal, cant function properly. I dont know what to do.....",31Oct2020,1
18,"She always thought she was a failure. She knows what she wants like taking vet tech courses online. Because she doesn't have it in her to get there. She makes her plans for doing vet stuff etc... But there are moments where she thinks ""what's the point"" she just always tend to get f@cked over. So she gives up. She thinks she can not do it. 

Yes she tries to be that strong powerful lonely wolf she knows she is. But once you have no to support her or someone by her side. She gives up. Even in deep in her heart she wants it so bad! Can't things be easier? She is tired of always fighting. Feels sometimes epilepsy and having a learning disability is killing me. Can't she just be normal. And have people by her side. She knows ya sure there are people around that standing there for her..... But sometimes she feels so alone. Her wolf self looks at the dots in the sky and the shine of the moon. Will help her find her way. She gets stuck in her own mind. Saying to her self ya you can fu@cking do this!!",31Oct2020,1
19,"here is thy father in lord of heaven. walk off your obesity,. and stop giving a flying fuck about what some dude around the corner isn't there for...",31Oct2020,1
20,"Heya Guys, thought alot about to post my problems here, but my English isn't the best at all. so sorry for that

My situation is kinda hard to explain, so if someone is willing chat with me (Discord, Reddit, WhatsApp)
I'm down for it.

long story short explanation:

My family is broken af, got a mom which is a alcoholic since my birth, don't know my dad and my mom never wants to talk about him besides telling me he's a bad guy, got 3 siblings, 2 sisters (43 and 41 years old) 1 brother (38) and me, 25. In my whole childhood and teenager life, my mom always told me I'm nothing, never helped me out even on simple stuff, telling me I just care for myself (said that since I'm 5 years old, I couldn't even reflect that), had a hard time, got too much weight as a teen, always stuck on pc because it was a nice way to get appericiation which I never got irl. after I moved to my first own flat (with 21) my life went okay, my siblings never cared about my life, but I'm fine with that. 2 years later I meet my first girlfriend, which got borderline problems (but I didn't knew that until we broke up 2 years later). I never saw a problem with her and I always tried to make the best for her. but it nearly ruined my life, she bought stuff without letting me know that (I'm owing 5000€ to several stuff), ruined my flat in a lot of ways, and at April this year I decided to broke up with her. I lost my work 1 year ago and since then I'm getting money via social payment (I'm not sure how to call it in English) because I can't work atm (hardly depression and eating disorder) since may this year I'm with a therapist but it's kinda slow, 1 meeting each month and my problems just getting more. My Mom doesn't care, even after calling her and crying because I don't know how to handle this stuff. instead of that, she starts to lie about me, and my younger siblings don't even talk to me (she did the same with my 43 years old sister). I can barely pay my flat and the money I owe, can't buy new clothes, lost over 50kg in 1 1/2 years because of my eating disorder (135kg - 83.2kg now) So my chance are low atm, I'm trying to find work but since the second Corona wave in Germany it's kinda hard to find anything, my therapist told me I could go in a closed psychology clinic (dunno if it's the right name) but I couldn't even afford to travel there. I'm stuck atm I can't even sleep more than 3 hours (got medication, anti depression stuff since 1 years) but it doesn't even helps me out with the sleeping part anymore.

atm I don't even talk with my friends about it, because it's always the same problem and I don't want to annoy them anymore, because it's annoying for me too, I realize it's a weird loop and I can't get out of it.

if anyone can share some thoughts about it, I'm kinda clueless, it's not like I'm suicidal because I'm not, but sometimes suicide feels like the ""last escape"" like ""wow after that I don't have any problems anymore, what a life"" and I know it's a weird mindset which I never had and it's alerting me",31Oct2020,1
21,"Hey everyone. So yeah, its my birthday today and for the last week I've been feeling suicidal. Like ill be casually doing work and the idea of blowing my head off just casually comes to mind. I've been able to brush it off as best as I can but today lots has gone wrong and I feel like I'm now in this hole I cant get out of. I feel incredibly sad this this idea of suicide is just looming over me. I dont really know what to do. Im taking Celexa but I dont think its working anymore.",31Oct2020,1
24,My family sucks and I know for sure that I’d be way happier getting drunk and eating anything I please in a hotel room rather than dealing with whatever bullshit they have to dole out that day.,31Oct2020,1
25,"I know it probably sounds like I'm trying to get attention but, I'm only 13 and I just can't ever find fun in anything.

I hate bringing attention to myself, but I can't help it being a pansexual and a boy with long hair and if I cut my hair to look more normal but that would bring even more attention to me.

I just wish I could vanish, without any pain or sadness.
I just wish everyone would forget me.",31Oct2020,1
26,https://youtu.be/Hf9vEaMnDGs,31Oct2020,1
27,"To start I’ll say I’m doing better in a lot of ways than I was a year ago but in a few ways I’m doing worse. This isn’t the lowest I’ve been, I’ve made a lot of progress, but even though I’ve improved it’s frustrating being depressed.

I was diagnosed with depression and anxiety about 8 years ago. During that time there were periods where I was doing pretty ok but then it seemed like whenever I started to get back into a good rhythm with life something big would happen that would either knock me down or exhaust me so much that everything seemed difficult. 

I hate how I didn’t do my best at school or at work because I wasn’t 100%. I’m still not 100% and it makes it so hard to show up on time or even at all. And I know I can do great. I’ve performed well before it’s just I’m so exhausted by everything. It makes it hard to deal with people and hard to get my work done.

I also hate how I’ve lost friends over being depressed. Some of my former friends would ask me to hang out and I just didn’t have the energy so eventually a lot of them stopped asking and eventually we stopped talking.

Not only that but depression makes me feel like a lot of things are worse than they are. Then I’ll have a moment of clarity where I feel like my old self and see “OK some of these things that happened in my life are horrible but I’ve gotta move past them, but these other things that caused me so much distress should have been easy to deal with or move past. What’s wrong with me?”

Another way my view of the world gets twisted is I’ll be feeling really lonely and feel like I can’t get my shit together enough to make new friends or acquaintances and haven’t for years then I’ll realize, “Wait, I have hung out with some new people during that time. I’ve also made new friends. And if I really think about it in college and at work and at other places where I tried to put myself out there, there were people who tried to be friendly or invite me out and I was too depressed or too overwhelmed with school or work or whatever at the time to take most of them up on those offers. Or to hang out with them more than once or twice, even if I really enjoyed their company.”

So on the one hand that makes me feel more optimistic realizing that “OK maybe I’m not as outwardly a mess as I am internally and I did have *opportunities* to get close to some of the people around me.”

But on the other hand that almost makes it worse. That these people wanted to go out for drinks or coffee or to do this or that activity and I’m the one who turned it down. And that one of the biggest reasons I don’t have a healthy social life right now is because I spent years not putting in the effort other people put in when if I had put in more effort maybe I wouldn’t be as depressed and would have a healthier life in general. I hate that I squandered that time when I could’ve been happier then which probably would’ve made me happier now.

I’ve cut off some toxic friends over the past few years and my life has improved sooo much because of it. I’ve also ended relationships that were unhealthy and have learned both how to be better in relationships myself and how to spot red flags in other people better. But I also haven’t replaced those friends with new ones, especially close friends, and though I’ve made some new friends, overall my social circle has shrunk way more than it’s grown for years. 

One other major thing I hate is that since I was depressed and let myself fall into bad habits like not sleeping enough and not eating before school or later work, sometimes people would try to be friendly or help me but I was too wrapped up in my own head to see their intentions or to fully appreciate them or convey my appreciation of them at the time.

I’m working on myself in a lot of ways and have made so much progress. Honestly myself from two years ago would’ve hoped to be doing better than I am in general but at the same time I wouldn’t believe how far I’ve come. It just sucks that even though I’m doing way better than I was I still have a long way to go and that I’m still dealing with the fallout of my actions and inactions when I was more depressed. 

I used to be the glass half full guy. Now I have a hard time seeing there’s much in the glass at all. Even when it’s over flowing with good things. I wanna be the glass half full guy again.",31Oct2020,1
