,text,time,score
61,"I admittedly have a pretty fucked up way of thinking about life. I am 20 now and over the past years I have essentially modelled my life around being the opposite of my 31 year old brother. 

When he went through university he didn't focus on his studies and pretty much failed out of a degree with minimal job prospects at a poorly ranked university. So I used this to motivate applying for a major with great career prospects (that I happen to enjoy as well!) at one of the best universities in the country. I'm in my third year now, and one of the top students in my comp sci class, again because I'm motivated to do the opposite of my brother.

He has been morbidly obese since his ~2nd year of university, which specifically motivated me to maintain a healthy weight and go to the gym in uni. He never worked while in university, so I've picked up different odd jobs that I really enjoy to support myself and so that I don't need to rely on my parents as much. 

He has never had a girlfriend, which I used as motivation to pursue the girls that I've had crushes on, eventually leading to my current girlfriend. He's still living with our parents - so I'm living away from home and saving up a decent amount of money if I ever need emergency accommodation. 

Telling him that his shortcomings have been my major motivations in life would be fucked, and I absolutely never will. Typing this out makes me feel like a piece of shit. We've always gotten along with each other, and I guess this post serves as a call for help and a way for me to vent. 

My worldview results in positive motivations and has put me on a good track, but it's fundamentally based off of negatives - being the opposite of my brother. I really think as I adjust into adulthood that I need to change this, do any of you have advice for changing something like this which is deeply entrenched?

",22Sep2018,3
62,"I'd been thinking about getting an iPad for a while, and when I saw the one I wanted on sale for 30% off, I impulse-bought it and an Apple Pencil to go with it. The problem is, it doesn't really allow me to do anything new. I can take notes with a pen and notebook, draw with a regular pencil, and browse the Internet just fine on my laptop or phone.

I mean, it is more portable than a laptop and more capable than a phone, so I can take it with me and get some work done while I'm out and about. And with its convenience, I've found that I've been studying, taking notes, and drawing a lot more with it. But I still feel a little guilty because even though it's been a net positive in my life, I don't really \*need\* it.

I'm still within the timeframe in which I can return it. Should I?",22Sep2018,1
63,Is this weird to have such a specific type? Is there something wrong with me?,22Sep2018,2
64,"I posted this in a few other subreddits with mixed results, and a small bit of hostility. I'm hoping this is the right place?

--

For most of my life I've been mainly attracted to older women. I find women my own age very sexually attractive, and also women who are younger.

But for me to really *want* a woman, I've noticed that she needs to be at least 35. Typically 40s or 50s.

My last relationship--which lasted a decade--was with a woman who was ten years older than me. My current partner is just over 20 years older than me.

It's not like this is bothering me. It's been this way for most of my life, and it just sort of is what it is. I'm not anxious about it, or nervous about being seen in public, or ruminating about what people might think. It's just that more and more I've sort of wondered why.

**About me:**

For what it's worth, I'm attractive, and have never had any trouble talking to women. (I hate talking about myself in this way, but I'll go on for the sake of this post.) Most women I talk to seem to find me attractive, and when I've talked to my friends and partners about this, they agree.

So it's not an issue of not being able to ""get"" a woman my own age or younger. It's really felt more like I've been softly dismissing a lot of women in my age range who are into me.

And I've also found that it's much *more* difficult to get into a relationship with an older woman.

I don't *at all* want kids. So that's never been a factor.

Sexually, I'm dominant. Sometimes very dominant. I can definitely be more submissive, but the requirements there are so long and technical that it rarely happens.

Overall, in day to day life, I tend to me more calm/quiet and aloof, but very assertive in conversation. 

**What I find attractive:**

The older women I'm attracted to are varied. Intelligence and competence are hugely important. But there's also the fact that I'm simply attracted to older women physically. All other things being equal, I think a 45 year old woman's face is significantly more attractive than a 25 year old woman's face. I also like the competency of style that older women tend to have compared to younger women. 

Edit: A bit of pertinent information I didn't think of before--When I was younger, I mostly found women around 35 to be the most attractive. By the time I was mid 20s my ideal age (where I tend to see women as being the most physically attractive) went to around 45. Even though 40s and 50s is sort of ideal, I still find women in their early 30s as attractive as I did when I was 20. So I feel like the overall age range has been static, and that I probably felt a little weird about being attracted to women aged 40+ when I was younger and came to accept it as I got older.

--

Anyway, I'm blanking on what other info I should provide. If anyone has any thoughts about information that might be pertinent, please ask.

TL;DR: I've always been attracted to older women and lately have been wondering why. Any thoughts? ",22Sep2018,1
65,"I have a problem of getting too attached to girls too quickly and it really has a burden on me. I can spend a whole day thinking of one girl and then I’ll over think some of her texts and really take it to heart. Examples: leaving me on read (obviously), replying with very few words, and just seeming uninterested. A lot of this is anxiety because I just want the girl to be thinking of me as much as I’m thinking of her. How do you guys keep your mind off a girl and focused on life (especially schoolwork in my case)?",22Sep2018,3
66,"I woke up today at 10 AM, I sat in bed thinking things over and analyzing ever second of yesterday. I thought about every single word I said. Sometimes I think all I do are mistakes and that nothings I do is right, but I know thats not true. I know that eventually everything works and I’ll be fine. I just need some sleep.",22Sep2018,1
67,"Here in Spain there are no bills at all. That's not a concept. The only thing you have to pay is prescriptions but it's about 0.10€ or so. I've read a UK comment talking about 8 pounds: damn bro, that's a lot. For cancer and surgeries it's the same, you can be poor as fuck and you will be cured (you'll have to wait but not till a point you die waiting) because WE ARE ALL SONS AND DAUGTHERS OF SPAIN and Spain takes care of its sons and daughters. Well, we all just agreed on it. It takes 4000$ of GDP per capita (in the US is twice that).

If you need some kind of data to understand why Universal Healthcare is better, here it is: the US spends twice as UE countries on Health (of GDP so taxes are ""included"", I mean, you have to understand what GDP means because most people just replies ""yeah but you have to pay more taxes: no, this is GDP, the total and absolute cost) and yet the US has worst WHO statistics:

http://www.who.int/gho/countries/usa.pdf

http://www.who.int/gho/countries/gbr.pdf

http://www.who.int/gho/countries/esp.pdf

http://www.who.int/gho/countries/deu.pdf

http://www.who.int/gho/countries/can.pdf

I'm not an expert but my theory is that, when you put on private hands something everybody desperately needs no matter the Will and Freedom of the Consumer (because you don't choose to be sick) then Laws of Free Market no longer apply and you create some kind of hiperinflation.

Another theory is that, historically the US has been an immigration country: people is constantly comming from everywhere. So, the original settlers (WASPs) don't want to pay for mexicans, europeans, blacks or asians healthcare so they keep their competitive advantage. If you think about it, societies with too much diversity and a lot of immigration tend to be less cohesive and solidarity is not precisely the thing. But that's just a theory I hope it's wrong...

Americans, you have to consider that, sometimes, more Freedom means more Slavery.",22Sep2018,2
70,"Some cocksucker hacked my spotify account and deleted everything on there. Didn't change the password because I guess he couldn't get into my email. So this asshole just deletes the thousands of songs and multiple playlists basically to be a piece of shit. 

Don't even remember exactly what was on there so now I have to just add what I can remember and start over again. 

What a fucking prick.",22Sep2018,1
71,I am an editor at a young science policy think tank. I feel like an imposter or useless person. I am thinking of at least trying to learn Python. Any suggestions?,22Sep2018,1
72,"Holy shit how am I supposed to do this? I want to do the right thing but idk.

All I want to do is have the choice out of suicide taken away so it’s necessary.

I wish I had a drug dealer. Anyone want to help a London bro out?",22Sep2018,2
73,Definitely a relevant movie these days.,22Sep2018,2
74,"My boyfriend lives with me and neither of us are the most organized people. He’s been living with me and and knows that I am a private person. He knows that I have a lot of anxiety. As a surprise he brought he invited his sister (I have only been around her twice because she lives an hour and a half away) to my apartment while I am at work to help him clean. When he told me that he had to get off the phone because she had just got there, I expressed to him that I was very uncomfortable with her doing that. He stated how I was being irrational and hung up on me. He then turned his phone off for awhile.
I am having an anxiety attack. my heart is racing, I’m shaking, and my breathing is all funny. I’ve been in the bathroom of my work. I don’t want my coworkers to see me this way, but I can’t go home. I don’t know what to do. ",22Sep2018,1
75,"Long story short, I've had depression for years now. Never took meds or got help, it just kept on getting worse. I barely ate (anorexic) and would cut myself almost every day. I was shy, self conscious, and negative. I lost my closest friend over it. Then, I met a group, albeit a little small with just over 10 people, and it changed my life.

At first, I resented them.
I didn't belong in that group. Then I got closer to some of them and I learned that some weren't so bad. I didnt trust a single one just yet, though. 
Then a few weeks after meeting them, I got in a bad argument and had no one else to turn to but one of the people in that group, so I poured my heart out to her and found out that she was sweet, honest, empathetic, and trustworthy. We talked more and had a lot of fun together. I trusted her. Then I began talking to one of the guys and he turned out to be really great. And again, I struck up a conversation with two of the guys and found a three person group to join, and I loved them more than anything. The others in the group became less of a nuisance and more like friends. 
It was about a month in that I vowed never to cut again. That wasn't so bad. Its manageable. When they started gently pushing me to eat, that's when the battle really began. I hated food. Still dislike it, but getting better. I slowly began to trust them all enough to eat around them, and then I trusted myself enough to eat. From there, it was all just an easy battle. They supported me through every hardship. When I stumbled, they steadied me. Nights were spent laughing among friends rather than bringing the mood down with my sulking. I went from the death of the party to the life of it.

For once in my life, I had energy, boundless energy. I wanted nothing more than to do stuff whereas the old me wanted to sleep all day. I loved people and was no longer shy. I became a charismatic-people magnet, gaining new friends. Every day was brighter; I looked forward to waking up. 

And it was all thanks to a small group of people with widely varying personality types, but one common trait: they all love and support each other in the perfect ways. 

Without these people, I would hate my life. Because of them, theres nothing I love more than living - besides them, of course.

Today I can officially say that my battle with depression and even anorexia has drawn to a close. I am healthy and in the best possible mindset, but most importantly, I have people by my side who will fight tooth and nail to make sure I dont fall again.",22Sep2018,22
76,"I found an iPad in my apartment while I was packing up to move out, I have no idea who might have left it but I wanna keep it lol. The only problem is that it has an activation lock so I can’t get into it.
Does anybody know how I could get around this? I only wanna get into the iPad so I could do some digital art but I’m stuck :/",22Sep2018,2
77,"A year ago, my weekends consisted of watching Netflix and YouTube, and the occasional grocery shopping outing. That was my ""life"" outside of work for months at a time.

This weekend, I'm meeting with two different friend groups on two different days, I have a date with a really beautiful woman, and yesterday I accomplished some good stuff at work which just makes the weekend feel so much sweeter (because feeling shitty about work and having to come back on Monday kinda sucks sometimes).

My entire weekend from tonight until Sunday evening is totally packed with stuff and despite being an introvert, I'm super pumped to do it all.",22Sep2018,1
79,"my family life is awful, and my social life at college isn’t too good either. i’m not clicking with my roommates and i often feel alone.. the only person that i feel like actually cares for me right now is my boyfriend, i’m really scared, what if i’m too attached to him, what if we break up? i don’t think i could move forward if we did. we have something really really great, and i feel so connected, but whenever he leaves or i have to leave i get so depressed, am i too attached?",22Sep2018,3
80,"Plans always fall through when I try to make them with people. They don’t seem to ever fall through when it comes to plans I’m not involved in. Just from Social Media it seems like this. Every Friday new things people are doing, but I’m just in my bed at 10 pm. People lie to me a lot too, it’s happened twice in a row these past two weekends, first this one girl “busy doing hw” threw a party, saw it everywhere. Then this week diff girl was “going to Virginia.” Yet she ended up at a party. Yet some of these people talk to me sometimes, I mean I commonly start any conversation. But I feel like the only people who start conversations with me just do it because they know I’m depressed and I’m a last resort for them when they’re bored or not doing anything I guess. I just feel like I’m kept in peoples lives to make them feel better because they’re “helping” me. I don’t know, I’m trying to really accept I don’t really have anyone instead of pity my self, I just don’t know why no one seems to enjoy me or want to spend time with me. that’s what gets to me I guess. I’ve been told I have a good reputation for being nice, I don’t think I’m super unattractive, i try to be kind and empathetic. But yet I’m alone every day of every week. Just me and some music, the gym occasionally. Sadly I destroyed my back today deadlifting. So now I can’t even go work out which is basically the only thing that makes me happy, or at least the only thing I have that makes me happy. I don’t eat sometimes for days at a time. I’m dissociated a lot, I try to make my life better by trying new things. But it hurts to not have anyone to do these new things with, and that’s always been a constant in my life ",22Sep2018,1
81,"My childhood wasn't horrible or anything. And my teenhood wasn't especially spectacular. But I have fonder memories of my teens years though. Sometimes I feel like it's how I should feel about my childhood instead. For example, I always feel nostalgic when I watch something like ""Teenage Mutant Ninja Tutles (2003)"" or ""What's New Scooby Doo?"", despite growing up with the original ""Teenage Mutant Ninja Turtles"" and ""Scooby Doo Where Are You?"". I seriously don't get it.",22Sep2018,1
82,"My roommate/friend has been with this boy for over a year. He is a manipulative, cheating, abusive boy. They break up and get back together like every 2 months. On Saturday of last week, they broke up after he threw her to the ground and choked her to the point that her neck was sore for the next three days. Of course, a couple days later, she brings him back to our apartment. I hate him. I hate seeing him here. I can’t talk sense into her. She says she wants to marry him. She can’t picture herself without him. She keeps saying it. I don’t want it to happen. Their relationship is so toxic, you have no idea how bad of a person he is. He’s changed her A LOT. I just want to help her. I don’t want her to get hurt again.
Have any of you dealt with this?
I need some advice. I just want to help her.",22Sep2018,1
