,text,time,score
19,"Today I officially picked my MOS field for the USMC. Usually in the marines you don’t get to pick an mos (job) only the field &amp; you need a “top 3” since not even your field is guaranteed soo.. sucks lmao picked mine today tho. 

As a first pick I chose “parachute rigger” I’ve heard it’s really hard to get it since so many people want it. Apparently it’s “badass”? But i asked around and people barely get to do (if at all) the “badass” parts of the job so dunno. 

In second place I picked “logistics option” and for third I picked “aviation mechanic” tbh I’m fine with any job as long as it’s not a cook or some kind of desk job. 
 
Other than that, not much happened today. Looking forward to Monday’s PT with recruiters ",22Sep2018,6
20,"Control over my mind and confidence are the two things I once had but feel like I have lost over time. There could be many factors that have caused this, all of which would be my own fault. The fact that I'm not freaking out or beating myself up over even posting this/admitting I have a problem worries me, because that means I've gotten to a point where I just don't care anymore.

Maybe I lost these things because of stupid decisions and choices I've made, maybe it was the drugs, maybe it's my attitude. But these are the two essential things that make a person who they are, or at least make me who I am, and I feel like I can only have these things when I take drugs (i.e. Amphetamine/Methylphenidate and alcohol. Yes, alcohol) meaning that I'm more focused and mature when I am tipsy/drunk than when I am sober. It's worth noting that I've gotten a little too comfortable with LSD over the past few weeks and let that take over my brain as well. My brain, which was once my best friend, has turned on me because of LSD. It told my brain to hate me for what I've done to it, for who I am. I've learned a lot from my trips but, I didn't expect to ever actually lose control over my own mind. I'm not saying I'm crazy, I'm just saying I feel belittled by my own mind after the bad trips I've had. So who knows? Maybe the acid's to blame. It's a powerful and mind-altering substance after all.

Regardless, as I sit here typing this, I hope time will fix me if I treat myself better and stop relying on drugs. I really let myself go. And now, who I once was doesn't seem to want to take me back no matter how much I beg and reminisce. Maybe time is the only true thing that will fix me. It's a shame I've taken steps backward rather than forward and actually bettering myself on top of what I once was, but if that means I have to relearn or make it a point/goal to gain *true* confidence and control, then so be it. I should have never let it come to this. Will what I've learned ever benefit me? Who knows. Who knows where I'll be years from now, what I'll be doing, or what my way of thinking will be. People change, I'm no exception.

Control over my own mind, confidence and empathy? Those three things are the most important things to me right now. I need to change. It won't be easy, but it's not supposed to be. If it was easy everyone would do it. That's what separates me from the rest of the crowd. And that's what I aspire to be.",22Sep2018,1
21,"I love the era we’re in, I really do. Technological, medicine, and health advancements are just a couple of things I can think off of my head as to why I’m blessed to be around in this era. 

But I wish I could relive the 90s and early 2000’s. Was watching early gossip girl seasons and just remembered how much fun the early 2000s were and then I thought about the 90s. I was born in 1997 so I’m not a “true” 90s baby as I have no recollection of those years but I love seeing pictures of my family in the 90s and all the ‘vintage’ and fun fashion styles they had; how cars looked; how my neighbourhood looked; what was on tv in the background etc.


Just random shit posting haha. 
",22Sep2018,2
22,"So yeah me and my girl got to see each other again and have a few dates here and then. We have a very hectic schedule now and we go see each other every once a month now ever since we got a job unlike before back in college we go have dates every week and have fun. 

Just yesterday, she noticed my nice clothes and ask ""why do I look too good?"" then I answered her in an unintentional fun sarcastic way ""cause you don't know how to look good and fix yourself"" little did I know that she's silently mad and got disappointed at me and she doesn't want to hold my hand when we're walking out in the public and she's keeping those tiny hands in her pocket so I can't hold them. 

She also told me the reason why she doesn't wanna hold my hand that time and it was simply because she doesn't want the people to see us and mistaken her for being a cougar. Cause my girl is a year older than me and I still have this baby face look which kinda makes people think that I'm dating an older woman. But anyway the date yesterday went great and I know that the smile on her face is satisfied to see me.

My girl is simple, she doesn't wear make up, cosmetics, paint her fingers, dye her hair and doesn't dress herself in fancy attention seeking manner, just plain shirt and pants will do for her. Ever since she started her 1st job 3 years ago my GF forgot to take care of herself and got more and more occupied with all of her work and its affecting her health like she's been getting a few hours of sleep, stress eating and she's gaining weight too and rarely do something about her hormonal imbalance. 

She also told me that the trend these days is that guys would cheat and dump on their GF/SO for another hot girl. So yeah basically that's it. Now I'm lost in words and don't know what to tell her. I love her for just being simple and that nice smile is always fulfilling to see. I just don't know how to not make her feel insecure with other girls? ",22Sep2018,2
23,Normally my day goes go to school come home and play video games in my free time. I don’t really like going out to much especially when it involves people from my school being there because I get anxious and nervous that I’m gonna do something stupid I don’t know. Lately I’ve been not really feeling like playing games even though they are my favorite thing ever I get in a lonely and sad mood. My friend invited me to a football game for our high school today and I answered with the usually I don’t really want to go. When I got home I realized I was gonna slip into that mood again and even though I didn’t want to and I was nervous I went and I had a good time. This isn’t to say I don’t go out to do things just not a lot and it’s usually the movies and stuff where I’m not gonna know anybody except the people I’m with. Now that I’m home I feel like I’m slipping into that mood again for some reason but I’m still a bit happy that I did something I usually wouldn’t do since I’m trying to be more social and improve parts of my life that I don’t like. ,22Sep2018,2
24,"Even though that I live in what was considered the most dangerous city in the world, this is something new to me because (thankfully), I live in one of the safest parts of town. It’s been like 8 years since I’ve heard a gunshot I’m very scared. My dad told me not to worry but I can’t. ",22Sep2018,3
25,"I miss in high school when I’d have ancient history class last period on a Friday afternoon.  My teacher for that class would usually just stand up the front and speak the whole time or we’d watch a documentary.
Even if earlier in the day I wasn’t particularly tired, for some reason I’d become so sleepy and relaxed.  [There’s this great short animation](https://vimeo.com/215498188) about trying to stay awake in class and it is ridiculously spot on.
It was like being in some kind of trance.  The final bell would ring and I’d amble, dazed, out of the classroom into balmy weather feeling incomparably content knowing that after 15 minutes listening to my favourite music on the bus, looking out the window at trees and houses blurring together with glazed-over eyes, I could just crash on my bed and feel absolutely fine.",22Sep2018,1
26," http://www.ihr.org/jhr/v14/v14n3p27_bloch.html

amianazi?

",22Sep2018,1
27,"it is very late and I'm mayhaps a little emo, but today the song Human by Dodie (one of my favorite artists) came out and i've been listening to it all day. god, the lyrics are just making me cry over and over. my SO came over and we were laying on my bed together, tickling each other, making each other laugh, and then we just laid there with our arms and legs all in a comfy, sweaty mess with our hands lightly grazing. i could feel his chest lift when he chuckled, the most beautiful sound i know. lately i have been so happy to be a human being. sometimes it is wonderful and sometimes it makes my bones and my skin and my heart ache, but no matter how bad or good i feel, i try to remember that whatever emotions are inside me are just a reminder that i am *alive!* my brain is alive and well and trying to keep me from getting eaten by another animal on the savanna. we are so alive. show each other the softly glowing cracks and the crevices of being a human in your wonderful, alive form. 

i seem high but i am not high at all, i am just emo. goodnight!",22Sep2018,3
28," I have hope for life. The world is amazing and we humans are even better. We love and we, sadly, hate. Yet we keep getting better, always. Everyone please keep being better. Humanity was born in a blessed place, it wasn't meat to die here.

I love you all, and i mean ALL. Truly :(",22Sep2018,6
29,"I’m 58kg, 5’5 in height. I’m unhappy with the excess fat in my stomach. It’s not so fat, and it isn’t noticeable if I wear the right type of clothes. Around 33 inches on the waistline. My concern is I don’t have a shape. I want to be curvier in the waistline. Will a month be enough? And will I gain the fat back if I stop going to the gym? Is it going to be worse?",22Sep2018,1
30,"I seen people constantly giving excuses to make protagonists look completely blameless. If a protag has a sick mother, it somehow justifies murder and robbery? When an antagonist does it, it's suddenly no excuse now?",22Sep2018,1
31,"I never follow up promptly when it comes to maintaining relationships. I’m a total social retard, nobody wants to be friends because I’m disgusting ",22Sep2018,0
33,"So I can’t go into too much detail, but pretty much I have (had) a reputation where I’m from from kicking ass of gangsters and drug dealers in the area, just trying to keep it safe and whatnot, some people liked me, some didn’t, whatever.

After a messy run in with the police however, I decided to lay low for 8 years, that was until I caught wind of new guys looking for trouble, they were holed up in the sewers, so I went down to fight, however I was greatly underprepared. 

This big guy in a mask greeted me, he knew who I was, I took for granted that I would kick his ass and send a message, however he severely beat my ass and broke my back, now he is a great threat to my area, police won’t do shit about it and I have at least a year to recover. 

What should I do, how do I make this right? ",22Sep2018,2
34,"Ever since i was 11 (now 19) i have had an eating disorder. It has changed forms and intensity over the years but has been a constant throughout all my teenage years. From the age of 12-17 I was in and out of forced inpatient psych care because of not eating, self harming and suicide attempts. From 12-16 I was in outpatient care at a eating disorder clinic following a meal plan. 

When I was 16.i had regained the weight lost  and was stable at a “healthy” BMI. Everyone thought I was okay, even I did.I was declared healthy and without diagnosis. I stopped going to the ed-center. In hindsight I think I longed to be normal and healthy that I convinced myself to look past all my still very disordered thoughts and actions around food. But I was not okay. I hated my body, I still restricted food and occasionally my starving went on for days. I still managed to keep a weight on the low side of the “healthy” BMI range. 

Until the spring of 2017. I was graduating and everything fell apart. From that time on I got deeper and deeper into my eating disorder and I started loosing weight. First in September I told my mother and we called the ed-center for help again. 

In the beginning of October before I had gotten an appointment I broke down one day after work. I was tired, starved and suicidal. The police came and got me since I attempted suicide and I was forced committed to emergency psychiatric care.  I had lost about 5 kilos by this point but was just at a healthy BMI so nobody there cared or believed me when I told them about my past and current struggles. I released myself and continued struggling at home, loosing more and more weight and becoming more and more depressed. The meetings at the clinic did not work and the world around me seemed to be crashing down.

In November my dad passed away after several years of being sick. It was expected but made me retreat more and more into my disorder. This went on, month after month til I had lost ~17kgs and had a BMI of around 14. My temperature was at a low 34,5 Celsius for days and I was threatened with force feeding and such if I didn’t make a change in the following week. 

Somehow I did. I got on the internet and read about recovery. I had literally nothing to lose. I was so hungry, so sad and angry. I read about unrestricted eating, extreme hunger and everything that follows in recovery. I researched the Minnesota starvation experiment, fat distribution and overshoot weight. Then I just started eating. I started doing what scared me the most in life. I ate and cried, I ate and shook from fear, I ate and felt sick from anxiety. I ate a lot, I ate whatever I wanted, in the amounts I wanted and whenever I wanted. I was so hungry, I ate many many 1000+ calories a day. I started to regain weight. I started to regain happiness, energy and sense of hope.

This was in June. Today I feel better than I have since I was 12. I in no way consider myself healthy or free from my anorexia but I feel hope. I still struggle, I still eat more than most and I still have a hard time accepting my body but I feel that I have a future. My cravings and hunger have started to calm down, I have regained weight(I do not weigh myself any more), I have the energy to work again after being in sick leave for 11+ months , I meet friends, I am anxiously anticipating my period to come back.I am seeing the light at the end of the tunnel and it is the best feeling. 

This was not easy. Me and my mom have cried, fought, hugged and screamed. I have thrown plates on the floor and had panic attacks over 2 extra peas or having taken 3 steps to little.

I just wanted you all to know there is hope. It will be a struggle, you will
Most likely experience extreme hunger, wanting to stop and go back to your eating disordered ways but you can do it! You can live a full life and be happy without restriction.

Also remember, you do not have to be clinically underweight to have an restrictive eating disorder. You do not have to be clinically underweight to be underweight for your body and starved. You do not have to be clinically underweight to deserve recovery. I will recommend a blog/YouTube channel/podcast by Tabitha Farrar for more reading and inspiration. You can do this. I’m on my way and I’m so very proud!",22Sep2018,1
35,"I was at my Costco, hitting up the food court. If you arent near/never been to a Costco, they have self serve for condiments, meaning anyone can help themselves to the ketchup/mustard/onion/whatever or since its Australia, its most likely tomato sauce in the dispenser instead of ketchup.

I didnt mean to pry, I just finished eating, took a piss, washed hands, came out of the bathroom and my eyes just wander when I saw someone eating one of the Caesar salads from the food court... with tomato sauce. I did a double take, a gag, moved on. But that fucking meal haunted me for a while after. Absolutely disgusting. I felt a knot in my stomach and slightly nauseous for while after, my mind was stuck on a loop. ""How could they eat that? Why did they do that? What in the actual fuck? How could they eat that? Why did they do that?... etc.""

Just because the condiments are free, doesnt mean you need them.",22Sep2018,5
36,"I know this is awful to say and believe but some people are just so horrible, they don't deserve to live. I don't claim to know everything about that woman, but to be so arrogant, self-centered, cruel...

I'm not a hateful person - I'm chill as fuck. I did my best to help. I stood up for myself after having had enough of her abuse and it only made her go out of her way to publicly embarrass me.

Just... why? This same lady has made numerous young cashiers cry. Why would she go out of her way to do this, to be fucking just... evil?

I hate her. I can't get the anger, embarrassment, and resentment out of my mind. 

There is NOTHING I can do to have any sort of justice or ease of mind, besides hope that her life is miserable enough to cause that sort of behavior.

I wish I could sleep. I wish I could push that anxiety away. I wish I didn't have to work another ten hours in just five hours. :(

Why are people so unnecessarily horrible? Fuck I wish I could just brush all this off but I can't.",22Sep2018,1
37,What can I do about it so it doesn’t smell funky as it drys?,22Sep2018,1
38,"Hi all, I have a tough issue I'm facing currently and any advice will be truely appreciated.

So it starts with my 7 year old son, he is having some trouble learning at school and is playing catch up constantly. Me and the mum are separated and have our own partners now.

This weekend I picked him up as per usual after work when she told me, she has gone to see the Dr and they recommended he go on a gluten free diet. He doesn't have Celiac disease btw, they said for him to use berocca to fill in for any lost nutrients, and that this diet will help him with his school work.

I know reddit is no replacement for a Dr, and I will take him to see one tomorrow. I just don't feel that this is sound advice, from what I read ""or from complete lack of information!"" there is no accredited information that links a gluten free diet to any improvements neurologicaly, or in any other way than being better for people with celiac disease.

Please tell me if I'm wrong but this doesn't sound right at all.",22Sep2018,1
39,"23m. 

I haven’t kissed or touched a woman in a year. I went through a bad breakup with an abusive partner about 1 year ago and now no woman will give me the time of day. I want someone that finds me attractive and wants me however I’m convinced I’m unwantable and I can’t figure out why.

I am 6’0, in good shape, have a good job and live on my own. I have a few good friends and honestly I feel like I’m a decent guy.

But no girls want me. I’ve had plenty of previous success but now no girls will give me the time of day. I try being the guy they want, the available guy, I try setting dates (they always flake), I try to be a cool dude and put my best foot forward when it comes to anything in my life.

But I just feel so unwanted and it breaks my heart",22Sep2018,1
40,"So recently in the news we've had sexual assault victims coming forward and often times a defense is ""But he's a good man"" well here is my story.

My Grandpa owned a lot of rental properties, and one of his tenants was a young man, lets call call him Randy. Randy was a local farmers boy and worked on his family farm. My grandpa did business with his family a lot, and in one of the deals my grandpa agreed to exchange rent for fully butchered cow every year. 

Anyway, Randy liked guns and video games and every time I would visit my grand parents I would go to Randy's house and play video games and we would go shooting together. Randy became a bit of an older bother to me. My memories from randy stretch from the time I was a toddler, some of my first memories are of Randy, 4to the time I was in my mid 20s.

Now one thing I must stress, Randy never did anything inappropriate with me. Which goes to strengthen my point I'm about to make.

Well a few years back, Randy got caught up in some FBI sting on child pornography. Turns out Randy had been involved in some production and a TON OF DISTRIBUTION of child porn. At first everyone to include my family didn't believe Randy could be capable of being involved in something like this.

So he was arrested, and through his trial the evidence came out. Randy had been a major part of a large child pornography distribution operation, even partaking in some production. Randy did a horrible things that harmed Innocent lives and will be spending the rest of his life in prison. 

The reason I bring this up is because of the metoo movement. I think its inspired a lot of sexual assault victims to come forward and this has resulted in some surprising accusations. Just because its hard to believe something, doesn't mean its not true. I thought I knew Randy, and if you would have told me what he did behind closed doors I would have been offended, I would have been mad at you, because I know Randy, and Randy doesn't do shit like that.

But I would have been wrong, So we should all be slow to judge. Truth doesn't need to make sense.",22Sep2018,8
41,"I broke up with my girlfriend of over 1.5 years first thought of it 5months in took me this long to find courage. I just turned 25 shes 21 i was her first everything. I broke her heart. I feel like a terrible human being. But i know it was the right decision for us both in the long run.....right? Im also worried i made the wrong decision. Idk why i wasnt happy with her. A few jealosy issues, we talked multiple times but it just never worked. She is the nicest and most loyal girl i have ever met my family absolutely in love with her never did anything wrong where i was making mistakes and getting forgiven around every corner. I hope i did the right thing. I really feel like i did deep down. Its been 12 hours. ",22Sep2018,2
44,"I just have a pretty dumb question, but I’m a bit concerned and don’t want to bring it to my mom.

So, I’m in the school drumline and I’m the only girl.  I’m a senior and it’s been this way for four years.  I get the same punishments as the boys, including marching with no shoes and socks in the heat of Georgia on black pavement, having the metronome cranked up louder if we somewhat slip, and sometimes hitting the boys.  He’s punched me in the shoulder once and left a bruise, and the bottoms of my feet have blistered and peeled off.

I’m in a lot of pain from last week and I don’t want to tell Mom, so should I just talk to her or try to doctor it myself?",22Sep2018,2
45,"Working with severely autistic adults in a residential setting for the last 10 months has been proper enjoyable. Learning about autism, for me, is an amazing exploration into a fascinating realm of the possible ways humans can be wired differently. Plus I like working in a field which impresses upon me the importance of treating vulnerable people with dignity and compassion.

For me, an autistic person is like a football player in a computer game who has had the levels of their attributes randomised. Their stats are all over the show, and because of this inherent uniqueness, it's highly unlikely any two players created will be the same. They will be strong in some areas of their game, and weak in others. Some abilities the player has are contingent upon others. For example, a player may have 99% passing accuracy but only 2% kicking power, and so they won't be able to realise their passing potential until a way to solve the kicking power issue has been figured out first. 

So an important part of the job as front line support worker and facilitator is seeking out ways to restore or rewire the need for, those prerequired abilities in order for autistic people to have access to the other strengths which are currently lying dormant in them.",22Sep2018,1
46,"I have no memories of setting up my reddit account. Must have been a more drunk birthday. Anyhow, 32 years and counting. It's been interesting so far.",22Sep2018,26
47,"an unutterable sadness crashed into me and all my fragility happened at once. 

every anxiety that i’d carried so long, every ugly opinion and undressed prejudice, usually displayed on the face that i wore, crumpled under the impact of raw horror.

making love consume me?  can love be a mutation that changes everything?

i believe i can’t change the evil structure of this society, and i feel the impossibility of rebuilding the construction of me.  i believe in my revisionist history, i thrive on regurgitating empiric memory.  so my life holds no surprises, unless i let them in, and even then i relate according to established whim.  nothing in me could be new or unused.  not one of my thoughts, no matter how absurd or confused.

i think i like my general setup.  

then the one i believe is the world to me makes a noose for a death, cutting both of us free.

an immense incision opens in me as i lose myself in this vicious grief.  bleeding out all pretentious conceit, i fill with the pain that’s killing the world.  

and the vulgar, the shallow, ridiculous me, mutates in that moment of harsh reality. ",22Sep2018,1
48,She was with my best friends for 2 weeks straight before we broke up agreeing to date as soon as we broke up and idk this just fucked me up even thought I broke up with her ,22Sep2018,2
49,My first ever relationship can get frustrating at times. We're like taking to mirrors when we quarrel. ,22Sep2018,2
