,text,time,score
50,Can I just ignore it? I live in TX if that helps.. I got a late fee on it too bc I didn’t realize there was a due date. I’d much rather spend the money on groceries since my fridge is empty but I also don’t want to get in trouble if I keep ignoring it.. advice?,22Sep2018,0
51,":((( i get too attached to people. 

how do you guys deal with getting over people? i'm really bad at it",22Sep2018,799
52,"Thorough documentation of this ongoing crisis is provided at the end of this post. 

This is a long read, but everyone in the US needs to be warned about this, and every day this problem isn't solved, it's killing more people. Action on this issue is urgently needed. 

I have [polycystic kidney disease](https://www.mayoclinic.org/diseases-conditions/polycystic-kidney-disease/symptoms-causes), and for the last four years, (at least while I was still physically able to do so,) I saw doctor after doctor after doctor in search of adequate pain management. In that time, I have not been prescribed anything for pain at all. 

Before that, up until a bit over 4 years ago, I had a life, because I had a doctor providing me with hydrocodone, which had turned out to be the only effective medication against my pain after I had tried every single alternative narcotic and non narcotic medication that existed there at the time. (Surgery had been ruled out as an unnecessary risk.) I used Lortab (hydrocodone with reduced acetaminophen) responsibly and sparingly for years, and never experienced any addiction or withdrawal. Only relief and a chance to live my life instead of survive it. 

Then, I was forced to move across the country in order to access other kinds of healthcare blocked from me in my previous home state. The new federal opiate laws went into effect not long after I moved. My new home state turned into an even worse medical neglect death trap, and now I'm not well enough to move again in order to save myself. 

My physical and psychological health have been utterly destroyed by the complete void of available pain managenent in the US. I can't function at all now, even basic things in my own home. I can't leave the house anymore, and even if I could, I have exhausted every single doctor I am able to access and been abandoned by every single one. I spend all of my time laying around in agony, crying, screaming, mangling inanimate objects, viciously self harming just for one source of pain to distract me from the other, and wishing for death. I have no will to live and no reason to want to. I'm probably only still alive because of rage towards the people responsible for doing this to me. One of the questions I have been asked by many of the doctors I've seen, after I explained my massive list of new and worsened physical and psychological symptoms (not included in this post), they genuinely wanted to know why i hadn't killed myself yet, and how I could still be alive after everything that happened to me. They weren't going to help me. They were just curious. I have also had numerous offers to help me access assisted suicide - while denying me access to the medication that would make suicide unnecessary. 

This is a death trap millions of Americans are stuck in with no way out. At least one in ten suicides in the US is now caused by untreated chronic pain, and that doesn't count all the early ""natural"" deaths (mostly heart failures) caused by symptoms resulting from the stress and trauma of being tortured in constant pain because of government mandated medical neglect.

Chronic pain patients across the country are now left with only two options: suffering, or suicide. **We need the help of able bodied people if we are to have any chance at life.** We have been completely abandoned by our doctors and legislators. We have been rendered powerless to save ourselves. And as long as nothing changes, more of us will continue to die every day. 
_____

This is not just a problem for chronic pain patients. Unreasonable opiate restrictions mean that **whoever you are, YOU TOO are only one painful accident, injury or illness away from being tortured and neglected** by the doctor or hospital you would go to for help. It doesn't matter how obvious your pain or its cause is. It will not be treated because doing so puts doctor's business and career at risk because of new federal and some states' laws based in misinformation and opiate hysteria instead of science, medical need, or compatibility with pain patients' basic human rights to life, liberty and happiness. And doctors always choose to protect themselves and their business over helping their patients. You aren't the exception because your doctor has been nice. It's a problem caused by federal law, and nobody is immune to that. 


The following is only the most recent story I've seen of an experience like this at an American hospital. 

""*For people who think that the refusal to treat pain is just for chronic pain patients and they don't feel that they shouldn't help fix this issue.
This is (name removed). she got severely burned on her arm and went to the emergency room she was denied any pain medication while she was there and was sent home with nothing and was also was not given anything for when they did the debridement. So if you think this problem won't effect you, think again.*"" 

Links to photos of burns (NSFW/L):

[Link One](https://ibb.co/kjQ3U9)    
[Link Two](https://ibb.co/kNGtU9) 
_____

More information, written by another victim of the American pain crisis:

A little CDC forced honesty from their new report released 8/31/18 at CDC.gov:

Opioid deaths: 14,487 of 325.7 million people died in 2016 from LEGAL PRESCRIPTION opioids. That's .000004% of the population! Now why is there a hysteria over PRESCRIPTION opioids?

Good question!

Especially when alcohol related deaths are 88,000 of 325.7 million. That's a much BIGGER number!! Yet... No hysteria over alcohol

1.3 million people are injured and 35,000 die in car wrecks per year. Just to give you a reference. A WAY BIGGER number. No hysteria over that. (edited to correct information)

Hmmm. 🤔

Maybe it's because this is how they reported opioid deaths to the media:

'Drug overdose deaths in 2016 reached a NEW RECORD HIGH.' 'Drug Overdose Mortality: A RECORD NUMBER of drug overdose deaths occurred in 2016: 63,632, A RECORD 19.8 PER 100,000 PERSON'S.' (19.8/100,000 is still only .0001% but it looks BIGGER reported this way.)

Sounds like everybody is dying from opioids doesn't it? Now why did they say 66,632 died when I said 14,487 up top? That's a BIG difference!

Well...CDC combined LEGAL, law abiding citizen prescription opioid deaths, with ILLEGAL heroin, cocaine, and fentanyl deaths!

Why would anybody want to DO that? It's kind of misleading isn't it? Well...it makes a BIGGER NUMBER.

Where's all the hysteria and 'crisis' for the 1,300,000/325,700,000 each year DYING of car wrecks!!? I can make that sound awful! And it is! But it's still only .003% of the population and people have decided it's worth the RISK:BENEFIT RATIO to drive. And the government lets them.

Because of the way the CDC reported opioid deaths, and others' agendas, a wildfire of hysteria resulted, causing disabled by pain patients to lose their opioid medicine, their ability to function, their dignity as they are treated like drug addicts, and any quality of life. Imagine an Ice cream headache 24/7/365 covering different parts of your body. You can't think with this type of ceaseless pain. You want to die.

This is something that is personal and each person has to decide the risks they take in life. Risks are everywhere, and people have to decide if something is worth the benefit. It's called 'informed consent' when you know of the risk before you take it. 

Shouldn't people in agonizing pain be able to decide if the RISK:BENEFIT RATIO of .000004% is worth the benefit of being able to get out of bed and function? Work? And not want to die from tortuous pain?

Doesn't make sense, single moms are facing homelessness as they can no longer work due to unbearable pain, MS, lupus, etc etc; also Vets who risked their lives for our country with painful injuries, now lie there wanting to die. Elderly people lie there sobbing with NO RELIEF, day after day, wishing they would die. Where's the hysteria over that?

We have no voice. People/media listen to those in power. Not the multitudes suffering at their hands. Please share the TRUTH. 

ALL the above information can be found here: Where things are in context. A LOT harder to get information here than in the hysteria promoting news. And they're counting on that, apparently. 

Reference [CDC.gov: 2018 ANNUAL SURVEILLANCE REPORT OF DRUG-RELATED RISKS AND OUTCOMES
](http://cdc.gov)
_____

Further information, references and sources:

https://themighty.com/2018/09/chronic-pain-anger-emotions-doctors-dont-understand/

https://www.painnewsnetwork.org/stories/2018/9/4/diversion-of-blame-and-the-opioid-crisis

 https://www.painnewsnetwork.org/stories/2018/8/31/cdc-most-overdoses-involve-illicit-opioids

 http://www.foxnews.com/opinion/2018/04/25/greg-gutfeld-opioids-facts-and-fallacies.html 

 https://www.politico.com/story/2018/08/28/how-the-opioid-crackdown-is-backfiring-752183

https://www.painmedicinenews.com/Clinical-Pain-Medicine/Article/09-18/Suicide-Accounts-for-Higher-Percentage-Of-Opioid-Deaths-Than-Previously-Believed/52566

https://www.cleveland.com/healthfit/index.ssf/2018/04/suffering_and_abandoned_chroni.html

https://www.ajmc.com/interviews/dr-jeffrey-gudin-how-providers-can-make-sure-patients-in-pain-are-treated

 https://www.cato.org/blog/civilian-casualties-continue-mount-governments-war-opioids

 https://medium.com/@ThomasKlineMD/opioidcrisis-pain-related-suicides-associated-with-forced-tapers-c68c79ecf84d

 http://ehealthcare.cc/2018/07/06/sudden-unexpected-death-in-chronic-pain-patients/

 https://www.painnewsnetwork.org/stories/2018/9/10/the-role-of-suicide-in-the-opioid-crisis

 https://www.painnewsnetwork.org/stories/2018/9/12/one-in-10-suicides-linked-to-chronic-pain

 https://hudsonvalleydoctorskilledmybrother.wordpress.com/2018/09/14/suicide-over-pain-telling-my-brothers-story-because-he-cant/",22Sep2018,3
53,"basically here’s the deal. 

i am a 16 year old guy
school and work are my main time consumers

currently work at a grocery store in produce department

mentally iffy manager, non social or enjoyable job/ the scheduling is not really accommodating to my student needs 

i have a hard day at school, i work out at the gym all the time, the last thing i want to do is come to work and be constantly walking back and forth from the cooler and the sales floor. 

meat department has a open position
the job is simple, person selects meat they want,
u wrap and give to the customer. 

i work 6pm-10pm and that equals slow day, barely any customers. my ideal schedule is 6pm-10pm sun-thurs. and have fri sat off(technically whole day sunday just work afternoon). and according to all employees there, the department manager is great and flexible with his student employees 

it’s been 4 days since i put a indirect request in. today i will walk up to the store manager and directly tell him i would like to switch. After that, if he needs more time, i give them one week. if i hear nothing, i go get a interview at another place my friends work that they tell me they can give me that schedule i really want. once i go and get set up there, i give my 2 weeks notice at current location. sound like a good plan?

when i speak to store manager, i don’t want to say i am quitting unless u switch me because that’s a dick move, but i will make up the reason as to why i want to switch which is, “i want to pursue a culinary degree after i graduate high school, and working in meat would be a great experience”. 

all honesty, i been very unhappy with my position for months already but was in the mind set of “fuck it”. i am done, i feel i desire better, i was felt if i did quit, they would take it personally. i am acting as professional as i can, and hoping
for the best",22Sep2018,1
55,"Hey all. I originally posted in /r/relationships but was told to post here and made a throwaway for an issue of mine. This is going to be long since I have a tendency to ramble so I’m sorry in advance.

I’m 23F, by the way. I don’t think I have any social awareness issues but please let me know if I’m the one acting weird. This situation just causes me to get so stressed out to the point of tears because I get attacked for it. I know people will tell me to get over it or grow a backbone or that I need thicker skin or something but I just need some sort of feedback. Before I start, the person I talk about in this post is known on FB for being the type of person to pry for attention. Posts about how she’s feeling sad but then tells people to PM her, bitches about people publicly if they wrong her even if she’s in the wrong, and just overall a lot of drama. I kept myself distanced until this scenario and it kind of concreted my realization that we’re not really friends.

So here’s the scenario. Let’s say I have an old phone that I don’t use. A friend will go, “hey, I need a new phone. Can I buy your’s if that’s okay?” And I’ll go “sure, that’s fine. Offer me a price and we can go from there.”. The person will offer me a fair price and then tell me “let’s meet x day”. I’ll go “sure, okay”. The day of and the day after, I won’t hear anything so I’ll check in. The person will tell me “hey, I’m still interested but let’s meet x day instead” (usually later in the week). Again, I’ll say “that’s fine, no worries. I’m not in a rush or anything”. Again, the day will come up and still nothing. No response or anything. I’ll shoot them a message saying that it’s okay if they don’t want it anymore but to let me know cuz it’s not being considerate of my time. 

And that’s when everything goes to hell. They come back at me like I’m attacking them. Like I’m the one causing the problems and forcing them to buy my phone. Keep in mind that every time this situation happens, I’m being more than accommodating with them. Someone asks me for the favor or the item or whatever and then I’m the one that gets treated like a bad guy for checking in because they can’t keep their word. And usually after a week of not hearing from them, I will send that above message (saying that they aren’t being considerate of my time) and get a text back going “oh, I’m sorry, my family member died”. Literally every time this happens regardless of who or how well I know them. It’s always that someone died and that I’m the bad person for asking them to stick to their word after a week or two of this because someone died.

This just happened to me with this girl I knew. She works in a shop near my apartment and I chat with her every now and then when I walk by. I added her on FB cuz it came up in conversation that I have a phone I don’t know what to do with since I upgraded mine. She asked for the phone a while back and I said, sure. Just message me whenever about it. Two months later, she texted me asking if she could buy it and offered a price. Told me that she would meet me last Friday but then tells me her paycheck hasn’t come through. The conversation went almost exactly like the above example except I even told her that it was okay if she didn’t want it after waiting a while (she had me wait about a week). She kept telling me that her paycheck was late and so I was like, I totally understand money problems. It’s really no big deal if you don’t want it. She insisted that she still wanted it and then told me a day to meet her by her work and I show up (last night after she got off work). The day of, she isn’t there and ignores my messages. I message her the next day (today) asking if she still wants it or what’s going on and get told “sorry, my stepfather died” and that I’m being unreasonable for being upset because she had a family tragedy.

I don’t know what to do. I told her multiple times that I wasn’t making her buy the phone but she insisted. Me and this girl don’t talk. She doesn’t reach out to me if I try to message her. We hung out once the day I added her on FB. She texted me telling me everything above and I unfriended her. My assumption is that if she’s going to ignore me when I try to talk to her and then blow up at me when she asked me for the favor then we’re not really friends. So I unfriended her and she gets extremely angry after seeing this. In her defense, I tried to explain to her that we don’t really have anything in common and that I just wasn’t trying to start a fight but people take advantage of me in these situations often so I was trying to be cautious. It made her angrier because, in her defense, I probably came off much harsher than anticipated because this is all over text. She tells me that I’m not really a nice person because of this situation and told me that I’m not welcome at the store she works at anymore and blocked me. I tried to offer that maybe we’re miscommunicating or something but that’s when I saw that I had gotten blocked.

I know this is all a lot of petty drama and people are going to tell me that this isn’t that big of a deal but I really want to prevent this scenario from happening again. I really did like the store she worked at and I didn’t mind chatting with her but maybe I did do something to piss her off so much.

Please, any feedback would help. I just really need to know what to do. It really hits my self esteem when someone attacks me for being a terrible person. I really do try to keep from inconveniencing anyone or being a dick. I know I’m sensitive but I just can’t take this happening again. 

**TL;DR** Friends or strangers will ask me for a favor or if they can buy something off of me but then take days or weeks getting back to me. I will try to be accommodating and patient but then get yelled at and blocked if I tell the person that they aren’t being considerate of my time. They will then disappear again and tell me that a loved one died and that I’m being a monster for bothering them even though just previously they came to me for the favor or item. I usually assume the worst and that I’m never going to hear from them again so I delete them off my phone and off FB and go about my life, only to find tons of angry messages and that I’ve been blocked. Am I doing something wrong? Am I socially inept somehow? ",22Sep2018,0
56,"I just wanted to get this off my chest somewhere people don’t know me. My friends are also probably tired of hearing the same thing.

Last night I decided to end my relationship with the girl I planned on marrying. In short, we argued too often and I always felt like I couldn’t trust her. She gave me no clear reason not to trust her, but she did lie about a lot of small and insignificant things which always made me doubt what she said. She also did and said a lot of small things to try and make me jealous. This latter point had a big impact on me because I cannot understand why, if you love someone that much, you would intentionally do things to make them feel bad. The thought of her doing things to make me feel bad keeps me up at night and occupies my mind all day.

I cried like I’ve never cried before, like a baby on the floor while she was watching me and begging me to stop. I knew noting would ever be the same and I wouldn’t ever be sleeping with her head on my chest or my face buried in the back of her neck. For some context we broke up a few times over the year we dated, but this is the one time I’m 100% sure I won’t go back.

It was like all my troubles disappeared when she was around. Her energy and playfulness and love is like a drug I can’t get enough of, but I know if I stay with her it will end in misery one way or the other, either through her cheating, me getting tired of arguing and leaving, or her saying something too hurtful for me to live with. I’m so proud of myself making the decision to leave and move on with my life, both for myself and for her, because I know I will be wasting her time if I stayed, and it just isn’t fair. 

I’m truly afraid that I won’t find anyone I love as much as her. I was in a relationship 2x as long as this in the past, but the emotions I felt didn’t even come close to what I felt with this girl. Not even 20%. She helped me open my heart up and be myself, while I helped her control her emotions and impulsive actions. She pushed me to learn more about myself than I ever though was possible, and for that I will be forever grateful. I love you, baby, and with all my heart I wish you the best.

Sorry for the rant but that felt really good to get off my chest. Thanks for reading.",22Sep2018,2
57,And all of them have short hair so like it just adds to the fact (considering they are mostly lesbians). Kms,22Sep2018,0
58,"No one has ever been so cruel to me or hurt me as badly as he has. He's the only man I've ever trusted. I am sick in my soul and to my core and I am forever changed. I prayed to god to make me better and to make me stronger for him. I prayed to God to help me feel secure inside, even when I felt his love slipping away, and I felt couldn't trust him. I've been so confused for so long. I wasn't even sure why I stopped trusting him. When we first started dating, he came to me with such absolute and honest intention. Like an actual knight in shining armor. In my head I called him my king. He told me once that the lord told him to take me. I knew he was lying, but I laughed inside at the thought. I wanted so much for the lord to give me to him. I wanted to be his wife and his confidant and his resting place. He was so strong, so protective, and... I am so lost. He suddenly stopped trusting me. He suddenly began accusing me of talking to people, of lying to him, of stealing, of doing things I never did. ... ... I never did until last night. I never once lied to him. I used to flirt with others some in front of him, to try to make him feel jealous. To try to keep his attention on me. I've been cheated on and left by everyman I've ever known. None of them ever gave me love the way he gave me love. I didn't know it was hurting him. I thought it was playful, because I thought he was so strong. I thought he secretly knew that I needed him and that I lived him twice as much as he loved me. I thought he knew that I knew that he was a better soul and a better person and that I would never have thought of betraying him. I guess I was cruel. I didn't mean to be. I didn't know that anyone could see me like that. That anyone could believe that I was beautiful... ... I honestly feel like I a huge piece of me has died. I feel like there is the gaping emptiness, and that if I am not careful, and if I am not stronger than I have ever been, that empty place is at such risk of being filled with a reckless spirit and destruction. ... This has changed me and destroyed me in a way I can't even find the words to say. ... I trusted him so much. I trusted him too much. I gave all of myself to him... and then something changed. He became to blame me. He exchanged his playful gleeful glances with suspicion and judgment. He began to question everything, and to try to control everything. He began to run. He began to drink. He began to tear me apart with his lips, when he once used to kneel and kiss my hurts with those same lips. He began move in a dark, hurtful, and entitled spirit. He ripped apart every part of my character and of my worth. I've never felt such hate. Even though I knew what he was doing. Even though I knew  he was trying to kill his own love for me, I couldn't stop it. I didn't know why. He stopped trusting me, which made me stop trusting him. I could only imagine that he must have found someone better to love and that he felt guilty. ... Now I wonder if he just began to doubt himself, and I didn't recognize it. It's a tragedy. It truly is. But, I'm glad he ended it. I saw that I could no longer satisfy him and that he was dying. I just wasn't strong enough to end it for him. I was never strong enough for him... He is a mountain of a man. The last of his kind. And I... am an empty trashed soul. I'll never trust again as long as I live. Thank you for showing me that I  can be beautiful. You were the best man I'd ever known. I love you sweet man. I always will. ",22Sep2018,3
60,"Its tough finding worth in yourself when everything goes wrong. I'm a 24M and I have always been very driven and outgoing. I'm currently getting a phd in neuroscience, I played jazz piano, I strive to be in good shape and have good friends. But in the last 5 years I've been diagnosed with rheumatoid arthritis, chiari malformation (neck/skull deformity that needed a major skull surgery, wont ever be the same), spina bifida, horseshoe kidneys, ive torn multiple ligaments including a thumb ligament which is not easy to deal with being a jazz pianist, and its really tough dealing with all this when I know how much its impacting my ability to reach my potential. 
I don't want to sound conceited but its a thought ive always had and never said out loud. But I always imagine how much I could do if I wasnt constantly in pain and being reminded by my body that I should essentially be dead already. ",22Sep2018,6
