,text,time,score
0,"It's so economical, and I can scroll through comments using keyboard shortcuts, rather than having to collapse every parent-level comment to see the next one or scroll through shit-tons of child comments to read a thread.

And I tried to like the redesign.",22Sep2018,9
2,"I got my blood test results before and I feel like they're low. I have a hard time building muscle and I am very skinny. When I was a kid around the age of 6, I noticed I had a very faint peach fuzz and I had hair on my scrotum. I also have had very hairy arms and legs as a little kid too. When I was 11, I had a spurt of hair that grew. But the thing is, my underarm hair is uneven and hasn't grown since, my pubic hair above my penis has barely grown and my voice has barely deepened, my forehead is flat like a womans, my adams apple didn't come out but I experienced A LOT of facial hair growth, more than my peers in school and I grew very tall. I had a beard when I was 14.  Here are my blood test results of my testosterone that I had recently.

&amp;#x200B;

    s Testosterone    8.1 nmol/L (7.6-27.7)
    SHGB              21  nmol/L (15-60)
    S Albumin       H 49  g/L    (36-46)
    Free Test(VC)     183 pmol/L",22Sep2018,5
3,"I was sitting alone at lunch, I don’t eat lunch because I’m self conscious about my weight.So I just sit there awkwardly looking at people who walk by and someone threw a baby carrot at my head I didn’t see who it was but it felt like I hit a new low I didn’t see who did it but I felt helpless that I couldn’t get any justice even for a seemingly small act this ruined my day.",22Sep2018,6
4,"I made a post about my Dungeon Synth musical project (free music!) [here](https://www.reddit.com/r/DungeonSynth/comments/9htgkn/%F0%9D%95%AC%F0%9D%96%9A%F0%9D%96%8B%F0%9D%96%8D%F0%9D%96%94%F0%9D%96%88%F0%9D%96%90%F0%9D%96%8A%F0%9D%96%97_eremite_2018/).

I've noticed that the post varies from 0 upvotes to 6 upvotes, depending on when I reload the page. 

Why does this happen?  How am I supposed to know when my post has been upvoted or not? As a musician, this gives me some anxiety because the numbers do not reflect reality. 

Is reddit lying to me, or am I not understanding this system?  ",22Sep2018,3
5,"I could forget about this misery. I should bus to Quebec and get liquor tomorrow. 

""A 40oz to freedom is the only chance I have

To feel good even though I feel bad""",22Sep2018,2
6,"**TL;DR**

Guys like me try harder than you scumbags and because you get by with your looks and money or whatever you practically shove us in the mud and then steal the girl and give guys like me the middle finger to be a prick while all guys like me get is ""you're like a brother to me"" from the girl we try for AND to add insult to injury all guys like me get for options is the fat ugly girl no one else wants.  Fuck all of you pieces of shit Chad douchebags. I hate you. And to top it off I'm expected to move and be happy for these and people feel I don't have a chpice but to only try and date unattractive obese women cause i have to ""know my place"" 


24 never a girlfriend or been kissed still a virgin never a date No attractive women like me only unattractive obese women like me and that's who people tell me to learn to settle for i hate my life cause of it

5 dating sites and never has an attractive or decent looking woman matched or message me only unattractive obese women or unattractive women do. 

When I go to bars and clubs I get rejected and ignored every time I cant win. 

The women i try for and who i want to attract are Ria Ciuffo from Barstool Sports attractive. 

I get told to aim for girls as unattractive and fat as the girl from youtube Christine Syldelko. 

Big difference in what i try for and what people tell me to get used to aiming for instead of offering advice that would help me attract women as good looking as Ria. 

And if any of my friends saw me dating a fat ugly girl they'd either laugh at me or worse think we're a good match saying I'm as bad looking and as much a loser as her. And if any of the women who rejected me saw me with a fat ugly girl I'd be looking for a bus to hit me. 

To give more context into what people read

 NO I do not hate women.  who I hate are the guys who women choose because the guys who women choose are always the type who have always picked on me and bullied me and then they rub it in my face on how they were able to get the girl I try for


**TL;DR**
Here's a list of all my experiences
1st Friendzone/Rejection ""**SARA**""

The girl i tried for in high school (24) but who friendzoned me is getting married to a scumbag piece of shit. (21) who cheated on her with a teacher She started dating him when me and her were seniors and he was a freshman he was caught sexting a teacher caught on the news and now the girl I want is marrying him and A TEACHER HERSELF 

and now everybody is happy that they're getting married it's like I'm living in the Twilight Zone that people forget that he cheated on her with the teacher and got caught on the news. And the only type of women who like me or unattractive and obese so when it rains it pours. i hate my life and i hate her fiance. 


AND THEN 2nd Friendzone/Rejection "" **ASHLEY** ""

**TL;DR**

Girl i love has a boyfriend and she's in love with him and it depresses me beyond comprehension that she loves him and she will never love me. I'm absolutely fucking depressed. 

Everybody else wants them to get married except me, i fucking hate her boyfriend he ruined my life. I asked girls on here if he's better looking than me and they all said yes he was and theyd rather date him than me. Can anybody give me advice thats beneficial for me? Not advice that only benefits her boyfriend, cause reality is if you say ""If you really love her youd be happy for her"" or ""move on"", that has no benefits for me it only benefits her bitchboy punkass boyfriend.


And again to recap she doesn't love me she loves him nobody feels bad for me because everybody else wants these two to be married already and the only type of girls who like me or unattractive obese girls so I don't get a bright side or a silver lining or happy ending that benefits me all of those is a losing situation for me or I end up with either nothing or what doesn't make up for what I lost out on. 


I told her I love her she rejected me then a week later she had me meet with her only so she can set me up with her fat ugly friend

3rd Friendzone/Rejection **ALEX**

My high school prom date whose a family friend and who i had a crush on for years, she made out with another guy in front of me and fucked him in his car and because she stayed at my place she invited him over to make out with him on MY DRIVEWAY.  

Here's what I look like: 
http://imgur.com/gallery/JBOBmdD

http://imgur.com/gallery/YttrjG0

http://imgur.com/gallery/ygsbgOo

http://imgur.com/gallery/3KA22KM

http://imgur.com/gallery/3kamg
 ",22Sep2018,0
7,"I may sound like an jerk but lord i gotta ask this....How do i stop a clingy girl??? So a month ago  i borrowed a pen from this girl and then she asked me to go to the canteen with her and I’m like sure okay i only agreed cause she let me borrow her pen... and then after dismissal she asked me to go with her again and i agreed, after a month it just got to the point where she clings on me everyday like a monkey i decline her often but she will still ask me again and again to go with her when she goes home,canteen she asks to be beside me during masses and other school trips,  my other friends have also realized that there’s this girl that goes with us for no absolute reason... she messes up my whole life I can’t even sit anymore for the whole lunch cause she kept bothering me... i know her intention is different like she just wanted to be friends with me  but it’s so annoying i want her to stop FOR REAL... even if she’s into me my eyes are set for somebody else, if she just wants to be friends then i will still need her to stop following me like a dog... it’s so annoying... I don’t even know her name since I had no plans on asking her about it.",22Sep2018,1
9,I'm such a pussy I can't do it. I knew someone who would stab their own hand. I just comprehend what kind of stuff they were going throigh back then. I guess I'm just weak.,22Sep2018,1
10,"i know this sounds bullshit but pretend for a second that it isnt beause i need some fucking help here

im trapped by an insane computer and everything in the building goes thru it

it can think

i need a way to make or establish an outer or extra internet connection to make a phone call to the people who can actually help me

this thing controls the entire building tho i dont know how it hasnt found me yet and im pushing my luck using a proxy and itsnot gonna last long 

i need some i.t. person or somebody to give ideas anything

im nowhere near any other buildings or internet sources pls help",22Sep2018,0
11,"Another Friday night, no plans. For the previous 5 years I lived in a big city and had a great life. Lots of close friends, parties every weekend. Living the life. I took it for granted. Recently I moved back to my home state (think small redneck state in middle america) to a small college town to pursue an electrical engineering degree - wouldn't be my first choice  but it was really my only option as far as tuition and convenience. School wise things are going great, however, socially, I feel bored and isolated, like I'm just wasting my youth. 

It just seems so tough to find friends here. It's a university that's not big on clubs, basically the entire culture revolves around frats/sororities, which I feel like I'm just too old to do that (23, not trying to get hazed by a bunch of 19 year olds). I've tried talking to some of the kids in my electrical engineering program, but honestly the ones in my classes who I've talked to have mostly been pretty standoffish, awkward, and/or just plain judgmental (I think some of them assume I'm just some sort of dumb hippie/bro who does a lot of drugs and doesn't belong in engineering, even though I'm actually pretty nerdy and have a 4.0 gpa). This whole school pretty much seems like most people still hang out with their high school cliques, as it isn't really an international school. A lot of people the only conversations I've really had with them is like (""what frat are you in?"" Or ""which high school did you go to?"") 

On top of that I'm always exhausted from studying that it's hard to put in an extensive effort to try to build a social life from scratch.

Honestly I just really need to find me a woman, and I have seen a lot of women notice me, but it's never in a social situation or a good time to talk. Basically all of my interactions with people are in class/labs/etc.. Ok I'll brag a bit, I'm a pretty good looking guy so finding a woman shouldn't be that hard, but I never go to parties or social events anymore so I don't really have the opportunities. So far I haven't gotten to know any woman well enough.

I am a dual citizen of Canada, so I'm thinking of transferring schools, but logistically it could be really tough, especially regarding transfer credits. 

I don't know, I'm starting to just accept that I'm only really here to learn engineering, but how do I cope with this void in my life? 

",22Sep2018,1
12,"I miss in high school when I’d have ancient history class last period on a Friday afternoon.  My teacher for that class would usually just stand up the front and speak the whole time or we’d watch a documentary.
Even if earlier in the day I wasn’t particularly tired, for some reason I’d become so sleepy and relaxed.  [There’s this great short animation](https://vimeo.com/215498188) about trying to stay awake in class and it is ridiculously spot on.
It was like being in some kind of trance.  The final bell would ring and I’d amble, dazed, out of the classroom into balmy weather feeling incomparably content knowing that after 15 minutes listening to my favourite music on the bus, looking out the window at trees and houses blurring together with glazed-over eyes, I could just crash on my bed and feel absolutely fine.",22Sep2018,1
13,"My favorite day of the year, yay 

I love my birthday, somehow I still retain the simple and childish magic of being a little excited about it.

 Unfortunately I’m feeling gradually less of that, but I’m still glad to be completing another year.

It has been a peculiar year, my life is changing continuously in many aspects. Everything is getting shittier, but since last year I’ve managed to, somehow, be happy with myself, or at least not losing my mind because of the problems I’ve been facing. 

That’s it, the cliche birthday and pseudo self pity post. But this is a safe space for that so happy birthday to me! 

",22Sep2018,9
14,"I made a 16 on a test that I studied for today. I’m so freaking trash, makes me wish I was never born. Nothing I do is ever good enough and at this rate, I’m not gonna graduate. Can you all cheer me up?",22Sep2018,3
15,"i went to a friend of mines birthday party couple of weeks ago at his crib. There was loud music, booze, females,the whole shabang. Anyways a lot of my coworkers went including this one girl i work with. Important note she has LDR with her boyfriend (same state, different colleges).

Throughout the party im talking to people, playing beer pong, smoking, dancing just enjoying myself. The girl in question was kinda off to the side just drinking enjoying the vibe, whatever. She doesnt smoke and she didnt dance really. Her friends come later and i end up drinking with them. So here i am drinking with her  and her friends trying to get to know them better. I personally find her friends more attractive than her but that doesn’t change the fact that i talk to them all equally at the party.

Fast forward after the party at work, this girl is all over me. I think her and her boyfriend are going through some shit. I always found her cute but i feel like something clicked at the party where now She always wants to be around me at work. She gets real close and flirty, says shes hates me when i tell her im not closing with her lol. We work retail btw

Anyways why would she switch up after the party. Like we were friendly with eachother before but after shes become real flirty.

",22Sep2018,1
16,"I haven’t had a hard life, but yet it hasn’t been quite easy. You could say I have an abundance of issues, issues that normally aren’t at bay. They are tucked beneath the surface, out of sight and out of mind. On the outside I look perfectly fine. 

When I was 9 my parents divorced. My mother, my sister, and I traveled cross-country to our final destination. We lived in a two bedroom townhouse. Mom was slowly losing her eyesight then. Mom was online dating and bringing guys over here and there. I remember a man named Todd, I was fond of that one. 

I remember a picture of a little girl stuck in the air vents and pulling it out. Staring at her short straight brown hair and blue eyes. I remember the crab apple trees in the backyard and the boys I played with every now and then next door. I remember having a trundle bed and sleeping on the mattress nearest to the floor. I remember my mom poking her head into the shared room of my sister and I and leaving red lipstick on the door late at night. I remember my moms anger issues and how she took any little thing on my sister and I. I remember trying to jump out of a second story window after getting in trouble for not eating my tomato soup and trying to shut my mom out of the room before she whooped me. I remember her biting my sisters leg and leaving a bruise for moving too much when we had to share her bed for the night. I remember being hungry and thinking something was wrong with my stomach because the sharp pains were unbearable. 

I remember my moms date with Jim and how I stayed up late one night to play with her make up and bras. I remember being in her room and listening to their small talk, he was telling her how beautiful her eyes were. 

I remember Misty, his dog, that I grew attached to. I remember us moving into Jim’s house in another town. I remember the wooden bunk beds my sister and I shared. I remember the loud moaning coming from the bedroom, and the porn being left on the television in the living room.

I remember being 11 thinking to myself how I will never live to the age 18 and couldn’t foresee any of my future. 

I remember going over to my childhood best friends house to play brat dolls and jump on her trampoline. I remember my mom smashing the CD player out of anger. I remember soccer practice and sonic kids meals.

I remember my mom and Jim finally getting married. I remember scowling as I walked down the aisle. I did not like this man. I remember my sister and I fighting at the reception and going into the bathroom to fight some more, missing the father daughter dance. Intentional. 

I remember my mom trying to force us to call him dad and if we didn’t she’d get upset and angry. I remember the throbbing migraines at 12 years old that never went away. I remember the seizure due to stress. I remember the relentless chores and strict rules. I remember being put on a diet and having to ask for snacks. I was not an overweight child. I remember the emotional abuse which turned physical from both Jim and my mother. I remember them fighting at every holiday. My sister and I locked in our rooms playing UNO and if we didn’t we’d get yelled at. I hate board games to this day. I remember more moaning from their bedroom late at night and the loud banging and me taking my sister into her closet and turning the pink Disney radio on high to mute out the noise so we could finally sleep. 

I remember calling our house “hell house” and dreading seeing Jim’s yellow truck in the drive way. I remember being so scared of getting yelled at by missing the bus I cried to the admin lady, in high school and ended up having to walk home to get yelled at. I remember the spoon fulls of mayo he forced me to eat as a form of punishment. I remember him trying to play fight me and groping my body as I washed the dishes at night. I remember being told I was worthless and would never amount to be anything but white trash living in a trailer. I remember comments regarding my breast size when I was 14. I remember breaking up with my first boyfriend at 16 because I couldn’t handle the abuse at home and a boy who wanted to sleep with me at the same time. I remember bruises and scars from being pinched and hit when Jim didn’t get his way with me. I remember him coming into the bathroom and attempting to open the shower curtain on me every night. I remember the constant belittlement and control. I remember fighting back and biting him through his army uniform. I remember getting so worn down that I stopped fighting and started accepting. I wanted to be the good child. I wanted to be liked. If I did what my mom and Jim said, I didn’t have to endear any pain. 

I remember walking on egg shells all the time. Getting spanked with a belt until 17 as I’m stripped down in my underwear with my blind mother whipping my back as Jim watched. My mom and Jim were both emotionally abusive, controlling, manipulative, and narcissistic. Jim being more sadistic. I remember being woken up at midnight to clean the bathroom because there was a hair in the sink or a tissue on the floor multiple times a night. 

I remember attempting suicide with shoe strings. Jim walked in and took everything with a string away. No therapy. Nothing. I remember digging my fingers into my arms wishing for my life to end because I was in pain. Every waking moment I wished to be dead. I wanted to die. I hated this life. 

I remember Jim following me to work at 16 when I got my first job just to yell at me for my driving and watching me afar at high school foot ball games to make sure I was being “good”. 

I remember being my moms personal chauffeur since she was blind. My sister being diagnosed with Aspergers. I did what I was told or I got punished. 

I remember waking up late for school one fall morning of junior year and deciding to apply make up. Jim didn’t like that so he made me take it off. I remember slamming the front door shut and yelling “I hate you fucking asshole”. I remember my sister giving me the look because we both know he heard. 

I remember coming home from school and being sat at the dinner table. I remember being told by my mother to respect Jim and that my behavior was unacceptable. I remember her telling me he’s my father. I remember thinking in my head that I’ve never once been respected. I remember his smug look at the table. 

I remember waiting until he left to go to some event to creep into my moms office to tell her he’s been touching me. I was shaking and the words barely could come out of my mouth. But I was fed up. So fucking fed up. 

I remember being sent back to my room and being awoken by the both of them questioning me about my accusation. I remember him denying every single thing. 

I remember being pulled out of school to talk to a detective. I remember court. And court again. And court again. And being locked in my room without my cell phone to study the court documents for trial. 

I remember the resentment and the hate. I can’t remember feeling happy from 9 until 17 years old. I was never happy. Just a servant to my mother and Jim, trying to make them happy so I wouldn’t have to eat that mayo. 

I’ve tried to commit suicide 3 times in my 23 years of living. All unsuccessful attempts. 

At times, I still want to die.

These are the things I don’t tell people about my “childhood”. A childhood that was cut short from abuse that has since fucked me up. I can’t form relationships, I get attached too easily, I’m paranoid and anxious of the worst possible outcome, I’m codependent, and have major daddy issues. But on the outside you can’t tell. I bottle everything up, make sure I look presentable, made sure I went to college and got a full time job, made sure to not turn into white trash that lived in a trailer. 

But yet, I am still unhappy. 

But I’m working on it. Fuck, am I working on it. ",22Sep2018,1
17,"I met this amazing girl at my college and we’ve been practically dating, but it’s pretty early in the relationship, and we’ve been enjoying our initial attraction. I thought I was being as intelligent as possible in striking a balance between indulging in our initial attraction and making myself and her aware that that’s what it is and anything could happen. I really like her and I think this is the healthiest relationship I’ve ever been in, though it’s very early to tell and I’m going off of how I perceive her and myself. I forgot about one thing.

At first I wanted to make a reddit post about just her and how amazing she is when we were a little deeper into our relationship but I left someone behind.

I live in Orange County for college and I used to live in NorCal, far above San Francisco. I’ve had this internet friend who lives in central California and we’ve been mostly platonic. Mostly.

Recently, I had been getting more affectionate with her after she told me that she was attracted to me due to our intellectual conversation (she’s seemingly sapiosexual/asexual). I knew that we wouldn’t work due to her asexuality but I also had my doubts as to if she was actually asexual or if she had never explored that aspect of herself. We’ve been affectionate before but it fizzled out. I wasn’t going to take any bets of her sexuality because that’s simply ignorant. I was only taking hopeful variables in and running with them.

Without thinking, I became affectionate with her and I even told her I love her. I don’t remember doing this, but it’s not something she would make up. I would have remembered saying it if I had the emotion behind it to back it up.

I told her I didn’t mean it, and that even though I liked her, I didn’t love her. If I had stayed with it love might have developed. But it didn’t, and I hurt her. She’s such a good friend and we benefit each other and learn from each other in talking about our interests. She’s helped me with college stuff and I’ve helped her emotionally. But now I’m the cause of her pain and I feel terrible. I fully admitted to my faults and apologized and that’s all I can do. I valued this friendship and I severely damaged it because of my actions. She tells me she’s even more hurt because this girl is “a prettier version of her”.

Clearly I have some thinking to do.

I don’t feel bad about this new relationship. I know I deserve it and the person that I’ve developed into can handle this, whether it works or not. My past relationship was toxic and being where I am, location wise, spirituality, and career choice(music), I’m happier than I’ve ever been in my life without relying on the approval of others. I was happy even before this started and I feel as though my life is getting better and better, aside from financial stress. I feel like my own person. I’m glad to be where I am but hurting someone just hurts.",22Sep2018,1
18,"I think a big shift is coming. With all the push for AI and 5G rolling out, I think within the next five years we're gonna have a shift in society. A Facebook level shift. A change big enough to make our day to day lives right now feel antiquated. I just needed to have this written down somewhere.",22Sep2018,1
