,text,time,score
89,I am a college student very close to graduating and the demands of the semester are just piling up. I also work part time and they are giving me tons of hours despite my requests to schedule me less. I also have ptsd and depression and have been struggling a lot lately. This has in turn made my health issues much worse. I have pain in nearly my entire body and have to go to the doctors a lot for tests and appointments to try to figure it out. I just don’t know where to go from here because I need to graduate and need to work to pay for bills. And I also need to figure out what is wrong with my body because I can’t live in pain all the time.,16Oct2018,1
90,"Hi, I just need a second to vent. I'm Bipolar and have PTSD's. People tell me it's pretty obvious in how I carry myself. This week I've had two separate people intentionally escalate situations to try to make me throw the first punch. My room mate (the more pressing concern) has almost definitely stolen from me in the past and I confronted him about it and he kept gaslighting me, saying he stole more than I suspect he did. A few days ago, hee told my neighbor that he is trying to start a fight with me on my birthday this weekend.  He kept yelling at me from his room so I came to his door, then he started screaming to get out of his room, so I left and he came out and kept standing in my face, but clearly not using his hands. At one point he just kept interrupting me without saying words and making sounds like he was (sorry) retarted.  


I can't report him because he's only stolen weed. He knows I'm only here for a semester and his actions feel like he's trying to ruin me before I graduate. I'm extremely angry and have been going outside all day to try to walk it off. Anyway thanks I'm sorry this is such a mess",16Oct2018,1
91,Can anyone advocate for a specific over the counter medication? I'm in the U.S and I have no experience with them. ,16Oct2018,1
92,I don't talk very much to people I'm not comfortable with and when I do I feel very awkward. It seems to be affecting me in the workplace I never fit in apparently and things never seem to work out. I have been through quite alot of jobs as I don't have a bubbly personality or just don't fit in. People don't want to be friends with me other than a couple of people as I don't talk alot. I don't know whether there's something wrong with me or whether I'm shy or an introvert. ,16Oct2018,1
93,"My friends boyfriend died via suicide in May, and shes obviously having a hard time with it. She told me today she doesnt want to be alive, and that even though she can see the good parts in life she feels like because of the contrasting sadness isnt worth it. How do I help her? I know time is the best thing, but there has to be something to help in the meantime right?",16Oct2018,1
94,"I'm in a very difficult situation. I can't seem to bring myself to ask my parents for help. Is it normal for them to get irritated at me if I do ask for help? How should I react when they do get irritated and lash out at me? I had an attempted suicide in May, so I can only imagine how they will react, with anger that I'm not only going backwards, but asking for their help again and support. They are supportive but can lash out any minute which will make me realize I'm a burden on them, and will be a burden when living with them again. Idk, maybe I am just thinking that because I have no children, I am only convincing myself that they don't want me... I'm all fucked up please help with some insight. ",16Oct2018,1
95,"25 f. I know I have bad anxiety and have delt with depression throughout my life. I'm getting so anxious at work now that I'm stress sweating and its affecting my performance. I wanna just live a normal life and be able to go to bed without my mind racing for hours. I wanna be able to handle things on without my anger-anxiety taking over making me feel like breaking something or screaming at someone. 

So my question is what do I do now. I know I have a problem and I know I need help but do I just tell my doctor, should I try seeing some sort of therapist? I'm all for being medicated, I've tried xanax but it makes me dizzy and tired. 

What if I bring up my anxiety that presents as anger and my doctor calls CPS because I have a 2 year old. I have learned to control my yelling and we dont hit or spank him ever but I'm so scared. 

I've never been suicidal but I guess I have thought about it. My son keeps me from going to that place. I guess my brain likes to play with that idea. 

I could go on and on (haven't I already though??) I just need some guidance. If you can help feel free to message me or comment. ",16Oct2018,1
96,"Early today I made some comments I have been so ashamed I even deleted them, I don't know what the hell happened, that is not who I am, why the hell did I write that?

I have found no reason, I mean, I had a stressfull day but the hell? I don't recognize myself, I easily realized that was not who I am but kept them as I don't think deleting something I said is good. But at this point I just had to.

Had a similar incident the other day, lesser,  am I turning into an idiot or an asshole? I really don't get why I have wroten some things that are far from my personality.

I am feeling really depressed because of this more than I usually would. I feel really confused as there has never happened something like that. I have had some issues but I have know then for a long time this doesn't seem related to them.",16Oct2018,1
97,,16Oct2018,1
98,I’ve been taking 150mg of Wellbutrin twice and just got prescribed 5mg Zyprexa for anxiety. Had anyone taken the combo before? Will my chances of weight gain decrease with Wellbutrin?,16Oct2018,1
99,"I have been taking a new ssri (Zoloft) and the doctor prescribed me .5 Ativan to take it as needed until I get used to the new medicine. I have been having really bad anxiety and depression since Ive started and have been taking the ativan everyday for around 2 or 3 weeks. A few days I didn’t take the ativan I self medicated with alcohol instead. I have run out of the ativan and feel like absolute garbage, my anxiety is so high and I just feel terrible. I don’t have any physical withdrawal symptoms however I am feeling severe rebound anxiety. Do you think it is possible I am addicted already and withdrawing even though it has only been a few weeks. My psychiatrist has assured me that I will not become dependent on the ativan because he only gave me it for a short period of time. Helppppp ",16Oct2018,1
100,"Well, it took me a couple of weeks (or even months) to convince myself to write somewhere so here it goes...

I am a college student in my mid 20s and this is my last semester. I have only one class left so I can work 4 days a week. I have great parents and sisters, and I love my work (I am a programmer), I have everything I could ask for, so I don't really have anything in my life that I hate or really dislike. 

But still, something is wrong. I dwell on the past.. a lot, and I don't understand why. I still really miss the couple of people I met in high school and don't speak anymore even though it's been five years. I get nostalgic really easily and I guess it wouldn't be a bad thing but while most people smile when think of the 'old' times I always feel like I could cry and I would do anything I can to go back in time. I can sit in front of my computer or lie in the bad at night and think about the past and the people. And it would all be fine, but when I am thinking about these things I get incredibly sad. Thankfully it almost always happens at home and at night, but it happened at work and I just stared at the monitor for a couple of minutes until I pulled myself together and got back to work. 

And the worst thing is that I can get nostalgic by anything. I just heard Otherside by Red Hot Chili Peppers 2 days ago for the first time and I know I should stop listening to it, but I know I won't. (music I used to listen to or generally sad music can easily make me sad. And sometimes this is the reason I start to listen to it, I don't know why)

This whole 'process' happens randomly. It may not come up for months, but it can come up every single day for weeks (like now). I thought it has something to do with my free time but it doesn't because in the last two months I either work, study, sleep, or write my thesis, so I don't really have free time and it still gets me. 

My only idea is that while I was in high school I always had someone I really cared about, someone who really cared about me, or just a friend. And now I don't have anyone. The only person I talk to (besides my family) is my coworker, but it's mostly programming related stuff. 

&amp;#x200B;

As I mentioned above this is something that happens mostly at night. When I wake up in the morning usually everything is fine, so I guess I can live with it (so far it's been 4 years) but it would great not to feel like sh\*t this often. Or somehow forget the past.",16Oct2018,1
101,Can anyone give me an advice on how to help my partner who is going through secondary traumatic stress because of my sexual assaulted story. We’re from South Korea and don’t know any good doctors here who could help us. Any advice would be greatly appreciated. Thank you. ,16Oct2018,1
102,It's to end it all,16Oct2018,1
103,"Can an employer refuse me a job when I use to work there but had to leave due to severe anxiety (I was having 15-25 anxiety attacks a day). On my last day there, my supervisor told me I would be welcome back after I got the help I needed. I am better now and tried to get my job back, but they're saying no because I left without giving notice. Now I just found out that someone who worked with me, and is a friend, who left under the same circumstances I did,  was welcomed back while I'm still refused. Is refusing me the job legal? 

Just wanted to point out a few things. First, the company I worked for is a Japanese company but operates in Canada.

Second, There is a way to send a letter directly to the president of the company. Should I ask one of my friends to deposit a letter on my behalf? ",16Oct2018,1
104,I’ve only just joined this sub but I’m struggling to find things to help myself at the minute. My diagnosis is depression and GAD with symptoms of psychosis (the latter only happens when I have high levels of stress and are very random). I’ve been to counselling twice once when I was 13/14 for bad self harm and again last year when my mental health really started to decline again. I’m prescribed sertraline but have stopped taking it because it doesn’t help. My mum has suggested these herbal pills at least I think that’s what they are. Just wondering if anyone else has tried these and what’s their experience with them? ,16Oct2018,1
105,"I was prescribed geodon and took it for two weeks straight. A week ago, I stopped taking it and I didn't have any withdrawal side effects. This morning, I took it with my breakfast as instructed. It was the worst experience I have ever had in my life. It only lasted for about an hour or two, but I was freaking out like never before. I actually thought I was gonna die.

Has anyone else had this side effect? 

I'm not taking this damn medication ever again.",16Oct2018,1
106,"I don’t know if this is a rant or a genuine question but life really sucks for me, it has for the past few years. When I was 12 I became really ill with a brain condition, I missed years of school whilst I was in and out of hospital having different treatments, tests and medications. I almost lost my eyesight, thankfully I didn’t but I have really crappy eyesight now. I didn’t get to experience prom with my friends because I was in hospital, I didn’t get to graduate school or go to college. I developed anxiety and depression which turned into another battle for me to fight, I couldn’t leave the house at one point. I got told by six different therapists that I wasn’t helping myself. I experienced three different car accidents that left my mum with a few back problems. My mum is now almost wheelchair bound with fibromyalgia, metatarsal adductus, a torn disc, arthritis and Morton’s Neuroma. I’m currently her carer. I accidentally found out that my mum miscarried three years ago, she doesn’t know that I know. At the beginning of this year my grandmother passed away. Yesterday my beloved dog died and today I had to watch my life long neighbour get wheeled away in a body bag. I’m so close to slipping back into depression, I need something good to happen but everything is just going downhill and fast and I don’t know what to do anymore.",16Oct2018,1
107,"For financial reasons I had to stop seeking therapy (for now), and for other reasons I won't be able to physically go to therapy for two entire months. 

&amp;#x200B;

How can I cope? I havent seen my therapist in two weeks I already feel like I'm falling apart. She was kind enough to check on me today but I'm so anxious about being on my own with my thoughts.",16Oct2018,1
108,"So, I have mental health stuff and sometimes I just can't handle friends who are coming to me with their mental health problems. But, honestly, I have no clue how to tell them that I just need a day or something? If you were wanting to talk to someone about your issues but they weren't capable at the time - what would you want them to say?

I guess for me, I sort of keep it to myself or talk to my therapist about it. There are some instances where a friend might ask if I make a comment about something bothering me, so I have no clue what I would want someone to say to me in the instance I speak of.

I want to be there for them, but sometimes I just feel like the things they are telling me would be better for them if they were telling it to their therapists.",16Oct2018,1
109,"I feel like I'm literally living day by day. 
My life is the best it's ever been.
I'm 22, I have my own place, I'm getting a car soon, I have a full time job with killer benefits, I have a fiance and a 3yo son, I haven't been hospitalized in 4 years, Ive been ""safe"" for 2 years.

Yet I feel like I'm living day by day. I used to love making plans for the future but now anytime my fiance wants to talk about plans (even a weekend in advanced) I half assedly agree as though I feel like I won't be there for it. 

I have disassociation problems, but it feels like more than that. 
The only future plan I'm holding on to is my ECT that I'm waiting for. (Doctor has to send over some more paperwork to where I'm getting it done) 

I feel like at any moment once the day is over there won't be another one. 
I'm not sad about it either. It's just kind of ""ok"" to me.

I don't know why.
I've been in therapy for 15yrs I've been on meds for 15 years (many different types but the current ones for the last 3 years) 

It's scary I think but I'm not sure about it. I feel apathetic about it and yet the same time concerned about it. ",16Oct2018,1
110,Do I have bipolar i dont know how to explain how I feel right now I always have different moods every single day like I am happy then im sad again then im sad for the whole month I always feel empty and sometime I have the excitement to do something and then i just dont wanna do it anymore my mood changes really quick like I feel sad then im happy then im sad then im happy again recently i woke up from my sleep i was like im gonna start a page about curly hair i wasnt even passionate about it but i did it any ways after two days i closed the page on instagram. i get annoyed easily i get annoyed by people breathing or coughing or sleeping Sometimes I wanna stay alone the whole day and sometimes I wanna go out with my friends but when i do i wanna go back home again I just dont know.I always have these crazy ideas like i wanna open a business or start an app all of a sudden that i dont know anything about then after a month i just dont wanna do it anymore because I suddenly lose interest. And also whenever im with my friends I always smile and laugh then suddenly im quiet my friends always tell me why do you suddenly get quiet my teacher would also comment that I would be quiet for 5 min and suddenly turn crazy.. and whenever I think about my buisness idea im like omg ill be the biggest person ever and so famous and literally after a week I lose interest.,16Oct2018,1
111,"Growing up, I have wanted to always have great success in wherever my passions took me. I remember playing with spaceships in elementary school saying I wanted to be an astronaut, making potions out of dish soap wanting to be a chemist (or really a wizard lol), or even take apart electronics and mess with them pretending to build something. This tapped into a big part of me and inspired me to become comfortable in the unknown, to always try new things, and to challenge myself. 

&amp;#x200B;

Now fast forward 15-20+ years and I am a in debt/broke college student who has been going to uni for almost 7 years to get my BS. I am procrastinating on every ounce of homework I have, I go to therapy for depression and anxiety, and I am living life miserably. I never work on my craft as a programmer unless I am slightly inspired OR I have to for school. I spend most of my days sleeping in my bed, playing video games, watching YouTube videos, or lounging around in a paralyzed state. Something I know about myself is that I have this inside fear of success. I have passed opportunities to apply for internships at tech companies, I don't push 100% on my projects, I usually give up any diet that I go on, and my life is almost empty because I allow this fear to control me. How can I not fear opportunity in my life? ",16Oct2018,1
112,"I am lazy day in and day out and I can’t seem to conjure the energy to do much. I’m 19 and living at home, I work at as a busser at a local restaurant, I don’t go to school (I tried attending community college but I failed all my classes). I did okay in high school, I used to workout everyday I used to be consistently happy. Now it seems like I spend all of my time on my phone, browsing instagram, reddit, snapchat and youtube. I used to go hiking regularly with friends and now I don’y really have the motivation or will to. I even had an amazing girlfriend. It’s all about my phone now. I wake up and look at my screen. At night I lay in bed for hours on my phone. I hypothesize it’s because I don’t have much structure in my life to keep me busy. I would rather lay in bed all day, than go outside. I used to be the complete opposite. I’ve come to hate myself for letting myself get to this point. I want what I used to be, fit and energetic and lively and POWERFUL in life. I just feel stuck like in the movie Get Out where the guy in trapped in his own head, hopelessly searching for a way out. Maybe I need to see a professional, that might help.",16Oct2018,1
113,"  

Hi everyone, my name is Claire Brooks and I am conducting a survey on the patient experience in a mental health context: [https://peopleblogspot.com/study](https://peopleblogspot.com/study). If you have consulted a Mental Health Professional, please take 15 minutes of your time to make your voice heard.

I am an independent market research professional and I'm doing this study pro bono, in conjunction with a UK-based charity called the World Dignity Project ([http://theworlddignityproject.org/](http://theworlddignityproject.org/)). The results of this study will be used to open up discussions with Mental Health Professionals about how to create dignity in patient experience. Thank you.",16Oct2018,1
114,"Everything was great. 'I love everything about you' ' I love how kind you are, i've needed someone like you for a long time'' 'No, I love how long our messages are, it just shows how much we love talking'. These are some of the sweet things he said to me. We were obsessed and inseparable.  He got depressed because of uni and stopped communicating. I'm not a high maintenance girl but he wouldn't' reply for 24 hours and he would say it was because he was sleeping because he was so depressed. (I do know for a fact his depression is real because he was late to work and slept in all the time and was failing his exams, cheating did not happen) I tried to communicate with him and asked  if it was me to which he replied 'no, I love that you're here, i'm so glad i met you' Then I notice that he has emotional capacity for everyone else apart from me but did not want to stress him out too much, but i decided to ask him the next time we met. Fast forward a few weeks, i was going to sit him down and talk with him, before I leave  my mums husband died right infront of me and theres was nothing i could do. I was really  shook and struck. I went to meet him because I just needed a bit of support to which He said it wasn't a big deal and that i'm too sensitive. Later that day (yes that day) he broke up with me. All very very sudden. (the whole decline went down very very quickly and I could tell it was his depression he was almost projecting on to everything. He then said it was his depression and I was very sympathetic. I was taking things well and then he says 'yeah it's your personality as well' 'You're too kind and a yes man' Shocked i asked why and he said ''you pretended to know who that actor was just to agree with me.' I was VERY confused, seemed very minor and petty. A few days before that he mentioned an actor, i said i didn't know and then i realized who it was and /i had mixed him up with someone else. 'That's not how I see it though' 'he said. This confused me as it was a really simple conversational utterance that he managed to twist in to that. ' j'Your messages are too long' he also said, when i already asked him weeks previously if our messages were okay (because they were quite long).I reminded him that I asked him and he said ' I don't remember that' How convenient. He never once communicated to me any issues  when I asked him. He twisted everything about me and told me I was too kind, when I called him out on it he said 'It's a mixture of everything though. There's too much going on with my friends. I always put them first before any relationship.' (His friend was going through a rough patch but she was doing okay). This made me feel like shit. 'I'm finding it hard to balance everything, I'm really numb and depressed' I empathise and then say that THAT does not give him an excuse to twist my character. He then accused me of nitpicking, even though he was over exaggerating very VERY minor things about me in to something I didn't even recognize. He then comes out with ' You never decide where to eat, you just go along with me' When in actual fact I said that i'm a girl who will eat anything and that I don't mind. I always let him choose because he was abused and bossed about by his EX and I was just gentle with him until he got used to me 'Well that's not how I see it and I'm sorry you don't see yourself that way''......... In other words he was right and I apparently don't see myself correctly. He knows I have depression and anxiety too and sometimes I got worried about him and maybe things might've looked one way. This convo went on for 20 mins and the he just fucked off and went a drink with his friends... Later that night I found out he had been liking pictures of other girls on his tumblr. I called him out on this and he gave more excuses and then he said to me 'it's right person wrong time, message me'. he would also say things like 'You just need to get over this' 'what do you even want from me' I also called him out because literally 3 days before we broke up he was still kissing and touching me. For weeks we did not talk and his sister started giving me abuse and I just don't know whats happening anymore. I'm very depressed. He turned on me so quickly and not I hate myself for being a nice person. He also said that he jumps at the first sign of happiness and that is why... but he said weeks previously that I made him happy. whenevr I called him out on his lack of respect he would always use his depression and that he's trying to be selfish. He then said I was putting him on a pedestal but I was just trying to cheer him up .I was nothing but patient with him and he just turned black and white on me.",16Oct2018,1
115,I’m just wondering if it is or not. ,16Oct2018,1
116,"So I have like major tinnitus. When it's dead silent, there's a constant ear piercing scream in my head. This will probably never go away unfortunately. No idea how it even happened. 

But lately I've been freaking out about it big time. Panicking in the middle of the night when I can't sleep due to the noise. Like, almost to the point of a panic attack.  

I have no idea how I'm gonna live with this the rest of my life. I'm fucking 23.


I don't even know what I expect anyone to say, I'm kinda just here to vent... 


",16Oct2018,1
117,I was recently prescribed 50mg of Zoloft. I take 50mg of Diphenhydramine to fall asleep. Is it safe to mix the two ?,16Oct2018,1
118,"I'm in quite a bad depressive episode at the moment (Not suicidal or self-harming though). All I can think about is my own depression. It's distracting me from everything and I'm now incredibly bored. It sounds like such a stupid and vague question but what am I meant to do with my life. Like, there's 24 hours in a day. All I want to do is eat and sleep, what do I do with the rest of the time?",16Oct2018,1
