,text,time,score
0,"A constant haze has loomed over over me the last few years of my life and I feel that it has consumed me. I never truly feel happy anymore, only temporarily distracted from the thoughts in my head. I think that I am not a real person but rather just someone dragging their feet through a meaningless existence. I remember so fondly the days where I could just exist and be happy about it, but now I’m constantly looking at my life under a microscope and feeling as though I’ve done nothing. My eyes never feel fully open and I’m constantly just waiting for the next thing to present itself with no real direction in my life. I don’t have the energy to put myself out there and I don’t see myself changing anytime soon",16Oct2018,1
1,"My friend and I have a blog up with where we write to each other about our struggles with mental health. If you're down and feel like relating to some online strangers, here's a couple of our posts!

[Welcome!](https://wordpress.com/post/nicoelle.wordpress.com/19)

&amp;#x200B;

[Why relapse?](https://wordpress.com/post/nicoelle.wordpress.com/51)

&amp;#x200B;

[Insecurity/ Decision-making/ Anger](https://wordpress.com/post/nicoelle.wordpress.com/62)

&amp;#x200B;

[Gratitude is an attitude.](https://wordpress.com/post/nicoelle.wordpress.com/162)

&amp;#x200B;

[Two Different World Views](https://wordpress.com/post/nicoelle.wordpress.com/286)",16Oct2018,1
2,"I hadn't even been at work for 30 minutes yet and I ended up in the bathroom unable to breathe and just...lost. I've been off of any type of medication for close to 2 years now and I had been doing so well. I went through a divorce and had some inpatient treatment, but haven't had any major issues in a very long time. I'd had trouble sleeping last night and came into work really anxious. Some things snowballed after I clocked in, and it just overwhelmed me. I feel ashamed and embarrassed. My coworker came into the bathroom after I didn't come back out for awhile and tried to help me as best as she could, but it just had to run its course. I'm worried they'll come back more frequently now afternoon that terrifies me. 

For anyone who's had this kind of ""relapse"", what can I do to prevent it from happening again? ",16Oct2018,1
3,"I've known for most of my life that I struggle due to childhood abuse (physical/emotional, not sexual). I've gone through depression, out of which I lifted myself temporarily but am now settling back into due to anhedonia.

Recently I discovered I also experience dissociation, probably due to the CPTSD caused by the abuse which went on for about 20 years.

Add to that I'm completely anxious-avoidant, again due to the abuse, and what I once thought was a strong committment to ""never be fucking fooled by anyone again"", which simply put means I cannot fucking trust anyone.

Including a therapist.

Okay. Now that I'm in a place to start working on this again (because it's not possible when I feel raw from having to admit all of this in the first place), and therapy is simply not an option--if I have to spend even a month trying to explain all of this to anyone, I will scream, and quit. I do not wish to take the chance of being bullshitted **again**.

I can explain it all to myself because I know *myself*.

If you were me. Which side of the whole thing would you tackle first?

Has anyone seen any group sessions for people who are just hopelessly fucked? I think I can deal with just being around other people and talking about everything in bits and pieces. But if it's me in a room with a therapist, I will get confrontational, it will not be helpful because I just cannot trust *at all*.

I'm doing some suggested reading on the side but I'm also very isolated. I need a way out.",16Oct2018,1
4,"So I’ve been having a hard time these last couple of months, and trust me I’m no expert in the field so I came here. I have these times where I get really paranoid like “something is literally going to kill me if I go in this room alone” or “if I turn off the lights”. Also any foreign noise can trigger this, and it seems so silly when I look back on it. Mind you these bouts are usually short lived, and only occur when I’m relatively alone. I’ve seen movement in the corner of my eye where there should be nothing, and this can also trigger it. Another thing I’ve experienced that has just developed recently, is the feeling of detachment. It feels like I’m not in MY body but a foreign shell of that makes sense, and my vision can slightly blur during this. I’ve been feeling less drive recently too, just not wanting to go to work, or go out. I’ve looked into psychosis? That seems very extreme though and not like what I’m experiencing. Thank you so much in advance for any help.",16Oct2018,1
5,"I’m a freshman at uni. and I just feel like I’m lost right now. For some reason I just feel like I’m not going on the right path even though I know I want to study business and get into real estate, I feel unproductive when I’m not making money and learning about my craft but I have no time to get a job as I’m in a fraternity and I’ll have to wait until second semester to get a job. I love helping people and traveling the world and I love real estate and being productive and making money but I just don’t know if I’m on the right path and just feel lost and empty. Any help or advice would be greatly appreciated",16Oct2018,1
6,"And I’ve felt this way pretty much my whole life. I’ve always struggled to make friends, it’s even harder keeping them. It seems like most people forget I exist pretty quickly. I’ve tried to join communities online but it’s the same there too. I don’t really have friends and it’s been that way my whole life and it’s just getting worse the older I get. I don’t see a point in trying anymore, it’s not worth it, but I so desperately wish I fit in somewhere. And I never have. I don’t know how to, I don’t know how to fix myself to be more interesting and less forgettable. ",16Oct2018,1
7,"I was told by a counselor once that this is something that I suffer with. I obsess over something, trivial to others, not decision exclusive, thoughts too. Over thinking and over analyzing my thoughts, fears, situation, decisions,  everything so much that I become paralyzed. Literally not able to do anything. It is so mentally exhausting. 

Anyone else heard of this? ",16Oct2018,1
8,I've been feeling so alone recently even when I go and see my friend I'm still so lonely I want to ease the feeling because I can't do anything with the sheer amount its weighing me down,16Oct2018,1
9,"I really should make a throwaway for this post but I don’t care right now. 

I don’t know what to do. I feel like I keep driving people away? I’m (24M) married to a wonderful wife (24F) and have been with her for 7 years, married for 3. We love each other to the end of the earth, and both foresee that never changing.

We moved across country for my work shortly after getting married, and have always been introverts. Finding new friends wasn’t our top priority. Lately we both started feeling too shut in and wanted to branch out and meet friends. The wife got a job at a local grocery store and is already talking to a few new acquaintances. And I have started to open up to people at work. I just transferred and it’s a whole new set of people, so I felt it was a good opportunity to make new first impressions.

I’m good with first impressions, but when I find someone that expresses interest in reciprocating a friendship, I open up too much. I’ve had three friends in a row start off great. Chatting all the time. Both sides instigating conversations. Stuff that makes me feel less lonely. But then I say too much.

I’m not going to say my life is horrible and I’ve been through the worst events, but it’s not been easy. There was a custody battle when I was 6, which made mom disappear until I was 12. My loving stepmother whom I regarded as my emotional mother, died suddenly when I was 16. My aunt and cousin were murdered when I was 18. I joined the military when I was 19. My paternal grandfather passed away while I was still in training. Last year my very close work associate passed away extremely suddenly after work one day from a heart attack. The following day my wife’s childhood dog died in a car accident, and I couldn’t be there for her. Then the next week my maternal grandfather died. That was about a year ago.

I guess I come with emotional weight? I’m not sure how else to put it, and I’m not sure what to do. Maybe I’m just writing all this to put it out there. I don’t know. I just don’t know what to do.

Sorry if there’s any typos. I don’t feel like going back and proofreading this.",16Oct2018,1
10,"With no outlet i just pent up my misery. 

I hate seeing people dislike me more and more and that is what i saw today. First day they were always quite ecstatic to see me bht for the last two weeks of school they just dont like me respond blankly.

They just, act different and i know its because i was obnoxious in class. I mean big surprise, i hate myself and so they would probably have eventually hated me anyway. 

Honestly i feel like im meaningless? I mean as a student, i really havent accomplished anything. I have no close friends which is why i ahve to go on here. I have no one who texts or talks to me after school beyond hw chat groups. I can tell people i hate myself, i want to kill myself, but i know for a fact kids at my school would either take it as the common joke or find me annoying.

I tried for a month. I really did try to just not show the negative parts of me! Bottle it up until home. It didnt work.

No one to talk to , no one to go to. I don’t want to waste parent’s money so i can socialize and tell people how i feel. I already owe them so much. I m so alone and honestly it feels like my soul has retracted deep into my body, miles away.",16Oct2018,1
11,"My obsessive thinking has gotten extremely bad as of late. I feel trapped in my head and can't take it anymore. I have the compulsions under control, and have started therapy, but i'm out of options for the obsessions and I'm going to the Doctors tomorrow to hopefully get prescribed. 

I've heard some really good things about medication and OCD.

Anyone have any luck with them?",16Oct2018,1
12,"Hi,
I am 30F from the US and I think about dying in one way or another all the time and cannot turn it off. Either I imagine myself dying in an accident (least common), getting tortured and/or murdered, or killing myself (most common). This will come up several times a day, really any time I am idle and thinking. I could be feeling super happy and these thoughts are still right there alongside the happy thoughts.

Sometimes I watch it happening in my head like a movie. Sometimes it is just my thoughts with no pictures. Sometimes I will say aloud to myself ""kill yourself"" just out of the blue, not even thinking about anything which is probably the most upsetting of all the ways these thoughts come to me since what if someone hears me? I can't just say ""oh sorry I was just talking to myself!""

I almost never think of any harm coming to anyone else, only if they are no shows/very late to something I will start worrying that they were hurt or got in an accident.

Even if it is a constant thought I have never tried to kill myself and I don't really consider myself an immediate danger to myself. Maybe more of an abstract danger. I don't think this is normal thinking?

I am going to see a psychiatrist soon when I find one with my insurance (currently emailing for some leads), and I see a therapist every other week. I am not taking any medications right now but I have tried four different ones in the past couple years for depression/anxiety (did not notice a difference) and hope to eventually find one that works for me.

Sometimes I get a questionnaire or they ask if I have had any suicidal thoughts recently but I always say no. But I think I should be saying yes since I think about it almost all the time. Should I say yes when asked, or bring it up myself? What could happen if I say I have these thoughts? What should I expect to happen? What kind of help can I get? Do you have any experience with this?

Thank you for reading!

tldr: I have suicidal thoughts but not sure how to bring it up or what to expect if I indicate that I'm thinking about suicide",16Oct2018,1
13,"Back when I was about 15 years old I went through an extremely bad bout of depression. During that period I started to get intense urges of just wanting to hurt people. I wanted nothing more than to assault one of my closest friends and just beat her until she was a bloody mess. I would think every day about shooting up my school. I would dream of raping and beating small defenseless women. And this would be constant every day. I would obsess over various girls in my school and dream about just beating them to death. I even went through a period when i stalked a 13 year old girl over the internet and would coax her into sending pictures of herself (nothing illegal although morally questionable). Now i'm 19 and it's only gotten worse. Almost every time I see a girl all I can think about is raping and killing her. And I've gone back to stalking that same girl (although shes 16-17 now) and slowly losing my mind over it.

&amp;#x200B;

I'm not a bad person. I always do my best to be nice to everybody. I've done charity, I hold doors for people, I'm always friendly, and I don't even have any criminal record. I've never hurt anybody before and I don't know why there's this evil inside of me that feels the need to get out. I'm worried that I eventually won't be able to control it anymore and I'll do something awful. I'm also worried about going to therapy because I don't want to be sent to the police or put away to a mental institution because then I could lose my job. I really just don't know what to do.",16Oct2018,1
14,[Great video](https://www.youtube.com/watch?v=HX9oyrB5EQw) about an art program for people living with mental health conditions based in Connecticut.,16Oct2018,1
15,"I’ve recently have been through a tremendous amount of situations and problems and everything has died down now. The only thing that seems to be a problem is that I’ve been crying at random times, but I’m not feeling anything. I feel so numb, but I cry and I cry with nothing going through my mind. 
I’ve also recently just started living completely alone for the first time in my life: waking up alone, sleeping alone, eating alone, etc. I’m not sure if what I went through or me being lonely is the cause of these constant and random numbing breakdowns.",16Oct2018,1
16,"Hey! My name is Scar and I'm 17. I was recently diagnosed with PTSD, have been diagnosed with general anxiety and moderate depression, and am currently on watch for borderline and bipolar 2. I have a history of self harm and panic attacks, suicidal thoughts type things. Obsessive thoughts are very common for me, I find something, anything that ive done wrong and spiral down a hole of thoughts that I cant stop to the point of going into flashbacks about my abusive past. Ive looked into PTSD before and didnt realize that thats what was happening, and now that I'm aware ive noticed it happens and has happened on a very regular basis, I thought it was normal, I guess. but I'm getting worse with everything. I cant sleep as well, panic attacks have been happening more, urges to cut have been happening way to often (but im 8 months clean and plan on keeping it that way). I broke up with my boyfriend over playing ps4 with one of his friends, whos name made me have a flashback and a panic attack, and haven't spoken to him since. I almost quit my job and have been getting increasingly irritable. it sucks and I dont know what to do, I cant talk to anyone I know about it, and only see my therapist once a week, due to anxiety I cant call her without freaking the fuck out, same with people in everyday life, so here, I turn to reddit. ",16Oct2018,1
17,"I'll cut right to the chase since I don't want to waste your time:

I'm a 16 year old Junior in high school. My parents signed me up to be evaluated and if I tell what I really am and have been feeling, they'll lock me up for sure. I don't want that to happen. Sure, I may have not made any friends since 3 years ago, the loneliness is killing me, I have zero self esteem, I am paranoid, I have constant nightmares, and am starting to feel more and more aggressive towards everybody, but I don't think I belong in a mental hospital. Then I'd miss school and then the colleges would hate me for that. 

  
So what do I do? Do I cheese it and just pretend nothing's wrong or should I spill the beans and face the consequences of my horrible actions? Or is there another way to work around this? Please Comment I don't know what to do. ",16Oct2018,1
18,Dwelling on the negatives ,16Oct2018,1
19,"I noticed this earlier in the year (back in the spring) when a family member passed away, I just felt very.... empty. I was expecting to obviously feel upset and what not but I just felt kind of numb and empty.

&amp;#x200B;

During the summer I didn't really have that feeling anymore. Maybe it's because I was back home and working, but anyways, fast forward to September (back in college, away from home), and that feeling of emptiness/emotionlessness has really hit me hard. I noticed it on the first few days of classes - usually if I don't know anyone in the class I'll introduce myself to whoever I'm sitting beside just so I at least know a person in the class. For whatever reason, I just didn't do it this year. At the time I just told myself that I was tired or whatever, but now that I look back on it, I just kind of.... didn't care? It's tough to describe. I think the best way I could sum up my feelings this last month or so would be to say that a lot of the time I feel empty, less emotional (I don't really feel emotions as strongly as I think I should be), and at times I feel like I just don't care about anything. It's worth mentioning that these feelings come and go, but for the most part they're present. I've also noticed that I feel mentally sluggish when I need to be alert, like when I'm in class or studying. I've found it pretty difficult to pay attention in a lot of my classes (I told myself earlier that I was just tired but I don't think that's the case), and when I'm studying I find myself zoning out/drifting off a lot.

&amp;#x200B;

I was looking some stuff up online and was wondering if I fit the bill for apathy. It might also be worth mentioning that I get pretty stressed out by school and (sometimes) just being away from home in general. Also read that smoking weed (which I do) might play a role?

&amp;#x200B;

If anyone has any advice, questions, or suggestions they would be appreciated.",16Oct2018,1
20,"I think I’m just worrying too much... because I also think I have mild depression(low energy,, and I had a thought like:

&gt; I hate myself...

And I immediately countered that thought:

&gt; I don’t feel that way! That’s not me...

I also have been actively looking for ways to help my severely depressed friends... so I don’t think I’m *that* depressed. 

Unfortunately the fact that my friends are depressed is inherently depressing itself.

Coping techniques? CBT, mindfulness... we aren’t our thoughts. 

I think I’m just worrying... lately I’ve encountered severely depressed and suicidal/suicidal... which gets me down, makes me anxious and even upset. I read some notes by a woman who committed suicide (I’m not suicidal) and the fact that she didn’t seek treatment actually made me a bit angry, that I wish she would have received help.

",16Oct2018,1
21,"Went for my first counseling appointment today and thought it went well, went home and had an argument with my s/o, went to see “a Star is Born” which I didn’t know had a suicide in it. Went home feeling like shit. It’s been 3 years since the darkness set in and I don’t think I’ve ever been closer to wanting to kill myself. Not sure if I need a new therapist, new s/o or a new life. ",16Oct2018,1
22,what should you do when you get suicidal thought all of the time? ,16Oct2018,1
23,"I'm drunk so this is probably super invalid and way too dramatic, but like I've been suicidal for years with a few attempts in my past. I've always been fixated on my golden birthday as the timeframe I have to fix my life. Well, I'm still in a shit place and it's coming up in a few months. I just feel like the precipice never gets further away despite therapy and attempts to get happy and at this point I just have this ever-increasing feeling that it's all fucking pointless. I've been transitioning for a year and it's such a joke at this point. I don't know why i try and I'm pretty sure I'm over caring. The funny thing is is that I feel so guilty about bringing up how suicidal I am. Like I feel like it's just some guilt-trip bullshit I pull to make people care. But it's still a cry for help? fuck i don't even know I just know I'm in a bad place and I can't be here anymore",16Oct2018,1
24,for the past couple of days my girlfriend started experiencing sudden moments of crying. but she herself doesn’t feel sad actually (only sometimes) and she cries hard and it lasts for awhile. afterwards she’s fine after i help calm her down. what’s happening to her? i don’t know what to do but i thought i’d ask here,16Oct2018,1
25,"I never asked to be riddled with anxiety and depression, or anger issues, I'm 32 and I'm so ready for it all to be over. I have no one , no friends, family that doesn't understand and lacks support. I talk to no one other than my 7yr old daughter, I isolate myself much of the time. I cry, I rage out in anger, I feel depressed more than ever. My wife left me 8months ago and has moved on with another guy. I hurt every day from the heart ache even though I deserve it.

I've struggled with mental illness since age 12 started with social anxiety and depression, it manifested to panic attacks every day for about 2-3years solid, at 22 I was diagnosed with agoraphobia and panic disorder, after a stretch when I became house bound, a year ago I was told I have ptsd and just a few weeks ago diagnosed with bipolar disorder. Sigh.

I've been disabled for almost 4yrs though have attempted to work temporary jobs lasting a few weeks to a couple months. Now I have lost all interest in anything, no desire, no motivation, no will power, I think in my head about the changes and things I should do but no matter what I do it like I can't fix it, if I do get on a good stretch then I'm knocked back down which has been the story of my life. 

I'm so alone, unhappy, can't smile, I feel meaningless, and so unwanted, I have zero confidence in myself and a since of hopelessness. 

I don't want to feel all this anymore. ",16Oct2018,1
26,"* dont get what the fuck is wrong with me anymore,I Have obsessive compulsive disorder,certain previous fixations and worrys,rituals and [routines.It](https://routines.It) all started when I was 10 after I had a operation done,the first sign was everynight before i went to bed I would ask my mom if I could call her down if im worried or scared or  something idk.That morphed into these compulsions and [such.Fast](https://such.Fast) forward to recent times and noticed that my mental health is deteriorating, I also became a bit of a hypochondriac but thats far from the issue.the past few years I have been plagued by irrational thoughts and worrys pertained to the paranormal and such.I would look up these weird rituals and it would make me paranoid,and I would go crazy over them for some reason.that part subsided partially,I always get these thoughts and obsessions in my head and scenario. THE MOST RECENT thought is this obsession with   thinking im gay which Im not, I know im straight but there are remember images that pop into my head uncontrolably 
* .my temptation from ocd got so bad that I got tempted to look up gay porn for a second but im not [gay.](https://gay.Now) i even have been having trouble ""getting o\*\* today and that put the thought back into my head.I have been beaten down by my own mind in a million ways and its only gonna get worse,I feel like its time to end it or something.Just cant take constant pain.",16Oct2018,1
27,"You posted here.  20 minutes ago.  You only had three posts in your history.  First one 7 month ago, third was today.  I tried to message you.  Message wouldn't go through.  Now your post is gone.  Talk to me. ",16Oct2018,1
28,"Im a 15 year old kid with bi polar tendencies and depression and i thought this subject might be related to that.. 
Its just whenever i get uncomfortable in a confrontational situation my throat blocks up, i get teary and my voice gets trembly.. Is there anyone else here with that problem that knows how to deal with it?.. ",16Oct2018,1
