,text,time,score
29,"So here's something about me and my background, I lived through domestic physical and mental abuse from my father too the point that I feel kinda mindless in a way being all I did was follow whatever he said. I lived to that point till high school until I gained some self control to be able to move away from that life. But I also noticed something that I have a wild imagination of things that even I don't understand. I would always try to predict things of course think of multiple situations in my head but choose the most logical route or situation that seems to be the safest. But here is something I find interesting about myself for some reason. How I forget, is that I use my own imagination to overlap my memories to forget. It's like editing a video to me, I cut out that 15 sec from a min video and it would look smooth. Now being able to remember or what happened takes awhile because I have to recollect my memories and try to remember what I was missing. This process kinda hurts my head but usually it never occurs. This isn't to show off that I could just forget and throw away something because I want to but forgetting too many memories that wasn't suppose to be memorable could've been memorable.",16Oct2018,1
30,"&gt;Do you ever just become so .. I don't even know .. .. Lately .. off and on.. I sometimes find myself just writing in fluid thought, like it's pouring out of me in pieces.. about a bunch of shit.. It's like a pressure valve releasing to keep from exploding.. just .. I don't know.. it could be on a specific thing, an interaction with someone, or.. just.. whatever.. .. it's like purging a bunch of pressure in a release of thought, feeling, bla bla fucken bla.. *breathes* .. rapid typing in windows notepad about.. yeah.. whatever ..  I don't even know.. *sigh* .. fuck man.. I feel like i'm losing my shit sometimes, or.. maybe that is the wrong way to put it.. I don't know... I used to think writing stuff out sounded silly, but.. fuck.. It actually helps a little maybe.. At least in the moment.. Even with a lot of it probably being nonsense, or.. *pfff* .. whatever .. And while you might not be dealing with shit, cause you, i, can't.. it at least lets some of it out.. releasing that metaphorical steam.. in abstract thought, direct thought.. bla bla, etc..  So while I might be typing about bla bla.. I'm also thinking about .. other shit.. I don't know.. What the fuck did I even just say? Heh.. I think i'm feeling a bit fried (tired).. or.. bleh... w/e.. It is what it is.. (queue the dissociation) --&gt; ""it is what it is"" - Lol.. *sigh* .. Fuck. 

  
Yeah .. \*sigh\* .. so that's a thing.",16Oct2018,1
31,"Hello.
I hope everyone is having a good day so far.
I tried to post this in LoseIt and no one seemed to comment on it...I hope I get some people big into fitness to give feedback.
I'm gonna try my best to keep this post short since I tend to overexplain and ramble..
So I have been officially powerlifting for 7months now.
I got diagnosed with bipolar 2 right after I officially started prepping and now I am finally accepting it and still learning about. Even before the diagnosis though, it was still a problem.
Anyway, this diagnosis came in the middle of a bunch of new/not so good things happening with my life, and when I got over the depressive symptoms for that small part of this year...it was like some other things happen that would make me sad-not depressed that I am still going through.
I didn't wanna go to the gym even though I knew it would make me feel better, and I was still making progress and I knew that I wanted to see myself lift more. And when I did go, It felt like SO much work! Getting out of bed seemed like so much work. But for the short sessions I did lift, I would think that...this is not the heaviest weight i had to carry lately. And given i would not go regularly, I beat myself up, compared myself to my coaches other clients like...they wouldnt miss their workouts.
I just lately had to write down why I wanted to workout regularly and what my goals were in life and in lifting which has helped, along with remind myself not to compare myself to others. 
ALSO when in depressive episodes I tend to overeat, and it seems like I lose touch with hunger signals easily. I follow an intuitive eating approach.
Anyway, I would really like pointers in training or competing with mental illness, as well as caring for nutrition when life hits you, when you are going through a depressive episode and your energy is depleted and everything feels like a huge step. 
I don't HAVE to do keep lifting, but I want to and this is my my way of moving forward so my mental illness can suck it. It helps everything else in my life feel lighter, so I feel pretty helpless when i've lost motivation for it.
Thank you for reading my post. 💗 Any feedback is appreciated.",16Oct2018,1
32,"I dont want to jump too far into this. I need help. My mental well being is dealing rapidly it feels like. I'm no longer able to get myself to my job. I'm unemployed. No insurance. Waste my money still knowing that I have important things to take care of. I disappear into video games to escape what is going on. Literally I play all day. I hate it but yet it's all i do. My girlfriend works full time and takes care of our daughter. This isnt the life i want. How do i, as someone with no insurance, get help for my mental state before I lose everything. I live in IA btw. I need some guidance please. I cant sleep I cant motivate myself. I am lost. Please any advice.",16Oct2018,1
33,"Hi. I have kind of a weird problem.

Sometimes when I am just casually going through my day, my face splits into this huge and kind of creepy grin. It can come out of nowhere when I’m doing literally just about anything, like taking out the trash, or listening to someone (whether they’re talking about something serious or not), or walking down the street. Sometimes it is accompanied by really funny thoughts and I have to keep myself from bursting out laughing at them, but most of the time it’s just my lips curling back and showing my teeth, making this expression that really does look like a smile. I usually end up having to force it into kind of an equally strange grimace or just straight up awkwardly find a way to hide my face, because I think it weirds people out. It has gotten to the point where people actually have made comments, saying things like “you have a huge smile on your face right now” or asked “why are you smiling?”

It’s bizarre because I feel like I have barely any control over it and have an extremely hard time stopping myself from doing it. It is especially uncomfortable when it happens during a serious moment. It feels like even when I know what’s going on around me and like I should be serious, my brain is on this completely different emotional wavelength and I become detached, no matter how much I want to stay present.

One theory I have is that maybe it’s a weird adaptation my brain developed. Maybe whenever I get too sad or stressed or something in my environment subconsciously triggers a memory, my brain tries to be a clown and cheer me up by being as funny as it possibly can and completely distracting me from my surroundings..... but I don’t know. Maybe that’s not it. I have no idea.

What do you guys think?",16Oct2018,1
34,"I’m 16. Last year my mom had a psychotic breakdown, and ended up in the hospital for about 3 weeks. She is bipolar but I had never seen a mood swing like that before. She first told me she thought my father was “fucking with her” like telling his friends to turn the power in the house off and move shit around. My dad did not do any of this at all, he simply wanted what was best for her throughout heir whole marriage. As the days went on my mom would tell me completely unrealistic stuff like she thought the church was after her and there were parties at our house and people were stealing her stuff. The worst of those days was when I was woken up by her digging through my trashcan and bedstand drawer looking for painkillers that she didn’t want me to abuse. I have never popped a pill or stolen anything from my parents. She also took my phone in that morning and denied digging thru my trash when I asked her about it. She just smiled at me and said no. I left to stay at my boys house and she left for the hospital for 3 weeks after I told my dad what had happened (he had left the night before for the cape bc she screamed at him to leave). When my mom came back she was still acting strange but almost normal. I felt pretty fucked up about the shit that went on during those weeks cause I’d never know if the woman who I was talking to was her mental illness or my mom. Sixth months later my mom has another breakdown. She tells me my dad and my sister that she loves us no matter what happens and that she was going on a run. She didn’t come back for 5 hours so we called the police and they came to our house. The police found her sleeping in the garage on the floor. She was very confused and anxious and told the police she was hiding her medication from the party that was going on in my house (there was no party, it was me my sister, brother, and dad) my mom told the police that she wanted to go to her room and not see any of us or our dad. She went up to her room but was screaming at my dad on the way there(idk what she was saying I was in the basement watching TV). Later that night while I was playing video games, I heard something shatter upstairs and lots of yelling. My mom was taking the beer bottles out of the fridge and smashing them. She told my dad that she fucked another guy, a family friend who had stayed at our summer house with us many times. My dad started yelling for her to stop breaking shit so me and my brother came to restrain her. She screamed in my face “I fucking hate you” I went off on her and screamed that she was selfish and always made things about her. I know she’s sick but I was just so angry. Anyways I left to go to my boys house and the police came after I left. They almost tased my brother bc he didn’t like the way they were treating my mom. She went to the hospital again for 2 weeks and came back distant and non apologetic. I barely talked to her for around 3 weeks. Months later now, she always wants to come in my room and talk to me and all this shit and I wish both of my parents would just leave me alone. I’m shit scared that I’m gonna end up like her, she and her father both have mental illnesses w those psychotic breakdowns. I can’t trust anyone anymore I think my best friend is telling everyone including the girl I really like to act nice to me and get involved w me by texting me and wanting to hang out because he thinks I’m going to kill myself or something. Does that sound realistic to u or is it genuine interest? And I can’t stop smoking weed everynight, I just bought a dab pen and I can’t stop hitting it. My friend just texted me saying “I know you are always joking about everything but are you actually alright?” I broke down in tears but I texted back saying I’m good. I’m sorry for saying so much but I don’t have anybody I really really trust to give me advice so it’d be better if I ask strangers.",16Oct2018,1
35,"I thought this was normal, but today I realized that it's not. I am never me in my dreams and everyone else is also strangers/people I don't recognize. I'm aware of what character everyone is and who they're meant to be from reality, but they all look like strangers. I've literally been a man, a women, an animal, various ages, etc. Just not me. Even when in first person, I'm aware in my dream that I'm not me.

Anyone else, healthy or mentally ill, that is having this stuff go on in their dreams?",16Oct2018,1
36,"I've felt a deep sense of helplessness, loneliness, and misery for my entire life, something I realized with clarity after my recent graduation from college. (I'm 23)

Now, I work as a paralegal (immigration law) and i feel so overwhlemed and stressed. I feel physically ill multiple times a week. I feel deeply inadequate and stupid, and I'm certain my coworkers agree of this assessment because I freak out and ask stupid questions all the time. I constantly feel out of control, helpless, and panicky..like I don't know what I'm doing. It doesnt help that i hold people's lives in my hands... 

And my brain! Never sharp, always foggy. I feel so stupid. I cant think clearly because I'm always panicking and i doubt literally everything I do. My mind moves too fast. It becomes confusing. I feel trapped. I have suicidal ideation, although I would never act on it.

At the same time, I can never find people with stories like mine. Depression and anxiety never manifest in others the way it does for me... So i feel isolated even more.

And my clients - how can I possibly complain when my clients' stories are full of abuse and murder and cruelty? And my life has been relatively sheltered? I know I shouldn't compare...but sometimes I can't sleep because i worry about them. They have so much more at stake..

I guess I'm super overwhelmed, and i feel so, so alone. I can't describe the despair I feel on a daily basis... I feel imprisoned.

I used to see a therapist, but she moved away. I miss her immensely, as if I am grieving in a way, but I havent managed to find another therapist. 

I'm just really sick, I think, and I don't know what to do. I feel like I'm in hell.


",16Oct2018,1
37,"Really not sure where else to post about this. Figured this might be a good place. Some backstory. I’m an 18 year old Male in his first semester of college. My parents have been separated since I was 11 and divorced since I was 14.

I was able to live in my childhood house until I finished HS and since I have my father pushed for the sale of the house a month after my graduation. It sold at the end of August and I have about 3 weeks until we move out. I’m currently home now trying to pack, not going well, and trying to say goodbye. I’m having a lot of angry thoughts in my head directed at my dad and the people moving in. 

Tried to talk to my therapist and didn’t help. Does anyone have any tips or anything that will help get over this rough time in my life? I’ve been dreading this since I was 10. 

Thanks. ",16Oct2018,1
38,"  

Last Wednesday was Mental Health Awareness Day. Frankly, for the first 18 years of my life I could care less about what this day meant. However, this year was a different story, and I wanted to take some time to reflect about my experiences and maybe even help someone. A friend of mine recently wrote an article about his struggles with anxiety and obsessive-compulsive disorder, and I thought to myself “This kid has a set of balls.” Mental illnesses suck, there’s no getting around it. It also takes a lot to open up to others about them, and in the end I gained a ton of respect for my friend for doing so.

So here goes…

Before I entered my freshman year of college, I thought that the world was a unicorn shitting out rainbows. This quickly changed when the stress of college, a number of failed relationships, and legal troubles (something I’m not ever open or proud of) burst into my life.

Addiction, hopelessness, anxiety and depression quickly flooded my brain like a tsunami. Not going to lie, it can make life fucking hard. Plain and simple. I never pictured myself as a person that had behind the scenes struggles and quickly thought…why me? What have I become? And the never-ending cycle of these mental illnesses continued to churn and worsen, quickly replaced by guilt. I grew up in such a good family, go to a good school, and have a concrete foundation…what could have gone wrong, and why am I thinking these thoughts?

Do I care what people think of me? Unfortunately, yes. Do I want attention or for people to feel sorry for me? Fuck no. In spite of everything that went on, being a driven person with a solid work ethic is the only thing that kept myself and my friendships sane. If all else fails, working towards your goals along with helping others is the best way (in my opinion) to combat these illnesses. It can be hard. Really damn hard. At times, it’s still tough to get out of bed in the morning without feeling unworthy and empty inside. Focusing on personal growth and taking small steps to improve one’s self can go a long way to a healthier brain and lifestyle.

**IN THE END** I didn’t choose to have anxiety or depression, and neither do the large population of the world that also suffers from them. But if I’ve learned one thing, it’s to take responsibility for the circumstances life has to offer. I believe a famous super hero once said: “With great power comes great responsibility”, which may be true, but the real way to live life is “**With great responsibility, comes great power.”** With life has actions, and with these actions comes consequences. I still suffer from anxiety and depression. It’s currently 2:44 A.M. and I’m still awake anxiously thinking about what people are going to think of me after posting this. Mental Illnesses are extremely tough to combat, but when we are able to own up to our circumstances and say “Yeah, my life has setbacks. But who fucking cares. Today, I’m going to try to be the best \_\_\_\_ I can be, and no one is going to stop me” is the day we can take one step closer to a more positive and carefree life.

Hopefully people that have had similar experiences as myself can find this helpful! ",16Oct2018,1
39,"I wish the title was overly dramatic, but it's not. The only reason I'm alive is my old dog who dies a year ago and ever since I've been going downhill. I can't go to school so I'm now home schooled and can't bring myself to do any work. I just can't do anything I can't go outside I can't go anywhere. The only thing I can do is be with my girlfriend she's just been there for me for 2 years and she helps me a lot. I'm 16 so I know it's probably not permanent and I'm okay with that. My dog was seriously the only reason I'm still alive. This is all over the place I'm just loss, I can't bring myself to do anything and it's tearing my parents apart. Nothing has helped and all my therapists I've seen don't know what to do. It just gets worse and worse and since I can't do school work I'm not going to get anywhere in life, I want to be successful and I know this isn't how to, but I can't make myself. My mind is so far gone and all I can do is be on my computer and just wait for myself to snap. I've considered so many things such as carrying out a shooting or just killing myself. I don't want to do either of those things, but they're constantly on my mind. I don't know what's wrong with me, no one does. I don't know if anyone can help I just needed to say it because it's 4am and I probably get 10 hours of sleep a week. My brain is so far fucking lost.",16Oct2018,1
40,"Yesterday my mind just fucking broke down. It was a very hat day and i was not used to it but as stupid as it sound i didnt drink anything so when i drove home from school with my bike after i dropped of the train. But as so as i drove some meters my mouth just went that dry that licking my tongue across the inside of my mouth just felt like being stabbed with a knife thousands of times in a second. I guess i the ride home took about 15 minutes but i dont exactly know cause the longer it took i went more and more dire for some thing to drink i just went fucking insane i knew i needed something do drink or my mind would break entirely. After 15 minutes i got home went inside and took some juice out of the refrigerator and it was a fucking relief as i chugged down the whole 1 liter bottle in one sip but then my dad went down the stair ways to prepare something to eat for me and that was the point where i completely lost it. Every thing felt like is was moving lightning fast and like i could dodge a bullet cause i would be faster than it atleast thats what i thought. I felt electrified and i couldn bear it my dad tryid his best to help me but he couldn't stand the presure of his son breaking down so he just colapsed for a few seconds i was worried that he had an heart attack so i called an Ambulance. But he quickly went back on his feet talked to the nice man on the other side and explained everything to him. My dad send me to bed where i was just laying down trying to calm down which i eventually managed. But my mind was still completely fucked I was just thinking about random words which made no sense but in my mind i understood them. I had to think alot with these thoughts till i had my first clear thought. I was fucking worried that i would never get back to my old self and always be fucking insane i thought my parents would send my to a clossed health center for the rest of my life but after 16 hours of sleep i went back to normal i fell the after effects but it's nothing to server i'll just get some help from a therapist to cope with it.

In the end i want everyone to know that everything is mostly fine now. And everyone who experienced something similar to what i did i hope you fell better now and might want to tell me what you went through. And to everyone else experiencing mental health issues i hope that you got someone to help you and that you are feeling better soon, im a person that you can turn to ill try my best to be a good listener and to help you.",16Oct2018,1
41,"Thanks for taking the time to click through! Study Update https://preparednessforemploymentscale.com

We have now had over 951 people take part in our research - that's over £951 donated to mental health charities! A lot of our responses have come from Reddit so thank you!

In case this is the first time you're reading this post... We are looking for people who are willing to complete some online questionnaires about employment and well-being which we hope will help us to improve services for assisting people with mental health difficulties to obtain and retain employment.

We are developing an employment questionnaire for people with personality disorders; however we are looking for people from all backgrounds to complete it. That means you do not need to have a diagnosis of personality disorder – you just need to have an interest in completing the online questionnaires.

The questionnaires will only take about 5-10 minutes to complete online. For your participation, we’ll donate £1 on your behalf to a mental health charity (Young Minds: Child &amp; Adolescent Mental Health, Mental Health Foundation, or Rethink).

If you’re interested please click here.

If you would like to know more about the study please click on the link above or contact the study team on EMPOWER@nelft.nhs.uk

Thank you for considering to take part.

Leng (Li-Ling Song, PhD student University College London)",16Oct2018,1
42,"I’m finally making the leap to go to therapy.. I had a rather tough childhood with a ton of emotional abuse, nothing physical though. I don’t want to give a ton of details but one of the things I had to go through was living with an older half-sibling (like, a 20 year age-gap) who was a drug addict and alcoholic. In order to help him quit those tendencies, my mom would do things like lock the house doors so that we would need a key to go outside (which I had a key, he didn’t). Point is, I had to see a lot of crap related to drug addiction because he lived with us and my mother never understood that his addiction affected me and my sister. Now I’m all sorts of messed up due to this and a lot of other stuff from my childhood but I love my mom and don’t want to get her in any type of legal trouble. I know that if I were underage and went to a therapist with these problems, they would be required to share them with child services. But, now that I’m over 18, this information would be between us, right? Completely confidential?",16Oct2018,1
