,text,time,score
43,"I'm 22 years old. I'm at a point where I no more understand what's going on in my mind. I feel sick. I feel so empty and like I have to pretend tk be normal. I see people around me struggling and yet feeling positive emotions but I fail to feel anything positive. I have had shitty past.. My present is okayish. I have been suicidal since very long time.. I just have bonding with my sister and my ex- friends with benefit. I have zero bonding with my parents. I feel sick when my parents are around me. They are abusive and have always been neglectful towards my emotional needs. I don't feel like taking any efforts in maintaining friendships or starting any relationship. I pretended with one of my guy friend that I can do casual no strings attached relationship and we started it in July but he ended it this month because we couldn't find place to meet. We never had sex, we used to just make out. I never confessed to him the way I feel for him. I have feelings for him and it was never casual for me. I could never confess because of my shittiest past and deep down I have beliefs like I don't deserve to be loved and I also don't want to be burden on anyone. I can't move out yet coz I'm not financially independent. I feel like I'm a punching bag of my mom, I cant leave her coz of her health and I don't want to stay at home.  I just want to be alone somewhere where nobody knows. My anxiety is also killing me. I play keyboard, watch movies, series, books to keep myself distracted from suicidal thoughts but I honestly want to end all of this. I see no point in life, I find life meaningless. I see no point in expressing myself because I'm always going to get hurt, people always leave me.  People love perfection and I'm not perfect.. I'm negative and full of flaws. I'm sorry but I'm so sick right now that I can't clearly express everything but this is getting worse for me and I'm waiting till this final year of my college.. I'm postponing my suicide but I really don't want to live.",16Oct2018,1
44,"Yesterday my mind just fucking broke down. It was a very hat day and i was not used to it but as stupid as it sound i didnt drink anything so when i drove home from school with my bike after i dropped of the train. But as so as i drove some meters my mouth just went that dry that licking my tongue across the inside of my mouth just felt like being stabbed with a knife thousands of times in a second. I guess i the ride home took about 15 minutes but i dont exactly know cause the longer it took i went more and more dire for some thing to drink i just went fucking insane i knew i needed something do drink or my mind would break entirely. After 15 minutes i got home went inside and took some juice out of the refrigerator and it was a fucking relief as i chugged down the whole 1 liter bottle in one sip but then my dad went down the stair ways to prepare something to eat for me and that was the point where i completely lost it. Every thing felt like is was moving lightning fast and like i could dodge a bullet cause i would be faster than it atleast thats what i thought. I felt electrified and i couldn bear it my dad tryid his best to help me but he couldn't stand the presure of his son breaking down so he just colapsed for a few seconds i was worried that he had an heart attack so i called an Ambulance. But he quickly went back on his feet talked to the nice man on the other side and explained everything to him. My dad send me to bed where i was just laying down trying to calm down which i eventually managed. But my mind was still completely fucked I was just thinking about random words which made no sense but in my mind i understood them. I had to think alot with these thoughts till i had my first clear thought. I was fucking worried that i would never get back to my old self and always be fucking insane i thought my parents would send my to a clossed health center for the rest of my life but after 16 hours of sleep i went back to normal i fell the after effects but it's nothing to server i'll just get some help from a therapist to cope with it.

In the end i want everyone to know that everything is mostly fine now. And everyone who experienced something similar to what i did i hope you fell better now and might want to tell me what you went through. And to everyone else experiencing mental health issues i hope that you got someone to help you and that you are feeling better soon, im a person that you can turn to ill try my best to be a good listener and to help you.",16Oct2018,1
45,"I feel like I'm only putting on an act for others so they don't think I want to attempt suicide again. A little over a year ago, I attempted suicide and ended up in a hospital. Since then I promised myself to better myself. I'm happy but as of right now, I feel like it's not really me. I feel fake. Not sure if this even makes sense. I know I have plenty to be happy and thankful for, but it's starting to not mean anything to me. I feel myself pushing away anything positive. Idk hopefully this passes.",16Oct2018,1
46,"I'm pretty sure that I need to get help for my mental health, as I think I'm depressed. I've wanted to go talk to my GP about it for a long time, but the thought of doing that is really scary for me. I'm scared that they won't take me seriously. I'm also worried About what to say. How do I approach the subject. Do I say something like ""I need help with my mental health"" or something like ""I think I'm depressed"". I know this sounds stupid but im finding it really terrifying to think about going to the GP, but I really feel like I need help. Can someone who has gone through the process of first going to a doctor tell me how they approached it? ",16Oct2018,1
47,"How do I encourage a friend to make changes to his life? My friend has suffered from severe depression his whole life, and is really bad at coping with it. He honestly doesn’t do anything but drink and watch tv, all day every day. After high school he’s become even more reclusive than ever, and is way less open about his depression. Hasn’t really accomplished anything since graduating two years ago because his parents pay for all his shit.  I really need to tell him that his lifestyle is fucked up, but in the gentlest way possible. He’s really sensitive and defensive. ",16Oct2018,1
48,Any w/ depression done ECT treatments? How did it change your life? ,16Oct2018,1
49,"So I've been taking a few meds for about 9ish months (This time). From January until last month I was in a residential treatment center for minors.  I have had my meds changed around a lot and take them for a few reasons, mostly for mood and depression. I have turned 18 while in the program and subsequently aged out. Now that I'm no longer in a facility where nurses give me my meds everyday I have completely stopped taking them except when I'm having trouble sleeping.  I have a hard time noticing changes in myself but I feel like my brain is literally moving slower and that I have to process things for a lot longer than before. I'm curious as to the potential side effects of me completely stopping my psych meds. 

Here's a list of what I was on:
Zoloft 150mg, Lamictal 100 mg 2x daily, Vistaril 20mg @ night, Trazodone 200 mg, Guanfacine 2 mg, &amp; Hydroxyzine  (PRN). 

If anyone knows anything about it I'd like to know. I have already set up an appointment with my doc to ask about officially getting off everything but that's 2 weeks away
",16Oct2018,1
50,"Hey ppl I m,21 have a question  if anyone can kinda relate: So I’ve had a history of abuse, ptsd and depression but been kinda getting it together. But now I’m stuck. I can’t maintain a job because I will get tired of it really fast and quit, I can’t maintain a friendship because I get scared that I’ll be left alone and distance myself. I can’t keep money, I have to spend everything I have every damn month. I can’t get intimate with a girl even tho there have been plenty of girls who were interested, it’s like as soon as I get the chance I flee. I like sex but somehow I manage to prevent it every time it might happen. Also I have extreme mood swings I can be absolutely suicidal one moment and be that (annoyingly) positive guy that has to tell everybody to be positive, in the next one. 
I just quit my job again and I’ve ignored everyone that cares about me again, maybe long enough this time so that they stop caring. And im really lost. I can’t get well like this and I have no idea what my problem even is. I often think I’m just an unsocial asshole, but if you’d ask anyone that kida knows me they would see me as this super nice and selfless guy that will get everyone to laugh and shit like that. Idk why I’m even writing this but maybe somebody has any idea as to what this is or maybe feels similar. ",16Oct2018,1
51,"I’ve been having a rough time recently for a number of reasons. I’ve been struggling at uni because I have dyslexia   and because I don’t really have any friends there. I’m not interested In what I’m studying anymore either so I have no motivation. The other day the only girl I got on with told me she’s leaving uni for good. Everyone else on my course is very bitchy  and shallow and ignore me. They act like I’m invisible. I can’t stick that for 3 more years especially on a course I’m not fussed about. I’ve decided to leave but I’m extremely worried about it. It’s a big change and I’m worried I’ll regret it. I’m also nervous because my family will think of me as a failure. I’ve also found out that as well as depression, anxiety, ADD and dyslexia I also have autism. I’m 20 years old so this is a late diagnosis but it really does explain a lot of things. I feel like my life is falling apart around me. ",16Oct2018,1
52,"CW: Abuse, slurs/hate speech, suicidality, self harm

Im 24 (F)

I'm falling apart. I've recently realized that I'm a Narcissist. I was raised by a literal psychopath. His paralimbic was disabled according to brain scans. I was beaten into a narcissist. I had to be fake to survive. I was beaten everyday. I was screamed at everyday. I was called faggot, cocksucker, retard, stupid bitch, pussy, worthless and much more daily. I'm Autistic and he would force me to maintain eye contact while he was screaming at me. My mind just broke. I don't even know who I am. My eye has been twitching for 2 straight weeks ever since I began with my new therapist. I'm so traumatized, insecure and full of self hatred. I'm in and out of psychosis. I have delusions, intrusive thoughts, vivid flashbacks. Im a shell of a person. I think about suicide everyday. Ive managed to quit self harming. I'm 2 1/2 weeks clean. Everyday is a struggle to hold it together. In worried that I'm losing my battle.",16Oct2018,1
53,,16Oct2018,1
54,,16Oct2018,1
55,"I was diagnosed with schizo and been on meds for 9 years...now I ain’t taking them I do still feel ok but I can sense it’s still not good enough?
Anyone here diagnosed with mental illness and are not taking meds but doing well enough in life?",16Oct2018,1
56,"Narcissists never stop being responsible for and should be held accountable for any abuse or harm we cause and acknowledge that. We also only really have a place in society if we are struggling everyday against it. That being said there are some unfair things that get said about Narcissists.

There is a stigma that we are 100% unempathetic, can never be healed or improve and therapy will only make it worse because it will make the Narcissist more cunning.

 In some cases this is true. There is a good way to know the difference. Why did they start therapy? Will they admit it to themselves and others? If a narcissist has been court ordered to see a therapist, the odds are they just feel threatened and feel like they shouldn't be there. They will lie a lot of the time because they can't face themselves and accept that there narcissistic. If however the narcissist is aware enough to seek therapy own and sincerely wants to be a better person healing is possible. 

You can think about it almost like addiction. I will always be a narcissist but we can be recovering narcissists and keep our symptoms at bay for long periods of time. We also will likely have relapses. I have a system now. I tell everyone that I'm a Narcissist as soon as I know them. Then I ask them if they'll do me a favor and everytime they feel like I'm being Narcissistic (I can't always tell), to tell me. As soon as they say that word, I stop talking and ALWAYS trust them over me. I then apologise and  have started practicing active listening and striving to make the empathetic choice at every turn. I try to give more than I take and be respectful of others' boundaries. A healthy and decent self is attainable for everyone if they work towards it.

A lot of us are really sincere about our healing. Al ot of us want to be better. A lot of us want what's best for other people as well as ourselves. We're not demons, we're just damaged, twisted and sometimes dangerous People. I'd like to say I'm really sorry to all the people we've hurt. You were always right about us we never listened. You all deserve so much better! ",16Oct2018,1
57,"My girlfriend suffers from bipolar disorder, but up until now it hasn't been an issue in our 9 month relationship.

Today she told me that she wants me completely out of her life. This was extremely sudden and shocking to me and seemed to come out of nowhere. Even yesterday we were talking about how excited we were to move in together.

She told me that she feels that she is is not mentally in the right place for a relationship, I have no idea how long these thoughts have been going through her head. Her messages have been aggressive and cold, not like herself at all.

I want to help her but that's difficult when she keeps pushing me away. I don't know what to do and I'm scared for her.",16Oct2018,1
58,"i dont know what the reason is, but it's like i fear betrayal, afraid of being looked down upon, fear of making mistakes, super self concious, perhaps past traumatic events in highschool/elementary school and being yelled at and hit by my father is the reason why? No matter what I try to do, I can't get this feeling off of me. Now I'm afraid of anything related to cooperation. What can I do to treat this? It's so bad that I'm even afraid to play with strangers in a video game because I'm afraid of failing and making us lose the game.",16Oct2018,1
59,"Hey, I have this problem where Im constantly aware that Im thinking. And as soon as my mind wanders off it says: Hey look that were 2 seconds where you were not aware that you were thinking. Now start being aware of your thoughts and the fact that your thinking again. How do I stop this, because it is driving me crazy. Thanks",16Oct2018,1
60,"A friendly environment that's been established for little over a week and already has 130 members.   


[http://discord.gg/jshMFkF](http://discord.gg/jshMFkF) ",16Oct2018,1
61,"I have been abusive. I don't believe that I am a danger to others now, but I can understand why a therapist might worry that I am, and I'm not ready to upend my life right now. Is there any way for me to talk to anyone?",16Oct2018,1
62,i feel like i'm i crisis mood. i'm in class but i just can't be here right now. what do i do?,16Oct2018,1
63,"I don't get it. I really don't. I like school. I mean it when I say that. I like my teachers, and while my classmates may be assholes sometimes, well, newsflash, so am I. I have nice grades, I participate in class. I'm breaking away from a toxic friendship with the help of my teachers and getting new friends. I'm going to a music school, something I've always wanted. Hell, today I'm gonna meet my teacher.


Everything's fine, great actually, so I don't understand why I just start crying out of nowhere once a small thing goes wrong, or why sometimes I feel so nervous all of a sudden, or so angry. Whenever I have a day where I'm alone before getting to school, I just feel overwhelmed, and start crying when I fail to do something.


I get this weird emotional feedback loop, and I get angry at myself, because I should be able to do what everyone else does, I should be able to go to school like a normal person, I should be able to do this fucking shit, but I can't. And I just break down.


I've thought about it for a while now, and I think it might have something to do with the following.


* My older sister, her boyfriend and her daughter are crashing at our place for a month. They're moving because they want to quit drugs and get their life together and they need a place to stay in the meantime. I don't get as much ""me time"" as I'd like to, and the situation is stressing me out a bit.


* I technically don't have friends at school, just friendly acquaintances. I don't feel lonely, but sometimes I really wish I had someone there for me, who I could laugh with to make the world seem less shit.
I don't really pay attention to trends, and my tastes are usually obscure, so I don't bond  easily with other people.

I also have problems speaking my country's language, and I stutter a bit and use weird words because I think in English. This has caused me some issues, mainly me completely butchering grammar from time to time. I have trouble properly expressing ideas, which causes misunderstandings.

I'm also a bit childish for my age, and I have no brain-mouth filter.


* My middle sister is also into drugs. While my older sister has quit the hard stuff, middle sis is slowly gravitating away from weed and into hard stuff like cocaine. She's also been selling drugs. Annnnd she's in some shit with a gipsy or something. And she only comes home every full moon. Everyone's worried about her. Dad wants to kick her out, but if we did that, something terrible would happen. Stressful for everyone.


* My father is a truck driver. He's only home three days a month. I miss him a lot. We're usually on the same boat about a lot of stuff and... I just wish he was here for me, damnit. He might seem like a bad guy, but he means well, and I love him, and I treat him badly and I don't know why, but I love him, I really do.


* My aunt has died. Her death didn't affect me very much, we were never very close in the first place and I made peace with the fact that she was going to die, but my mom still isn't quite over it. I feel helpless because I can't help her.


I said everything's fine in the beggining but after typing all that out... well.
Most of these are things I can't change, anyway, and it's my attitude and how I deal with them that matter. I can't make the storm go away, but I sure can walk up to it and tell it to go fuck itself.

I think what's causing this is repressed emotions or something. I don't know.

I need advice, because the people I've reached out to won't let me speak and just shut me down. And I can't keep missing school. It's test season already. I need to get hold of this fast.


Thanks for reading, hypothetical reader.










",16Oct2018,1
64, i feel like i'm in crisis mood. i'm in class but i just can't be here right now. what do i do? i just want to run. ,16Oct2018,1
65,"Hey everyone,

&amp;#x200B;

just wanted to let you know that we have created an OCD-Chatroom for people from Europe (everyone else is welcome too, of course). It's called OCD EU:

&amp;#x200B;

[https://discord.gg/aNe3kGv](https://discord.gg/aNe3kGv)

&amp;#x200B;

See you there! 

&amp;#x200B;",16Oct2018,1
66,"I finally got a chance to enter a program where multiple psychyatrists evaluate you (thank effin Canada) and once they consulted they said Cyclothimia without a shadow of a doubt.

Problem here is that they put me on new meds right away and told me to stop taking my antidepressents(Venlafaxine 75mg) at once. The withdrawals are hell. I stumble, feel cold and worst of all, the damned brain shivers or brain zaps as some people call them. I'm seeing double at this point lol.

Now they have put me on Seroquel and Lithium.. How long should I expect the withdrawals to last and also would the switch to seroquel minimize the withdrawals from discontinuing antidepressents? 

Thanks.",16Oct2018,1
67,"I have a mix of bpd , anxiety disorder , ptsd and clinical depression ",16Oct2018,1
68,"Not physically at all. I don't want to hit or  harm anyone, except maybe a couple people I don't like  when they get annoying, but that's natural. 

I really want to hurt people emotionally,  as well as manipulate them and find myself constantly thinking about how I would do it.
 I want to make people cry you know. For example, i'd like to get a girlfriend just to break her heart after having her fall in love with me. 

I'm 20. I've never been like this before maybe a couple years back.  I did go through depression around the same time. 
I have always been the quiet guy. My friends acknowledge that and so did all my teachers growing up. The thing is, I am actually the opposite of my fantasies in the real world, I may be a little too nice. As in I'll rarely say no, and I go out of my way to help others. 
I'm not sure what the real me is, a decent guy everyone sees me as or what I want to be. 

I don't understand and I need help. 
Thanks ",16Oct2018,1
69,"Hello! 
So
I’m from the UK and I’ve been having a really mixed bag of problems mentally for years. I was diagnosed with depression at 15 and put on citalopram, over the years I was changed to fluoxetine and at 28 I was then moved onto sertraline. 

Everytime I visit my GP with changes/growing concerns about my health they seem to change/up the dose &amp; I don’t feel I’m being taken seriously. At the minute I’m on 150mg of Sertraline - I was told I was depressed, then I have a anxiety disorder. I wonder if anyone can shed some light and maybe give me some ideas of areas to read up.

I would consider my “normal” self to be quite reclusive, anti social, don’t keep friends or make plans ect. Always have a calm head and always willing to help others. 

Since I have been on sertraline I’ve felt like two completely different people, the highs are really high like unbelievable. I feel on top of the world, like I can do anything, don’t need to sleep or rest I just want to keep busy. Stay up until 4 am get up for work at 7 and be fine. People at work have said to me ‘what ever your on I want’ and I’ve never taken that seriously just sort of off the cuff.  My sex drive also goes off the rails, lusting and being overly pervy/desperate but a lot of the time being unable to finish. Can’t stick to tasks at work, distracted super easy, forget what I was doing. 

Other times I feel like I’ve hit a new low, no motivation, can’t get enough sleep, not enjoying anything what so ever. Everything feels hopeless &amp; I become really pessimistic, pushing away everyone around me starting fights for drama no interest in work &amp; people have said to me ‘your mood completely affects the people around you, if your in a bad mood/quiet it feels like there’s a storm cloud around us’.

I told my GP last week and they upped my medication again and said give it a month to kick in and come back. Also it is worth noting that I have always answered the question of self harm/suicide as a resounding no and was told if I said yes I would get help sooner. 

The best way it can describe it is like a pendulum- I can wake up feel on top of the world and swing so hard and so fast either way at any point. 

Sorry for rambling on so much, I just feel so lost right now and can’t contain my own thoughts, feels like I’m going to have to do something stupid to be taken seriously.  I just want to be in my grey area in the middle, content &amp; invisible. ",16Oct2018,1
70," 

\#ask, #attitude, #dreams, #Fashion, #Fitness, #mature, #Mentalhealth, #RiskManagement, #Addiction, #anxiety, #bipolar, #depression, #diet, #empowerment, #family, #lonely, #love, #onlinedating, #parenting, #relationships #plasticSurgery",16Oct2018,1
71,"What qualifies as having suicidal thoughts? Is just having the thought pop into your head when you’re depressed and then dismissing it considered to be dangerous level of suicidal thought. Or does there have to be some level of considering it as a possible option for your problems before it becomes something to be concerned about. 

I have struggled with low moments off and on for years. I have never looked for professional help so I have never been diagnosed with anything and have never been put on any treatments or medication of any kind. But I’m in a particular low spot at the moment and these thoughts have popped back in my head. I have never seriously considered acting on them and they don’t tend to linger. But the fact remains that when every something goes wrong in life, they pop up. 

I’m not scared by them really, I just don’t know how normal this is, if it’s a sign of depression, or if I need to start talking to someone because it’s a very serious sign of trouble. No one talks about the type of mental health issues. It’s so taboo. So I have no idea if I’m entirely alone or if I’m surrounded by people quietly having the same thoughts I do, and pushing them to the side in the same way I do. ",16Oct2018,1
