,text,time,score,subscribers
66,"I have been reading a lot about addictions and whatnot lately, and one guy I come across is Gabor Mate who talks about addictions being rooted in trauma experienced as a young child/developmental years.. and addiction for him is defined as anything we partake in compulsively to ease mental pain and ""escape"" - food, drugs, internet, porn, etc.


And this got me thinking.... my early childhood, though it had ups and downs like anyones, was not traumatic.. plain and simple i had a loving family. BUt most people's account I read involve having an abusive mom or dad or absent parent, etc.

For me, I think my trauma started when I became a tween/teen , first entered middle school. I started to be bullied a bit by other boys for ""seeming"" gay, being called ""fag"" etc. And this was at various points throughout middleschool, really. Being called gay and the alienation that resulted from that within my male-peer group. 

This would follow me into highschool with whispers and suspicion of my sexuality and never really being fully accepted by male peers. One experience stands out to me is in how when I was to give a presentation in a class full of jocks, I was nervous that I'd be laughed at, etc. But I said to myself ""nahh, they wouldn't be that cruel, they havent done that to anyone else""... annnnd I was wrong. I was laughed at. Mainly because my voice at the time sounded feminine i think plus just being nervous and my mannerisms. That hurt pretty hard because not only was I laughed at, but I trusted they'd do better and they did not. 

I say all this to say, does this count as trauma? I mean, yes this hurt me and impacted me, but it doesn't seem as bad as many other stories I heard or involve early, early childhood like most. Thoughts? How can I resolve my trauma, these memories if it is indeed so?",29Apr2018,25,
67,"I'm a guy.

I think I'm ugly but all of my experiences tell me I'm good looking.

For instance, girls always compliment me and call me cute. Guys always tell me I look like I pull a lot of women. One guy even recently told me ""you know why she's interested in you? because you fucking look like Brad Pitt"". My mother always tells me I should be a model. Women always come up to me and dance with me in clubs. I get a lot of Tinder matches. Etc.

Do I have BDD?",29Apr2018,2,
68,"Im a 5th Year Comp. Sci student and have been at my current job as a programmer for 2 years. I have OCD and ADHD, and some of my compulsions include staying quiet during arguments or when im im being questioned or doubting everything i do and redoing it.

During the Last year, I’ve had problems finishing my projects, i couldn’t give realistic timelines, and i couldnt ask for help because the company is basically him and I with a girl that does social media.

Whenever we get into arguments, he says that my adhd is made up and that its just society that wants to keep us down ( “he is the type of guy that took one psychology class and thinks he is woke”). This makes me want to punch him because i didn’t confide in him my sickness in order for him to use it as a punchline. I know I have messed up but damn it makes me mad. 

I once got burned out and he made it seem i was just a little kid making excuses.",29Apr2018,3,
69,"So this started off last summer as me feeling like  something about life was off and everything just felt different and i felt no emotions. At times i just wouldn't feel right and it was distressing but I didn't know how to explain it and it would make me want to be alone and cry. One day I felt rlly bad anxiety and felt like i was going crazy somehow and i actually ended up being taken out of school and I'm doing independent studies rn.

I never heard voices or saw things that weren't there or anything like that. After some googling i began to believe it was depersonalization/derealization.

But now things are somewhat worse because i have these weird thoughts and feelings. It seems like everything about reality is so weird and bizarre to me. It makes no sense to me that we're living on a planet suspended in space and every time i go outside and look at the sky it freaks me out because it seems fake. Just things that I have never given thought to or have been freaked out by now suddenly make me uncomfortable and don't make sense to me. Also i hate being out and about in public because i see other random people and just the fact that there's so many people living in this world and they all have their own personal lives is weird to me. Because i feel like rn my life feels fake, like a movie playing out before my eyes and people in public are like background actors but no, they're real people with their own lives.

One example of reality not making sense to me is i do not understand how cameras and video recording and even talking on the phone is even possible. Like i don't see how its possible to like freeze a moment in time from the past like it blows my mind. or to hear someones voice on the phone who is no where near you. I know it has to do with like light particles and sound waves but those concepts in itself don't make sense to me. And that's like something you can't question, you just have to accept that light particles and sound waves truly exist because we were born into a reality where they do but my mind like won't just accept it and stop questioning it. I have a polaroid camera and I feel like if i ever use it and see an image before my eyes get developed onto a piece of film, i will like have an anxiety attack because it doesn't make sense to me anymore. 

And so many other things about reality just are sooo weird and feel fake to me and it gives me anxiety and a feeling of dread. And I'm questioning why are things the way that they are. I'm scared because I don't know how I'm going to live my whole life like this feeling so weird and disconnected from reality. I'm especially scared because i'm going to be dorming at college in the fall and that in itself is scary but especially since I'm feeling weird. I don't know how imma do it. I really want to get back to normal before then.

The thing is, I haven't had a complete break from reality because I'm aware that these feelings aren't normal. I don't know if this is an extreme case of derealization or something else. I am not having delusions like believing inanimate objects are speaking to me or anything like that.

I did see a psychiatrist and she gave me an antipsychotic, olanzapine and i took only 5mg for like two weeks then stopped because i didn't notice a difference and also didn't rlly see why i needed it because I'm not like hearing voices or anything but do u think i should try it again?

I then switched the another psych who basically didn't even address my weird thoughts and just like blamed this on anxiety from starting college soon but i had these weird feelings before even thinking about college. and she didn't even prescribe anything

but idk what to do man like i want to get back to normal before starting college. but rn all i do is like stay home and do nothing like i don't like leaving my house bc i feel uncomfortable out and about.

do u think i should try the olanzapine again? any other advice? ",29Apr2018,2,
70,"This is probably not as bad as some other people, but i want to empty my heart.

So I am almost done with a school (where you go to when you are 12-17) , with only the central exams remaining. 
And I notice that  I am feeling a little down every day, which is pretty weird for me because I am a happy and optimistic person, that is also why it is bothering me.

Because I am almost done with my school, and everyone is going different paths in half a year, I notice that I am constantly thinking about how it will we, and if I will see everyone. And every song that I listen that can remind me of that time makes me a little sad, even if it is a uplifting song. 

I have an awesome group of friends around me, so maybe that is also a part of why I am so sad that maybe I will never see them again. 

I hope the story is a little bit readable because English is my second language.",29Apr2018,1,
71,"Hello everyone, this is my first time posting on Reddit so please bear with me. I got thinking today ‘What more can be done to reduce the mental health stigma?’. This can be practically anything, from government action to social beliefs, education, etc. While I have my own thoughts on the matter, I don’t really know many others who suffer with mental illnesses, so I’d like to know what others think. Best wishes x",29Apr2018,1,
72,"This has been going on for about three or four years now, I’ve tried antidepressants (lexapro) and while I feel fine on them, as soon as I wean off of them I remember why I was so miserable. I usually get back on them after a mental meltdown and continue them for six months or so, but as soon as life feels tolerable again I wean off... until the next big trigger kicks me down.

I could go back on them but at this point I’m feeling like I’m just numbing myself so that I can stick around just to appease the people around me. Sticking around, working, paying taxes, feeding myself, fueling my body to move forward in society just for the sake of pleasing those who are close to me. It’s so exhausting, I’m so fucking tired. I had a good run and I’m proud of my achievements, but I have no further goals and no reason to stay.

I have spoken frankly and openly about my views on death and suicide to my partner and no matter how many times I try to explain how I feel in a rational and calm way he gets upset. Rightfully so, I guess, but I wish he would just calmly tell me it’s okay. I want so desperately for someone to say “it’s okay, I know you tried hard. You had a good run and it’s time you rest,”

I don’t perceive death as a bad thing? Society made us perceive death as a sad, bad, terrible thing. But in my mind, the worst way to end a life is by tragic accident, disease, murder, or old age, alone in a home. Choosing to end your life on your own terms, peacefully, when you are ready, seems like one of the most wonderful ways to go. I don’t want to die immediately, as in, tomorrow or the next day. But I would feel so much better knowing I could. That the choice is there and that it’s “okay”.

At the moment, the options for suicide (locally at least) all involve discomfort and pain, and fear. I don’t want to go that way. I don’t want to have to hop through a hoop of sadness and adrenaline and anguish just to get to the other side. It makes me so sad that others seeking the same peace have to cross that traumatic hurdle. 

I suppose it doesn’t matter if you are dead but for the sake of my family, no matter how much they don’t understand it, I want them to know I didn’t suffer and that it’s something I absolutely wanted for myself.

Life feels like a party where I’m slowly edging towards the door and trying to bow out before anyone notices.

I guess... 

I don’t know what I’m trying to achieve by writing this. It just seems like nobody here can relate. Does anyone else feel this way? Is there something I can do to make this all easier? How do I live with myself when it feels like I’m remaining in it for the sake of those who don’t want to deal with my departure?

I’m so tired, just fucking tired.",29Apr2018,11,
73,I often feel like my mood is so difficult to control. It's hard to get out of a bad mood but my good moods are blissful. It seems like one little thing can set me off and my world comes crashing down and I wish I knew why I felt this way. I've joined a new fitness class anyway so I hope that enhances my mood. I am also going to delve back into my art and self care routine.,29Apr2018,1,
74,"I'm 19 years old and have been dealing with depression since I've been 14. I want to talk to a therapist/psychologist. I barely have any money so I can't afford one. Does anyone know how I go in the prosess of getting a therapist/psychologist for free? I've heard of people getting it, but I can't find any information about it.",29Apr2018,2,
75,"I've struggled with depression and anxiety since I was a child, and it's mostly around success, achievement, fear of failure, etc.  Basically, I travel through life constantly feeling stupid and like I'll die without accomplishing anything.  I've spoken to a therapist without much effect, but I've never talked to my primary doctor about it or taken medication. This all leads to the following question that I've been pondering.

Theoretically, if somebody has been a failure at everything that they have ever tried to do, wouldn't depression be the correct response?  And in that case, what would the effect of antidepressants be?  It seems like if they actually worked at all, they would really just be hiding reality from the user.  Can antidepressants make a person blind to their own failings?  

I understand that there are normal and abnormal responses to trauma such as an injury, death of a loved one, failed relationship, etc.  but what if the depression is stemming from a truly failed life?  Is there a level or duration of depression that is appropriate?  

Sorry I know this has been vague, and maybe the question itself speaks to how my thoughts are spiraling, but I've just been thinking about this recently and wanted some outside thoughts.
",29Apr2018,1,
76,"If you're deeply suffering inside, it's killing you pretty much, is it ok to tell someone about the pain even if it'll hurt that person?",29Apr2018,2,
77,"I’m not sure if this is appropriate for this sub, but I really need some advice. 

My aunt and uncle just got divorced, it was messy. Really messy. They have 3 kids, and they got caught in the crossfire. Uncle has basically cut off all contact with them, Aunt tried to comfort herself with drugs and alcohol. Two of the kids seem to be coping well (as well as you can in that situation at least) and are staying with maternal grandparents who are much more stable. One of the kids however, is still living with my aunt. Last time I saw her she’s gone completely inward. She won’t look anyone in the eyes, won’t speak unless spoken to, and just looks mentally beaten down. Keep in mind that last time I saw her just six months ago she was a happy, even bubbly young girl and she’s done a complete 180•. She’s also showing a lot of warning signs of depression and was seeing a therapist for a while but apparently my aunt stopped that. She doesn’t really have many friends where they’re currently living, as most of her friends are in her hometown with her grandparents. My aunt and uncle weren’t super connected with the rest of the family, so I’m not as close with her as I am with the rest of the family and I don’t really know how to approach trying to be a support system for my cousin. I really care about her and want to try to help her through all this. Any advice would be appreciated.",29Apr2018,1,
78,"i have a friend who has anxiety and (i think?) depression. she says she doesn't see herself being alive after 18 years old because it would be ""easier to just die"". she also tries to go days without eating (on a monday she said ""i'm not eating until thursday night."") and/or drinking water. i know she's had suicidal thoughts in the past, too.

i've never really had thoughts like that so i don't know how it feels or what to say to her. i want to help, but i'm not sure what i should do. 
i honestly don't feel like she has the right support at school, at home, or from me. 

please let me know if you have any ideas on what i can do to support her! she's a really good friend of mine, but i've only known her for a few months now.",29Apr2018,1,
79,"I'm so sorry for who I am. I'm o sorry for the way I turned out. I'm so sorry for the failure that I've become. You deserved a better son but instead, you got a fuck-up, a freak, and a failure. I wish there was a way for me to change my soul, but there just isn't. It's all my fault and there's nothing left for me to change now.

I'm just a parasite that feeds off of your hard work and patience, and I'm so sorry that I am who I am. ",29Apr2018,1,
80,"Just switched from Zoloft to Trintellix. Only been a week taking it, but was just wondering if anyone has any advice/ important things to know about it. 

I suffer from anxiety and depression; Zoloft helped a lot with anxiety but made my depression worse. I am hoping Trintellix does better.",29Apr2018,1,
81,,29Apr2018,266,
82,"My daughter (14)  has been dating a boy for a year. In January we learned that their relationship took a major step, way way to young in my opinion.  It is a very co-dependent relationship. She has abandoned all friends and basically ignores the rest of us also. It is them against literally everyone else.  She has struggled with depression and anxiety during this time, maybe slightly before he was in the picture. They started seeing a school counselor together, and she suggested my daughter see someone else in addition to herself. She made it clear to me, that when my daughter comes alone, she opens up. When the boyfriend is there she clams up. In March I finally made an appointment for her to see a therapist under our insurance. I stay for half of the appointment, but my daughter is totally stone-walling this lady. Barely answers questions and it makes for a very uncomfortable hour. In my daughter's eyes she feels like she is betraying the boyfriend. ""I don't need anyone else to talk about my problems with"" Today we had a discussion about her not being open to counseling. She said her and the counselor just don't click. I honestly don't know whether to believe her or not. Part of me says it's just a ploy to avoid going. I'm afraid if we  change therapists she will do the same thing. ",29Apr2018,1,
83,"I was currently reflecting on something I've always on some degree been doing: being weirdly mentally lazy. Often I can easily zone out from people and situations and be mindless (thinking to nothing in particular) like connecting or even thinking to something serious is too tiring for me. I can be mindless focusing simply on the taste of the food I'm eating, or the phyical comfort I'd be experiencing or some songs line that have been playing in my mind. I am always in my head, but often I also think to nothing or daydream. I'm not always like thisI and I also have anxiety disorder on top of things but I have been always mentally lethargic and scattered I don't know why",29Apr2018,2,
84,,29Apr2018,3,
85,"We go through life with barriers and safety nets, with support and backing, someone or something to always catch you when you fall, but is that really beneficial for you? some would say yes and others no.

I’m here to ask the question, can you really grow as a person and truly as yourself while unintentionally holding yourself back, you never get enough courage to go fly to somewhere, or to go do something like a party or see someone, or maybe you bottle it and just don’t think you have what it takes to get that job you always wanted.

If you look at life as a whole, there are more significant things for you to be concerned and bothered about, then just what if’s and buts, about being embarrassed because you said something or did something wrong.

I’m suggesting an idea, A principle, think of your world as a ocean, if you are on a boat comfy and everything you need, whats the point of going anywhere, what is the point of moving, But if you drop yourself within that ocean, forced to sink or swim, you need to keep moving forward, to find that boat of comfort, and when you find that boat, you will sit there, in that safety zone once again, looking back at that swim you just made, and on the experiences you faced, and then after doing those swims, you truly grow and find out who you are as a person, and how to really tackle those situations that once before made you freeze and doubt, but now you realise, whats the worst that can happen, they reject you and oh look you still go on living and 99% of your life has not changed, embrace the new and unknown, grow from life, don’t stagnate and just be a watcher of life but a player and user of it, to find what you truly wanted.",29Apr2018,1,
86,"I like to think it’s past me but there’s still lingering anger and sadness. I crave revenge but more do a means to forget and move forward in life with a sense of purpose and feeling free. I just feel like my old bullies are all still watching me, waiting for me to fail again ",29Apr2018,3,
