,text,time,score,subscribers
41,"Just for the record, I do not have any children and do not spend significant time around any children. Also, I would never act on these thoughts. I did take care of my significant others sisters kid when she was 2 months to 2 years. We were basically like the nanny for 7-8 hours a day. And I freakin loved her to death and she loved me. I was very caring to her. And I’ve also spent time around my nephew. And I love l him to death as well, never laid a hand on them in a bad way and never would. But I do have thoughts of hurting children. I never had thoughts of hurting my nephew or the little girl I took care of specifically, ever. This is just more general thoughts. I feel like I would get satisfaction out of slapping a kid around. Making a kid cry and when they start crying, hitting them more. And I’m not talking about hitting them to death or anything (im not that sick) but just upsetting them really bad. My thoughts have gone as far as to imagining hitting a kid, making them cry, hitting them again, telling them to shut the hell up and then putting them in a closet and shutting the door to scare them. Or covering up their mouth with my hand where they can’t breathe for like 20’seconds and making them cry and squirm. I know this sounds really bad but I’m just being honest and I’m wondering what is wrong with me even though I’d never do these things. I know many people have thoughts of killing people and would never act on it and stuff like that, so how abnormal are my thoughts? I was just watching videos online and came across the apparently kid when he was on the Ellen show. He’s so cute, funny and just a happy kid. But I couldn’t help but think about how I would love to hit him and tell him to shut the hell up. I started wondering how such a happy kid would react to being abused. Please don’t be too hard on me here. Like I said, I’ve never abused a child and I never would. Oh and to clarify the age I’ve fantasized about hurting is like 2 to 5. Not a baby but not a kid past 3rd or 4th grade. Also if y’all are being completely honest, have y’all had any similar thoughts? And if not, have y’all had any other disturbing thoughts or urges? Thank you. 

Oh and I read something online on a post website like this about the urge to hurt something cute. I think that is part of my urge here. Hence the ages 2-5. I love kids so much and kids are so freakin cute so I think that is a factor. I don’t know why I would wanna hurt something cute but that stood out to me. And then someone said they should substitute the word cute with helpless and that hit the nail on the head. I’ve found about 3 other posts of people asking this same question so at least I know I’m not alone. People also talk about hurting animals but that’s never been an issue for me. ",29Apr2018,0,
42,"I promised myself I wouldn't commit suicide until after my parents died. The reason is obvious, I don't want to put them through that. Sometimes I'm terrified about what happens after their death. But when I feel really low, I remind myself why I can't commit suicide now. My next couple thoughts are always along the lines of why aren't they dead yet. Which makes me feel like a terrible person. 

It's sad when science describe the brain as a biological computer. I think ""if only,"" then I could find the corrupted part of me and delete it.

I wish I could be open about this irl. Words can't explain how I feel. How do I describe the feeling of wanting to be dead so much I never existed. I want to go back in time a give my dad a condom or a picture of his grandmother naked, anything. ",29Apr2018,3,
43,"Hi, hope this is the right place for this. 
to make a long story short, I met a girl I knew from two years ago last night. We were semester buddies in a high school dual credit program and ended up going to the same college. We wanted to catch up and hang out a little bit, so we went to Starbucks. For the first 2 hours, we chatted about grades, fun local places to go, puppies, and terrible CGI movies. Very normal and innocent conversations. We begin talking about relationships, and I mention I’ve had a boyfriend for 3 1/2 years. She then shows me pictures of a guy she likes. Out of no where, she talks about how she is going to crush him while they are fucking. I laugh and make a joke. Then she says “if the sex isn’t good, I’m leaving him. Then I’m going to fuck his dad. I’ve always wanted to ruin a family.”
I know it sounds like a joke, you had to be there to get the full serious effect of what she was saying. I look at her and say “what??” And she says “if you need to be somewhere, you should leave.” And I do.
I came here because I wanted to get a second opinion on this. Does this sudden turn sound like it could be a mental health issue? She is also a psych major, so I am guessing she is interested in that due to her own struggles. I really want to understand the situation better, and I don’t think it was just someone being weird. I sensed some pain or hostility for sure. 
Thanks.
",29Apr2018,1,
44,"Obviously not a proper one however I don’t have the money to get a real one and I’d like to know if I may be experiencing some depression or bipolar.
If anyone could help it would mean a lot ",29Apr2018,0,
45,"So I have created a discord specifically to help give people with Autism a safe space to talk, play and interact with others similar to them. Even though we are primarily ASD based, anyone can join! So if you struggle with social interactions or just want to chat to some friendly faces, this discord is for you! Anyone is able to join and it is well moderated so there won't be any sudden surprises! We have only been up 6 days and already have 80 users! Come join us, this community is extremely active!

Link: https://discord.gg/UNk2wkh",29Apr2018,20,
46,"I posted yesterday about how I upset my best friend by being selfish, so I made the decision to be less so. It has left me in a position where although I am having a really tough day and have been cutting for the first time in a while, I can't actually speak to anyone about it because that will make me selfish.",29Apr2018,1,
47,"When I’m texting I can’t sit still and just text, I have to walk around the house and I’ll find myself just doing the same circuit over and over again for hours when texting, family took notice of me just constantly walking around and got a bit worried, the people I used to text heaps don’t really text anymore so now I just listen to music, same thing applies, instead of doing work I spent 4 hours walking up and down my kitchen and living room withheadphones in and occasionally having something to drink, now I’m sitting in bed and my legs are sore, does anyone else do the same? ",29Apr2018,1,
48,"Hi people! Recently I’ve been worried I’m emotionally desensitized, to feeling empathy especially. I’ve grown up with texting people, so due to circumstance I usually communicate with people that way. When people vent to me, I don’t know if I actually empathize, or pretend to empathize because I think that’s how I should feel and it makes my friend feel better. I don’t know if I actually feel bad for them. It’s almost like some of it is just unreal, like these problems are just “things”, not actual negative things happening to them. I think the reason this is is because of that barrier that arises when talking with someone through text, it’s a lot easier to exercise empathy, though it may be less real. Am I right in assuming this? Am I crazy for feeling this way? Does this imply I’m a sociopath, or at least an online sociopath? Thanks in advance for any help!",29Apr2018,3,
49,"She is 17 years old, has recently lost both of her parents and no other family. It doesn't see that she could afford therapy and i'm not sure if she has any friends. What do I do?

\(I seem to be the person she mainly approaches\)",29Apr2018,0,
50,"A lot of the resources I’ve found for BPD (specifically the abandonment issue part) paint the person with BPD as an abuser and their partner as the victim. Not really helping my feelings of being a worthless human / being inevitably abandoned because I am worthless / too needy / self-destructive. 

Anyone know any good resources for coping? Can be online or dead tree format. Thanks. ",29Apr2018,1,
51,[deleted],29Apr2018,1,
52,"HORRIBLE memory loss (I can barely remember what happened yesterday let alone anything that happened years ago), AWFUL concentration, I barely talk to anyone, can’t understand anything that’s explained to me and can’t consume information. I just can’t take this anymore. I need help and I don’t know what to do. Please hear me out:

I’m currently 14 years old, turning 15 in May. I used to live in United States up until 2 and a half years ago, then certain situations caused my mom, my brother and I to move over to a country called Costa Rica. I had to get used to a lot of things, like culture, language (everyone speaks Spanish here, I think I’m starting to speak it better than English which sucks) etc but I got accustomed to it after a while, and I even made some friends. I got transferred over to this semi-private catholic school about a year ago (which I’m still attending) and that’s when problems began to arise. I still didn’t know how to interact with Costa Rican’s much so I was usually quiet and didn’t have many friends. People began to talk to me behind my back saying that I had a problem, which was really frustrating. But then I met this one guy and another guy who used to live in the states too and things got better..The school year ended in November (school year is from February - November) and I ended up passing the year with very high grades. I thought things were going to get better, but boy was I wrong.

I’ve already explained this on multiple threads in an attempt to seek help and I’m tired of explaining it completely so I’ll make a short summary:

-It started in December, I couldn’t understand things. Sure, when somebody would ask me a question I could respond normally but I felt like I wasn’t processing the information correctly.

-When 9th grade began this February, I sort of got cured in a sense that I could finally think somewhat normally again to do work in school.

-Then, around March 20th, my symptoms came back and got WORSE. I can’t understand anything properly, I feel like everything that’s happened in my life from the past including things from yesterday were nothing but a dream and I can barely remember them, I’ve forgotten almost everything from the states, like how is that possible?!?! Back in November I could still remember everything. 

-This April, my symptoms have gotten worse. I’ve lost most of if not all of my creativity (My passion always used to be making YouTube videos. I have a comedy channel with a lot of subs but I haven’t uploaded in a while because I feel like I simply can’t) I can’t form any coherent thoughts in my mind, my memory is close to gone, my social skills have gotten even worse to the point where the only two friends I have in my school are starting to not talk much with me (probably because they think I’m acting weird) and I barely talk to the friends I made at my old school now (cause I used to socialize with them a lot). Right now it’s 9:51 am, I woke up feeling completely spaced out, and because of that the only thing I feel is a rush of adrenaline, fear and anxiety right now. I’m having trouble writing this, and it’s taking a lot of effort to do so. 

-It hasn’t affected me academically yet since all of this is pretty recent, but we’ve been given a few group assignments and I have trouble contributing on the projects. I think that my classmates feel like they’re doing all the work, and whenever I work on a project with my friend, he treats me like a kid with special needs and has to tell me to work. I wasn’t like this last year, last year I helped out on assignments a lot and got good grades. But with this thing, I feel like my grades are going to fall.

-I’ve looked up a few posts online and I’ve found some people who are going through the same thing, but they’re all 19-30 years old and they say that they’ve lost everything. It makes me wonder what is going to become of me if this keeps up, it could be life threatening.

When I woke up feeling all disoriented today, I thought to myself “This is the last straw.” I want to tell my mom TODAY about what I’m going through. I feel like it’s some type of disorder, like depersonalization disorder, anxiety or something. The reason I didn’t tell her as soon as it started was because she’s stressed enough already, I love her and I don’t want to worry her. I need help from you guys, what do you guys think? ",29Apr2018,13,
53,"So every time summer starts my mood goes to shit and I feel really detached from everything. I can deal with the mood but the detachment is really bugging me.

It's like every time I go outside in summer I feel like there is a kind of a barrier between me and the world. I feel uncomfortable and mentally not really there, it's like mental fog. Sorry it's hard to explain. I don't think it's full blown derealisation but I need to do something about it.

I think it stems from my childhood, I was mostly at home during summer playing at the computer and feeling bad that I wasn't out there socialising.

Does anyone experience something similar ?",29Apr2018,10,
54,"Hello, You are invited to complete a survey for a WMU psychology department research project designed to assess treatment preferences among adults seeking treatment for a variety of concerns. We hope to learn if and how preferences for treatment change over time, and if patient’s perception of their treatment’s match to their preferences is related to the benefit received from treatment. The survey is open to anyone ages 18 or older who is currently engaged in mental health treatment for at least one month and four therapy sessions, and not longer than one year. If you choose to participate, you will be asked to provide some demographic/background information, respond to survey items about your preferences for treatment and how they have changed over time, and about your quality of life. The survey may take between 30-40 minutes to complete. Your responses to the survey items will be anonymous and kept confidential. Clicking the “SURVEY” link below will take you to a page asking you to read through a consent form explaining the purpose of this research, the content of the survey, the type of questions you will be asked, the amount of time it may take to complete the survey, and the risks and benefits of your participation. At the end of the form you can click “AGREE” to consent to the use of the answers you provide and to begin completing the survey. Thank you for your time and interest.

https://wmichcas.qualtrics.com/jfe/form/SV_afS6lEMGYYG0JjT

Project Title: Treatment preference, retention, and treatment outcome at a university-based outpatient psychology clinic Principle Investigator: Scott Gaynor, Ph.D. Student Investigator: Chelsea Sage-Germain If you have any questions prior to or during the study, you may contact Chelsea Sage-Germain, M.A. at Chelsea.e.sage@wmich.edu or (269) 387-4497 or Dr. Scott Gaynor at (269) 387-4482. You may also contact the Chair of Human Subjects Institutional Review Board at 269-387-8293 or the vice president for research at 269-387-8298 with any concerns that you have.",29Apr2018,0,
55,"Hi, apologise first if these kind of posts are not okay.

I'm after advice on where to start looking for medical help or possible diagnoses even if it's that nothing is wrong with me.

I'm based in the UK, come from a family with a variety of mental health issues and have had concerns of myself having issues since a teenager.
It is getting to the point where it is starting to affect my personal life almost daily.
 
I'm guessing going to the GP/doctor is the only route to go to start getting help, but if I'm honest I really feel I cannot trust them at all and have been blown off by them seeking help as a teenager to the point where I feel they don't believe me or take my concerns seriously.

I'm not sure what other routes are available?",29Apr2018,1,
56,"I don't know if this is going to make sense to anyone, but here it goes:

So I live alone. Like no chance ever of someone walking in on me alone.  Yet there are times during my day where I start to do weird shit and am 100 percent aware I am doing the weird shit.

Like I'll start talking to myself (not normal for me) in half thoughts or saying things like ""you're fine"" or ""get a grip"" over and over to my self. Or I'll check to see if my apartment door is locked repeatedly even though I know it is, or I'll lay on my bedroom or kitchen floor for an hour or two at a time. Pacing, hiding in my closet, constantly keep looking out my window, etc. You get the picture.

The thing is the entire time I am doing these things I know deep down they aren't rational and warrant no reason to be doing them. I don't even tell my psych or therapist about them because the behaviors are embarrassing to me. When I am out in public I am largely able to get a grip on things other than being abhorrently spacey and need concentrate really hard on things.

It just feels like I am faking these behaviors to myself to convince myself I have deeper rooted problems with my depression which might not even exist.

Now I do get sleep paralysis, tactile and sometimes visual hallucinations, and my lizard brain obviously sometimes can't tell the difference in things. But even then I know deep down those things aren't real.

Does anyone know what I'm talking about?",29Apr2018,2,
57,"My really close friend, after having an excessively stressful week, talked to me extensively about what was going on with her last night.  She said that in regards to emotion, she feels everything, but nothing at the same time.  Her whole year has been going from on stressful activity to the next, with no breaks or hesitation.  She doesn’t say no to anything, and therefore gets swamped by piles and piles of responsibilities...

Our conversation last night really scared me, there were times where it felt I was talking to a robot, giving short, uninterested answers to my heart-felt insight and support.  I understand this is a personal problem, and therefore I can’t directly help, but I really care for her, and I’m concerned that if she doesn’t realise the load she has that she will end up hurting herself. 

After doing some research last night, I bought a book called The Energy Bus. I know she loves books and I’ve heard it to be an extraordinary positive, and uplifting book that lets you see meaning in your life.

I realise that I truly don’t have any experience or training on mental issues, but I want to be ready to support her in any way possible.  Any help or comments that any have, would be greatly appreciated. ",29Apr2018,1,
58,"i did a official iq test 6 months ago and scored 114 on the verbal part but i can´´´´´´´´´t barely talk and i never understand what i read.

how is this possible

i did spend from my 18\-21 in isolation while spsychotic and never talked to some one or did anything. i am 22 now btw",29Apr2018,2,
59,"Many traumatic events have happened to me in the last few years of my life as well as many other bad things. I wont go into too much detail but it includes: beong mugged, grandfather dying in front of me, an 11 year old dying in front of me, being in an abusive relationship, being falsly arrested for 21 hours (by my ex, she was charged).

Since then my life has crumbled. Its been 2 years since most of that and i dont feel better in the slightest. I feel worse even. Ive dropped out of uni and cant go back, limiting my career options, ive lost all my friends, i still love my ex and cant get her out of my head 24/7, ive attempted several times.

Im not getting better. And ive talked to proffesionals to no avail, they gave me medication and CBT. Im tired of living like this. In pain everyday and alone. ",29Apr2018,1,
60,"1 in 4 people are effected by mental health in any year. This means that if you go out for dinner with three friends, one of you is likely to have a mental health issue.

35-50% of people with mental health problems don't get help. Only 14% don't know somebody with a mental illness.

Every year, more than 800,000 people die from suicide. Thats one every 40 seconds.

Doctors are working in a system that is under sever pressure! See the video below for more information.

""Sometimes if you want to see a change for the better, you have to take things into your own hands."" - Clint Eastwood.

We must understand and realise that it is ok not to be ok, and then seek out support, advice and guidance wherever we can find it!

https://youtu.be/W1_PiuApc40",29Apr2018,2,
61,"Anyone has problem with oversleeping and getting out of bed and found a solution? I try to set my alarm to get 8 hours of sleep everyday but I always end up turning it off in the morning and then waking up hours later, It seems like I only feel rested if I get over 10 hours of sleep and it's so frustrating because sometimes I have to wake up early to do stuff and it's very hard to force myself out of bed. I feel like such a lazy person because of this. I take antidepressants and anxiety medication btw, but even before starting them I was like this.",29Apr2018,2,
62,I'm drowning. I can't breathe. I don't want to wake up and face homelessness and letting my family down. I'm falling into a pit of despair and can't get out. ,29Apr2018,1,
63,"This is a bit long but I really could use some insight right now and would greatly appreciate it. 
Lately I've been having allot of overwhelming unreasonable feelings. I've done a pretty good job at keeping it under control though and doing my best not to act on these feelings but last night I slipped up.  
My friend had asked if I was available and I said no because I'd been told I had a family thing. It turned out the family thing was actually not when I thought it was so I actually was available. I texted my friend to tell her but she didn't see it until it was too late. 
I found out on snap chat that her and another friend had gone out and I kinda snapped. I called her out and got really upset with her and was just being generally unfair. 
I felt immediately guilty and actually had a bit of a scare with a razor blade. I told my mom right away so I'm safe. 
I talked it out with my friend this morning and It turns out is greatly upset her. I feel awful and I don't trust myself anymore. I acted like a maniac and hurt someone close to me. 
What's next? Will I lose it on my boyfriend the next time he's out with friends? Will I freak out on a customer at work? I'm so anxious right now and don't know what to do. ",29Apr2018,1,
64,"Whats wrong with me? Nothing has changed in my life and there is no logical reason why I am depressed en full anxiety in the morning. In het afternoon I feel normal and strong, my mood is like day and night. Someone who expierencd the same?",29Apr2018,2,
65,"So I’m going to try keeping this short and concise. A few years ago I did have a few problems, but I’m just going to hit up on the most recent problem, which is why I’m here.

I’m a 24-year-old guy from the UK. Over the past few months I’ve been increasingly more and more anxious in the day to day. It starts with my heat ponding, sweating, and just a sense of unease. When I’m like this I find it really hard to just relax and I become very restless. 

Its not getting to the point where when I’m out in public I just feel uncomfortable and my chest gets tight. 

I’ve tried everything! I’m gay, and recent came out to some friends hoping that would help, it didn’t! I took a vacation abroad for a week to relax, that didn’t work. I exercise at home, nope! The old thing that works is booze! 

Years ago I didn’t have a problem with drink. It terrifies me that I’m going to fall into hold habits. But I’m not sure what else I should do. 

Any advice, or support would be amazing. Thanks!",29Apr2018,1,
