,text,time,score,subscribers
16,"First fyi, I'd like to tell y'all some things about me. At the end of May I'll be 23, I have a 3yo daughter and the most wonderful boyfriend. I've been through a shit ton to get to where I'm at right now. Most of it bad, but it was all a learning experience for me. Even in the first grade, I was being sent to talk to someone. At 14 I was sent to an alternative school because the teachers and staff at my school had been told that I was suicidal. Subsequently I ended up in a mental hospital and a ward of the state. I was diagnosed with severe depression and anxiety with suicidal tendencies. A few years later when I was 17, my new doctor wanted to retest me to make sure I got the right meds, I was then eventually diagnosed with manic depression  with social anxiety. Now on to the real story!

I can't stand psychiatrists or therapists or counselors, and yes this is all from experience. And because of my medical back ground, from what I'm actually certified for to what has personally happened to me or close family members, I don't trust chemically made or synthetically made drugs. I've been on so many different prescriptions I can barely remember them all. Basically I'm like the bubble boy, except I'm not a male nor do I live in a bubble. I'm just constantly fighting one type of sickness or another. But back to my original point in all of this. Because of my aversion to most modern medicine, I kinda have more limited options on ways of dealing with everything. So I thought maybe this sub could at least hear me out so that I can try and relieve some of the daily stress. Now I self medicate, and not just with that herb you're thinking of. I use lavender, bay leaves, tea, honey, etc. etc. But sometimes you just need someone to talk to about everything with someone that understands and empathizes with you. That's why I am here. For me, it is a daily struggle to keep myself in check, especially in public. There have been so many times where friends and family have point out to me that I'm being a bitch or overly excited or what ever. I can't control it all the time, it's like I there in my head but it's not me moving my body, it's not me talking, it's not me it's happening to. Then after I gain control again I feel so bad for what I've done, but I can never really make it up. I'm a very hard person to deal with on a daily basis. Eventually almost everyone gives up on me and moves on. I'm a very sketchy person now, all though I used to not be. I can still almost blend into normal society too. But even so, I'm constantly feeling like I'm being talked about, or people are staring at me. I'm never truly comfortable anywhere. Yet I still crave human interaction and I still have to function normally. ",29Apr2018,1,
17,,29Apr2018,1,
18,"Now that I think about it, this might explain why I fear engaging with women so much. 
I am male, USA. I very likely have a depression and mania disorder, not exactly fully diagnosed as I haven't been thoroughly evaluated. But I know I have hypomanic tendencies (excessive concentration and abilities, well below mania) and also depression (lethargic, little motivation, predominantly). I could also just have Secondary depression caused by my ADHD.

I actively avoid things that might make me feel bad, avoiding my phone because of possible calls about the eviction, or something worse. Avoiding the mail because of news I KNEW was coming my way (quit-notice pertaining to unpaid rent) to the point that 1 or 2 months passed and the mail carrier marked my mailbox as ""Vacant"" and all my mail was returned to sender.
I ""hang onto hopes"" such as trying to make money online and spend a lot of time trying to make those things work while ignoring the negatives... believing that I cannot get another job since I've already lost two in the last year, no one will hire me. And, of course, I don't try, even because it's just more pain.",29Apr2018,1,
19,"I’ve always been to afraid to ask...  it here it goes...

What is it like when you truly have “voices in your head”?

I have my voice... like that I read with and think with. But in that same voice, I get the negative shit talk. The voice that tells me that it’s easier to be dead. To take the pills. To get the gun, etc.   The voice that causes me to panic.  The voice that says I’m a loser and a fraud and that no one truly loves me. 

Is that “voices in your head”... or is that just inner monologue of depression and anxiety thoughts?  I know this sounds silly, but I really don’t know. That voice is so mean and hateful sometimes... it seems like it’s someone else.   I kind of hope it’s a voice,  because I don’t want ME to talk to ME like that. ",29Apr2018,2,
20,"I'm so incredibly disgusted with myself. I was overweight, lost it, then gained it all back then some. I can't look at myself without being absolutely disgusted. I hate my body. But I can't make myself want to change. I hate working out. I don't miss the hours in the gym. I don't miss counting calories and watching what I ate. I don't miss the anxiety of missing a gym day or eating poorly. I don't miss my mom telling at me for ""being picky"" or her accusing me of having an eating disorder. I don't want to do any of it. But I'm so fucking repulsive. ",29Apr2018,2,
21,"i asked my boyfriend if he’d want to help me make a video and submit it on Youtube and he brought up an interesting yet worrisome point:

being that my dad’s emotionally abusive girlfriend plays a significant role in the struggle and buildup of my obsessions.. what if she were to see it and yeah.. i don’t really want to elaborate on what she would do..

this would mean a lot for me to do because the prior submissions tend to focus on counting, hypothetical, and cleanliness obsessions while my obsessions mainly surround intrusive thoughts regarding religion, violence, doubt, and sexuality.

what should i do??",29Apr2018,1,
22,"I need help. Please. I hear people who aren't there. Loud noises and vocals literally scare me and both combined together make me want to end everything. Please, someone help me.. what is wrong with me, how do I fix myself. Please. ",29Apr2018,1,
23,"Hello Reddit. It's been a very long time since I've been here, haha. I have a problem that I am facing, and I wondered if some of the incredible people here might be able to give me advice.

Ok, lets start.

I have suffered from general **depression**/**anxiety**/fears of everything/lack of goals for the last ten years. During that time I managed to make it through university by coasting part time, but was **unable to look for work**. This is a problem, because it means that I **don't have the option of going back to school**. I wound up going on **disability payments** and subsisting at an extremely minimal level for several years, but it was obvious something needed to give. I then spent six months teaching English in China because I'd read it was something people could do that was low effort low skill, but I basically hated it and was counting down the days until I could go home.

Right now I'm living in Japan staying with a friend and doing just enough work for her to cover the cost of my food, but it is an obviously precarious situation. I love some aspects of Japan and think that being here for a while could be good for my mental health, but I do not love teaching English, at least from the limited experience I have of it, and I don't think I'll ever be able to cope with the Japanese work ethic. I simply **don't have the physical stamina to work 40 hours** per week.

So now I'm in a conundrum. I have about nine months during which I will have structure and a few hours every day to work on my goals. After that, I can either have a job in Japan that gives a visa (and is thus necessarily full time), or I go back to Canada and go back on welfare/disability. If I'm not actively doing *something* structured, though, I can only see the progress I've made on my mental health going backwards.

So now I ask myself: what can I focus my limited energies on that will lead to a better life?

* 1) When I am resting, **I like to read**, and I am in the process of trying to write a web novel. I was raised on books and think that with practice I could probably get decently good. I also have a lot of interesting experiences I can draw from. Obviously web novel writing isn't going to pay much unless something crazy happens, but there *are* ways to **make writing pay**... I just don't know what they are or how to get them. I think I might enjoy editing, since I have done that for free with some of the stories I read, and I think if I could make editing people's stories into a way to earn my keep, I might love that. Ok, laugh if you want :) Writing jobs are very **low demand**, and finding freelance jobs has the prerequisite of learning how to market myself, which might be extremely difficult or impossible for me.

* 2) My first time in post secondary was in video game design. That was over ten years ago, I was pretty mediocre at it, and I quickly learned that I don't have the personality needed to get jobs in that industry (I'm an extreme introvert and thus can't effectively network). However, based on my experience then, I think that if I put effort into **learning computer programming**, I might eventually get to a point where I could do work for pay and not hate my life. I have the advantage of being **able to focus** extremely hard for extremely long periods of time, and I read that computer programming is a field that could be **well suited both to my personality and to my anxiety**. Jobs in *that* field are in higher demand and pay better than writing jobs, and with some experience under my belt I might be able to negotiate part time. It might take a few years since I'd have to teach myself, but I have Canada's social safety net to keep me alive while I get there. If the end goal is worth obtaining, I think I could motivate myself, but it would be **extremely difficult**.

* 3) Since I am in Japan and do like it here, **learning Japanese** is an option. I wouldn't be able to get to a decent level in nine months without the money to pay for school, but if I put my life on hold for a few years, I could do that on my own while teaching English (blech), although my physical stamina would be an issue. After a few years of hating my life, I might eventually get to the level where I could do translation work, which I think would be awesome. Or I could use my native English ability to do other sorts of work in Japan, such as doing writing for video game companies or editing for translation companies... I haven't yet found any of those kinds of jobs, but I am assured they do exist.

I have three terrible baskets full of holes, and only enough eggs to half-fill one of them. Which one should I choose? If I have a goal, I believe I can work towards it, but I am anxious about choosing the wrong one again.

If you made it this far, thank you for reading &lt;3",29Apr2018,3,
24,"I don’t feel real. I feel like I’m daydreaming. I don’t have school for a few days and I often feel this whenever I’m idle or have free time. I feel lazy and aimless and... weird 

I feel like a ghost navigating a seemingly familiar life which belongs to someone else. 

I’m only on serotia right now and I really wanna try antidepressants again but my doctor is scared it’ll make my mania go crazy (she says I’m like... bordering on bipolar disorder which I kinda see...)",29Apr2018,1,
25,"Did you know people with high IQ's are more likely to have depression or other mental issues. Literally Einstein had a form of autism that essentially made him very smart. Fun, ....right??

So as I said before, I'm the bubble girl. I have a nerve disorder called Fibromyalgia, it makes my nerves and muscles work overtime causing severe pain at times. Sometimes it even hurts to where clothes, you are in almost constant pain. I hate being touched a lot, the anxiety of having that pain flare up at physical contact. It keeps me from being comfortable in crowded spaces, though I don't mind being in a small place by myself. ",29Apr2018,1,
26,[deleted],29Apr2018,1,
27,"I ask because i recently learn that my older brother has it. From his grandmother. He was their and he didnt like it. Appreally it personality disorder.
Then 2 weeks later talking with our mother i brought it up. Didnt say that my brother has it but like i heard about this. She turn arpund and is like i had that. With me ansering that not something that gose away.

So what is it. My mom told it mean you get heavly attach heavyly fast. Witch she dose. But my brother seem to be the opposites. He dosent get attach fast. But i know he get attached harder then he let on. Google research on it keep bringing me to little kid systom. My brother in his late 20 my mother 47. So help please what is it.",29Apr2018,0,
28,"I can't sleep at all, even after I took 200mg Seroquel and 20mg Zolpidem (ambien). A while later I took 1gram Xannax and I'm still awake! I hate it. I also have these weird ankles growing pains but x100. I'm not even a kid anymore so with? I'm sooo tired but nothing seems to help. Even tried a warm bath and some tea. Can anyone explain why nothing works? Or what I could try?",29Apr2018,1,
29,"Ok so quick synopsis- I am a very intelligent,good looking, amazing person overall &amp; honestly my only downfall is that I’m diagnosed Bipolar. I have been seeing someone for 6 months and have recently been 100% honest and open about my diagnosis &amp; everything that comes with it both good and bad. I was prepared mentally &amp; emotionally for this guy to run away as fast as possible but he didn’t. Now, we haven’t fully committed to each other &amp; are still “dating” but I want/need more of a commitment based upon my own specific needs. Not like I want to marry you but more of an understanding that we are exclusive &amp; all of that. My question is how does the average man generally feel about being with someone with a serious mental illness if everything is great. If I understand what I need to do &amp; “us” need to do to help me maintain my mental health is that enough? Or do I need to do anything more? I am falling in love &amp; am so scared to be hurt especially my level of vulnerability here. Any feedback or advice would be appreciated.  ",29Apr2018,1,
30,"So, I don't know exactly what this would be classed as, or if it even belongs on this subreddit in the first place- but I am so so so afraid to change even small things in my life. If my shoes wear out and I need to buy a new pair, I'll loose a few nights of sleep the days before I have to wear them. I refuse to get my hair cut, as I just can't stand the thought of appearing drastically different infront of others, mainly out of worrying about they're reaction. I don't know if this would be seen as social anxiety, or something else entirely- does anyone else have similar thoughts? Or am I just being weird? Idk- any help appreciated! (If this is grammatically incorrect or just sounds strange then sorry!)",29Apr2018,2,
31,"I just learned from this past months, that I have OCD. Which im in currently in pain and I seek help regarding on how I can work with it while doing tasks (reading/studying/logical reasoning)

Here's my post: https://www.reddit.com/r/OCD/comments/8fpygn/working_and_ocd_urgent/ 



If any of you are free or have some-time and the same time have knowledge regarding OCD, I hope you can hit me a pm. ",29Apr2018,2,
32,[deleted],29Apr2018,1,
33,"Hello,


I have a history of ill mental health but until after I'd finished abusing drugs it was limited to depression. Throughout the time I abused drugs, I didn't care. I had lost all feeling, no longer was I depressed because I knew it wasn't long before I could get high again.
My drugs of choice were MDMA and LSD, I would sometimes smoke cannabis. I never drank, that would lead to depression. 


My delusional thoughts are quite acute, but when they come they come hard. I've been at work a few times and had to go and cry to myself in a corner or the bathroom and try to overcome my thoughts and feelings.
I'll explain a few instances, which are in order from least recent to most recent:


I was at home with some friends over, we're just chilling and my dog walks in. One of my friends start petting my dog, calling him a scruffy dog in the tone in which one would speak to a dog to excite it. You know the one.
I felt like he was calling me scruffy and took it really personally, wondering why he would say that to me. This was probably the first of many to come. This was quite some time ago, almost a year and a half ago. Since then I've had other experiences but unfortunately I can't remember them all.


I'm walking through work and a colleague starts a conversation, it starts off quite well with a simple how's things and the weather pretty generic textbook conversation, any way we somehow get onto the subject of the homeless guy nearby that frequents outside our place of work. He then mentions how some of them can be con artists and finished by saying ""you know who's genuine"" He did say something immediately before that sentence too which struck me as well but I can't remember...
At this point my mind was convinced he was no longer speaking of the homeless person but actually speaking about me, to himself as if to say I'm not genuine. I walked off thinking why did he just say that to me? I was hurt, although I understand why he would say that. I find I'm a half empty vessel at times, people aren't my strong point. I found a secluded place to cry and try to compose myself.


I'm sat at a table with my girlfriend, her mother and her partner. My girlfriend starts speaking about her dad, mentioning he's quite dominant in a conversation. Her mother replies with how he only wants to speak about things he's interested in and doesn't care about anything else.
At this point I'm convinced she's actually just said that about me, so I'm sat struggling to compensate by talking across the table while other people are speaking to prove her wrong. I was unable to speak, as per usual my inability to perform socially got the best of me and in this situation made me feel worse.


I struggle socially as I'm not sure when it's my turn to speak or if I should at all, whether or not what I'm saying is worthy of someones ears. So I don't really socialize any more, the last time I tried to make friends with some people from work we went out and I actually came home and cried to myself every time because I knew my efforts were futile.


So I seclude myself, I am not on social media, I don't speak to my family although they care for me I'm afraid to connect. I don't have friends, or at least the ones I do have I just ignore these days, texts or calls just get rejected. I hate passing anyone I know in the street, does one just say hello or converse further? If I just say hello I worry they're offended I didn't say more. If I say more I'm worried they actually don't care or are judging anything I'm saying.


I'll end on this, although I'm troubled and hate the way my mind affects me. I'm depressed about my life and the fact I feel I'm stuck in a dead end job with no prospects, I can't help but love life. I'm not suicidal in fact I never want to die, I love life despite its struggles. I just wish I could conquer my own life.


",29Apr2018,1,
34,"Didn’t really know where else to post this on Reddit, but does anybody else have full on conversations with themselves? I notice it most when I’m drunk or under the influence of drugs, but have definitely caught myself doing it when I’m sober, and well before I started using drugs in the first place. Is this a sign of something? I’ve been recently prescribed Zoloft for a separate thing (I had extreme shortness of breath after pneumonia and developed a minor panic disorder as a result) but this is something that’s always been going on way before that. Just wondering if anybody has the same sorta thing or any suggestions because it is really weird to me sometimes. Honestly I’ll end up in full on conversations and it seems like I’m observing the conversation while it’s going on and it’s kinda crazy haha. Any response is welcome, thanks ",29Apr2018,1,
35,"My wife told me this tonight in all seriousness. I thought I was also querky with an overactive imagination but not crazy... These are my ""querks"":

- act out different characters in front of the mirror

- narrate out loud when doing tasks as if I am making YouTube videos

- I have multiple inner voices that seem to pop in and out of my thoughts like I have turrets but thoughts. Like they will say random things, like ""88888 and with two friends"" etc. Sometimes they are very negative though.

- I shake or make noises as sometimes it feels like I get a sudden burst of energy that I can't control. Or say out loud things like ""add 99cents"" randomly

- there was a period where I thought at night that I could go into this lucid state where these ""beings"" told me they would help me reach ""the top"" so I could help them with their plans

- I get fixated on crazy ideas. Lately it has been packing my grocery cart perfectly and hoping the store clerk notices it, previously it was I had this strong to make electromagnetic devices and take them out to the dessert. Don't know why.

- someone stole a 5$ ball from my front yard. I drive around the streets for an hour or so at night  looking for who stole it. I'm trying to setup a camera now in case they come back.

- sometimes I think I see things out of the corner of my eye but I can always seem find what it might be. A fly, or a bug. But the initial thing I thought I saw was bigger than a fly or bug. But I can never out my finger on what I saw, so it might be a fly..

- I'm medicated for anxiety and depression.

- I'm 25, male.

What's wrong with me?",29Apr2018,1,
36,"I have not much of an idea about bipolar but I’ve heard delusions and erratic behaviour, outbursts and odd thinking patterns are common, she says she’s been diagnosed and I’ve known her for years, she has not done one of those things,

She’s just been sometimes happy and sometimes sad and I know I can’t feel what someone else is feeling but is it possible to have bipolar without all those symptoms?",29Apr2018,0,
37,"Hello all. Just wanted to post here to get some wisdom from this sub.

The world health organisation state that mental illness reduces life expectancy at a rate of between 5 to 25 years. Now, I determine that factors such as increase in smoking, drugs, alcohol and other factors come into play for this population...but naturally so will co-morbidity (health problems alongside the mental illness). However, I wonder how many of these additional medical problems were caused by taking SSRIs and their side effects. Meaning, how much of this decline in life expectancy is caused directly by medication?

St John’s Wort seems to be an effective choice for those with mild to moderate depression. However, some studies have shown a correlation between irreparable eye damage and SJW. It seems to be the ingredient ‘Hypercin’ that is to blame (and it’s reactivity to sunlight).

Just wondered how people feel about these points? I took SJW and I felt it made a massive difference. Unfortunately the prospect of irreparable eye damage was too much of a risk for me, so I stopped. I do feel that taking SSRI’s could be an option for me at some point, but cutting 25 years off my life seems like a huge price to pay.

Also: does anyone know of a Hypercin-free version of SJW that I could try? Would like to try that before SSRIs if I can. I’ve heard they exist but can’t seem to find any.",29Apr2018,3,
38,"Hi people,

Tomorrow I start as a support worker in a psychiatric hospital in the UK. All too often I hear/see negative comments from people, or people asking ""what's the worst thing you've seen?"" 

Hopefully this thread will help future patients feel a bit less afraid of hospitalisation. 

",29Apr2018,16,
39,"Every once In a while (like now) I'll start panicking and everything in my life just seems shit. Like I'm in way over my head and every task seems so big and scary, couple with this overwhelming sense of anxiety and dread towards everything. It just hits me like a ton of bricks and I don't know why.

Does anyone know why this happens? D:",29Apr2018,6,
40,"I have friends, a lot of them, all are super supportive, kind and care for me, I have a supportive family that is worried about my behaviour, and have good health and looks, it started where I just clicked and sat in front of a depression diagnosis, suicidal thoughts became attached to my lifestyle replacing hygiene and healthy habits and the anxiety destroyed all studying and school opportunities, I have a ton of good memories and good laughs, but something isn’t right, I’m all too close to removing friends on Facebook, Snapchat, instagram, Twitter,Skype, discord, steam, Spotify, and stop hanging out at any of our spots and completely change schools, but I can’t put a reason on it, maybe as a form to punish myself?, to prepare myself so if I were do it, it would affect the least amount of people as possible?I’m on the brink of destroying my social life for no reason, like a social suicide. 
",29Apr2018,2,
