,text,time,score,subscribers
0,"I feel like if I don't have a lot of noise or full mental distraction, it's just a loop of ""you are nothing. You are nothing. You are nothing"" in my brain. ",29Apr2018,203,
1,[deleted],29Apr2018,1,
2,"I have a therapist. I try to be honest but I have so much going on. He suggested a get a case worker for my health stuff which will help if it works. 

I tend to use metaphor when talking about how I feel. I am in a sea of gray or in a well of despair or between a rock and hard place. Nothing resolves my internal tension but avoiding stressors doesn't wind me up. 

I actually want to be dead. Not in a going to hurt myself sense but in a it would be better not to be here sense. If I knew a painless guaranteed way I would take it. 

I want to tell my therapist that next week but I don't know how. We are in the same line of work so I worry. ",29Apr2018,1,
3,"I can't hold self esteem because I know I can't save everyone for good. There's no way to save all the organisms living on the world. The only ways I've thought of were cloning immortal copies of one person who loves nature or wiping out all of the humans. 
I just can't take my eyes off the animals suffering and dying every second of my life. I just can't see a world where there is no bloodshed.
I can't even cry to let it out. It feels like I forgot how to. I see way beyond what I need to see, and it hurts me. I can't seem to just look away, even for a second, and so I feel I've become emotionally numb. Is this some kind of extreme teenage depression or something else?",29Apr2018,2,
4,"a clickbait title maybe but nonetheless i feel as though i have a problem and i need help. i have this one friend, lets call him coury, and every single time we talk he bitches like i have never heard him go five minutes in a conversation without him mentioning how horrible his life is. and sometimes when i am feeling good it just brings me down. and sometimes i feel bad and i try to talk to him about it he always tries to one up me with his depression ex: i say ""i dont know man, i just feel really bad my stepbrother is suicidal again and i want to help him but i cant"" and he will shootback with ""well my real sister is getting death threats and got kicked out of school"". i dont want to be a dick and tell him to stop bitching but i know he is going through alot. i just am too and it feels like he just wants to always one up me. 
the snl sketch penolope comes to mind",29Apr2018,1,
5,"I've already made reddit posts about this but i just really want and need some more sincere people giving me honest opinions. I'm not sure what exactly will make me feel better but maybe yall might have an idea? 

I have a history of sexual assault. in high school my dads employee manipulated me into sex and threatened me so i wouldn't tell anyone. after two years i told my dad and my dad refuses to fire him and actually still hangs out with him regularly as a friend. I love my dad and don't know how to handle the person who is supposed to protect me hanging out with this man who did this awful thing to me. 

I also was recently raped \(in the last month\) by someone I thought I could trust. It's broken me. I'm anxious all of the time, I can't be with my friends without freaking out and feeling uncomfortable, and I cry all the time. I had to tell his wife about it and they have three kids so I feel like I've ruined a family. I also have been admitted to a mental hospital twice in the last month for suicidal thoughts and plans. The first time I got out and I was much worse once I left because my boyfriend found out what happened and didn't take it well. He's now decided to stick by me but I had to be admitted again because I had fantasies of revenge and killing myself and I tried to steal my parents' guns. My second time in the mental hospital was awful, one of the techs was high and fighting with patients and another tech FaceTimed me and other patient's faces to her friend even though this is a huge HIPAA violation. I reported these incidents and the nursing staff accused me of lying and said if I said that tech was high then they would just lie and say I was high. I ended up getting the attention of some higher ups and they're launching an invesigation but anyway this time in the mental hospital made me much worse and didn't help me at all. I'm still feeling suicidal and if I bring it up to my friends all they say is generic ""it gets better"" and ""you have so much to live for"" which doesn't help the rage and betrayal and disgust I feel. I can't tell my therapist how bad my thoughts are or she will call the police and send me right back to that awful hospital. I see a psychiatrist and am on medication but it doesn't help much either. I'm afraid I'll feel like this forever and I've reached out to my parents, my friends, healthcare professionals, everyone I can think of and I feel like this is a dead end and I'm never going to get better. ",29Apr2018,3,
6,"so I'm 18 and the last time I truly lived my life was when I was 10. This was the period in which I would hang out with my friends and overall lived in a 'normal' life.  Yeah, I had OCD tendencies when I was younger but it did not formally hit until middle school- so when I was 11 years old.

For years now, I have basically lived my life googling random things on my computer and having to keep on bookmarking everything. I'm basically on my computer all day long-I honestly, I have no life (had to take a medical leave from college because of OCD). Yes, I tried random activities such as track/cross country, color guard, acting class, theater, volunteering and more but I was never really present. 
 
I do not know what it is like to live a 'normal' life or what it entails as my life for so long as been OCD. Currently, I am on a waitlist for residential but I'm scared what my future entails without OCD. It's kind of funny because as much as I hate my OCD, it's also a part of me.",29Apr2018,1,
7,"I’ve been having this problem over the last few months where whatever I do, I can’t seem to get any satisfaction or relief from it. It’s not like I have stopped enjoying things that I like doing, I still love doing those. Its satisfaction and relief from stupid tasks that bother me more than they should

For example when I want to mail a letter and everything is set and ready to be sent, I start second guessing. I reopen the envelope and re read the contents over and over again but I am never content with it even though it’s perfectly fine. I have to go against my instinct to recheck everything and reopen envelopes after envelopes and wasting stamps.

It’s only until it’s sent and out of my control that the feeling goes away.

Anyone else feel like this or know how to remedy it?

Thanks :)   Not sure if this belongs here so if it doesn’t, let me know and I’ll delete it ",29Apr2018,2,
8,I just cant anymore... its too painful,29Apr2018,2,
9,"I’ve had a very long ongoing battle with depression spanning the past couple years. Late last year, after hitting my lowest point, i decided to try and take my life back. I stopped drinking, changed my mindset (actually kept up with my meds), all of that. And for the past 6 months or so, I’ve been doing really well. But lately, I feel like I’m starting to lose myself again. I feel like I’m having a full on relapse. 

I know that I’ve been extremely stressed lately to the point where I’m having migraines (big life changes coming up), but I’m starting to feel like the entire world is weighing me down, like the pressure is starting to get to me, and it hurts. I just feel like maybe I can get some words of encouragement from someone who’s been there. Anything would be greatly appreciated. ",29Apr2018,1,
10,help me not be stupid in front of people for saying negative shit to people to be disrespectful to say tight wet or pussy dick help me get rid of these unwanted though and eliminate any wishful thinking give good reasons to keep my yap shut I will not fight I am a God to honest man with a big heart I'm only 23 I've never done anything to anyone to hurt them I've only been in a dui I would save lives if in danger from a gun man I wouldn't hesitate to kill for those I love. I was normal  I know that's not far it now but I need to stop worrying so much about shit that really matters.. I say things to myself like I'm alright or FUCK THAT SHIT or we are all having a good time. I need help getting rid of these things so I can be out in public free from anxiety .. I want to become a marine and mental toughness is my priority next to positive mindset and ,29Apr2018,2,
11,"TLDR: SO of 8 months is having serious delusions of grandeur, believing he can dismantle the entire world by way of social media. I have no idea what to do and need help!!

I have been seriously involved with my SO for about 8 months. We happened very fast, and out of financial necessity more than anything. 3 weeks after meeting, hurricane Harvey made landfall, leaving both of us without a place to live and he without a car. We decided that it would be wiser to cohabitate, save our money, get him a car and a new job, (he despises his current occupation), and try to figure out this relationship thing between us in the process.     

That worked for about 2 weeks, until I lost my job due to repercussions from hurricane Harvey, which forced the owner of the small repossession business I was working for to dissolve the Houston branch.     

I immediately began driving for Uber. Since he was still without a car and works 50 miles away from home, it was more cost effective for me to drop SO off at work at night, Uber around town for 7 or so hours, pick him up from work in the morning, then head home to get some sleep. I also worked on his two days off during the week in order to make enough money to keep us financially afloat. We did this for about 2 months until I ran into a medical problem necessitating surgery, and therefore a hefty hospital bill, which we had to scrape together and which I lost a week's worth of work out for recovery as a result. This caused us to fall behind on my car note, and my car was repossessed a month later when I couldn't pay the overdue balance and my current balance at the same time. (They refused to work with me on a payment plan.) Once it was repossessed, it would have cost over $2300 to get it out, which was money we didn't have, and there was no realistic way for us to attain such an amount. For the next 3 months, I struggled to find any side jobs I could do for extra money while trying to figure out how to get SO to and from work every day. I applied to every job I possibly could, with no results. We barely escaped eviction, twice. We fell several months behind on several bills as well as my credit card payments, (furthering the destruction of my rapidly crumbling credit score).     

During this time, my severe depression and anxiety was going absolutely haywire under all of the stress, and this is when I started noticing some things about my SO that began to concern me. He had previously told me that he, too, had experienced depression and has anxiety as well, so when I felt my sanity begin to slip, I tried to talk to him about it, attempting to explain what steps he could take to help keep me from becoming too wrapped up in my depressive episode. When I brought up the subject, though, he took it as an insult, calling me selfish and inconsiderate of his feelings and all that he had been doing to keep a roof over our heads. He went on a rampage, yelling and stomping through the apartment, throwing things around, just basically having a temper tantrum. As someone who has already survived an abusive relationship, I am unfortunately conditioned to a certain response, and began to apologize profusely for making him angry. I ignored the overwhelming anxiety as best as I could until he left for work and I could allow myself to break down. The next morning when he returned from work, he apologized for getting so upset, but held his stance on the fact that it was still my fault.     

This kind of thing has happened several more times; I bring up a subject to talk to him about, and he turns the tables on me and makes me feel invalidated, ending with me apologizing for being selfish and inconsiderate through tears, followed by panic attacks and depression that lasts days, sometimes all week.   

In February I attained a decent job, and began working again, bringing in steady money. In the past 2 months, I have made enough to buy a cheap car for SO, (which broke down 2 weeks ago and has still not been fixed despite throwing over $500 under the hood), and catch up on almost all of our remaining bills. I made a budget to get us back on track, and made goals for us to reach for. I still need a car, and we need to move somewhere closer to work. (I work 10 minutes from SO's job, so now both of us drive 50 miles ONE WAY from our current apartment.)     

While I began trying to focus on these goals, SO began acting more erratic, becoming more and more entranced in his phone, specifically in social media. His dream is to be a photographer and writer, and he uses Instagram, Twitter, and Facebook to connect with other like-minded people and to promote his work, something which I have tried my best to encourage, even going so far as to buy him a nice DSLR camera and trying to set up a legit photography website, with corresponding business cards to disperse, as well as a blog for him to write. I offered free photoshoots to some of my friends in order to build his portfolio and gain experience, but every time I scheduled a shoot, he would come up with an excuse not to go. I tried to do the shoots myself, (and failed), two times and ended up canceling the rest. He never even looked at the website or the blog, and the box of business cards is collecting dust, unopened.    

 It seemed that the more SO became engrossed in his phone, the more he ignored the things around him, including me. He has lost all interest in intimacy and sex, saying he has too much on his mind. He began having fits of anger and would rant about how he has been ""saying these things for years but nobody believe[d]"" him, and that ""everyone has always called me crazy, but I'm not! This proves it! People out there are noticing!""   

When I asked him to extrapolate on what he meant, he went on a tangent about all sorts of things ranging from how fucked up this world is, and how we are killing the earth, all the way to how famous musicians and rappers are using his exact words in songs, things that he has been saying for years, and how he's tired of other people making money off of his writing.      

A couple of weeks later, the rants evolved into how he is speaking up and how he won't be silent any longer, and that he is going to ""do this right"" and make so much money that we will never have to worry about it ever again, and that no one, NO ONE, will hold him back! 

He has also told me a few times now that famous people, Rick Ross in particular, have told him that he needs to ""get out there"", and to ""do it right"" so SO can ""make it big"".     

 SO also believes that famous people have also told him that what SO is saying online is ""causing a stir"", and that it's ""drawing attention"" to SO, and that he is inevitably going to piss off the wrong, influential and crooked people, and they are going to kill him, and possibly me since I am affiliated with him.       

He mentioned that he wants to buy a firearm for protection from them.      

A couple weeks ago, he told me that he caused the entire city of Houston to stay at home during the weekend of the Astros and Rockets games, noting that there weren't many cars out on the road that weekend, all because of what he had been saying online.     

 A few days ago, he straight face told me that Nikki Manaj just put out a song, just that day, that she wrote about him and his online influence.       

He has also mentioned, on several occasions, that people online are calling him a God, that ""they all want me to be something I'm not"", and how ""they want to take what I'm saying and twist it and dissect it, and pick out the things they agree with and use the rest against me"". He also believes that ""they"", (whoever ""they"" are), want him to completely dismantle the government, to destroy the status quo because it is such a wrecked system.      

As of this morning, SO told me that he ""single-handedly caused the cesation of the Korean war"", that the reason North and South Korea have come to an historic agreement is because of everything that SO has been saying online this week about how we need to be agreeing to peace in order to save the world instead of fighting amongst ourselves.      

He constantly talks about how much smarter he is than anyone else on this planet, and how no one can keep up with the mental leaps that his mind makes, and that this is the reason why he doesn't tell anyone about it because no one else understands what he's going through, and because they don't understand, they will all tell him he's crazy when he KNOWS he's not, and he refuses to be convinced that he is crazy ever again. (He claims his ex-wife used to twist things he said to make him feel crazy, and he vows never to be manipulated like that ever again.)      

This morning, he sat in bed next to me, listening to music through his headphones and crying. He told me that he is at an impasse, that he has to make a decision about what to do from here on, that this particular decision will result in a world war to end all wars, that millions of people will die, that their blood will be on his hands because of what he is saying online, and that this is a very heavy burden to have on his shoulders.       

At this point, I am scared. I have no idea what is going on with him, and any time I try to bring it up, he goes off on these raging tirades that just get more and more impossible and surreal the longer they go on.      

 I have tried calling all of the mental health resources I could find online, but they are all closed until Monday.      

I don't know where else to turn.       

Help me, Reddit, please... I am worried and scared, and stuck in a situation I can't get out of with someone who truly believes he is the smartest human alive, he can control the entire world with his cell phone, and that he is going to cause the breakdown of the entire world as we know it through use of social media, and that it will cause the deaths of millions.       

I don't know what else to do.


*Sorry, I don't know how to make paragraphs in a post. 😫

Edit: Figured out how to create paragraphs.",29Apr2018,6,
12,"Hey guys, if you don't mind I could use the perspective of someone who's been there or someone who knows better than me.

This is about me and my friend, both girls in college. She is severely depressed, has been for most of her teenage years and is very deep in that hole. I know I can't lift her out of it, I can offer to find her a therapist, make the calls, get her there and back but in the end; the decision to give it a chance needs to be hers. 

We've spoken about it a lot of times, why she doesn't want to go to therapy and is afraid it won't work. She's scared she's been feeling this way for too long, that it's too late to get help; that she deserves to feel this way because she's responsible for all of it, that she's not worth someone's efforts, that she doesn't deserve to feel any better. She knows all the ins and outs of how it's medical, chemical, how she's being unfair to herself and her view is skewed, how all her reasons for not wanting to give it a chance are just excuses. It's free in my country, you don't even have to commit to it right away because there's 5 zero-commitment sessions with every new therapist. She knows all this. And sometimes it feels like she's actually hearing me and actually considering it, but in the end she always shuts down.

There's this truly beautiful amazing person who is battling all this shit she doesn't deserve and I wish I could take it all away from her but I can't. I would move the planet to get her help if she allowed me, but so far she won't. Her life is so far from over and there's so many wonderful things out there and I know therapy doesn't help everyone, but most people benefit from it and she hasn't even tried. She is not actively suicidal but essentially just waiting for her life to be over. I'm sure you all know the feeling. And it hurts so much to watch because she doesn't deserve any of it, she doesn't deserve the way she's been treated and the way she treats herself and there is no objective reason holding her back, just that she's her own worst enemy. I know it's depression protecting itself. Some days I feel like I'm talking only to the depression part, and not to her underneath at all. Some days she actually listens. But I don't know what to say anymore. 

If you've ever been in her situation and did end up deciding to do something about it, what was it that needed to click for you? What changed? If you're currently in her situation, what would you *want* to hear? Even if it won't be any kind of wake-up call, what can I say to make it any more bearable for even just a moment? I want to be there for her and I know I can't make that decision for her and if she's not ready she's not ready but I'm not ready to give up hope. ",29Apr2018,2,
13,"This woman in my fathers life is extremely controlling and manipulative. She is late 30’s and still acts like she is a 13 year old. She influenced my father to kick me out when I was very suicidal with bad depression. Her mental state is unhealthy as my dad stated when they broke up a couple years ago. She has abused my father before. When I did live there previously, I would hear a sound that sounded like a hard slap. It was late one night and I heard her yelling at my dad. Then I heard a slapping sound that followed my dad saying: “I don’t deserve this abuse.” So it sounded like she was throwing a tantrum. Some of her family don’t speak to her sometimes to the point where they moved to a different state! My problem as of now is that I’m trying to retrieve my (expensive) personal belongings from my dads house. I have been trying for almost two weeks now. I contacted my dad only for a text he replied saying that “he has a concern about giving it to me.” I understand that he did pay for it and all but I worked for it so he could help pay for it. I am scared what they are both going to say to me about it. I need advice and what I could do about my situation.
Thanks! ",29Apr2018,1,
14,"I feel like I'm always weighed down by a lead blanket, not really living my life.  I've always been shy and reserved and never felt like I could be myself around anyone, even my wife and 3 teen kids.   I'm on anti-depression and ADD meds which have helped in many practical ways, but the depression meds have reduced the highs just as much as they've reduced the lows.  I have to have them to function though.   Going way back, my mom died of cancer when I was 12 and my dad became an alcoholic not long after.   He was functional and provided for me in every physical way but had nothing to give emotionally.  For all of my adult life, I'd say a fourth of ""me"" has just been going through life waiting for it to be over.   I've never been suicidal, but I can rationalize the feeling that 48 is long enough for a life to last and, for example,  I'd be at peace if the plane I was in was going down or I was in some other unavoidable situation.   I would say that the thing that connects me most to the world is my feelings of pain and loneliness.  Knowing that those lowest feelings and experiences have been felt in every civilization for as long as humans have been around is comforting and connecting in a way.

My family loves me and wants me to be my best and be connected and present with them.  I don't think t hey can't help me because I've been neglectful in the relationships, and it's all too emotional, but I don't know what kind of help I need.   

",29Apr2018,1,
15,"I don't know why but when I'm driving I'll suddenly just start focusing on the curb or whatever is right next to me \(Another car, bushes, cliff, etc\) and once I think about it I just can't stop paying attention to it. This ends up giving me anxiety and my driving becomes unsteady and I think I'm going to hit whatever is next to me. It takes all my power not to swerve. No matter how much I tell myself to just breathe, have confidence and don't pay attention to the side, I just cant. Why is this? Anybody have a similar issue? This has just been happening the last few months.

I wasn't sure what sub to put this in.",29Apr2018,1,
