,text,time,score
1,"I’ve been slowly realizing that I might be in an abusive relationship. I’ve been with my fiancé for 10 years and his behavior is the type I grew up with with my dad mistreating my mom, so I guess I just normalized it. I feel sorry that I’ve wasted over 1/3 of my life on him, but the way he’s treating me is making me severely depressed. I even tried to end my life this summer. How can I leave? How can I explain this to my family and friends who have never seen this bad side of him? How can I move on?",20Feb2020,1
2,"I am 27, and I have been working dead end jobs since I started working. The only desired places of employment in my town, are the mills that everyone seems to work at. So, basically my only hope to better my situation is to pursue a line of work that is more broad, with more opportunities. Ideally something that will survive the changing times with automation becoming more common. I am leaning towards a career in computer science, or information technology since the demand for this type of work seems to be increasing. But I am having doubts about it due to my lack of formal education. I earned my GED in the state of California, and only achieved around 70% of the required credits to graduate.

\-----------------------------------------------------------------------------------------------------------------------------------------------------

So I guess my questions are;

What extra schooling/time would be required of me given my lack of high school credits?

When perusing a Bachelor's in a given field, am I required to take all of the general studies classes as well?

I have weak math skills when the equation is formulated for me, but when I am the one creating it, my understanding of the process is far better. With the aid of a calculator, I have no issue. If you are someone  who has had this issue, how did it impact your experience with math in college? How did you overcome this?

If you have a career in one of the fields I am interested in, what was your experience? Did college provide you with the necessary tools for the job you currently hold? Or did you have to learn the whole process on the job?

If you waited till you were half dead to turn your life around, how did you manage it? If you pursued a higher education, did you find the process to be difficult/demoralizing? 

If you did not go to college, but took classes to learn a trade, what is that trade? And what has your experience been like?

\-----------------------------------------------------------------------------------------------------------------------------------------------------

If any of these questions apply to you, and you have answers, please PM me any responses. Or just any advice in general pertaining to financial improvement given my lack of skills and experience. 

Just a guy here who has been married for a while now and want to set a proper foundation to raise kids and start a family, but lack the direction and confidence to do so. Thanks for reading.",20Feb2020,1
3,n,20Feb2020,1
5,"My bestfriend have suicidal thoughts, depression and anxiety. Lately she been thinking she's not pretty or good enough for people, and that she just wanted to be ""beautiful and happy."" We are 13 to put that out there. I tell her that beauty is subjective, and that's she beautiful just the way she is. But she claims that I'm lying. She started having these thoughts about her self because of her crush. Last year, her and her crush started having romantic feelings, and getting really close. But never officially went out. He is similar to the clique ""nerd"" he's not famous, nor talkative, and straightforward. This school year, he starts to ignore her, not saying why or nothing. She feels like she's not good enough or pretty enough for everyone. That's when she started to SH. Lately she been asking me how can she change herself so she can be beautiful so everyone can stop giving her werid 'looks'. I try to tell her that there's always going to be someone judging you, not matter how 'beautiful' you are. But she doesn't care about that. She asks people to rate her 1 out of 10. Today, she gave me a note at school and it said. ""People has been ignoring me for no reason, and dont want to make eye contact with me, giving me looks, staring at me... people called me ugly, what can I do to improve my looks"" I'm not sure what to say. Her looks is definitely above your average 13 year old. What can I do to make her realize her worth? How can I help her?",20Feb2020,1
6,"

I have been writing my life story the past year. My life includes many challenges and this book is how I overcame them. By looking deep into the unknown, I discovered a reality that I think is pure. It’s a state of mind more than anything but I feel free from fear, judgement, and anything negative. My memoir will dive deep into the dark corners of my life and how I now live with a different perspective on life with love in my heart. I share intimate details and try to relate to many people with struggles of pain and suffering whether it’s mentally or physically. The book is a path of transformation and I want to share this path with the world so that everyone will know there is hope and we all can heal.

Would you be interested in reading a book like this?

Thank you in advance for any input!
Much Love!",20Feb2020,1
7,I don’t like them (romantically.) But they appear in my dreams and I can’t stop thinking about them no matter how hard I try. Being around them just stresses me out now to the point that I can’t make eye contact with them without feeling super anxious. I wouldn’t quite call it a crush because I don’t *want* to like them nor do I like them. They’re just stuck in my head like a crush would be.,20Feb2020,1
9,"So, since I was 14, I was planning to study diplomacy, but the University (College) is too far from my home and I don't have money to move out.

 I started studying design on the local one last year, while working to get some money to move, but in the middle of the year I changed my mind and gave up from my dream of studying diplomacy (the why is useless).

Now on February (2020) I start feeling a strong will to start Med School and our local University has it, but now I'm feeling really afraid to do it (since I can't see blood) and feeling bad for wanting it, because I have other dreams like starting my own company and YouTube channel  
(don't judge me, I like making people laugh), also I don't want to finish it ""too late""

(I'm 20 years old this year, and feeling like 45)",20Feb2020,1
11,"this may seem petty or trivial, and it probably is. But im seeing this girl and its just coming up to a month of us going out and she sent me a message just saying "" i love you "". Thing is, ive known her a while before going out, and i know she hasnt had the best experience with guys either (dont worry this isnt gunna become a white knight post), so i feel like she might be rushing to that conclusion of loving me. I know i cant decide her feeling, and maybe she truly does, but i also would feel kind of guilty if shes only saying that because the guys in her past were complete assholes. What do i say in response?",20Feb2020,1
12,"My dad is a horrible driver. He takes his eyes off the road constantly, he speeds, he pulls a lot of risky moves. Sometimes he takes his hands off the steering wheel for 30 seconds or more. 

The thing is, when I tell him that he shouldn’t be doing these things, he doesn’t listen. He just gives me the “yeah, yeah, I get it.” Maybe he doesn’t want to listen because he’s been driving decades longer than I have. 

Is there any way I can get through to him? I’m lucky enough to not have to drive with him as often as I used to, but I still don’t feel safe when he’s driving. It’s a terrifying experience.",20Feb2020,1
13,I'm broke as hell and don't have a job currently but might get a really good one in the next month but I'm not sure if I'm gonna get it. If I don't get it well I'll look for a different job but that may take awhile. Also friends and family aren't an option right now because I just want to be alone and they're all going through their own shit right now.,20Feb2020,1
14,"She says I'm hiding someone in the basement, I'm praying against her, I'm wishing something bad on her, or I'm doing witchcraft on her. She tells me to leave her alone even though I'm not bothering her. She calls me retarded, says I need help, and threatens to call the police on me and take me to a mental hospital. She asks me the same questions over and over again and if I don't answer she gets mad and curse me out. She keeps asking me to move my bed by the door even though I told her I don't want to. She asks me why am I looking at her even though I'm not looking at her. She's been doing this since we were kids. She won't stop. It's annoying and it really hurts my feelings. She knows that but she doesn't care.",20Feb2020,1
15,I don't know what his problem is. I asked him to leave me alone and I told my mom. I even called the police. I don't know what to do anymore. He harasses me. When I come out of my room he yells at me. When he sees my room door open he opens his room door. Then when I close my room door he closes his room door. When my room door is open he closes it. When I come out my room he watches me. He follows me in the kitchen. He stops and looks at me. I'm sick of it. Sometimes I'm left home alone with him. I go in the bathroom and lock the door until my family comes back home.,20Feb2020,1
16,"2 days ago I broke my arm and sprained my wrist Faldo when the stairs at school. I have a cast on my left arm and a brace on my right hand. Now many everyday things have become a challenge:brushing my teeth, eating, bathing,getting dressed,etc 

My sister has offered to help but I’m kind of embarrassed to ask her for these things, she already deals with enough things and I don’t think it’s fair for me to add to them. What should I do",20Feb2020,1
17,"I am considering doing uber, but I would need to rent a car in order to do that. The car will likely cost around 400 a week. I am allowed 250 miles a day of driving on it. Is it worth it? I live in atlanta.",20Feb2020,1
21,"Was 19, flew from the East Coast to have sex with a 13yr old girl. Sentenced to 3years and 20years of parole in Cali. A state I despise and my life is 3000miles away. Theres only one person in Cali I even know. 

Why does California even want me (childmolester) to stay in there state? Make sense right???

Feel like my only options left are evil ones. Sigh. 

Alot more layers to the story but who cares",20Feb2020,1
22,"(using a throwaway for obvious reasons)

im 16 at the moment, and my mom is incredibly psychologically abusive. she swears, calls you names, ignores you for LONG periods of time, the list goes on. my self esteem and self worth is literally non existent and i didnt realise this even counted as abuse until i read an article about it today.

my younger siblings are 10 and 12. my mom used to only be mean to me, but now im starting to see her act in the same way towards them. my youngest sibling confessed to me that he feels really bad about himself, even though my mom never really swears at him. just hearing her talk that way to me has diminished his confidence. i never realized that by hurting me she could be hurting them too.

my sister (12) has had suicidal thought and has only told me, i dont know what to do. my parents are both together and i dont want to tear the family apart but i cant let my siblings go through the same things i went through

also, sometimes my mom is really nice. she laughs and smiles and acts normal. and then all of a sudden the littlest thing sets her off and she gets upset and becomes cruel. she never really has seen the seriousness of her actions, once she made me cry in public and somehow managed to turn herself into the victim.

i dont know what to do, i still love her very much, please help. &lt;3",20Feb2020,1
23,"I have no idea why, but i am very bad at taking fault when someone confronts me. And i often feel like someone is calling me a bad, evil, and terrible person if they were to direct blame to me. I just get so offended and i need to stop and realize that sometimes i mess up and act like an asshole. But i have no idea how?? I am a very stubborn and defensive person!! Ugh why am i like this? When someone confronts me i can’t help but act extremely defensive and angry. Or i just suck it in and dwell on it too much long after the situation has passed. Even if they had a point i start to resent them for even a little bit of criticism.. (I KNOW.) I feel like it is just me who is too stubborn... Please people of reddit if you were once like me, how have you matured and learned how to accept defeat/fault?? 

TLDR: Give advice on how to handle blame/confrontation better and less defensively.

Sorry if it’s short but please give good advice.

P.S. Also when i say blame it is just a synonym for confrontation or fault, i am not saying i am the “victim of blame” if that makes sense lol.",20Feb2020,1
25,"For context I'm 23(f) and was with my ex boyfriend for 3 years we broke up nearly four years ago and I'm still in love with him. I was the one who ended the relationship and he pleaded for me to get back with him for a solid year and I refused due to it being a somewhat toxic relationship. Anyway fast forward to present day and I still have feelings for him, I've not been in a relationship since him. I've dated many people but it's never gone anywhere or I've compared them all to him. I genuinely believe I'm sabotaging myself as I honestly want to find love again but dont believe I'm worthy of it. In the back of my mind I think no one will ever love me except for him, how do I overcome these feelings? A huge part of me wants him back but the problem is hes engaged to another woman and from as far as I can tell hes very happy and I wouldnt want to ruin what he has. I'm just at a crossroads because I cant shake my love for him but at the same time I don't think anyone could ever love me again. What do I do?",20Feb2020,1
26,So this all started when I found some friends at college. There is this one large heavyset individual who follows us around because we are frequent Pokémon go players. On a raid when I finally caught a Pokémon I shouted out “alright finally!”. The fat guy then told me I needed to control my autism. This hit very close to home because one of my biological parents may have had Aspergers and based on the way I can overreact to sudden changes I’m starting to think that this may have been the case and I wasn’t informed about it. The fat one also has made offensive comments about women and how he is too financially stable and girls don’t like that.(personally I think it’s because he is a fat motherfucker who has no respect for anyone but himself) please help me try to distance myself from him without losing my friends in the process,20Feb2020,1
27,"My boyfriend and I have been fighting a lot recently. I usually am not a fan of asking reddit for advice, but I wanted to know how others deal with their anger. 

I tend to start yelling and things tend to get pretty out of hand. I do not want to go into detail, but I do want to know if anyone has ever had anger problems and what you did to control them?

I want to stop yelling and I want to not be so angry. I want to learn how to calm down better or not get so angry in the first place.

Right now I have a few methods I can try, if you do any of these, then please let me know how it worked for you: writing down my feelings before discussing them, try to do breathing exercises, when I start yelling then pause for a second, meditation, ask myself questions if it's worth it etc. 

Doing these methods also seem hard when you are in person arguing. 

I, also, would like to mention that I am battling depression so sometimes that affects my thinking and being rational. 

If you have any advice, please let me know!",20Feb2020,1
28,"Last night, a guy was trying to broke into my house from the backyard, I see clearly about he's food print on the floor with damage on the back door. I asked my neighbours and they didn't hear anything and nothing happened to their house. What is this and are they going to back later for another try?",20Feb2020,1
30,"Hey guys, I posted a few weeks ago looking for advice on eating more vegetables. You guys helped tremendously and I can’t thank you all enough. 

My next problem is gaining weight. I am a 24 year old male around 5ft 9inches and only weight around 135 lbs. 

I have always been very small and now as I grow older I fear I will never be able to gain weight. I am extremely embarrassed of my weight and want to gain more weight and muscle mass. I’m a very active and busy person so I usually only eat one huge meal a day and snack on chips before bed. 

I’m looking for advice on gaining weight as I want to become a fire fighter and due to my size I cannot gain muscle as I am too light. 

Any recommendations as far as diets/supplements would be amazing. Thank you very much!",20Feb2020,1
31,"Jewish people have the highest income and lowest crime rates in the USA. Many I know are from really good families where the parents are doctors, professors or dentists. Therefore I think the probability that the Jewish girl in the video is a homeless runaway who is exploited is virtually nil. Plus I am not aware of any case where a Jewish girl is was a victim of sex trafficking, they tend to be latino, Afro American, poor white or from poor Asian countries.   


I recently read articles of how some porn videos involve women who are trafficked, so I want to avoid watching them. So is sticking to Jewish porn a safe bet?",20Feb2020,1
33,"Everytime I think about talking to her I fell awkward, what do I do?",20Feb2020,1
34,"When I get super depressed, i end up getting  angry at a certain “stage” if someone really hurts me.. I end up being really mean to them and idk how to stop.. then if they keep hurting me I end up crying and crying and crying and feeling like I need to d*e. I’m 16 if you want to know. I also am on a waiting list for a therapist. I’m also a closeted trans Male if that helps.",20Feb2020,1
35,"I really need a friend right now , I’m not depressed just really sad.I just need someone...",20Feb2020,1
36,"Hi reddit.

I (22F) have a ten year old brother who has autism. He can talk and understand things relatively normally, but not in the way most people do. When we told him our stepdad had cancer, he didn’t ‘get it’ and doesn’t show emotions like other people so it is hard to know if he really understands what death is, or what it is going to mean. Our mom is out of the picture, by the way. We live with just our stepdad (we have known him all our lives) so it will be my job to tell my brother when he passes. 

Our stepdad is going to die in the next few days and I don’t know how to tell my brother and make it sensitive enough so that he understands he won’t get to see his stepdad ever again. I don’t know how to word it or approach it. I’m usually good at approaching subjects with him, but for this one I have no clue where to start. 

Any help or advice would be appreciated.",20Feb2020,1
37,"How do I person... with people?

(20f) I am making my way through the world, which is good... I guess. But one thing I’m sorta struggling with is making friends. Since I’m living on my own, unlike a lot of people I know my age, I don’t really have the budget to go out that often. I’m just wondering what are some simple ways to make a few pals. I just want to break the social solitude.",20Feb2020,1
38,"Reddit, Seriius situation and need advice obviously will get another std test but had one week ago that tested negative on all testable stds (hpv can’t be tested for in men..) so my girlfriend and me hooked up earlier today and something felt off upon returning home I noticed a few bumps on my cock by the pubic bone but on my dick now this happened about two weeks ago as well and I was std tested after that because I freaked out told her to get lost etc but when it came back negative I forgave her and continued our sexual relationship. The odd bumps are back today, we screwed oral etc like four hrs ago. I need advice what if not an std could be the cause of this? I really do not think it’s an std because I got checked at my family doctor and planned parenthood all test were negative and the doctor said it was probably just some sort of irritation. Please anybody with similar experience or advice comment!",20Feb2020,1
39,"let me preface this by saying no, i didn’t steal anything. my friend and i went prom dress shopping today and i ended up with a big blue smear across the front of my hoodie from what we found out to be a leaky security tag that was on a dress i had been carrying around. the hoodie is brand new and was pretty pricey so i’d really like to get all of the ink out. any suggestions? if it makes any sort of difference, it’s a mid-toned blue ink on a gray Under Armour hoodie. any help will be greatly appreciated!",20Feb2020,1
40,"I have been with my gf for 8,5 months now. We geniuenly love each other and we have been through thick and thin together. I'm pretty sure that I want to marry her some day.

But I have recently reconnected more with my good friend. We dated for a week about 1,5 years ago, she was my first love and we are still good friends. I have started to feel something about her. Idk if it means that I'm attracted to her or I am simply just feeling closer to her as a friend.

I definitely don't want to break up with my girlfriend. But I don't know if I want to tell her about those feelings, since I'm afraid of losing her and I don't want to make her sad and feel like I don't love her. The thing is just that I'm so confused about this feeling. I just want to know what I should do. Please help me in any way. (I'm 17 btw if that helps)",20Feb2020,1
41,"She tells me I'm hiding someone in the basement, I'm talking to someone in the basement (there is no one in the basement), I'm praying against her, I'm wishing something bad on her, I'm doing witchcraft on her. She calls me retarded, tells me I need help, and threatens to call the police on me and take me to a mental hospital. She asks me did I hide someone in the basement over and over and if I don't answer she gets mad and curse me out. She asks me to move my bed by the door even though I told her I don't want to. She talks at me all day and yells at me. She's been doing this since we were kids. She won't stop. I don't know what's wrong with her. It's annoying and it hurts my feelings. She knows it but she doesn't care.",20Feb2020,1
42,"Honestly I don’t even know why I’m sad. I’ve just been super bummed and in my own head and in return it’s causing me to be unmotivated, lazy and careless when it comes to schoolwork and such. Any tips on how to overcome/ rid this completely?",20Feb2020,1
43,"
Not really sure what the issue is but for just about my entire adult life so far I (32M) haven’t been able to have a really consistent relationship with guys I meet. I’ve met many acquaintances and associates from work, college, church etc. Some I still talk to to this day. But that’s just it. All we ever do is talk. Catch up. No meet ups at the bar. No ball games, birthday party celebrations, Pickup basketball, video games etc.

I’ve always been the person that brings people together in my own family. In other words I’m always extending myself. Reaching out. Calling to check on distant relatives and the same holds true for the few “relationships” I have with guys I know. I resolved years ago that I wouldn’t do it any longer. Every relationship needs reciprocity in order to work well and I haven’t gotten that. 

I recently moved to a new city and thought I honestly had some budding friendships brewing. One guy was really into music and creating music just like me. We can collaborated on a song and talked about doing more music together.  Not long after that we were texting about some songs he had done. That was the last I’ve heard from him. As I’ve said I’m always the one reaching out so I’ve been waiting to see if he’d initiate a new convo. He didn’t. 

The other guy I had already known for about a year and we actually met up and went out with his other homies one night. He even has a friend that lives in the same complex I do! I thought surely we’ll be kicking it all the time. NOPE!

I have a guy who I’ve known for years. We met on the job and became, what I would consider, friends. Really cool, sharing advice (mostly him giving me advice) talking about our wives, the job etc. We talk about once a month. But whenever I suggested we hang out, double date etc. it was always like “rain check speak” (Man, we gonna get together bro.” “You gotta move up here so we can hang!”) It seem like I was required to be local(he lives in a town about an hr from where I used to live) which was always perplexing to me because  I commuted to work there everyday lol. I also came there often for date nights and events with my wife and her sister and husband.

I don’t know what it is. I tell my wife all the time to cherish her friends because they practically worship the ground she walks on. Always calling, texting coming out of state to visit etc.

It just seems like whenever there’s potential for a real great friendship it’s nose dives into the ground.",20Feb2020,1
