,text,time,score
288,"I [19F] and my boyfriend [20M] have been dating over two years (we’ve known each other a lot longer) and we feel it’s time to get an apartment together. 

Due to family situations in my own household, my boyfriend suggested I live with him. Long story short it’s been over a year now that we’ve lived together and we love every moment of it other than the toxic atmosphere we are surrounded by from his side of the family. But that’s a story for another day....

For a short while we were living on our own while his mom was trying to sell his previous home. We were both working during the day and would come home at dinner time to each other. Once the house was bought and we were forced to leave, we applied for an apartment and got denied due to lack of credit. 

Fast forward a year we are still living with his parents and we are feeling miserable and trapped. We don’t feel like we can speak freely or walk anywhere without someone being behind the corner listening. We BOTH want out but don’t know if financially we are ready to support our selves or if we are just scared to make the commitment of depending on each other financially. 

I am currently in dental assisting school and in 3 weeks I get my certification to start working in the field (in my area its around $16-18/hr). My boyfriend makes a decent amount of money as an entrepreneur/forex trader. The price range we feel we should aim for is around $1,300 for a 2br 2ba. Both of us have gotten credit cards since last applying for an apartment and we have done a good job keeping up with payments and will sometimes pay early. We also have a friend who wants to room with us and help pay rent. He is in the same boat we are with credit and financial stability. We all have saved up some money as well (enough for 6 mo rent). 

In three weeks I want to move out and live with my boyfriend and finally have a place where I can call home and feel safe but I don’t know if both of us are financially ready or if our credit will hold us back. If we can’t afford rent, or other bills, we won’t have a parent figure who can help out.  

Any advice would be greatly appreciated, we’re just trying to figure out how to take the first step at starting life on our own. Thanks!",20Feb2020,1
290,"So, i absolutely suck at reading cues right. but i went to get my haircut yesterday and decided to also get it bleached. so im there for a couple hours and obviously was talkin to the stylist. we seemed to hit it off (but, i had dialysis and was sorta out of it so maybe completely misread everything?).

anyways, when i was paying for it, she gave me her card and wrote her cell # on it and said to call her next time and shell make sure to order better bleach and/or the color i want. and then thanked me for dealing with her weirdness.

so, like, i really suck at reading cues. but... if she wanted me to only contact her about work stuff, wouldn't just calling the shop be fine? why the extra  of like ""call my personal number"" unless...? but i dont want to do that and be the creepy weirdo, but this doesnt ever happen to me. like seriously, im about as clueless as it gets (kid you not, i had someone actually legit flash me in a bookstore once and she still had to follow it up with something like ""i think youre cute, lets go out sometime heres my number""). so, was that like a ""hey call me"" or a ""you tipped well, i want to make sure you come back to me""?",20Feb2020,1
291,"She’s can still speak a little. And hear. Just cannot move around much at all.  She lives far away but can’t talk on the phone very well.  Thinking of going to see her but I just do not know how to act when it’s likely the last time I’ll see her. I feel like Ill break down crying which I don’t want because I’d rather be a source of positivity.  

What can help give peace to someone who is ill and dying? 

I hate to write a big long thank you for everything she’s been in my life because then it sounds like a goodbye. But maybe that’s okay?  

They think she will pass in a matter of months. 

Thanks for any help.",20Feb2020,1
292,"Okay, so here’s the slight issue: my (20F) friend (22F) CONSTANTLY wants to talk/FT. Which I know probably doesn’t seem like an issue, because who doesn’t want to talk to their best friend all the time? Well, in all honesty—me. I just have limits for how much energy I can give out to others all the time. And when I say constantly, I mean she will text me every day, and there never comes a stopping point unless I stop replying (which I hate to do bc it feels like a jerk move). She’ll literally text me all day if I don’t stop responding. I think she just reaches out to me mainly when she’s bored (which is often). And the thing is, I don’t want to constantly be on my phone. I’m trying to limit how much I’m on it in favor of getting involved in my hobbies/homework bc social media/tech can be time consuming and draining, you know? But last time I left her on read after a few texts (I was spending time writing), I came back later to a ton more texts, as if it would get my attention. Then she asked if “I was good??”, and when I finally said yes, I just am trying to take some time off from electronics/need some space, she kind of guilted me by saying she just got insecure because her old friends used to ignore her on purpose to be mean. So I had to let her know that it of course wasn’t personal and I would never do that to her, and I just needed some space away from constantly interacting/my phone. She also will try to spontaneously FaceTime me every single day (I’m not exaggerating, I get a call daily). I really don’t like to FT, especially not every day, so half the time I’ve just been ignoring the call and coming up with an excuse over text. Obviously, this issue could probably be solved if I just talked to her about it, but based on her past experiences/anxiety she might just assume I don’t want to be her friend/secretly dislike her. This of course isn’t the case, it’s just that constant interaction becomes exhausting (especially through technology). Any advice on how to maybe approach her about this and cutting back a little in a way that won’t hurt her feelings?",20Feb2020,1
293,"I have diagnosed depression and been having a really long episode it’s affecting my life and relationships heavily. I feel like I can’t count on my friends to talk about my problems and the moment I do they don’t say anything other than “that sucks.” When I feel myself I’m not typically a negative person but when I need to talk they don’t want to listen and deflect me by calling me negative. 

I don’t have the energy in my life right now to get out there and make friends. I don’t know what to do at this point in my life. I already scheduled a therapist appointment and it’s due soon but I still need at least a few people I can count on in my everyday life. I feel incredibly alone. 

TLDR: I’m not doing well but when I try to lean on my friends for support they don’t want to listen. I’m trying to get professional help but I still need people I can lean on and I don’t know what to do.",20Feb2020,1
294,"I'm a 17-year-old female and I've been Bisexual for just about my whole life. Of course, I didn't know what it meant to be bisexual until I got into middle school, but I know I've always liked men and women. Over the past few years, I've only dated men. I've had good, bad, and terrible experiences, and for the past few months, I'm starting to feel as if I no longer like men.  Although the idea of not liking men isn't necessarily bad, I'm just concerned that I no longer do, seeing as how  I've been told sexuality is something you're born with. 

I feel as if I should be concerned about this because I'm worried there's something wrong with me (meaning I had bad experiences and now I've developed some issue with men) and because of it, I no longer want to be with a man. I really don't want this to be the case because I'd hate to change my whole sexuality because of some bad experiences. It's weird because every time I have the opportunity to be with a man, the idea has only made me anxious but I just can't imagine not wanting to be with a man again seeing as how I've happily been with them before.

Should I worry about this and try to fix this issue (by maybe taking therapy or something)? Or is it normal to have a sexuality change after years of being bisexual?",20Feb2020,1
295,"I don't know where to ask this, I tried on r/AskReddit but a moderator removed my question because it was too personal.

This is pretty recent, it's been happening for a week, but it highly concerns me. I never payed attention to it, but my dad has been keeping track of it, so today he brought it to light to my family.

When he picked me up from school the police officer followed us from my school, my dad noticed it and I kept my eye on him. My dad got gas and we thought he would stop following us, NOPE. There is a park a mile or 2 down from my neighborhood and the officer waited there and followed us til we pulled into our neighborhood. 

I took photos of the car and will proceed to do so until he stops or until it gets worse. If it gets worse, I'll start videoing the experience. There are three police officers that monitor the school when kids are being released, but there are still more. 

Around my area there are 6 police cars that monitor one road, I don't think there is any crime in my area, but there are a lot of old people and just starting families, and before we move, my dad searches for pedophiles or any other criminals that may live in the area, so I trust him that he did that research. I'm saying those things because this area doesn't seem threatening to me, and it's crazy that only 3 police officers monitor a school zone in the morning and afternoon, while 6 monitor a road morning and afternoon; and that road doesn't have many crashes happen. 

They've only been here ever since 2 months after we moved in the area. This concerns me because I've heard this girl in one of my classes talk to her friend, that a police man told her that ""he'll buy lingerie for her"". 

As far as i know my dad doesn't speed, and he drives a sports car. I don't know why an officer will be following my dad so close to his car that if he goes a little bit faster he could rear end my dad's car.

To clear up some stuff, I don't know much about the world of police officers, and why they may monitor one area more than the other. I'm stating my opinion and what's happening, I'm very weirded out that he follows my dad to my neighborhood especially after picking me up, there has been human trafficking in my area, there has been some officers found to be helping out the human trafficking, so I wouldn't be surprised if a police officer was apart of the trafficking.",20Feb2020,1
296,"I just received a notification from the Samsung ""find my phone"" feature on my smartphone with nothing but the number 1. I'm terrified that it could be something a lot more serious than I believe it to be. Am I being tracked by an ex? Is this something that just happens? I've never used any of the Samsung related apps on my phone so I'm even more lost as to why I would be receiving a notification from an app that I've never used before.

Has this happened to anyone else?",20Feb2020,1
297,"I'll keep this brief. I'm 20 now and beginning to realize that my upbringing has messed up my perception of the world. I realized that one of my deep seated beliefs is that ""nobody will love me if I'm not perfect."" (I.e. perfect looking, high achieving, very intelligent, funny, good at conversation, etc.) This came from a lot of things as a child, but has lead to me being very down about how I look (I'm not overweight but I feel like I am) and having a very serious skin-picking issue (once I know I have an imperfection I can't ignore it). I like almost nothing about myself because nothing is good enough if it isn't perfect. I also have trouble loving other people in spite of their flaws (I do love people, I can just be very critical). 

TL;DR - I despise myself and act self destructive because I can't be perfect and I don't know how to handle it.",20Feb2020,1
299,"My best guy friend has been in a relationship with a girl for about a year now, and I've been in a relationship for 5 years. However, I've noticed over the past few months he's acted different around me, and one drunken night he admitted that he thinks he's in love with me. All my friends have said he looks at me a certain way and are sure he has feelings for me. Should I confront him, or just pretend it never happened? Like I said, we're both in relationships, and he recently moved to another state with his girlfriend.",20Feb2020,1
300,"So I ended up getting into a fight with somebody in my friend group. Let’s call her BC(bitchy c***). We are all high schoolers by the way. Something stupid I come up into a class that she and I are both in. It isn’t really important, other than that’s where we begin. One of my other friends, let’s call her EF(ex friend) said that a few of the people in that class had been complaining and blaming me for something minor that I didn’t even do. I told EF that she could tell BC that it wasn’t my fault and I was sick of the BS. I then told her nevermind don’t say anything, because I had been upset already when EF has first told me. The reason why I believed that it was BC that was complaining I’d because stress shears complaining in that class, and was always the ringleader of the drama. That’s why I didn’t want the information going back to her. Well, later in the day we’re all leaving the class together and BC says that we need to talk. I think, ok, we can talk. She proceeds to start screaming at the top of her lungs that I had been touching her inappropriately (I hadn’t) and harassing her (again no) and she had been having night terrors about me that I had raped her. She also proceeded to scream that I’ve cheated on my gf multiple times (which isn’t true I only did once in the story of honesty on here, it was over a year abs a half ago, and BC was involved in no way). I call her on her bs and she keeps raising her voice. Keep in mind we’re in a fairly big Highschool and we’re walking to class. She said that she’s never involved in drama, and she didn’t spread it, and then I watched her from the branching of the floor I had to go to keep complaining and telling anyone that would listen how awful I am. And kept doing it on the bus. What should I do? This really pisses me off and I want to come to her tomorrow but I’m unsure of what to say or how to approach it. Thanks, hoping for at least a reply or two. 😕✌️

TLDR: Girl I have class with blew up for no reason and started making up bs in crowded hallway. I want to confront her about it but doing know how or if I should at all.",20Feb2020,1
301,"So I have a sealed collectible item which was a bit damaged by water, one corner is a bit puffy now (of course there’s a tiny hole in a wrap). It’s completely dry now, 2 days passed, I need to flatten it somehow. Any ideas, how to fix it? [Here’s the pic](https://imgur.com/a/N1xo9SN)",20Feb2020,1
302,"I was recently hired with a handful of other people. It's a warehouse facility and we were told what job we were hired for, and that we would be trained in other areas related to the product down the line. Orientation was yesterday.    

Today, I did not start with my group in the product room. I started with the facility/janitorial woman. This was a big surprise to me, as I did not expect to spend the morning this way. I was told that she needed the help, and they know that this is not the job I am here to learn, but with my past experience I would be a great help. I took a tour, cleaned the bathrooms, floors, sanitized, and such related duties with her. Her new assistant is starting this position soon, so why me? I told them I was more than happy to be a team player.    

Later, I found out I'll be doing the rest of the mornings this week. I can't help but feel that I was singled out. For some background, I am 1 of 7 of the new group, and none of them have to clean the building. When I returned to the product room, 2 in my group asked me where I'd been and I just responded, ""cleaning.""  I have only been a front desk receptionist in the past and I have a bachelor's degree in graphic design. I feel awkward to mention race but if it does give any more information, it is definitely 95% white individuals at the moment and I am in the minority.    

Advice: Would you disregard this as meaningless or see it as questionable? I do see it as both ways and that's my struggle.    

Thanks",20Feb2020,1
303,"So title says it all, kinda feels like a golf ball underneath my shoulder blade to be like a little more precise  it’s around the triangle auscultation. I can’t even do push ups without feeling it. I left weights and go to the gym 5x a week. I haven’t gone for two days been going to the sauna and stretching doesn’t seem to be going away anyone got any advice or opinions?",20Feb2020,1
304,"I need some advice and help to recover. I recently got hurt and here’s why. It sucks to talk about but me and this girl were talking, we genuinely liked each other, a lot ! But she met someone at a quince and just went with him. It broke my heart and ever since we haven’t talked. We did but like it was just me explaining how bad she messed up, she really left me like that. I know I can’t really explain it but I just need help to stop thinking of her. Everything was great about her, her personality, body, laugh, everything. We FaceTimed every night, we’re excited for our future because we knew we were gonna be something. She explained after we stopped talking how she wishes things weren’t like this and she regrets it but does not at the same time and said she truly loved me and more. Honestly it hurts and I came to my realization to stop talking but I just need help from you guys to help me take her off my mind even though she’s just perfect. It sucks a lot, I haven’t felt like this in so long and I can’t explain how hurt I actually am even though I kind of feel better, I miss her a lot and I just need to forget about her.",20Feb2020,1
305,"Vague title I know sorry, and I know this is probably such a small problem compared to other people. But basically idk what I want to do with my life?? I’m a junior in college, I’ll graduate in almost a year from now, and I study applied math. Today I went to the job fair and I noticed that every company I talked to the first thing they asked me was “what do you want to do?” and every time I got asked I didn’t have an answer. I started to think about and now I’ve truly noticed I don’t have the slightest fucking clue what I want? I started to think about all my friends and even my girlfriend they all know exactly what they want weather it’s a specific industry or company. It leaves me wondering how the hell people know this... does it just randomly come to you and you think oh okay I want to work with genetically engineering or work for samsung(arbitrary examples btw specific to prove my point). Idk guys i’m just a little freaked out and kinda scared that once I’ll graduate I’ll just do nothing bc idk what I want to do. is it bad that I kinda just want A job? like not any job bc I don’t want something miserable but to me the whole reason to go to school is so I can break the poverty cycle in my family and now that I’m here like wtf do I do never thought I’d make it this far I guess. Sorry for the long post today has been helllla stressful and I needed to get this out of my head.",20Feb2020,1
306,"I have had this friend that I met last semester at university. She was nice and preppy and we were talking like any 2 friends do. 
One of my colleagues enrolled later on and I introduced them to eachother. 
Suddenly the friend I met last semester starts treating me as a third wheel , telling my other friend that they shouldn’t bother with me , and if they wanted to relay a message they’ll fo it through my friend and not directly talk to me . 
Yesterday they told my friend in front of me “ i told you to never listen to a word she says “ 
I don’t know why the very sudden change and what have I ever done ... i tried to talk to her , and said , You can text me anytime DW. 
She said angrily “ you sleep in late don’t you?!”
While I always reply, and I actually do not sleep in that late , my friend wakes up very early ( before 6 am) . Yeah I don’t expect any 2 friends to text at 6 am...",20Feb2020,1
307,Soooo I’m a 17M and I have huge social anxiety when it comes to large groups of people (and yeah it’s diagnosed lol). Whenever I complain to loved ones that I can’t seem to talk to people well or keep people interested for very long they always tell me I’m not “putting myself out there enough”. I’ve heard this over and over again yet I still don’t know how exactly I’m supposed to do that. Sorry if this is kind of a stupid question I’m just really curious because I’d love to enjoy large groups of people at parties and stuff someday.,20Feb2020,1
308,"tl;dr: i fucked up my rib and couldn’t work but i couldn’t tell my supposedly emotionally abusive mother that out of fear so i told her i was still working and i don’t want her to find out and get hurt that i lied to her 

18m, been living on my own for a year, and have a rough family life i was running from. i have ptsd from a separate ongoing situation in my childhood which just makes all this even harder to deal with. 

anyways my mom has always been someone i struggle with. people around me call her emotionally abusive towards me and always have but i struggle to accept that because it’s still my mom. she’s very strict and controlling of everything i do, my money, my school, my work, it used to be down to what other kids at school i was allowed to be friends with and how i was even allowed to feel emotionally about things. i love her very dearly but we’ve always struggled and i’ve always found she hurt me often. 

i’m transgender and up until literally today (i got top surgery yay!!!) i had to wear a binder. i seriously fucked up my rib from over binding and using ace bandages as a kid (i know, i’m not smart, i was 13) when i got a real binder i wore it too often without meaning to and i ended up really fucking up that rib. it hurts all the time, so badly i couldn’t wear a binder anymore, and if i did wear it just to go to work i’d be shaking and getting dizzy and crying because the pain was so bad. i had to quit my job, i couldn’t go on anymore. but i was so scared of my mom’s reaction and her behaviour towards me about it that i just never told her that i wasn’t working anymore. it’s super stupid, it’s one of the dumbest things i’ve ever done i swear. but i knew she would scream at me and call me lazy and useless and tell me i would never be anything in life and i was so scared so i hid it. 

now she wants to declare me as a dependant on her tax returns (even though i’m not but yknow) and so she’ll need my income for the year. she’ll know it’s too low. 

money isn’t the issue, she hasn’t been paying for me i’ve been paying for myself so it shouldn’t be anyone’s business but mine where i get my money and what my yearly income is but since she’s insisting on declaring it i’m going to need to give it to her accountant at least if not her herself and i don’t want to hurt her feelings that i lied. ideally i was planning on recovering from top surgery and then getting another conventional job and just never mentioning this whole thing ever again but if she insists on seeing all my income statements that will all blow up in my face and i’m so scared of hurting her feelings. i’ve never meant to hurt her and i’ve been wracked with guilt since this started but i’m so scared of her i have nightmares about her and i was scared and didn’t know what to do and felt backed into a corner.  

sorry this is the messiest post i’m just freaking out when i should be happy and recovering from surgery because i don’t to hurt her and i don’t want her to hurt me back for this. any advice would be appreciate even i the advice is that i should go fuck myself because honestly at this point i just hate myself so much for this",20Feb2020,1
