,text,time,score
785,"A family member opened a bank account for me when I was a minor. They put a significant amount of money in there and they had kept the account hidden from me until one day they told me about it, and had me sign something related to it last year. I didn't really read or care about what it said but today I got a message about suspicious activity on the account, that it will be isolated and blocked if I don't verify it. I'm considering going to the bank, telling them I have nothing to do with whatever activity went on there, and keeping the money for myself. Would I get in to any trouble for this or is it perfectly allowed?",20Feb2020,1
786,"TLDR: my teacher excluded me from a classroom wide plan and I'm quite sullen because of it. 

So I'm a naturally long winded person and I'm aware this isn't a huge deal. The easy fix would be to simply have better study habits but here we go anyway.

I have a year-long course at the moment. I am in my second semester as an upperclassmen. Last semester, I failed to complete a number of specific online assignments. They were due every week and typically not exhausting to do... 

The website itself? Fine. Tedious, but fine. For this reason as well as myself being a procrastinating dumbass, I opted out and my grade suffered because of it.

As a bit of background, this teacher is... Interesting. They ""jokingly"" threaten students every other day. They openly and loudly talk with their favorites about how they would love to knock students out. They beratted a student for coming back to class late, said student admitted that she had a mental breakdown. Teacher continued to ridicule her, saying she needs to see a counselor and nealry reducing the student to tears. Quite the sight. Also quite infamous for leaving the old ""69.89""s. A yeller. Satan essentially.

This is a personal qualm. They somehow, against every odd, speant the entire semester so far as well as much of the semester last year discussing racism and colorism in a class with nothing to nessesarily do with it. At my school it is the norm to write the standard on the board. She is apparently expempt. I may seem like an asshole, but I'm a poc myself. And as a bit of a literature buff, I would like some other shit too. I'm aware that it is black history month. Her point of view is the sort of ""race is a social construct"" stance. A direct quote. 

Now back to my case. Teacher announced this semester that those who consistently preform well on the aforementioned website will be excluded. I decided to step up. 
On a whim, the teacher has excluded me from this. I checked the code of conduct (no, really) and it stated that for a level one offense- the only one of which I fall into being 'refusal to follow instructions'- and the punishments that may apply include ' loss of privilege' and 'enforcement of positve behavior'. (I had no idea my education was a priveledge). I'm wondering if I would take this up with her directly or if there's any grounds for me to report her on.

As I'm writing this there's a heated classroom v teacher yelling match.

Regardless, from this post you can probably conclude that I'm a lazy idiot who tried to get by on the system and failed.",20Feb2020,1
787,"so i write some jazz/folk/hip hip (trust me it makes more sense when you listen to it), but I'm having trouble getting the word out to people to listen to it. so far, most of the people that have heard it seem to like it, but I'm having trouble just hitting a wide audience. 

the link is [Soundcloud.com/ink-well](https://Soundcloud.com/ink-well) btw, if anyone wants to check it out.",20Feb2020,2
788,"I have a great life, awesome family, kind of a fucked up relationship and I'm unemployed. Usually I'm happy but suddenly I get extremely sad and angry and keep thinking about ways of killing myself. Has anyone being through something similar? Tips of what to do?",20Feb2020,3
789," i have autism i have too get fillings done there using oral sedation and papoose board, will the meds make me dizzy, will papoose be snug, what should i wear or bring , will i need too be hooked up too monitoring equipment any support thanks",20Feb2020,1
790,Well recently I started to tell myself to do 10-15 sit-ups a day to make sure that I lost weight within the end of the year (15kg/33lbs by the end of the year) but currently I am having a little trouble trying to keep on track. I am also thinking of boosting my self-confidence. Any advice as to how I can motivate myself to keep myself on track as well as raise my own self-confidence?,20Feb2020,1
792,"I've [36m] been on a few dates with a very nice [37f]. It's still early on, but in anticipation of potentially getting serious with her (or someone else) down the road I'm wondering when would be the best time to disclose i've been busted by the boys in blue - twice - for drunk driving. The most recent of the two is close to 10 years in the past now. This has never really weighed on my conscious - its not like I was wasted and crashing into things.. and the number of people who get busted for this is a small fraction of those who do it and get away with it. Still very stupid, obviously. Worth noting, haven't had a drink in 3 years and plan to continue tea totaling indefinitely (this was not precipitated by any kind of serious trouble). What would be the most disarming way of bringing this up? Ive considered just not saying anything because it doesnt show up in criminal checks anymore, but dont really wanna go that route.  TY",20Feb2020,1
793,"English as a 3rd language, sorry. Throwaway for obvious reasons. 

I work in a internacional company and we have different ""teams"" in different countries. We also have parties with some divisions from the same country quite often.

Last year I was put in the same team as a guy who is really attractive and basically had at least one date with every good looking woman on this company. 

We became friends quickly as we have the same kind of jokes and hobbies (and some crushes). One day we were just hanging out and we kissed. Later he invited me to his home and after that we started to be friends with benefits. 

I don't know how people from work discovered that since we didn't have any ""couple"" behaviour outside his or my house. Well, after six months, we decided to stop, since none of us wanted a relationship and the new manager said that he would go to London and I was going to the peruvian team, where I started on the company, but not my homeland.

Everything was fine, until yesterday. I was in the bathroom when the new manager got in talking with someone. What she said:

— Do you believe ""hot fun guy"" was going out with the tomboy from eng? I couldn't believe when I heard that. [...] Last Friday he didn't want nothing with me. [...] Yes, ridiculous! I can't stand to see him with that shit crippled girl. [...] No, he is going to stay there just for few weeks, for trainings. She is really in another team now. [...]

I just freezed and listened. I got angry and sad, couldn't do nothing but listen and hold tears.

I know they already had something in a party before she moved to our division.

I am short, with short hair and wear gaming T-shirts and converse shoes. If I hadn't boobs, I could easily pass as a teenage boy cause I'm not so good girly looking. And yes, I have some disabilities and can't walk very well. 

I love Lima, but it's good to be home again and I would like to stay more than one year here (I landed here on Feb 26 last year). What's bothering me is that she could have put me away just for the sake of her sexual life and I am REALLY angry with being called ""shit crippled girl"". 

I thought about going to HR, but I didn't record her talking and have no proof of what I have heard. I don't know if I should go and talk to her or warn my friend about her sick crush on him. Reddit, what should I do?


Long story short: I was friend with benefits with a guy and the team manager apparently managed to get us a ocean apart and said shit about me but I have no proof and I'm upset with this situation. 

P.S.: I don't know if crippled is the best word, but she called me of a rude and insensitive way to call someone who has disabilities.",20Feb2020,1
794,"Hello! I wonder if you’re supposed to record the vocal part and then add the instruments afterwards? Or vice versa? Like, what’s the easiest? 😊😊

Hehe, I’m pretty new to this😁",20Feb2020,1
795,"I have always had a rough relationship with my parents, therefore I had decided when I was younger, I knew it would be best for me to leave as far away as possible from my parents. I mentioned the idea of moving to Florida for college to my mom and she was actually really all for it as long as we had the means and money to do so. The years have gone by and the topic was brought up again in Freshman year, and again, I had my mom’s faith but my dad avoided the college talk as much as he could. I completed high school with lots of community service, work, involvement, and awards. I had a strong resume for colleges, applied to four (including my dream school in Florida) and got accepted to all of them. However, I didn’t know my mom had a vision for me and forced me to apply to one of the schools that I didn’t like. I gave it a chance. I attended some events but I still felt like it wasn’t for me and my heart was set on my dream school. Slowly, it became an everyday argument of whether or not I would go to college in my state or in Florida. Money is not an issue and our family is not close, but my mom likes to guilt trip and manipulate me into thinking that I will “ruin my life and the family” if I make that decision to leave. It’s becoming so toxic to the point where it’s affecting my physical health. I can’t handle these everyday arguments because now it’s driving me and my parents apart. My mom has become emotionally and verbally abusive and tends to harass me over email or text about every little thing, with the college decision being the top priority. To make things more confusing, I had started talking to an old friend again and we figured we had romantic interests. He has been close to my family since we were in 7th grade but we did not talk for many years due to some issues he was going through. To sum that up, we decided we didn’t want to be a part from each other and we wanted to live in the same area. He gave up everything for me, including his college decision so he’s taking a year off. My mom gave him the green light to do so but that was when I was going by what my parents wanted. I mentioned Florida and started making those plans but they absolutely hate the idea and I can’t do anything about it. They’re dragging him into the situation and have gone as far as to threaten to leave me in debt or homeless if I involve him in my life. I don’t know what to do or what options I should take. I clearly do not have their support and I’m lost. I would appreciate any advice. Sorry this post is so lengthy",20Feb2020,1
796,So I've been friends with this guy for more than 10 years and we used to play a lot of fortnite but for him this game got boring and he stopped playing.I want him to get back playing this game because i know that if he playes only one game with me he'll be back on playing fortnite forever and he is a cool guy a positive and a chill person any good convincing techniqus?,20Feb2020,1
798,"Just turned 30 and I’ve found myself in a situation where I have no friends. Well, that’s not entirely true because I have about 4 or 5 friends I could see probably once in a blue moon but not regularly and a few friends living in different cities from me and some over on the other side of the pond in New York from when I used to live there (I’m from London).  My core group of friends however, who I could rely on to hang out any given weekend for the past ten years , are pretty much no more - one guy is suffering from a mental breakdown and has turned into a neo Nazi- I called him out once on it and made fun of the Nazi group that he’s joined (I’m mixed-race so what does he expect) and he won’t speak to me anymore and my spineless other mate has taken his side even though he himself is Colombian. The third person in this group tried to sleep with my ex girlfriend and caused a bunch of drama between me and her resulting in me losing my shit and verbally attacking him to the point that he will no longer speak to me ever again. I used to make friends easily at uni and work so I know I’m a likeable guy but I don’t know where to start as a 30 year old with no one to hang out with during the weekends. Shit is lame",20Feb2020,1
799,"So recently I've fallen back into gaming more, since I have found I have a bit more spare time when my girlfriend isn't around. I don't necissarilly prioritize it, and I'll do all daily errands and tasks before I sit down and play games for about an 1-3 hours in a day, probably about 4-5 times a week, maybe more if there's extra alone time. 

This issue comes when my girlfriend comes home. I usually get off as soon as she comes home so we can spend time together, talk, and do things. but sometimes I'm RIGHT in the middle of a game and want to finish it up. During this time she *demands* my attention and says I play to much, but when I finish my game and start fully conciously asking about her day without any other distractions, she tells me she no longer wants to talk about it and her high energy has passed. She does this everytime I have a game overlap when she comes home.  In these times she then will want to smoke some weed and decompress, ultimately just sitting on the couch and watching TV together until she passes out, and we go to bed. Well last night she fell asleep, and I didn't work the next day so I said screw it I'll over indulge a bit and play more. At some point she woke up randomly and started getting so mad at me for playing my game when she was asleep, stating I have a serious problem and I'd rather play games than to go out and spend time with her. I can't even find words to justify myself, other than I only play when responsibilities are done and she isn't home, or if she is asleep. And that demanding my attention mid-hobby is unfair. No matter how I schedule my hour or two, I always catch flak. I keep telling her how rude it'd be if I demanded her attention while she was playing music, and then getting mad at her if she was doing it (quitely) while I was asleep. She just thinks I'm becoming a loser with a gaming problem. 

Am I in the wrong here? I enjoy being immersed in a fake world for a little bit, and I don't feel it's anywhere close to a problem, 1-3 hours a day spaced through the week seems like nothing compared to my past or what others play for. How can I help allieviate this aggression towards my hobby?

TL:DR gf thinks I have a serious gaming problem for playing video games 1-3 hours in a day, about 5 times a week when she isn't home or is asleep.",20Feb2020,1
800,"Today is the day i decided that i've had enough.

I will try to summarize the story as much as possible. To anyone taking time out of their day to read this, thank you.

I have a brother, 27 years old. He's 10 years older than me and is a very self-centered person.
He has made my life a nightmare. If me, my mother or father tried to argue with him when he was doing something wrong, he would always go for violence. He beat me for as long as i can remember, since i'm 10 years younger than him he never had a problem overpowering me.
He finished college several years ago, never had a job and doesn't go out looking for one either. Ever since he turned 18 he has been more behaved, due to fear of my father kicking him out, but still is an extremely toxic person, who always puts himself about others.
Currently, he just watches anime, plays video games and does some housework.

He always keeps saying that he is a ""special case"" and that people should just accept that his situation is ""not like anybody else's"".

Several people have tried to help him to change. My mother, my stepmother, my father, his friends from school and from college but he always spits on everyone's hand and keeps making excuses for why he can't or doesn't want to follow their suggestions. Unsurprisingly, he currently has no friends or SO. Everyone eventually got fed up of his ""i'm superior"" crap and went their separate ways. It's always about him, him and him.

Even when noone is interacting with him, he still manages to make everyone uncomfortable. For example, as i mentioned before, he plays video games, and as is to be expected from a computer, sometimes there are problems, errors, etc 
Whenever something isn't working on a computer, he start to become extremely toxic. He starts clicking the mouse faster and faster, and giving one final strong click.
Starts pressing Ctrl+Alt+Del furiously and starts to yell things like ""why can't things just work?!"", ""the engineers that made this are a bunch of incompetents"", lets out loud groans, bangs the table and generally making a huge fuss. He does this every time, for years, almost daily. Me and my friends that have met him and witnessed some of these scenes came fo the conclusion that he probably does it for attention. We started to see more and more that the things he does is for attention.

Things are getting unbearable again. He walks into my room and does as he pleases. Kicks open the door, slams the windows open, turns the fan that was pointed to me for himself.
All of these things are making me lose my mind. I'm 17 and am currently studying to pass an entrance test for college. I'm trying to get into the best university of the country, hundreds of kilometers away from here, but even if i get in, it will only be next year. All of these things that he is doing is seriously impacting my studies negatively.

The only solution i have in mind is to speak to my father and to basically put my brother in line using fear, just like that book, ""Leviathan"".

Any help is appreciated, thank you.",20Feb2020,1
803,"
I (20m) recently started dating a new guys (25m) and have been seeing him for about a month and liking him a lot. But I just had a sexual health test and found out I have chlamydia from a previous one night stand. 
I’m on medication and will be cured from chlamydia in week.

However I’m wondering do I have to tell my new partner that I have chlamydia? We have gotten a bit intimate, but the most we have done is a bit of oral - and it is very unlikely to contract chlamydia through oral sex. Also he mentioned he’ll be getting an STD test anyway. So do I have to tell him that I have chlamydia? 

It’s just so embarrassing to me and I don’t know how he would react. I’m scared he’ll be grossed out and not want to see me again. Then again he is 25 so I’d hope that he wouldn’t react in that way, but I don’t want such a small thing, where I most likely didn’t pass it on to him anyway, to affect our relationship.",20Feb2020,0
804,"Looking for things I can do, preferably in my home, to take the stress off. No drugs or alcohol.",20Feb2020,1
805,"Hello. I'm basically a mess, or that is what I feel like as of now. I have a bachelor degree in mechanical engineering, a degree that was supposed to be completed in 4 years but I took 6, in that period I absorbed very little knowledge about my field. I'm good with computers, I can code, fluent with c++ and learning python (I learnt coding after 4 years of engineering as I  couldn't handle the technical information, if you're wondering why I took mechanical engineering in the first place). I also worked for a year after my 4 years of engineering at home sales. After I cleared by bachelors I felt like I should get education from a better country and a good college, so I started shortlisting countries and various universities for the course of project management. I came across countries such as Australia, Singapore and New Zealand which were good for my course and also the country provided the lifestyle I could adapt to (totally an introvert and hates going to clubs). After reaching out to colleges it turns out that the fact that I took 6 years to clear and the pile of backlogs made it more difficult to move forward. The time I took for granted came and bit me in the butt at the worst possible time. After the rejection I have been feeling completely down and demoralised. Working out is the only way I can get some frustration out thinking of what a LOSER I turned out to be. I'm not able to think straight for a couple of days and I'm worried this might get worse. If anyone's been through a similar situation, please tell me what to do. Not words of encouragement, but what I need to hear",20Feb2020,1
808,"Okay so let's start. My cat is a stray cat that we sheltered 3 years ago along with his 1 brother and 1 sister while he was the size of a hand. At start he was a good and cat. He would play around, hop and run. Then after a few months he started to vomit. 2 times a week or so. We took him to a vet and he said he didn't know. Then another one and another. All couldn't find the problem. One of them suggested a big hospital for animals and with no another choice we took him there. In there we learnt that his stomach walls were thicker than normal cats which made his digestion much harder. As an attempt to digest his body started producing more acid. Then led to vomitting. Doctor said that there were no way of curing this. And gave us an acid regulator pill. We started to give him that. He was no longer vomitting if we didn't forget to give the pill. But his condition worsened. His body got accustomed to the pill so we had no choice but step up the dosage. This started a cycle. And at this time. At the third year it is at a point that a normal adult would take that amount. 40mg twice a day. And if we ever forget or change the food they have he starts vomitting everything. He is sick of this too. So much that all he does now is sleeping eating and watching some walls or his siblings. We have dozens of toys and pet him, love him but he just runs away thinking we would give him the pill. So any idea on how can we make his situation better?",20Feb2020,2
809,"So in my previous relationship, I was used very much for sex &amp; sexually abused several times. That has left me destroyed inside feeling as if I’m just a piece of meat. I keep that to myself and never really express emotions about it therefore leaving me unaware to the feelings I am feeling... if that makes any sense. In my current relationship, I opened up about it and my boy promised to never use me, especially in that way, and that he wanted to make sure I was always comfortable. Well, last night I had woken up to him pulling my underwear aside and figuring me and then sitting on top of me. I pretended to stay asleep and just shifted slightly. When I moved, he got off and returned to his chair to watch YouTube. I let a couple minutes pass and then got up. When I got up he looked at me weird and then went back to normal. I didn’t say anything although I wish I had when it was happening instead of pretending to be asleep. I don’t know how I should feel about this and it’s been driving the ptsd and my anxiety up a wall all day. I have been silently crying whilst he lays in bed all day. What do I do. How am I supposed to feel. I have no idea. I know it’s “normal” for one to rub or even just lay their hand down but this was more than that. 

Edit: forgot some of the story.",20Feb2020,3
810,"I'll admit that I crossed the line, now she's mad at me, and I wish I wasn't so selfish by consistently interrupting her work, I truly felt a really deep connection with this teacher, and I ruined it, and to be honest, she is one of the most important people in my life right now. I know it was my fault, and I've felt so guilty. I want to demonstrate that I've changed, I've learned my lesson, but when I asked her if she'll ever forgive me, she said she didn't know.

¿what should I do?",20Feb2020,2
811,"Anyone else find it frustrating that when it comes to dating issues or just issues with your significant other or maybe it’s just someone your crushing on it seems to always be from the perspective of the female. It’s like guys are made out to be these emotionless hunks of meat that do nothing but stare at the wall until a pretty thing comes along. I mean it’s bullshit guys get heart broken, guys fall into deep deep depression, and guys get just as lonely if not even more so then women. It’s frustrating that we’re made out to be something we’re not. Sure maybe some guys are but the overwhelming majority are not. This just me who’s frustrated by this?",20Feb2020,1
812,"I fell in love with my best friend (I’m a guy and she’s a girl) around a year ago. I never said anything because she’s way out of my league and I thought it would just make things weird between us. She’s had a boyfriend for around 7 months now and that’s been killing me so I figured i’d try and move on from her. I end up talking to a girl and eventually dating her, and my best friend comes out and says she has feelings for me. Please help i have no idea what to do.",20Feb2020,2
