,text,time,score
540,"TL;DR AT BOTTOM

So, this is probably gonna end up being a very long and rambly post so I want to apologize right off the bat. But I feel like I really need help with this. 

So, my brother’s (Jason) fiancee (Melissa), whom he has a 5yo kid with (so my nephew and my mom’s grandson, Cole), is very toxic. We’ve never really liked her but she used to make my brother happy so the family dealt with her. But about three years ago, this dislike was solidified when she stole from me. She stole money, $40 in cash, and we are certain it was her because she was literally the only person home in the time it was stolen that could have done so (my best friend and I came home and I left the money in my purse. My best friend spent 100% of her time hanging out with me, and Melissa popped in for some reason (maybe to drop something off, I don’t remember, but the reason doesn’t matter). Then my best friend and I wanted to go back out, and I went into my purse to grab some money as we were only going to the corner store for soda or snacks so I wanted to bring just a bill of $20 as opposed to my whole purse and the money was all gone. It obviously couldn’t have been my best friend as she was with me the entire time, and Melissa was the only other person in the house). I know what exactly happened isn’t important but I’m explaining this first instance so that you guys can get the true picture that she is undoubtedly the one causing issues and blame is not being misplaced.

My mom said she’d buy and set up a camera to catch her if she tried to do it again. Well, my mother didn’t. So I got another $30 stolen for no reason. Then, she stole some concealer from me.

The concealer probably doesn’t seem like a big deal, but it is; she stole concealer that a) isn’t her shade and b) is a brand she’s allergic to (which are both reasons she used to say that she wasn’t the one who took it… it was a cover). She chose that out of all the makeup she could have stolen (my entire collection was strewn over the counter and she chose that specifically; I know she took it because I found it at the very top of her makeup bag later. I know I shouldn’t have snooped but I had to know). She gains nothing from this except the satisfaction of knowing she stole from me, and it caused a rift with Jason and I.

I sent her a text saying something very ambiguous, like, “hey, I can’t find my money. If you’ve seen it/know where it might be, please let me know”. She twisted this to me outright accusing her of stealing so she told Jason. He ended up physically assaulting me and I ended up in the ER for fear of a concussion or spinal damage (I have osteoporosis, and he shoved me into a short flight of stairs. My head bounced against the top landing and my spine landed on the stairs, causing lots of pain). I told everyone that she DID steal my $70 and concealer and Jason completely took her side, with everyone else saying “I believe you but we can’t do anything”. I cut contact with Jason and Melissa for a few months after this, until my mom BEGGED and guilted me into talking to them again because she “missed having her family together, especially at Christmas” (this happened right before and I refused to spend that Christmas with them). They “forgave me for lying making stuff up about Melissa”.

In the past three years she’s also stolen from my grandmother (my mom’s mom) and now she’s starting to steal from Jason as well. He says he’ll repay my $70 as now he understands, but I don’t want the $70 (from him, at least. I’ll gladly take it back from her). It’s not about that. It’s about someone who’s supposed to be family stealing from me, my elderly grandmother and my brother.

This whole time (aside from the physical assault incident) I’ve said nothing to keep the peace, and that wasn’t my sole choice. My mother BEGGED me to not say anything, because “if Melissa is challenged she’ll take Cole away from us and we’ll never see him again” (which I don’t doubt. She’s done that before when my mom pissed her off for some reason or another, but came crawling back when she needed money (you may notice she has a bad relationship with it…)). My mom and I have a very strained relationship because she bows down to Melissa and pretends nothing is wrong. So every Christmas and millions of times in between - as they live near us and visit often - I’ve been forced to smile, treat Melissa kindly, give her gifts… And I just can’t do it anymore.

Very recently, my mom told me how Melissa is now stealing from Jason. And I… completely lost it on her. Like, literally lost it. My mom was still refusing to say anything and I just went crazy. I was that stereotypical hysterical, insane woman who’s literally jumping up and down screaming, blind rage, seeing red type thing. I’m not proud of it. I’m incredibly ashamed. It felt like I was sucked out of my body and something possessed me and I went nuts. I wasn’t physical (as in, I didn’t harm her) and didn’t throw anything or anything, but I was wildly flailing my arms and yelling. It was crazy.

I told her she cares about Cole more than she cares about her own two children and her own mother. That I think it’s disgusting that she’s willing to let the three of us get stolen from (and get physically assaulted in my case… she also told me not to tell the ER what really happened (aka to LIE) and to “let it go; he’s my brother”), and let her relationship with all of us sour, just so she can keep a relationship with Cole. Don’t get me wrong, I love Cole very much, but I also value myself, Jason, and my grandmother. And I can’t keep doing this anymore. Because not saying anything just enables Melissa, and lets Melissa know that she can keep stealing from us because even if we KNOW she did, there will be no repercussions.

I ended up, later, sobbing on the phone with my boyfriend about it and I started yelling again (not at him, just like… in general. Like, “how can she do this?! Why?!” type thing). My mom came downstairs to me and told me that okay, she’d say something, because she can now see how important this is to me and if it’s important to me then it’s important to her (which confuses me because why isn’t this important to her inherently…? But I digress). 

So now here we are. We’re finally going to say something. My mom says she doesn’t REALLY want to because she sees no good in confronting Melissa, as she’ll just deny it, and “what then?”. I say, then we cut her out. Don’t allow her around us, don’t allow her at Christmases. Cut her completely out of our lives. And THAT is good. I know it may result in Cole being taken from us, but I also say that if Jason would just stand up to her too, then we could see Cole. Jason has just as much of a right to dictate who his son sees as Melissa does. I’m not sure at this point if he would ever do that, because it’s not just my mom who is too cowardly to say anything (it’s EVERYONE! I’m the only fucking one who cares it seems!), but if that’s the case then so be it and I don’t want contact with Jason either. Whoever enables her behavior and bows to her is just as bad as her. Whoever enables her stealing is just as bad as stealing themselves.

How can we say something to her? What can be done? I don’t want damage, but if it happens then it happens. How can we approach this in the best way possible? And how can I stop feeling guilty about the fallout on Cole and our relationship with him, because even though I logically know we can’t keep going on pretending nothing is wrong, I DO love him and DO want him in my life?

TL;DR: My sister-in-law is stealing from myself, my brother (her fiance) and my grandma (my mom’s mom) and has been doing so for three years. I’ve finally had enough and am going to say something and cut her out, which I haven’t done until now because my mom has pressured me not to in fear of losing a relationship with my brother and the thief’s young child. How can I approach cutting her out in a clear and least-harmful way, while also not feeling guilty about it?",20Feb2020,1
541,"I just took this test https://psychcentral.com/quizzes/autism-test/ and got a schore of 34 which equals autism. I actually relate to a lot of the questions in that test, like avoiding social interaction and being bad at it, liking to focus on certain things and having a daily schedule which can annoy me a lot if it gets interrupted. The thing is, I'm 18 years old and my parents have never really truly believed I actually have autism, and thus won't do a damn thing helping me with it. I used to be convinced by them I don't have autism, but within the past year I've become significantly more aware of it because I found information on the internet. Before then, some people have diagnosed me with autism but because my parents didn't believe it, I didn't believe it either. They're still convinced there's nothing wrong with me and if I try to convince them otherwise it just won't work and they won't listen. If I try to get help they oppose it. The thing is, I also looked up what Asian countries' view on autism is. After I heard from someone that autism is considered taboo in Japan and won't be recognised properly, I looked up if it's the same in China. Probably not as bad as Japan, but still not the same as Western countries. Actually, I never lived in Asia. My parents did, and before I was born they moved to the Netherlands.

My mother may also be at least slightly mentally unstable. She's been sent to therapy at least 2 times now and both times after she went back home nothing seemed to have changed. I may or may not have inherited the autism from her. I don't know. My dad has also adapted Chinese cultural parenting and always tried letting me do the hghest possible education, not realizing I was collapsing because of it and my autism preventing me from achieving top results at school due to me hating school because I didn't want to make social interactions, none of the subjects interested me and it just felt like a prison. Thus, I ended up failing class 3 times in a row and got sent to a school for autistic people. That school actually feels less like a prison but the taxi trips, because it's about 1 hour away from my home town, sitll take a ton of free time and sleep time and it ruins me. I still have an extremely hard time studying because of all the things in my head and my dad getting stingy with it which discourages me. Because of my autism I also have my daily routine thing for home, which does not include school work of any kind because I'd rather sit in front of my computer than waste time, and if my dad wants me to do school work at home I get extremely annoyed because it destroys my daily routine, but I can't show any of it or else he will get even more pissed.

It doesn't just have to do with the parenting. I also learned that I'm in the bottom attractiveness tier. Asian men are simily viewed ad the most unattractive to white girls. And I get more attracted to white girls than Asian girls. On the outside I'm Chinese, but on the inside I'm Dutch. 99% of the people I see outside are Dutch anyway and Chinese people are rare so I don't want to pursue a Chinese girl, I want a white girl. I also hope my parents will respect that but I have no idea and a relationship is not on the horizon right now anyway but I still worry about it. But simply because of the way I was born I have severe disadvantages. Almost all of the white girls will simply not view me as a potential partner just because of my ugly-ass Chinese face and maybe not even having a larger weiner than Dutch guys. I simply can't compete. Maybe if I had a decent personality, but the autism, bad personality traits and social awkwardness have destroyed that. Both my outside and inside are unattractive. Sometimes I feel like one of the most unlucky people in the world.

Tl;dr: My parents don't believe I have autism and won't help me with dealing with it. Thanks to them I didn't believe I had autism either until recently. They don't want me to get help from others either. Thanks to the autism I struggle severely with school and social interaction. My parents don't understand me. Being both Asian and autistic also makes me extremely unattractive for white girls.",20Feb2020,1
542,"I know its not good for me and probably one of the reasons I'm not losing weight but idk how to stop. And I don't like that I enjoy staying up. I love cleaning at night, doing homework, working out, cooking, you name it. I try to stay up all day so I can sleep at night but I get so irritated that I fall asleep during the middle of the day. And when I do force myself to lay on my bed and close my eyes, it feels wrong. Like I feel uncomfortable.  Its kind of hard to explain.  I feel uneasy. I cant stop. Even if I'm tired at night its like my body is forcing itself to wait until 6am to zonk out. And I've tried to change this.  I'll do good for a day but my body is just so used to the nocturnal life that it basically prepares for me to stay up now. Idk what to do.",20Feb2020,1
543,"So long story short I (21F) recently moved back in with my parents after living away from home for a year so that I can begin university. 

My parents and I get along well but I feel like I should move back into student accomodation (even though I hated it last year) once I start uni so that I am no longer living with them. I love living at home but I don’t want to be “that person” who is 24 and still living with their parents. 

Is it really worth moving a bit over an hour away just to avoid the stigma??",20Feb2020,1
545,"Around September I suffered from extreme burn-out and it took my productivity to an all time low for the rest of 2019. In January, my new years resolution was to be more productive but now, it feels like I've bit more than I can chew once again.

\- I have 3 full days a week at uni  
\- My dissertation to do (which is so much work it feels like a full time job)  
\- Many more assignments to do in the next month  
\- I'm starting a part time job for 3 days a week   
\- I volunteer for 1 day a week

It feels like I'm doing so much and I don't have the time to be doing the things that I need to prioritise right now: like my dissertation and assignments. I also need to prioritise leisure time as I really don't want to burn out again because I know once I burn out, it's gonna take another 3 months of therapy and not doing any work to get out of it. 

But at the same time, I still feel like I'm not doing enough? I know loads of people who can juggle more than this but I guess this is where my limit stands.",20Feb2020,1
546,"Hello guys, hope you're all having a great day. Anyways, I need some advice on this since I don't know where else to ask (mom is useless on this topic, sister isn't replying yet). 

Anyways, I'm currently looking for work to help pay for my college tuition (I'm restarting college in a couple of months) however I'm pretty undecided if I should go for the ones closer to home (I live a few towns outside of the main city) or go to the main city. I'm going to go to an online college btw. The commute from my place to the city would take me anywhere between 1.5-2 hours ONE WAY (about 3-4 hrs total) however the city pays about 20-30% more than jobs here. Getting a place in the city is very expensive so I'll barely be able to make ends meet if I stay there, given that I have close to no experience and don't have a degree so the jobs I'll be able to get won't pay well enough to support both my tuition fees and living expenses. I don't want to be too reliant on my family either. 

I considered going to work in the city and bringing my laptop and study in a coffee shop or something after work but I live in a 3rd world country so unless I bring a car (which I have but is super expensive to use everyday) I'm probably not coming home with my laptop back lol. 

Any advice is greatly appreciated, thank you",20Feb2020,1
547,"So we are looking for new employees at my work, I am high enough up the chain that I get to sut in on going over the resumes of applicants, today while doing this my boss would read an Arabic or Indian sounding name and put that persons resume in the ‘no’ pile without even reading it, then when he sees a caucasian name he would read the whole resume but then go on facebook and find the applicant, one of these was a man who’s profile pic showed him with his male partner, my boss said “ oh hes a homo” then put his resume in the ‘no’ pile.

I know I don’t need to explain what is wrong here, what can I do though? If I speak up against this I will probably get managed into an early resignation. We have a HR dept but it is notoriously useless.",20Feb2020,1
549,"I realised listening to the Joe Rogan Podcast today. His guest was a mathematician, physicist and all that jazz. I was enjoying him speak immensely, he was delightful in short. Very good conversationalist, very eloquent in his explanations and generally exceedingly likeable. 

Until he revealed that he was of Jewish descent. He’s not even practicing, neither did his father. However, instinctively it shot my enjoyment and admiration for him. I’m aware he’s still as likeable, smart and still seems like that decent to good person. But before if I had the chance to become his friend I would have fewer people on top of that list, but now, physically my stomach is turnt to it.

This happens without fault. I don’t feel like I have generally negative feelings about them, if you asked me what I think of about them it would be strictly neutral as all people’s are. But physically, on an instinctive level",20Feb2020,1
550,"So, for context, it was my grandmother's birthday last Tuesday. I see my grandparents every Monday night after work for dinner. They are aware I work long days, and do not have access to my phone for the majority of the day, and are appreciative that I come and see them weekly.

This particular Monday on the drive home my grandfather mentioned that it was my grandmothers birthday the following day (I already knew this, but it was a nice reminder.) I said I'd call when I got the chance but it wasn't likely that I'd be able to call until the evening. 

Come the next day and all is going well at work, I get everything I need to do done, and start to pack up ready for the end of the day. I car share to and from work daily (Still learning to drive.) and appreciate the support that my lift provides me. My lift, isn't exactly the most punctual person, and on this particular day, we didn't actually leave work until past 7pm.

My phone had died by that point, and I was unaware of the time until I walked through the door. I started getting myself settled down for the day, and go to call my grandparents. That's where things go dark, I wake up, it's 2am. I never managed to hit the call button before passing out. I plucked up the courage finally to call them on Saturday (I'd been really busy with work, and hadn't really had the chance before this), and talk to them, they were fine over the phone and I apologised for my mistake, explained what had happened and they joked about it. Come Monday, dinner is going well and we get in the car to go home. This is where it goes downhill, my grandfather says that I am bullshitting, and that I'm becoming thoughtless like my dad, I try to contest my point but he wasn't having it.

I'm aware that socially I'm not the most developed person, and that I struggle with different things (I've been to the doctors and they can't seem to find out what is up). I struggle with communication and my memory isn't perfect about certain events and things like that. I'm aware that I could have done better with this situation but can't find out how to fix the problem.

Has anyone else been through something similar? Is there anything I can do in regards to overcoming this? I'm aware reddit isn't the best place for receiving help like this, but I'm not sure where else to go.",20Feb2020,1
551,"I am 17 years old and I am thinking about moving out of my parents house in about a year. 
Dont get me wrong, there is nothing bad happening it just that living by myself as young as I can has always been my goal. I know that I am capable of taking care of myself and i want to find more stable job and get on my own feet.
There is just a problem that I don't know how to tell that to my parents, so they won't think that they did something wrong. I don't wanna hurt them and I just can't find the right moment or the right way to tell them. Any advice?",20Feb2020,1
552,"My life is falling to pieces. I’m 18 years old and I lost my dad unexpectedly to a heart attack just over a month ago. That man was my best friend &amp; my rock. We’ve both suffered with severe mental health issues and our pact has ALWAYS been to stick around for eachother. I think we’ve kind of always subconsciously accepted that we can’t live without eachother. I blame myself completely for his death. I was raped in October and since that day, he’s been a broken man. His physical and mental health deteriorated instantly, and now he’s gone. If moving on from the assault wasn’t hard enough alone, I now live every day with the thoughts of how different my life could be now if it never happened. I’m quite close friends with a family in my village, Dad (35), Mum (39), and two young boys (4 and 1). Ive become particularly close with the boys’ Dad, and in the last week or so, we’ve somehow ended up having a sexual relationship. Last night, he told me he thinks we need to stop, because he’s worried I’m now viewing him as the father figure I no longer have, and fears I’ll develop feelings for him - he doesn’t want to break my heart. In short, I can’t say no to him &amp; within 10 minutes of telling me this, he was putting himself on me again. I feel sick and scared and very alone. I need a miracle to be able to live in this world.",20Feb2020,1
553,"I'm 20, doing my bachelor's degree in something that I, first and foremost, think is boring and, for a second, not at all intellectually stimulating or, far from it, challenging.

And I am too old for anything else.

Okay. I did drop out of highschool at 16 (changing between half-a-dozen schools in the process that culminated in me dropping out), and, in retrospect I find the reason for all this being my own difficulty in understanding my own thoughts and emotions, and I have to stress on emotion because I do kinda think of myself as not a very emotional individual, and recently I've learned about myself that I am easily overwhelmed by emotions, and a severe sense of purposelessness leading to impulsive decisions.

Whenever I mention my urge to drop out of college, my ma tells me that it's because I know that there will be food on my plate even if I don't work.

I got a few hobbies that I'd like to cultivate. And maybe I could move to more ideal country. And, there, I may find a community. God. These are hopeless fancies.

I am having a difficult time being part of a society where I am starting to think of myself as quasi-misanthropic. I hate knowing these self-deluded, micro-meglomanical creatures do hold and can influence some power over me. 
Btw, I am from a third world country.",20Feb2020,1
554,"So this literally happened 2 hours ago. My friend(14F) has slite on her wrist. About 5-6, red, parallel, running the width of her wrist. I'm so worried for her. She usually is quite cheerful and very nice, but I never noticed the slits till today. She's constantly avoiding me and my questions. I don't know what to do. It may be nothing, itay be something serious. I don't want to do anything rash or stupid. What do I do",20Feb2020,1
555,"I have dealt with depression/anxiety as much if not more as the average person and up until I turned 18 I planned on not going to college and going to wait until I found something I was passionate about. Well, I guess I can just say simply I got carried away the excitement of my classmates moving on and going to college and decided I would go to an out of state school to have a regular college experience. I ended up partying and working to keep my bills paid while i was school that I eventually basically abandoned my actual studies. After a semester and a half, I made the decision to drop out and figure stuff out and keep working. It has been a year and a half and while i’ve enjoyed meeting people and working around the college town, I still have no idea whether or not to go back to school or try to find a job without a degree. I have waitressed for a couple years now and I’m sick of it but I don’t have a passion or a distinct skill so I feel I have nothing to go off of. Is this normal? How did you figure out what you wanted to do with your career?",20Feb2020,1
556,Like what would be the 1st offense and 2nd offense.,20Feb2020,1
