,text,time,score
402,"I lost my best friend 4 months ago.

She was my person. My absolute favorite person in the whole world. I felt 100% comfortable with her and loved her beyond any words can describe. She felt the same about me. I know it for a fact cuz she kept telling me that. 

We started drifting away in quarantine. I didn’t feel like it was a huge thing because I knew her and I knew our friendship. It was strong enough to survive this.

We went from talking every day to maybe talking once a week. And by the end of July I offered her to meet up. She told me she’s scared and she doesn’t know why. I assumed she felt like I didn’t wanna talk to her and she was scared I was gonna leave her. She refused to talk to me, even on the phone and eventually stopped responding to my texts. On my last text to her I said I’m sorry if I hurt her in any way and that I’m here to talk whenever she feels comfortable.

4 months later, and I still feel sick to my stomach that I lost her, and even worse - without any explanation or a chance to say sorry for what I did and fix our friendship. I feel lonely. I feel hurt. I feel betrayed. I know I did something wrong, otherwise she wouldn’t have don’t that, but I don’t know what it is, and it’s driving me crazy. 

I never expected her to end it like that, and I can barely resist to urge to text her, reach out, try to reconcile with her. But I’m scared of being rejected or ghosted again. 

What should I do? I feel so lost. I need her.",20Nov2020,1
403,"Hi, 
I (25M) am posting this here because I have come to the conclusion that I don't have enough balls to take a decision by my own.

I've been back to the University after 3years of doing nothing, to start a master's degree in nuclear physics. 

Class's been hard since beginning, didn't attempt to connect correctly with my mates mainly because I've been doubting this master since day 1. Not that I doubt that there will be any job, just because I don't feel it right. I don't enjoy things we study as I used to enjoy it, and well as a person who was used to have plenty of interests in scientific studies and being good at it for that, it's a (little) pain in the ass to feel being forced to study against my interest.

Although I'm like, ok, maybe finishing this master would be useful at the end.

These days I seriously think about leaving all of this for a minimal wage job, that would allow me to finally leave my parent's place, and be able to develop myself more. 

Of course keeping in touch with fields that are interesting for me would be certain, I just feel like I want to be more free.

What are your thoughts ?",20Nov2020,1
404,"This is going to sound horrible but it torments it at night and I don't know who else to tell. Back when I was 14-15 I used to be, well, a stupid hormonal teenager and as someone like that I was also desperate for attention.

So I created a badoo account and I did shitty things, like catfishing older men and women into having a ""relationship"" with me, lying about my age, lying about my life, sending them pictures where I looked 18+ as I told them I was... I never sent nudes or anything, and I was lucky enough to really never encounter a real predator, only older people in university who just wanted to date and hang out.

It was shitty from me, back when I was that age I thought it was just lying but now that I'm 22 and I'm the same age of the guys/girls I used to catfish it makes me feel horrible to think I could have an online ""relationship"" with a kid 7 years younger than me and I couldn't know it, it makes me feel dread inside.

I got discovered three times because of stupid things like details about my life that didn't match, personal stories that were more typical from teenagers than from adults... But the worst case happened with a 22 years old guy who I ""dated"" for 4 months, we used to text every day, we used to talk about our lives and personal problems, he used to send me random pictures of his pets, family and friends and I only sent him pictures where I looked older.

But he started suspecting until he finally confronted me about who I really was and he pressured me until I told him the truth. And of course he reacted badly, he called me which didn't happen before, he was panicking and crying, he even asked me if I thought he was a paedophile or a predator and that's something that I still remember clearly these days because I never heard a man crying like that before. Until then I had inmature thoughts like men didn't cry like women do until I heard him. And it was what made me delete my fake social media accounts and even quit the internet for weeks, which felt like an eternity back then.

And the older I get, the worse I feel thinking ""what if I was in his place? what if I got catfished by a 14-15 child like the people I catfished to?"". None of them are in jail, none of them were paedophiles fortunately, the three of them inmediately cut contact with me after what I did. But I can't stop thinking how it would fuck me up if I was in their place.

And sometimes I feel like I deserve to be catfished, like I deserve to be lied and to go trought what they made me go trought. Sometimes I feel like I don't deserve people to treat me badly or to scam me. 

Because I don't know, I can't stop thinking if they hate me. Specially that university guy I ""dated"" for 4 months. But I can't contact him anymore and apologize or anything because he had such a common name that yikes. Also, I don't think it's a good idea to contact him honestly.

Do you think they hate me for what I did? It's been years and it still eats me inside, I've never heard an adult man crying like that before and after what I did.",20Nov2020,1
405,"My friend was having issues with her boyfriend. She came to me for help, I talked to her for a couple of weeks. I started getting the feeling that I was sticking my nose in her business and I didn’t want to feel responsible if they’d break up. I told her that I didn’t know how to respond and I don’t think she took that well because ever since I said that she hasn’t really spoken to me anymore. She said “sorry shouldn’t have messaged you. It’s my problem not yours.” That is so not what I meant. It’s been a few weeks now, he broke up with her last Friday and she told me like two days ago. Normally she would’ve told me first. Should I message her to say I she can always talk to me and I didn’t mean what I said back then the way she took it? I already said something of the sort right after but I have a feeling she still didn’t take it well",20Nov2020,1
406,The relationship has been over for 2 months now but I can't seem to get over it. Any advice?,20Nov2020,1
408,"I have a decent microphone (Blue Snowball) but my friend doesn't. All he really has is the one built into his laptop.

We both enjoy video games, so we might make the podcast about gaming news.",20Nov2020,1
409,"Hey everyone.

Lately I’ve been feeling very “bored of life” and have been roaming around my house in almost a dream like state. It feels like nothing is real, and very floaty sometimes.

I’m an avid video gamer and usually have no problems sitting at home playing games, I suppose you could call me an introvert. Recently however I will often sit at my desk and just stare at my desktop for 5-10 minutes then go lay on the couch and just kinda stare off into space. What used to be my number 1 hobby just doesn’t bring me happiness because I’ve been doing it all day every day since the beginning of the year.

I’m a high risk individual so I’ve quarantined since the beginning of the year, only to go to my local dollar store occasionally. All my friends are having parties, hanging out with each other and they’ve seen to forgotten about me. I haven’t had a text from anyone in months. 

There’s a party tomorrow where all my friends and many many people will be there. I won’t be going, but it just really sucks some people can just go on care free with their lives ... 

Okay I’m just rambling at this point. 

What has everyone been doing to occupy their time at home? I feel like I’m in prison. 

Thank you very much for any feedback",20Nov2020,1
410,I’m 17F and my bf is 22M. What do I do. I love him so much but I know it’s wrong. I’m scared of what can happen. Sometimes I feel disgusted with myself because I know it isn’t right but I don’t know. I’m a mess. He makes me feel loved. I know his intentions aren’t bad. At least I think. I don’t know.,20Nov2020,1
411,"I've always experienced low self esteem and low self worth. They're both things I've been working hard to overcome. 

However, over the past year I've started slipping down a slope of absolutely crippling self doubt. As with anything it started off without me really noticing it. Things like big decisions (expensive purchases, actual life changing things) got harder first, but since I've always been a little indecisive it didn't really seem all that odd. But now I question my little choices that wouldn't even cross my mind before. It took me an hour last night to choose that I was going to shower in the morning rather than in the evening. 

I'm so frustrated with myself. It's getting so stupid. I want to shake myself and scream to just choose SOMETHING. When I try to force myself to choose something it feels like my whole body goes into shock and I get a panic attack. 

I know there's more than likely a reason behind this sudden flood of self doubt. My parents and family have never been that supportive and I'm very used to my ideas being shot down by people I tell them to. It would be fine if they provided constructive critique or reasoning, but that's not what I receive. It's usually 'Oh you want to do that course? No."" with no explanation. 

I'm absolutely terrified that this self doubt is pushing towards the depths of learned helplessness. 

If anyone has any advice or resources on how I can deal with this I would be more than grateful. Thank you so much.",20Nov2020,1
412,"If you lost your kids because you were a drunken drug addiction and you were given the option to sober up in order to get your kids back,  what would you do and how would you do it?",20Nov2020,1
415,"I have a bunch of SLC SD cards and they are not used, they're industrial grade so they can go -20°C and +40°C. I got this bunch SD cards after replacing those memories in automatons from my company. I still have no idea what we could do with them...",20Nov2020,1
416,"Here’s the back story, I work for a company called Huttig Building Projects, so I basically just prep doors for painting so they can be shipping to customers or other business establishments. My boss is my boyfriends, brothers girlfriend and it’s caused some issues as she makes everything personal and lashes out at me in a very unprofessional way (swearing, saying we are friends and have a personal connection when we don’t.) She gave us all a choice to work Saturday to catch up because the department is behind because some people can’t do their jobs correctly and just automatically assumed my boyfriend and I were coming in on a Saturday when we typically have it off. So I spilled the news yesterday and told her we weren’t going to come in because we have better and more important things to do then work on the weekend (I.e, we have to try to sell our truck and get a new vehicle) she basically just stormed off on me, and acted like a total bitch about it. So I approached her and asked her what was going on and explained that I was given the option to come in or not and that’s when she basically told me that I shouldn’t have a job because I’m always a couple minutes late coming into work, and all this other stuff and made it extremely personal for no reason. Did the same thing to my boyfriend. It’s been what I considered a very one sided toxic relationship and she doesn’t treat anyone else in the department like this, whatsoever. I’ve even asked them myself. 

I am putting my two week notice in on December 16th, as is my BF, so I can get a little bit more money and try to secure a new job before I leave. Do I need to give her a proper reasoning for giving my two weeks notice? Would it be wrong to tell her how I feel and make her realize that she’s been very unprofessional toward me since I started? And explain every wrong thing she’s ever done to me? Idk what to do about it. I feel she may revoke my privileges to work those two weeks because again, she makes it a personal affair when in reality she’s just my boss, whether she comes around the home I live in with her boyfriend (my bfs brother) or not. I talk to her when she is there to be nice in front of my boyfriend family even though we all don’t like her, or the fact that she’s married still and is dating him. Please give me some advice, I really need it",20Nov2020,1
417,"I (27/f) am dating my bf (37/m) for 4 months now. He’s smart, educated, attractive and amazing.


We were just right now having an argument a little back and forth over the phone. Nothing crazy but... an argument nevertheless. 

He says “yes there’s a lot of stuff going on and honestly... I just feel like you’re not mine. Wow I’ve been wanting to say that!”

I said “okay” as I began to cry and I hung up. To me that meant he was about to say “it’s over”. 

Idk if he was just expressing how he felt or if that was him wanting to break up for good. 

He still has me on social media as well. What do think?",20Nov2020,1
418,"I suffer from anxiety and in January this year I got a really bad cough. The doctors just told me it was a viral cough and it would clear up on its own, it got worse and worse and I was throwing up while I was coughing and choking. I couldn’t breathe and it scared me so much. I couldn’t walk around much because I would just cough and I was really short of breath. I was ill for 2 months and I still wasn’t quite right for a while after. 

I’m not sure if this was corona, because it wasn’t really a thing in the UK in January but it was horrible, I ended up bleaching my entire room and cleaning everything and buying hand sanitizers because I didn’t want to ever get sick like that again. 

Then corona became more of a thing here and it terrified me. My anxiety has spiralled so bad into being afraid to cough and constantly checking myself and freaking out if I feel hot or have a headache or a sore throat. I work from home and i am sat tensely all day just freaking out and shaking because I think I’m going to get it/ have got it. 

I’m 32 and apart from anxiety I would say I’m in ok health. Everyone I’ve asked have said they aren’t particularly frightened of catching it, and that even if I did catch it then I would probably be ok. I wear a mask, wash my hands and I work at home so I’m not around people. 

How can I stop obsessing over it so much? And is anyone else as frightened as I am of it? It’s really taking over my life :(",20Nov2020,1
419,"I’ve been good friends with this one girl for a while but lately she’s been showing more and more interest. Late night phone calls, she texts me good morning, she also usually texts me first now as well, and she even invited me out with some friends. And I like her. But I’m worried bc she has a toxic ex and they’re always on and off. I feel like if he ever calls her up she’ll lose all interest in me and go to him. But besides the point, the dilemma is we were supposed to talk otp tonight and play some cod mobile cuz that’s what she likes. And she said she couldn’t tonight bc she’s going through something and she was otp with someone.... ( I’m thinking her ex). But I tried being supportive and said hope you feel better and I’m here if you need someone to talk to. She replied “you’re a good friend you really are”. And that is worrying to me.... am I being friend zoned? And what can I really do abt that toxic ex?

Edit: she just texted me asking if I wanna talk",20Nov2020,1
420,"Hi! I'm a grad student and not going home for Thanksgiving because of Covid/my parents not taking precautions, and I'll be alone in a new state. A girl in my program that I worked with on a group project invited anyone who needs a place to go to to join her (she and her husband are also staying here for the same reason). I'm pretty sure she's the kind of person who wouldn't offer if she didn't mean it, and I would love to have someone to eat with (we'd eat outside on her porch!) I don't know her super well though, and feel really awkward texting to see if the offer still stands. Does anyone have suggestions for how to politely word that in a way that doesn't sound pushy/over-enthused/like I'm inviting myself? It's giving me a lot of anxiety to the point that I was considering not reaching out and just being sad on Thanksgiving instead. 

&amp;#x200B;

Thank you for any help!!",20Nov2020,1
421,"I have zero stance on religion because it’s not my business. However this church is known for refuting science absolutely, causing members to make bad financial investments and aiding in the spread of misinformation. Currently our county has the highest Covid numbers and deaths in our state. This particular church encourages their members to not wear masks because Satan is a liar. They also force young members that have unplanned pregnancies to come full term and the church pastors keep the babies. There have been several reports of sexual misconduct in the name of the Lord, where one pastor will “heal” you if you preform fellatio. It’s fucking weird. Now that I explained why I bought the domain names, what do I do with them. My first thought was to redirect them to the planned parenthood site but that’s just what I came up with on my drive to work. What do I do now?",20Nov2020,1
422,"I could be completely wrong on my observation and maybe just paranoid. But in the event I'm not I'd greatly appreciate any advice. 

I'm 22M my sister and her friend (F) are both 13.

Okay so Sis has been friends with, I'll call her A, for some time. Obviously they've hung out at our place and when they do I let them use my game systems if I'm home or when they were younger I'd wrestle with them, mainly my sister and have her attack her friend. 

More so recently, which is where my concern comes in, A has been asking about my relationship (I'm engaged but I don't think she knows that). Her questions always are directed to how long her and I have been together, if we're fighting, things that seem a bit odd to ask about, though that's my opinion. 

She also tried to get close to me when she's over, we have two couches, I'd sit on one then she'd sit on the same one too. 

Again maybe I'm reading this in a bad way, maybe she's just comfortable around me and all that. 

But what do you all think? Should I talk to my folks (I live at home) or to my sister to ask more questions? I don't want to accuse her or ruin her friendship or, at worse, make anyone think that I initiated anything.",20Nov2020,1
423,Is it normal to feel my chest getting filled up with air as I breathe in?,20Nov2020,1
424,"I posted some images of the two of us on an adult website. There was nothing identifiable in the images that could be traced back to either of us, but my ex-partner has found them.

&amp;#x200B;

At the time I felt that as they could be anyone in the pictures that it was relatively ""safe"" to do so and no one would get hurt. She has found them (by keeping tabs on my activity online herself) and I feel awful for breaking her trust, even though we've been apart from years now. I want to ask for forgiveness for causing her distress but have been advised not to get in touch. The images have of course been taken down.

&amp;#x200B;

I feel like I've let myself down as well as someone who I still love to some degree. I want to ask her for forgiveness but have been advised not to get in touch at all. Police were involved and I can hardly blame her panic even though there was nothing in them that could be traced back to either of us - I understand that is beside the point.

&amp;#x200B;

I am genuinely quite regretful and ashamed but don't seem to be able to move on without at least asking for forgiveness from her and I'm not sure whether I can even forgive myself for is a clear break of trust.",20Nov2020,1
425,"Hello, 

Im in the 3rd Year of my Film and Advertising. 

I come here to ask that I feel like I have been setback cause of the pandemic, this was going to be the year in which I would have done more filming/increased my portfolio. 

Next year there are more chances things will turn to normal. I feel like I’m unprepared for the real world especially with the circumstances now. 

To those who in a similar position, or those who have graduated, what would you say? 

Many thanks :)",20Nov2020,1
426,I've been seeing this girl and lately I mostly just reply to her stories/snaps. How bad is this and what's the worst that could happen if I keep this up? Meeting up isn't an option rn due to lockdown unfortunately.,20Nov2020,1
427,"Hello! 14M here.

I have a friend S. I helped him to become friends with a girl named A. 

They've been having an amazing friendship. Lots of fun chats, lots of gaming. They are like two drops of water - same interests, same humor, both are really smart.

It isn't only sunshine and rainbows, sadly.

Since S and I are really close friends, he often shares concerns. There have been some pretty worrying ones regarding A.

They had an argument because S had made an Instagram story tagging two of his female classmates. 

Another thing S has pointed out is the fact that A is cyber stalking him. I remember that when we three were talking once (that was a long time ago when I was still friends with A), A said, absolutely correctly, what phone S had, and that she knew that (A and S hadn't seen each other before). It was because the phone's camera made a tiny logo on one of S' photos on Instagram.

Third thing he mentioned is that he regularly sees her writing (without posting anything) in Discord chats he's active in, even though she doesn't do the thing those chats are related to (for example, the Minecraft chat, and she doesn't play Minecraft).

He also noticed that she changed her Discord status several times to match his. He attempted that 7 times, all of them yielding a change in her status, so it can match his.

A has also told S (indirectly) to not communicate with me, because I was acting demeaning towards her (which was true, for unrelated reasons, and it was my fault.)

Last, but not least, he has told me that when he starts up a game on Steam, he sees her online on this game a minute or two after he begins playing. She doesn't invite him as well.

I am pretty worried about my friend. I do not want to ruin their friendship, however. Should I be concerned? Should S be concerned? What should we do if our concerns are justified?",20Nov2020,1
428,"So basically i (from germany) started studying this winter semester with four friends who do the same. I wasn‘t good at math in school and i also wasn‘t that good in programming either. I absolved school with a Grade average of 2,6. Now at the moment i have Ops and stuff bc i have bad teeth and try to get them fixed. So basically i found out few weeks into studying that its interesting but i really am not able to do the math tasks or programming tasks on my own ( only with those friends i talked about, they are smarter than me) and i also don‘t feel the motivation to go all out and try to catch up all math i can‘t remember( i finished school this year and forgot already so much lol ). Now i don‘t know if i should look out for jobs for this rest of the year to overcome and than maybe look for a real job. Also the OPs put me behind the schedule for university, thats why i mentioned it. I really like animals but i don’t know what to do with it xd. (All the thoughts and doubts came up in my mind bc on wednesday my wisdom teeth got pulled out and my chaw got weakened lol and now im lying around and and thinking about my life all time ...)

Have a good day
Friendly pedestrian from germany :)",20Nov2020,1
430,"More than a month ago, I was phone interviewed by a BPO company and asked if I could do it work from home. I was unable to accept it since we didn't have an internet connection back then (I was expecting that I can choose to work in the office, but unfortunately I had no choice), but I asked if I could contact them again once we are able to have one and he said yes, I can contact that same number. Now, we have a fast internet connection so I thought maybe I should again apply for the job. I text messaged yesterday the same number that interviewed me but still no reply so far. What do you think should I do? Should I send another text message, call that number or just send an email to their website where I applied?",20Nov2020,1
431,"Hello, I'm 36yrs old and have just found my biological father and don't know how to go about it.  Any advice,  perspective,  opinion or support would be appreciated. Thank you.",20Nov2020,1
432,"As you know, I tried getting advice from this subreddit before, about my grades (Thank you to everyone that responded). But now, am I a failure? I know the stuff that they teach me but whenever a test comes I just do so freaking bad? I study much as much as I can, I go to Reddit for help, I ask my teachers about the subject, and yet, everything that I do is all for nothing. 

I feel very depressed and anxious because of this. I already had a few mental breakdowns during a test, but I am not sure how to stop them. Maybe it's my fault for not learning the material the correct way? Maybe it's my fault somehow?",20Nov2020,1
