,text,time,score
219,"My parents have been fighting a lot. It’s gotten to the point where I don’t feel safe, my grades are dropping rly bad, and my relationships with people are getting messed up. But maybe that’s my fault. In the end that’s all my fault. I have control over my grades and relationships. My siblings live in different states now, so I’m all alone (it’s been like this for over a year).

Both of my parents have depression. My mom is an alcoholic. I recently got diagnosed with depression like a couple months ago. I’m not on meds or anything. Normally I can stay calm and stay out of my parents fights. But tonight I went out to clean my dishes and my dad told me I was unladylike and that I was a monster. For no reason, his back is hurting so I think he wasn’t in a good mood. That hurt my feelings, and I myself am really depressed tonight. I called him a dick. I regret it, but he started coming at me and telling me I can’t call him that because I’m a teenager. I went into my room and locked the door. My mom knocks on my door and asks me what happened with my dad and why. I said “Mom, it’s right in front of you, are you kidding me? you guys are crazy. Leave me alone. The only way I will get happier is being by myself in this shit show.” and she said “but why did this happen” and I said “well I pushed things under the carpet for a long time and then I exploded. Hey! I wonder where I get it from!! Now respect what I asked and leave me the fuck alone.” 

I feel bad. I’m normally not mean like this. My mom is kinda drunk and I don’t want to talk to her right now. My dad is being mean and scary. And both of them are screaming at each other. I am very anxious and sad 

What do I do?",20Nov2020,1
220,I made myself squirt tonight for the first time. I’ve been self pleasing for awhile now &amp; I must say this is a big accomplishment for me.,20Nov2020,1
221,"I work in a restaurant and have just been offered a position as the manager, but I am completely lost and have no idea how to manage!  The restaurant is connected to several other establishments on property that are owned by the same person. We had great success this year and were able to make profit despite being completely new and having to compete with other long standing local favorites.  Due to the success of the restaurant, the owners of the property decided that they needed a “real” manager instead of just a few people supervising and helping out every once in a while.  To my surprise- they asked me.  

Although I am an extremely hard worker and know the ins and outs of both my own restaurant and the other establishments, I don’t think I am qualified.  I am a 22 yr old female, have two years left of college before I even obtain my bachelors of finance, and have no experience managing.

What do managers even do?  How do I run a staff meeting?  What can I expect from this position?  I don’t know that I am qualified for this at all and am scared out of my mind that I will mess it up.  Any advice will help, thank you! 

TLDR: it’s my first time managing a restaurant- any advice to a new manager?",20Nov2020,1
222,"I was hoping someone here could answer some questions I have about the cognitive symptoms of schizophrenia. I'll leave a TLDR at the bottom for those who don't wanna read the context. After a couple months of heavy cannabis use, I started to experience paranoia. Thinking that any plane that flew over my head was gonna drop a bomb, that people on the street wanted to hurt me, stuff like that. I then got obsessively into religion, and entered an eight month long psychosis where I had no awareness that I was sick. I thought I was becoming more enlightened, which I see in retrospect was part of the illness. Over those eight months I started to experience very bizarre thoughts; random phrases and noises in my head. My lack of insight prevented me from seeing this as a sign that something was wrong. The delusions got more and more intense, until I started getting visual hallucinations. It looked like translucent tv static that danced around on blank surface, forming vague patterns, particularly when i smoked weed. Then the static started moving like liquid across the wall and pulsating. 

After 8 months, I began to notice something was wrong. I couldn't feel empathy, or any other emotion. I was losing the ability to read; my eyes scanned over the words but my brain wasn't able to piece them together. When I looked at people I couldn't focus my attention on them, I was unable to fix my awareness on their face or make eye contact. I then decided that I had gone crazy. From this point on any apparent control I had over my mind disappeared. Over the next month things went from bad... to hellish. Everything started to look foreign, not distorted, but unrecognizable. I'd look at a person and it was like I had never seen a human before. My thoughts went from weird and chaotic, to incoherent but at least somewhat connected, to disconnected fragments of thought that finished before they made any sense. My mind jumps from one unrelated thought to another, and I can't even call them thoughts. I'm starting to lose self-consciousness... like even though my thoughts are insane and my emotions are gone, there's a weird unsettling feeling that I am fine. Like there's nothing wrong with me. It's like going under the water, and when I occasionally resurface I'm like ""what the hell is going on, I need help"" and then I go under water again.

Life feels similar to an acid comedown. Everything looks very high definition, like the quality of reality was switched from 480p to 4k. This makes going outside terrifying and overstimulating. I've been abstinent from weed for three months but it hasn't gotten any better, it's gotten worse. I'm unable to visualize anything, and thus am not able to recall memories, my memories are vague and un-detailed images that cannot be held for more than a second.
My mind is disappearing, and with each day that passes suicide seems more and more appealing. Without a functioning mind, how are you supposed to make it in the world? Have relationships? I can't even make the most simple conversation anymore because conversation requires thought and emotion. 

I'm getting an evaluation soon, and seeing a therapist but the purpose of therapy is clearly not to put back together a broken mind. I have not yet been diagnosed with schizophrenia, but both my doctor and therapists agree that it's most likely whats going on here. Positive symptoms started after a couple of psychedelic trips and heavy weed abuse, and negative symptoms began at the start of puberty. I didn't know what was wrong with me, I was emotionally numb, had a monotone voice, didn't ever feel lonely even though I'd spend most of my time alone. Before puberty I loved social interaction, but after it was painful and I avoided it as much as I could. For the next couple years when I would hang out with friends I would be silent almost the whole time. I had nothing to say, and when I did it would something weird and socially inappropriate. My brother also has psychosis, so it runs in the family. 

Some questions I have about this illness are, do anti-psychotics help with disorganized thinking? Do people struggling with schizophrenia ever recover from this sort of mental disfunction? Does the lack of emotions ever go away? If this is gonna be my life going forward, I don't think it's a life worth living. I don't have any suicide plan, so you don't need to comment about that. I just need advice about what the next step is. Thank you for reading.

TLDR: My thoughts have become incoherent fragments that I have no control over whatsoever, and I have no ability to visualize or recall memories anymore. I'm pretty much unable to read, and emotions have gone away entirely. Even anxiety. Do antipsychotics help with these sorts of symptoms? Ive only felt anxiety and fear since 7th grade, and now even anxiety is gone...is there any chance of recovering from this?",20Nov2020,1
223,"So I live in Canada. Currently in Grade 11. But haven't even started yet because of me. I've procrastinated for 6 months out of 2 years (with this being the 3rd year) that has started and I haven't done any course work. Total number of courses I have done 5 Gr.9 courses and 4 g.10 courses. With the total amount being 30 credits. Meaning I have done 9 credits. This doesn't even include the 40 hours of community involvement. I'm sure I fucked up and now all I can think about is this. Can't help but tear up a bit because I made stupid moves. 

I'm not like other students. I don't think I'm overly smart but I'm also not someone who thinks they can just make a comeback from screwups. I really need help.",20Nov2020,1
224,"I am a 17 year old boy, currently in my junior year of high school, and I am really struggling wether I should quit the only sport I play, ice hockey. This dilemma has been giving me anxiety for years now, and I really want to get this off my chest. I started playing hockey when I was 10, and I used to love it. I used to be truly dedicated to getting better, and I would train in my front yard every single day for hours.

A few years passed, and until I was in around 14, when kids were allowed to hit each other on the ice, I believe everything changed. I have always been very small and skinny, so I had a lot of trouble with this new change. At the start of the season, the first thing I noticed was that everyone on the ice was so much bigger and better than me. This is where I began to lose confidence in myself. As the season progressed, I became aware that I began to lose motivation and love for the game. I would also get a lot of anxiety every time I played, because I felt very embarrassed about being the worst out there. However, I fought through it, and I even received a reward for sportsmanship from my coach at the end of the season. 

By freshman year in high school, every player who was as bad, or worse than me quit the program. For around the past three years, I’ve been the worst on the ice. I always felt embarrassed and could never focus during practices, because I could not stop thinking about what the other kids were thinking and saying about me. I believe that the constant feeling of being the worst over these past few years has really destroyed my confidence, and affect the way I feel outside of hockey.

I understand that it is mostly my fault for not being as good as them, and I don’t expect any sympathy for it. They have much more of a drive to improve and make varsity than I do. However, these past few years I have just had no motivation at all to improve. I just can’t stand the sport anymore. Every time a game begins, I stare at the clock the whole time, waiting for it to end. 

I have tryouts next week, and I really want to quit, but if I do, I will have no other sport to play. I come from a very athletic and strict family, and they will be very disappointed in me if I quit. I’m not sure wether to push through these last two years, or just drop the sport and focus on something else for these final two years. I want to thank you if you read this far, and I would appreciate your help. Thanks.",20Nov2020,1
225,"She’s my coworker and we’ve worked together for a little while, so we’ve become quite close. But over time shes been dropping small hints (I don’t even think she realizes) that shes kind of into me and I usually play dumb and pretend to miss in hopes she’d get the hint that I don’t like girls (we’re both female).

We have also talked about dating and boyfriends before so she knows I like men... I don’t know if she’s trying to test me or gauge a response or whatever, I just want our friendship to go to the way it was earlier... I want to let her know the truth but I also don’t want to humiliate her and ruin our friendship.. Could someone please give me advice on this? I really do care about her and I want to let her know as gently as possible.",20Nov2020,1
226,"I've had clinical depression for a while. My mom has taken me through therapy, counseling, doctors, even the ER. I really hated that time of my life, therapy sucked, meds sucked, everything sucked. 
They made it very clear though that the only way to make it end was to prove that I could act safe though, so I complied. And somehow I kind of got better for a little while. I had goals, energy, and stayed clean from self harm.

But recently verything has unraveled again. I feel like the band-aid that was put on my mental illness has finally fallen off. Everyday I feel on the verge of s/cide. 

Part of me feels compelled to tell my mom what's been going on, but she's either not going to take me seriously or panic and make me redo everything. What should I do? 

Btw she's religious and has only let me see other Christian therapists, even though I'm an atheist and LGBT. Kinda sucks.",20Nov2020,1
227,"For the past 17 years of my life my father has had the same work schedule, our conversation usually consist of him telling me to take out the trash. But I’ve never vividly remember me and my father spending any time together. I spent most of my time gaming, going to school, working my job since I was 15. But I rarely saw my dad. My parents aren’t divorced either so it was points when we are all home together. I don’t feel bad about it, I’m just concerned about my father. I’m moving away from my family soon and I feel like he might get emotional after my departure. And honestly I don’t feel comfortable when any one gets emotional it feels really weird to me. Other than that talking to my father doesn’t feel smooth at all, it feels skewed and weird most of the time and I really don’t know how to deal with that.",20Nov2020,1
228,"Hello, so i’m in the midst of highschool and am at that stage where we start to learn about personal finance. 

What are some main financial goals a fresh new adult should have?",20Nov2020,1
229,"I (27M) have a girl (25F) that I like at work. We both work at the same job and position (though not always on the same hours/shift). I've crack jokes (whether there good or bad), act silly (but keeping it professional or minimal due to being on the job). help out at work. etc. All of them makes her laugh and make our days at work a fun and less stressful.

I'm pretty sure some of our co-workers is catching on (based on my behavior around her) and one of them asked if I do like her (which I told them, as it was obvious and felt hard to say no). my only problem is, I have a hard time just saying it to the actual person (something that I mentally struggle with every time I really like someone and I hate myself when I miss an opportunity or when I even struggle saying it).

Now I'm about to work two jobs in a couple of days (reasoning for two jobs is a different topic for another day). while that good on some points. It would mean very little time (or non at all) working together. And I feel like I'm running out of time on telling her about my feelings towards her (yet can't find the rights words to say it nor get pass this mental struggle.) before I start working on my 2nd job.",20Nov2020,1
230,"I had a college friend group of five. I lstopped speaking to my college best friend because I noticed every single fight in the friend group was started by her, and she was constantly nasty. There would be screaming fights because of her. It never involved me so I ignored it, but then she was nasty to me and I felt like I finally saw her for who she is. I'm still friends with the other 3 girls, one of them is my absolute best friend (ex roommate, known each other since we were in the 6th grade). She wants to drop this girl as well because of the drama.

&amp;#x200B;

Next I dropped my high school best friend, and because of this, I lost all my other high school best friends except for two of them. Our friend group was so tight and close because one of our friends died our Junior year and it really brought us together. I swore our friend group would be close forever. Me and my ex broke up, but he said he was never rlly in the group, he just dated me. 2 years later he's coming to hang outs and is best friends with them all again, including my best friend. He's going to her lakehouse with her and her friends. She's given him so much advice about me since we broke up. They're constantly replying to each other on social media (tik tok, twitter). It made me uncomfortable so I dropped her. Now suddenly her best friend from college is friends with my ex and also dating one of the guys that was in this friend group. Her cousins love my ex as well. I thought I could handle it, but obviously I know my roles and this friend group clearly no longer should have me in it. One of the guys also called me childish for not wanting my best friend to be close with my ex, so I don't see myself being close with him anymore. The rest of the friend group are guys, so I'm SOL there.  
My best friend is now one of the girls that also left that friend group, saying she realized she only liked the guys when we'd drink and have parties, and she hated my ex best friend. The two of us are still friends with one of the girls, who is balancing both us and them.

I was also in an on&amp;off again relationship. It's now off because he's depressed.

I know this is a part of life and i'm 21 so it's bound to happen. But it makes me sad. I wonder if I subconsciously got too upset at my ex best friend because I didn't want to be close to my ex out of respect for the guy I was seeing. I wonder if I just stayed calm if I'd have so many friends right now and i'd feel less depressed and lonely. It's hard to tell yourself you did the right thing when you're the one lonely in the end, and everyone else is close.",20Nov2020,1
231,"Women make their own life hard, while a man lives his life trying to find a woman to make happy. Fuck boys exist because of the way women are. Women don't know how to take a compliment and if they do they become the reason fuck boys exist. I don't want to be full of anger towards women but that is what's happening. I welcome anyone to debate with me on this help me find the light lol.  Sorry for a any typos I can't be bothered.",20Nov2020,1
232,"I am 31 years old male, I finished my master's degree in statistics in 2018 Nov and I have been working in this job for 2 years since graduation. 

Pay is okay, ~ 77k with a good pension plan. Since I got this job, it's been always challenging. I thought it was due to my skills and I always tried to put more than 100% to catch up since my career start was very late. 

Fast forward 2 years. A team of 5 (2 co-leads, 2 project managers, and me as a programmer) received millions $ of fundings in the middle way through and now we have 20 people in the team. By the way, we are a small research group based on hospital.

I have been working so hard, and there were always huge pile of works, I couldn't even take proper vacation for two years, no promotion and they expect me to serve as a mentor, manager of the new hires on top of my regular workload. 

I can't take this anymore. I feel like I am not respected and I am trying to find the new job in the big companies with proper structure and where I can focus on specific task without worrying so many tasks on hand.

But It's been hard to find the new position, so I am just surviving every day until I could take my breath. I have been working weekends, until 8:30 am - 10pm for the last few weeks. But I can't stop, I have to pay the bills and rent.

Probably the answer is finding the new job but this is more difficult than I thought. I don't know what to do. What should I do in my situation?",20Nov2020,1
233,"I opened my mouth at work the other day that my friend was possibly exposed to COVID. He was getting tested and that I was scared I had it. Hypochondria creeped in and I panicked and started saying I didn’t feel well. It got to someone older I work with and they filed a huge complaint against me. All of my managers are pissed I started all of this panic. A guy is now in quarantine and is blaming me. I don’t even have any symptoms. My boss reamed me a new one for the havoc I caused and I was hoping on going for a promotion in the next month. I’m a great employee and he even mentioned it. He just says my nonsense always puts me back when I get ahead. 

My mouth is always getting me into trouble. I say too much and it’s hard to keep a secret. I show my hand too often. I like to be open but then I get screwed. I’m always in trouble for saying things I shouldn’t and people have a hard time trusting me. How can I fix this? I’m 25 now and it’s potentially getting in the way of my career. My boss always says to just keep my mouth shut and do my job then I can get to where I wanna go. I just want to be better and a better professional.",20Nov2020,1
234,I am a 20 year old guy and I have been dating my current girlfriend for the past 3 years and I really love her a lot. But I before I dated her I had a little fling with this other girl that only lasted a couple months. I sometimes think about the other girl and sometimes I would wonder what would happen if me and her would’ve continued and didn’t cut off each other. I am happy with my girlfriend but my mind seems to wonder off sometimes. In my head I’m stuck trying to decide which one I should pick. Who do you guys think I should go with. Sorry about my grammar.,20Nov2020,1
235,"Hi so I’m sharing a room with a roommate it’s my first time sharing. I’m currently staying here for 2 months now but I’m really stressed out can’t get enough rest. She is a student most of the time she is in the room on her laptop doing her study, assignment, exam etc etc. Since she is doing online study, she get her meetings online, and boy I tell you she don’t use headphones or earphones it’s so freaking loud. Even when I’m trying to sleep still she will play on loudspeak and I would always get awake. I’ve told her to use earphones, but still she is playing loud indian music which I don’t really hate but I just want peace and quiet in room. Everything is on loud speaker. Even in late hours she is studying and I would tell her I have to sleep, she will only tell me she will not make noise but I still could hear her because she is always talking to someone on the phone. Please help how can I tell her I want to move out when I’m just staying here for 2 months. I didn’t sign any lease or anything. Thank you",20Nov2020,1
236,"So I got really depressed, I started college while I was in high school. It was fairly easy as a bunch of me and other classmates were together and cheated on simply everything. I am now almost completed with my bachelors in business management and feel as if I know nothing. I try to learn and stay focused, but my depression hinders me.. do you think this will impact my future? Will I be able to get a job in the business field without this knowledge? Do you know anyone who’s cheated their way through college, or have you?  Is there hope for me?",20Nov2020,1
237,"I DON'T WANT DMS FROM THIS I JUST NEED ADVICE

So I keep getting physically aroused like a nagging feeling that won't go away for hours at a time, I'm not even thinking about sex a lot and no, snapping a rubber band on my wrist won't help... I like that.

I've tried gaming as a distraction but I'm quite literally getting antsy and moody from it and my mom keeps asking why I'm bitchy.

How do I train myself not to be horny?",20Nov2020,1
238,"Basically, as soon I finished high school, I didn't know what I wanted, never liked anything, I gave a thought to every single career, but I simply dislike everything I can think of, I ended up choosing computer science, simply by the fact that I play games, and both use computers... I thought I would like to be a programmer or a game developer, In the start, since everything was new I was enjoying, but on my last college year, I already knew that I would not like working with that, but didn't have the guts to tell my parents that I wanted to leave my college on the last year, now I graduated, Im 19 years old without a job and I don't know what to do, I don't wanna be a burden to my parents but I'm lost...  


TL;DR   
I (19M) graduated from computer science college but I don't want to work with that, or anything else I can think of and don't know what to do with my life.",20Nov2020,1
239,"So long as it doesn't die naturally before the birth, would you choose to have the baby, knowing it will be disabled &amp; dependent on others for life?


Or would you do a ""mercy killing"" (abortion) and maybe try again at pregnancy later?


(Assuming multiple doctors have been consulted, tests have been run, etc. &amp; the baby is definitely found to be ""defective"" in multiple ways; for example, doctors can confirm the baby has downs syndrome, servere mental retardation, brain damage, and other bodily deformities - such as a hole in the heart and incomplete digestive tract)",20Nov2020,1
