,text,time,score
0,"I’m at uni trying to sleep in my dorm and finally having a night off. Everyone is drinking , this mate has a girlfriend away from uni who come s here and visits sometimes. I could hear everything through the walls like her saying no you have a girlfriend we can’t do this and then heard them making out in the corridor and saying they’ll do stuff later. Do I say to him that I heard it all? Or do I just shut up or wait for him to mention it?",20Nov2020,1
1,"i might go to college, might not. If I do it'll be for art. My school was too cheap/lazy to have more than the bare minimum of classes for online students. I'm in 7th grade and I just wanna get as much credits done early as I can, that way in highschool I can spend as much of my time on more important things, like getting a job or starting my own small buisiness. Problem is I'm from a low income household. mainly just living off of social security. We ain't got the money for the extra courses. How do I get the credits without having to spend the money? I'm normally an A's and B's student, maybe a few C's. This semester I'm super behind, but I'll be able to catch up before the deadline. how do I get the extra credits? I'm in oklahoma if that helps.",20Nov2020,1
2,"For background information, I (17F) am a high school student, so I still live with my mom. Also, I have a few medical issues that put me under the high-risk category for COVID, and I'm in the US in one of the states where COVID cases are rapidly increasing. At the beginning of quarantine, my mom was super careful about going places, letting people visit, etc., but at the months went by, she became more lenient about allowing my sister to go places and hang out with her friends and having people over at our house. Because of my school situation, I don't have any classmates that live near me, so I've barely stepped foot outside of my house since March (even if I had friends near me I wouldn't hang out with them because I know how dangerous COVID is). 

So here's the problem. Recently, she's been letting people into our house, even if they haven't been properly quarantining/social distancing. In the near future, she's throwing my sister a birthday party at our house with around 15 or so of her friends. She says that they're going to be mostly outside, so it's not that big of a risk, but I think that it would be best for nobody to come over period. I've tried to talk to her about letting people over and why I don't think it's a good idea, but each time I mention it to her she tells me to shut up and avoids the situation, telling me that she's the adult and I'm the child, so I have to listen to her. I have no idea what I should do. It's obviously really frustrating for me to be in a situation like this with no say in what's happening, especially since I'm the most at risk in our household because of medical problems. Additionally, I've tried pointing out to her how she's critical of people who aren't social distancing and keep continuing to party, but then she turns around and does the exact same thing. She gets mad at me when I mention that too. 

Any advice on this would be appreciated, as I really just feel like I'm stuck between a rock and a hard place.",20Nov2020,1
3,"My boyfriend recently approached me about the possibility of his mother moving in with us. This immediately put me on edge because even though I don't dislike the woman, I can't imagine actually living with her. 

Now, to put things into perspective, my boyfriend has an older sister who lives alone in the same city, but does not want to take in the mother because it would drive her bonkers. My boyfriend to a degree much worse than his sister, has major issues with his mother that has resulted in him moving entire towns away to get away from her throughout his life. Basically, the mother was an absentee parent while he was growing up, and when she decided to be a parent, he was resentful of her attempts since he was an adult and didn't need that sort of thing anymore. He has never been the type to spend more than a few hours with his mom at a time, because he gets seriously annoyed with her. 

However, with his sister not wanting to take in his mother, he is considering letting her move in with us. Like I said, I don't dislike the woman, but I never have been able to relax around her ever. Being around her puts me on edge. She has this ability to make someone question all their decisions and actions and undermine what they say/do/decide for themselves. Often times, she speaks down to people. Once, when she visited our house and saw my collection of books, she looked at me and laughed, saying ""You need to stop buying books. No one needs that many."" She is also very religious. I am far from religious, closer to a pagan, and worry that her incessant god-fearing wall decor will end up making it into our home. She's also a huge party-thrower, and I again fear that her constant parties and seasonal get-togethers will invade our home. 

She's never been downright rude to me, but she can be very nosy. She'll ask questions that she has no business asking, to the point of making me uncomfortable and my boyfriend having to step in to tell her to stop asking things. With all of these things, I'm just worried about how she will affect my daily life in my own home. I'm afraid I'll be unable to relax or do what I want to do with her around. Am I being unreasonable for not wanting her to live with us? I just feel that his sister should consider a little more flexibility since she actually lives alone whereas we are a couple living together and honestly would have to make a lot of changes for her to live with us.",20Nov2020,1
4,"But he’s head over heals for me. He’s a really good guy but growing up no one ever pushed him to do good things. he smokes weed all the time, drinks all the time, and doesn’t do any school work. I just don’t see him going anywhere in life, and i want to be with someone who will go places. And I’m okay with people drinking and smoking, but it’s the fact it’s everyday, even at work. I also don’t see myself with him when I’m older. I’ve been having these thoughts that it would be best if we broke up. I see other guys and think that maybe i would be happier with them, then my actual boyfriend. I know he deserves better, and to be with someone who’s also in love with him. But when i think about that it gets me so sad. I don’t want to do life without him. But i think i could be with someone better, someone i click with, someone I’m actually in love with. He’s also going threw a lot right now, and i think it would be selfish to end it with him right now. I just don’t know what to do. I’ve been feeling like this for a few months now.",20Nov2020,1
5,"So i’m 16 and I have a girlfriend who is also 16. We had unprotected sex every week this month and we been scared of a pregnancy. Today her period was supposed to start in the morning, and now we fear that she is pregnant for sure. We don’t know what to do at this point. She can’t buy a test until next week. She is thinking about taking ibuprofen to stop a baby. I need advice quick!!",20Nov2020,1
6,"So my bf has this friend that is always trying to break us up, we are so happy together &amp; he wants to always put stuff in his head about me. He will send him pictures of half naked girls, telling him “oh you’re missing out, single life is great”. It gets my blood boiling because my bf tells him off but he keeps doing it and he just stays being friends with him. That is not a friend, that is a hating as n !!! He is always disrespecting me , telling him oh you’re still with that fat girl, first of all I’m not fat he’s a hater. He’s the fat n !! Lmao like tf. He weighs like 200 pounds... but anyways it pisses me off that my bf is still friends with that bich as ng.",20Nov2020,1
7,"One of my guilty pleasures is checking out random redditors and seeing how much I can find out about them. I never do anything malicious with the information but I have been able to find social media profiles, home addresses and phone numbers. I'd say 80% of my searches have been ""successful"" and it takes about 5 mins on average. Do you guys think I should let them know or let sleeping dogs lie?",20Nov2020,1
8,"When I was much younger, around December 2008. My mom and I went to Mexico to see my grandma and the rest of her family. Since then, my grandpa passed away and my mom hasn’t been to Mexico since then. My grandma is getting older and my mom hasn’t seen her since we went back in 2008. For reasons, my mom can’t come back to the US if she goes to Mexico . My sister and I have been thinking about getting passports but I’m still a minor. What we want to do is go to Mexico and have a video call with my mom while me and my sister are there. What can I do?",20Nov2020,1
9,"I (20f) am trying to take the initiative to move out. My therapist says it the right move, my boyfriend is actively encouraging it and even my doctor, who saw me for emotional stress chest pains, told me to get out. The decision is in full swing. My issue is that I don’t have enough money to comfortably move out. I have two jobs and I’m at full time student at a community college. I am considerably stressed, to dangerous levels. 
My biggest issue is that both of my sisters emotionally batter me and it affects me very greatly. I’ve never gotten along with my older sister, she despises my personality, and always nitpicks my actions. My little sister looks up to her, and often follows suit. My parents turn a blind eye because they don’t like that their kids are fighting.  I am not going to change my personality, but it is hard to cope with the negativity. What can I do other than quietly exist until I’m able to get out?",20Nov2020,1
10,"TL;DR need to reply to a TF about a deadline I exceeded by TWO WEEKS and never informed them

Hello!

I dropped out last semester due to a severe mental health episode. I'm doing well now except I still have trouble writing papers. The academic office is well aware of my situation. I also communicated to all my professors during the first week -- save for one class which I joined quite late so never got around to it. As irony will have it, this is the only class I messed up BIG time. I exceeded the deadline for the first paper by five days and never wrote to them but they were kind enough to give me a mild penalty as I briefly explained my situation and promised to not repeat it. 

HERE'S MY PROBLEM:
For my second paper, I again exceeded the deadline by two days, emailed my professor for an extension; he gave me three days. I then slipped into a cycle of oblivion &amp; denial lying to myself everyday that I'll finish the paper and now it's been TWO WEEKS and I still haven't submitted it. I again failed to write to them because it makes me feel so ashamed and vulnerable I just sit mum. 

My TF emailed me yesterday. I'm very close and need just 1 more day. But I have to respond and I'm so crippled by shame at this point I don't know what to write. So any suggestions on how I can approach the email will be much appreciated.",20Nov2020,1
11,"I suffer with manic depression but am mainly ok so it doesn’t affect me as much as it does other ,so not complaining but I was recently dating this girl (20) me (18) she had heard stuff about me from her relatives friends that they heard in school years back , mainly just saying that I was somehow a serial “womaniser” to quote them , I have never been someone like that , she asked me about this before we started dating and I told her it wasn’t true and not to worry ,she believed me and it was fine I stayed in her house a lot and she stayed in mine it seemed all fine , she had been fine with me then randomly the next morning she had removed me on everything ,not blocked but removed from followers and she sent me a text saying please don’t contact me again . I guess she heard that stuff again as she also said to my friends girlfriend to stay away from him who stuff was also said about , it was a brief relationship so I’m not devastated or upset but I feel confused by the whole thing I was never anything but nice to her and although I could ask her by text or phone call I’ve chosen not to out of respect for myself , I feel like she didn’t have the respect to ask me about the situation or lack there of . I’m worried about her mental health and I hope shes doing well , but even if she works this stuff out I don’t think I can date her again based on lost trust because she obviously didn’t respect me . Even more confusing is hours before that she had been texting a friend of mine saying how much she loved me and shit like that . I’m very confused but not upset so I’m just going to let it go , my problem really is I’ve had a kind of anxious feeling since like terrible guilt despite me knowing 100% I couldn’t of done anything like cheat or say anything bad about her (especially in lockdown). It’s only been w couple days since and after the first three days the seemingly everlasting anxiety about the situation eased but then began in spurts whenever I thought about it I’d start hyperventilating and having what I think is panic attacks (despite me never having anything significant in that manor before) it’s eased again but I still feel guilt . But I also 100% know I treated her as well as I could . Any advice on how to deal with the anxiety would be appreciated I don’t know much on the subject and have mostly just been avoiding caffeine which helps me kind of 😂 .thanks for reading (needed to vent as I haven’t told any friends or family yet )",20Nov2020,1
12,"There is this piece of clothing i've dreamed of owning and wearing for two years now, unfortunatly the company that makes it is going bankrupt and i know they won't survive this month, but my parents won't let me buy it because the biggest size they do is about 1 inch smaller then me, i've pretty much given up all hope of having it, and to just let the company die, but i need help just accepting this and moving on, please help",20Nov2020,1
13,"Can I get some advice on where to go, what to do, how to get started, etc? 

I saw a post made by a friend of mine that people are going hungry because of COVID-19, and that scared me.  I've been wanting to help donate or so something to get people to help, but I wouldn't know how to and I'm scared I'll get shut down. I want to start doing something with my life (16 years old), and I've decided that next year I want to donate to/help at least one place every month of the year until the end of high school. 

Can I get resources, donation ideas, where to donate, how to get people to listen and support a place, etc? I would volunteer, but there's COVID-19. I just want to do something. My school went on full distance mode, so I am not sure if I can start a drive/fundraiser there.",20Nov2020,1
14,I am at a lost. No matter how much I tried I can never be happy. People though out my life have treated me like shit. One the reasons I get treated like that is because I have autism. I tried therapy but it is not working. I tried to read advice from other people for the issues that I am having but it doesn't have an effect. It looks like I going to sad and alone for the rest of my life.,20Nov2020,1
15,"rant : I am scared of most things, losing people, the dark, big dogs.
I’m also really scared of getting myself involved in something that will result in me being in pain.
But I love this person so much I can’t even describe it, why do humans need to have these emotions it is so annoying.
We went out and I broke up with them (months ago) but we seem to have developed a closer bond since then and I’ve been regretting it more because I feel so in love. They are all I think about and they hint to wanting to be with me too but I can’t fully tell.
Part of me wants to go for it and the other part wants to keep my walls up and just leave it.
I’ve had such a horrible year with family deaths and world problems (u all know those ones) so I don’t know if I should even think about romance but god dammit I think this person is the most beautiful thing to walk the planet even if we do argue and annoy each other. 
One part of me wants them to find someone else so I can get the heartbreak part over with and another part just dies at the thought and wants to be with them",20Nov2020,1
16,"I honestly just want to chat with her again. It’s been a few months now. We was ok friends, but the past year we became really good friends i Think. Maybe to much. She broke up with her bf and we hit it off like 3 month afterwards.

I wanted to tell her - which is to late to say now ofc - how much i cared about the friendship, and that hooking up was dumb af since we so good friends, and i was the 2nd guy ever... so a bf type of thing is all she know of. 

She is probably one of the funniest and most badass girls i know... but after she broke up with her bf, a whole new side of her was shown. I had no clue she could take a Full 180 turn and be suddensly so sugar sweet, shy and Way to clingy lol. Litterally the last week we spent as fwb she both wanted me to eat with her mom and gave really passionate kisses the middle of the Day etc. Just super touchy. i knew the friendship was absolutely fucked. It was to much really, and not what i agreed to.  She just agreed to ‘my terms’, of being fwb with no feelings, which she couldn’t.

I remember thinking ‘This is not gonna end well’ at the end, and it didn’t. Rn i’m thinking; sure we’re gonna talk to each other again... but wondering when this Will go back to normal, if ever? And should i let her be the first to contact? She have dm’ed me tho, since. if we’d parties we were both invited to and she had asked me where i’d been, since i have went to other parties. 

Last few times i’ve met her have just been soooo weird. Idk whst to do tbh",20Nov2020,1
17,"I (15M) suck at algebra and I cant afford to fail this course. I need to get grades above an F and not fail. I swear, classes before this were a ton easier. Also, i'm in algebra 1.",20Nov2020,1
18,"I went through school relatively easy, never had to study and was called a smart kid. Went to university having this mentality of doing everything without effort and never acquired studying skills and failed. Sadly, I've already failed 3 times in life due to this issue and I don't know what to do.

How do I learn to study?",20Nov2020,1
19,"(Sorry if the format is weird on this post I'm on mobile atm)

I am currently in Wisconsin and was invited by my fiancee's family to go to their Thanksgiving in Virginia. I would really like to go however I have a few problems. We would be leaving Saturday but I have a shift at my work on Sunday. I'm trying to get off work by using pto or switching with another person but so far everything is still pending. I'm going to call work tomorrow since the shift manager wasnt there today and see if I can get approval. If those dont work I will have to call in sick which I dont want to do because I've already called in sick last week. I dont want to lose the job since I'm already tight on cash.
I havent been on a real vacation for about 7 years and never took one with my fiancee. I really want to go but I'm just scared about work and my future work endeavors. I'm almost done with school and am looking for a job since I'm about to graduate.
Do you think I should continue trying to get the day off or do you think I should stay home?",20Nov2020,1
20,I don’t know any movie sites online that will actually let me watch a movie for free instead of promoting me to buy Amazon prime or something it’s lame need help plz,20Nov2020,1
21,So I have a friend that I work with and we were talking on Snapchat but all of a sudden I’ve been left on delivered for the past week. The thing is he’s been active on the group chat we’re both in with others from work even now just sending random messages and memes. Why is this? It makes me feel bad,20Nov2020,1
22,"Ok, ok. It may be a little silly, but I need something fun to play. I'm sooo bored. any recommendations. Preferably mobile games. Some games I play are Brawl Stars, Clash Royale, Minecraft, Among us, and some others",20Nov2020,1
23,"So we've always had a really iffy relationship. Since I've gotten older and moved out I've seen gow bad it was. They now want me to come oit and see them every holiday and more recently I've hit a weird spot where I gotta go out of town for the holidays but I don't want to tell them.

What's the best excuse I could give to avoid seeing them. I already plan to tell them I'm not feeling well to avoid Thanksgiving but any other options for Christmas? I usually spend every holiday with tgem but I just don't want to this year.",20Nov2020,1
24,"Like the title says, I'm a pedophile and I need advice on what to do about my fetish. I am attracted to prepubescent girls but I really don't want to be, it makes me feel very shameful and uncomfortable when I think about it. At first I thought I was only attracted to ""cartoon"" children (loli), but today I masturbated to a (clothed) image of a real child and now I feel really bad. I don't think that I am going to harm anyone, but I'm also worried that if I don't get help something might happen, I don't know but I need help and I don't know what to do. I don't have anybody to talk to about this, I stopped seeing my therapist after COVID-19 (I was seeing him for unrelated reasons) and I don't want to talk to my parents about seeing him again because I'm worried they might ask why I want to see him again or something. Also I told one of my friends about this about a year ago, and I'm worried about him telling everyone, or maybe he already has told everyone, I don't know. He's not really the most trustworthy person and I haven't talked to him in like a year, and I don't know how to handle any of this. I just don't know what to do and I want help.",20Nov2020,1
25,"I’m not an insecure person so talking to people isn’t hard for me but texting with someone online who I don’t know is the hardest because I just don’t know how to start a conversation, if you have any advise it’d be greatly appreciated",20Nov2020,1
26,"Hey, i have been thinking about creating my own clothing business with graphic tees an, sweatpants, shorts, and other accessories for a long time now. but i see a lot of people doing the same thing. i want to buy an ipad to create my own designs but i wanna make sure i’m totally ready before i make a huge investment. do you think it is a good idea to create my own brand with so many other small clothing businesses? any tips?",20Nov2020,1
27,"Is it me or does it make anyone uncomfortable when people ask what I do for a living? I don't really mind the question I just hate the look I get after.... To put in context, I sort of fell behind in college because I took a break and now I am playing catch up. To make a long story short I work in a mailroom... … I honestly hate my job and hate talking about it. Anyways, every time I meet my bf's friend/ family members  they always ask me "" So... what do you for a living???"" And then every time I see them they want more details...... Anyways, my job is really not that interesting and every time they ask me about my job I always end up giving them short yes or no responses which often times makes me feel like I am being rude because it always looks like they wanted more from my answer. Anyways, I am not offended nor triggered by the question I just don't know how to continue the conversation when all they want to do is talk about my job.. It's actually gotten to the point that everyone from my bf's family never talks to me at gatherings. To be fair, they hardly talk to him either and we usually just sit and talk to each other... Anyways, how can I change the conversation and avoid them going back to my job? I don't really have any interest or hobbies.... I well informed about pop culture but I don't see my soon to be republican step mother in law wanting to talk about Harry Styles wearing a dress nor do I think they would want to hear my opinion.....

&amp;#x200B;

I don't know, honestly I am not sure I would get any help here... A part of me does not mind them not talking to me.. It lets me get straight to the eating",20Nov2020,1
28,"Title says it. I’m pretty old now but I still live with my parents cuz I didn’t finish my high school yet. About 10 minutes ago my dad cought me fully naked masturbating in the bathroom. I didn’t lock the room like I was doing everytime. He saw but I didn’t see him because my back was turned to the door. I just quickly grabed my things and went to bed. He waited for me to go upstairs went to bathroom and then returned saying nothing to me. 
Problem is my dad is very strict and religious. I was always afraid of him and we don’t talk much. I don’t have any idea what to do.",20Nov2020,1
29,"Hi, I’m a sophomore in high school and there’s this girl who I’ve recently made friends with. We’ve been friends for around a month and idk if it’s too early but I’ve developed a crush. The thing is, she’s got a boyfriend. I’m not a complete dick so I can’t say anything about how I feel. I would never do that to her boyfriend especially since he lives a few hundred miles away. But I don’t know what to do. When I talk to her it’s simultaneously the best and worst thing ever. I love talking to her. We walk to our 3rd period together. Same with our 5th. We eat lunch together. We talk every morning and every night. But I don’t know what to do. It’s stressing me out and tearing me apart. Please help",20Nov2020,1
