,text,time,score
636,"I (27f) am a new mother. My husband (32m) and I have recently had to put up a no contact with my mother and I was wondering if I was the asshole. So to give u an incite of what was going on let me start when my baby was born. I had a horrible pregnancy but to be honest it was worth every sec when my baby came to this world. When she was born my mother literally took her away from me when I was holding her. But I thought she's excited to meet the baby. Everyone was but I saw a look in her face that told me other wise. But I ignored it thinking naw there's no way. Now skip to spring we had a few friends move in due to the pemdemic. I was just about to go back to work and on that fateful day police came and told us one of our roommates had molested our child. I was horrified, disgusted, angry, and more. But my mother had other plans and other ideas. That night we went to the hospital with our child. My mother had said ""Well it is ur fault"" I looked at her at that point and said ""Excuse me, what did u say"" she said ""If u didn't have a gold heart this would have never happened this is ur fault!"" I couldn't even look or sit next to her at that point. I told (sorry yelled) at her to leave. But I forgave her. Thinking maybe it was my fault. But after therapy I got better. I was getting back on track. I was going to work. I was starting to defend my husband from her racist comments. And then she posted a picture on Facebook that got me and my husband really..  well angry. So some incite, my husband and I are huge about keeping our mask and being clean do to our baby being so small. We have followed the 6 feet rule. We saw our baby being held by some random Man that nether of us knew. When I brought it up that we still aren't comfortable with random people holding our baby she dismissed it and told us that this man was a family friend and that it was only him and his wife. I have never seen him before that picture. So I knew it was a lie. Now this is where I started putting boundaries. It was when my mother yelled at me on halloween and that it was Her right to take Her baby trick or treating. She littlely said Her Baby. That i killed her mother because i don't wear a mask (fyi everytime i see my grandmother i do wear a mask) My husband and I at this point have said you can see the baby at our house but she is to not be at my her house with out ether of us there. Now I've been told by a lot of family that I was in the right what she said was wrong. But I grew up with family is family u can't abandon them. You have to forgive but at this point shes just hurting me and my husband. Ooooo there's so many stories I can write about her if u want just let me know, but how far should I go? Am i wrong for putting boundaries on her?",20Nov2020,1
637,"These old women living on their husband pensions/dying jobs maybe, probably retired tend to follow you around even though you have not met them more than 20 minutes in real life. They start conversations with you as if you are old friends. It's very depressing. They need friends and a support network.

Could someone please show them a suitable retirement home and hobbies they can pick up? I don't wish to get to know them, not last year nor this year.",20Nov2020,1
638,"I started having a light hearted debate with my friends about reselling ethics, I believe reselling is ethical and was giving points and it just ended up with them 3 v 1 telling me to shut up and move on every time I made a point and calling resellers scumbags at every point. 

I would like to just move on and pretend it didn't happen but they make jokes about me being wrong about it occasionally and it puts me in a bad mood as when I start to reload the debate they just tell me to shut up and move on. 

It's not part of my character to let things slide in general, I prefer to hash things out there and then, it is especially frustrating when being taunted with it also.

Here are the points if anyone was interested;

Luxury Reselling Ethics 

1) People who are willing to pay to extortionate prices don't care about the money they spend as it's a small percentage of their bank balances and is negligible.  

2) After restock and more restock the people who are willing to pay extortionate amounts of money will reduce and resellers will get stuck with products.  

3) The argument that even though rich people shouldn't pay high prices just because they're rich (I know, poor rich kids right)  If the rich people choose not to buy at extortionate prices the reseller market crumbles and they could then buy at cheap prices like everyone else.  

4) If you have limited amount per household this will help further prevent reselling.

5) These items are luxury items therefore not necessary and no one loses out. If reselling luxury items to some poncy rich kids can put food in your kids mouths then there's no problem. 

6) The argument that if the original business sold it at crazy prices is shitty, therefore reseller behavior is shitty is false as the reseller does not have the options to have economies of scale (to mass produce more products in order to make a larger more stable income)  

7) A strong reseller market is a direct result of a company not making enough units whether first release or on restock.",20Nov2020,1
639,"If you're one of the parents above, read this.

&amp;#x200B;

* When you buy something for someone else, that **does not** make it yours. If you buy someone something, you **cannot** take it back. It is **theirs**, and learn that once and for all.

Say you recently went out and bought some new school shoes for your child. They've tripped and ripped the sole of the shoe off. Would you say that the shoes are now yours? Of course not. Don't be silly.

&amp;#x200B;

* Your child's room is **their personal space**. Not for you to rummage in, not for you to enter without their permission. **Stay out**.

Your child's room is their space for them to feel comfortable and for them to live in.  If you look around their room, you'll lose their trust and make them feel as if they have to live up to your expectations of a perfect room, same with cleaning. Let them be happy with the area in which they want to live in. You don't live in their room, so why should you care?

&amp;#x200B;

* **Do not look through your child's phone.**

Do you want your child to lose all kinds of trust in you? Even if they're not hiding anything, Don't ever snoop through their phone. They'll have private stuff, even if it's not bad, such as simple texts from friends or S/Os (significant others), without needing you to watch over their every move. Next, their gallery. They don't want you to look through their pictures, videos, Snapchat, or anything else. Some people might want to keep their personal life personal, and you're no better than them, even if you gave birth to them. They're still human, with rights and an opinion, and you're gonna have to learn to respect that.

&amp;#x200B;

* Don't **doubt** your child too often.

Even if they do lie a lot, if you really know your child, you would be able to tell if they're lying or telling the truth, especially about serious situations. You losing your trust in them will turn out to be a double-edged sword, which will stab you right in the ass as you see your child doing the same as you do to them.

&amp;#x200B;

&amp;#x200B;

should i make a part 2?",20Nov2020,1
640,"I recently repatriated after almost a decade abroad. A couple years into my life abroad I made a good friendship with a girl from my same original country. Our friendship grew and grew over the years. She became, to me, one of the best girlfriends I’d ever had (I always had trouble maintaining friendships with girls). I took her to the hospital when her water broke early for her first child, and she eventually named me godmother to that child. I took care of that child when she went into early labor with her second and was there for her and her family when they lost that second child. I celebrated with her when she got pregnant a third time and was there for the birth of that baby. Our families would do things together like game nights and day trips and even holidays together when neither of us could return to our country to see our family. When our parents would come visit us, we introduced them to each other. She would text my mom separately from me. She and I even started planning on opening a business together. 

Then I found out my husband and I would need to relocate for his job. As soon as I told her, she started to pull away. I tried to see her more, because I knew I wouldn’t get so many opportunities in the future, and she started turning me down more. She got very distant, but I just figured she had a lot going on, taking care of two small kids and going ahead with a new business venture (different industry than the one we’d been working on). After I moved this past January, we kept in touch via text and video chats...for the first few months. But around May, she ghosted. I couldn’t get a response. I couldn’t get feedback on any platforms. Even when I would post a comment on her business’ social media pages, she would like or respond to everyone else’s comments but mine. 

This was awful. It hurt me beyond belief. But over the past several months I’ve tried to come to terms with it. I stopped reaching out or making any attempts in August. However, my question is this: am I still the godmother to her first child? His birthday is coming up, and I have always given him a gift. My heart still wants to connect with him; I love that little boy like he was my own. I don’t want him to feel forgotten by me. It seems obvious (though has never been explicit) that his mom doesn’t want to put any effort into continuing our relationship, but does this extend to her kids? It’s so heartbreaking. What do you think? Should I send him a gift and let him know I still love him, or should I just wash my hands and walk away? TIA

TL;DR: I was the godmother to my best friend’s kid, and my BFF has now ghosted on me, and I’m wondering if I can/should still pursue some kind of relationship with my godson or if I just have to back off.",20Nov2020,1
641,I'm on a skills assessment part of a job application and they asked me an uncommon opinion I have. I put Donald Trump id not that bad of a guy. I'm not racist or into politics just my assessment. Would that hurt my chances?,20Nov2020,1
642,"

Hi! I will be a high school student after 1.5 years. I am both excited and worried about it.

First reason tht i am worried about is, friendship. I live in a foreign country. I have friends are from same country with me. But in there are mostly foreigner people in the high school that i want to start, and i have so many mistakes when i try to speak language of this country. I am worried about if they prejudge me and if they refuse to be friend with me. I am already concerned about if i can't reach the point that needs for high school that i want to start.

Second reason is, my grades. I am worried about my grades. I heard that in high school, there are more difficult. I am worried about if my grade going to be more worse and if i can't reach te goal that i want.

Can you give advices about them? Thanks for your answers!",20Nov2020,1
643,"I don't know what to do, I just went to get some food from the lounge in my student accommodation, and it felt like there was always something behind me or something just around the corner behind the walls. for a moment it sounded like someone walked into the lounge but without opening the door. People do live above me, but this sounded distinctly like it was on my floor.

This ominous feeling persisted for a while and now things are staring to look 2D, like everything is just a super detailed drawing that I'm somehow interacting with, like I could grab my dressing gown or wash basket from across the room while still being sat on my bed. I feel like I could turn around and turn back and all I'll see is a canvas with a drawing of my room on it",20Nov2020,1
644,"This is perhaps the hardest situation I have or ever will face, and I've genuinely no idea how to fix myself or resolve this issue. 

&amp;#x200B;

I suppose I should start from the beginning, 

&amp;#x200B;

About a month ago, the police department called my parents telling them that I was talking to someone in France and they have to check through my laptop/phone to make sure that I wasn't doing anything terrorist related \[due to the recent terrorist attacks in France + the UK being at a high risk of a terrorist attack\] and afterwards, told my parents I wasn't allowed to use Discord anymore, even though they found nothing on the laptop. 

&amp;#x200B;

This French person was an online friend of mine and we grew pretty close over the course of the 7 months and we helped eachother out in the tough times and celebrated the good times. We got so close that I decided to get her a little snow leopard plush as a gift (also yes, it IS a her, we called and all her pictures don't exist on the internet) and I guess that's what caught their attention. As far as I know there's an investigation going on to find a 'group' linked to terrorism. As a 16 year old undergoing a transition to a new bit of school (A-levels (Essentially 11th Grade for the Americans)) and randomly getting the main source of socialising when at home shut off, it caused me hell in my head. Life at home is already pretty stressful and I used Discord as a main way to keep my sanity (and yeah I do have friends in person, but my phone has restrictions like a 1hr limit before it locks for the day) and now that I can't Discord, I panicked and probably did something pretty bad.

&amp;#x200B;

I got a few VPNs and then used another social media site to talk to this French person \[for now let's call her Ray\] thinking it'd be okay, I wouldn't get in trouble and this situation would sort itself out. It really didn't :(

&amp;#x200B;

The police called a second time on last Friday and took my laptop for 5 days to check through it. This second time caused my parents to just become distant and disapproving of me, and honestly expected me to run away and join ""ISIS"". I'll admit the past few days haven't been their shining moments in parenting, but I honestly don't blame them, I would be harsh too if my child supposedly conversed with a 'terrorist'. And now I've been having incredibly depressive episodes where I just break down crying and don't want to be physically alone. 

&amp;#x200B;

It's really hard for me, I don't know who to believe, even though I really do think that Ray is innocent, but the police are saying otherwise, but they themself won't talk to me at all, and all the information I'm getting is being relayed by my parents. I haven't been given the chance to ask questions or make peace with any of this. :(

&amp;#x200B;

I woke up this morning after a dream about Ray being able to talk to me again and being given chocolate via post, but after I realised it was just a dream I got depressed and only got out of bed out of fear of crying and falling into a deeper hole of sadness.

&amp;#x200B;

The question of if she is or isn't innocent about the allegations are already enough to make me question everything, and I really do care about her, but I think it would really be the best idea if I stopped trying to talk to her, for better or worse, because I can't handle the stress of the police or anything that could bother her.

&amp;#x200B;

So in conclusion, how would I make saying goodbye easier and deal with the new loneliness in my life?

&amp;#x200B;

Sorry for sounding a bit like a loser, I just can't handle it on my own

If something is unclear or you want more details I'll happily fill you in :)  


TLDR : Police think Discord friend is part of a terrorist group and now I have to deal with loneliness and frequent periods of sadness",20Nov2020,1
645,"I'm really on the crossroads here and I need an outsider point of view. 

I knew her since we become classmates in 2015 but due to my natural shyness, we didn't really speak with each other more than needed in natural interactions. Years passed and my friend told me she asked him to tell me I should ask her out to prom, after all, I didn't because a) I saw she already paid for someone outside our school (she might have done it being shy as well and wasn't sure if anyone's going to ask her out, they didn't end up dancing together after the initial dance so it might be it), b) wasn't sure if my friend isn't fooling around as he was known for it, c) the whole prom thing was really stressful for me already and I didn't really get any vibes from her indicating she might want to be my date for prom.

She also invited me to her 18th birthday and I was one of the few boys out there, not everyone from my class was invited. I generally think she liked me even if we didn't spend much time with each other. 

After we graduated, I got my summer job as a night receptionist at the hotel, I'm talking 12 hours shifts and understaffed so I ended up working almost all of the summer. All I did for a few months was basically sleeping or working. Now here goes the part that doesn't let me sleep at night: we got matched on Tinder but I never asked her out. You see, the point is, I was so overworked I basically had no drive to do anything else and after all the only free time I could write to her was around 2 AM, not good, right? Long story short: my grandpa died and I got even more depressed, I started university and suddenly we have almost 2 years since our Tinder match, never approached her as well as she didn't made any moves, only to delete our match year after. We've met 3 times since The Fateful Match, every time it was in our class group but I didn't get a sign of courage to speak with her and I don't think she was going for it either(?). Then we've met in the public library once, alone and we spoke for a few minutes as she was in a visible rush. I remember this prosaic talk to this day. I saw her a few times in the same place but both of us didn't really approach the other one? After all, it's the library, you came here to read not talk. 

Last thing that makes me unsure about doing anything: from her Instagram page it seems like her post-high school life is full of experiences, she has travelled to USA, Vietnam, France and now is participating in semester-long university exchange in France. Meanwhile, all I did was not much, to be honest. I ski a lot, but it's not really travelling, at least compared to her trips. I'm really miserable atm, stressed about my future and lonely. I know how it goes, you should be content with yourself first to think about the relationship but I believe that's not the case, I like myself and I'm passionate about my hobbies, I guess all I need for now is companionship. 

So, should I ask her out after she comes back from the exchange? I'm afraid I idealized her and she won't be the person I think she is, I'm afraid I'm going to be boring for someone who seems like enjoying their life to the fullest or that she is no longer interested in me if she ever was. And finally, I don't want to be some sort of creep, nice-guy that romanticises casual relations with girls, to this day I wonder if I'm overanalysing and she was never interested in me but I just can't stop thinking about her and move on. I'm mad at myself for not doing anything in high school or when we matched on Tinder. Truth be told if not for a Tinder match I would probably move on a long time ago but it makes me feel like I lost a chance. 

Please, give me some advice on how to approach this problem of mine. Sorry for my English grammar, not a native speaker. 

&amp;#x200B;

TL;DR: We've matched on Tinder two years ago after graduating high school but neither of us made a move. Now I'm afraid if I'm overanalysing/romanticise things, idealized her. Should I move on or ask her out?",20Nov2020,1
646,"The story is a bit long, and I want to ask strangers to let me know if I'm in the wrong and should support them in their decision. First of all, my family is really close, so when my brother sprung up to his engagement this month and his desire to get married next month, I was hesitant to congratulate him (btw going to refer to him as Tim). So the issue I see here is that his relationship started wrong. What I mean by this is that my other brother, let's call him Bob, had known the girl first and were friends. Bob had a crush on this girl when he was in middle school. Tim, at that time, was about to graduate high school and was oblivious to this girl and her existence. Tim began playing video games on the pc with bob. Tim started medalling in Bob's life and trying to help bob flirt with the girls they were playing with. Despite bob telling him to fuck off because he had no interest in these girls. Tim had conversations with those girls despite them being a lot younger than him (he was an adult, and some of the kids he was playing with were in middle school). Tim ended up finding out the girl who bob was interested in and claimed he had contacted her to try and be his wingman. When bob first found this out, he told Tim to stop talking to her and let him do his own thing. Bob eventually finds out Tim, and the girl was flirting despite everything Tim had told him. Once the girl and Tim started dating, they kept their relationship a secret. At this point, bob had thought Tim and the girl had cut whatever was going on before it became serious. Tim is in the army, and when he was able to take a few days of leave and visit, he had told our mother he was dating this girl and who she was. Tim's mother had told him to break things off with the girl; she did not believe she could support the relationship if it would hurt another one of her children.  Time eventually told his mother he broke things off and started handing out with another girl while he was in town. He started hanging out with that other girl a lot. He even took that other girl to a family Christmas party and other family events. But surprisingly, a few months later, Tim told his brothers and sisters he was dating the girl bob had a past interest in.  And today says he is engaged with the girl.  And also says he wanted to inform his family because he care about them and wants their blessing. Despite his parent not know about this girl's existence. BTW the girl and Tim had not interacted much time in person. It's mostly all been over the phone/facetime or playing video games. 

If anyone wants to give any advice, it would be appreciated and welcomed. I also want to ask if me not supporting Tim is wrong?",20Nov2020,1
647,"Just a small background on me; this would be my first time away from my family and current friends, building independency. I would have to transfer schools and get a full time job.",20Nov2020,1
648,"Here’s the backstory for context first (kinda complicated so I’ll sum it up as short as I can)
Last year in school, a girl that I never saw before was in my class and I got a major crush on her. I didn’t know she had a boyfriend at the beginning of the year. The dude was in my other class and he found out I liked her because we talked about girls without me knowing who he was. So she knew I liked her bascially for the whole year (messed up situation, IKR 😂) So they eventually broke up after winter break and then I told her I liked her in March (THe day before we got out of school for COVID) but got friend zoned . I stopped texting her in April because she wasn’t giving the same energy back and we didn’t speak until last month. I decided to text her just to catch up again and we’ve texted a few times since then. 

Side note: I was basically simping for her (which left me so hurt when I got rejected) then and I was in a bad time for myself. I have improved myself very much since then, physical appearance and mentally and started taking better care of myself. 

Here’s current situation: I’ve had reoccurring dreams about her off and on for months and I can’t shake the thought of her. I really feel like I’m over her (but I also think I still have feelings at the same time. I think I may just be trying to deny I still have them) but I just can’t shake it off. So my question is, i kinda want to just put my thoughts to rest once and for all and ask if she wants to go out sometime but I just don’t know if I should do it. I don’t think there’s any chance of her saying yes but I think I just need to do it and get it done and hope it can finally put my thoughts away. 

My birthday is this week on thanksgiving so I figured that it’d be a nice gift if she said yes lol. If she says no, I won’t really affect me that much. 

But the only thing that I’m hesitant about is that I just talked to her on the phone for a little yesterday and the local Fair in January came up in the convo and we talked about going. Idk if doing anything now would ruin a chance for something that could happen then",20Nov2020,1
649,"So, me and my girlfriend want to meet up together (We don't see each other much outside of school) and her parents are kind of strict, and mine are too about how far we can go away from our houses. We live close enough though, and her dad knows but her mom wouldn't be happy about it. (I have a different reason for not telling my parents) So, she said her dad said maybe we could meet up, but he doesn't want to lie to her mom, so we don't really know what to do. She said her mom told her tons of times ""If you get a boyfriend I'm going to take away your phone for months"". I'd just really like to know if there was anything we could do to tell her mom about it without her getting angry. Any help would be greatly appreciated :)",20Nov2020,1
