,text,time,score
97,"My life had its ups und downs. Right now, more downs than anything.

&amp;#x200B;

It all started about 3 years ago. I don't know what happened but I felt like something broke inside of me. I am really shy and I am not able to talk to a girl normally and since then I never had a girlfriend or any sexual contact with one. I am 19 years of age.

&amp;#x200B;

The only person I am able to speak to is a childhood friend that I've known for 8 years. I always was able to speak to him and always told him what I had on my mind.

&amp;#x200B;

But to be fair, that really didn't help. It only helped a bit. He hold me I should seek professional help from a therapist but I was never able to so, because of my parents.

&amp;#x200B;

My parents, really scrict, believe in religion, have always prioritized religion first with me coming in second. I cannot seek professional help and can't really talk to parents because my relationship with them is fragmented and I either always play on the computer for 4h+ straight or go outside with my friends. Right now I am not ready to tell them that I don't believe in god. It's like, they're not my parents and I am not their son.

&amp;#x200B;

Even if went to therapy I would be concerned from a financial aspect. Right now I am in a hole, where I cannot think emotionally and financially properly. I never took the time to save up my money and wasted it on unnecessary stuff. Whenever I got angry from either playing a game or fighting with my parents I always destroyed something I have had bought for so much.

&amp;#x200B;

Whenever I was out with friends I always tried to drown my sorrow with cigarettes, hookahs and alcohol. As you can guess that really didn't help me out too well.

&amp;#x200B;

I don't know what to do. Suicide? Well that certainly was a topic that I was thinking about and I am actively thinking about it still. But in honest opinion, that doesn't solve my problem.

&amp;#x200B;

I just wanna be normal and happy but I don't know whats hindering me.

&amp;#x200B;

The story will probably add up as you guys (hopefully) comment. That's all I can say right now...

&amp;#x200B;

P.S. I've created a second account to write this because I am too ashamed that somebody I know will find this post...",20Feb2019,1
98,"I was assaulted and robbed approximately 2 months ago, and since then my life has taken a sharp turn for the worse. I had to go through a very rough couple of weeks with the police interrogating me as if I was a suspect in a conspiracy, and it really messed up my ability to function and be productive. They eventually caught the assailant and realized I had nothing to do with it, he is now in prison awaiting trial. Even so, I've suffered from intrusive thoughts and anxiety throughout my entire life, and now they're worse than ever. I can't fall asleep and can't get out of bed. I was sick for about a month after what happened, and I fear my mental state was a factor in that simple cold developing despite medication. Can't function in my studies and can't stop worrying for my family, since the assault took place in my driveway and the assailant knows where I live. A neighbor with whom I don't speak (and never have spoken to) approached me out of the blue and asked if some people came by a couple weeks ago to beat me up, which only triggered my thoughts and induced anxiety more. I had to identify the suspect via photo, and seeing his face wasn't easy for me. I was scared of everyone being in on it. His lawyer, the police, that neighbor. Everyone. I can't stop looking over my shoulder, and can't go more than a few hours without making sure my family is ok. I hate it when another family member leaves the house on their own to walk the dog or go anywhere by foot. Therapy isn't working either. No improvement. I've been feeling very lonely, as no one in my environment knows about what happened and my mental state. I've nearly taken my own life once recently, only stopping because of that small light of hope in me that things will get better. Today I walked in my driveway and saw 2 full unfamiliar cars parked outside. The people in there looked suspicious, but at this point I can make a killer out of a bunny rabbit. I'm going insane, feeling so alone, especially without a partner for the past 4 years. I don't know what to do anymore. Just need to get this off my chest. I'm completely lost. Thanks if you took the time to read this.

",20Feb2019,2
99,"First ones to legalize cannabis for medical and recreational usage....and will be the first ones to have a vote to decriminalize psilocybin mushrooms.

Can’t tell if this is something to be proud of or not 🤔",20Feb2019,1
100,"Our fish can teach us to take care of our things, to check in on things, and they teach many children the circle of life. My fish died yesterday, but I already knew the circle life. ",20Feb2019,1
101,"So when I was a kid, my parents would tell me I couldn't leave the table until I ate everything I'd served for myself. I'd end up sitting there, not allowed to leave until I'd eaten myself sick. To this day, I don't feel full until I've just about overeaten to the point of overcapacity. 

I worry about it because I know that my metabolism isn't always going to keep up with me. I've managed to stay trim because I eat well or engage in fasting for days punctuated by huge meals. I've worked at decreasing my food intake, and controlling my appetite, but it's so difficult because I have sort of an inlaid idea about how much food to eat that isn't healthy. 

It's just disturbing to me when I've just eaten, and the skin on my stomach is almost painfully swollen and tight and hangs off of me like a pregnant belly or gut. 

I know it isn't sustainable but I'm not sure what to do about it. Especially in the winter when I get depression and eat for comfort. 
",20Feb2019,3
102,"Hi, I'm a 17 years old boy and I hope today I'll successfully make a bad impression of myself here by creeping you out.

I've recently seen some changes (bad changes) in me and it is making me go crazy. I'm very shy. I've been suffering from depression since I was 13. I don't go outside if I don't need to and stay inside most of the time and read books, play games, do graphic design etc. People think I'm a nice guy (in real meaning, not r/niceguy) because I don't treat anyone bad (I mean you can't treat anyone bad if you don't interact right?). I don't have any real life friend (have some on social media but they live overseas).

I was somewhat satisfied with my boring life until I started to see some bad things in me. I'm getting too jealous these days. It's infuriating! And it's also very embarrassing to think or talk about.

If I see a man (any age I don't care) with a woman (they maybe friends or couple, attractive or unattractive I don't care) I feel my blood is boiling in jealousy! Even if a girl just talks to someone, it triggers my bone! Now you can definitely imagine by now that I've never had a girl friend or any kind of proper female interaction in my life. It's not even like I'm desperate for girl friend (to be honest I don't even want any. I'm happy being lonely), but still it makes me so jealous to see any man with a woman.

I feel like that man is lucky and he doesn't deserve what he has and I'm better than him. Even though every cell of my body knows how false that statement is. I'm not handsome, neither I have any good hobbies nor am I rich and just forget about the personality! So there are no valid reason for me to get a girl friend.

How do I act after that? I feel an intense urge to scream! Scream as loud as I can. I also start ignoring them (once I didn't help a guy in my class in his project just because he had a girl friend). Then I realize how terrible of a person I'm becoming and I fall into depression. It has gone to a point where I get jealous of celebrities/athletes about having a girl friend.

My brain understands everything but it always fails to explain my heart about this. I can't even talk about it with my therapist because she is a married woman and it might creep her out.

I feel like I'm slowly becoming another person. I'm more angry than I've ever been in my life. I've blocked all the guys in my school on social medias just to avoid their pics with their female friends.

Is there any solution to this?

Edit: Sorry for bad/wrong English I'm an Indian and English is my 3rd language.

Edit 2: In case if you were wondering, yes I'm subscribes to Pewdiepie.",20Feb2019,0
103,"My mom just got a call from a relative saying that my little cousin tried to kill herself by ingesting a bunch of pills. Apparently, she’s been suffering from depression and had also been cutting herself recently. This was likely the result of a divorce. What threw her over the edge was that her boyfriend of late broke it off with her. I just don’t know what to do with this and if there’s anything I should do. 

I’m 22 and I’ve known her since she was born, we were always very close and still keep in contact regularly. Sometimes, I’d take her and her younger brothers to McDonald’s and see how they are doing in school and staying out of trouble. I especially like to know how they are doing because we live in a small town where people generally obsess over alcohol, drugs and vandalism. I left the town behind for college and want to help them do the same one day, as most people in the town don’t graduate high school. It’s surprising how ambitious these kids are as they are already talking about what they want to be when they grow up and what university they want to attend (the same one I’m going to). 

Anyways, I just don’t know what to do because to me she’s still my innocent little cousin and thinking about her attempting suicide just kills me. Is there any way I can support her through this depression? Or should I stay out of it? I don’t want to be nosy or pushy to her but at the same rate I’d like her to know that I’m always there for her and her brothers. Especially because their parents are not always able to give them this attention. 

Thanks for reading, I hope you have a nice day. 

",20Feb2019,2
104,"It happened again, I forgot everything. All the facts and lines are there, but the feeling is gone. I have been thinking of leaving my girl for a while because of this. I know it hurts her when I look at her look a stranger. I can’t be a father if I could forget my child at any time. I’m just gonna be alone, hopefully find some decent job and pass the money on to some cause. There’s just no one to talk to about this, so thanks for the read. Sorry it’s a downer ",20Feb2019,1
105,"I'm a soon-to-be twenty year old gay girl going on my first Tinder date in just about... an hour. 

Any words of encouragement, or advice, are soooo fucking welcome!! 

I'm really trying very hard not to die from the stress. ",20Feb2019,1
107,"I popped into the local grocery shop today before work to buy a energy drink. There was a small queue and by mistake without realising I pushed into the middle &amp; when I realised I had pushed in, I kindly told the young lady(mid or early 20’s)at the back of the queue to let me behind her and wait. 

Whilst squeezing behind her by mistake our hands touched and she replied “ Oh sorry I didn’t mean too”, she seemed shy I would say or maybe embarrassed. I quickly replied “ oh don’t worry”, and she said “ I don’t make friends in real life”, she said this whilst smiling I would say, me being a joker I said “I can be your first friend. She smiled and laughed so did i. That’s it boys. 

Small talk is cool. Live &amp; learn. ",20Feb2019,1
108," I really need help on this one people. Backstory: 35yo in a rocky relationship for 5+ years, have 2 toddlers. I'm an easy-going person, friendly, thankful, and driven by a desire for harmony. A modern hippie, all about universal love and peace and acceptance. I still tend to argue if I don't understand or feel misunderstood, but what I want in the end is truth and understanding, even if it means I was wrong. My spouse has declared us incompatible though, and I'm inclined to agree.

TL/DR: I'm in a toxic relationship, and I need to escape before a mysterious death finds me. I have no solid evidence against my spouse, but I am convinced they will have me hunted down and killed if I just take the kids and run. They have the means.

I'll let you in on the secret relationship between my spouse and I. Secret. Yes, because my spouse would never show this side of their personality to anyone outside the immediate family. They slip up on rare occasions, like by demeaning me in front of my friends, but it's so rare I even get to see my friends ever since we got together. There doesn't even seem to be much time or care for our extended families either. Came to realize yesterday that I haven't really met or heard from any of their friends, and I'm starting to understand why. I feel isolated from friends and family, and feel I have no one to turn to. There's too much to explain in conversation, but I need to vent before it kills me, so I'll pour it out here.

Most notably, they frequently put me down as not being good enough. They mock my personality (""playfully"" in their eyes), beyond the point that it causes me to feel ashamed and worthless when I'm around them. Even when I have reason to be proud of my work, it is often dismissed or belittled by my spouse. It's as though I can't do anything right.

They often have a mean or offensively sarcastic sense of humor, and they get angry with me for not finding it funny. The problem is, they are so very often serious when they insult me just as frequently, so I can't tell when they are ""joking"" or not. They regularly threaten physical violence ""jokingly"", less jokingly when they are stressed, and at one time of extreme stress, though I was very calm and taking care of the baby, they did hit me several times in quick succession until I snapped and hit back once. Nobody was bruised, but they very quickly and conveniently forgot they hit me at all. Just like another time when they forgot how they bellowed so loud that they were going to beat the crap out of me, loud enough that all the neighbors in the building and anybody outside could have heard it. Why? Because I gave our son a single firm spank on his bottom per my spouse's instruction. I didn't even want to do it, but I've learned that my wants have little sway in this relationship.

I have catered to the wants and needs of my partner as best I can. However, the more I try to work to their benefit then the more I err, it seems, until somehow everything that goes wrong must be my fault, even if there is no perceivable correlation, even if the circumstances of failure were arranged by my spouse alone, only I am to blame. Actually, my partner blames and insults the kids, too, but I have been elected the scapegoat of the house.

I thought it cute at first, the frequent monitoring of my location and web activity, it means they care about my well-being right? Knowing where I am just in case we can meet up and hang out, or seeing what mutual interests I've been reading up on to enrich conversation, or checking in with me asking what I'm doing...it's all because they really care about my well-being, I genuinely thought this at first. That's how naive I am; this is how I justify the actions of others, by asking myself why would I do it? And that is what I came up with.

It gets disconcerting though, as the snooping intensifies when they are upset with me. Then every call log is reviewed, every movement becomes monitored, and a sour, uncouth, or offensive dialogue awaits me if I do not immediately respond to my spouse's messages. I get fiercely interrogated if even one of the several tracking systems on me shows me being anywhere other than work or home, which only occurs due to a legitimate gps or cellular glitch, mind you. I haven't cheated on anyone before, and haven't had the inclination to despite ample opportunities over the years. But my spouse has cheated on others and admittedly enjoyed it, and they have been cheated on as well (I think we all have), so perhaps they are responding to a fear of their own past as it is projected against me.

When I open up to share my feelings or concerns, civilly and with respect, it's 50/50 chance of neutral vs mad response. If my words aren't directly congruous with their own thoughts or opinions on a subject of conversation, then it feels like what I have to say isn't heard, considered, and especially not respected. Instead of acknowledging my feelings and sharing their own in kind, it often becomes a battle against me until they get the last word, or in rare cases until I actually succeed in clarifying my point in a way they can understand.

When I make a mistake, they don't care to know why it happened. They just want me to feel like crap, and will spin elaborate insults to secure this as though it were their favorite activity. It may actually be so. From my perspective, I make mistakes all the time, and it isn't a bad thing to do as long as a lesson is learned from them. My spouse only appreciates this perspective when they make mistakes, that is, on the rare occasion they own up to one.

*There are very few good moments with this person* – Every day brings another challenge. It seems as though they are always complaining about something, especially me and my family. My spouse attempts to control my behavior and happiness, as though the rule were if they were not happy then I should not be either, and they are rarely ever even content, let alone happy. I don't know if they have ever been happy in their whole life, actually, and if you knew their story, maybe you wouldn't blame them for this being so. I certainly don't, having heard it myself. Doesn't mean I should conform to the same bogus groove, though. A meaningful life is not found in the pursuit of happiness, rather in the appreciation for what we have. This concept seems out of reach for my spouse most of the time, though, and I just don't have what it takes to appreciate being treated like garbage.

My partner tells me I am a burden to them, financially, emotionally, and physically. They resent me for not giving them my whole paycheck and put me down for making less than them, even while I actually earned more. Doesn't matter to me who makes more, they're more than welcome to; it all goes toward our family, but my spouse sees it differently. The amount that I don't put into their checking account, about 10%, goes strictly toward medical and credit card bills, 80% of which are mutually accumulated between us both, yet the debt is in my name. Honestly, though, I would take all our debts combined under my name if it meant I could stay safely away from my partner. Emotionally, we're not on the same page: different social priorities, incompatible core beliefs and values, different means of coping, different triggers for stress, etc., we just can't relate. Physically, I don't clean up as much due to being away for work or present for children most of the time. My spouse brags about how they clean and cook and play with the kids every day while working from home to boot, and I am told that I should be equally capable. They complain about having to do everything themselves, and I won't deny their efforts. But what can I do around the house when I'm away? And what is more worthy of attention in a house than children, especially when I'm already away most of their waking hours? I help where I can, but my priorities aren't the same as my partners. Besides, most of what I do to help is only found to make things worse according to them. I like to think the kids would disagree.

I also have a daughter from a prior relationship who lives with her other parent, now far away, and any reference to her in a conversation has been a vector of discord in the past. I abandoned my spouse because of this before but became convinced they had changed within a matter of days, by the sound of their silver tongue. These days it's a little safer to talk about my daughter unless it's regarding providing additional support. Why should any letter I write to my daughter require prior approval by my spouse? Why shouldn't I send gifts or care packages to her? Why should I be required to involve my spouse in a parent-child relationship when they said they never want to see the child again and that my daughter has no place in their life? I don't want to be an estranged parent, I love my daughter and miss her so much. They demand consistency from me but provide none themselves. Communication is the breath of every relationship, but I feel continuously strangled by my SO.

I don’t feel free, welcomed, or even safe to speak my mind. I'm near to mastering the art of walking on eggshells at home. I have to act a certain way just to be accepted by my spouse. I'm not myself when I am with them, and I don't like who I've become since we got together. I have since adopted the same rude and cruel mannerisms blasted against me, and have since used them against others. Genuine friends of mine who witnessed it respectfully pointed out my uncharacteristic behavior. Because of their controlling behavior and, granted, near constant presence, our toddlers recognize that my spouse is the boss, and I am the punching bag. And my spouse either doesn't realize or doesn't care to remember that how we treat each other is the lesson we teach our kids to treat us and others and even their own selves. So the lesson these kids see every day is that it's okay to treat people like crap, you don't have to listen to anybody except the boss, and whoever can scream louder always wins.

Whenever I share my desire to grow and improve, the other person responds with mockery, disbelief, or outright forbidding of any action that might interfere with their personal preference for schedule or worldview. There is almost no encouragement or support for my efforts. Instead, they're stuck in old judgments insisting that I will never be any different than I was or am now, never good enough. I am told both that I need to change and that I can't. Regardless of my education and accomplishments, I am perceived to be an idiot with only the most foolish ideas. It seems that any subject which I ask their input on is one they didn't already think up, so they must disapprove. But asking for input in my book means sharing thoughts and ideas, and is completely different from asking permission; it isn't even phrased as a yes or no question.

My partner is continually frustrated by the fact that I am easily distracted and very forgetful, and they have convinced themselves that they must have a near perfect memory, attention, and intelligence. I hope that dream comes true for them. Were it not for my ease of forgetting, we would not have been together this long. Instead, anytime we have a good day together, I throw the past offenses out of mind entirely, it just happens. I convince myself that things aren't so bad, my partner doesn't mean to hurt me, they're just under a lot of stress, and everybody snaps at some point. For example, yesterday my partner decided that they would rather literally bang their head against the wall while shouting at themselves in front of our kids, instead of answer a question I designed to confirm our mutual plan for the evening. Unsurprisingly, there ended up being a lot of confusion about that plan in the end.

And that's when I unplugged instead of snapped. I decided if my attempts at maintaining a relationship are bringing someone to inflict self-harm, in front of ever-attentive children no less, then I need to stop. I finally accepted the possibility that I may forever lack the level of skill and understanding necessary to communicate with this particular individual as though I were their equal counterpart. And so, given the toxic nature of the relationship, I figure it'll eventually kill me to stay so I'd rather leave or die trying. I won't abandon my kids though, they are already targets of verbal abuse, and I fear their situation will only worsen if I'm not there for them.

Why did I stay with this person for so long? Because I love them, deeply, I feel sympathy for their troubles, and I have repeatedly invested so much hope and faith into their psychological growth and return to a loving manner. Such wishful thinking is easy because they are drop dead gorgeous to me and absolutely incredible in bed, albeit a rare experience now since we have kids, two jobs, and no support circle. Mostly, though, because we have the two kids that I can't raise on my own and they shouldn't be left in the maligned care of my spouse's antics either. I truly will not survive if I stay in this relationship, though. Either I'll learn to feel so bad about myself that I lose all personality and get ditched anyway, or my spouse may actually kill me with a knife in a moment of blind rage, like if they ever found this article. I feel like there have been some close calls on both these accounts already. After 5 years together, I am convinced those are the only two outcomes unless the relationship is pre-emptively ended.

So I need some input to brainstorm some options here. Your turn.

TL/DR: I'm in a toxic relationship, and I need to escape before a mysterious death finds me. I have no solid evidence against my spouse, but I am convinced they will have me hunted down and killed if I just take the kids and run. They have the means.",20Feb2019,4
110,Sometimes I really wonder if I’ll get a job that I actually want to work in that pays somewhat decently ,20Feb2019,1
