,text,time,score
66,Even the thought of my teeth touching wooly fabric makes me shudder. I love sweathers and don’t really know what to do. Anytime I realise I’m actually wearing a ‘scary wooly sweather’ during the day I drool for minutes afterwards and my teeth feel weird. Does anybody have anything like that? Any ideas how to deal with this?,20Feb2019,1
67,"I’ve recently come to terms with the fact that I am highly sensitive. Little (but not trivial) things have a big impact on my emotional state. This is fine until it starts affecting my work. When something is upsetting me, or I feel hurt, it becomes almost impossible for me to sit and focus. Instead, I keep dwelling and overthinking. I cannot postpone my work until I am in a better state because I have continuous deadlines to meet and also I go through these emotional waves quite often. I’d like to hear about other people’s experiences with this. How can I deal with/overcome this?",20Feb2019,1
68,:D WOOOOO,20Feb2019,3
70,"i just wanna go out and hang out with my friends and chill but im forced to stay inside and watch fucking netflix for days because going outside hurts my body

god damn it",20Feb2019,1
71,"Just wanted to share something that I discovered when I clicked on the ""other discussions"" tab at the top of my post.",20Feb2019,2
72,"The day she was born was the day I had  a second heart living outside of my body. My second heart is 27 today and beating ever so beautifully 🧡
Happy birthday monkey",20Feb2019,1
73,"** How we got here : **

Before getting into how I believe TES:L can be saved, I'd like to suggest a hypothetical way of how TES:L arrived at its current state. Imagine the most boring strategy card game possible. There are only creatures and each creature has power and health equal to its magicka. So a 1 magicka creature is 1/1, a 2 magicka creature is 2/2, etc...

The game itself is kind of boring. You hope to draw creatures on curve, attack other creatures when you can trade beneficially, and generally play optimally. However, you never really feel cheated when you lose because, well, how could you? There's perfect symmetry.

But in order to keep players interested, new cards need to be released. *By* *definition* these new cards must be more powerful than previous cards. Otherwise they would never be played. So now there's a 4/4 creature that costs 3. Maybe a 3/7 that costs 4. 

But eventually the players grow tired of those and we have to add *effects* and *powers*. This is where the opportunity (but necessity) for a major problem begins, because of *synergy*. Because as more new effects are introduced, the possibility for synergy grows exponentially with the number of cards in the system. Similar to a [network effect](https://en.wikipedia.org/wiki/Metcalfe%27s_law).

Soon, the system begins to change in ways the creators never intended. The possibility for synergies spiral out of control, similar to the way [Alchemy](https://en.uesp.net/wiki/Skyrim:Alchemy) functioned in Skyrim. All systems move towards [entropy](https://www.realclearscience.com/lists/10_greatest_ideas_in_the_history_of_science/entropy_universe_tends_toward_disorder.html).

All of a sudden, the player base senses something is off. The game is still *challenging*, because you're playing against other human decision makers. But, it's somehow less *fun*. Certain card interactions feel fair while others feel exploitative. Often players are unaware of why they feel this way, but they get the sense that something just isn't right.

**Where we are now :**

For a longer version, see the post by u/DukeMo [here](https://www.reddit.com/r/elderscrollslegends/comments/asejvz/i_love_tesl_heres_why_im_leaving/), but the key points that relate to this post are:

* Too many possible synergies and good cards make tricolor decks the only viable option, along with one dual color (warrior). Spellsword, Monk, Archer, Scout, and Mage are all dead classes.

* Too many cards exist that aren't fun to play against. Synergies have grown out of control, Ramp Warrior being a good example.

* Creature trading, control of board, midrange decks are no longer relevant.

We've seen the results of these in the game. Players are less engaged. Wait times for games are longer. Within the top posts on reddit, not one is within the last three months. And I don't have real data on the subject, but I feel as though more players quit games sooner, rather than play them out.

To be fair, I thought the Isle of Madness story mode was outstanding. It had about as much emotion and great storytelling as could possibly be done in a card game. It was fantastic! But the cards released and new mechanics did not help the PvP scene. 

Fortunately, I think it is possible to simultaneously salvage the competitive, expanded PvP scene as well as encourage veteran players to stay engaged.

** The path forward :**

I suggest the following three changes to The Elder Scrolls: Legends going forward.

* **Replace 'Casual' with 'Classic' as a game mode:**

Classic mode would include only the expansions, stories, and promotional sets up to and including Clockwork City. Specifically: Madhouse, Heroes of Skyrim, Dark Brotherhood, and Clockwork City, along with Monthly cards up to that point.

It would provide a fun environment for veteran players that preferred the older style of play, as well as a simpler version of the game for newer players. There would less effects (no rally, exalt, betray, or plot), and no double cards. 

There would be substantially less synergy as well. This would provide a more welcoming environment for new players and they would not be overwhelmed with the abundance of cards to choose from in deck building.

**Expand character leveling and racial bonuses:**

I'm honestly very surprised this hasn't been done so far, because I think every player remembers how exciting the early days of leveling up were. With each expansion to The Elder Scrolls Online, the max level cap for Champion Points has been increased. It now stands at 810 (I believe it was originally 270). 

To start, I would suggest a new cap of level 250, with appropriate rewards spacing such as an epic card every 10 levels, a legendary card every 25, and an alternate art legendary every 50. These could be race specific to your avatar. Small amounts of soul gems and gold would fill the remaining levels.  

In addition, I would suggest a small number of new avatar portraits for attaining level 250. There would be no need to record new voice lines or dialogue. 

**Inclusions for next expansion:**

Lastly, I would suggest two inclusions for the next expansion or story. A new keyword: *Stoneskin* and a new card restriction *Noble*.

*Stoneskin* would be a simple keyword for a few creatures. They would be immune to lethal. I think most of you have seen this effect in The Black Dragon. I think it provides an important counter to Telvanni and Ramp Warrior decks as well as strengthening mid-range. It could be limited to a handful of Yellow, and Purple or Blue cards initially to strengthen Mage and Spellsword decks.

Secondly, *Noble* would be a card keyword that essentially means: ""Can only be played in dual color decks."" I think a good, simple start would be to introduce 10 dual-color cards in the next expansion. One for each of the ten dual classes. These would be lore based and vary in strength related to the current meta. Crusader and Warrior would not need a significantly strong card, but Mage and Spellsword would. 

-

With the transition to a Classic mode, an addition of more leveling, and *possibly* a change in the next expansion, I believe we would see both a substantial reinvestment from the current player base and the opportunity to attract newer players as well in a simpler environment. ",20Feb2019,1
74,"The first time I realised I was unattractive was when I was around 12 years old. Our school was throwing a dance party and when it came to choosing a girl to dance with, every single one of them rejected me saying ""Eww"" or ""I don't want to dance with someone like you"". I still remember how crushed I was. My parents told me that I was a cheerful kid, following his passion from a very young age. I was attending drawing classes and wanted to grow up making 3D animations. But when the dance party night happened, I became sad and introverted and didnt do much asides from playing video games. I thought things would get better, but they didn't. All the way up to college, my life sucked... It wasn't terrible, it was just lonely and sad. I never had a girlfriend, so I missed out on having an intimate relationship with someone. I don't want to brag, but I was smart enough to get a job that was payed nicely, despite having no passion or hobbies whatsoever. When I saved enough money, I decided to undergo plastic surgery, specially nose job and chin implants and dark circle eye removal. Plus I hired a personal trainer and got into shape. So in a span of a year, i went from being an 4/10 to a solid 8/10 (i think).  Up until now, I didnt know how shallow people and society are. I mean, everyone started treating me better, i made friends way more easier and women... Everyone tells you that its all about confidence but I think its complete bull\*\*\*. I am the same person I was before, only better looking and dating women was never as easy. This change made me realise how important looks are for being happy and confident. I think its the key for happines. There is a lot of talk about white privilige these days. The only true privillige that exists is good looking people privillige.

&amp;#x200B;

So to my fellow ugly friends I say this. Dont try to get people to like you, they probably won´t. People are sh\*tty and shallow. Work on yourself and if you are willing to undergo the change of plastic surgery, go for it.  


 ",20Feb2019,1
75,"So I had to post this here since r/rihanna r/music and r/art are pretty restrictive in what they allow. 

I found something I like on Society 6 but I can't tell the quality and visual difference between a poster and an art print, stretched, canvassed, or metal prints. I do not want to but one of those and get what looks like a poster. I am also not sure if that is a trustworthy site. Amazon and ebay turned up nothing. 

Fotpforums.com does not let me post without mod approval and no mod has approved my post yet for whatever reason. 

Currently I am browsing etsy but they have a lot of stuff and their search engine either sucks or people label their merchandise wrong. Not sure if they are safe to buy from either. 

Its actually been pretty frustrating just trying to ask questions and learn.  So here I am.",20Feb2019,1
76,"I've never been so unstimulated in my life. I accepted the first job offer that came along after getting fired last month and it's just so fucking slow all the time. I'm pretty sure I'm becoming a worse bartender with every shift I work here. God knows I'm not going to make any money here. This is the worst mistake in the lpmg string of mistakes that have been my life in the last year.

So, I'm sitting here, allegedly tending bar in the banquet hall, but it's for some dry corporate sales meeting. I make a fresh pot of coffee every hour or so and put out a few extra cans of soda, and that's it. ",20Feb2019,1
77,"I'm a new chemistry lab TA and I held my 5th lab today. So I'm supposed to have all my students be done/out the lab room and I'm also supposed to be out the room by 11 AM, but that did not happen. I was explaining concepts to my students to make sure they understood what happened in lab today and it took longer than expected. When I told my head TA I wasn't finished cleaning up (it was 5 min past 11 AM), she said to me ""wow I am not happy."" Ouch that just ruined my day... Now I feel like she hates me and will prevent me from becoming a TA next semester :') Anyone see the light in this situation? Because I can't help to think that my head TA will forever be biased against me.",20Feb2019,1
78,I just got back from the hospital and just been staring at the wall. Dont know what to do,20Feb2019,2
79,"I really just need to vent. I was laid off last May from a company I didn’t love but I had a lot of friends there. I took a job in June as an office manager almost out of desperation because I felt I couldn’t be unemployed, though I was receiving severance, and I was too depressed to motivate myself to apply for something I was more qualified for. 
In my current position, I am alone in the office a majority of the time because my boss is a sales rep. He made it seem like he would mold me into being a sales rep too but this job has become much more of an administrative position than I originally thought. At this point, I’m actively applying to new jobs and even have an interview Friday (yay!) so I’m not looking to tell my boss how my happiness can be improved in the current position. 
I just feel so incredibly lonely. I hated my job that I was laid off from but didn’t realize how important it was for me to be surrounded by a community. Even if many of those coworkers annoyed me. When my boss is in the office, I hate it because he is such a distraction. He tries to be my buddy and tells me the MOST personal stories about his life. He asks me questions about processes that he should definitely already know and acts like he knows everything yet can’t do a basic function in excel. When he’s out of the office, the most socializing I have is giving the ups man a signature or chatting with the janitor. I have no peers and it is making me so depressed. 
I live with my boyfriend but when he gets home from work, he is wiped out from his day as he owns a landscaping company. He’ll listen to me but it’s so unfair that I completely rely on him when it comes to advice/venting/etc. I have some friends but not the type I talk to on a daily basis. I miss just having a work community around me. 
This post will probably get overlooked and that’s fine, this is all just weighing on me really hard lately and I needed somewhere to get some of it out. 

Tl;dr: I mainly work in an office alone. It is super depressing and I’m really having trouble lately. ",20Feb2019,2
80,"Luckily I don't have any sick needs I fulfill with doing so except my curiosity, which is more than enough. I've seen a lot of people die in different ways. The act of beheading people, or shooting them dead...Fatal accidents suddenly ruining the life of dozens of people...The death of FUCKING TODDLERS! I just don't feel well after these experiences. They were kinda traumatising and I really shouldn't have watched so many videos. I want to talk to someone",20Feb2019,3
81,"You’re not. 
You’re looking to someone else to validate you and guess what... they won’t. Even if they do, they can take it away just as quick. 

Learn to love yourself a little everyday. Like you when no one else will. 


Forgive yourself often. 


You deserve it :) no matter how much you think you may not. 


Love and Light always, 


-Viz",20Feb2019,7
82,"Some days I just want to give up on school, on studying, I'll just fail my test anyways. But no. I choose to keep pushing. College isn't supposed to be easy. Don't give up. What you put in is what you get out. Take a breather, and then get out there and get it done. ",20Feb2019,2
83,"Me and my boyfriend got into a fight and almost broke up. After a few days, he reached out and things were fine again. Yesterday we got into the same fight. We almost broke up again, but I decided to go on a break for 2 weeks.

I feel like when we meet again, there isn’t much hope for our relationship. After everything that happened it would be hard to go back to normal.

I lost my best and only close friend. I’m laying in bed and I don’t want to get up and study. I don’t want to get food I just want to sit here and feel miserable.

I know this isn’t the end of my life but I just feel like I wish I didn’t exist right now so I didn’t have to feel the pain and loneliness.

What hurts the most is that we both want to stay together, but he told me he is willing to still date me until the end of college since we make each other happy. I don’t understand why he would want that. So now I have to decide whether to continue dating him in what is probably an unhealthy relationship at this point, or deal with the heart break and loneliness of not being in his life anymore. I miss him more than anything and I truly do love him but I don’t know if I’m strong enough for all this.",20Feb2019,3
84,No people around me no one to disturb me not chatting to anyone just me and myself in my room with my thoughts. That's when I truly enjoy life. Why is that? Is that normal?,20Feb2019,1
85,"It took 1 hour to memorize the combinations of short and long beeps that represent the letters of the alphabet in Morse code. Why? Because now I can read Morse code! Why the hell not.

I only used a single picture too. Google ""Latin alphabet in international Morse code vector image""  in Google images if you're interested.

",20Feb2019,2
86,"Looking at my old pictures makes me cringe, oh God fuck my face ",20Feb2019,1
87,Hey so my dad died of a brain tumor on Valentine’s Day and I got broken up with day of bc I didn’t tell my girl about my dads cancer. My phone lines were Down for the first 3 hours so I couldn’t talk to anybody and I have given up on pretty much everything bc I just don’t have any fucking motivation.,20Feb2019,2
88,Colds are wimpy. The flu would keep me down for about a week. I like flus because they allow me to relax and reflect on my life. A cold is just an annoyance. ,20Feb2019,1
89,I can't wear wrist watch because of my thin wrist and it will just looks like a necklace. What to do?  I want to waer it with my formal dresses ,20Feb2019,1
90,"Long story short, I just got out of a relationship with someone who treated me poorly. We had an instant attraction to one another, that quickly blossomed into being more than just friends. She had a lot of bad habits and, I felt like she was showing signs of emotional manipulation. Everything that happened between us can be found here (I don't feel like having to type it all out again) [https://www.reddit.com/r/datingoverthirty/comments/ap7vml/im\_at\_a\_personal\_crossroad\_with\_a\_woman\_25\_that\_i/](https://www.reddit.com/r/datingoverthirty/comments/ap7vml/im_at_a_personal_crossroad_with_a_woman_25_that_i/)

&amp;#x200B;

It's been a little over a week now since we've stopped talking. I miss her so much, and I can't for the life of me figure out why. I know she wasn't respectful of my feelings, pretty much played victim the entire time we were together; made me feel bad for feeling uncomfortable with the way she chooses to handle her emotional problems. All of my friends have said I am better off without her (they all saw her for who she was the minute they met her). Despite all of the bad she did, I still miss her. I can't figure out whether it's a sign that what I felt for her was genuine, or that I'm able to give myself fully to someone. Maybe it's just being around someone who made me feel like I was wanted (despite it being an illusion). I'm having a hard time trying to forget about her; when my mind is idle, it goes to the memories of our time together, and then I end up missing her.

&amp;#x200B;

I wish I didn't feel this way considering what kind of person she is but, it's how I've been feeling since I broke off contact with her.",20Feb2019,1
91,"I can't handle this anymore. My career can't get started. I don't get any calls back. I'm making $200 a week max. I did have a second job. That ended. My Dad can't work anymore since his stroke.  Not right now at least. His bills are piled high. We need $500 in two weeks to keep the house we are living in. We need $800 for the power bill that's behind to keep power on. We need $300 for the internet and cable bill which is behind. 

He can't get disability, he doesn't have Medicaid so he can't go to any doctor's to get check ups, therapy or figure out anything else that was discovered when he had his stroke.

I want to just give up. Lay down and die. Despite all I'm doing to get him back on top, I can't. I don't mind working. I have asked for help and no one came to the call. I've never wanted a handout in my life. I just don't know what else I can do. It's a losing battle and I don't see any way out. 

To all the people he helped in his life, the people that he paid for your bills, he paid for your insurance, he made sure you had food, I hope someday you have a better life. I just don't understand how everyone can just turn their backs on people that have been there always. Now we are down and I can't get us out. I'm trying. I put everything I make  into the bills. 

I barely have gas, we barely have food, yet there's no help to be found.  If I somehow pull out of this, I can assure you when I'm doing well enough, I'll remember those who left us behind and I will make sure that I do everything I can to help someone who is in need. Not everyone is in a bad situation because they want to be or they made choices to get there. Some inherit the storm other's were going through. 

I feel myself slipping into a dark place and I never thought I would feel these feelings again. 

I just wanted to get all of that out. Hopefully I'll have a positive update in a while. If not, it'll just be silence from this account. I don't think I'll be here to type it up. ",20Feb2019,5
94,"I try to be likeable by others i try very hard to be ""funny"" so others will like me...
I want others to give me attention and be my friend but i fail...
I think my self as a dumb, pathetic beta male and a loser nice guy...

I have a low self esteem, and i dont know what using my brain means, i dont know what being a man means, i dont know my self and i dont know others. I hate my self and i get jealous of others who are cool.

I also dont have a personality, thats why its hard for me to make friends and no one values me or cares about me..

But i want to have a cool personality and be a person that others value but i think no one values me.

I dont know why i dont get RTs and likes online..i base my self on Rts and likes i get..  do i have have to be funny to get friends ?


I want to be smart and intelligent and a successful guy and dont think myself as a loser all the time.

I dont want to be a nice guy but im the mean guy now for the sake of being mean, i dont want to be a loser or a beta male or a guy with no back bone or a pussy or a dumb or foolish or moronic guy.

How do i avoid those???
How do i do self improvement?
I dont know whats my purpose in life..
I dont know what to do.
Is self improvement the most importannt thing in life? Is that where i should start?",20Feb2019,2
96,"I was assaulted and robbed approximately 2 months ago, and since then my life has taken a sharp turn for the worse. I had to go through a very rough couple of weeks with the police interrogating me as if I was a suspect in a conspiracy, and it really messed up my ability to function and be productive. They eventually caught the assailant and realized I had nothing to do with it, he is now in prison awaiting trial. Even so, I've suffered from intrusive thoughts and anxiety throughout my entire life, and now they're worse than ever. I can't fall asleep and can't get out of bed. I was sick for about a month after what happened, and I fear my mental state was a factor in that simple cold developing despite medication. Can't function in my studies and can't stop worrying for my family, since the assault took place in my driveway and the assailant knows where I live. A neighbor with whom I don't speak (and never have spoken to) approached me out of the blue and asked if some people came by a couple weeks ago to beat me up, which only triggered my thoughts and induced anxiety more. I had to identify the suspect via photo, and seeing his face wasn't easy for me. I was scared of everyone being in on it. His lawyer, the police, that neighbor. Everyone. I can't stop looking over my shoulder, and can't go more than a few hours without making sure my family is ok. I hate it when another family member leaves the house on their own to walk the dog or go anywhere by foot. Therapy isn't working either. No improvement. I've been feeling very lonely, as no one in my environment knows about what happened and my mental state. I've nearly taken my own life once recently, only stopping because of that small light of hope in me that things will get better. Today I walked in my driveway and saw 2 full unfamiliar cars parked outside. The people in there looked suspicious, but at this point I can make a killer out of a bunny rabbit. I'm going insane, feeling so alone, especially without a partner for the past 4 years. I don't know what to do anymore. Just need to get this off my chest. I'm completely lost. Thanks if you took the time to read this.",20Feb2019,1
