,text,time,score
30,"Neckbeardiness is just being relatively deprived of social contact (intentionally or by circumstance) consistently and from a young age, and then getting the [Dunning-Kruger effect](https://thedecisionlab.com/bias/dunning-kruger-effect/) on social savviness, and becoming stuck on the peak. Social savviness is a broad subject - appropriate language and timing, body language, empathy, humour, reading a room, the tasteful breaking of these rules for comedic or communicative effect, etc. And he believes, perhaps by virtue of his upbringing or natural talent or intellect or some other semi-credible source that he's a master of all those things. This is the Dunning-Kruger in full swing, and this particular application a doozy.

&amp;#x200B;

From that elevated position of confidence - baseless confidence but effective confidence nonetheless - he believes that everyone else, the poor normies who get all wound up over 'nothing', are all socially inept compared to him. Somehow, despite them spending more time around people than him, they haven't got the natural talent with social behaviour and language that he has. Those who find him grating or irritating, he believes, simply do not understand him, for his natural ability has catapulted him beyond their comprehension. He might even feel sorry for them.

&amp;#x200B;

But it's lonely at the top.

&amp;#x200B;

He knows something is wrong, he's not stupid. (all that time not socialising went into other interests and studies, they're not morons) True masters of conversation and social situations have friends, are fun and parties and generally liked, but somehow that doesn't happen to him. He sees the awkward reactions to his statements, notices the barely-concealed cringes at his jokes, hears the hushed chatter when he leaves the room. He's in constant arguments both online and in real life. He wears eccentric clothing and develops his vocabulary because, for some baffling reason, nobody seems to recognise his social brilliance on its own merit.

&amp;#x200B;

But he sees the flaws in everyone else too. Sees how they anguish in fear at what people will say to them and about how what they say will be interpreted, in addition to all their other flaws that humans have. It looks like hell. No thanks. At the very least, he says, he's not like them.

&amp;#x200B;

The lack of empathy may be the worst part of the whole situation. How could he make sense of the feminist movement? The black lives matter movement? Anything whatsoever that requires putting himself in the shoes of someone who has a life completely different to him? 

&amp;#x200B;

How could he understand the concept of creepiness when he has never felt (and is unable to empathise with people who have felt) unwanted sexual attention? Creepiness, he surmises, must not actually exist, and therefore when called a creep, further surmises that it must be just another thing to add to his mounting pile of ""weird things women do for no reason"".

&amp;#x200B;

He believes he has empathy, he has empathised with his friends who are mostly similarly gendered, coloured, and sexually preferenced. He has empathised with the fictional characters from film, TV and games who are specifically designed to appeal to people like him. But he does not. He is self-contained. He is resistant to change. He is an intelligent, confident force immune to social pressure, but he is lonely, bitter and arrogant. And he is afraid, because if somehow he is changed, he will lose his confident force, he will become susceptible to social pressure, and he may discover that he is not intelligent as he thinks. All that defines him will be gone. What will be left? It's not worth finding out.

&amp;#x200B;

\--

  
This is a message to anyone who read that and felt it in their soul. If what I said hit you like a tonne of bricks or, more likely, you just read that and said to yourself something along the lines of ""yeah that's me, except that I DO have empathy and creepiness IS just some weird thing women do for some reason"", or if you use a word like normie or NPC or chad or ""your opinion is invalid"" anything along those lines unironically in your speech, this is for you:

&amp;#x200B;

The first step to recovery is admitting you have a problem. Intelligence often exists alongside ignorance, and changing your ignorance will not make you stupid or weak. Your neckbeardiness is not your personality, your neckbeardiness is an a virus inside your personality, and curing it will not damage you, it will heal you.   


Have a chat with someone, but don't offer any opinions or help. Just listen, imagine what it feels like to be in the situation they describe, and describe to them how you imagine that feels. Make sure you don't invalidate their opinions or steamroll them with your own, just add your thoughts alongside. From this day forward, you must keep in mind that your belief that your opinions and tastes are superior is a reflex which is tied to your self-esteem. When you notice it happening, when you feel yourself about to get self-righteous and tell these empty-headed normies how it is, stop yourself. You don't have to agree, but you don't get to edit them or change them. It won't work anyway.

At your next few parties or gatherings that include women, have a conversation with a woman but speak to her as if you were speaking to a man, except try not making any references to sex whatsoever. You might think you can pull it off, you might think it makes you funny or charming, you might justify it with ""If she gets weirded out it's her loss and she's a prude anyway"", but don't, because you can't. Don't offer to hug her, your sneaky hugs aren't sneaky, they know what you're doing, all of them. Just chat to her, and when you're done, talk to someone else. That's all there is to it.  


Throwing in a ""That's what she said"" or pointing out every double-entendre someone says (""i'm coming"", ""hold this for me"", other things that people just say in regular conversation) might have brought the house down in high school but it grinds conversations to a halt and gives the impression that you're intentionally destroying the flow of conversation so you can make it all about yourself. They can be pulled off, but not by you, not yet. You'll know you can do these things because, after being freed from the Dunning-Kruger peak, you'll feel like you can't pull them off, and then eventually you will feel like you can again. That's when you can. 

&amp;#x200B;

That applies to everything else too. 

You are overdue for a crash in confidence and self esteem, the crash most people have in high school, and you probably deserve it. Not just a bad day, a world shattering life event you'll remember forever. It's ok, it's a part of growing up. 

You'll feel like you can't do any social stuff like you used to. but then you'll feel like you can, and for the first time(ish) in your life, you'll be right.

&amp;#x200B;

Now here's the good news.

You're smart. You've been critically analysing the faults in society for your whole life, you saw the patterns and stepped outside them on purpose, you are not a mindless cog, and this change won't change that. Your growth after the crash will be much faster because you are older and intelligent. a whole new layer of the world will open up to you. It'll be ok. It's better to know.

&amp;#x200B;

It took a heartbreak, a staggering amount of guilt and an escape from the social environment I had created to push me past that point, to free me from from the Dunning-Kruger peak, To make me recognise that i'm not bloody Voltaire, to reveal to me the context that I create around me, to topple me from Mount Stupid and down the valley of the unknown and finally up the balmy hill of social competence. I haven't been called a creep in years and people flock to my parties and invite me to things. I feel loved and respected, and I know its true because i know what it feels like when i'm just telling myself that.

&amp;#x200B;

I was afraid I would lose myself, but I found myself.",20Feb2019,10
31,"Been going through a very tough time lately, saw this quote in passing, thought it was quite relieving.. Even in the toughest of times, it will pass and something good will come of it all",20Feb2019,2
33,"I’ve recently had a lot happen in life (child had to have major surgery twice in a month) my busiest time of the year is happening at work. And it’s not been the smoothest time in my relationship with my boyfriend. I have been divorced for 2 years and I HATE social media. I was just introduced to reddit and i actually really like it! I have to use social media with my job and business so as much as I want to delete it I can’t. I’m contemplating turning it into strictly work related. Because I feel so stupid for letting this get to me..but I don’t understand when you have been nothing but nice to someone why they randomly stop or just refuse to like your stuff. 

I know you are thinking “who the efff cares” —hi hello I do. Lol not that i care I just sometimes want to know. You will see them automatically like anyone and everyone else of your friends but not you. And I’m a female and it’s mainly other females. Or they will like anything and everything my boyfriend posts but if it’s a post with me...nothin. Makes no sense to me. I’m just curious as to why ",20Feb2019,5
35,"Oh how the times have passed. I remember elementary school, high school, college and university like it was yesterday. I feel like I haven't accomplished anything at all from age 22 to now, what a waste of seven years. All I do is wake up, work, shower, eat and sleep. Fives times a week. I make $45/hour and I live in the middle of nowhere. I'm making steady income but I don't know what to do with it. I feel like money can't buy me happiness. 

I'm glad I removed my birthday from Facebook so I wouldn't have to face any social anxiety about who gets the most birthday posts. I mean, the only thing keeping me alive is the fact that I save lives on weekly basis at the hospital. If it wasn't for that and my parents and maybe one important person in my life, I'd probably be taking my own life out of misery.

Anyways, happy birthday to me.",20Feb2019,23
36,"tl;dr I'm about to leave university, so I've been wondering, where do people who hate large social situations like groups/clubs/parties find partners?

I've been reading through older posts on reddit in general and I felt like none of the suggestions really applied to me. Of the suggestions that I've come across that I've tried:

Online - This one has actually been really successful for me, either through dating apps, games, or just posting and people added me, I've met literally every single one of my friends and all but one of my past partners online, even the ones who lived close to me. I'm not too keen relying on the internet though because as a male, the odds are so overwhelmingly stacked against me, and I've been in some pretty toxic relationships in the past, so I've been recommend to look elsewhere.

Through friends - My main group of friends are really shut-in too or don't live anywhere near me so we kind of just live our own lives. The ones that are close to me IRL are really antisocial too and don't talk to women, even my friends who are women don't talk to other women.

Interest Clubs - I play games and watch anime for example, but not everyone who plays games or watch anime will have anything in common because their tastes can be too niche. The biggest source of new friends IRL I meet people at is when I go to Yugioh tournaments weekly, but anyone who's ever played that game IRL will know that effectively 0 women play the game.  
A secondary issue is that I hate the cliques that develop in these clubs/groups, and the social drama that arises because of them. IDK how to describe it, but I find any sort of gossip, talking behind people's backs, and group power dynamics to be unbearably annoying so I overwhelmingly prefer talking to people 1 on 1.  

Parties/Clubs/Bars - I don't drink or do drugs, and I hate these loud, crowded places. I also find it really annoying to talk to someone I met recently if they're drunk, because the way they are makes it really difficult to get to know them properly, beyond their attitude when drunk. 

School - I'm in a major where my classes don't have women in them. I'm also unsure of how appropriate it is to just talk with random people I know nothing about, especially since I know a lot of them have places to be since they're at school or studying.

Church - I'm not religious and a similar problem with school, I'm unsure of when it's appropriate to speak to someone there.

In General - People who I've dated or made friends with that I met IRL tended to be too normal to be compatible with me. I know that I have absurdly restrictive limitations on my social interactions and I have fairly niche interests too, so meeting people IRL is exceptionally hard because I feel like they wouldn't have enough in common with me to be compatible, in neither personality nor interests.

Thanks for reading it this far, and to reiterate the advice I'm looking for, where should I go to meet other antisocial people, and how should I approach them?",20Feb2019,1
37,"Hi, all. Where do I even begin. I am a senior in college and I have been dealing with depression for years now. It has really worsened in these past few months, given some external factors, and I think I am falling apart. My Nana passed away in January. My step brother just got diagnosed with stage 4 non hodgkins. And, I just received my rejection letter from the graduate school I applied to. I had spent months working on my app, I had a high GPA, and I busted my ass off. I’m devastated. 

I’m anxious about graduating and starting a life of my own. I feel like my grandparents on my mother’s side will push for me to move back home, when I have no more friends there. I am a first gen college student and the thought of falling back into that small town I have tried to escape my entire life is excruciating. I have always wanted out because I have never belonged. I’m just afraid I won’t be able to do things on my own. I feel ignorant, inexperienced, and horrified. ",20Feb2019,1
38,"Not sure how to explain it, but it's the same sound you'd hear when you yawn. I run my fingers gently along my face and it triggers that sound. I'm guessing it's the reaction from the tiny little hairs on the face, but how common is this?",20Feb2019,2
40,"He was my high school sweetheart that didn’t treat me perfectly. He called our relationship of two years silly before taking me to a restaurant I hated and then dropping me off at home saying “it’s over”.  I should have let go but I had never felt love that intensely and truly and was way too clingy and couldn’t understand then that I really drove him away. 

That was almost six years ago. We reconnected as friends for a bit before trailing off and being strangers again. I try to remind myself of all the bad but all I can think of is how I’ve never felt so strongly about anyone since. I forgot him for a good year but he’s always in the back of my head waiting to reappear once I have a dream about him or I see someone who resembles him. He’s just such an interesting guy and I would still do absolutely anything for him.

I don’t ever check up on his social media but if he’s seeing someone I hope they’re happy together and I hope he finds that insane and beautiful love that I found in him. ",20Feb2019,2
42,I never use to have issues chatting or making friends. I still don't really. I just have no interest. I find people to be annoying and interacting with them to be quite taxing. I have a daughter and having to interact with other parents is something I try to avoid. Perhaps it's 16 years of serving in restaurants that has rendered my will to small talk to zero. ,20Feb2019,3
43,so i tried not to go on social media (only lasted two days sad shit) and i have deleted/deactivated various social media accounts before to leave people or just to stop investing time into it. idk how to just not participate lmao. should i try deactivating temporarily or should i just delete the app altogether? ,20Feb2019,1
44,"I’ve started to work out more, I’m saving some money to buy stuff I want, I’ve got a beautiful girlfriend who just melts my heart every time I see her ",20Feb2019,5
45,"Doesn't seem like a big deal but it took 4 days of mentally forcing myself. I also did some laundry, and might as well do some groceries tomorrow. Its been hard in ... pretty much... all aspects of life and little things seem so hard right now.  But I can pull this through and you know what, I don't give a fuck because I care. there are things and people that matter to me and they deserve more than a person who gives a fuck, they deserve a person who cares. I will somehow dig myself out of this shithole I fell in and be a proper person. I know I won't be the best but I will be trying anyway.",20Feb2019,7
47,"I don't know what to do. I can't sleep properly and this dilemma is affecting my school. I am stuck with a father who is to timid to say anything regarding his feelings and a mother who can't let my father go and reacts overexaggerated with every emotion she feels. I try to support them as much as I can, try to put up with both of my parents. At the same time I am trying to emotionally comfort my younger brother and I am trying to focus on school, trying to keep a job which I desperately need for a vacation with friends. 

&amp;#x200B;

It's draining me and I need someone to support me because I don't know if I keep my sanity any longer... I just need some help... I don't care if it's from a stranger of the internet or anyone else... I don't have friends to talk to... ",20Feb2019,3
48," I'm 14 and live with my mom, and for the past couple years I've been getting really (really really) sick about every 1-2 months for about two weeks or so at a time. Can barely stand/attend school most of that. She absolutely refuses to take me to get vaccines, even though she's been a licensed nurse for more than 10 years. My dad doesn't legally have custody, but can he take me to go get vaccines anyway? ",20Feb2019,149
49,"https://docs.google.com/document/d/1x7f6cLwgpL76fSGd9ppRV-9eMv0MsAyyVvQaWr1X1wo/edit?usp=drivesdk

It's about a 13 year old girl searching for her missing father. 

I don't care about upvotes, I just want some feedback if I'm doing a good job before I start another story. ",20Feb2019,0
50,They had a fight today. She came over my place to smoke pot and relax. Then she phoned him to come. He came to my house and slapped her. Then I stopped him by grabbing him from the back. They talked for a few moments and the girl just went home crying. I don't know anything now except that the he's no longer my friend boz he hit a girl. ,20Feb2019,1
52,So i’m turning 16 this year and i want to go to a festival this summer as a few of my favourite bands are going. My mother isn’t happy with me going with my friends even thought the festival is only a 1 hour drive away. I can see her argument that she wants to protect me but i feel like i’m responsible enough to stay safe and have a good time. There’s around 14 of us going as a group and we’re all super close therefore there’s little chance of us splitting up. All of there parents are happy with us going as a group except mine. I really want to go to this festival and i would hate to see my friends go and have fun without me. I usually don’t ask much of my parents but i feel they are being over protective. What should i do? ,20Feb2019,1
53,"At one point or the other in our lives we feel stuck or feel like the whole world is against us. It seems like it is all over and there is no where else for you to go. Before asking the question on how to start over in life, you have to remember that change is constant.

Change is the one thing that everyone of us would go through – we grow old, mentally we get mature, we fall in love, get our hearts broken,fall sick etc. We all experience change, some happy and some negative.

So how can you start over in life even when it seems so hard.

Link: https://thezeroed.com/how-to-start-over/

",20Feb2019,0
54,"I'm ok with it and don't think of it as a problem/issue.
I don't care much for others emotions, I like power, I lack empathy, remorse and guilt, I don't feel stress or love/romantic attraction for anyone/anything, I want to do whatever I want but I really don't want to face the consequences. I often don't have many emotions and when I have them, they aren't that strong. ",20Feb2019,1
55,"I have a really short attention span to my external environment. I tend to daydream a lot. I start thinking about something and a train of thought starts going in my head. To the point where I lose track of what’s going on around me. This is especially bad at work because I make so many mistakes just by not paying attention enough. I started a new job at a lottery shop, and it’s so quiet and boring, so it’s easy for me to start daydreaming. However I’ve found recently that I keep forgetting things, like giving out cash when I’m supposed to take it from the customer. I misread a lot of things. I feel so ashamed. I’m not that stupid, but forgetting little things like that make me seem like I am to the boss. How do I stop daydreaming and learn to pay more attention to things?",20Feb2019,4
56,"I'm FTM and feel my body looks disgusting. Over 110 lbs looks obese to me and I recently did my body fat % using BI scales and nearly threw up. I miss when I was 90 lbs and had no hips or chest and ''sparrow legs''. Also the more body fat I have, the more estrogen I retain which just makes me feel extremely gross. To skip dinner I often go to sleep at 6 PM so by the time I wake up it's the next day. I'm also doing cardio and drinking energy drinks.

I'm 5'5 and 110 lbs.. my goal is 90 lb and a body fat of 13% like what it was when I was skinny a few years ago. ",20Feb2019,1
57,"Lately I do have some problems that I do not know how to solve. It just way to hard for me.. and I got no one to refer, got no one the hear me out, got no one to share. All by myself. I have been pretending to be fine and happy until I get tired at the end of the day. 
 Want to cry, but the tears wont flow out. And I keep thinking tht there are other people who in the worst condition and have much more suffering than me. Because of this also, I told myself that I am not qualified to cry since there are other people who have it worst than me.
😞
",20Feb2019,5
58,"I’m not sure whether to take up the offer of a fellowship/job in a city I love, or stay where I’m at and begin a masters. Both are paid for, I won’t be losing money. Sometimes I’m just amazed that I made it this far. ",20Feb2019,1
60,"It's not like im REALLY ugly, or an idiot that can find a topic to talk about. But if I like someone I kinda get like paralized.",20Feb2019,2
61,"Quick backstory my dad passed away almost 3 years ago. He was only 48 and it was so sudden. I was always a daddy's girl and he was my favourite person after he passed I took care of all arrangements by myself because it was just him and me.
I think of him often. I do believe in this quote:
""Everybody dies twice, the first time is when they lower you into that grave and the second time is the last time somebody remembers your name""
Today it happened I thought of him and of something I remember he said but I cant remember how his voice sounded I simply can't  recall it. It probably sounds silly but it hit me like a train and I feel awful.",20Feb2019,56
63,I don't know what to do anymore,20Feb2019,842
64,"I've been like this for many years, I hate making mistakes and hate feeling like a failure, it doesn't help that I'm quite an emotional person and get upset very easily when I know I'm having a bad day, and making mistakes.

Today at work there was a message addressed to the whole team, about reminding what needs to be done, the correct way to do things etc, now this was basically indirected to me because firstly it was written after my shift that day from a fellow and angry sounding receptionist, and because it was in regards to a specific shift which I do the most out of the whole team each week. And I know it was meant to be helpful, but the way it was worded ""just ask the guest it's not hard"" made me pretty annoyed. Then the day just got progressively worse, just lots of little mistakes, the duty manager was getting annoyed and on my break I just broke down. 

I want to reduce my shifts because I hate the pressure, I hate the fact that I'm obviously not doing a good enough job that others have to bring it up, and I hate getting so stressed to the point I cry. And I don't want to feel this way, I'm not the brightest person either so everytime I make a mistake I just critizise myself and my stupidity and lack of intelligence.. 

What do you reckon? Go easier on myself? Reduce the number of shifts, should I talk to someone in my team? I got transferred from another department and I would much prefer working more shifts in my old department (now heads up I've been in this new position for just over a month, still learning the ropes) but it means I don't have that pressure or stress or make any mistakes, I just don't want to be on bad terms with the manager or duty manager because we are short staffed and I know they appreciate my help even when I feel like I'm letting everyone down. ",20Feb2019,3
65,"Start to bleed. Insert tampon. Feel sexy, empowered and feminine. Finally part of the sisterhood. ",20Feb2019,0
