,text,time,score
0,I hate my life lmao,20Feb2019,5
1,"You're still in a damn library, have some fucking consideration for the people outside the room and quiet the fuck down you disrespectful assholes. 



The room is still in the 'Quiet Study' area, that applies to you fuckers as well. 



Oh and to the Karen who brought in her hot wings and started eating them you can go fuck yourself. Now the entire library smell like wings and I'm hungry as fuck. ",20Feb2019,11
2,"A lot of the time, when I'm trying to deal with my loneliness, some people say ""You gotta learn how to be content with yourself."" That phrase got me thinking: is it possible to be so content with yourself/self-reliant that other people lose value?

Over the last couple of months, I think I've slowly descended into that mindset. Before then, I always dreaded being alone, yearning for companionship. Then, I started to accept my loneliness. Instead of asking people to hang out, I started doing things by myself. I learned that it's possible to enjoy life without others. 

But it was only today that I noticed that I rarely go out of my way to make anyone else feel better. I haven't asked my family for anything, I stopped reaching out to my friends, I even quit my job so I could sell crafts from home. I've developed myself so much that I'm not really seeing the value of others anymore.

""Why go to the movies with friends when I can go by myself?"" 

""Why eat dinner with the family when I can buy my own food?""

""Why work somewhere when I'll probably make more money selling crafts?""

Is this a bad thing? A good thing? Is it possible for someone to be so self-reliant that they see other people as liabilities rather than potential assets?

**tl;dr** I've started making myself happier, but I'm worried that eventually, no one can make me happy other than myself.",20Feb2019,7
4,"I have a security camera outside of my house that is triggered by motion. Part of its view is capturing coincidentally my neighbor's vehicle departing and arriving. Since installing the camera, I've noticed that my neighbor departs and arrives home roughly twice every hour throughout the entire day of every week, seemingly all day and all night. It's a quiet suburban mid-to-upscale community. In our few interactions, he's neighborly but not very approachable and very rough around the edges. I'm pretty sure he has a gun, hearing him recklessly fire off a shot or two in his backyard at what sounded like target practice at either a tree, the ground, or one of the many types of harmless wildlife we have lurking in the area. He presents himself as someone not to be messed with whenever he loudly barks at any service contractors whether parking their trucks in front of his to fix telephone poles or mowing other people's lawns across the street. I'm not eavesdropping. His natural speaking voice is so incredibly loud and boisterous, like any prison caricature on TV of an incarcerated person who struts about wanting to be heard. I can easily hear his side of every conversation he has with his pool cleaner and other people who come to work on his house.

&amp;#x200B;

He comes off as a guy who worked hard to pull himself out from wherever he came from to make a better life for his wife and daughter. It doesn't appear that his wife works, as I never see her depart or arrive, but I've spoken to her bumping into her on occasion. I never see his young daughter. In hindsight, he may have said niece, but I have a vague memory that he referenced her once as his daughter. This is all important backdrop to paint the quiet community and his tough guy personality before adding that we are both African Americans. So, I didn't want to paint someone's leap that this is a ghetto of any kind, and because my tendency is to not jump to stereotypical conclusions. But I can't think of a single common job like Uber, police officer, tow-truck driver, or on-call anything that would explain his all day and night back-and-forth departures and arrivals every 30 minutes. It doesn't seem like time to do anything but drop off something nearby before returning home, and then departing 30 minutes later. I'll try to go back and map actual times from the motion-event videos, as there's always a strong chance I'm exaggerating how quickly and often he returns in memory. 

&amp;#x200B;

But it is daily, and his day and night activity triggers my cameras to the point that I'm considering disabling the cameras because it's always just him coming and going incessantly in short intervals. The only thing I could guiltily imagine is that he is some sort of modernized drug dealer that instead of selling drugs on a street corner, he does drop offs whenever receiving a phone call. But even that doesn't fully make sense to me, because why leave and return every 30 minutes? I feel like I'm missing something, and that there must be a logical obvious answer from someone who has a job that mirrors this. I'm not a nosy neighbor type. iT's just everytime I look at what triggered my cam, it's him. I'm not even compelled to contact the police if he were a drug dealer unless there was suspicion he was involved in something more nefarious that was harming people who were unknowing victims, or something quite deadly beyond marijuana. But I have zero evidence of him being a drug dealer. I just can't imagine what his job is. To afford his house, he doesn't seem to have enough time to go to work, although he does depart every day early in the morning, but then returns shortly thereafter, and that pattern then repeats throughout the day. Any ideas?",20Feb2019,2
5,"They'll laugh at things i say all day and eventually will just be like ""ok im just gonna mute u"" am i really just being annoying? How do i find the line ",20Feb2019,1
6,"Yesterday, I developed a horrible headache and then a fever. My neck began hurting around night. Today, I noticed my neck hurts even more. Lights, like from my phone, are starting to become difficult to look at as well. I’m not sure if this is the flu or possibly meningitis, but it’s worrying me. I don’t want to diagnose myself so I’m debating if I should just wait it out at home or not?",20Feb2019,1
7,[https://youtu.be/SVonAuNADyo](https://youtu.be/SVonAuNADyo) Like and subscribe if you enjoy! ,20Feb2019,1
8,"Be so fuckin broke you can’t afford ANYTHING to eat or smoke and after two weeks the cravings start to go away.
Helps if your car is broken down so you can’t drive to the store/friends house to bum one off em ",20Feb2019,8
9,"I’ve been a lurker for quite a while now, my anxiety has limited my ability to have interactions practically anywhere. I’m gonna go comment and chat and stuff, hopefully it won’t be too stressful.",20Feb2019,2
11,I am struggling. I don’t have any friends. I don’t think I can continue. I love my son. ,20Feb2019,3
12,"Sometimes my parents do this. It really bothers me, and I can't do much about it.
It's mostly my mother, whenever she is mad.
If I bring it up, she acts like it never happened, as if I misheard her or I'm making it up.
Is this normal/common?
What can I do about this?",20Feb2019,5
13,"I’ve never had a problem with birds before this (actually think they’re quite cute). But this summer there‘s this one myna hanging out near my uni’s tram stop and I swear to God it is possessed with the spirit of hatred and murderous rage, it has attacked me no less than 8 separate times and every time I go to class I have to speed walk past the area and be hypervigilant to duck at the barest swooshing of wings or evil cawing

The problem is that now I’m flinching and ducking every time I see any bird flying towards me or making bird noises, even if it’s a harmless little pigeon or sparrow and it’s chirping prettily instead of squawking demonically. It has been very inconvenient and I am starting to fear open spaces.

Goddamn stupid fucking bird, you’re not even supposed to be here you’re an invasive species god ",20Feb2019,11
14,"For the passed few months I have been struggling (worse than ever) with self image and confidence and all that stuff. And today for he first time- ever, I called myself beautiful and meant it. I looked in the mirror and the first thought that came to mind was wow, that’s beautiful. Without even thinking! I don’t know how long this will last but I just really wanted to share this accomplishment, I’m just so happy for myself. ",20Feb2019,2
15,so my friend made a bet that i can’t get over 100 downvotes. i would like to prove him wrong. please people of reddit downvote my comment below and spread it across reddit. i want to beat his ass,20Feb2019,0
16,Hey.  This is probably going to come off weird but you know I am. Do you have anything you need from me? Or to say to me/ yell at me? We had a rough while and I know each time was on me but I feel like I owe you and I can't get you out of my head and I just really don't know why. But I've had you stuck in my head forever and I don't know if I just saw our friendship as more than it was because I was the weird loser but I need to figure it all out and I don't know what to do. You're the first person I ever really let in/ cared about but we've barely talked in what?  6 years?  And you're still always in my head. This is really hard to send. I don't typically open up unless I'm extraordinarily wasted. I'm procrastinating with these last sentences. I don't know why this is so hard for me to send.,20Feb2019,1
17,"I have a crazy amount of work for college that needs to get done. I didn't have class today and I still did nothing. I didn't even do anything that I like either. I just sat around on my phone in bed, all day.

The worst part is, I can't seem to even care about the upcoming deadlines. I don't know what's wrong with me. I think I've finally snapped.",20Feb2019,2
18,"So, some context. I've been in online school for four years before I've started going to high school last year. For the record, I don't think there is anything wrong with crossdressing (clearly), nor do I think it's wrong to not have masculine role models, but that's exactly what happened with me (I've been living in LA). Most people I knew were women or gay, and about two years ago I made a video where I played a female character and my sister gave me clothes from her to wear.

Flash-forward to now, and as an insecure straight male I obviously wanted no one to see that, but didn't take down the video. I've become friends with this girl I think is cute, though she clearly doesn't like me, and she's an upperclassman anyway so whatever. We're both in Into the Woods together but have been talking over text more, and she saw the video and I am extremely embarrassed and especially worried about seeing her when school is back knowing she saw what I prayed no one would.

She thought it was funny and probably thought I was gay anyway before (I've kind of accepted that's my high school fate) but god that was so embarrassing.

Has anything as embarrassing as this happened to you?

Jeremy",20Feb2019,2
19,"I was a having a debate with a friend of mine, we were talking about a 60 year old celebrity having a 16 year old girlfriend. I said she was probably groomed, this guy is a pedo, no child would want a crusty old dude! Kids that age like cute boys! Then he defended that was just my preference, she's close to 18, she gave her consent (legal age of consent in our country is 12). He even asked me if both 13 year old have sex, were they both pedophiles? I lost my cool, and my respect for him and called him an idiot and his argument is stupid. I mean that's a child! He later said that we should stop stop the conversation because I'm being too emotional, which I did not reply, since I become irrational when I'm angry. Still shaking from but rant over.",20Feb2019,1
20,"My wife discovered that we had a mouse in our kitchen 3 days ago. I went and bought various traps and placed them in the places I had researched would be the best places to catch the little rodent. For 3 days, nothing. That little mouse ignored or got around all of my traps. It kept me up at night thinking about that little rat bastard living in my house, rent free and eating my garbage. That's my garbage, not available to any creature that sneaks in and lives under my fridge.


So, tonight I set the traps and happened to notice the mouse was chilling between the fridge and counter. I went outside and got a piece of all thread rod. I was able to make it back into the kitchen and it looked like the mouse was snacking on something. I was able to speak and kill the mouse on the first try. I was no longer a suburb dwelling dork, I channelled my ancient hunter ancestors and killed the wild beast. My wife was impressed with my masculine display of heroism, but she left me to clean up the carcass by myself.


TL;DR I killed the mouse that was eating my kitchen garbage and felt like a tough hunter. ",20Feb2019,0
22,"[It's a classic line in Hot Fuzz](https://www.youtube.com/watch?v=puK5CwThaq4), but I think it's spot on.

The way I see it, there are only three possible causes for collisions:

1. Someone was driving like an asshole or idiot.  Note that I consider driving too fast for conditions or any sort of weather-related crash to be included here.

2. Sudden unexpected mechanical failure, such as a brake line suddenly failing, tire exploding, etc.

3. Things that are frequently called ""Acts of God"" in legalese, such as [a large rock falling into the road](https://www.youtube.com/watch?v=SwfKeFA9iEo).

I have no statistics to back this up, but I'd be willing to bet money that a minimum of 90% of crashes are caused by #1.  In these cases, it is flat out wrong to call the crash an ""accident"".  Driving recklessly, distracted, drunk, etc...these do not happen by accident.  They are deliberate choices that result in collisions.  By calling them ""accidents"", it implies the collision couldn't have been prevented, or that the person that caused it can't be blamed for it.

Even crashes caused by carelessness (Such as not sufficiently checking a blind spot before changing lanes) *still* are not ""accidents"".  When you're in control of a 2,000+ lb hunk of steel, there's no room for carelessness.  One failed shoulder check can cause death and dismemberment, and calling such a collision an accident feels like an attempt to minimize the responsibility and accountability.",20Feb2019,3
23,"Don't really know where to start so here goes... When I see a post or a comment on Reddit, specifically from subreddits",20Feb2019,1
24,"When I see a post on Reddit (or anywhere else for that matter), on subreddits or places similar to r/askreddit, I just don't find it to be convincing. If I don't have concrete, obvious video or factual evidence, it's just not real enough for me I guess? Just by looking at a post with something like 30k up votes or whatever, I feel like my trust is -1 times that of others. It really is infuriating to not be able to believe anyone, and it's gotten to the point where I don't trust family and friends. Just wondering if any of you have feelings similar to this?",20Feb2019,2
25,"Hey Reddit

I don’t really know what to say or who to talk to so I thought I’d pour everything here in hopes of feeling better or finding some guidance. Me and my fiancé broke up after 8 years very recently, it’s my first breakup and it her decision in the end. The reason was that she felt that the relationship was stagnating and that she wanted to explore life and find herself. We started dating when we were around 17 and I’m 25 now, it just saddens me so fucking much because I know that one of the reasons was because of me, I wasn’t romantic enough at times and I’m aware of this because I’m not the most romantic guy, that and for at least two years now my mental state has been depressed for a variety of reasons that I won’t go into right now. She admitted she carried me a lot during that time and I won’t even try to deny that, her words were “How can I love someone who doesn’t love themselves?” and that stings me so much. I can’t help but beat myself up over the past week since the breakup because if only I tried harder, these 8 years wouldn’t have been trashed like this. 

We accepted that we’d stay friends and we still talk, it’s hard sometimes but it works. What I don’t understand right now is that she still says she cares for me a lot and even loves me, she still hugs me and at times has kissed me after the breakup. I had to level with her and tell her that I couldn’t do that, it hurts too much because it just fools my brain into thinking that we’re still together when we’re not. I get that it’s hard to drop feelings for someone even after a breakup but I don’t understand the affection after a breakup. I don’t know if that’s the right thing to do or not but I felt that it was for the best. 

I still want to fight for this relationship, I don’t know if I should or shouldn’t, whether it’ll hurt me more in the end or do me more good. I definitely think it’s salvageable, but nothing in life is certain. Maybe I should let go, maybe not.

I’m almost 26 and I feel like a child all of a sudden, I feel like the answers are right in front of me but I’m too naive and can’t see them. I don’t know, everything is a bit of a blur right now and I just thought writing this down and getting some advice would do me some good, for what it’s worth. Anyway. I definitely need to work on myself, I guess if there’s any silver lining it’s that the relationship made it harder to realise just how bad things have become. At least I’ve come to awareness, as much as it hurts.",20Feb2019,3
26,"Is what you told me two years ago in this very bedroom, I remember being 15 and thinking you were stupid over how much effort you put into your make up and outfit. He's just a boy I thought. 

And now I'm older, standing in front of the mirror you once stood in putting on mascara and eye liner just to hear him say those two words ""Your beautiful"" 

And now I understand. ",20Feb2019,1
27,I have spent the last like 3 or something days mainly on Duolingo with a few exeptions learning Russian and every thing I read and type looks like Russian and it's all blurry and really not ok,20Feb2019,0
28,"Is it just me ?? 
Post 2 and 5 of my feed are always ads and after that I see an ad every third post. 
Then my stories are the same !!!! What the actual fuck is going on with Instagram? Its become absolutely unbareable ",20Feb2019,2
29,"the love I had for this girl was one I don't think i'll ever find again, we both have since moved on in our lives. However we are still very great friends. We talk about our current and previous relationships to each other and it's honestly a healthy friendship. However I just can't get out of my mind the burning passion i still have for her buried inside, it's been well over a year since we split and it was a very messy break up too but something about us we just could never fully break away. Even though she has a boyfriend and I respect that and wish the best she's always been in the back of my mind. 

~ AO",20Feb2019,2
