,text,time,score
154,"Hey guys, for the past couple years I’ve been feeling emotionally numb, and I have trouble caring about things in general. There’s no specific cause of this. I wish I could go back to the days when I was energetic and felt like I was alive. Lately it feels like I’ve just been going through the motions of life. Any advice?",13Dec2018,1
155,"So, I'm in 6th grade but this happened last year in 5th grade. There was this girl I really liked, she'd already admit to liking me and I made it obvious i liked her back. We had this thing called Masters In Math we got a sheet of paper with math questions on it, now I was a gifted student with straight A+'s on every report card I got. We were doing multiplication by 9's. There were 25 questions and 1 minute to do them. So I sat beside her and we always ""flirted"" and joked around with each other. She was already done so she was watching me finish up. I had 1 question to go with about 3 seconds left. It was 9 x 2, I knew the answer ""18"", so half way through writing it she took my pencil and said ""times up"" in a joking manner. I didn't finish. So... I didn't pass. When everybody else did. Every body knows I'm gifted so it was really hard coping with kids making fun of me because I didn't get the question right and pass. With all this negative comments and bullying going on, my friend (girl) was trying to say sorry. Since I've had other problems like this I didn't really believe her. Now I know she was being sincere. So I kept on brushing her off and ignoring her until we only talked in times where we were forces to be put together. I still like her and she still does like me but after I was a complete jerk, its kind of awkward. The ways in which I was a jerk was I met somebody else who was arch nemeses with the girl I like(d). She was also a girl. She started telling lies to me about her, I believed her and started to talk about her behind her back. The thing is I am always trying to ask her if she is actually doing these things, (stealing my lunch, ripping my test) but she always says ""no"". I have a weird feeling it is my newfound ""friend"" doing these things to make a bad impression of the girl I like. Now it is extremely awkward to talk to her. All I need is now I'm in 6th grade, (same class as her, and trying to become friends again).   The only thing is I am socially awkward, I stutter, don't look the greatest but try my best to and am extremely shy, even to my immediate family. I need a bit of ""advice"" on how to tell her without ""harassing"", or annoying/forcing her that I want to get into the same state of friendship we used to be in. Please take everything I said previously into consideration on what I should do.

&amp;#x200B;

Thank you.

&amp;#x200B;

\- idontlike112",13Dec2018,1
156,"I’m 18 years old and I was out last night with my friend at his house. His father was home, but asleep so him and I were gonna just have a couple drinks and play Rocket League like we do pretty often together. I brought a 5th of fireball and drank about half the bottle pretty quick, but I absolutely remember the entire night. I was never drunk to the point where I would have made a bad decision. We stayed in his basement all night. I don’t know if it has any bearing on the story or not but my girlfriend of 3 years who means the world to me and I were arguing on the phone pretty intensely for a little bit that day which is extremely rare we’ve never really argued about much. She proceeded to break up with me around 1AM over the phone. So I just kept drinking and drinking trying to not rlly think about it and I wasn’t honestly that shaken up about it. I was keeping myself distracted. Anyways, he hadn’t drank pretty much anything so he was 100% sober. My girlfriend called me around 1:45 saying she made a mistake and wanted to get back together so I agreed and we agreed to meet at my house the next morning around 9:00 when she got done with her finals. I went pee and fell asleep somewhere around 4:30AM after him and I played some games for a few hours and looked at some YouTube videos. When I woke up I believe it was around 9am. I skipped my dentist appointment and drove straight home, totally sober. Got home and laid in my bed with my gf. Now things turned a different direction and my gf and proceeded to start getting intimate, when I pulled my pants down, I had a sticker on my private parts. This is more info than I’d like to give but the sticker was placed very square and even and fully stuck pretty tight into the tip of my weiner(lol). The sticker said “Inspected by” and had the #12 written on it in Pen. When I found this I realized my abs were incredibly sore and I had a small scratch on my back I dont know where from but for some reason this reminded me of a story of a guy who woke up in a bathtub with his kidney removed and no memory of it. I don’t know if I should contact some sort of police, move, right it off as some coincidence or what to do. Feel free to ask any questions I will reply to them whether or not they’re personal. 

Thank you.",13Dec2018,1
157,"I work in engineering, but I have no higher education, just work experience. I make ok money where I am now with an ok company, but they've let it be known that I'm not going to move up in the company and I'm pretty much stuck where I am without higher education. 

I recently got an offer from another much better company in the same industry located about 1000 miles away, for ridiculously more money and better benefits, and after a very thorough interview I learned that their company doesn't require a degree to move into higher positions, they promote solely on merit and had personnel present who were in higher management with nothing higher than high school but lots of experience. 

Essentially, this is my dream job being dropped into my lap. 

I'm divorced and my two sons live close by with their mother, who I have a good co-parenting relationship with, we have a normal visitation schedule where I have them every other weekend for a few days, and visits beside that. I love my kids dearly, it took a long time for me to be a good dad and they mean a lot to me. Moving to this dream job would mean seeing them much less, though my new job and situation would afford me the ability to fly down every other month and have a month off every summer for them to fly down (recommended visitation schedule for far away parents) without a problem but at the age they are (2 and 5) I'm afraid that I won't get this time back with them and I might be sacrificing my relationship with my kids. 

I'm professionally stuck here, there is no moving forward here and I don't think another opportunity like this will come along soon, but if I take this job then I will exit my children's lives in a major way. If I stay here with my kids then I will stay stagnant in this position for a long time, even my getting a degree will take at least 5 or 6 years with the time I have to commit to it. 

I'm not a bad dad but if I take this step I feel like I'll be giving up on them, I'll be a deadbeat dad who walked out on them. I'm still paying child support and seeing them if I move, but I won't really be a dad, not in the way I want to be. This job is my way forward though, this is such a golden opportunity that I can't afford to just say no. ",13Dec2018,1
158,"For years I’ve been cutdown with rude remarks. My “friend” has had no problem with pointing out my flaws time and time again, but whenever I point something out they fall to pieces and never let me forget about it. They are never happy for my success to the point where I actually avoid telling them anything good now. When other people compliment me my friend follows it up with an insult. For years I’ve lived like this, like I have no choice but to walk on eggshells. Today was my turning point. After getting off the phone with a close friend she told me that her brother was told by my toxic friend that I have a drinking problem and she’s been spreading this rumour in town. I feel as though the friend is saying this lie because I’m moving to the city soon. It all sounds ridiculous but I feel like I’m being punished for leaving. I don’t know what to do...",13Dec2018,1
159,"Background info: My daughter is in 2nd grade. She is reading at a 4th grade level, has frequent compliments from school staff members about behavior and helping classmates, and is a generally good kid - though opinionated.  We recently moved to a new state from California.  My daughter was previously in a 10 star school, where she was at the top of her class in her scores for mathematics and science.  The school she’s in now is rated 8/10. The first time I met with her new teacher, she had nothing but praise for my daughter...until I mentioned that we’d come from California. She seemed...offended when I mentioned where we’d moved from for some reason.  All of her tests and homework assignments come home, and she has never missed more than 2 answers on any of them. She never struggles with her homework, and she even recently received an award for academic achievement, so imagine my surprise when her report card comes home, and her teacher scored her “below grade level” in literally every subject - even art. I know she’s not performing below grade average, because, as I’ve mentioned, I’ve seen her test and homework scores. Not really sure how to proceed now, but I’m pretty pissed at the prospect of my daughter being treated poorly because of where she’s from. I honestly don’t know what else it could be. Any advice as to go to proceed?",13Dec2018,1
160,"Long story short. When I was 20 my dad and step mom moved to Canada and left me in California. I'm 24 now, married and we decided to move to Tennessee. I talk to my dad off and on but hes a pastor and I'm atheist, and I just dont agree with majority with what he says. Hes manipulative and trys to win me over from my mom (who lives in texas)... anyways. I got a call from my dad saying how him and my stepmom want to move to Tennessee to be closer. I was so happy to have this change to myself. I dont want him that close to me anymore. I dont want him prying in my life and manipulating me. 

How can I stand up to him. ",13Dec2018,1
161,"So just a little background, I am a custodian and I’ve been filling in as a lead custodian at a different and much larger school. Much more stressful, bad crew, and not well maintained. I absolutely love where I was, feels like home and everyone is like family there. Im in college full time and work 40+ a week and I was able to do homework at work most of the time on breaks at my original site. Ive been at the new place 5 months now and just miss my old school very much. The thing is the difference in pay is $15 vs $23 and I am still negotiating my pay so I still have the option to walk away. Should I suck it up and take the extra money? Or stay where Im at until I graduate? I still have 3 years left in school. ",13Dec2018,1
162,"I know this sounds like trolling but I can assure you it is quite the opposite. Ever since 2015 I started going on 4chan and creeping on /pol/ and now my mind is totally warped and distorted. I thought what I posted and read was just for fun and trolling but I genuinely feel like I can't go back to what I used to be, which was a pretty left-leaning and open-minded individual. I honestly don't know which way is up anymore. Is this normal? Or is it old age? (29 M btw...)

I can't seem to get back to ""normal"". I can't seem to quit getting back on 4chan either, as much as I try. Going so far as deleting apps on my phone. I've tried spending time on reddit but I feel completely out of sync with the user base. Without getting too political, I do love Donald Trump but I don't know why anymore. I know he's a horrible person and has done many illegal things, which I do read and support on subs like /r/politics. But in my heart of hearts I can't stop loving the man and wishing the best for his family. And I know that's irrational and part of the brainwashing...I just can't seem to shake it off.

And that's just the tip of the iceberg. My life has been falling apart at the seams ever since 2015. I broke up with my girlfriend, quit a successful job in a big city, ended up moving back with my parents. Have no job, no money, no real friends. Used to workout and eat healthy, now I barely eat and watch anime all day. I wish I was making all this up. And no, I don't blame all of this on 4chan. I know I'm a big part of the problem as well and have to stand behind my decisions. I'm not looking for sympathy. 

I guess, I just want to commiserate with anybody else that feels like this. What their personal experiences have been like? I know most will look at this and laugh but I am being sincere, perhaps in the weirdest of ways. I feel, well, alone in this but maybe this will resonate with somebody else. Maybe this is the wrong place to ask? 

Obviously throwaway for many reasons.",13Dec2018,1
163,So we've always just filled a bucket of poo from our back yard and dumped it into the garbage bin seeing it as no problem. Do you need to have it bagged before putting it in the bin or can you be fined for it being unbagged? Live in Alberta Canada.,13Dec2018,1
164,My childs tooth has not come out for about a year and now its detatched at the front but its still attached at the back,13Dec2018,1
166,"My entire life I haven't been able to control myself from thinking that if I'm not the best, there's no point in living. I feel that if I die and am forgotten, my life will have been for nothing. If I don't become famous, powerful, or wealthy, I am useless. This attitude constantly drives me into suicidal pits.

&amp;#x200B;

It has had some weird effects on me: it's made me super competitive, a perfectionist, and constantly depressed. It's not that I feel I'm not living up to other people's expectations, I feel I'm not living up to my own expectations.

&amp;#x200B;

My hyper-competitive attitude has driven the people I love and respect away from me, leading to even more depression. I turn everything into an argument, I feel as if I have to ""win"" in everything if I want to succeed. I've seen a doctor about my depression, but he brushed it off and told me to wait it out. I'm sick of constantly being crushed not only by school, but by myself.

&amp;#x200B;

I need to find relief from my thoughts not only for myself, but for the people that care for me. So far, everything people have tried to change me has failed. I have little hope that I can change myself. I am crawling towards a goal I know I will never reach. What can I do?",13Dec2018,1
167,"Hi everyone I’m a 20 year old male and I still live with my parents, I’m not going to college and plan on joining the military as soon as I get fit enough and my shin splints go away and I also am not in a crunch for money since I make some money from some side stuff. 

So here it is, I just started working for 24 Hour Fitness at the front desk and pretty much hate it. I’ve worked one shift so far and I am working another tomorrow morning, and after my first shift I felt like throwing up just thinking about returning tomorrow. I worked the opening shift from 5:30am to 12pm. 

What put me off first was that All the employees hate working there and they all are constantly arguing back and back with each other. Most of the customers are chill and don’t say anything and the others are rude and a nightmare to deal with. They are getting rid of the towel service which was the one part of the job That kinda enjoyed and now they want front desk people to do more sales related stuff that I dislike. They haven’t trained me and have just thrown me into the front desk without knowing what to do and they want me to start working alone next week. I get extreme anxiety from having to deal with membership issues when I don’t know what to do and I get bad anxiety with phone calls there and they’re system in general. I feel extreme nausea right after getting done with work because i Immediately realize I have to come back, Ive hardly been able to eat for the last 40 hours because I can’t hold anything down. 
They also have a hard time keeping employees 

What should I do? Tough it out and stay at a job I hate or move onto a new job?",13Dec2018,1
168,That's it,13Dec2018,1
170,"It’s the holidays, money is tight. 
Out of curiosity.....
How do people even start selling feet pictures? How do you find clientele for that? or how does one come up with prices? or preview the ‘goods’? Anyone care to explain how that whole idea works? 
Maybe some tips for future reference?

THANK YOU! :)",13Dec2018,1
171,"Hey guys!

My boyfriend just broke his phone. He can't get a new one anytime soon. I have an old phone with a cracked screen lying around that he could maybe use instead of spending the money he doesn't have on a new phone entirely. The main issue is that he is AT&amp;T and I am on Verizon.

I'm wondering if there is a way to put this old phone onto his account somehow? They are both iPhones. I think my old one was an iPhone 5c, his is newer. I can get the details later if you guys need that info. I just don't know much about this stuff",13Dec2018,1
172,"(So sorry it's long and done from a phone.)

Ok, I live in a house with two housemates, I am renting to own it from my folks, the housemates are paying me monthly to stay there. I am friends with both, but in the months we've been living together, issues have popped up. Roommate A I have been knowing for a couple years now, roommate B I met through A and have known for a little over a year. 
Roommate A had trouble holding a job and paying rent for the majority of his time staying here. He's paid rent maybe four or five times in the year we've been here. I cut him slack because he was my only friend for a time and we had been close.
Roommate B has come to me with complaints about A. For example, not cleaning up after himself, leaving food out, leaving the stove on, not properly caring for his pet cat and strong odors coming from A's room.
    Many of these things I have noted myself, but a few were news.(I work out of town for most of the month, and have a poor sense of smell.)
These issues have been addressed in group discussion and in one on one conversations. Little  progress has been made.
I gave him an ultimatum, get his act together or leave. Pick up after himself, no dirty dishes in his room, clean his room and deep clean his carpet. I gave home unroll the first of December.
He did enough to get by.
But now he's starting to get back into his habits. He continues to distance himself from his friends, does not help pay utilities and is currently late on this months rent, though his job pays well and the rent is only 250. 
Roommate B, I've had very little trouble with as far as cleanliness, he's better than me and it's just a few personal preferences we have negotiated on. B has a shit job, but has so far never missed a payment or shown disrespect to our home.
I don't want to ruin what friendship I have left with A but I want him out. Any advice? ",13Dec2018,1
173,"My boyfriend and I recently allowed my boyfriend's brother to live with us in a rental and pay 1/3 of the rent and utilities. My boyfriend and I have lived here for several years. My boyfriend's brother moved in about 3 months ago. My boyfriend's brother recently got a girlfriend. This girlfriend apparently left her living situation (with an ex) and is now homeless so she could be with my boyfriend's brother. She spent the weekend at our house and then my boyfriend set the boundary that she could come over on weekends but she could not crash in our apartment during the week. It's now Wednesday and my boyfriend's brother called and asked if his girlfriend could stay again, citing that she had nowhere to sleep tonight. We allowed it tonight again but we're both upset that he's already not respecting our boundary. Are we being too harsh? ",13Dec2018,1
174,"I’ll try to make this short.

I consider myself to be an understanding person, I don’t judge anyone on anything that is concerning them. I’ve helped a good number of people with their issues and I don’t really get depressed from what they experience, maybe temporarily but I get over it immediately so that’s a good thing in my opinion.

However, I don’t tell anyone of my personal issues because I always think I’ll “get over it”. My ex would constantly tell me that I’m wrong for bottling up all these things and that one day it’s gonna come back and it’ll be bad for me. I told her it’s ok but now it’s got me thinking, will that actually happen?  I feel good about myself right now but I’m kinda worried that these feelings will come back randomly since there were times where I’d just randomly be bummed out and just start doodling stuff on paper for hours until these “phase” passes. 

I think I should be fine, I take care of myself and distract myself by working on improving myself(physique, personality, etc). What do you guys think?

Might delete this after a bit since this account is mostly for more “positive” things ok pce :D",13Dec2018,1
177,"It gets even worse if I wear headphones or anything that compresses my head. I also have nervous twitches happening I’ve never had before (eye brow twitch, hand twitch, slight head twitch) and I can tell all the pain/heaviness feeling is around the back of my head. My eyesight has also gotten worse/blurry.

I’m going to try to schedule a doctor visit but unfortunately my doctor kind of sucks and usually tells me I can’t help with that (primary care doctor) and a specialist for my brain is prob gonna be no joke payment wise. Just wondering what you guys think though. It’s been two weeks and it’s only gotten worse.",13Dec2018,1
178,"I’d add a photo of what it looks like but I’m on mobile. Just imagine a wart that was all cracked and callous. On the side of your left pinky (for some reason the right hand was a clean slice....) But anyways 

Like I said, polydactyly. It’s not really a big deal I had both fingers removed when I was a few months old (parent didn’t like the abnormality). However my left finger was totally botched leaving a little lump of maybe scar tissue?? The base of the finger?? This isn’t about cosmetic reasons, as to the removal, but more so practical ones. 

I just inherited a signet ring, an older sort made for wax seals with the family crest in the middle. It’s tradition to wear the signet in your left pinky (I’m a stickler for traditions) however the ring is a little small and while it goes on and comes off fine my right pinky when I put it on my left the scar makes it difficult to take it off. It can be painful (the wound is rather sore oddly). 

So what should I do?? I want to wear the ring properly, as it’s very important to me, but wearing correctly can be a hassle. Do I suck it up and wear it on my right hand?? Risk a lot of damage to get it resized?? Remove the bud scar itself?? Or is there something else I’m not considering. Any advice would be helpful. Thank you. 

",13Dec2018,1
179,"Long story short. About 8 months ago I met this friend named Greg at the same time I met my now best friends Cindy and Shelby. Shelby, Cindy and I are very similar and hit it off immediately quickly became close as we all had recently moved, etc. Greg was a friend of shelby's and kept tagging along until Shelby grew distant from him. I maybe hung out with him four times, and Cindy and Shelby still occasionally see him and have expressed he's likely depressed,  doesn't have friends bc he comes on too strong, etc. However, Greg will still text me from time to time saying we should hang and that he needs more close friends.  How do I respond? I don't want him to be sad but I don't want to deal with him. Sorry for the vague rambles, thanks!",13Dec2018,1
180,"okay so my lady that i got likes tropical scents or anything beachy. she’s a super sweet middle aged lady and it should be easy cause she would like anything but i’m at a loss. also, i don’t want it to be a gift card. i want it to be something thoughtful. but i still can’t figure out what to get. i need some serious help 😭",13Dec2018,1
181,"I don’t know why but I’ve just fuckin fallen so sad, I don’t even know why, I just got a new guitar, I’m sheltered, educated, have friends, but I still feel like shit every day. I don’t know why this is happening but I don’t feel happy, even if I because successful as a musician how can that do anything for anybody else. If I died here right now what would change, who would change. Nobody really would in the long term",13Dec2018,1
182,"This sounds odd and stupid, I'm aware. 

I noticed that I can't scream. I thought it was a made up thing that people simply *act out* until I was 12 or something. My friends asked me how I stay so calm whenever we're watching a scary movie or a stream of a horror game. The thing is, I never stay calm; I'm just shitting my pants silently. This is the same when I play those games on my own. My heart would drop, body would jerk a little at most, no sound would be made. I can speak louder but that's not the same as screaming. 

It may not sound like a problem to seek advice for, but it's a crucial thing for me. This may have still happened regardless, but I think the bastard who molested me as a child could've been arrested on spot if I could scream. I'm always afraid that I wouldn't be able to call for help when that kind of thing happens again later in the future. I don't need that happening twice in my life. ",13Dec2018,1
