,text,time,score
0,So my mom ordered a package off of Walmart for Christmas and it came in today. The problem is we didn’t get what we ordered. The package came in and has a shipping label with all of our information on it. We opened the package and it’s not what she ordered but it has the receipt of what we did order. What do we do?,13Dec2018,1
1,Dont really see any signs of anything but i hear youre supposed to get tested. Im freaking out cause i been in this chick raw but pulled out after one stroke cause i got scared of catching anything. 😔,13Dec2018,1
2,"Sp I’m confident a girl might have romantically, or at the least, platonically liked me in high school. Its been a few months since we’ve talked but recently I’ve developed feelings for her. Would it be weird if I out-of-the-blue followed her on Instagram? We’re going to the same college. If I see her I could just start talking to her again in real life. I don’t know what to do. ",13Dec2018,1
3,"At first I thought he was reading his notes out loud or rehearsing for projects but he's in my major and we don't do projects. I know now after 4 months of living with him he's not reading notes because the things he says are not related to school.

He will sometimes go into the washroom and turn the shower on and start talking if he doesnt want me to hear him. 

At night he turns to the wall smiles and chuckles at his own talking. Is this a normal thing people do?",13Dec2018,1
4,"The main thing about this Co worker I worked with her at a job in the past and I'm stuck with her at my current job.  The thing I'm try to do  is get along with her. but every time I try to say something to to her about work to keep her in loop what's going on she shouts or screams back . Also if you ask her can help you? She says I don't need your help! 

What shall I do?

Advice please",13Dec2018,1
5,"**Hey guys, what option do I have if I want to ""stream"" the sound from my TV to my phone where my headset is connected. It's about porn that I would like to stream to the TV via Chromecast but would like to hear via headphones?**",13Dec2018,1
6,"When asking for a raise in salary, what are the best ways to present/phrase your request?

A little background: I work for a large corporation. The department I work in typically works with shared accounts to evenly distribute the work load; however, our management team put me in charge of a separate account that I am in charge of running independently 6 months ago. The person who had this account before me got hired for a position within a different department and when they were running the account, it was a complete mess. Since taking it over, I have received multiple compliments from management about how efficiently I’ve been operating in comparison.

Well, I guess because of how I was managing the first account I was given, our management has recently given me an additional account to run independently. This is a way larger work load than any of my colleagues and while I’m still able to manage the volume - consistently completing my work by COB - I’m definitely beginning to feel the strain from the demand. 

I definitely feel like I need a pay increase that is comparable to my production and performance, so I would like to know how to ask for one without appearing like I cannot handle the volume of work, or without being perceived as entitled. 

All help is appreciated!",13Dec2018,1
7,"Without going in to any detail, *something* happened and now I feel much more empathy and sympathy for those in bad situations. I feel like it doesn't count though as it stems from my own experience and I know that if it hadn't happened, I wouldn't be as empathetic. I feel like it isn't the real me that is a better person. How can I genuinely become a better person?",13Dec2018,1
8,Long story short theres this super cute girl who's the cashier at this fast food place. I want to try to get her number but ive never hit on a girl while shes at work. Shes the only person at the cashier so its not like im hitting on her infront of her boss or co-workers. Anyways is this a bad idea? And how would you feel if someone tried to get your number while working?,13Dec2018,1
9,"I do not want to get into the details but overtime I have developed a dislike for one of my friends. We have been friends for two years and I have noticed that my dislike for her has grown as the more she does/says things I do not agree with. And It is at the point where I just don't like her anymore or miss her. She definitely does not feel the same way about me, which is the worst part as she says I'm her best friend. But is it just bad to feel this way? And I feel really fake being friends with her but I've tried to end the friendship many times but she doesn't let it end..? Now I find everything annoying about her. She can just get very clingy, overbearing, mean and petty and sometimes and I don't think she likes me having other friends.

Please no comments about how it is stupid that I've started to dislike her as there is a lot more to it..",13Dec2018,1
10,"I applied to an M&amp;A internship for this summer and had a behavioral interview two weeks ago-- they said they would let me know in 2 weeks about next steps. Exactly two weeks later, today, I got an e-mail from the team leader asking for a phone call to ""further discuss"" the analyst role. 

Does this mean that this is another internship interview or is it a pre-offer chat?",13Dec2018,1
11,"I'm a 51 year-old guy who has reached the end of a career in digital advertising. Even if anyone were hiring middle-aged people, which they're not, I can't tolerate it anymore. 

In classic midilfe-crisis tradition, I want to do what I should have been doing the whole time, which is writing. 

The thing is, I like having electricity and a roof and health insurance and clothes for my kid, and even successful writers get paid bupkis. I've got a little money saved, but it's littler every time I look. 

I've looked into getting gigs like jerking frappuccinos at Starbuck's or sacking groceries at Trader Joe's. Jobs like that won't pay my bills, but they will remove all discretionary time for writing, searching for something more lucrative but less soul-crushing, and general living of life. 

So, any ideas for how to pay the bills while following the dream?",13Dec2018,1
12,"My mother wanted me to come down to the house for Christmas pictures this year. I come and shave and look all nice for her so she’ll be happy which seems near impossible to achieve. When I get there we go to the beach and end up leaving in 5 minutes. They chose the coldest day of the fucking year of course but I let it slide. When I ask when they’re happening again, she ignores me multiple times till I just get up and start to head home. About a week she doesn’t tell me when the Pictures are coming so I make plans to go out with my girlfriend and hang with some friends. When I tell her the days I won’t be available she turns around and freaks out “I GUESS WE WONT BE TAKING PICTURES THIS YEAR” I mean are you fucking serious? I asked you 4 fucking times and you ignore me. Now it’s my fault? I wish I could say I’m surprised but she’s done this my entire life. ",13Dec2018,1
13,"So I'm 23, male. There's a girl at my work that I have a crush on. I don't really talk to her, I just see her in passing. I don't want an emotional relationship with her just physical. Is that bad? I have not made any moves on her because I don't want people at work to know about it regardless of her interest.",13Dec2018,1
14,"I have a group of online friends, we're in a guild. It's one girl and the rest guys, and we're all friends because of the girl. I noticed that all the guys really like her. Because of that, they do whatever she wants. If she's mad she'll take it out on one of them, he just takes it. If she's being moody, one of them will come up with an excuse why she's acting like that and go comfort her. It's like she formed the guild so she can get attention. 

&amp;#x200B;

That didn't bother me that much, but I noticed whenever she didn't like somebody, the others will start not liking that person too. They would start private calls, make hidden channels on discord, anything to make that person feel left out. It happened twice with the people ending up leaving the guild. It's happening a third time right now, but I want to do something about it. I don't want to see these people get bullied anymore.

&amp;#x200B;

I'm thinking of leaving the guild and leaving a message in the discord telling them that they're bullying people. I also wanted to tell each one their toxic behavior, but I felt like that was petty and coming off as preachy. 

&amp;#x200B;

What's the best way to handle this situation?",13Dec2018,1
15," I  betrayed the trust of one of my best friends. What I did does not  matter to him as much as the fact I did it, and I did this completely on  impulse. I’ll explain more later in the post, note that it has just  happened very recently too, and I have been very upset about this. 

So, what I did was: I messed with one of his accounts in an online  game. He had trusted me to pilot the account for him on multiple  occasions (and the game does allow this), and I had often taken care of  his account without him asking before. I had logged on to help him, but I  was also feeling upset about something at the time and I just ended up  impulsively deleting some of his items and his freinds list. His account  is not ruined, but set back a bit, over time everything can be regained  but it’s still time. This is on a free-to-play MMORPG. It was a petty  impulsive action. I may have had some reasons to be upset but it was no  justification, and it was the fact that I betrayed him that hurt him as I  said, not the amount of damage. I wish I could simply undo it, and I  was in disblief that I even did it considering how much he trusted me  and helped me and such... 

This guy has been one of my best friends, as I’ve said, and we were  very close. I would confide in him and he told me a lot too. We had our  fights before but I never betrayed him like this before. We’ve had a lot  of fun times, we met on the same game I messed with his account on. We  would play games together or just talk almost every day. He does have a  bit of a temperament, and I don’t know if he’ll forgive me or if I can  really move on from this mistake I made. I don’t make friends very  easily, and believe me, I valued him a lot and I still do... I just wish  I had thought things through, not acted on impulse. I hope I get a  second chance, but I know it’s his decision and I know I’m going to miss  him terribly over time. 

When we talked about it, he didn’t seem angry at first but as we  talked and he thought about it more, he got angrier. I don’t think I  handled it as well as I should have. I plan on giving him time and  trying to talk to him again but again I don’t know if he’ll forgive me  or give me a second chance. I don’t know if I deserve a second chance  anyways. ",13Dec2018,1
16,"Myself and my friends run an online community in a video-game. One player who we don't know in real-life, has always been a huge asset to us, as well as a **real** online friend. He was a valuable member of the community, and a bit of a leader in the roles (the game is World of Warcraft, but I don't want to go into heavy detail, because all I need is advice on the ghosting).   


Well anyway one day this guy just ghosted. He stopped logging in and has been offline for almost 2 months. He was always an in-touch person with open communication, always at our events, discussing our management and the game: an active member. Now he's MIA. I don't even remember our last communication, or if there was some kind of argument or thing that upset him.  


 I'm the leader of this community, the guild master, and although it seems to be a trivial thing, I care about members of that group. I'm used to someone who wants to leave, or short-term players taking a break or leaving altogether. But when a long-term asset who was a good friend &amp; decent human being just totally disappears without explanation, it kind of bleeds into my real life, worrying/wondering what happened.   


One thing that I noticed, probably the thing that ticked me off the edge the most, and made me sit down and write this post is this: In the Discord (which is a chat community) I always see him online, just sitting there, idle. But today for the first time I noticed he changed his profile picture. So that made me a little mad. I think its a little rude what he's doing, and I'd love to sort if out. I don't *NEED* to know, and if I have to, I can just **let it go**. I was just wondering if anyone had experience with this, if I should send him an email, or just screw it. We're online. These things can happen.   


**TLDR:** A guy my friends and I frequently talk to in a game setting &amp; casually (online) just ghosted and stopped talking to us all without any explanation, &amp; I'm a little concerned. ",13Dec2018,1
17,"I graduated a year ago with no luck finding a job in my field...brief jobs at Home Depot, Starbucks, Wells Fargo under a temp contract that ended 2.5 months early, and now Costco as a seasonal. 

My mom moved to a bad area with no public transportation or job opportunities (outside of Home Depot) shortly before i graduated.  I stuck around there and applied to the only 2 banks close by. I got offered a job (after leaving my resume off the teller application) as a relationship banker but it was simply too far away. I don't have a car and there was no bus that went in that area.

In June i moved down to NC hopeful. No luck here either. I think i'm overqualified for jobs like a bank teller and the temp staffing agencies have just given me a run around. I got a job at Costco as seasonal but after Christmas i'm leaving to move to ATL with my Dad. 

I'd probably have better luck in MD, where my school is located, but i simply *can not* live with my mom. I have to wait until i have a job and apartment/room secured until i go back.

I've slowly lost interest in most things finance related. I was interested in personal finance, but most of those jobs, as i see it, are either sales based (selling a financial product for commission to a client) or dreadfully boring, bleeding my eyes out at a desk staring at a computer screen. Both of those options suck. I was ready to die in the time i spent at Wells Fargo's office.

I considered studying for the CAPM Exam to work my way into Project Management field but i simply can't grasp some of the most important topics and its almost like i'm switching to an *entirely* new field with little understanding outside of one class i took as a sophomore.

The only advice i've gotten, from my mom, has been to simply get my master's. Her main reason seems to be that this would defer my student loans. The problem with this is that i'll just end up with more student loans if i go to anywhere reputable. 

The only thing i can think of is getting certifications but nothing seems to entice me enough to want to go for it, especially in finance. A lot of certifications either require work experience before you can even get them...which is kinda hard to get when nobody will hire me.

The only thing i can think of is getting certified in something. A Master's is off the table (i have no interest in going back to school formally for a while) and if not that then i might as well just move to CA and be homeless out there.

TLDR: Can't find a job with my degree, not interested in my degree, have no idea what to do.",13Dec2018,1
18,"I am pretty much living in hell right now. My parents scream at each other death threats, call each other names and wish death upon each other. It has gotten to the point where I don't know if this time will there be a solution. I have to witness my mother cry and scream her heart out while my alcoholic dad buries himself in his room, not a sound escaping it. I had a bad day and I suffered from depression in the past, I am afraid of relapsing. OP is 18 and gonna move out but I can't with only a few scraps of money.",13Dec2018,1
19,"Just that whole mindset of ""saturdays are for the boys, my boys come first""... do they ever grow out of it? I have no issue with them having nice strong friendships, but so many times I feel like they've put their friends ahead of me, even when it wasn't neccesary. Please tell me this is just  a teenage boy thing.",13Dec2018,1
20,"Life gets hard for everyone.  I get that.  By no means am I stating I'm more important than the guy down the street, or whomever.  I'm just not sure what to do anymore, and I figure this is a somewhat safe place to write this out.

&amp;#x200B;

Life Story Short (At present: 26 years old)

 \- Parents divorced when 7 years old, mother blamed me saying I was born to save a dying marriage (and failed)

 \- Was isolated as a kid by two babysitters among eight other kids (my brother was one of them).  Kids would make up things to make it look like I lied all the time, and as a result, the babysitter went out of her way to make sure I had nothing to do with them.  I lacked social skills all the way up into my second job at 21 

 \- Brother doesn't remember this, but he made me suck his dick back in hometown when I was six

 \- after my mom married my stepdad, they pulled me from soccer (of which I had been doing for eight years, 4-12) and gave me video games (single player stuff, no human interaction) while my step dad verbally abused me from 10 to 16.  I wasn't allowed to join clubs or sports because I was an irresponsible child despite not being taught proper responsibility

 \- When I finally moved to my Dad's place at the age of 16, my step mom left my dad and I.  Before walking out the door, she said she was leaving because I didn't love her enough.

 \- I've been in two relationships.  First one I left because my ex cheated on me with an intern at a police station.  Second one raped me (prefer not to go into the details).  I also worked at a job where I was sexually harassed for seven hours by a gay assistant manager.  Only reason I couldn't leave was he was the only manager on shift, and I was working in a position that didn't permit me to leave my spot except for lunch breaks or bathroom (basically, I didn't want to look suspicious, and didn't know what to do, so I sat through the shift the best I could).  I no longer work for him, but he donates to the maintenance of the very street I live on.  I see his name every time I drive to and from my current job.

 \- Brother has five kids with current wife, wife has gone out of her way not to say or include me in anything for the entirety of her being in the family, except christmas and thanksgiving (which considering the above, I'd understand completely)

 \- Living back with my dad, and work as a security officer for a local city.  I love the work, and despite the obvious treatment officers in and out of the law get, I'm used to it and love helping people regardless.  If not for jujitsu, my cat, and some friends from overseas, I wouldn't be here.

I'm at a point where I want to finish my education, move overseas, and leave all of them behind. But my dad, after three years of me having nothing to do with my mom and stepmom, still presses on me the importance of family, despite the fact that my biological family has largely nothing to do with me.  I feel a responsibility as an uncle to be there for the kids when im actually invited and what not, and yet I hardly even know them.  My dad's also backed me through some other situations, and helped me deal with and resolve them, but he largely lacked any presence in my life.  I'd only visit him every other weekend when growing up, and when I did visit, all he did was raid on MMOs while my stepmom taught me normal people skills (cooking, cleaning, general responsibility, etc.)

&amp;#x200B;

Looking back at the above, I don't know if this was a rant or a looking-for-advice or whatever.  Respond as you wish.  I just don't know what to do anymore.",13Dec2018,1
21,"Hey you guys, I'm a 25 male and I feel I'm at a stage in life where there are lots of sociocultural norms shifting and I'm not sure how to manage them.

Recently (relatively) got out of a relationship and I'm no longer in a position/at the age where school provides easy access to meeting new people and finding new potential partners.

I often read statements online from women about being asked out at the gym etc., and how annoying or encroaching into personal space it is. Except I see this complaint (although I'm sure a real one) extended to almost any setting. Don't ask someone out: at the gym, at work, in the library, etc. as they're there for: exercise, work, reading/research, etc. and not to be asked out.

It often seems that women are trying to convey something other than ""location"" and ""context"", as any context could be seen as the above mentioned.

So I'm not sure what I'm missing here. What sort of social contexts are appropriate for hitting on someone after schooling age? Where can I meet new people who might be romantically available and open to such a conversation?",13Dec2018,1
23,"The other day I was talking to my friend, it was ok but we started an argument. The argument prompted her to hang up on me and she wouldn't respond to my messages. This was on a Friday night so I wouldn't see her till next Monday afternoon. All weekend I was trying to message her but she didnt respond. On Monday I noticed that she was wearing long sleeves (which she normally doesnt do) and she was seemed nervous when I was apologizing to her. Her sleeve peeked up the other day and I saw cuts on her arm. I'm not sure what I should do",13Dec2018,1
24,"Hello, 

&amp;#x200B;

Im 21 years old and had been an avid gamer since primary. Recently the games i played had given me serious health issues, i had a breakdown after failing to upgrade my gears countless of times. I have decided to quit gaming completely, but i can't find any other ways or activities that would cheer me up. Im really depressed. Is there any suggestion of what i could get involve to distract myself from gaming and possibly a new hobby ? 

&amp;#x200B;

Any replies is greatly appreciated",13Dec2018,1
25,"My cousin (call him Brad) recently texted me saying that he is planning on asking his girlfriend of 7 months to marry him and if I would be his best man. P
The problem is that Brad is 19 and his girlfriend is 17, they don’t have any means to support themselves, and they are both pretty immature. Eight months ago he was in a relationship with another girl and spoke about how he wanted a long future with her. He moves very fast with all the girls that he is with but marriage was never a serious thing until now. How do I tell him that I think he’s moving too fast? Should I even try? Her father for what ever reason has already given him his blessing. 
I personally believe that they want to live together but some of my family can be pretty traditional and they don’t want to face any criticism. 
What should I do? Any advice would be greatly appreciated, thank you. ",13Dec2018,1
26,"Hello,

   I'll start with the basics. I am:

* 13 years old
* I identify as an apache helicopter
* Chinese
* A ""nerd""

The problem I've been experiencing recently is total loss of motivation or interest in life. Combined with the fact that my parents have recently put harsher monitoring on my computer (well, yes, I DO have many ways around that, but most of them have a catch - they would notice that I'm getting around them if they bothered to look), which means that the amount of social interaction I get outside of school is basically zero. All of those factors combined makes me wonder - what IS the point of getting up every day? Yes, you could say that right now I'm preparing for my future - if that's the meaning at this point, then I would say I'm doing a decent job. I've gotten most of single variable calculus under my belt (past AP Calculus BC level), linear algebra, discrete mathematics, etc. In physics I'm about AP level, biology, beyond AP level (verified with past tests). I've become interested in machine learning and programming. However, I'm afraid to advance too far or spend too much time in any of them - after all, my future is \*\*very\*\* uncertain at this point. Which brings me to my next point - if I AM successful, so what? Get a good paying job, have a good family, etc. It's not like I'm ever going to make any significant impact on humanity. So what's the point of living? (note - I'm not suicidal. I guess I'm too much of a wimp to ever do it).",13Dec2018,1
27,"I always fear I’ll probably come off as to much to my friend. So I’ll send two messages and hope for the best. But I really do want to help them. At this point I just am hitting dead ends and I really want to be there for them. I can tell there blocking me. So I don’t know how to reach them. I want to be there for them. They have been going through a lot but fear of being to strong. I usually don’t tell them my true feelings towards situations. 

How can I help someone, and not come off as too strong? ",13Dec2018,1
