,text,time,score
436,"Throwaway for safety reasons.

I have a friend and we get along great, but whenever I meet her, she is pretending to be positive, she also has 13 as her lucky number, not because of any reason just to be positive, she says. 

So I asked her why she's always pretending to be positive and she told me that she is really sad, like really sad. She also draws a lot (really talented) and likes to travel. But out of all these things she does, she doesn't really enjoy them and she also states that she is not depressed. A big reason for her is working till she gets old and grumpy.

I get what she means by not depressed, like overall just sad. I'm really just sad and it also hurts me, because I thought she would've been a happy person. I'm not really worried about her in terms of suicide, but more worried about her mental state and how it isn't really nice to be just sad, like without a reason.

How can I help her? I don't really know what to do, when we're meeting I always feel how she's not really happy, just pretending to be.

TL;DR: Friend is sad but not depressed.

Sorry for my wording and grammar mistakes, I'm not a native speaker.",13Dec2018,1
437,"I didn’t get a call from my doctor- but I found some of the blood work results online.
So I haven’t been eating and practically only drinking water and lost 12 pounds in a month. 
Well I’m dehydrated and have a UTI. 
I’m still super anemic- and have elevated platelet levels.
But my glucose levels are normal. My vitamin levels went from low to normal. And my sodium levels are fairly high.

So being unintentionally anorexic and living off pretty much water diet has dehydrated me, but in some ways made me healthier? 

I don’t know what is going on.

So until I get a call from my doctor to go over everything I’ve decided to go on a fairly strict diet.
Dairy restricted. gluten free. Strictly fruits, vegetables, rice and fish- as well as daily exercise for at least 15-30 (starting with Pilates in the morning). I’m going to see if that helps. 

Doesn’t help that I’ve been sick as well- super hot and clammy- but apparently my hands and feet are cold as ice. I can’t find my thermometer, but a friend told me I was burning up. I feel nauseous and my throat hurts so bad. So I think I have another viral infection. ",13Dec2018,1
438,"I’m 23yrs old and sometimes I just feel like I’m so intellectually unaware and not sure how to make meaningful conversations and talk about elevated topics like politics or other things that are happening in the world, or like even general knowledge. 

It really bothers me because I know I’m not an idiot, I recently just completed my Bachelors and did well, but I just can’t help feeling worthless and just not able to pitch in into conversations and make smart comments or what not. I stay quiet and listen but I’d love to be able to actually know more and be part of conversations. 

Any advice or help with how to increase my ability to be part of meaningful conversations without feeling shy or stupid. ",13Dec2018,1
439,"I've reached an age where I should have outgrown wetting my bed, however I can't break the habit. My family says they can smell the urine even when it's not there(even after leaving my room and coming back much later) and I can't change my sheets every day. A urologist told me that I should be using the bathroom frequently, since holding it can cause my bladder to weaken and leak during the night. However, when I was a child, I had a habit of holding it and now I use the bathroom very few times during the day. Once when I wake up, once after I finish school, and maybe twice before I go to bed. I've already tried not drinking as much water, bed-wetting alarms, etc. ",13Dec2018,1
440,"I started working at a small law firm part time about 3 months ago. Originally, I was under the impression it would be unpaid and didn’t care as I just needed to get out the house. However, about 2 months ago, my boss had me fill out a W9 and asked for all the hours I’d worked so she could write me a check. Weeks have gone by and she hasn’t mentioned it again. Next week is my last week before going back to school and I’m unhappy that she hasn’t paid me or even brought it up. I don’t want to be rude and ask her for it but I’m not sure what to do. If I was paid minimum wage I’d be owed over $400 by now but she hasn’t even told me how much I’ll get hourly. I feel like I’m being taken advantage of or maybe she’s just that busy? I’m one of 2 employees, the other being her mom who also works part time and is paid. ",13Dec2018,1
441,"I recently had a date with this guy I’ve been talking to online. I wanted to actually meet him in person because we got along so well over the phone. We met, I honestly had a great time with him, but I just didn’t feel a spark. I assumed he felt the same way. But I got a text from him eagerly asking when we can go on another date and how he really felt a connection between us. I don’t want to accept a second date from him. It’s not fair to him if I don’t feel the same way but he does. How can I let him down gently? I’ve never had to reject a guy before in my life and I’m so afraid he’ll get angry with me. I’d love to have him as a friend because we get along so well, I’m just not interested in something romantic with him. ",13Dec2018,1
442,"Hi so tonight me and my gf are going to be hanving another girl over. This is the first timeafter two months of trying, and im excited. This has been a personal dream of mine since i realized what it is. I know if everyone is just comfortable we will have a good time, but i was looking for any advice on initiating or something, anything really

Thanks everyone. Sorry if this isnt the place for this type of stuff. If so please point me in the right direction. ",13Dec2018,1
443,My friend and I just took our white work clothes out of the washing machine and they have random ink splotches all over them. I checked the pockets and the drum when I noticed the ink stains and couldn't find anything that could cause stains such as a forgotten pen. I'm really stumped at what the cause could be. It's a communal washing machine for our accommodation so could the previous user have used something in their wash that affected ours? Thanks.,13Dec2018,1
444,"My cousin David had “medical complications” and passed away a couple of hours ago. 

Unfortunately, there was a lot of family drama that occurred the past few years: my uncle cheated on his now-ex wife, and she was obviously furious. She divorced my uncle and encouraged my cousin to cut off contact with him (my cousin was 30, so he was an adult and could make that choice). 

David did so, and though he kept in contact with my uncle’s side of the family, he soon distanced himself, as his mother pressured him to do so and he was tired of some of my family members insisting that he reconcile with my uncle. David really only talked to my mother and myself. 

We didn’t hear anything when David was hospitalized and died: we found out via social media, when his friend posted about it and tagged him. We tried to get in contact with his mother to ask about what happened and funeral arrangements, but she’s blocked us all. 

None of us live in the immediate area of David, so we don’t see his local newspapers. But several of us would like to be there for his funeral. How do we go about finding his memorial information if we don’t live in the area and don’t have contact information with people who might know?

**TL;DR: my cousin died and due to various circumstances, my side of the family might not be notified with funeral details. How can I go about finding his funeral/memorial details?**

Thanks in advance. ",13Dec2018,1
445,"Me (M) and my friend (F) are attending the same university classes of this guy, that keeps texting her asking to go out on a date or to study together, although she keeps declining his invites and always leaves him on read. Worst part is that he wrote her more than once (in a ""joking way""), that he might come to her house to see her. What should I do? She is becoming annoyed and scared, but she doesn't have the courage to confront him. What should I tell him?",13Dec2018,1
446,"I recently got married and my husband is very well off ($70 mil).
We've been dating for 2 years, engaged for 1 and got married 4 months ago. His money is inheritance because unfortunately his father passed away shortly after our wedding, up until that point he was a COO of his fathers company living off of his paycheck which was amazing (55K monthly) but this amount of money is on another level (for me). He's the CEO now. 

I come from an upper middle class family,two parents and three kids, we all went to private schools and got cars for our 16th birthday but we certainly didn't have the Richie Rich childhood my husband had. My parents got everything they have through hard work, they both come from poor families and have always supported their relatives who unlike them,never pursued higher education and were comfortable working low wage jobs and being on food stamps. 
They're the type of aunts,uncles and cousins who only call for money and don't pick up the phone when we call them with job offers or to ask how everyone is doing. That was one of many reasons why they weren't invited to the wedding, other one being that it was a smaller wedding of 50 people closest to us. They weren't upset until they found out that my husband and I didn't sign a prenup, thanks to my rambling sister. 

They've spent every day since calling, showing at our gate at random hours, coming to my husbands company and staying at the lobby until escorted out by security and one of my uncles threatened to go on a hunger strike if we don't give them money. They each want 100K which would be a total of $2.3 million. My late father in law was a well known and respected businessman with an impeccable reputation and they've threatened to take this to the press and lie about all sorts of things to get what they want. We could legally disprove whatever they say, but we don't want the unnecessary attention. We appreciate our privacy very much! 

We don't want to give them the money that will go towards parties,drinking and buying jacuzzis. They've been offered jobs multiple times but always refuse. 
We also don't want to put them in jail because it would further complicate everything and at the end of the day, my parents care for their families, it's hard for them to accept the way things are. 
If taking legal action becomes unnecessary, how do we proceed to tell them without jeopardizing anyone? We already have top notch lawyers but they're very insensitive to the subject.

This whole situation is putting so much pressure on me, I began my infertility treatment a week ago and this amount of stress and negativity is putting the whole thing at risk.
Is there a way to solve this without involving the authorities?Any advice at all? Thank you! ",13Dec2018,1
447,"  My sister has always been fairly on the skinny side, not unhealthily though. She has done gymnastics and other physical activities for a long time, her choice completely (im only clarifying this so that no one assumes she was pressured into this.) As someone who became overweight around this time because of the same fucking shit my parents did, I can say that them not intervening absolutely fucking ruined me. I am 19 now and am finally realizing how much this shit has really negatively impacted my life and over the last two months I have been going to the gym and have lost around 20 pounds (was 285 to begin w and am now 259, yay!).

  Anyways now that you have some background, on to the issue. Lately she will not do any physical activities WHATSOEVER. Totally sedentary lifestyle and jokes about not doing exercise but then actually just doesnt do it. She eats constantly and when I say she has gained weight, its a lot. We took a trip to the beach this summer before school started back up and she had stretch marks from such rapid weight gain. I am just really concerned she is gonna fuck her life up like I did and regret not maintaining herself. I am not going to be a dick and say anything behind my moms back obviously but I am just concerned. What do you guys think I should do?

TLDR; Sister has gained around 50-60 lbs in a year from becoming totally sedentary, will not exercise at all and I am really worried for her long term well being.",13Dec2018,1
448,"Hi, I'm looking for different ways to make money \[legally\]. I would like to make up to $100 from now to Sunday. I know it is hard, but as of right now I really only have afternoons to do anything since I work my full time job during the day. Right now the only option I have is to do Lyft every night, but I dont think I will make too much since my area is not the best for that. 

Any ideas would be greatly appreciated.

&amp;#x200B;

I am 21M located in CT, USA.",13Dec2018,1
449,Hi! I was wondering what subreddit I should post a scary story/creepypasta to? Thanks!,13Dec2018,1
450,"I got suspended for flipping out after getting told I was sexually harnessing some random girls i don’t know. I am going back tomorrow and nobody has heard what I have to say, and teachers most definitely heard about the rumors. What can I do to calm my anxiety? I was thinking of trying to buy some Xanax to calm myself for tomorrow.",13Dec2018,1
451,My dad left me a house about two hours away about four years ago. We are required to stay in this parish because of a custody issue. It breaks my heart to see the house deteriorate because we cant get up there very often. I need the best advice you have before i call a realtor and put it up for sale. Ive never owned anything or sold anything like it. Thank you!,13Dec2018,1
452,"I know the #1 advice is to get a job. And I do want one. But I've been shuffling jobs my entire life and always end up having to leave due to an anxiety breakdown or due to depression. So while I can and will get another job, I will 100% leave it shortly after (even though I don't want to leave).",13Dec2018,1
453,"I know it’s bad to do that, but I felt insecure in the relationship and paranoid he’d cheat on me for reasons I’m not gonna bother typing out atm. 

Anyway, I was using his phone to text a friend of his that I hadn’t spoken to in a while (he let me). My bf went to shower and while I was texting that friend, I thought, “hmmm, lemme see who else he’s texting”. I was scrolling through his texts, there wasn’t much, and found a female name I didn’t recognize from two months ago. As I read their short conversation it appears as though they’re coworkers. They were talking like they’re best buds. It seemed like she was asking him to extend his shift til 7 (couldn’t fully understand the context) and he said that’d be better for him. Then he asked if she wanted to grab dinner afterward, and she asked where, and he said “lol making the man decide, huh?” I cant remember what else was said but he cancelled on her and there were no subsequent texts between them. 

It strikes me as odd because he always tells me what his plans are and with who (on his own volition). A few times he drove a female friend home and he told me, I didn’t mind. But I never heard of this woman before. It’s got my mind reeling, and now I’m thinking “if these are his texts, what could possibly be lurking his Instagram DMs or Facebook PMs?” 

I’ve always been too afraid to snoop, because for one, I don’t like the idea of invading someone’s privacy and two, I’m afraid of what I might find, something that’ll confirm my suspicions. He does seem really committed to me, but you never know. Am I just being insecure? Am I making a big deal out of nothing? 

",13Dec2018,1
455,"So I’m living with four other guys from my fraternity, we’re all friends, get along great, but they’re in the same pledge class so they’re just a bit closer. This is relevant a bit later. We’re college guys so of course we’re going to be messy, the kitchen gets trashed on the weekends so we end up cleaning. Four of us, myself included, all clean up when we see stuff out, dishes, loading/unloading dishwasher, trash, really basic stuff. The last guy though does nothing but play Fortnite, all day, every day, to the point where it’s 2am and I can still hear his call outs through my wall.

I really don’t care what he does in his free time, but he never does chores, we’ve taken his xbox once and forced him to do chores, but after that the other three guys gave up. I’ve found up to ten of our cups on his desk, so his excuse of “I don’t cook so I don’t have to do dishes.” Doesn’t fly, but two of the other guys want change but are apathetic towards it, while the other defends him saying “MoreThanFour, you’re just as messy.” Referring to a dish or two left out after cooking, something everyone is guilty of. 

I like the guy, he’s a good friend and roommate, but how can I get him to help contribute or get the other guys on board with enforcing chores?",13Dec2018,1
456,"To clarify, my friend (called Owen from now on) is NOT a diagnosed schizophrenic. I live in the UK

Owen has a number of recurring symptoms which (from the result of my quick Google search) seem to only appear in schizophrenia:

- he’s been having auditory hallucinations on and off for at least 2 years

- he’s recently started having visual hallucinations (for about a month as far as I know)

- he has recently socially withdrawn when he used to be extremely extroverted

- he is apprehensive of certain people, namely (and annoyingly) his parents and doctors

I’m not going to ask for medical advice here (it’s against the rules) but you can see why I think this is the case.

Obviously these can be extremely dangerous especially if untreated, and I want Owen to see a doctor before he withdraws even more. He agrees that he should tell his parents or see one alone, but ‘turns off’ every time I mention it - just saying ‘ok’ or ‘ye’. I should mention I don’t talk to Owen at all in school; only ever through messaging. 

Only me and Owen’s girlfriend (called Evie from now on) know this is happening now, because he told me and I persuaded him to tell her. Evie and I have spoken a little about it, but we have no idea what we can do to help.

What do I do? I don’t want to intervene and risk hurting him, I’d much rather persuade him to do it himself. I don’t know how to help. Thank you in advance for your support.



",13Dec2018,1
457," Isolation, and shunning society used to seem like a favorable way of life, because it felt like a healthier alternative than contributing to a social system I didn't wholeheartedly believe in. The world is complex and full of contradictions, and I felt like my *inner* world was the only stable thing I had any degree of control over, so if I could successfully build my reality within it, there would be no need for anything external beyond the basics like food and shelter.

As stable as my reality feels, I'm now realizing that I need to ground myself in a *collective* reality if I want to avoid falling deeper and deeper into depression, and eventually madness.

Much as I hate to admit it (because it brings my isolated existence into question), I'm still a social creature at heart.

I'm in great need of a new value system, but there doesn't seem to be anything unquestionable and stable that involves others and sets me on a clear path for the future.",13Dec2018,1
458,"I was always very bright and very anxious, and when I got older school became a major point of stress for me. I’ve been struggling along for years just to try and get an associate’s degree and I finally realized that this pursuit is ridiculous and that filling my life with depression and anxiety to try and do something I really don’t want to do is never going to satisfy me and is a waste of my time. There are other ways to make money and not being a student is not the same as not educating myself. 

But, even though I know this is true, I am feeling tremendous guilt and shame about my decision not to return to school next semester. I love learning and I love the idea of school, but it exhausts me and fills me with dread and I just can’t keep living like this. I need to find a way to redevelop my sense of happiness and self worth, to really claim my decision not to continue with college at this time in favor of improving my mental health. 

So my question is, for those of you who were “destined” to go far in higher education but then chose not to, how did it go? Are you okay? What changes have you made to maintain a positive perception of yourself? What do you do for work? What ways do you educate yourself? Essentially, what is life after you put school on the back burner when school is the thing everyone has always used to define you? 

",13Dec2018,1
459,"The company I work for produces way too much plastic waste and doesn't have recycling or composting facilities. It's all about hitting sales targets. And, I would like companies like it to go out of business. They're bad to our environment.

But, I can't exactly afford to strike and get fired right now. I'm so conflicted. I feel like a coward.

Should I strike anyways?",13Dec2018,1
460,"Essentially I told her I didn’t want to be friends with her because she’s a total narcissist and is incapable of helping herself with her problems. Her mother and father have given her the world, she’s medicated and the whole nine yards. She still blames all of us (her friends) for this attention seeking behavior like drug use, and talk of suicide. 

We’ve told the school so many times she’s suicidal and a druggie but she denies it and life goes on. 

It’s obvious she’s only doing this for attention but we don’t know what to do. Police have failed, school has failed, and now I might get into trouble for wanting to cut her off. 
",13Dec2018,1
461,"Hello, My apologies if I am posting in the wrong place.

I own a small business and have 3 landlines coming in. I would like to setup an announcement only voicemail on two of those lines. In addition, I would like to have the announcement play at different times each day. for example, mon/tue/wed, we close at 5, so I would like it to start at 5. Thu/fri we close at 12, so I would like it to start at 12, and sat/sun we closed, so I would like it all day. 

&amp;#x200B;

I have searched google, and have run out of ideas, so here I am asking. Is there a service, or device you can recommend to fit my needs.

&amp;#x200B;

Best regards.",13Dec2018,1
462,"So I [16f] take the bus to school every morning. I usually take the earliest bus because I get to my bus stop pretty early every day. I have a friend who I’ve been friends with since freshman year and now when it comes to sitting next to him I get nervous and I really, really don’t want him to sit next to me. He usually does, though, since there’s so many kids he ends up being one of the last ones, which means that my space alone in the single-seater all the way in the back will be taken up with him.

He likes to hold my hand a lot and hug me, and in freshman year I usually let him because he was my friend and I didn’t find anything wrong or weird about it. About a third of the way into the year he put his arm around me and grabbed my boob which was completely out of the blue and I swatted his hand away and I didn’t talk to him for three weeks. Since then he hasn’t tried anything like that but I’m still really conscious of the memory. Only a few people know of the boob grabbing and I never reported it to a teacher or told my parents or anything like that because I don’t want to get my friend in trouble.

Flash forward to now (I’m a junior now and he’s a senior) I got really aware of my absolute dread to sit next to him this morning. He went to hold my hand and I limply let him grab it. He hugged me for a while and I was just trying my best to ignore it, and he put his head on my shoulder and I felt extremely uncomfortable. I just don’t want him to be so on top of me all the time, and I don’t know how to talk to him about it without seeming like a jackass. What do I do?",13Dec2018,1
463,"My grade is currently an 89, 90% is the cut off for an A-, I want my grade to be 90 if possible. It might not work out but I at least want to try requesting, the most she can say is no. I've been pretty active in her class, and attended most lectures except the last 3. She knows my name in the class of over 100 students. I've asked her questions after class and stuff too. So can you guys recommend me a good way to email her? and like what to include in the email.",13Dec2018,1
464,"Okay so throwaway for obvious reasons as you’ll see in the near future. But here goes.

So ever since I turned like 14 (I’m 16 now) I’ve had a ton of pubic hair. Like A LOT. We’re talkin’ it spreads out into my inner thigh. Now it’s a good 1 1/2 inch long and I don’t know how anyone would feel about it given the chance to see it.

SHOULD I SHAVE IT?!!",13Dec2018,1
