,text,time,score
306,"I’ve had this best friend for 4 years and we were once really really close, we told each other everything and we couldn’t do anything without each other. Now that school has started she just stopped talking to me often and has stopped caring about me coming over or even doing anything with her. And last time we hung out (my birthday party with many other friends there) I tried talking to her she seemed very annoyed at me and actively tried to avoid me while she talked to other people enthusiastically. I am very positive that when she starts college next year we will most likely stop talking all together and our friendship will be dead. What hurts about this the most is that SHE was the one who was so close to me when this started and she was the one who always wanted me to hang out with her and she encouraged me to be closer with her and tell her everything. It seems that she was super into me and just got bored of me and is now super interested in my other friends. For my birthday present she gave me money but for my other friend she gave a lengthy heartfelt letter and a lot of inside joke presents that he valued deeply and it took a lot of effort for her to get. So I know I need to move on and focus on myself but it’s just so hard, I can’t stop thinking about her. How can I move on? ",13Dec2018,1
307,"I've always had a fucked up sleep schedule, and it's severely impacted my life. I consider myself a night owl, meaning I'm usually up til around 2 am even if I have to be up for work at 8. 

Now that winter is upon us (Mid West resident) I'm finding it much harder to drag myself out of bed, to do the absolute minimum of getting ready every day. Also having to start my car and do all the ice removal that comes with that. -_- 

anyway, I want to start getting up at 8 am every day, but I always stay up way too late, and end up sleeping til like noon.
What can I do to be more consistent with the time I'm getting up, and how do I make it easier to get out of bed in the AM? 

TLDR: Trying to wake up at 8 everyday, fucking that up on weekends, also getting out of bed is my worst enemy. Help? ",13Dec2018,1
308,"I feel dead inside. Im in a shitty situation band I need to figure out what to with myself soon, or my life could be in danger. I need to get my shit together but I just can't do it. There's no point, I'm always so tired and I hate myself. I'm too scared of failure and I hate mys of too much.",13Dec2018,1
309,"Long story short it’s been a rough year for my husband and I. Our Switch is under a pawn loan and I really wanted to get it back to him before Christmas, but as it stands, we’re barely gonna be able to make it on groceries and rent, if we even manage that. Every other bill is taken care of. I just wanted to see if anyone had advice on little ways to make money. I’m working Door Dash right now but my area is very slow as I live in a fairly small retirement town right now. Thanks in advance. 💕",13Dec2018,1
310,"I’ve been let down a lot in the past and now it’s hard to ask for stuff now. I’m trying to move in with my mom and it’s been different to say the least. The other people I lived with kinda let me to raise myself, and doing anything extra wasn’t an option because that wasn’t their job. The problem here is that my mom keeps wanting me to do stuff and speak up if I need/want something, but it’s really hard (she doesn’t think it’s natural for a kid my age to be paranoid and have such low expectations for things I guess? I don’t know.). Even asking for things like food, toothpaste, or feminine products is hard - she’s always is the one to ask me if I need something. I really want to take up a sport and learn a second language this year, as it might be my last chance to experience stuff like that, but I really have no idea how to ask. I’ve been let down so many times that I don’t think it’s going to happen, but she says she can make it happen. I need advice on how to get over this because I’m only holding myself back at this point. ",13Dec2018,1
311,"Okay so. Currently I pay $285/mo for health insurance that covers pretty much nothing. $7000 deductible means I still can’t afford to do the things I really need to like see a psychologist. 

Anyway, my husband got a job in August that will allow me to be on his plan with him. I have until the 15th to pick a new plan on my own, which will be $100+ more with a slightly lower deductible. His work enrollment opens in January. My dilemma is this: do I select a new plan for the sake of not allowing my coverage to lapse, or do I just wait until January when his work enrollment opens and hope that their plan is cheaper? 

I don’t know a lot about healthcare and it’s all kind of overwhelming. Halp",13Dec2018,1
312,"Ive been struggling with my mental health for years and many people in my family suffer from mental illness ( mother, grandma , etc) and have been hospitalized for it.

I’m sure I have a form of depression and anxiety but I think I may have borderline personality disorder. The idea was brought to me by my boyfriend , he began researching stuff about mental illness after dating me for about a month or two. He began to pick up on my patterns and he got concerned . Ever since I’ve talked to people with it, read about it and it really does sound similar to what I struggle with everyday . My question is : how do I get diagnosed? How do I go about getting some kind of treatment ? I live with my grandma and she’s been suggesting I may need some help as well. I just have no idea where to begin . ",13Dec2018,1
313,"I'm 21 now and I have zero self confidence, I go to the gym almost every day and eat right but I'm still really overweight, I feel like I've been fighting this uphill battle for to long. I just can't stand the sight of myself, I don't even have mirrors in my room anymore because my reflection bums me out. What am I doing wrong? Am I really as ugly as I think I am or am I just to harsh, how do I improve my self esteem? Thank you.",13Dec2018,1
314,21. Male. Please message me. Feeling super bad :(,13Dec2018,1
315,I’ve been pretty drunk before but never blackout drunk. I just want to do it at least once for the experience. ,13Dec2018,1
316,"I'm at a loss to explain my next-door neighbours' (M, F)  behaviour. They seem to have a very loud relationship, but close ranks if I poke my nose in. Tonight they had a loud argument (wouldn't call it a domestic exactly) and I went out to run an errand. When I got back at 11pm, I noticed someone parked in my spot. When I went to check it out, there was the Female and her daughter each sleeping in their respective cars. 

&amp;#x200B;

I don't want to jump to conclusions, should I call the police?",13Dec2018,1
317,"I tried to kill myself yesterday. So I drank only few drops of Windex. But now I feel like my throat is burning and sever abdominal pain even if I just drank few drops. I’m worried if I go to the hospital and tell them, they could hospitalize me to psychiatric wards. What should I do...?",13Dec2018,1
318,"So a friend of mine lent me her canon DSLR (can't remember the exact model) and after moving into a new apartment, I can no longer find it for the life of me. I have called several friends who I believe would have it if I didn't but none of them do. I have also scoured my apartment and storage space but no luck :( .

Today she asked me how her camera was doing and I have not yet answered her message since I'm at a loss of what to say to her. I feel really bad and I really value our friendship so I don't want this to ruin it :( . I am planning on buying her a newer model DSLR to replace the one I lost, but what should I say to her until then ? 

Any help is appreciated! Thanks ",13Dec2018,1
320,I’m a high school drop out who finished a high school online called penn foster but I feel like it was a waste of time and not something legitimate even though I received a diploma and transcript for the 12 courses I completed. What should I do next? Should I try to go to college? How do I fix this mistake and not feel incomplete and a failure? ,13Dec2018,1
321,I’ve been feeling lost in terms of what I want to do with my life. I never really knew what my passion was and I need help in finding what it is. Maybe this conversation will help others in their search as well.,13Dec2018,1
322," 

My teacher is a lovely woman (she has helped me get a college place for next year and such) but she has been going through a rough patch at the moment. She is having a divorce and it has been very difficult and the school have not been very easy on her.

The other night she had several glasses of wine over a party at the school. And she was not in a good state. The cops in my area (understandably) are very rigorous and had she got pulled over her teaching career would be finished.

I didn't want this to happen, so I (I don't drink and am teetotal) drove her home instead. I have told her I will not tell anyone about this incident (in a way that would identify her obviously) but in return I want her to get cleaned up and that she should get a good rest over the Christmas holidays. She has not been herself and I hope she can come back from this.

I genuinely believe that she can come back from this. I am male by the way, so this isn't some women's bond type shit, if the teacher was male, I would help them out just as much.

I lost a cousin to a drink driver so I know about the damage they can do so I am not trying to make light of drunk driving.",13Dec2018,1
323,"How do I ask a guy for his number, I've never talked to him before. ",13Dec2018,1
324,"I am in a terrible situation and I know I’ll get heat for this post. 

I have a great job, doing exactly what I want to do. 3 years ago, they remodeled our office into a terrible open workspace. I sat with a group that I got along with, which made it not-so-terrible. It turned out that I got along really well with the guy I shared a workspace with, also married, and we developed a close friendship. Around the holidays last year, I realized that we were getting too close (emotionally, not physically), and pulled back a bit to respect my marriage.

The guy got upset and stopped talking to me completely, which is obviously awkward. I tried to be cordial and he was not responsive. They rearranged the space again and now we sit on our own. In June it got to a breaking point and he was being openly mean. He yelled at me about a project we were both working on and I made an official complaint. He thinks that I was being manipulative by being his friend and now I’m trying to take his job. It feels like I’m going through a terrible breakup and having to sit next to the person for 40 hours per week, so obviously my stress level is through the roof.

My husband does not know the whole story but he does know that I have been having a tough time at work. I have been interviewing but due to the nature of my job it is difficult to find a position quickly. I am the primary breadwinner and have the only benefits, so I can’t just leave or we will lose our house. I have been a finalist for several jobs after a lengthy interview process only to be told I am overqualified or that I am being considered for another position that will open up in the future. I just found out that I did not get another job yesterday, and my husband picked up a night shift, got home late, and then told me a long and ultimately inconsequential story about his day after I had been crying in the bathroom at work and all evening about not getting this job. Then he made a joke about how he makes no money.

I am so resentful of him. I need to leave this job and he is not supporting me emotionally or financially. He has a degree but has the same job we had in college. My hair is falling out due to stress and I am shaky and constantly tense. I was very outgoing and positive at work but now I don’t have the energy for small talk and just want to do my job and leave. I cry on the way home all the time (and I am not normally a crier). My husband works some nights and weekends so even when I am in a sane environment I am often alone dwelling on work problems, waiting for him to get home. I am so unhappy and I don’t know what to do. I love my husband and he is normally a very sweet and loving person but he obviously doesn’t get the seriousness of this situation. 

How can I move forward while keeping both my job and my sanity? How can I smooth things over with the guy at work enough that we can work together? How can I make my husband understand this situation without hurting him? I am at a total loss.",13Dec2018,1
325,"Im a sophomore 16m and there’s this girl I like a lot, we don’t know each other exist, and I don’t know anything about her. I only see her in the hallways with her friends during passing period and I don’t know how to approach her with out embarrassing everyone in the area or what to say to her. Any advice I would appreciate so much",13Dec2018,1
326,"Hi all,

I'm not sure if this is the right sub to post this on, but I'll fire away anyways. So, a few months ago, I found that I had a new cousin. Her father got around a lot and always went to other states. Here is where things get scary AF. Apparently she was born out of a sex cult. Her father would have sex with many women and then sacrifice the children to Satan. So they literally would farm out babies for sacrifices. Luckily for her, she was sick as a baby, so she wasn't deemed ""pure"". One of the women turned her in to one of their cousins to raise her. Her father made a fake birth certificate for her when she was older with the name of him and the woman. So now she has no ""real"" identity. Honestly, her life starting from birth seems like a fucking mess. Her first cousin took a DNA test with her to confirm the relationship. WTF can we do to fix this?",13Dec2018,1
328,I have an essay do on the definition of happiness and I don’t want to put down the basic “being with family and friends” I want a true deep meaning but can’t think of anything. Any ideas? :/,13Dec2018,1
329,"I've been heavily relying on cheating in my school and I think its getting out of hand. I really want to learn but I see myself taking the ""short cut"" out since I have such limited time and I'm so tired. The problem is if I immediately stop cheating, I'll start failing my classes (which I want to avoid at all costs.) I know its wrong and I feel extremely awful about it so I really need some advice on how to stop without automatically failing. ",13Dec2018,1
330," how to bring a multitool throught airport?   
(europe)",13Dec2018,1
331,"When I asked where he was in our lot so I could take a look, he said ""I'm not gonna be late to work.""  I suggested it'd help with the insurance if he let me see it and he revealed that he was already gone. I asked, ""You drove away with a broken rear windshield?"" and he answered ""I'm not gonna be late for work!""  
For good measure, I filmed myself walking the whole parking lot looking for a broken glass or a tree branch that could break a car window.  I found nothing.  
Is there any chance of this guy getting something out of us?",13Dec2018,1
332,"Im just a dumbass kid and don't know who to ask or what to do. my friend crashed my car and I don't know if his insurance is able to be used since he was in my vehicle. Do I have to go through my insurance? If so, that would blow because my rates would go up. I also don't wanna be a dickhead and make him pay out of pocket if it's like $1,500 or some shit like that. ",13Dec2018,1
333,"I'm currently job hunting, but managed to get a job full time but only the last half of November and December. The manager said he couldn't offer me a job afterwards, as they would already be overstaffed the following months, but that the job could give me a foot in at the other stores of the same chain, owned by the same two men(whom I have not met). 

My problem stems from my colleagues. The manager seem to like me, but the 3 other workers dont.. The first few days were fine, they are kind of a joking, sarcastic bunch of people, who didnt talk much aside from handling customers. There is only one girl besides me.

I dont know if its me, or if its the stress of christmas that has gotten into them(its a bookstore), but they don't respond to anything i say unless its a work related question. Sometimes i get a nod or a ""mm"". Its all throughout the day, but an example i remember, because i just got off work, is when i said ""see you tomorrow"", they looked up at me, but back down quickly with no answer. 

This really points to them not liking me and ignoring me on purpose. If this is the case, i dont know if i should say anything, as the job is only temporary. But i'm kind of scared of them speaking badly of me to the manager, when he will probably give me a personal recommendation to the other stores, as he hinted at that. 

BUT maybe there is a small chance this is not the case. As by observing them, they dont really seem to smile at anyone, not even customers. they dont talk with any emotion. They're kind of dead. Which is why i thought maybe they were just stressed and in bad moods. I myself am very bubbly and smiling often. 

I am just overthinking this way too much, and its giving me a big knotted ball in my stomach. ",13Dec2018,1
334,"Is there a guidebook or a list or a journal that helps someone organize as many aspects of their life as possible?  


I have ADHD. While I'm trying to get it under control, I can't take normal ADHD medications and that means I'm feeling more out of control than usual. I keep forgetting to keep up with basic day to day routine stuff and even miss even the big ones (like ""pay parking ticket""). I struggle to leave on time and it's been really embarrassing.  


I struggle with self discipline for *sure* but struggle with planning myself in the long term. I want to be able to organize myself better so that I can devote more time to the things I *do* enjoy.",13Dec2018,1
335,"About two years ago, I came out of grad school with a PhD. Like most people in academia, I had this dream of becoming a teacher, but as you may know the job market is extremely punishing. (Out of scores of application, the only offer I got was for $12k a year, no benefits.)

&amp;#x200B;

I took a different job at my undergrad alma mater - not a teaching job, but a job that would let me use my skills in a different way. When I was hired, the vice president - the head of the office - told me in no uncertain terms that this wouldn't be a gateway to a teaching job. I know this because I wrote it down during the interview (taking notes is a habit). She said, ""If you work here, you work in this office, not in X Department if they want you to teach a night class.""

&amp;#x200B;

Fast-forward two years. Turns out I don't really want to teach anymore. I like what I do now! Plus with all the politics that go into teaching, it's a minefield I don't want to reenter. But in casual conversation with Coworker Jeff, I learned that Coworker Hank has taken on an adjunct teaching position at the university, in addition to his role in this office. Hank was hired a little over a year ago in an administrative assistant role and reports directly to the VP who told me that I was expressly forbidden from taking any teaching position. Our roles are both 8-5 jobs, but I'm sensing that Hank might have gotten special treatment because of his proximity to the boss.

&amp;#x200B;

Am I right to be furious about this apparent double standard? It seems irrational to me because it's not even an opportunity that I want anymore, but I don't know that I would have felt this way two years ago. But I know that I'm angry, and I don't know why. I feel like a dope for listening to my boss and not trying to break the rules outlined as terms of my hiring, when it seems other people aren't put under the same restrictions. I also feel like I've gotten my first dose of ""loyalty will get you nowhere,"" and I'm wondering if I'm ready to move my skills to another organization.",13Dec2018,1
336,"A bit of a backstory summarised

- There's this girl I've been into for years now, went to high school together 

- Asked her out a few years ago, she said yes but declined later saying she's busy  

- I've advanced both physically (I'm pretty fit and dress well now) and mentally (much more charismatic and socially approachable)

- I wanted to ask her out a few months ago again but she had the hots for my socially awkward and shy friend

- They went out once but I'm pretty sure they're not together anymore or if they ever were

I'm going to a party next week where both of them will be there, how do I go about approaching her and how do I flirt successfully for her to know that I'm still interested whilst my friend is there. 

I don't want to come off as rude to my friend but in honesty I'm sure they weren't or aren't together, I'm from Europe if it changes anything.",13Dec2018,1
337,"Well I'm currently unemployed and looking for a job. I am expecting a job interview come this January. Well I am in the aviation industry and knowledge and theories and whatnot are an important aspect of the work, so basically I need to hit the books as they say. Thing is, I have been on a down time recently and trying to get back up on my feet. I haven't exactly held my notes, books and reviewers for a long time. If I have to be honest, I kinda have a tendency to be distracted when I'm a bit overwhelmed with reviewing. But I need to get this job which means I need to hit the books hard, so any advice you can guys give me so that I can be more efficient. Usually I get the job done with how I study, but I just feel like I need to up my focus game especially since it is for a job interview(with a written exam)that I am studying for.",13Dec2018,1
338,"I got offered a position in a city 8 hours away. I would need to buy a car, get an apartment and move in exactly a month. Is it doable? ",13Dec2018,1
339,"I have never been able to have my own pets but I’ve pet sat many times for my neighbours cats since I was a teenager. I’ve always wanted to be able to hang out and care for a dog but I’m not sure how to do this without seeming weird or odd. I don’t want money or anything. I feel like a dog could actually be therapeutic for me. 

My neighbours cats have grown up with me but they’re getting old and aren’t the same as dogs are. I’m just wondering how I could go about spending a few hours a week or so with someone’s dog.",13Dec2018,1
340,"Last night a group of friends and I were drinking and I was talking with this one guy and we were talking about likely couples in our friend group. I confessed that I thought that my best friend and another mutual friend (let’s call them Emily and Jack) would be cute together. I know that Emily and Jack like each other but are afraid to make a move, but it was private and not supposed to be shared with anyone else. The friend that I told, who I’ll call Alex, won’t tell anyone else, but I feel awful for telling Emily and Jack’s secret. I didn’t even realize what I had done until a couple hours later. I have a lot of guilt about it. I plan on talking to Alex and making sure he doesn’t say anything about it, but I have no idea how to trust myself with any secrets ever again. And there’s probably a lot more facets of this that I’m forgetting are issues right now. Any advice at all would be appreciated, thanks",13Dec2018,1
341,"it's with a separate roommate and my mom. The rent is 2600 and we'll split it 3 ways ( so $800 each or close) utilities too

just seems easier then paying for everything by myself. 
I know the social stigma tho 
",13Dec2018,1
342,"Nov 9 
Nov 10 goes to a friends house party right after my surgery w no concern. Which is bs.  Then the bar. Out for two hours. Not bad but i texted I needed to pee and he wasn't here to help for awhile. Suffered. Not okay. Then plays video games w a woman, lies to me when i asked who he was playing with. Says a bunch of dudes. I see a message pop up from a girl and realize he was voice chatting i.like the way you use that gun. Im so mad he lied. 

Nov 12 at bar for two hours. Telling me a girl hugged him and he pushed her away. Then later saying he didn't push her away, just shrugged? Wtf. I get a text saying he's inappropriate from unknown person w a fake acct on fb. I dont tell him. Fn mad. Tells me as well im just playing games w him basically?!  Deflects everything it seems bc this chick was hanging around w him rt before me until 3am. Cool. He was def flirting via text in the past. Someone sent me proof. So why lie?!

Nov 13
Gets drunk, yells at me for dropping something at 6am when I'm disabled and its hard to reach crap. Keeps trying to pick fights.  Esp over money when he knew I wasn't rich and my situation.
 Blamed the alarm not going off on me? Wtf?! I dont even know how to set it. 
Brings up my jealousy which is really boundaries. Sorry your bff wants to f u, and I'm not okay w that. Cool double standards. Or I'm not okay w you hugging girls you've fd or led on, and lie to me about it. Say you never hit on them, but really you seem to get plastered in the past and do whatever. Discovered he also fd a girl hours before moving me in. Maybe he thought i would bail, but he has no morals obv.

Here's my main issue. I can go get assistance to move, it'll take time anyway, so I feel weird being here and angry for now. I'm fuming inside until I can get the f away. Anyone have any suggestions how to cope mentally? I dont think I'm over reacting, but if anyone has a different perspective let me know. 
",13Dec2018,1
