,text,time,score
37,"For the past two weeks my life is not going the way I expected it to, but that’s fine. Recently I have been laughing more and talking to myself a lot more than normal. Before I use to think everyone talked to themselves, but the more I actually pay attention they really don’t. I talk to myself as if I’m two people. I tell myself I need to do this and that. But then I respond to myself by saying no I can’t do that because of this or that. So I’m going back and forth in a conversation with my self. I really am concerned about it is that normal?

Another thing is that I have been laughing out of nowhere. It’s not like I’m using the bathroom and I start laughing spontaneously. I laugh when I feel down, insecure, or try to hide something. I make myself laugh usually when I’m alone. 

Am I going crazy or do other people do this too?",12Sep2019,1
38,"I’ve noticed that time is moving by faster and faster as I age. I’m only 17 but I’ve been diagnosed with depression since I was 12. My guidance counsellor in middle school told me “time will fly by before you know it” and I thought “what a stupid thing to say” now I’m fucking scared. I’ve watched my parents grow up in front of my own eyes, my childhood dog is getting old, I don’t talk to any of my old friends from elementary or middle school. I remember being in grade 6 crying myself to sleep because I didn’t want to grow up, most kids in grade 6 can’t wait till they’re adults. I’ve realized that I am not like everyone else and I don’t want to be. All my friends and piers seem so content with working a 9-5 till they die. Why? Why live like everyone else when you can live a life of your own.",12Sep2019,1
39,"WARNING: Could be triggering to those who are survivors of sexual assault/abuse.  Also, this is going to be a long post.

So for those of you who follow the news, recently the Emily Doe of the Brock Turner case revealed her identity as Chanel Miller. Turns out she's an Asian American woman, I'm an Asian American woman and it was empowering to see her coming forward. It really inspired me to share my story, for the first time, face-to-face with someone. I felt that my therapist was the safest person to tell it to and it was the most positive experience I couldve received. 

The first I ever spoke to about this was when I was 19. This was a romantic partner of mine, who was very unsupportive of my story. He told me ""Arent you glad you didn't tell anyone? Think about how broken apart your family would be if you did. That's your mom's brother."" Not once had that idea ever come across my mind. He instilled in me, fear, and after that, I knew that I could never ever tell anyone in my personal life about my sexual abuse story. 

I was only 6-7 years old and it was my mom's then teenage brother, who assaulted me. For this story, we'll call him Dee. 

The first time (at least I think it was the first time) it happened was one day when I was visiting my grandparents home. Dee asked me if I wanted to play frisbee. I remember we went out into the backyard which was fairly big. Towards the outskirt of the backyard was a shack and two abandoned cars that were parked parallel to each other. And I remember he had me lay down in between those two cars and proceeded to assault me. He told me things like ""Moan for me."" I don't remember how it felt, I don't really remember anything after he told me to do that. 

Flash-forward to another event that took place: I was visiting my grandparents again and Dee took me into the bathroom with him. He sat on the toilet seat and proceeded to have me perform oral sex on him. I remember while we were in the bathroom together, another uncle of mine knocked on the door telling Dee to hurry up with the bathroom because he needed to use it. At that moment, Dee looked at me and gestured me to not make any noises as he responded to my uncle outside the door. Shortly after this, I remember tasting something in my mouth, which I now perceive to be semen, and wanting to spit it out into the trash but he told me to swallow it. After that, he told me to leave the bathroom first so that no one suspected we were in there together.

I'm not really sure if anymore events happened after those two. Honestly, I feel like I didn't comprehend that these events were of sexual abuse until I was in my early teens. At the time the events happened to me, I don't ever remember feeling that I needed to tell someone. I feel like I had little comprehension of what was happening to me. I do remember wetting my bed until I was at least 9 or 10 years old, and looking back it makes me wonder why no one ever looked further into that. Bed-wetting is a sign of childhood sexual abuse.Why didn't anyone think that maybe something was happening to me to make me wet the bed so often, and at an older age than what was normal.

My therapist told me that the reason why I cant remember much of what happened to me or remember how I felt during those moments is because in traumatic times like that, your mind kind of checks itself out in order to survive. 

Something my therapist told me that, quite frankly, made me want to give her a huge hug was that the best way I could help the little girl who endured that pain, is for my current self to process my emotions and to heal. I've never felt so safe about sharing my story nor hopeful that I could proceed to heal from the terrible events that happened to me.

I hope that anyone who is also a survivor knows that 1) you are not alone 2) there are safe places to share your story 3) it is not your fault.",12Sep2019,6
40,,12Sep2019,1
41,"So lately, I've begun to suspect I might be psycho/sociopathic. I feel like I want to know for sure, just so I can stop thinking about it. It's starting to feel like I'm wasting my time with the thought, but I can't just dismiss it like I usually would.

My question is, how would I go about talking to my doctor/psychiatrist about taking the test to see if I am, in fact, a psychopath?",12Sep2019,1
42,You know when it’s one of those nights where you’re so depressed that you feel like ditching everyone and everything? I have such strong feelings of just being alone because I feel like my feelings are just such a burden. Sometimes I feel like being alone would get rid of the anxiety I feel of not having people care about me.,12Sep2019,211
43,"I don’t feel particularly sad in this moment but I do feel the sheer lack of motivation to continue living. I’m dissatisfied in life and the state of the world. I feel the older I get and the more I learn about the past, present, and possible future of the world the less I want to live. My life is riddled with problems now that I can’t find the courage to confront. I’m feeling really numb out of nowhere despite the lack of any real catalyst. I don’t know how to go on.",12Sep2019,1
44,"I've never made much of a long post about mental health at all, and I didn't really know where to go to get help with this, so forgive me if this isn't written well or anything like that. My writing has declined for a while. For preface, I guess idk if it's important, I'm schizoaffective (depressive type) and schizotypal, so maybe there's something explained by the symptoms i'm not understanding. 

&amp;#x200B;

I'm 22, and ever since I was about 6 I've been through therapist after therapist trying to find someone I can trust, but I always have problems with opening up to a therapist. I have no idea what I'm supposed to keep in mind throughout the day related to my disorders, what sorts of things to talk about. I've sat in silence for most sessions, with a few words or rants about music or the state of the world or art being most of the exceptions. 

&amp;#x200B;

What can I do to make sure something of substance comes from my therapy sessions? I've no idea what I'm supposed to do, never really have, but I would really appreciate any advice from Reddit. Sorry sorry if this is the wrong place to post this, I've hardly used this site.",12Sep2019,1
45,"Does anyone else have/have had a problem with extreme self hatred to the point that you’re suicidal, feel like shit, reject people who ask you out due to feeling you aren’t worth their time, feel really ugly/stupid, etc? If so how do you stop.",12Sep2019,1
46,"I've been in and out of counseling since age 10 and I really started to feel better about myself at 17. Throughout those 7 years it was my family situation, antipsychotics, and school that kept me down. Now at the age of 20 I recently had a small mental breakdown. It ended with me smoking weed and ending up in the hospital three times in one day. 

I then went into mental health services convinced I needed it and that talking it through would help. Immediately I described my anxiety, abnormal thoughts, and simple auditory hallucinations (Which assumed were hallucinations but not sure. They occurred once a month for multiple months in a year period). I was told I had anxiety disorder which I totally agree with but I was also told I had ""unspecified schizophrenia disorder."" My counselor was an older gentleman who seemed mentally delayed himself so I found it odd he was practitioning. My first two visits (After 3 Intakes!) were him telling my mistakes of getting off of antipsychotics and pushing me immediately to go to a psychiatrist. 

I dropped out of this counseling even though I genuinely wanted to talk through and opted to my doctor prescribing me an anxiety medication called Venlafaxine. Since on the anxiety medication it has helped many of my symptoms go down, I really don't have any of them much anymore. The downside is this month I have been experience restlessness, foggy brain, and other things from the medication. I also general object medication, what they like to call ""non-compliant"" (I hate this terminology so much). 

I want to talk to my primary doctor about getting off of it and just doing this all on my own but he keeps pushing the idea I'm schizophrenic as well. I just feel like I'm genuinely not and wouldn't like to be pushed into antipsychotics or incorrect therapy. My dad is on 6-7 Antipsychotics all at once as he was also diagnosed with paranoid schizophrenia. I feel like if I do have it, it is a minor case and it definitely doesn't affect my functionality. 

*Can anyone relate to this story specifically and give me any tips regarding my path towards health? This subject of Schizophrenia has been bugging me since April and I think about it daily. Greatly Appreciate suggestions, thank you!*",12Sep2019,1
47,"One of the most frustrating impacts I've noticed as a result of a long period of poor mental health is a deterioration of my ability to speak. In my own head, I can talk and form coherent thoughts just fine, but the second I open my mouth, my voice is higher pitched than it used to be if I can speak, and I feel like I have to physically push the words out as if they're literally getting caught in my throat. I physically feel it happening.

I know the obvious solution is speak more and it will sort itself out, but I feel almost embarrassed to try because it sounds like a scarred toddler's voice coming out of a 22 year old man's mouth whenever I have to speak with someone I normally don't. It's worse when the conversation I need to have is important such as asking a professor a question or going to an interview. It's just frustrating. Does this happen to anyone else?",12Sep2019,1
48,"i swear this isn’t your typical teenage angst because it keeps on coming back no matter what. i’m having difficult finding a hobby, a passion, a friend even. i don’t know who i am or at least want to be.",12Sep2019,21
49,"I've been talking to this new friend online and via text and things have been going so great that we're planning to meet irl but literally as we're talking about low-key, public first dates she asks me about my drug history and I let slip that I've been clinically dead all nonchalantly except it wasn't just that, but my stupid ass said ""legally"" instead of ""clinically"" and literally two hours later i realized my mistake and texted her at 1am to correct myself and probably further make a fool of myself. So now in the morning she's gonna see all those texts and be like wttff maybe I shouldn't meet this person and I hate myself right now",12Sep2019,1
50,"I've been on and off my medz (largely off) since the beginning of the year. I've been diagnosed with paranoid schizophrenia since 1998 (age:27) since I returned from the Navy in Washington State. I'm from Southern California. Before that I lived at home since high school and was diagnosed with basic depression in 1994 i believe when I was having some issues that were being pent up inside. Since, 1991 i started smoking pot until 2012. I started smoking cigarettes in 2000 when I had a major breakdown. Big mistake. In high school age 17 tried alcohol and that got me through. I quit alcohol around 1998. Never really had a gf was always mostly a loner. Currently, I have problems with anxiety, stress, panic, paranoia, isolation, persecution, ptsd, and depression. Which are all symptoms of schizophrenia itself. The only thing i can say medication has consistently helped me with is sleep. Other than that, it makes me tired, slow, weak and a zombie. It also messes up my sex drive so I can not have the daily pleasure of masturbation. I try to eat healthy but I don't exercise as much as I want to. My family life is pretty lonely for me. I'm pretty isolated from them all except my mother. But, overall I just wanna be left alone. Doing public things has become increasingly harder. No friends and no life. My only escape is the mountains.",12Sep2019,1
51,"Hey so, recently I've been having a lot of flashbacks, a lot more than normal. 

I've been in therapy and stuff for the last two years, dealing with schizophrenia, Depression, a bit of Anxiety. 

I've always been getting post traumatic flashbacks, but I haven't talked about it much with the psychiatrists, because, until recently, it wouldn't happen that often. 

But anyways, that's the background, 

Just a few hours ago I had a nasty flashback to being raped, I was on the couch at my friend's house hyperventilating and freaking out, felt like I couldn't breathe, physically seeing things from the past, felt like it was happening again, you get the idea.

It was a nasty episode.

But then I had to drive home, I felt really shaken, while driving home I kept zoning out, the episode was over but my head was still fucked, everything felt surreal, like I wasn't in my body all the way. I know the feeling very well by now, but I've never driven with that feeling, I don't know if that was safe. 

On the one hand, I was very shaken and vacant, but on the other hand driving did help distract me and get my mind off of it. 

If this happens again, and I have to get home, what should I do?",12Sep2019,1
52,"My dad is a tough guy, until it gets to his kids. In 10th grade I was sent to a mental hospital and although things went good for a while it's gotten tough again recently. The only thing is that for the past few years he's insisted I was just lost. I never was fully okay and finally know I need to be doing more than seeing my therapist once a month. She agrees I should see a psychiatrist. And now I know I need to. I'm under his insurance and I don't want to hide this anymore anyways. I just don't know how to tell him when he's so optimistic about it and I know if I tell him he will get scared again. But I need to tell him.",12Sep2019,1
53,"I go through patterns of irrational and irresponsible behavior, and Ive never really talked to anyone about it. Im tired of it, and I want to feel normal, so I have set up a talk with a doctor.  The following short story is just an example of what I feel and what I do when I go through one of these ""episodes"". Luckily they only last a few days and they dont occur extremely often..maybe once-twice a month. If anyone has any input about what Im experiencing, please share, and thanks so much. 

  

Monday-September 10. First of all, Lee (husband) is not here, and I rely on him a lot, whether I realize it or not. He keeps me in check just by being himself and being here. On Monday, I knew I had lots of things I had to tackle- lab notebooks, studying for the early test, chem homework, getting ready for drill, studying for zoo quiz.… I think that’s it mostly. And the gym of course. That did not happen on Monday. I was thinking of what I would eat, went to class at 930, and I was angry the whole class period because someone took my front row seat, and I struggled to pay attention in class the whole 50 minutes. After class, I had an extreme impulse to go to starbucks, like literally sitting in traffic I made the decision to go there instead of going home (impulsive). I went inside and I ordered much more than I originally wanted, 2 sweets and a drink. I got back into the car and ate that shit so fast I wasn’t even out of the parking lot, then finished the second sweet off by the time I was home. I was physically sick to my stomach, too much sugar, but I kept drinking the Frappuccino anyways. Then, as the tummy ache hit me, I had the urge to throw it all up. Like not actually retching, but thinking that making myself vomit would make the guilt and the sickness go away. So that’s exactly what I did- I went and threw up everything I had just eaten, and not gonna lie, that shit felt great. Made me feel better physically and felt good coming out. I think this is the most that I threw up ever, in amounts of times I induced retching. It was upwards of 10-ish. I vommed so hard that I must have strained my neck because it hurt later that night at work. So, now its time to go to my next class, so I microwave some vegetables, barely have time to force a couple down my throat, and I run out the door. At this point, when I consider my throwing up, I don’t really have any feeling towards it. I don’t feel bad about it, I don’t feel like I have a problem, I don’t think its something that warrants medical attention on its own. I almost feel like an imposter for seeking medical attention for something so stupid. What bothers me so bad about this, is how chaotic it makes me feel, and how fucked up my relationship with food is. I don’t understand it. Its like an addiction that I have to suppress 24/7. I fight off the urge to stop and buy candy (sometimes lose) every time I get in the car. I know that if I bring any money to work, Ill ditch whatever health food I brought in 100% of the time and instead go buy so much fast food that I feel sick and fatigued when I go back to work after lunch. And then grab I candy bar to finish it off. Its an urge I just CANNOT control. 

Now, we cut to yesterday, Tuesday. Im avoiding shit I need to do (avoidant/procrastinating). I go to class, take my zoo quiz, go to chem lab. Chem lab gets out early, and Im starting to plot and plan about how Im going to bake something today. But what? A cake? Cookies? Croissants? I settle on attempting macarons and cake pops. Its important to note that I love to bake, and often do it as stress relief. I usually don’t eat my bakes, but instead give them to other people. But on this particular day, Im wasting precious study time thinking of how Im going to bake these extravagant macarons. I go spend $50 dollars, and by this time its 5pm… Im already late for homework and study time, but Im well aware and I just keep procrastinating anyways. Fast forward to 10 pm, and Ive finally finished baking. They look okay, not crazy great. So I immediately and impulsively eat them, and halfway through I get sick. So I take a small break and then finish the rest. I did not purge these. By the time I started the work I actually had to get done, it was around 11pm. I sit myself in front of the computer and try to work on organic chemistry homework, but honestly, it looks like another language. I cant follow, I cant comprehend…its useless. So I promise myself I’ll wake up a little early before my first class and do this homework. Of course I don’t… I sleep until 8, realize I have forgotten all about a different classes homework that is due today. So, I skip my first class this morning so I can do my second class’s homework..very rushed and stressfully. So at this point in the week, Im feeling extremely frazzled. Cant think straight, feel like im in a fog, having trouble focusing in my classes. So, I decide Im going to call out of work and go speak to a doctor about mental health, because Im tired of this pattern.",12Sep2019,1
54,"*please let me know if I should post this somewhere else since I am new to Reddit * 

Prefacing this to say I’m (F,20) not depressed but I’m starting to wonder if I chose the wrong Major or if school just isn’t for me . 

I (F,20) used to be really creative I would draw,paint, do weird makeup, write lyrics , write poetry etc but then I got in a dark place and I can’t seem to get out of that dark place when it comes to being creative or doing school work . In regards to school I do try very hard , I spend countless hours studying and revising my work  to no avail .  

I want to find something I’m good at that I can build a career on. I know the one talent people say I have is making others feel better but I don’t know where to go from there I took a psychology course and hated it , I’m okay at sociology but idk . 

I know if I had the skill I would love to be a lyricist , a writer or performing artist but isn’t that a dream everybody has ? 

I just feel like I don’t have a purpose . 

TL;DR: I feel like I don’t have a purpose , I’m not good at anything anymore, I feel like college might not be for me , but I don’t know what to do .",12Sep2019,32
55,,12Sep2019,1
56,"Hi

I feel like I have glass splinters inside my forehead, above and right between my eyes. In a circular area, about the size of tiny makeup boxes that women carry around which have tiny mirror on the inside.

Can someone help me how to get rid of this phantom feeling. This is causing much distraction and mild headaches. I am even scared to touch the area.

**Short story long**: 

A few nights back I had dream. 

We were trying to get through a mystic portal of some kind into some place. This portal was made of glass/mirror, inside a tiny circular metal box, about the size of Nivea cream boxes. The first person got through it(that too might have been me as well).

How we warp is, we slowly get absorbed/sucked into the portal and then we are in the other place/room. And then, when I tried, the absorption part started, but eventually it felt as if the process was reversing. Instead of me being absorbed into the portal, the glass part of the portal slowly crumbled and got absorbed into my forehead. 

My partner (have never seen this man/guy before. But we bonded like brother in law. My wife doesn't have brothers. My sister is yet to get married,not in a relationship.) planned to take me to the hospital. We have to get on the motorcycle and he has to drive me. I didn't know him before, I didn't like or dislike him (except for my dislike of social interactions). Before we could leave, we were interrupted by multiple family matters. And we finally got on the motorcycle and he started driving. 

We eventually reached a cross road(He now felt like the younger brother of a brother in law). Where the smaller road we were on was merging with the highway. And he did say something witty, for a kid his age. And I said something like, ""you think you are a doctor"" or ""you are a doctor"".",12Sep2019,1
57,"Hey, everyone. I’m not sure if this is the right sub reddit to post this to, so if it’s not, please redirect me.

I’ve struggled with mental illness my entire life, but haven’t been able to pinpoint what exactly I have. I’m posting here in search of opinions or ideas of what it may be.

When I was 17 years old, I started experiencing a loss of appetite, loss of interest in hobbies and life, and perpetual sadness. I was diagnosed with Major Depressive Disorder as a result.

When I was 19, I began experiencing sudden panic attacks that came unprompted, irritable bowls, shaking, and sudden vomiting. I was then diagnosed with General Anxiety Disorder (though in my opinion, I think I have Panic Disorder.)

However, I still have so many random symptoms that don’t seem to fit in the depression or anxiety category.

As a child (roughly ages 8-14), I had delusions of grandeur. I believed that a meteor was going to hit the Earth and would literally stand outside each night and stare at the sky waiting. I also believed that the devil could hear my thoughts. At one point I believed that my dog could secretly speak and was hiding it from my family. (Yeah, I know... weird.)

These delusions aren’t as frequent nowadays, but they are still present. I have a delusion that I can’t shake that my dad has hidden a camera in my bedroom (I have no basis for this belief.) I also constantly think my spouse is cheating on me.

I just need help :( Any thoughts?",12Sep2019,3
