,text,time,score
127,"I have a family member that has lost her ability to work at 58 years old. She broke her back (then the doctor botched her surgery giving her more pain) and that coupled with a rather severe case of rheumatoid arthritis she is in constant pain. 

Social security disability insurance (SSDI) gives her a monthly stipend but it's not really enough to pay for much. Her husband works 50+ hr weeks to pay for the medical bills, house, etc. But she has been steadily getting more and more depressed. I don't worry for her safety but when I bring up talking to someone she explains it away with ""we don't have the money for that."" 

She has always been a rather active person, loving outdoors, her gardens, keeping her home clean. But since her back surgery she hurts so much and gets sick all the time so she can't do what she loves. All she wants is a purpose or something to love doing again.

So I'm hoping someone here knows a way to get help either through SSDI or another government agency to help her pay for the help she desperately needs.

Thanks for reading this, it helps just getting this all off of my chest.

Any and all help is super appreciated! ❤️",12Sep2019,1
128,"Hi,

This is my first time writing here but I am looking for any input. Thank you in advance. 

Sorry for any grammatical errors, I am absolutely exhausted. 

I am struggling so much with my mental health, which is now making me physically ill. I have been pushing through for the past 8 years but recently I have reached my limits. I don't want to disclose the details but things are bad. I desperately want to quit my job that I have started 3 months ago; but I am so so so afraid. 

I want to take the time to get help, properly dedicate myself to my self care and be in a better place both mentally and physically. Time-wise I am wanting to take between 1-3 months. However, I fear that it will make me unemployable in the future.  I am terrified that my current employer will perceive me as incompetent and any future employer will perceive me as incapable.

When I decide to look for work again, the first thing that will be asked in any job interview is why the gap in my resume and why I only worked my first proper paid job for 3 months after finishing my studies. (I am now in my late 20s).  Hence, I will have to disclose my mental and physical health issues in the interview and well.... I think they will judge me..... harshly.... even if they say they won't.  If they compare 2 candidates with similar qualifications, they will most likely choose the one who has not disclosed mental health concerns.  On top of that, I won't have a reference from my previous employer as I worked there for only 3 months.... so nothing to show for during my time there. 

Basically, I fear that taking this time off will unleash a chain of events that will lead to a non-existent career. I have interests, passions and ambition but my mental health is hindering that significantly. Most of the amazing things I have accomplished have painful memories attached to them because of the constant battle with my mental health (during the process of attaining those accomplishments). It's been hell and has taken me to very dark places. So I am thinking to myself enough is enough.

 But on the flip side even with all the awareness that is happening, which is great- mental health is still a big taboo especially in the professional world.

I hope I am wrong; please any thoughts are appreciated.",12Sep2019,1
129,"On 4th of July this year, I unexpectedly rescued a German Shepherd mix named Sandi. A friend of mine couldn’t keep her anymore, and Sandi fell into my life.

Not only does she brighten my mood just by being the best dog I’ve ever had, but she helps me through panic attacks, and keeps me from harming myself(I punch and hit myself in the legs and head). I never had to teach her anything, she picked it up all on her own. 

Also, Sandi is one of the only reasons I leave the house, other than work.

I take her on two walks everyday, and the fresh air and little bit of exercise have done wonders for me. My appetite is back up, I’m sleeping better, and my body is starting to feel healthier. 

I am so grateful that she came into my life when she did.",12Sep2019,323
130,"Lately things have been good. I don’t have a lot of issues to talk about. I’m stuck in therapy talking about old issues or how well things are going lately. Don’t get me wrong, I still really think I need therapy because some weeks are *bad*. 
But days like today, I felt really good and I didn’t feel like I had anything to talk about. There were long pauses and silences and I just felt like I was boring my therapist. Like I had nothing interesting to say. What do you do in those situations? How are you supposed to deal with it? Should I just cancel my appointments on those days?",12Sep2019,7
131,"Right now, and every day, I want to die, that's just how my mental health is, people understand that, what people don't understand is why I won't get immediate help.

Here's one explanation, I don't want to get ""better"". Quite simply, I see me being happier when I die in the future, whether that's tomorrow or 80 years from now.

Here's a better and second explanation, I don't particularly like people, I don't have autism or any condition like that, but I prefer to keep things to myself, going to the doctors for help would require at one point, talking to my mom, I don't want to talk to my mom about my mental health, I would quite literally rather die.

No reason particularly to post this, just wanted to share my reasoning",12Sep2019,3
132,"Hi,

This is my first time writing here but I am looking for any input. Thank you in advance. 

Sorry for any grammatical errors, I am absolutely exhausted. 

I am struggling so much with my mental health, which is now making me physically ill. I have been pushing through for the past 8 years but recently I have reached my limits. I don't want to disclose the details but things are bad. I desperately want to quit my job that I have started 3 months ago; but I am so so so afraid. 

I want to take the time to get help, properly dedicate myself to my self care and be in a better place both mentally and physically. Time-wise I am wanting to take between 1-3 months. However, I fear that it will make me unemployable in the future.  I am terrified that my current employer will perceive me as incompetent and any future employer will perceive me as incapable.

When I decide to look for work again, the first thing that will be asked in any job interview is why the gap in my resume and why I only worked my first proper paid job for 3 months after finishing my studies. (I am now in my late 20s).  Hence, I will have to disclose my mental and physical health issues in the interview and well.... I think they will judge me..... harshly.... even if they say they won't.  If they compare 2 candidates with similar qualifications, they will most likely choose the one who has not disclosed mental health concerns.  On top of that, I won't have a reference from my previous employer as I worked there for only 3 months.... so nothing to show for during my time there. 

Basically, I fear that taking this time off will unleash a chain of events that will lead to a non-existent career. I have interests, passions and ambition but my mental health is hindering that significantly. Most of the amazing things I have accomplished have painful memories attached to them because of the constant battle with my mental health (during the process of attaining those accomplishments). It's been hell and has taken me to very dark places. So I am thinking to myself enough is enough.

 But on the flip side even with all the awareness that is happening, which is great- mental health is still a big taboo especially in the professional world.

I hope I am wrong; please any thoughts are appreciated.",12Sep2019,2
133," 

Hey guys,

I am 5 years sober and so pumped about it, but tonight I really want to talk to people and answer questions if I can. I love talking about my issues and talking to people about their issues and I absolutely love trying to have open discussions about what we struggle with collectively.

I think its so important to have an open conversation about mental health to show others that we are Not Alone. That has been a really big focus of mine for the past years and a half.

I struggle with anxiety, depression, seasonal affective disorder, and ADHD and am hoping to have my largest conversation yet tonight if everyone could tune in with me (: you can click my link and follow but the most important thing you could do is just **set a reminder to come watch tonight at 6:00 EST**  
[twitch.tv/spidermojo](https://twitch.tv/spidermojo)

additionally if you want to play minecraft with me tonight while we talk you can join our discord  
[https://discord.gg/AGGtza2](https://discord.gg/AGGtza2)

Thank you everyone for the support and please please please lets have a great discurssion tonight &lt;3",12Sep2019,1
134,"Hello friends, so i started to suffer from panic attacks, depression and anxiety in 2014. After that i went to many mental health specialists and i took mirtazapine 15 mg which was then reduced to 7.5 mg. This drug treatment went for a year but i found natural behavioral changes helped me a lot to solve underlying problems. I found those pills addictive so I've stopped Antidepressants. Symptoms began to alleviate if i changed my demeanor that's why now I rely on my changing my attitude and behavior. But i still have heaviness of left side of head, insomnia- i sleep like 4-5 am and that too very weak sleep, can easily wake up from small noise. Memory problems. Lethargy. Sometimes concentration and decision making problems. Please help me decide should i begin with antidepressants again to get rid of these problems or my natural behavioral changes are enough.",12Sep2019,1
135,"My dad and I were really close when I was younger,  but as I grew older, around my teenage years he got a girlfriend and I was kind of ignored, that and a bunch of other things going on in life I started acting out and became sort of a hell child. My dad and I arent as close now, we do talk but were both busy so we dont get together or talk a lot as much as we used to, the reason I give that as background is because I feel like I'm just a huge disappointment to my father. He doesnt understand mental health really, hes one of those ""think your way through it and take your meds"" so he doesnt really ""get"" what I went through and what I still go through. Everytime I make plans with him, I get super nervous that I'm not ""good enough"" or something.. it's hard to eat .. or focus.. any tips? .. I really want to actually really enjoy my time with my father and not just panic",12Sep2019,1
136,"I've fought with depression for several years now in addition to anxiety, PTSD, and BPD. I read recently that electroshock therapy can help with depression. Medications don't work, and therapy usually just leaves me feeling worse as we uncover how much of my shitty life I've been dealing with without realizing it. Does anyone know how it works, if its invasive (I'm a college student), or if it even is a reliable solution?",12Sep2019,1
137,"I'm starting to look for psychological/psychiatric help for the first time. A grandparent, who's obsessed with health (and I think less trusting of psychotherapy), is forcing an appointment with a place I'll call the 'Health Institute'.
I was open to the idea, but then she off-handedly mentioned that they don't accept any kind of insurance, and that it's 100$ an hour. So I got kind of suspicious and looked it up - it's vague about what they *are*, there aren't any reviews or outside mentions, and the photographs only show a gym (no offices or anything). She only recommends them because they share an office building.

From their website, I'm now a little suspicious of their wording: they analyze you for 30-45 minutes, then develop a 'treatment plan', which I think just means different types of exercise. You're then charged for an $100/hour gym membership. Is this a valid replacement for psychological help? I've never done this before so I don't know if it's unusual.",12Sep2019,1
138,"Hi all,

I am hoping someone can guide me to some resources or provide me with some advice regarding this issue. I hope I utilize the correct terminology and apoligize if I offend anyone.

I live in an apartment within a larger complex in Minneapolis, MN. Since moving here last summer I've noticed a woman who lives in an apartment the floor above mine yells...a lot. And it's hard to ignore because it is very loud.

She always demonstrated these symptoms, however they seemed to subside after a short period of time. Lately it seems significantly worse and I hope I can maybe help her. 

The last 2 weeks I have noticed she is yelling when I wake up in the morning, yelling when I come home from class in the afternoon, and she's yelling when I go to sleep. My partner has even mentioned that twice she's been startled awake around 2am by the woman running down the hallway yelling. 

When I stop to listen I notice the yelling never makes sense, it's total word salad and is often about weird things like Tom Selleck or Bon Jovi. I've also noticed she often plays the same song over and over again.

I've seen this woman exit her apartment a handful of times. She is often dressed innapropriately for the weather (wearing a puffer vest and sweater in the summer heat) and using a broken umbrella. My partner once was taking the trash out and passed by the woman who proceeded to close her eyes, plug her ears, and hum. 

I know nothing about this woman. I feel for her because it's obvious she's living with a severe and persistent mental illness that just seems awful. I cannot imagine how exhausting it must be for her. Is there anything I can do to help her as a total stranger? Can I call a mental health crisis response team to potentially knock on her door? Should I knock on her door? Is there anything that would help?

Thank you in advance.",12Sep2019,3
139,"Thanks to noticing some patterns I’m sure that I have anxiety that’s worsened by my job and pms. It’s never been too much of a bother until the last few months. 

The best solution would be to simply quit but that’s not an option at the moment. I am working on going back to school to get a 2nd degree in a field I know is more manageable, so I’m kind of  stuck at the moment. 

So until my plan B kicks in, which doctor do I talk to first?",12Sep2019,2
140,"I’m really frustrated. I want to start going to counseling because I can’t get myself to work on what I’m passionate about—I only ever do what I’m required to.

Every person I’ve gone to thus far has been absolutely bonkers. One woman wouldn’t stop talking about politics and how she’s in a different tax bracket, so I basically had to sit there listening to HER rant about HER problems. Suffice to say, I haven’t gone back.

Another person (we didn’t know this at the time) specialized in hypnotherapy. I’m not saying it doesn’t work, but my parents weren’t comfortable with it and I wasn’t in love with the concept either. So we told the lady that, and she went off saying how we all hypnotize ourselves all the time and she finished by saying, “Don’t worry, I won’t PLAY with her.”

UHHH wait what

Every single time a psych person pulls this garbage, we give up on it. It’s so difficult to find a good psych that works with our insurance and isn’t nuts.

I’m also frustrated with how they deal with suicidal thoughts. Since I’m 17, they pull the whole thing where “If you’re having suicidal thoughts we have to inform your parents and they have to be in the room...”

I’m always confused as to why some people do involuntary hospitalization garbage as well-I’ve had suicidal thought for 9 years and I haven’t acted on it...and now you’re going to force me to be charged thousands of dollars? Don’t you understand that many suicidal people already feel like a waste of resources? It’s all backwards, and because of that policy I’m always worried about speaking about that just in case the psych is stiffer than I thought...

Any advice on what qualities to look for in a mental health professional? We’re dropping off paperwork at a new place tomorrow. Fingers crossed!",12Sep2019,2
141,"hell, i was wondering if it normal to be sad, not depressed, but sad most of the time and just sort of uncomfortable in my life, even though i have been very lucky and have been born into a good home with financial security and good education. I have everything one  would need but i just cant seem to get happy, i feel very lonely even though i have loving parents and a good family, is there something wrong with me?",12Sep2019,1
142,I think I need someone to talk to about my mental health. If anyone is willing to I would really appreciate it.,12Sep2019,2
143,"[No research being done because of lack of funding.](http://nymag.com/scienceofus/2014/10/what-its-like-to-have-extremely-awful-body-odor.html) There could be a cure one day but, [fuck you if you have it now](http://nymag.com/scienceofus/2014/10/what-its-like-to-have-extremely-awful-body-odor.html).",12Sep2019,1
144,"So recently my bestfriend said someone we are close with said she doesn’t like us together and stuff but I don’t think she likes me because she really loves my friend and says it’s her bestmate and always hangs with her and my friend doesn’t seem bothered anymore but I feel like I’ve been pushed away and the girl who said the things acts weird with me for no reason and she doesn’t know I know this and she ignores me and lies all the time, it’s really annoying me and I don’t know what to do because I can’t really say and confront her because of how I found out and I feel like now I’m loosing everyone and I feel so low but I feel like there’s nothing I can do.",12Sep2019,1
145,,12Sep2019,0
146,Sometimes I think I going to explode soon that I going insane again trying suicide again.  My psychologist is doing nothing. I don’t wanne go insane but I can’t control it. If it’s happening I can’t stop. I am so scared if this time suicide is working.  Pleas give me advice.,12Sep2019,1
147,I was watching an interview with this guy Aaron Weiss whose band mewithoutYou I dig and he spoke about this and how freeing it is. Has anybody ever tried this? It seems like a heavy thing one would need to be spiritually strong to do.,12Sep2019,1
148,My social anxiety has got to the point where I cant hold a conversation with my friends that I have known for years and I am now even afraid of making a joke incase it wasnt funny. Sometimes I dont feel I can contribute anything to a conversation so I just stand there feeling awkward and recently started feeling like I'm not always wanted because I just kinda stand there. The thing that makes it worse is that these are the people I feel the most comfortable around and even then I cant talk to them. It has started making me so lonely even when there are people around me and it's the worst feeling there is,12Sep2019,2
149,"throw away account but my brothers got pyschosis and some mania,although if you came across him he seems fairly normal. although he talks to himself and has conversations with himself all the time,im not sure who hes talking too and im not sure if the doctor knows this.he doesnt take the medication with the doctors permission and seems to be doing ok. he also says really strange things sometimes that dont make much sense and are downright bizzare. I worry about him sometimes,hes a good guy has hobbys but Hes been having a lot of problems. hes still fairly young although hes an adult technically. i just wanted to know if this is something associated with these disorders,sometimes i hear him whispering in a bizzare manner to himself. he also sometimes asks if i heard those noises at night. those are the only symptoms of his i can notice from my perspective. i think he also had an episode of mania the other day,because he started hitting his head with a ball and sat in the fridge and was laughing weirdly",12Sep2019,1
150,Just curious about any methods or techniques or things you do to keep in check- if you have any :),12Sep2019,2
151,"I want to speak quite frankly.

I'm at university for the second time. I failed before, but now I'm older and hopefully wiser.

I'm really trying to stay positive, theres a lot to be excited about. But at the same time I'm anxious for a lot of reasons.

Last time I was at university, it went very wrong. Several things happened in quick succession culminating in a suicide attempt, and then me dropping out. In my self imposed isolation I also lost every friend I'd ever made.

On another note. My hairs been falling out. I went to the doctor who told me it was alopecia and that he couldn't do anything. So far my hairs long enough to cover it, but new patches keep appearing, some as large as 5cm in diameter. I'm both scared and self conscious about it, my hands are shaking just from imagining it; I already felt ugly.

I've been trying to make friends but it's hard. When I'm with people nowadays, the words just don't come out no matter how hard I try. People eventually just move on to talk to someone else.

I feel like little pieces of myself have been slowly falling away, I dont know whos left anymore, I'm a  stranger. I've been trying to get to know myself again, like how I'm writing a novel, and making art just for myself. 

In a lot of ways having no connections to the world is liberating, I feel free to explore who I am in a way I never could before. But sometimes the silence is deafening, I start crying, I just want a hug. I want somebody to let me into their world so I dont have to stay in mine anymore, even if i can't stay.",12Sep2019,1
152,"Hi. I'm 25 and a few years ago I was in a relationship that broke my personality and who I'm. 

Now I'm so suspicious and always when my girl get out with his friends I think that she is cheating me or when she told me something I think that she is laying me. 

I need overcome this because I love her and I don't wanna lose her. 

Please. Help me. 

I need their advices.",12Sep2019,1
153,What did you take/do? Who or what helped you come back to life? Did it hurt? Did you at any point regret your decision but it was too late?,12Sep2019,0
154,Has anyone become obsessed with the idea that they are loosing their minds? I have a constant worry that I am loosing my mind when everyone else constantly reassures me I am sane. Any advice?,12Sep2019,1
155,"I finally managed to bring myself to make an apt with a psychiatrist for consult and changing meds a few months ago. Their first new patient opening was for the first week in October. 

One of the reasons things have gotten bad for me is my work situation. We’re understaffed, overworked, have awful hours, etc. 

Requested the day off for the appt (as well as for two other appts that week), I only got one day of the three off. So I had to reschedule... for two weeks later. Not like I was already waiting since JULY or anything. 

I cannot wait til I can find a new job. It needs to happen like, yesterday. At this point I’d rather be unemployed.",12Sep2019,2
156,Has anyone become obsessed with the idea that they are loosing their minds? I have a constant worry that I am loosing my mind when everyone else constantly reassures me I am sane. Any advice?,12Sep2019,3
157,"So my son has slowly been becoming more reactive, aggressive and angry.  Yesterday everything came to a head at his Pediatrician's office.  She watched as my 13 year old angrily berated me for not loving hin and blaming me for everything he could think of.  I",12Sep2019,1
158,"So this is odd, but I can't shake the feeling that in some way I'd rather be insane than bored stuck in my parent's house forever. So everything I do seems to contribute in some way to my self-perception of my insanity.


I self sabotage by overeating when I know I should eat less. I kick a flower pot every morning to have a reason to get out of bed. I regularly take psychedelics, about once a week. I've convinced myself that my opinions and personality is entirely made up and subjective to the point of arbitration. I've long given up things I used to pursue endlessly because I wasn't making any visible progress at all.


I do try to meditate if my thoughts start to enter a negative spiral however. But there's one negative thought pattern that I embrace willingly: the feeling that society is quickly heading towards collapse, or at the very least descending. I like thinking about that; not because I want society to collapse but because I think it's inevitable and fascinating.


I guess I want to be disconnected from reality, because my I find my mind so much more interesting. I only wish I was better at day dreaming and remembering my night dreams. I feel happier now more than ever, but I really don't understand why or how humans do anything. I don't understand why I do anything or why I should do anything.",12Sep2019,3
