,text,time,score
73,"The past couple of days I have been feeling to groggy and down. It probably doesn’t help that I’m coming down with a cold and it’s a bad time of year for me but all I want to do is sleep and remove myself some anything remotely social, including just sitting in the living room. 

When I feel like this I constantly beat myself up. I feel bad for doing things to make myself feel better. What’s your techniques for lifting yourself up?",12Sep2019,3
74,"More of a vent than anything, I'm taking steps to help myself but my god, it is hard. Everyday I want to cry... I'm so sad all the time to the point where if I feel any kind of vaguely neutral emotion, it's really striking and overwhelming. Even now escaping briefly to the bathroom while at work, I could bawl my eyes out. I've got too good at blocking out why I even feel sad anymore, it's probably some sort of defensive or copying mechanism but it's left me with a horrible heart ache/dull emotional pain and I detest it. Need some kind of virtual hug fest or several punches in the face, either or at this point...

Sorry if this doesn't belong here by the way, I am happy to delete it if so. I may delete anyway even if it does belong here, I do that a lot lately. Guilt is one of my most familiar feelings.",12Sep2019,3
75,"So I'm only 15(m) and I've never actually been diagnosed with anything, the counselor I was seeing a while ago thought I might've had bi-polar depression which she said would be hard to diagnose at my age. I started getting depressed between 7th and 8th, pretty bad, and did some cutting and always tried to hide it, but eventually my family found out and put me into the counseling and I ""got help"" there wasnt really much they did for me besides ask about my problems and ask me to fill out symptom sheets, and I couldn't cut any more without feeling guilty, so I started internalizing it and just hating myself, then after 8th, I joined sports, to try and boost my self esteem, then I started smoking pot to relieve literally any of the symptoms,and it worked for a while, I lost weight, got out of counseling, had a few relationships, but my depressive symptoms kept creeping back up, I still hated myself still hated my life, and sometimes the highlight of my day was reminding myself I can end it whenever I wanted. I got tired of opening up to people only for them to not understand me and think they ""fixed"" me, so I put up a front and just pretended to be happy, and its been like that for a while now. I'm being put into drug counseling soon, and I quit smoking a few days ago, I'm only about 4 days sober and its terrible, I started to notice my mood swings coming back, my third day, I felt amazing! I was so social, felt so confident, smart, just all around happy, like actually happy and as soon as I was alone, I just broke down out of nowhere, I just hated myself and everything I've ever done, I cried myself to sleep last night  trying not to think about suicide or cutting because I feel like they're not my thoughts, I just can't get out of my head, and I just want it to stop and be normal, and stop feeling melodramatic all the time...",12Sep2019,1
76,I dont know but once in a blue moon i would feel like i might be going crazy or mentaly crazy. I dont want it to affect my husband as well bc sometimes ive been complaining about not feeling well. Its just me and him too so its like idk sometimes he cant help me with this kind of stuff because maybe he needs help himself or dont want to deal with it. Maybe i just need to do things idk,12Sep2019,1
77,"I am currently self-employed as a gardener but as that season slows down I need another job for winter.  I'm currently struggling to find/keep jobs because my mental issues (OCD, head injury, anxiety, depression, SAD) pose significant challenges.  When I do find work, the self-care and structures in place to manage my mental health seem to go out the window.  

Is anyone else self-employed? 

Is anyone else seasonally employed?

How do you manage?",12Sep2019,1
78,"I take zoloft for my anxiety and its been a long time since ive had a panic attack, but this year my days hace been spent in a high functioning depression. I feel tired all the time and cranky a lot. 


I often spend small 5-10 minite breaks throughout my day daydreamong about quitting everything, going home and sleeping, then I snap back to it and get back to work. 


If i do take time to sleep more, i feel so guilty that it isnt peaceful at all. 



My husband aquired some slow release morphone sulfate pills. 

Ive taken one 5 days. Not in a row.


Every morphine day is a good day. It doesnt feel high. But it feels refreshed, motivated, and hopeful. 

I want to feel like that every day. Is it possible? 


And before you give me the spiel, I do exercise and eat well.",12Sep2019,1
79,"I’ve been severely depressed for rhe past year or so but then I started getting better. Recently I received some news about how I have an abdominal mass and it’s concerning. The results aren’t completely conclusive yet, but obviously I’m thinking of the worst and spiraling into depression and stress, and this time I don’t know if I can make it out",12Sep2019,1
80,"My body control is very calm. 

However I am really trying to work on keeping my voice down and not yelling loud when upset, frustrated, aggregated etc. 

On average we all experience distressing situations on a daily basis to some extent 

I am motivated to work on avoiding yelling 

My new cellphone (2019 Samsung Galaxy A50) was having functional issues and volume issues. 

I got upset and began raising my voice at 10 minutes after 7am in the morning. 

I woke my neighbor up again and I cannot keep doing this, it is not intentional, but I have to get ready between 6 and 9am in the morning often, which is when the majority of people maybe still sleeping. 

What are tips/recommendations for keeping calm and not raising voice when angry or upset. 

It is the same with traffic. 

When people don't see me and nearly hit me on my bike it triggers a negative, frustrating emotion. 

I am looking to improve my not just anger management but distress management as well.

I drank alot of coffee this morning as well (5 cups in the maker) which equals out to 3, 355ml/12OZ
mugs, so over a litre of coffee and caffeine may have an effect.",12Sep2019,1
81,"My Dad died 6 months ago after a long fight with Cancer, and I’ve always suffered with horrendous anxiety and depression. The last couple of years have been crippling.

I decided to take some time off of work to try and heal and until just now I was worried it wasn’t doing any good..... 

I feel a million pounds lighter just acknowledging that I’m getting better and had to tell someone ❤️

I know everybody has a different path and the way we deal with our illnesses are unique to each of us, but if I can smile today, then there is at least a tiny bit of hope for us all! 

Hoping to pass on my smile to someone who needs it today. You can do this!",12Sep2019,276
82,"Those goodbye letters that you have written, stored at the back of your drawers, hidden from the light of the day because you're afraid your parents might be heart broken to know that their ray of sunshine is going through something, is your strength. 
Having gone through it all at a young age, I learnt how depression attacks you anywhere, not discriminating the time or place. I have soaked cushion covers, crying myself to sleep. I have suffocated myself, depriving myself of the smallest moments of happiness in my life. Depression took the best years of my life away. I laid in my bed, thinking of ways to die. I thought of all the people I had ever hurt. I reminisced the ways I used to smiled, when I meant it. I imagined how happy everyone would be without my existence. I stored all my notes, of the numerous words I had been called, the scars I had, the battles I fought with myself. The poems that called depression pretty angered me. I felt the wrath in my veins when those poets made it seem plausible that crying myself to sleep was cute. It did not feel that way. I wanted to die. I wanted to die. I wanted to die. 
The day I decided to die, 29th of November, 2016, I sat down, crying. This was all that it led to. I did not have to.gwt bullied anymore. I took one last look at my hand. I rolled up the sleeves of my jacket. My hand was filled with scars. Line by line, every touch of the scalpel hurt me. I thought of all the happy moments in my life. All the times I laughed with my friends, all the times my parents smiled at me, all the times I listened to new music, all the times I saw people happy, all the time I was happy. For a second, I thought I was more than my battles, or my scars. I was more than the words that others called me. I was more than those who hit me. I was more than those who pulled me down. So are you. 
You're a person of your own. You define yourself. If you're going through anything remotely similar, you probably cry yourself to sleep, thinking of how your end would be the start of a happier life for others. It's not true. You're not living your life for them. All those times that you've been happy, those countless memories that you consist of, they make you a person. A human. A human others would be glad to meet. Do not die. Life is hard, but you're strong. You have lived through the worst battles, till now. Go on. It gets better. It gets better. 
It really does get better.",12Sep2019,4
83,,12Sep2019,1
84,I see no future for myself and I have no clue what I’m doing,12Sep2019,10
85,"Hi everyone,

Name is Jose. I mainly post on the Sim Racing subreddits but I made my way over here because I wanted to share my story, and also discuss both the outlets I have found that have really strengthened my mental health to the point that I feel some of that innocence of my youth starting to come back and it's beautiful.

Depression, anxiety and OCD ran my life for nearly 20 years. It was my own stories that I made up in my head that led me to that lifestyle and what I have learned is that at one point in my life I made a conscious decision to feel that way based on my lack of knowledge and understanding to what was really happening. I felt these negative effects as if a blanket had been pulled over me and I just felt heavy, slow and sluggish all the time. I started talking myself down and felt worthless. 

I can't even begin to describe how lucky I am to have been surrounded by the people that have been around me for so long and they are the ones that helped almost without them even knowing it. The help came from within me and I simply started to look at things differently and make sense of them differently. I started making conscious decisions to live the life I wanted. 

Now, coming up on two years, my first company will be turning 2, and I have since started working on a new project where I have found the biggest tool to strengthen my mental health.

I started go karting back in Puerto Rico when I was 5 years old. Unable to afford it on my own, I was never able to do it professionally. Simulator Racing has really taken off and taking the plunge to work for myself has allowed me the opportunity to get into Simulator Racing quite seriously. It has made me feel like the 5 year old karting kid I used to be without a worry in the world. Except this time, I'm the same 5 year old with 25 years of knowledge on top of that and the world makes a bit more sense now. It's a beautiful thing. 

Being aware and accepting how this has made me feel, I've really taken on a passion for continuing to strengthen my mental health and also sharing my experiences. I want to share my experiences because for so long I searched for answers, never really finding anything that worked FOR ME. My experiences are from me, dealing with it on a day to day basis, and really trying to learn something from it. I really hope that my experiences are able to help someone because it's such a beautiful thing being able to free my mind, even if it's just for 5 minutes a day, sometimes those 5 minutes can be a life changing moment. 

I am doing all of this through my social media platforms. On Instagram I discuss my food photography business along with the effects that working for myself and working in that industry has affected my mental health, and on YouTube discussing Sim Racing and how the simulator itself serves as another tool to strengthen mental health. 

Should you ever want to seek out someone else's experiences dealing with mental health, my social media platforms are linked below.

[http://instagram.com/jc\_throughthelens/](http://instagram.com/jc_throughthelens/)

[https://www.youtube.com/channel/UC7GDl5Aak5t55v4hhxPL81w](https://www.youtube.com/channel/UC7GDl5Aak5t55v4hhxPL81w)",12Sep2019,0
86,"I don't want this post to sound attention seeking but I literally have no clue what to do next. To start things off my mom has anxiety and depression and is on pregabalin for it (idk how this would help but im clueless on this so I included it anyway incase it holds significance). My mom got anxiety and depression through extensive drug abuse and from traumatic periods In her life, now flash back to about 2-3 years ago when I first started doing drugs, I was a bright kid, was never bad at school and had decent grades, like a year later things started to go a little downhill as I started taking drugs more and more, eventually I started smoking weed everyday without fail and I even steal sometimes just to get a gram because without smoke my brain just overloads and I start to lose my shit at the tiniest things, anyway fast forward to my final year of school, this year was just crazy, I was constantly in trouble at school whether it be for stealing, fighting, being a Kyle and punching walls, headbutting door frames, flipping chairs etc. Just being a complete dickhead in general, but then my head of year pointed something out, there is nothing that puts me in a bad mood, it will just happen out of nowhere, one minute I'd be all happy and hyper in my lessons, and then within the space of a minute id be losing my shit, I did a little research on bipolar and the symptoms just seem toooooo accurate, anyway, you can probably guess how my grades did this year... I didn't get a single gcse, I'm kinda just in self destruct mode, like I don't mean to but I have 0 motivation for anything and it's fucking my dad and my nan up too. (Not relevant but even writing this my head is overloading and I'll explain one problem and then it leads to another, so sorry if this is hard to read) 



You know what there's too much to write down but you get my drift someone pls reply I'm confused as shit rn",12Sep2019,2
87,"I've been thinking of dropping out of school for years now ever since I was in 6th Grade. At the time I didn't mind it much, but wanted to be homeschooled instead because at least I was still studying, just not in school but at home.

Every year (ever since 6th grade) there was always a thought of dropping out of school. Especially when I was in 7th-8th grade, I always found excuses not to go to school. My mom still doesn't know that majority of those excuses were lies, because I knew if I told my mom I wanted to drop out she would get mad at me and give me lectures and all that. 

My thoughts of dropping out kind of stopped when I was in 9th grade because I was finally moved into homeschooling. This homeschooling was different though, you had a choice to go to those classes they have once a week, and my mom didn't ask me if I wanted to go to those classes, she just made me go to them. I got mad at her for a while but I realized I was actually fine with it because it was actually kind of fun and even better than my previous school. 

Moving on to 10th grade I was getting the sense of wanting to drop out again. I didn't mind it though, because I felt like it was just because of schoolworks and how stressed I was. But throughout this timeline (6th-10th grade) I only realized now that my mental health was getting worse and worse every year. I didn't know and still don't know how to deal with it.

I'm currently in 11th grade and I really want to drop out. I've been trying my best to not think about it, telling myself that it's most likely because of schoolworks and all that. But honestly, my mental health is getting worse every single day. I honestly hope I was exaggerating about that but I'm not. I don't really know what to do. I want to tell my mom that I want to drop out after the 1st Sem ends. But I'm too afraid to tell her because I hate explaining why, and I'm pretty sure she won't allow me to.",12Sep2019,2
88,"My friend, and fellow stand-up paddle-boarder has taught me to start saying YES, when everything around me often screams NO.

If you have 4min30sec, please watch is award winning talk here in Canada at a 'Speaker Slam' event, where he won in his category. 

[YouTube Link](https://youtu.be/2R5DYP1ipD0)

Thank you Mike!
PaddlesUP!",12Sep2019,2
89,[removed],12Sep2019,1
90,,12Sep2019,0
91,"As someone who grew up with anxiety and depression, the mental health issues I am seeing in teens nowadays deeply worries me. I hope this podcast helps shed some light on the issue: [https://youtu.be/LGHbI-iYAZQ](https://youtu.be/LGHbI-iYAZQ)",12Sep2019,2
92,"Ever since I was 14 (I’m now 18) I’ve had waves of helplessness that make me feel like life has nothing for me and that everything is too difficult for me to handle. I’ve spend two months of holidays doing nothing (I did enjoy it for the most part though) and now that it’s time to go back to school I just fell back into this old mindset. I feel irritated by everything and everyone, I find everything exhausting just thinking about it and it feels like everything I’m doing is for nothing, that I will never amount to anything and disappoint everyone. Like said in the title, when I start overthinking about all this I always end up wishing I were just dead. Anyone has advice to alleviate it ?",12Sep2019,2
93,"i don't know if this is appropriate here. if so, i apologize.

before beginning: hey, hi, hello! my name is cait and i'm a bit of a writer (if that's what you want to call it). i do work a pretty steady job, so at least i have that going for me.

i'm going through a bit of a tough time. my mood is all over the place and i feel like i've just lost my FP. to go a bit into it, they're currently on vacation and i asked a question. we typically talk via discord, but discord wasn't working so i assumed messaging them would be okay.

however, it wasn't. they turned on me and said i shouldn't have blown them up the way i did. the spat continued into the late hours of night until they said: ""cait, i'm done."". noted that this has happened several times before and i may have been in the wrong. they wanted to stop talking to me. i broke down. i had a panic attack.

this person is my fp. we write together and talk a lot. and i don't want to lose them. while we've spoken today, i feel like they're slowly drifting away from me. i don't want them to go. typing this hurts. but i proceeded to move on. write with others until they wanted to write again.

we were talking for a bit and this morning (around 2am) i woke up to them saying that they needed to close the chapter. i was blocked, and now i’m completely lost on what to do.",12Sep2019,1
94,"Basically, I'm totally addicted to destracting medias like movies, tv shows, songs and reddit. I used to be a great reader but now I hate reading on phone. It's come to the point that whenever I watch a movie or something these days, I feel immensely guilty and I can't enjoy any of it. But I can't stop watching because I don't know what else to do with my time. So I always end up coming back to my phone. How do I get out of this vicious cycle? Please help.",12Sep2019,1
95,Sorry if this is too much info but i have had germ/spreading germ ocd for a couple years now. So today i used the bathroom at work and noticed a brown spot on the brim under the toilet seat. I was wiping and the paper came pretty close could have touched the brown spot. Now i have this fear that i can get some really bad virus or std from this😔. I also get hemroids pretty often so my area down there is always a little tender so i am not ruling out having a cut.  Some help would be greatly appreciated i am trying to get over this myself but i am having no success,12Sep2019,3
96,If people such as my mum is telling people i have anxiety it really annoys me because there are loads of different types of anxiety and each one is different. I have social anxiety so for my mum or people to just refer to it as anxiety means people won't under stand me properly they will just assume i get anxious about general things and not the fact that I'm so god damn horrible when it comes to social interactions and by saying i have social anxiety and not just anxiety means people should at least have a better understanding as to why i act the way i do.,12Sep2019,9
97,"Hey,  

This is an attempt from me, because I am feeling really bad rn (and I dont know if im in the right subreddit), to try and get some help.

&amp;#x200B;

Ive never had friends nor hang out with anyone for the last couple of years (im 22 now) but i did have my gf.  

I had PMO problems and it ruined my relationship with her. I would think of other girls, think of cheating, bored with sex cuz PMO ruined my head etc.  

Since it was like that, we would break up occasionaly for like few weeks, and I would start feeling dreadfull without her.  

Eventualy we would get back together.  

This happened a few times over last couple of years and it would always be the same in my fucking head:  

**When shes mine** i dont love her the way a bf should, especialy with that PMO situation, i would be like yeh shes here, as if she was just some kind of arbitrary extra for me, not my soulmate.  

**When we break up and shes not mine**, I cant sleep, I check mesages every 30min to see if she responded to some random msg i sent her,I cant eat, im crying-  

&amp;#x200B;

We broke up 2 months ago when I went to my vacation house due to same problems, but in those 2 months i tried and did fix my PMO because I truly wanted to be with her and have a healthy relationship (which ofc then includes sex life too)

She offered me to be together again a few weeks back when i got back from my vacation house but I didnt want to cuz I fixed my PMO problems and I wanted to fuck other girls while having her as an option. However I didnt do anything, I tried but I would always end up thinking about her no matter what I do. Like ""Wow, maybe casual sex isnt better than having a real loving gf"" (i never still had a casual sex with anyone other nor had any other gf ever, so my curiosity kills me)

This is now, our last cycle (currently in breakup faze) and last few days i couldnt function and she was in town where i live and we said we would maybe see eachother but she said maybe not because she was ready to move on from me. Iz was literally killing me. I was in my bathroom 3am shakin freezing cold, afraid i might lose her.  

I would wake up in the middle of the night, check my phone at like 5am then go back to sleep anxious.  

&amp;#x200B;

**NOW FOR WHAT THE FUCK I CANT STAND ANYMORE:**  

Like I said, ***when Im losing her***, or i know shes not mine and shes slowly deleting memories of me in her head, im losing my mind. Im thinking like ""ok other girls,casual sex"" but i end up just crying, thinking how i shoulda told her i love her, how i shoulda been honest, and how im ready to accept that im fucked up but she still wants me and i want to become a good bf to her.  

And ***when i know im not losing her***, like just today when she just told me she will come to talk to me, and when i asked does she wanna stay few days, she said maybe if our talk goes right. This in my head means that we are going back together AND ALL OF A SUDDEN IN 1 SECOND I lose all those fears of losing her, all those EVERYTHING, i can eat I can whatever. But in a bad way, im no loger having that inner fire thinking ""i just want to hug her, fuck everything else"" or ""im gonna run up to her when she leaves the train when she gets here and just cry in her hug"" and im just like, chilling.  

Like almost ""eh, whatever"" stance. Like I dont care, were together again, cool. LIKE WHAT THE FUCK IS THAT.    

Im no longer like wanting her love, her touch **as much**. I literally would do anything for her to not go when shes not mine, and when i get a confirmation she still is, im like cold stone chill almost dont care, dont wanna go to park or moovies as badly as i wanted when she wasnt mine.  

I am so sorry for this awfull text, but i just didnt know what to do and I dont wanna spiral down some bad thoughts...  

**TLDR**: I want to love my gf like she deserves it, and give her back the love she gives to me. When shes gone, Id do anything in world to get her back, but when I do get her back, I just instantly turn cold, like i dont care ""stay or go, whatever"". If it sounds sick, you got it correct.   

What to I do, how do I get help.",12Sep2019,1
98,"Failed everything, I’ve got nothing and nobody and my mental health has deteriorated to a point where I cannot easily re enter society again. Idk why I felt to write this here, no one can help but I guess just writing it helps. Good luck with everyone else fighting the good fight.",12Sep2019,1
