,text,time,score
0,"Came across this podcast today. It's getting bad when even second graders are committing suicide. I hope this helps someone today. 

Every person matters. I've had anxiety and depression for as long as I can remember. Podcasts like this remind me that there is always someone that needs help. It's up to me to ask.

https://www.clearpathtraining.com/post/podcast-when-second-graders-are-committing-suicide-it-s-time-to-do-something",12Sep2019,1
1,"It's like 2 am where I live and i used to cry when I went to sleep almost every day because of overthinking about my parents and time and my friends and all those things,but today I stopped I did it,i started crying but I managed to stop instead of being 2 hours crying.
Yay :D",12Sep2019,3
2,"I'm tired, so so tired.",12Sep2019,2
3,"Little back story, was always happy annoying loud outgoing helpful motivated and everything good (almost seemed I was stuck in a manic phase my whole life), till one day I just woke up after a heavy night of drinking and everything was wrong. My heart would race anxiety was awful everything felt wrong couldn’t sleep anymore, motivation was gone, ptsd type thoughts came in racing my head, couldn’t get out of bed, nothing sounded good anymore, girlfriend helped the most out of everything I tried, my bowl movements changed, lost 20 pounds in weeks, couldn’t smoke weed anymore, just completely went of to a opposite person who I thought I couldn’t never be.

Been on:
Wellbutrin
Lamictal
Zoloft
Buspar
Clonazepam
Xanax

So I started seeking mental health. So they put me on Wellbutrin, I didn’t really give it enough time to really work but after a week it may have seemed to make my problems worse and suicidal intentions worse. So I stopped then lemictal did nothing. So then they tired. Zoloft after even the first couple of times it finally felt like that cloud was gone from above my head. But beeen using that for 5 months now and still I feel pretty awful it almost seems like I just got used to my problems so it doesn’t seem as bad as before. 
I just wanna know what went wrong and if you guys think you might have an idea what might be off in my head and maybe give some medication I could try.
(Benzos help me deal with it but do not help with it at all, even if I’m barred out I still feel like shit I just don’t care)",12Sep2019,1
4,"I am a 17M who has had a lot of mental trouble for the majority of my life. It is nothing severe (thankfully), but it hurts me still.

For years, I can not find enjoyment in anything. I’ve tried so many hobbies and so many activities. Nothing seems to “spark” with me. Not even relaxing makes me feel good. I don’t feel happy at all. Only video games have given me some enjoyment. In the past 3 years or so, it has gotten worse. I’ve had breakdowns where I just cry to myself (not a lot, a few). The only thing I find myself doing now is just passively watching YouTube or music. I want to do stuff; I want to be able to enjoy a hobby, at least. However, whenever I try to, I feel nothing. Nothing to keep me pushing forward. And when I do, there comes the inevitable mistake one makes, and I just get very close to said breakdowns. I’m nowhere near suicide, but I feel so depressed and emotionless all the time.

I’ve only tried talking to my parents about this a few times. There are times where I mention I enjoy nothing, and while they do seem concerned, nothing comes out of it. There was also another time where I came into tears with my mom about it. She did seem worried- I am not saying they don’t care. But, she just blamed it on hormones. That was two years ago. I’m still being affected by this.

What should I do? I’ve considered going to a therapist, but I don’t want the cost of it (US resident here). I also don’t want to add more costs to my family. My brother had to ride in an ambulance for something, which cost a good sum of money. My mother had to be in the hospital (for a personal reason), which also cost a lot of money. Then, my father had to be hospitalized for weeks because he got bacterial meningitis, which was also a lot of money. I don’t to add more burden. I also feel bad for talking about this. I see so many people posting they are “depressed” but are not, that I started believing that I am either faking it, or I am over exaggerating it. I don’t want to pay $1000 for a therapist to say that I am just a hormonal kid. What can I do?",12Sep2019,2
5,"I decided to room with one of my best friends, I'm really socially akward so thought it would make the transition to college easier, but honestly he doesnt really have any respect like I thought he would, he's even been treating me like utter dog crap too! Like he always calls me a dumb ass all the freaking time, even over the smallest things and it's REALLY annoying, and he's just been really rude and really inconsiderate too! Like at night he'll stay up to like 2 playing xbox with his friends, or watching youtube, which I really wouldnt mind if he wasnt so LOUD about it and when I try to tell him if he could turn it down a little, he just calls me a bitch. Also today, it was raining and I wanted the windows closed so my PC, which I built and was expensive, doesnt get wet and damaged, he called me a b*tch said the room gets to hot for him, opens the window then goes to class and as the dorm door is wide open yells that I'm a b*tch, now I'm afraid our RA and other people on the floor think I was doing something mean... I didnt think he would act like this in the slightest, I get that friends wont always get along, they'll fight, and poke fun, but holy cow I wasnt expecting this! I'm getting annoyed and really frustrated that he doesnt have any respect! Also earlier in the year, he said he doesn't care if my stuff gets destroyed cuz, I quote, ""it's not my sh*t, why should I care."" He also always tells other people that I met that I'm a dumb ass, a b*tch, and a lot of other stuff and it's getting really annoying... I'm afraid to try and change rooms cuz I don't wanna start any more drama then there already is... I think that I'll just have my parents take my PC back home when they come and visit soon since I dont even use it that much because of college anyways, and hopefully I make some new and better friends whom of which I can room with next year instead.

Final thing I think I should add, I treated him like he treats me, and he he got all depressed and mad as heck at me and said that I was doing it to be mean while he does it all sarcastically, which kind of screams hypocrisy... Honestly maybe I really am just a b*tch, and I really am just a dumb ass, but I dont care I just dont want my stuff to be broken...",12Sep2019,1
6,"I have been having a lot of vivid dreams that are so convincing I wake up assuming its real. And then by the afternoon I dont know if it happened or not or if its real. I'm abit unsure if this is a result of the abuse of hypnotics and blackouts so on or something other, I have diagnosed with possible delusions which I believe is a psychosis? Would they be linked?",12Sep2019,2
7,"I am 33 years old turning 34 soon, used to build websites using CMS but that business died, got fat and I fueled my online gaming addiction in the process as for the time it was easy living fixing desktop PC and building websites until that industry collapsed and transformed and I didn't keep up enough. Wasted my life doing an advanced Diploma in IT which I never used or didn't push hard enough to find a job when I could now the Diploma is almost useless. 

Ended up working in a company that delivers goods like sugar and doing hard manual labor, I am hated by everyone because I have a lot of education and am doing said job and people think I am stupid, lazy and spoiled for doing this kind of work. I saved my money in 2 years doing this work and paid to do a full 1 year HVAC course in a refrigeration school I also lost 50 pounds and feel much healthier and can climb easy now, I have 1 month before completion and now I am getting more hate from co workers. They tell me I will never amount to anything and I will waste my HVAC certificate like I did with my IT diploma. So much guilt I feel now you wouldn't believe it not even playing video games can take it off my mind

Then I got an anal fissure from constipation that is still ongoing after 8 months and lots of pain and no medication can cure it. But it is however easing up and is a lot less painful now tho I have to drink milk of magnesia every night and use an expensive cream. Who knew constipation could be so deadly? 

Then there is Karen, who is she you may ask? She is my cousin's ex wife she married my cousin in 2001 and they had 2 kids who are now 16 and 18 each. The guy she married was her first ever man she is a very nice and quiet person and very decent and kind, after getting married and moving into a room in the same house that he and his family lives her husband sisters along with his father started cursing Karen, taking her groceries etc when she wasn't home and tossing it into the trash destroying her personal belongings. She started spending her hard earned money to buy her inlaws things in the hope of them treating her better, this was a lost cause as they all wanted her gone as they were jealous of her success in life in both being pretty and an accountant. She bought a new pair of sneakers for her husband's father and he threw it at her when she offered him the gift then cursed her and they all banded together in that house to fuck up Karen's life. Karen's husband turned out to be a gambler and a drunk even tho he has a great job, he treated her so badly, so after 3 years of hell and 2 kids she packed up and left got a divorce and never looked back. The bastard husband didn't even care for her

Her same wicked father in law came with her son last month by us home here to visit and brag about his grandson's success as if he had anything to do with it. This triggered the memory of Karen in me and got me seriously depressed, even tho its 16 years since I last saw her it still pains me deeply to even think about what she went through, she used to tell me all what they would do to her when I would visit her when she was living there. 

I desperately tried to get into contact with her by asking a decent family member for her number, all efforts failed until her son gave her my number. This decent family member told me Karen won't speak to any of us no matter who it is but I wanted to try because last year Karen was missing and nobody cared to even inform any of us. 

Finally Karen messaged me 2 days ago I phoned the number immediately and told her how I wanted to know if she is fine and how I missed her kindness. She told me thank you but she also said right now she doesn't want to speak to anyone this is 16 years later she still won't speak to even me. I was in utter shock and disbelief but I also understood why she is the way she is now, she is broken and hurt beyond repair and who wouldn't be? I messaged her and let her know that I know what they did to her and I will always stand up for her character and name no matter what. 

She thanked me and said she is happy that there was still 1 good person from my family she said she appreciated the support. She then blocked me on wats app and now I know that there is no more tale to tell, it bothers me greatly not that she blocked me but that she is so hurt, the pain appears to transfer over to me in some weird way and I don't know why I feel so hurt and broken over what happened to her even after so long. An old wound shared for an old friend that I have not seen in a lifetime.",12Sep2019,4
8,"Hi all. the way I see it, if I was never born, I wouldn't care if I don't experience happiness. I wouldn't have a conscious mind to begin with. i wouldn't exist, and I would have never existed, so I wouldn't care.

to me, most of life is either mundane, painful, or not worth it. the happiness never lasts long enough and I can't do much to fix the world. 

I don't want to die, but if given the option, I'd pick ""go back in time and stop my dad from nutting in my mom to create me"" rather than ""keep living life as it currently is.""

&amp;#x200B;

people say that someone bored by our world is just a boring person, and that someone who sees all the bad is and edgelord, so since I don't want to die but rather would choose not to be born if i could choose that, am I normal? 

&amp;#x200B;

i don't long for it or anything. i just know i'd choose it if i could. life's joy isn't worth the pain to me. and then you try to tell others how you feel and they put you down for it. anyway, is that normal or a sign of something?",12Sep2019,1
9,"So I am a 14 year old (M) who is clinically diagnosed with OCD, anxiety, and chronic motor tic disorder. These are all problems that I have been experiencing for 10 or 11 years. I have been in and out of therapy throughout my life, and I have been seeing my current therapist for basically 2 years. However, I feel like it’s really not helping me. I don’t feel like I’m getting better and it’s costing my parents a fortune. They have been suggesting getting me medication, but I don’t want to resort to drugs if I don’t have to. I’d like some advice on perhaps some things I could do so that I don’t have to go on pills. I’d like to get better on my own so that I’m not reliant on medication for the rest of my life. Anything helps. Thanks.",12Sep2019,1
10,"I have this belief that my father and soon to be stepmother are neglecting me to the point of poisoning my food. I believe that they want me to become sick so that they don't have to deal with me anymore, and that they know I have a mental illness which they are exploiting. However, I lack any evidence of this and it all appears in my head. But it seems so real that I can't sleep without taking a benzo. If I don't take a benzo, I think about all the ways people want to hurt me. Then, during the day, all I do is walk around the house in agitation, without eating or taking care of myself. The stress has caused me to form chest pains, a cold that lasted two weeks, and like I'm about to collapse. 

I am seeing a counselor soon, but there's times where I feel so hopeless that I need to be hospitalized. What should I do to fix these problems, and what is wrong with me?",12Sep2019,1
11,"Today is a the biggest mental health awareness day in Australia so wanted to do my due dilligence and make the effort to spread this awareness far and why and contribute to those who need the support. So for you who are reading this R U ok? If you are I am really happy for you, if you're not please reply below and share your story.",12Sep2019,1
12,"Ok so over the last year I have become completely obsessed with the idea that I have a cluster B personality disorder, specifically Narcissism. This has come in tandem with increasing guilt and shame about my thoughts and actions from when I was younger. I have come open about these fears to some close friends and family and they have been completely reassuring that they don't think I am a not narcissistic, but I feel like maybe I just internalize it but don't let myself act out in a shitty way. I'm pretty sure I have empathy but now I even question if I really do. I'm maybe 8 sessions into therapy and my therapist has identified that I have had internal feelings of not being enough since a quite young age. Kindergardenish. I'm so terrified of being a horrible person. If it matters I have generalized anxiety disorder and some obsessive tendancies, and ADHD. I've been under the advice from friends that this is just an obsession but yet I am constantly identifying judgemental internal thoughts that are reflections of my own insecurity on others. I just don't want to be like this. I don't want to be a bad person but I'm so tired of the constant thoughts and anxiety. 

I also have some dependant tendancies and fear of losing my friends or pushing them away and being alone. I have commitment issues from a past relationship that was traumatic but have a minor obsession with finding a serious relationship before college ends because after that I feel like dating opportunities get scarce. However I also believe that I shouldn't get into a relationship because in reality I would be doing it for the wrong reasons and I might be a narcissist and I don't want to be a shitty partner. 

Has anyone else felt like this or have any advice? I've heard the whole if you worry you might be a narcissist then you aren't one but the DSM V doesn't say anything about lack of self awareness in it's diagnostic criteria.",12Sep2019,1
13,"Im struggling between believing that i have these problems and that im not depressed enough to be depressed. 

Whats going on with me. I got so angry over this i just gave myself a black eye. Fuck",12Sep2019,2
14,"A bit of past history: i'm currently 25 and have been displaying symptoms of clinical depression (diagnosed at 17) since I was 10 years old. Most probably triggered by a traumatic event that happened then. Since then I have slowly been developing symptoms akin to Bipolar II, which is the most likely cause of my mental health issues now. I have family members with Bipolar, and myself and other family members strongly believe my mother has it too but no formal diagnosis. 

In the past I have been seen by counsellors, CBT therapists and a small stint of EMDR (for Chronic fatigue syndrome). Other than the EMDR and 1 counsellor, the rest of my experience with mental health professionals was before I was 18. But that's not for lack of trying. I have been trying to get mental health help for years. I thought post-pregnancy I would have more luck, but instead I seem to be ignored even more. 

At 5 months pregnant I was deemed 'at risk' due to mental health. I had a counsellor through the pregnancy and then for 6 weeks post-birth. I was supposed to receive care at a local perinatal unit, but they conveniently found a reason not to have me in their care. But they wrote a letter saying I needed Secondary care due to long-term mental health issues. Weird how they said I need extra help but weren't willing to do so themselves. 

Asked my GP for referrals a few times, 1 referral was sent through to a short-term therapy centre who said they cannot help me as I am 'too complex'. That referral was closed. My most recent referral led me to my area's main hub for patients who need extra help with mental health due to long-term illness. I thought 'great, finally going to get help'. But instead I was told they cannot help me as I 'only have depression'. Apparently because I don't exhibit extreme euphoric manic episodes I cannot possibly have any form of Bipolar disorder. I literally tick every box for Bipolar II except for sexual interest... and been advised by other medical professionals that I exhibit clear signs of Bipolar disorder.

I was supposed to get a call back from that mental heath facility, but have heard nothing. I have rung twice (well, twice I've gotten through, usually it just rings for 10-15 minutes, and I give up) and both times they say they'll get someone to call back. 

&amp;#x200B;

I'm just tired. I have a 2yo little boy, a flat to upkeep, and a psychologically and emotionally abusive mother who I have to care for. And all the while I stay up until 3am+ either crying or zoning out for hours at a time. I'd pay for private psychological help but i'm not in a position to pay. All the charity mental health counselling either has a long waiting list or doesn't serve my area. I'm stuck as to what to do. 

I'm sorry about the long post, I suppose I needed to vent and I heard Reddit was the place to do that. I've just lost all enjoyment in my life because i'm so drained mentally. I want to give my son the best life, but how can I do that if I'm being a zombie mother who isn't really, fully there....",12Sep2019,2
15,"My friend has depression, pretty fucking severe depression too. Her parents know she’s depressed, they know she needs her medication. They’ve known for 5 years now (Holy shit we’ve been friends for 5 years) and they still fucking forget to get her medication for her. They can afford it, they just don’t get her medication. Its fucking annoying and abusive and I fucking hate it. I think its intentional too, because they seem to not buy her medication whenever she’s getting better, every fucking time. I hate this so much.",12Sep2019,3
16,I recently heard that if people say stuff about you a lot ots mostly true... and one of my friends calls me a dumb @$$ all the time and my other few just say I'm dumb or retarded... I mostly got A's and B's but I guess that isnt good enough... so how do I get smarter?,12Sep2019,1
17,[https://wix.to/g0BpA10](https://wix.to/g0BpA10),12Sep2019,2
18," I've been feeling really guilty about sharing my suicidal thoughts with close friends and family. But I feel like I can't really handle my thoughts sometimes. After expressing my thoughts, people try to make me feel better. Afterwards, I tell myself I'm bad a person for being emotionally manipulative; making my busy friends and family take time out to calm me down. Other times, I say my coping mechanism didn't work and I just needed help. 

I don't know what to do anymore",12Sep2019,2
19,"Should I kill myself because?:

* I've always been really insecure and hated myself. I never had friends and don't have a single one now. I tell myself I'm a freak and a loser every day
* I'm angry and sad all the time
* I hate being Latino. I hate my Spanish name. I hate not getting better jobs, raises, or promotions like a white guy would
* I hate my parents. They're terrible typical Latino parents who never provided for me. My mom is a disabled mentally unstable abusive lunatic. My dad is an irresponsible loser handyman who never helped me financially in any way
* I hate being stupid. I think my intellect is so low and I always feel intellectually inferior to everyone else. I've been in the US for 13 years and still have a slight accent. I'm just too stupid to sound American
* I'm bisexual. I hate being a fag who has never related to real men. I literally only had 1 gay male friend and we're not friends anymore. I feel like such a freak whenever I see a guy and think he's cute. It repulses me.
* I hate my job. I'm basically an admin and work with all women (and have worked in all women environment for years). I work for a pharma company making $65/yr w/no benefits and can barely pay my bills (live in Boston- REALLY expensive out here).
* I feel so inferior to all my MD and PharmD coworkers (vast majority of them are these). They probably give all the good jobs to all the white guys instead of me
* I feel like no matter what I do, I'll always be poor and a loser bc I'm Latino and all the white guys and Asians take all the good jobs
* I do have a GF. She's a white Physician Assistant. She makes $110K. It's so humiliating to have a PA GF and you as the man basically be the secretary working with all women. It's so pathetic and degrading. Her parents are the perfect white family. They paid for her college and supported her completely. Mine couldn't even afford a roof over our head. Her fam is so typical white and mine is so typical Latino
* I have eating disorders
* I can't stop thinking of past mistakes or dumb shit I said as far as 10 years ago. The memories haunt me constantly and just remind me how stupid I am

I don't have a therapist and for the first time I've almost committed to going to a hotel and shooting myself",12Sep2019,4
20,Curious how i make an appointment with a psychiatrist? Do i just randomly call one i find on internet? how do i know a good one from a bad one?,12Sep2019,9
