,text,time,score
0,"I invited my friend over for a party and my brother and sister had a bunch of their friends over as well. My whole family was there too. We went in the pool and also had chips with dip with people most likely double dipping so germs were being spread around a lot. Few days later most of my family is sick and we are about to leave for a long family vacation overseas in a few days. We all more or less have a fever, sore throat, headache, chills, muscle sores, nausea and all that. It’s bad. I told my friend I’m sick and she said she had the same exact symptoms two weeks ago.

She’s anti vax and opposes medicine in general so she did not take antibiotics or any medicine for her sickness. I read that when you don’t take antibiotics it makes the sickness last in your body for up to two weeks even after symptoms have disappeared and you can still be contagious. Basically I believe she literally contaminated the majority of my family at my party and probably my siblings’ friends as well.

Bummed because we are literally about to go on vacation. It’s my parents 20th anniversary, me and my mom’s birthdays, and my graduation celebration all in one basically. I don’t know what we are going to do when we are all sick af. 

Also I don’t know if I should tell my friend and say hey you got everyone sick next time take responsibility and take fucking antibiotics so you don’t contaminate everyone around you. What do you think?",29May2019,1
1,"I don't post stuff like this...but oh well. My life right now pretty good, I have everything I could possibly need. 
One problem. I feel unsatified. I have great friends, I like my school, but it feels as if I am stuck on the same routine. I have been told a lot of people like me because I seem down to earth but I question if they like me for me or if they like me for my name. I overthink everything. It seems that everyone is fake these days. I know I am only in high school but it feels like it will never get better....how do I stop thinking this way?",29May2019,2
2,"Mom is an immigrant (permanent resident, non citizen), speaks little English (heavy accent), and currently works night shifts at Wal-Mart as a sales associate. She is early 50's, with a previous bachelor's degree from her home country. (self described that she doesn't know most of her education from back then anymore). She is raising my youngest sibling who is 10 and on the Autism Spectrum, which is why she works at night (she takes care of him during day, our dad during takes care of him at night). Soon (no definitive timeline given to employees yet) the Wal-Marts in the area will not be open 24 hours. Same with Targets, and other comparable jobs which means my mom will have to find a new job. She looked at janitorial jobs or maybe cafeteria/lunch lady, but I think she could go back to school for something like medical billing and coding. With online school, she could work towards a certificate of some kind soon enough. Money will be an issue, family is pretty in debt and doesn't make a lot of money. I'm seeing community colleges that offer ""Continuing Education"" programs, but what kind of programs would be right for her? Can she just apply to be accepted into studying for an associates? Any other kind of high education or career she could learn? What should she keep in mind while she makes some important decisions in the next 6 months or so? Can I do anything as a 19yr old college student?",29May2019,1
3,"Hi. I'm a 15 year old male who thinks is bi and i just lost my virginity to a guy who was older than me i don't know his exact age but definitely older than 18 he was cool and chill about everything even though he knew my age and i knew his. I was sexually frustrated and really horny and was basically going through grindr being extremely thirsty until i texted this guy named Mike. Now the thing about me on grindr is that i ask guys for pics and after they send and i send my own i normally just jerkoff and that's that. At first i texted him a few days through the app asking to trade pics and he declined fast forward to this afternoon he asked for pics while sending some of his own. I sent him some and he complimented me and told me to meet him in his apartment building. I was hesitant and finally decided that ill tell him i can only go for a little bit and he says it's fine and tells me to come. Now ive never done ANYTHING sexual with anyone in my life. Ive never had a boyfriend, girlfriend or my first kiss and obviously ive never had sex. So my horny self decides to go after i ask him for a few more face pics. It was a short walk 12 minute that felt like forever i was cold even though it was 70 degrees and i was shaking because i was so nervous. So i get there and find him and he leads me to the top floor staircase. He sits on a window ledge and im sitting on the stairs still nervous and he just talks a little trying to break the ice I guess he talks about how he declined me at first because he didn't trust me and explains that i shouldn't do something i didn't want to. He mentions how me being so shy is cute then asks me what do i want to do. At that point I felt like i left my body and was looking at myself from outside my body. Ill try to skip over the nasty parts but I say what i want to do (bj) so he takes it out and it feels like a dream. Not in the fact that im enjoying it but in the fact that i didn't feel like myself. I just started and tried to mimic what I see on porn. Then after a while he asks me to get up so he can see my ass i do what he says and he compliments me while feeling me up and I say ""maybe you could try putting it in"" WITHOUT A CONDOM I SAY THAT. IT WAS SURREAL I DIDNT FEEL LIKE MYSELF so he asks if im sure and i said ""Yes"". So he starts slow and after a while i ask him to ""go faster"" THIS STILL DOESNT SOUND LIKE ME I also say ""Talk Dirty"" Im not sure those were things i just found hot. He asks if i was ok multiple times and i say yes even though it did sting a little. So we finish and we tell me i should go down and he goes up on the staircase YES WE HAD SEX ON THE STAIRCASE he gives me a peck and i ask him if i could try again since it being my first kiss. Then i walk home with a million thoughts running through my head. He didn't seem like a bad guy he was genuinely nice and made me feel somewhat comfortable but he did know i was underage heck maybe he regrets it. I think about telling my friends but i think i shouldn't because they might think im dirty and I feel dirty refusing to look at my reflection. i think about being a highschooler and not experiencing sex with someone my age and i think about how overexaggerated sex is in tv and in high school. I think about if i liked it or not, I think about him saying ""if there's a next time"" and if i should see him again. I just felt overwhelmed. I always saw ""my first"" as something sacred even though im not religious. It was just weird I don't know",29May2019,1
4,"I really want to stop self pitying and victimization. I want to feel self love and self gratification. Maybe without a therapist, preferably. Maybe within the form of some media like book, documentary, or like podcast. I heard meditation helps. Please help me, I want to change who I am.",29May2019,1
5,"Sorry if this is not nearly as interesting or special as most threads on this reddit, but im not very socially talented, so some advice on this would be much appreciated.

A good friend of mine told me a while ago she's in a wheelchair due to a surgery because her spine wasn't growing correctly, she cant keep balance by herself now. I know she is very insecure about this and it took her a long time to tell me (it's a long distance friendship). Ofcourse i told her it wasn't going to affect our friendship in any way and i still cared just as much about her.

But even though i know she trusts me and she told me she's comfortable talking to me about most issues, she avoids the topic. Personally i would like to know more, both out of curiosity and because i care about her. But i am not sure how to bring this up, if i should approach this casually or in a serious matter, or just not at all. Any advice would be welcome :)",29May2019,2
6,"I'm wondering how not to be lonely and open up more because over the years I have closed myself off from people due to bullying and being backstabbed or forgotten by past friends even when I try to initiate contact. It has gotten to the point that I don't like going outside of my room because I feel safer there. However, because of this I have phases where I get really lonely and I'm wondering if anyone can give me some advice about how to fix this?",29May2019,3
7,"Hey guys so I don’t know if this is where I should post this but I need to know how to answer in this scenario. 

So I have a friend from college that is in one of my classes with me, so we were texting today and he said there was something about me that looked different today. 
Long story short he said my new haircut looks cute, so I said thanks and couple of minutes after he said it looks sexy on me. I don’t wanna be the kind of girl who says “oh I have a boyfriend” for something stupid, but I just don’t want him to keep saying those things because it feels weird honestly and I do have a boyfriend. 

Also, I don’t know how to react to compliments so this is more awkward than usual and I don’t like it. 

TL;DR: my friend from college is complimenting me and saying I look sexy and it feels awkward because I have a boyfriend and I just need to know what to answer in these situations please",29May2019,1
8,"My friend and I talk everyday (he’s been busy with work lately so we only exchanged a couple of texts on Friday). 

I messaged him Saturday night and he got back to me Sunday morning. I responded in the afternoon when I woke up. I got no answer. I messaged him again Sunday afternoon and still no answer. I called him a few times Monday, no response. I texted and called today a few times and still no response. I am extremely worried as we talk at least once a day. I can’t stop by his house since we live in completely different cities. 

What should I do.",29May2019,1
9,"I have a bad case of this disease called exostosis. it's like extra bones growing out of nowhere on the surface of an other bone, i have it on my shoulder, knees, ankle and my wrist, it effected my life on every side, since i remember i always was ashamed of the way i look and walk, i always felt like people are watching how weird i walk, i always wear cloth in a way that they cover my legs and shoulder, always wearing baggy pants and like that.   


I walk weird and don't even talk about running, normally it's not painful tho, it' only gets painful on my ankle when i walk for long or run or doing some heavy exercises.  


the treatment is surgery and removing the extra bones but it's really expensive and insurance in my shitty country only covers just a small amount of it.   


so yea, I'm 21 here, don't have any money nothing near what i need, i'm barely making enough to pay my rent, got a poor family I'm really tired of living like this.  


please give me some advice  
thank you for reading and sorry for the bad english",29May2019,1
10,"Well, I'm a untalented person. I realized it about three years ago, so I decided to learn guitar and start a new hobbie. I didn't learn almost anything theoretical, but on the other hand I practiced a lot. It was cheering me up a lot and helping me to pass through hard moments in my life. But as time goes by, I got really discouraged. During almost two years, I wasn't improving too much, even though I was trying hard. I also had no one to share about what I have learned, so I gave up.

A few months later, I knew about a recently formed group from my neighbour. In that group, they practiced a lot of instruments, including guitar. But I also gave up quickly because there was a guy who was always hitting on me and being inconvenient. I had no incentive anymore.

I miss playing it, I just don't know how to encourage myself to start to play again. I'm afraid of trying and getting disappointed at myself.",29May2019,2
11,"i met a girl at the beginning of the school year and we really clicked, and we're hanging out a lot and making lots of plans together with ourselves and our friends. recently we've been flirting and been a little touchy. everything is there and i think of her everyday, but when i see her face i don't really see myself attracted to her physically. she's not unattractive, but shes not my ideal type either. i dont really know what to ask for specifically, but what do i do?",29May2019,7
12,"So I just finished my junior year yesterday and now im heading into my senior year at a high school i didn’t want to attend in the first place. I wanted to go to this other school where my best friend goes along with some other people I knew.

When I started there my Sophomore year I didn’t want to be there at all but I accepted the fact my parents couldn’t/wouldn’t enroll me in the school I wanted. I started meeting people and hanging out all the friends stuff. I made it through the year and still wanted to go to the other school but just accepted the fact that wasn’t happening. 

Junior year starts and a lot of stuff happens to my personal life where I won’t go into detail. I make 2 new best friends and start losing contact with my friends over in the other school. I go through winter break and come back. By this January I had stopped thinking much of the other school but occasionally wonder and wished I’d be at the other school. But then I met my now girlfriend and then more personal stuff happened involving my love life and friendships. I’ve gone through a lot with my new friends. 

I’m about to go into my senior year now same school. But at my school senior year we have to choose our “propaedeutic package” which is basically a package including classes for regarding certain career paths. There’s “Chemist-Biologist”, “Physicist-Mathematician”, “Economic-Administration” and “Humanities”. Now, ever since I heard the 4 options I had I’ve wanted none of them and I had to forcefully choose which I would go into next semester. 

Here’s where my problem comes in. 

A few weeks ago my mom told me there might be a slight chance that I can switch schools to the one I wanted to go into the first place. Of course at the news of this I started getting a little excited but not too much. Tomorrow we are going to the school to see if I can get enrolled for my Senior year. 

My problem is that I don’t know if I should change schools. Even if I did my problem then becomes how am I going to tell my friends and girlfriend that I’m leaving them to go to another school? How can I tell them that in a way where no one is hurt? I also don’t know how to handle this situation since we all are out on summer break already.

Should I even change schools?
How am I supposed to tell my friends if I do?",29May2019,1
13,"I sustained a TBI (traumatic brain injury) in the summer of 2012; I was in a coma for a month, have right sided weakness, I hope and ptosis. I've often wondered if I was able to get pregnant, and after much googling on the subject I've concluded that I can, even tho it may be difficult. 
I've also read that I will experience extreme fatigue afterwards and possible postpartum depression. 

I was wondering if anyone who has had experience with head injuries and getting pregnant have any advice, tips, or stories to share!",29May2019,2
14,"Im about to graduate hs in a few weeks and I have no idea what I want to do with my life. Like when people ask about what my goals and my dreams are I just draw a blank.. Ive started trying to avoid relatives because all they do is ask questions I dont have answers to. I cant comprehend how some people have everything planned out and have known since they were 12 that they wanted to be a lawyer or whatever.. I just have no idea what I want to do. How could anyone make such a big decision. I dont really have any talents or skills.. nothing I like to do really transfers to a good career or job. All I like to do is read, listen to music, and go on walks with my dog. I just really dont know where to go or what I should do with my life.",29May2019,3
15,"Hello! This is my first post in Reddit and I'm actually excited lol 
I don't know if this kind of question belongs here, let me know if there's a better subreddit

So, I'm a 17 year old student form Mexico (So sorry for my bad English, and maybe this can affect recommendations) and I have one nephew (12 year old) and two nieces (6 year old and 3 year old) from my two older brothers. Recently I had the idea of, when I have money enough, buying my three little darlings some books so when they are older they can be more creative and stuff. 

My younger niece obviously can't read, not yet, but I would love to buy her some good book so she can start slowly.

My older nice can, but she's more of the nowadays kids that likes to watch YouTube videos and stuff, she's a completely energetic girl and like cute stuff (princess, ponys, sparkles, animals, etc)

And my older nephew is not really the type of reading kid, he's kinda been doing bad in some classes in school because he gets distracted and doesn't do his homework and I'm not sure if he would read the book but I want to give it a try, he's an amazing boy, likes things like Star Wars, Legos, action, horror things, but because he's a little bit more younger I want to give him something more appropriate for his age but still something he would like.

So, if you have kids or know a good book I can give to them please let me know! Also if you have some advice to create a better reading habit for them it would be so helpful!

Thank you so much in advance! (n.n)",29May2019,1
16,"This is in Texas if that’s important. 

So about an hour ago my dad came barging into my room with a hammer saying he was going to put down all of my dogs. My wife was obviously against this and they ended up getting into a fight. He now wants to get all of the dogs out of the house starting with his dog. I won’t get rid of my dogs because I have had them since they were 6 weeks old. 

In about 45 days my dad is going to court for a felony drink driving ticket and is more than likely going to be locked up for a few years. 

Both of us are on the lease for the house.  Is there anything he can do to make me have to get rid of my dogs?",29May2019,1
17,"So ya.

Usually its over things like movies or shows or games or other random junk. But it will be all I can think about and indulging in it is the greatest thing in the world. These obsessions can last weeks or months. I've sort of accepted this fact about myself, sure its weird but it doesn't hurt anyone. Plus its really fun to be obsessed with something.

Now the issue is when I get obsessed with people. Very rarely does it happen, but I kinda lose control when it does. Back in school I had a crush on this girl. Important note: I spoke to this girl maybe twice. Like ever. But she was all I could think about all day every day. Sure I was younger and had raging hormones but this above that. I masturbated to only thoughts of her for 3 years straight. When I wasn't in school I was always fantasising about her and this made up future of us. Its really creepy I know.

I'm currently really obsessed with a twitch streamer, and its hard to resist the urge to donate my entire life savings to her. I wish I could say that sarcastically but thats literally whats going through my mind. I dont even care that she won't like me back, just if it makes her smile and laugh then thats like the worlds best drug to me. Being obsessed with people usually just fucks with my life because all I care about is theirs. On one hand I want to stop because its not healthy but on the other hand it gives me joy and makes me feel all good inside. Probably because I enjoy others lives so much because i hate my own.

IDK what im asking advice for really. Just needed an outlet. How can I stop these obsessions if at all possible? It's hard because the instant I realise i'm starting to like something, all hope is lost, and i go immediately into a crazed obsession over it.

I'd be that creep ex or stalker. Well i wouldnt actually stalk them. At least not unless its convenient. If we were together at school then maybe a little. But not like follow them home type stuff. But i'd be that guy to find a hair of their crush and put it in a glass box and keep in my room and worship it forever.",29May2019,1
18,"So, there is a person who is a distant acquaintance who I started talking to on FB after a few years, a few weeks ago. We talked for a few weeks, maybe once a week - then the relationship went extremely sour.

I am ready to drop this when I can get my head around what is going on and what this person's intentions are so that I can be prepared to deal with them.

So, the conversation turned toxic in this way: 

- This individual critiqued my career aspirations, saying that I will not reach my career goals.
- They critiqued my hair style in the past.
- Said that I am not the only person that they talk to on Facebook , and I am not 'special'.
- They are indifferent to me and do not care if I talk to them or if I do not talk to them.
- The conversation always turns competitive. 
- Questioned how I got on to my degree course.
- Said that I was a 'weird and unusual person - but you can work with it'.

So, I distanced myself from this person, due to their indifference and mean comments. However, this person occasionally still messages me out of the blue - although the conversation goes nowhere as I do not take them on. 

Now, after a few months this person is behaving in a way that confuses me. They keep liking my photos and FB status'. I also notice that they immediately log out of Facebook Messenger, each and every time I sign on. 

Could someone please spell out what is going on in this person's mind? If they dislike me why are they messaging me randomly and liking my photos? This is confusing.",29May2019,0
20,"I had an interview for an IT job like a couple hours ago and they said on the spot that they weren't going to hire me. So I acted as professional as I could, said ""thank you"", asked questions, and wrote a Thank you letter to the interviewer and all that stuff. I thought ahead that this rejection wasn't going to bother me because I pretty much knew that they weren't going to hire me anyways but I CAN'T STOP THINKING SO NEGATIVELY ABOUT THIS!!!

I never mentioned to them that my communication was lacking because of my Aspergers Syndrome. They also told me that I wasn't being direct with what I was saying but that was mostly because I was too nervous since it's my first time.

WHAT THE FUCK DO I DO??? I have never been so depressed in such a long time. I keep having these thoughts about killing myself because I know nobody is going to hire someone like me who has aspergers and not enough indepth knowledge about IT. My resume is a big mess and I have nothing else to show for it. I'm scared that it's gonna take years before I can get a job, maybe decades. Idk. It's scaring the shit out of me. I am doing the best I can to make sure I succeed but given how little I've done, I just don't know if it's possible. I want to be independent so bad but I make so little doing gigs and I still live at home at 27. My siblings have all settled down and I'm still stuck here with nowhere to go.",29May2019,1
