,text,time,score
554,So basically I’ve been dating this boy for a year now and I just decided to tell my dad last night. I was expecting to be in trouble or yelled at (which is the most usual thing for him) and he just didn’t. He was calm and was just like okay. But I’m scared of him maybe using it against me in the future or someone saying the wrong thing because with him it’s like always having to be careful with words you use because the smallest things set him off. I’m just worried. Everyone seems like it was stupid to do and then when I seem disappointed by that they change and say they are proud. But I really felt like it was the right thing because it would have probably been worse if he just found out on his own. Anyways did I do the right thing? I urgently need advice because I’m honestly kinda anxious and upset about it.,29May2019,0
555,"Not new to reddit I’m on my other account my family knows my main account. Ok so this is hard for me. When I was younger, I was raped and molested. I’m in my early twenties now and I just got comfortable with telling a few people. I’ve told my SO first and I love him to death but he just wants to get mad and confront the guy who hurt me. So I really don’t like talking to him about it. And then I’ve told a friend and she’s helpful. But then the other day I told me sibling.  Now that I’ve told them, they want me to tell everyone in the family. But I don’t think I’m there yet. They’ve been telling me that they want people to know what he’s done and that he needs to be called out. I was scared to tell my sibling because it’s one thing telling a friend and you’re SO if they don’t know the guy. My sibling and whole family knows the guy. My brother is friends with the guys brother. I just don’t want people to see me differently or to think I’m lying or making it up. I swear to you I’m not. I’m so freaking scared because if they don’t believe me then I’ve lost my family. And if they do, my family will want to try to press charges or confront him. I’m just confused. I’m not ready to tell more people it’s taken me almost 17 years just to tell one person in my family and now they’re wanting me to just tell everyone I’m not ready but now that I’ve told them what if they just go ahead and tell my family. I’m not in the place to tell anymore people right now i think. So tell me reddit, what do you think I should do? I don’t think I’ll be in the right place ever to tell my family. Do I even have to tell my family? Do they have the right to know? I’m confused. If you want more details just ask on the comments.",29May2019,1
556,"I hadn't been this conflicted about something for a while. Firstly, I flew back home after finishing College. It was the time I can finally spend with family I hadn't seen for more than a year. I haven't even had the chance to visit through the majority of college. I'm suppose to fly out not so long from now so I can attend my grad ceremony which I've been looking forward to after what I put into my program. I also need to start applying for a job. Not to mention a friend of mine has been telling me that his company is currently looking for a couple of people for his team and other positions are available as well, this is of course a potential job I can aim to get. If not, I still have the chance to apply to other companies and start working as soon as I can. Worth noting that I do have internship experience so I'm not completely hopeless about landing something in my high demand field. However I've been obsessing over whether or not I should extend my trip by a month or so. Why extend? When I went back home, I was still anxiety and depression riddled from my vitamin d deficiency. I feel as if I couldn't spend proper time with family with this anxiety. But now that I've supplemented with vitamin d for a while I feel like I can relax again but my return trip is almost here. My grandmother is old and ill and my other grandma is old as well and I just don't know if I'll ever get the chance to see them again. I haven't had the chance to spend a lot of time with other family as well because they're working or schooling. Not to mention that my mother and father and siblings are here. I'm getting better mental health wise but I'm still conflicted about staying here as I'll skip my graduation, skip out on a potential interview oppronunity in my buddy's team/company and postponing my overall job search. I have about two weeks left to decide, so I hope someone wiser and clearheaded can help.

Edit: I should mention another plus to staying. Dentistry is cheap here and I require two wisdom extractions before leaving . Although realistically, I'm not mentally ready at the moment to step into a clinic and get them out in the remaining week or two I have.",29May2019,1
557,"My entire life I’ve felt ugly no matter what I do. I started getting piercings in 10th grade and they boosted my confidence a lot at first. Now I have 5 facial piercings just so that I can maybe feel pretty but now people just think I’m some pierced up weirdo and ruining my face, which lowers my self esteem even more. What is something I can do to help boost my confidence other than putting more holes in my face?",29May2019,0
558,"Hi guys,

&amp;#x200B;

Little about me, I got out of the service after 5 years in the Army.  Disabled Vet receiving $4500 a month from the Veteran Affairs.  Been questioning my life even more after feeling useless that I am not doing anything with myself.  Are there any jobs out there that you guys recommend you wished you could do but the pay isn't realistic enough to hold that job.  Currently doing college to motivate me to find new goals to feel accomplished.  Not trying to overload myself with stress.",29May2019,57
559,"This was posted in r/exjw. An Elder is similar to a priest - a well respected man in a position of spiritual authority. JWs go out in the door-to-door ministry in car groups of 2+ ppl. 


There is an Elder in my area. He's mentioned in car groups in the ministry about how one of his sons needed extra punishment because of his lack of discipline. He said he used to 'wail' on his son when he didnt behave properly. He clearly used similar forms of punishment on his other kids, as theyve disclosed similar treatment. I think they believed it was normal because they always laugh about it. He's mentioned using corporal punishment on the platform in talks as well.


At one time, a boy in my hall disclosed to me that his father was physucally abusive. I told this Elder about it (as I was required to if i heard of wrongdoing) and his response was ""sometimes children lie about abuse to get attention.' I found this disturbing, but being a ypung, believing witness, I yielded to the brother. The abuse, as far as I know, was never dealt with.


I heard recently that one of his daughters has narcolepsy and created ""false memories"" of her dad abusing her sexually. This morning, my heart started sinking when I thought of all this. This man plays with the children in the congregations and is well trusted by families. I dont know if I can trust that sort of explanation, but I wanted to ask any experts here what their opinion is. I dont know what to do, but im very, very concerned.",29May2019,1
562,"There's a spectrum everyone falls into. One end are those who have an emotion reaction to everything which decides their fate. The other end are those who can move on without feeling any emotions from the situation.

For example, if someone treats you like trash and a slave and here to tend for them. you assessed all your options. Theres no way out. You would either have a major emotional reaction. Lose yourself in a sea of no self worth or esteem. You would hate yourself and lose faith in youtself. you would look in the mirror and wish you could escape everything. Their body. Their life. You would be depressed and tend to any sort of escape like drugs sex alcahol you name it.

Or you would be like ""I might have to live with that person but who cares how they treat me. I'll just do what I can do and try to live somewhere else even if it doesnt seem attainable now""

I'm definatly the emotionally reactive kind. How do I completely turn from that?",29May2019,0
563,"Ex and I were dating for almost 5yrs. He was physically abusive, mentally, emotionally. Even tried stabbing me in the neck because he didn't realise food I put in the fridge, because he passed out drunk, was for him. Drunk a-hole! I fought back twice but every other time I would run and hide my dogs and myself.

We broke up almost 4yrs ago. I cut off complete contact 2yrs ago because of threats and eventually took off ""ignore messages"" to outright block. I thought that blocking him would make him angry and he knew where I lived.

He STILL messages. 120 unanswered messages.
Cycle of: sweet and nostalgic ""I understand you never want to speak to me again"", annoyed that I didn't respond, angry to the point of making serious threats, apology. Repeat.

I recently moved across the world with my dogs, he contacted my brother saying how much he missed and loved me and was I dating someone? My brother felt sorry for him and told him that I moved with the dogs.
He is pissed! Has been since I moved, I recently found out. I checked my alt Facebook account and there were so many messages.
I'm afraid for my family who still live in the same city as him. He is violent and unpredictable.

What should I do? I feel really powerless right now",29May2019,2
564,"Hey everyone so im on mobile so please cope with that🤣 well heres my situation I have a friend F19 and I M19 having been talking for 5 months and ive know her for a few years now. And now ive hung out with her a bit but we couldnt alot cuz of school but this past week we have hung out alot 3 times in the past week we got coffee earlier today and went biking yesterday night as well as just biked for a while earlier today. The thing is ive had a crush on her for a while now but idk if i should tell her how i feel and im pretty dumb when it comes to noticing hints tbh. So any advice here would be helpful any question please ask!
Thank you Again! And have a nice day/night.",29May2019,2
565,there are certain individuals on earth I would rather not share the same air with whether they were too obnoxious too egoistical too rude too ignorant too close minded etc etc how do i make peace with these people existence? every time i have to see them i am reminded they exist i hate the world even more sorry if this is too edgy but it's real,29May2019,0
566,How do I get rid of it fast? I don't wanna pull up in my ferrari with a stack of dollar bills in my hand and a cold sore on my lip,29May2019,1
567,"Strap in. TL;DR at the bottom.

I need advice on how to reach what's left of my family.

My ""father"" is a career on/off alcoholic now currently in his early fifties. My mother is in her early sixties and ontop of being the most persistent manual laborer you'll ever see, is also a career victim even though you'd never know it from the outside because she has always presented herself as a very 'hard' working class lady. I (late 20's male) am one of five children, three boys (one late 20's a few years older than me, the other early 30's) and two girls (42 RIP, and my baby sister late teens). 

Atleast once a year give or take since before any of us were born, during a heated argument our mother would get beat. Never one to initiate, always retaliatory, she would deal her fair share of damage back. He has a quarter inch divet in his forehead from a granite ashtray. Not being a fan of anything even close to a fair brawl, ALL of us boys were subjected multiple times to our ""fathers"" alcohol fueled aggression.

 The older we got and started entering the 'backtalk' phase, the less he needed alcohol as an excuse to push us into walls and pop us in the ribs, mouth, etc. Mom would pull him off, scream for him to stop, treat us to McDonald's or something we wanted within reason- all the while pushing us that family has flaws and this isn't anyone's business. Once we got large enough to fight back, it only took him losing one fight to switch to verbal abuse and destroying our stuff, as well as switching victims.

 My mother was protected, at least, and what she endured drastically slowed. We all reacted differently to this as we aged. The oldest brother cut ties with everyone and doesn't even cash birthday checks, middle brother is serving fifteen years for violent felonies, and I carried on the families janitorial business for nearly 9 years and became a half decent boxer. All the while keeping close to my sister's and mother. ""Father"" slowed his drinking for nearly 4 years, switching from screwdrivers and vodka in a cup to a joint and a few cold Budweisers. Things were looking up.

That brings me to now. Last month, my mother was diagnosed with Emphysema and is permanently strapped to an oxygen tank. Last week, an unexpected blood clot stole my oldest sisters life. It was extremely upsetting and unpredicted, stirring the emotions on an already taxing few months. Since we were all pretty much doing it, no one really payed attention to fathers drinking habits increasing. 

Last night, I received a call from younger sister who still lives at the house. Hysterical, she told me how an argument over laundry taking too long resulted in father beating her with the laundry basket, and when she got her fingers in the loops to stop it, he punched her in the face hard enough to cause short memory loss. All this was secretly audio recorded by her and was harrowing to listen to, to say the least. You could hear her stuttering that she's going to call 911 while you hear mother in the background shouting ""Don't you dare! No! No!"". 

This is the first time he's struck her, and by the time I got on the phone with her to insist he needed to leave in handcuffs, my mother's influence had already convinced her that it would not only be detrimental to the family, but would somehow affect mom's health. The more I protested, the more it was insinuated I was making it all about me and worsening the situation. 

I drove over to try and convince in person, only to be met with my mother downplaying everything and acting like NOTHING happened. Blood still on the floor. Sister in denial, father sleeping it off. I wanted badly to hurt him, but reacting violently to him would of done no good, considering each of us boys has handed it to him atleast once without behavior changing. It would also tank my chances of going golden gloves should I of ended up arrested.

So I took my birth certificate, told my mother I was sorry she lost her first born but until that beast was out of her life, they've lost me too. Even the youngest. Other than a text from father calling me a traitor, I've yet to hear from anyone and intend to keep 100% no contact. 

I feel so shitty about it though, and I intend to reach out to little sister after a cool down period to try to reach her again. That's why I need your advice. I've got no idea what to say or how to communicate this isn't normal to her.

TL;DR- Abusive father falls off the wagon, assaults the youngest of our family. Mother coaches her into accepting the same victimhood mentality as she has and both refuse to do anything about it. Need help/resources to convince otherwise.",29May2019,1
568,"I have run into an abundance of intolerable people on this app, more than any other, to be quite honest. Not what I expected. I wanted to use this app to be free to express myself and entertain myself and possibly learn about things I’m interested in but because I’m not like the rest of the redditors that have been here they’re whole lives I find some very rude comments. What has possessed you to come on to people the way that you do? What happened to just being nice or not saying anything at all?",29May2019,1
569," He's 77, and he has a history of mental illness. I don't know what it is exactly but his history entails: 
•Set our kitchen on fire

•Ran away from my uncle's house, then our house

•Severe alcohol abuse, pill abuse

•Stabbed my mom with a knife

•Spam calls relatives at 2am

•Switches between being kind to berating everyone and making my mom (his daughter) cry.


 He makes doctor's visits weekly, even though the doctor told him not to call unless a medical concern arises. He calls the doctor to talk about his love life since our doctor is single, and my grandpa wants to set him up with women haha. (We're Indian, so it's a common cultural thing for elderly people to set kids up with other kids) 

 Well my dad called to tell me not to take him anywhere. He wants to go talk to my doctor right now about setting him up with a woman. My grandpa has trouble walking properly but is 100% lucid, so he's been yelling at me that I'm keeping him a prisoner for an hour now. We, the grandchildren, aren't allowed to take him anywhere unless it's a medical condition because he always becomes verbally and physically abusive with me and it pisses my dad off.

 TLDR; Are we being unfair to him by not taking him to places? He can barely walk, even with his walker, and has a history of mental illness.",29May2019,1
570,"Title is confusing, lemme explain --

I recently turned 16, and, in my state and the states around me, 16 is the minimum age to work at. However, I'm moving states in a month or so, so I figured I'd wait on getting a job until school starts.

I love World of Warcraft, but, considering I don't have a job, I can't pay for the full game. I have one Night Elf Monk that I've played all the way through the free version with.

Do I just wait patiently? Should I just make other characters for the time being?

Inb4 ""Just ask your parents"", my mom did offer to pay for it for me as long as I played it, but that was a year ago, and since it was only recently my birthday, I don't wanna seem needy to my mom. I'm making this post because it's okay to seem needy on the internet. :)",29May2019,1
571,"I work hourly and get paid every other week. I asked my boss 2 weeks ago if I could have a raise, and he said yes. We didn't talk about a particular dollar amount or when it would be applied, but I was hoping it would be on my last pay period. How long should I wait to bring it up again? I don't want to sound impatient or annoying, but I certainly think I deserve the raise.",29May2019,1
572,"We have an acquaintance from my wife's Mom's group who is a very nice lady.  We've had her over a few times and my wife has done some lunches.  She's confessed that she's seeing someone about anxiety that she can't seem to understand.  She says her brother just got diagnosed with bad OCD and she says in her family (first generation immigrants from India) mental illness is never talked about.  

Her son is about 3.5 and makes zero eye contact and never smiles.  He doesn't interact like the other kids, barely talks, fixates on the same toy for hours etc.  He's not able to read other kids and he needs a ton of supervision, bites, etc.  I'm not a doctor, but I can recognize autism cluster symptoms.  While we've never directly talked about it, we're getting the strong impression that she doesn't realize.

Do we say something?",29May2019,0
573,"Most recent relationship, I broke up with her about 5 months ago.
Broke up because she is living with her ex next year and hes been absolutely horrible to her. She started hanging out with him more than me and I got really jealous about this. 
But it was more the breakup I was horrible about. We said we were gonna try and sort things out but she kept putting everything off and playing around with me. I was pushy in getting things sorted out and really argumentative which I regret but I couldn't bare being played around with. It hurts me so much still because it was the best relationship I ever had until the last month when her ex came back into the picture. She was my best friend and I've lost her. She has a new boyfriend and I'm talking to someone new but I'm still really hurt about everything. I just needed to get this off of my chest more than anything. Any advice would be really appreciated",29May2019,1
574,"So I see the little fucker forming and I don't wanna pull up with the herp on my lip, please help me, how do I get rid of it fast?",29May2019,1
575,"So we broke up about three weeks ago. Long term relationship. It was abrupt as hell, she dumped me over the phone.

And this relationship was meaningful to me. I really was never as in love as I was with this woman. It was really intense the entire time, my affection for her was through the roof. She used to be my favorite person I'd ever met.


I was emotionally a wreck for the first two weeks. I was recovering rather quickly, however, probably the fastest I have for a relationship.

Then I was told some information, combined with my own knowledge.

Essentially, during the last month of our relationship, she had cheated with one of her ""friends"" at least three times, and those are just the ones I have direct knowledge of. 

I also discovered that she had been disloyal the entire time, texting her ex extensively, getting into deep emotional conversations with guys who like her, soliciting nudes from other men.

So after knowing that, my self confidence is ruined. I know I shouldn't feel this way, but I feel worthless and shitty, like I've done something wrong. I feel like no one will ever love me again, that everything I thought was love in that relationship was her deceiving me.

She doesn't know I know this. We work together. For at least another year. She told me she wants to be friends, she tries to be all friendly with me and smiling and shit. It kills me because I just can't believe she's continuing her deception.

And I can't lash out at her, because we need to maintain professionality.

What the fuck do I do?",29May2019,2
576,"As the title mentions, all my life, my family has talked about negative health issues. Literally almost every day since I was 5, and I'm now almost 30.  


Every issue I have, I blow way out of proportion, and want to go to the Doctor and get everything checked out, and never feel calm when doctors say that I'm fine. Even after CT Scans and lots of samples.  


I'm scared to death of dying all the time or getting cancer and not being able to catch it before it's too late. The funny part of all this is that this anxiety is making my daily life even worse because it stresses me out enough to GIVE me issues that WEREN'T there. So, being inflamed for 20+ years from stressing about my health is making my health worse. Go figure.  


I've been going to therapy, working out, and eating healthy, but the more info I can get the better from as many sources as possible. How do you train yourself out of thinking things like this? I'm sick and tired of being sick and tired from my brain doing this to myself.",29May2019,2
577,"So myself and 4 other people have been planning on moving in together in a few moths. 

2 of them I get along well with, one I don’t know so well because he seems quite depressed and the other I can get on with but I feel kinda steps on my toes at times. The two later guys are fairly close friends when compared to the other 3 of us (just known each other longer, more in common etc etc)

The one that kind of steps on my toes a bit I feel can be quite rude or blunt with me. Like they can get annoyed at small things. For instance a friend of ours went away and I asked them where they’d gone/when they were back etc so I could catch up with them but was greeted with “why so many questions”, or when I asked them when abouts we could move was just greated with bits like “o k?”. It’s just small things and kind of his attitude. 

What’s more is all of them are younger than me and students whereas I’m working full time so kinda different lifestyles I suppose. 

I also feel like bar one of them they hold kinda TERFy views or support an socialist organisation (which I used to be a part of but left when it got TERFy) which has TERF views but don’t mention them to me since I am trans (but still living as male) or they will often forget I am trans when I bring it up (asides one of them who is more switched on to such things). It makes me kinda anxious. 

The problem is id struggle to live on my own nor have other ppl to live with. 

I could afford it but would likely cost more and I feel like I might get depressed. But I also feel like this guy will keep stepping on my toes. 

Idk kinda ranting. Just after a second opinion I suppose.",29May2019,1
