,text,time,score
172,"I put too much pressure on myself and it's a problem. The way I talk to myself in my head is quite nasty. I have been trying to make strides to be more compassionate to myself and tone down the whip-cracking drill sergeant inside of my head. But I guess I worry that having that personality of being hard on myself is what allows me to get shit done, work out regularly, and eat clean. 

How do I ease up on myself without turning into a lazy piece of shit who eats trash?

How do I get over this fear? How do I ease up on myself",29May2019,1
173,"My mind has been feeling really muddled and overwhelmed with life for a while. I've been in therapy for some time to process my traumas but I want to get an appointment to see a psyciatrist for some medication. As of now I keep putting it off due to the anxiety of it all, and the added depression isn't helping. Thing is I really can't stand the thought of being babied through it. It just scares me that despite my desire to get this help my mind is jumping to other scary alternatives instead of following through..",29May2019,1
174,"Okay, so I wouldn’t necessarily call what I experience “bullying” I just don’t know what to call it. 
I went to a small, home-schoolish, private academy until the second semester of freshman year (where I am now) so needless to say I’ve never experienced this public high-school atmosphere before.
For some background, I don’t have the best social skills. I’m aware of it, and trying to get better. It’s mostly due to the fact I was isolated with other odd kids almost all my life, and was never really exposed to “normal” behavior. I have odd interests as well. I know an absurd amount of animal facts that people find odd, and I’m interested in true crime (no, I’m not a psychopath I just find it interesting) so people think I’m weird. I don’t have any friends really because of my crippling anxiety (I know, I sound like every teen) but really, I don’t have any people I hang out with. I usually spend lunch in the library reading and/or doing schoolwork. I also have Tourettes, my ticks are moving my neck and sneezing. Having Tourette’s makes people assume I’m mentally decrepit or autistic (not that it’s a bad thing) 

Anyways, a girl in my class realized I was the odd and started doing this thing that wouldn’t necessarily be bullying, but is still meant to make fun of me. She started calling me “babygurllllll” for some reason. I know it seems harmless but the way she says it and then whispers to her friends when I respond, it is obvious it’s an inside joke with her friends. She also pretends to be my friend. She starts conversations obviously set up to make me embarrass myself. Long story short, she laughs AT me, while pretending she’s laughing WITH me. For a bit I thought it was my imagination, but I realized she was doing almost only to me. I assume she thinks I’m socially retarded and won’t realize, but I do.

I don’t know what to do, I’ve been trying to brush it off, but it really does hurt me. I’ve been trying to brush it off but after every class with her I feel entirely belittled and self conscious. Should I forget about it? Confront her? Ignore her? Please, I feel so self conscious when around her. If you can help please do.",29May2019,1
175,"So recently I’ve noticed that i’ve been playing games for hours non-stop. I recently invested 15 hours in a game to then lose all progress by dying in it. While I was angry i also took a second to think if I’m wasting too much time on games. I’m just kind of on a two way road not knowing where to go with anything. Give me all the criticism, positive or even negative advice. I need my eyes to be opened up.",29May2019,1
176,"I'm not afraid to admit I'm a bit of a late bloomer in terms of relationships. I was ugly and very insecure for the first 18 years of my life, and have only just recently started to turn that around. I started talking to this girl I knew from school after she hit me up from seeing one of my Instagram posts. We hung out once, things went well, and then we hung out again.

&amp;#x200B;

The second time we hung out, unfortunately, I caught some hard feelings. I was trying to repress them to the best of my ability, but stupidly, I made the decision to act on those feelings and I sent her a long-winded text, something along the lines of ""are you really interested in me for me?"". Even more pathetically, I sent her another text the following day, after getting no reply, saying ""sorry, that last text was stupid, let me show you a good time this weekend"".

&amp;#x200B;

Naturally, she didn't take well to these texts, and didn't reciprocate the same interest. Can't really blame her for that, I mean, that was pretty sad on my part. I was in the process of moving on from the whole experience, when she hit me back up a couple weeks later. I asked her ""So are you interested in hanging out again or nah?""

&amp;#x200B;

She replied saying she wasn't sure, saying that the soonest she could hang out again would be in July (we live a bit of a distance away from each other, so I can only visit her on weekends, and she is supposedly playing a sport right now, so weekends don't work).

&amp;#x200B;

This is all fine and good I guess, but then I noticed that she had posted something on her Instagram saying something along the lines of ""needing love"".

&amp;#x200B;

I guess what I'm afraid of is that someone else will snatch her up before July comes and I won't have the opportunity to explain myself in person for my past behaviors or have the opportunity to potentially start something with her. The ""flame"" in my eyes is already dying, but I don't want it to completely die out, I don't want her to forget about me entirely.

&amp;#x200B;

It's a lot of mixed signals I'm dealing with here, with her hitting me up first, to posting that needy shit on Instagram. **My question is, should I hit her up, try and chat with her to remind her of my existence, or should I play it cool, pretend like I'm indifferent and wait until July comes to try and do something?** I really do like her, and I know she likes me too based on the things she's said in the past and the multiple chances she's given me before. I've learned a lot from this experience and I want her to know that I won't ever make those same stupid mistakes again, that I will be the type of guy that she really needs, not some loser piece of shit that asks for her approval. I want to show her that I can be that person, but I don't want to miss the opportunity to do so.

&amp;#x200B;

Any advice would be appreciated. I know that this post in its entirety probably looks stupid to anyone older than me, or anyone with more experience than I have, but give me a break, I'm 18, and this is my first real experience with a girl. I'm sure you've all been in a similar situation before.",29May2019,2
177,"I (24M) am engaged to a wonderful girl (25F) and we’re getting married September 7th of this year. 

As our relationship got more serious, obviously I had the pleasure of getting to know her family more and more over the past few years. While I can’t say that I’ve spent enough, or maybe just don’t have enough in common to be “close” with them, I know them well at this point and they know me.

I was raised poor, and therefor extremely financially conscious. In high school I realized that I could train myself not only to be frugal, but to be wise with money. I majored in Finance and have started several small businesses. I devour personal finance books, read from the experts like Dave Ramsey, Peter Lynch, Robert Kyosaki, Tony Robbins (judge me), etc. I listen to financial podcasts almost daily and quite literally make personal expense/income spreadsheets for fun. I’m currently working in investment sales at an F500 Co. Bottom line, I like learning about money and am a huge nerd.

My fiancé is the opposite. Free spirited, spend if it brings you joy, “if I have it I’ll spend it” type of personality. She has made tremendous strides since we’ve been together in learning to be more financially responsible - as I have learned to be less of a penny pincher and enjoy life more as it comes. (Obviously that’s a recipe for friction but we’ll save that for another post).

Since getting to know my fiancé’s mom, I’ve begun to recognize toxic financial habits in her life. She’s a former CEO of a tech company and used to rake in the cash in the 90’s. It’s clear that her lifestyle, circles of friends, and habits developed during this time and haven’t deviated much since. (We’re talking limo to the airport, first class traveling once a month often out of the country type spending). In ‘08 she lost that job and has been bouncing around doing odd and end corporate coaching type roles - making less money but keeping a similar lifestyle. 

Adapting to less money has been hard for her. I’ve heard numerous stories about her awkwardly asking to borrow money from friends, selling some of their property without her husbands permission, and taking out loans when she found herself underwater. She attributes digging her way out of each of these scenarios as a testament to her financial savvy despite not having a clear cut budget.

As a former boyfriend and now fiancé of her daughter I have steered waaaayyyyy clear of voicing my opinion on this - as much as I really want to with my fiancé. Instead, I’ve tried to focus with her on how she and I can be wise with our own money for ourselves and our future family. 

A few months ago, my future mother-in-law got her role reduced at the company she had been working at the past year. This came with roughly a 2/3 pay cut. Since then, I have cringed watching her take her youngest son on vacation to California, go to Alabama for a long weekend with her old sorority sisters, and Atlanta for a day trip and a few other odd/end trips/purchases. My fiancé and I have scratched our heads trying to figure out where this money has come from. 

It’s also important to note that in January she insisted on throwing us a very nice wedding in Sept. My fiancé and I insisted on not wanting to accept such a generous gesture, but it is somewhat tradition for brides family to cover the wedding and who are we kidding, it was a free wedding to us. When she lost the pay check and I saw the spending patterns fail to change, I had this weird gut feeling and began getting very nervous. I thought if things got dire she might try and come to me to foot a portion of the bill or for a loan. Either way, not a position I wanted to be in. I’ve been out of school and working for two years and haven’t made a ton of money, but I have a nice little savings heaped up. Money that I’ve dog eared to purchase us a house this fall.

Today my fears were confirmed.
She called me while I was at the gym and gave me the spiel about the lost job, tough times, stresses of wedding planning- the whole 9 yards. She’s worried that she won’t be able to afford what’s left of the wedding expenses. We’re talking several thousands of dollars. I left the interaction at me needing time to think about the request. I want to be angry at her for being so irresponsible but I realize it’s no use as she literally has no understanding that her spending patterns are to blame, but she believes she’s a victim of circumstance.

Do I have the money? Yes. I could foot the bill but it would deplete my savings and hinder our house buying process. I can’t help feeling guilty about not wanting to help out when I have been tremendously frugal for two years and she’s been irresponsible. I feel like since it’s my wedding and if I say no out of principal, even for a portion of the costs, I will look greedy and potentially harm a relationship with my future mother in law and prevent a portion of this wedding that my fiancé is excited about from happening.

My options as I see them are pay a portion of the expenses. Escape the situation without being a bad guy but further encourage bad behavior and open myself up as the family bank. Or, option 2, stick to my principals. Explain the money is already allocated toward a house, and risk tarnishing relations with my fiancé, her mom and potentially have to cause the wedding to be trimmed back substantially.

I’d sincerely appreciate any and all constructive advice.

(TLDR: future mother in law spends money recklessly and has found herself in a financial bind trying to afford the wedding of her and my fiancé’s dreams and wants to dip into my personal savings to cover the costs)",29May2019,1
178,"So I had braces for about 2 years and six months, they took them off about 2 weeks and a half ago I’ve been using my retainers every night as told.
I know I’m probably over reacting but I’m anxious my front teeth gap would return, is this anyway possible if I’m wearing the retainers constantly?
Just need some reassurance",29May2019,1
179,"I intend to die tomorrow afternoon. I am aware that my class at university will be severely affected by this, and I want to reassure them that they aren't 'the reason.' I know it's natural to wonder what you could have said or done to prevent a suicide, and to feel like it was your fault.   I have been trying to tell them that that couldn't be further from the truth, but I can't seem to get the words out, because it would ruin the mood of the conversation or make them sad. How can I bring this up?",29May2019,0
180,"Whenever I compliment her or try to say something positive about her appearance she accuses me of being a liar.  I try to be as patient as possible and explain I'm not lying and try to reason with her. It sounds like she has been through a lot with her ex as far as emotional abuse so I try the best I can to see where she's coming from. Reddit, is there anything I can do to help her believe me? She really is one of the most amazing people I've ever met and is so incredibly kind and supportive it seems like I don't even deserve her sometimes. I feel like she might be the one and I've never felt like that about anyone so I want to make sure she actually knows that I want to be her everything. 

TLDR: gf calls me a liar when I compliment her. Help?",29May2019,2
181,Title explains it all but for more context im an asexual male (i never told her im asexual) and Im wondering if anyone has any good tips for me. You know maybe something to make myself more presentable or somehow get the question in graydiently.  And if things go south maybe something to say and lighten the mood.,29May2019,1
182,"25 F. One semester of college left and have the opportunity to move in with a girl that I'm close with for 8 months. Have lived with parents entire life. Have suffered from depression for a few years, mainly due to isolating myself completely and just going to work and school and having no social life. Parents are decently easy going, but can't have guys over unless we sit in the living room lol. Usually this just ends up with me spending most of the time at the guy's house, but this has gotten hard especially since the guy I'm seeing now lives with his parents. They allow me to be home late, but don't like it if I'm home at like 3. I feel like I could use the experience since I'm planning on moving to a new city when I'm out of school and maybe it would be better to see what it's like living by myself while I still have a close support system but also have a dream of traveling when I graduate so I really don't want to have to dip into my savings at all.

Pros: New experience, change of pace, possibly expanding my social life since the girl has a decent sized group of friends that I've meshed with well, Experience for living on my own in a new place later, more freedom in relationships

Cons: Money. Would like to have savings for traveling after college and security blanket, have $6,000.00 saved up now, but would likely have to dip into that some. Wouldn't have a lot of extra cash like I do now. Also, I suffer depression and anxiety and I'm not sure if that could be improved or get worse.

Advice? Opinions?",29May2019,0
183,"This is a throwaway account because I don’t need this shit biting me in the ass later on.  Also on mobile, sorry about the fucked format.

I’m in the middle of a near four year relationship, started my freshman year and now I’m a senior. I have loved him for a long time and everything was swell but now I met this friend of mine who I’ve just so happened to accidentally fall in love with in about three months of an extremely close friendship. Now I’m in the middle of this love triangle with two guys who I love and I don’t know what to do. 

My actual bf doesn’t make me that happy but I still love him. I don’t know anymore what to do. The friend I fell in love with loves me back and I know that because we say it to each other as we hid away and cuddle and kiss away from everyone else. I feel fucking horrible but I don’t want to lose either. I feel so fucking selfish. What do I do?",29May2019,1
184,"It’s been a couple of months now, but the minute I start to have feelings for another man I get thrown back into this very dark and scary place. I have had a handful of relationships, but this is the one that was the most serious. We met in my freshman year Of college and he was this super nice guy who helped me through a lot. I ended up losing my virginity to this man and from there we dated for about a year and one month. I had invited him to come to my home and visit my parents and extended family and he, with no hesitation, agreed. We had a super great trip, had a fun car ride back, and then when we got back to his home(he lived at home still) we had loving sex. We said “I love you” as we always did. The next day, While in class I got a text message from him asking if we could talk, I agreed and met with him an hour later. Just like that he was breaking up with me and wouldn’t even provide me with any real answers as to why. This truly messed with my head because we had just visited my family, shared a passionate moment, and had a good day overall and then suddenly he was breaking up with me. He now has a new girlfriend and that part I’m okay with, but every time I start to get feelings for another guy, I just feel as though I’m just a sexual object to them or something. I have tried to get over this feeling, but can’t no matter how hard I try. I’m currently talking with a guy, but want to be able to get close to him without disclosing everything that I have been through. What should I do?",29May2019,2
185,"Since December I became severely depressed and also developed and anxiety disorder. I didn't know at that time, and I didn't like self diagnosing so I just thought it was a part of puberty. It got so bad to the point that I attempted suicide.

Later, this year, I got diagnosed with anxiety and depressive disorder. I got medication for sleeping, antidepressant and anxiety pills. I started taking them and saw a change. But only for a little while.

It's terrible now, again. I go to therapy, I visit a psychiatrist on regular basis, I take my medication which stopped working and everything is falling apart.

My mom doesn't want me to get locked in there either. But she feels like there is no other way to get me help. I don't wanna be locked up. I really don't. It's a scary place. It would effect my school grades, my school life, social life, future work - basically everything. 

TL;DR: My depression and anxiety got extremely bad and mom is thinking about putting me into mental hospital, where I don't wanna be.",29May2019,1
186,"Okay so I came here to get some opinions. My family goes on vacation every year. That is our time to unwind and make memories together. We are a pretty close family., all love within 20 miles of each other, do family dinners ect. This past year has been a really rough year for us, my brother is getting a divorce and my mom has ms and some other serious medical issues. To me family vacation is supposed to be able just forgetting the outside world and being completely comfortable and relaxed with the people closest to you. My question is, my sister started dating some random guy maybe 2 months ago. She tells me tonight he’s coming on vacation AND has the audacity to tell me he’s not chipping in to pay. Am I just being a bitch by thinking this is absolutely selfish and rude for her to be bringing some guy we’ve all met once, on a 7 day vacation in a small beach house that with two toddlers and a baby we will all be on top of each other the whole time or is she being a selfish bitch by feeling it’s completely okay and fine to do this? Thanks for your opinions!",29May2019,1
187,"I have certain parts of my body that I'm super self conscious about.
 Recently my s/o has been touching those places. Yes I let him and he too has places on his body like that, but he got used to my touch and it's not embarrassing to him anymore for me to touch thoes places
But when he touches or kisses thoes places it makes me upset because it embarrasses me. How do I get comfortable with him touching(in my opinion) my most private areas",29May2019,1
188,"I'm a 20 yo male. To make a long story short in highschool I lived the stereotypical teen romance with a girl I loved very much. Things didn't pan out and I never slept with her due to drama. Since then I've been laying low, for 2+ years now. I've focused on school and a social life and been rewarded handsomely yet I still crave the closeness and affection of an actual relationship. I'm not ""bad"" with girls, but I rarely get involved romantically with them because I guess I'm picky (and not ""oh too fat"" or ""big nose"" picky). Regardless I've always felt that the one thing holding me back is my virginity and I got trapped in a paradox of sorts. Can't lose my virginity unless I'm I'm a relationship, can't get into a relationship unless I lose my virginity. You see how dumb this seems, but to a confused kid it makes perfect sense. Recently I've downloaded some dating apps and have had fun flirting and such. Now I've encountered an impass. I have the opportunity to sleep with a girl I met on the app. She's 7 miles away and totally into it. She even sent nudes and I'm attracted to her. There's just one thing....

I don't want to just toss my v card like a coin in a well. I'm too old and too realistic to think like this but I want it to be special (ughh i know). Not fireworks on the beach, but like with someone special. I want it to be someone I love and who loves me. Someone I trust and someone I feel like will be around in my life a good amount of time. Some may say that it's okay to feel this way. But I've heard others says it's never really special the first time and the sooner you start, the better. I feel like I'm holding my self back from experiencing a whole spectrum of life and social interactions just because of this.

Basically I have until the end of this week to decide. I don't have anyone special in my life. I don't foresee anyone special arriving either. Am I torturing myself for no reason or is this a reasonable and even justified stance?

TL;DR: I'm a 20 yo male that missed his shot in HS. Now I have a shot again and I'm hesitant because I feel like I want someone special to take my v card. Should I say screw it of stick to my guns?

P.s: the dating app girl is nice but I don't have feelings and I don't think she has feelings. Not to mention I'm only visiting this area for the week.

P.s.s: a large component of this issue is also my insecurity in penis size. Tmi I know. But I'm not micro or anything but I'm about 4"" hard.",29May2019,1
189,"I just got out of school for the summer and barely made it out without going insane.  The first week or so was great and then it turned out I was going to be working for my uncle’s farm for the foreseeable future. This is my second day and it’s complete shit. I wake up at 5:30 and work until 4:30 at the minimum. I have a hard time anyway with bottled up mental issues and this just makes it so much worse that I just feel dead inside. I feel like any joy that I have has been completely snuffed out. What’s even worse is after I get done with my job for the summer I have to go to football practice that I absolutely hate with a passion and have no love for, because I am forced to by my father. I know you might think I’m soft and that “everyone has a job at some point” but it’s not just the physical labor, it’s the effect that it has on me mentally I don’t know really how to deal with it. I feel like I’m about to collapse and break down all the time. My parents would just say “ tough shit” if I told them about this
, but I just need some advice on how to keep going.",29May2019,0
190,"I just interviewed for a job that is in my field of work. It is the type of place I hope to work at in the future. The issue is I moved away from my friends and family to go to school in my current city and by accepting this job I would be placing myself into a contract that I would not be able to leave for 2 years. Ever since I moved to this new city I have felt isolated, and have not found a group of friends like the ones back home. I've felt depressed the entire time I have been here, and if I take this job I feel like I'm traping myself. However, I know myself and if I get offered this job I will take the position. It is the exact job I want, it's just located in the wrong city and I am worried that I will not get another opportunity like this one.

Has anyone else ever been in this situation? If so, what did you decide?",29May2019,1
