,text,time,score
365,"*sorry if the formatting sucks, im on mobile*

I've known this girl (Let's call her B) since we were in about 1st grade, we were basically best friends but then we both grew up and kinda distanced ourselves from each other. Then last year we started talking again, but mostly small talk. But this year everything changed.

Basically, B talks behind my back a lot, acting like some sort of expert just because we were friends in elementary school. B told my girlfriend and one of our very close friends that I'm not ""mentally stable enough for a relationship"". I thought she was just being petty about this so I let it slide.

Recently however, I found out some more things she's said behind my back. B has gone so far to claim she's an ""empath"" (people with common fucking sense would know empaths are not real things) just to say that I faked a panic attack.

My anxiety is pretty serious and it got really bad one night and she was there to witness it. I literally could not breathe or stop crying but she still claimed I faked it. I have no idea why she thinks this because faking a panic attack would have no benefit towards me.

Then when my girlfriend told B we were dating, B told her that she had to break up with me and her reasoning was that I was not ""mentally stable enough for a relationship"", something she had already said.

I'm not even just mad about the things she's said about me. She has literally threatened to ""beat the shit out of"" one of my friends, let's call him T, and even went so far to wish DEATH upon him. I don't understand how SICK you have to be to wish death upon someone. There was a point in time where I hated T, but I know right from wrong and didn't want him to die.

Usually I have no problem with getting rid of negative people in my life, but I'm afraid it will just make my situation worse. Plus, my girlfriend is friends with her, so I probably wouldn't be able to talk with my girlfriend a lot and I already cannot spend time with her after school because of how possessive B is over her.

All I'm really asking for is tips on how to get rid of B, I don't want anything to do with her because of all the shit she's said. I don't really need tips about how to talk to my girlfriend about the situation if you were going to give any tips about that as well, she already knows I want to completely drop her from my life. Anyways, if you decide to help me, thank you so much, I really appreciate it.",29May2019,1
367,"So I hired a mover to move a Vending machine and he quoted me $260. So he picks up the vending machine then says it will be $260 + 1 hour ($80) + tax. So $395 in total. (I wasn't there for the pickup I had a lady show him and his crew where the vending machine was)

When I was shopping quotes I could've easily found multiple people to do it for $280.

I refused to pay because that's $135 more than the initial quote and I only prepared $260 in cash for him. (I was going to leave work to meet with him).

He now demands that I etransfer him $395 or he's not giving me my vending machine. Or that I pay him $180 and come pick it up. (Which I have a friend who will go pick it up for $150).

So should I go there and pick it up (With some friends) and refuse to pay him because he didn't deliver the vending machine? Or should I pay the $180 and suck it up?

Also I even offered him a deposit beforehand which he refused and said to give him cash when I see the workers (but he must've expected me to be at the pick up which I was not I was waiting at the drop off).",29May2019,1
368,"Background; i don’t live with them, and the ones living in our house are my parents, siblingss and a housemaid(for 3 months )

3 weeks ago, my brother’s wallet that has 4 dollars was stolen. It is still unknown to this day who was the culprit, but my parents first blamed my sister because of a reason i’ll keep to myself; but rest assured, she never ever stole anything. Parents talked to us to be more careful.

Yesterday morning, now, brother ‘s wallet which has fucking 50 dollars ( the money was shared by the both of them )was stolen and my parents blamed my sisted for it to an extent where they searched at her bag and belongings, in which they found nothing . She started crying and kept saying “Why are they blaming me?”. My brother started to cry as well, cus he was getting blamed for being irresponsible ( I was not home at that time)

I don’t want to blame anyone but who else could possibly steal it? I became suspicious of our housemaid. I dont want ti point fingers since we have no proof..... but me and my brother both agreed that my sister couldn’t do that ( might be a little bias, but ) since she could’ve just get her part in the $50 , and wouldn’t get the wallet.

When I arrived home, our parents “talked” to us about the situation. The whole time it was all about my brother being irresponsible, that he could’ve put it somewhere else, etc. and it fucking maddened me. Why are we the only ones getting blamed for? Why Is It Only Our Fucking Fault? 

It badly maddens me that I was shaking, and I want to defend my siblings so I spoke up. I told them that we weren’t the only ones they should be mad at. Why is is only our fault etc. That we were not the only ones at home. Why not blame the culprit? And what hurts more is the moment i spoke both of my siblings start to cry. 

And what was their response? They told me why was I affected that much. That I wasn’t there when the situation happened and that I was overreacting. Maybe I was but I just want to defend them because they don’t deserve the blame.

Tmi, but when i started speaking , the maid slightly peeked at us. Idk if this counts but yeah.

End of story, I left them. And now I am exhausted af that Idek what to do. Idk if I did the right thing; that i just want to know who fucking culprit is and i hope they got caught.",29May2019,1
369,"I've asked, but every time they just ignore as long as they can. I leave that house permanently this weekend so if they don't pay by then, they just won't. Bc why would they? What do I say to make them give me what they owe me, which they can't just ignore?

Turning to Reddit because I'm far too pissed off to be ""nice"" on account of one of them just asked *me* for money that I already paid them months ago. That was significantly less money, and even then, idk if I really owed them (complicated, won't go into it).",29May2019,1
371,"Hello, 22 male here seeking life advice. 

So basically I'm working a job that's okay, pays well and whatnot but there's no excitement in it and is definitely not what I wanna end up doing when I'm older. It has growth opportunities that are a little more interesting and requires a skill I already have but its still not ideal.
I had a dream growing up about what I wanted to do but that has since changed and now I'm left not knowing what to do and it's killing me.

I have a few hobbies but nothing that really drives me enough to make a living out of it.
And because of my situation I can't really enjoy them anymore cause constantly at the back of my mind is just rumination about what the hell am i going to do. 

But every single day I just have constant anxiety about how I wanna work for myself, doing something artistic/designer related but I just don't know what. I'm trying to live happy and act just as I would as if I had my dream life but damn it's hard.

I've spiralled into a pit of depression and I don't know what to do. I guess I just wanna know how to be happy even though I'm not. 
I can't change careers again for awhile because I've done it too much over the last few years. 


Any advice would be great thanks!",29May2019,1
372,"I’m a girl and I have a crush on my best friend who’s a guy. I’d suck it up and tell him how I felt if he didn’t have a girlfriend. I started getting these feelings a week before I broke up with my then boyfriend (that wasn’t why we broke up). It’s been about a month now and these feelings have only gotten stronger. 

The thing is we’re really open about everything and I did confess back then that I had a small crush on him but that I knew we were just friends etc. he told me that at one stage he had had a crush on me but he sorta made the decision not to act on those feelings, sorta suppress them I guess. 

I’ve only known him for like 4 months but we’re so close. I also don’t have many other friends. Part of me hoped I could just sit it out until he broke up with his girlfriend but it’s too painful. I do honestly think he likes me, maybe a little bit more than a friend. We just have this connection. But I don’t think he’ll act on it. He certainly wouldn’t cheat (not that I’d want him to)

It makes me feel kinda guilty. Whenever we’ve been hanging out and he leaves I just feel like shit. I think it’s actually affecting my mental health. I know I should get over him but it’s so hard, I just don’t know how to. Maybe I could tell him how I feel? I don’t think it would affect his relationship but it might allow me to get some space from him and move on. But at the same time I’m so used to seeing him like every second day so that would be really hard.",29May2019,2
374,"I live an apartment style condo.  Picture an apartment complex, but we all own the apartments.  Everything inside my walls is mine, the outside of the building is the responsibility of my HOA.  My apartment is on the 3rd floor, which is also the top floor.  

I’ve lived there for 5 years now and during the first year I was sitting on the couch one night and heard what I thought was a cricket which I thought was odd since I’m on the 3rd floor, until I saw my cat go crazy and realized very quickly it was a bat she was smacking around as it scuttled across my living room floor trying to take flight.

In the last year I’ve had 4 more bats enter my home.  I have no idea how they’re getting in.  I do not open my windows ever, A/C is running 24/7.  I’ve left several messages with my HOA about the issue and they never answer when I call, and do not reply to my voicemails.  I’ve even had my realtor call on my behalf and the same thing just silence.  I spoke to my neighbor the other day right after I had to capture bat #5 in front of my new girlfriend who will not sleep over at my house anymore as she has a crazy fear of bats.  He informed he has also had bats get into his place as well as a bird once.  

I hear them scratching and moving around in the walls and ceiling every single night when I lay down for bed and that is not an exaggeration.  It’s disgusting and unnerving after so many have managed to get into my place.  I *believe* they’re getting into the walls/ceiling and then somehow entering through my air vents.  It’s driving me insane and now I’m to the point where every creek or noise I hear in the middle of the night I assume it’s a bat flying around and jump out of bed to investigate.  To me this is a safety issue.  Bat #2 I actually was asleep when it got in and woke up to it flying around my bedroom which resulted in me having to get a rabies shot just to be safe because that’s what I was told to do.

What are my options here?  My brother suggested I hire someone to handle it and then send the bill to my HOA but I’m not sure if that’s exactly legal.  I wouldn’t even know who to call though.  An exterminator?  Someone to patch up all the holes around the building where I believe they’re entering from?  An HVAC guy to check if my vents are properly sealed?  

Please help I’m running on like 3 hours of sleep every night since the last one got in.  Thanks for reading and sorry this was long winded.",29May2019,1
375,"A little background...

I've been unemployed for 10 years, there's a lot that has contributed to that but currently I'm having trouble even job hunting, my options for jobs are very limited due to autism but then my qualifications and experience for the jobs I can apply for is limited too, and although I get good feedback when I do get interviews I'm turned down because of that big gap in employment. 

As a result of this I've lost 10 years of my life, years in my twenties and thirties which means I've missed out on the normal fun of my twenties, I'm not where I 'should' be in life in terms of a career, home, partner, and kids. This is killing me, I always wanted kids but at 36 that doesn't look like it's going to happen now, and I don't know what the point of my life will be without kids. 

I have no friends and I've no idea how to make friends when in this position, I have no hobbies as I simply can't afford hobbies so I have a lot of time and nothing to do. This has lead to severe depression, I'm lonely and starved for even the most minimum social interaction. It's killing me.

I can't seem to get any help from anywhere. Employment support can't help as I'm already doing things right re. I have a good CV, I volunteer, I get good feedback when I do have interviews, etc. I've been to therapy multiple times but they agree they can't help me as my depression is understandable in the situation, I don't spend all day in bed and I try to get out, there's no mental barriers when it comes to work.

The current situation...

Any job I go into has to be a good fit, if I go into a job and it doesn't work out then I will end up back on welfare but at lower rate and worse situation. 

I've been volunteering at a charity for over a year and I think I do a good job, I've been desperate to do more so when a job came up I decided to apply. The job was a trainee position, it was the lowest job in the office and one I could do with my eyes closed. This job was great because I knew I could do it, I had experience working there already so I thought I'd be a shoe in, and it can lead into multiple other roles in the office. The interview wasn't great, but also wasn't bad.

It looks like I don't have the job. 

Now I'm not sure what to do because...

A. I'm still a volunteer. It's almost as difficult to get voluntary jobs as paid jobs, and volunteeribg for this charity looks great on a CV, so it's not like I can just easily go into a new volunteer role elsewhere. I need a volunteer job to stop myself going insane but also as it's my only work experience and way to get references. I'm going to feel like a joke going into volunteer when people know I was turned down for the job, seeing the two managers who interviewed me. 

B. If I can't even get this job then what's the point in trying? I've been unemployed for so long, I just can't get back into work, if I couldn't get into this...what should have been a breeze for me to get...then I'm struggling to see any point in even trying any more. This has been my attitude for some time, for obvious reasons, but this is worse. 

With no point in looking for work that also translates to no point in living...I've no chance of friends, a partner, anything. I literally have nothing in life and it looks like there's no way of changing that, every attempt I make to get anywhere, the smallest attempt to improve my life just falls flat. I don't see any point in living.",29May2019,2
377,"Hi all! So I am a 20 year old guy and my problem is that socially I really don't know where I fit... I've always been shy and had difficulty making friends and altough I opened up a lot more in my later years I still feel like I have problems making genuine connections with people as frequently as other do. My love life sucks, since I fell in love with my best friend she didn't return any of my feelings and the only other girl I've slept with I have this cold/(can we even call it friends) realtionship with. I see all these people confidently approaching each other and here I am, confidence in shambles and just being hit with it all I don't know what to do. Am I just maturing? I feel like I am better than I was before although with all the social standards I have to satisfy its harder...",29May2019,1
378,"My sweet girl Ashley was sexually assaulted two nights ago. We are home from university and her parents were away on holiday while it happened. She was at home alone with her highschool aged sister. Ashely was invited to her close friends house (in their neighborhood) for some wine and dinner. Sadly she drank a little too much so she decided to head back home early. It should be noted that she is in a cast from a recent surgery so she has to scooter around. One of her long time family friends, Mr.Asshole (21M) offered to help her home. Ashely has been sleeping on the couch downstairs since her surgery prevents her from walking to her room on the second floor. Being quite drunk, the last thing she remembers is getting home and setting herself down on the couch to fall asleep. She woke up the next morning in their guest bedroom without shirt on. Mr.Asshole had texted her the night before asking her “to not tell your mom that I took advantage of you”. Ashley cannot remember what happened past falling asleep on the couch.

Mr.Asshole later told Ashley on the phone the  morning  after that he carried her to the guest room and took her shirt off because “you kinda woke up so I took that as a yes” past that he was vague with the details. Not giving up much. 

Her highschool aged sister got home right as  Mr.Asshole was coming BACK AGAIN to “check” on her AGAIN.. Ashely’s sister didn’t let him in again thankfully. 

Ashely is hesitant to file a report because she just wants to be done with it.* I am 100% on her side no matter what.* However I want to push her to file a report. I think that even though Mr.Asshole and the Asshole family are long time family friends, this **should not exempt** them from justice. Ashely just doesn’t want to cause more pain/ drama than there already is. Her mother somewhat agrees. 

So reddit, 

a) what should I do? Should I keep voicing my opinion to Ashley? Or should I back off and let her make a choice?

b) what should Ashely do? Is it worth ruining deep friendships over this?",29May2019,7
379,"For my older Brother’s 16th Birthday, he got a $10,000 car from a family member, who also promised he’d do the same for me and my younger brother when we turned 16.

 My 16th Bday was yesterday, and I did not get a car or even any money towards one. I didn’t tell the member I was bothered, but i can’t help but feel angry that my brother got multiple nice cars (he wrecked 3 cars, including the birthday one) and I didn’t get anything. I’m so tired of being dependent on my parents to take me to and from work/school when I know how much they hate it. 

I wish I could say I knew why this is, but the family member did not give any indication of why he made this obviously angry choice. We are moving out of state this summer, though, and this particular person (and others on this side of the family) have resented the fact, and this wouldn’t have been the first time the person withheld gifts or something because he is angry and wants to manipulate us. 

Idk how to handle the situation. I really wanted a car so I could hang out with my friends here before I leave this summer, which I can’t do now since my parents work all the time and can’t take me to places they go. My parents say when they sell our house they’ll buy me a car, but I know that won’t happen since they don’t trust me to drive after my brother had his problems.",29May2019,0
380,"I've been thinking about doing review videos on YouTube for a while now. The thing is that, after a test recording, they would average between 3-5 minutes each.  
I remember reading or hearing a while back that anything under 10 minutes was considered a waste for some reason?  
Any thoughts folks? Is it worth it recording and uploading my shorter videos?  
Thank you.",29May2019,1
381,"My mom grew up smoking cigs at a young age, on top of having adhd. Since then I theorize her impulsive personality grew uncontrollably, because now she is extremely impulsive. It has always effected everyone around her drastically.  She had her own business around 15 years ago, and was making a lot of money, but that soon went away since she always scammed her clients to go pursue her gambling addiction. She also stole my dad’s money a lot, and they were married for 10 years. Her impulsiveness also effects me and my 2 year old sister (I live with her and my 2 sisters, the little one is hers). I’m most concerned about my little sister because of how my mom treats her. She doesn’t have any patience with her. Whenever she cries, she gives her a phone to watch YouTube. Whenever she doesn’t want to do something, she bribes her or threatens her with a fake monster, or a spider since she knows she’s afraid of them. My dad and I have tried to talk to her about this but she just won’t listen. How do I help her? I really don’t want my little sister to grow up with an anxiety disorder or to be as impulsive as she is.",29May2019,1
382,"Would Datacamp.com, or Codecademy.com be more beneficial to learn Data Analytics from the very beginning?

Preferable:
1. The site with better bang for my buck
2. Highly respected (over the other site)
3. And which yielded a more suitable result for landing a new role in the Data Analytics field",29May2019,1
383,"I’m in grad school, once I graduate I will move and need to decide where to live. I have two places in mind and have been thinking about this for the past year, but I still don’t know. I would appreciate any input.

City A: I’ve visited this city many times as I have several friends that live there. Myself and most of these friends are LGBT, and I feel like ideologically we are very similar. This city is a hub for music, art, food, and has a lot of parks and natural beauty. Unfortunately, it has a lot of traffic and a large percentage of young college students. I would not live in the city but a little bit outside to have lower rent and also because my job is home health and it would be better to be closer more in the suburbs.

City B: I lived here for a year and a half before going to grad school. I also have some friends here, as well as family that lives about an hour away. Most of the people I know are from a job that I had while I was there, with a company that I loved. It is the kind of place that I could see myself growing a lot professionally, and there is a good chance I would be able to work there if I move back. I really like the people I know but I haven’t known them as long and we don’t ‘gel’ as much as with my friends in City A. However the LGBT “scene” is not very prevalent here, it is much more conservative that City A. I feel like this is important because I’ve been in the closet or half in half out my entire life and I would like to be able to date and live my life openly in a more accepting place. This city is smaller than City A, and I would probably pay a little extra to have an apartment in the city within walking distance of museums, restaurants, and shops. I enjoyed my time living there previously but it was hard for me to meet people then. I would probably make more of an effort if I moved there again.

I keep thinking about this and thinking I will probably move to City B. But then I start thinking how I would regret not moving to City A. And vice versa. I think that no matter which city I choose I’ll feel regret for not choosing the other city.

I’ve made a pros and cons list, I’ve talked to some friends, but they are understandably biased due to which of the two cities they live in. I could move to City A for a few years with the intention of moving to City B later but that seems like a lot of work and isn’t very compatible with how my job functions. I would be doing the same work in either city, I would be paid about the same. The different is that I would probably be self-employed in City A without other employees, and in City B I would be an employee with day to day working alone but with opportunities to participate in employee events in person.

Does anyone have any advice? I still have another year to think about it and make a decision but this has been on my mind for at least a year already with no decision.

Thanks.",29May2019,1
384,"First of all, hello. Both me and my friend are 15, and are finishing our freshman year soon. Just the other day, she started telling me about how her entire family abuses her, both physically and emotionally (I suspect sexual abuse too). The first thing I did was tell her that I'm going to contact the police, but apparently her family has already gone to court about something similar, and got away free. She's started telling me more and more about her life, and I feel I really need to help

My question is: Is there anything I can do as a 15 year old? Her family is most likely going to deny anything I say, and from what I know, I'm the only person she's told. 

Thank you in advance for your help, and have a good day.",29May2019,1
385,"There are some friends that make fun of me, I get it, they want to be funny and shit, but it's gonna stop. If someone tells me they're gonna do something to me, and I tell them ""Do it"" they shut up because they don't have the balls to do anything to me. So they're not trying to be threatening they are just making fun of me. So this leads to a verbal combat, what to do if someone insults me and makes fun of me? I usually stutter and I am pretty awkward when it comes to talking, in fights I can get pretty well but how do I stop this?",29May2019,1
