,text,time,score
44,"So, I came here because I'm not sure where else to go. 
I'm 20 years old, when I was in high school I started dating a girl, we went out for just over 3 years. We shared many important events in our lives together getting drivers licenses, prom, graduation, both started the same college together. But 2 years ago we broke up, well I guess she broke up with me.. not even a week later she is seeing another guy, she was seeing him behind my back too. A year goes by before I date anyone again, one of them was for 5 months but never hurt when we ended, but the second was extremely hard to cope with.  But I'm single again. 
In the 2 years since we broke up I've thought about her alot, I would say almost daily. I know she did me wrong but its soo hard to get over. Is it normal to take this long? I'm just lost on how I feel or how to deal with this. I tried talking to someone I trust about, they said that I cant think like that, that I have to move on, well that's easier said than done. For me this is really hard to talk about, any help is very appreciated ",13Nov2018,1
45,"(Serious post)
My family are causing me terrible anxiety and it’s only getting worse. 
I’ve been with my partner for a long time now and my family have been disapproving for a while, my partner has health problems and they never accepted her writing her off as a hypochondriac and constantly suggesting that I leave her despite me being very in love with my partner she’s one of the things in my life that makes me truely happy. 

My sister is super judgmental of other and also has been a bully to me for most of my life, she jokes around and sometimes we laugh and get along but a lot of the time she will put me down about my cleanliness, laziness or my job and passions, she will talk down my career which I studied for saying anyone could do my job and even when I told her recently I completed training she basically reacted like it was nothing. 

My mother however has been extremely emotionally manipulative ever since I moved out, if I don’t call twice a day and go around multiple times a week she gets upset. She also constantly wants me to bring things over or pick things up for her that she has brought. If I don’t she will call me and yell at me down the phone for 10 minutes or more berating me and my partner (most of this I keep from her to keep her from getting upset since she’s easily upset) she will call me and yell at me if my garden is untidy, she’ll make up that my roommate is unhappy with me about things which aren’t true and will afterwards call me crying and apologising that it won’t happen again. 
After these times I will be extremely anxious for hours and have had anxiety attacks from this. 
I love my family and they have been through things that have terribly affected them but at this rate it feels like the anxiety will kill me and I don’t know what I should do anymore?",13Nov2018,1
46,"Hi,

I'm a male college student hoping to be a doctor one day, hopefully. The thing is, I don't think I am nowhere near ready to be a doctor, my mind and my habits are just tripping me up.

I should start by talking about how I spend most of my time: reading webfiction online. Sure, it's not inherently bad, but I've noticed that I read webfiction so that I don't have to think any complex thoughts; my other time sink is my addiction to masturbation, I think because of the incapacity to form proper coherent thoughts that is associated with the fugue state I enter when I start searching for porn. 

I do well in my classes, putting in the least amount of time I can to get an A. I save as much time as I can to enter 'oblivion' as I call it. It is a state where I don't have to think, worry, or do anything at all. In a regular weekday, I go to classes, I study, then I waste time trying not to think about anything that worries me. In a regular weekend, I fritter away the entire day by reading webfiction or masturbating. I should mention that I am not suicidal.

What am I worried about? Well, I'm worried about whether or not I'll ever be a doctor. See, by masturbating and reading webfiction online I've effectively devoted a significant portion of my life to seeking nothing, whereas my fellow competitors for Med School seats have probably used that same amount of time to do club stuff, research, volunteering, and other things that I haven't done. Med Schools seem to be obsessed with finding students who have 'life experience', which is something I am clearly lacking. 

This feeds into my worries about breaking expectations. My parents, my grandparents and I want my life to be meaningful, and I genuinely believe that becoming a doctor and helping people is the best way to have a meaningful life -- while also not having to worry about money ofc. In high school, I was just expected to get good grades, do well on all the standardized tests and the colleges would admit me because I provide padding to their statistics; this was fairly easy for me to do. But now, I'm supposed to seek out 'opportunities', build 'life experience', make meaningful friendships/networks and just generally have a life outside of classes. This stuff, I have not done. In college, I got a great score on the MCAT, a 3.9 GPA in the classes I've taken, and I've made one or two passing friendships; however, the other stuff just seems really unstructured and I always ignored it because it didn't seem as easy and tangible as getting grades and test scores. 

Talking about this does pull some weight off my chest, so let me vent some more:

Another gripe/worry I have with myself is that I can't do anything significant without someone telling me to do it. If someone else asks me to do something and I say I'll do it, I'll definitely do it. However, if I ask myself to implement a habit that is important to me, like exercise, better cleanliness, stop wasting time, etc., I will do it for at most a week (more like just 2 days) and then return to my default state of seeking 'oblivion'. My default state is doing nothing, and it doesn't seem like I can make permanent changes to my habits by myself. This is super irritating to me. I pay \_so\_ much attention to what other people want from me, but why can't I devote myself to the things \_I\_ want? Surely I should be able to ask for that from myself? This is a problem that's probably been with me since middle school, but it was only really apparent when I left my hometown where I had a martial arts teacher who would force me to work out 4 times a week. 

I don't know where to start. I've tried changing myself with willpower over the last 3+ years, but obviously, it hasn't panned out. I need better skills and coping strategies. Whenever I think about how powerless I feel, I immediately blanket myself in apathy by tiring myself out somehow. However, I get the feeling that I can't keep devoting my time to thinking nothing nothing if I want to have some kind of life with challenges and meaning. I can put in bullshit levels of effort into classes and still get an A, but I can't put in bullshit levels of effort into relationships and myself and get anything out of life. I feel like, in terms of life experience, I'm comparable to the average middle schooler, instead of a college student. 

Thanks for the help. ",13Nov2018,1
47,Hey. So I want to start seeing a therapist and I was wondering if you guys had any tips for finding a therapist. Also I like therapists that are more based in testing than based on how I feel. (Maybe that’s a different thing. Sorry I’m uneducated) is there a name for that kind of professional?,13Nov2018,1
48,,13Nov2018,1
49,So I find that my perception of life changes frequently. Sometimes I think I’m on top of the world and sometimes I think that I should just give up. And it’s usually based around time of day who I’m with and season. Now the problem isn’t that it’s that whatever state I’m in I believe to be the only correct perception of life and that every other version of myself is wrong and then when I change moods I think the same thing. What is this? Is it normal is it not,13Nov2018,1
50,"43 year old male. I do have sad feelings, and get choked up by some things now and again, but I haven't actually cried since I was a kid. I don't think that I am capable of crying. Is that abnormal? ",13Nov2018,1
51,"it's too much, i'm tired and i don't want to be here anymore. too anxious to fix anything. i don't want to make it to my 20th birthday",13Nov2018,1
52,"Basically, I know that if you don’t give your thoughts undue attention for anxiety, you stop caring about intrusive thoughts... can you do the same for depression and you eventually get over tiredness, anger, resentment, grudges, irritability, etc?

How can I help myself?",13Nov2018,1
53,"So I went to the bathroom at night, I left to go back to my room. I was thinking about a conversation I was having with my friend. Now she’s on the second floor and I went to use the third floor bathroom.  So went down stairs. Then all the sudden my brain and body wasn’t thinking straight.  It was like a dream almost where you can’t control it. I thought I was on the first floor. But I was still on the second. So open the door thinking it was my door I was wrong. All the sudden it felt like I woke up. I said to my self what am I doing here this isn’t my room. My other friend who is her roommate saw me. I was like wrong room. Advice? Did I just sleep walk?",13Nov2018,1
54,"The holidays are coming up soon. My father passed away 3 years ago on New Years from cancer. And, I can’t stop thinking that I’m not living up to what he would want me to be. ",13Nov2018,1
55,"Just last year I finally got over my imposter syndrome and started to actually recognize that I have anxiety. Before that, I thought that I was just nervous and shy and that anxiety was a term reserved for people with ""real problems"". I always had the inclination that I didn't deserve to say that I had anxiety because other people out there have it much worse.

Now that I've finally past that, I feel like I want to go out and get diagnoses for a million other things as well (dyslexia, ADHD, autism, OCD, etc.) and I'm wondering what drives this impulse, and why so many other people want to do the same. It seems like everyone wants to wear a mental illness badge these days.

I try and be as honest as I can with myself and consider whether or not I have such disorders or if I just want to be unique and ""sophisitcated"". Are people seeking diagnoses to validate their lack of success in life? Are people just trying to grab on to mental illness statuses to make themselves feel like they're special or ""damaged""?

I have a cousin who always complains about her own social anxiety even though she hasn't been diagnosed and is the biggest social butterfly I know. She is also incredibly lazy and it gets her nowhere in life. Is she using her self diagnosis as an excuse for having done nothing with her life? Could I potentially be doing the same thing by seeking further diagnoses for myself?

My girlfriend has a laundry list of mental illnesses but she is the exact opposite of my cousin. She has pretty severe autism which tends to branch out in to all sorts of other issues, but she keeps it to herself and you'd never know she had any problems unless she told you. She mentioned to me that when she was younger, all of her friends would start to mimic her illnesses for no apparent reason. Why does this happen? Do people do this to feel special? How do I know I'm not doing the same thing?

Disclaimer: My own diagnosis considerations have existed before I met my girlfriend so none of it is linked to her.",13Nov2018,1
56,"This is more of a personal question but I have no motivation to do Anything even the things I love. I always tell myself “today I’ll be productive” but I end up just lying around. I try so hard but I can’t do anything. And I know a lot of people will jump to the conclusion of depression as it is one major symptom but I don’t think of myself as a sad guy. I don’t think I have any major mental illnesses. I just what to know why this is happening or if there is anything I can do to help myself as my life is spiraling out of control and I just am too apathetic to do anything. 

If you know of a subreddit better suited for this sort of question please tell me. 
Thank you in advance ",13Nov2018,1
57,"It's really painful to think about what I'm doing at the moment, in the manner a 3rd party would do. Not me being caught up in what I'm doing, I mean me thinking ""What would someone else say about what I'm doing"". The kind of perspective you use to scrutinize other people on a daily basis, EG ""look at that dumbass posting on /r/mentalhealth to bitch about his problems as though someone is going to step in and solve them for him instead of actually taking action and responsibility for himself and seeing a mental healthcare professional like an adult"".

I'd never done what I outlined in the title (almost literally) until I had a Shroom trip in college. I'm not even sure I had self-awareness before that, and even after, it's sputtering and painful. I strongly suspect most of my family has some degree of executive functioning issues. Anything involving me using the concept of time as a tool is extremely difficult. I've been living my life on autopilot, and deadlines don't exist unless they're immediate.

The hell is going on with me?",13Nov2018,1
58,"Just looking for advice. Fairly new relationship (8~ months). My partner suffers with anxiety and depression and has been medicated for most of their adult life. They've openly told me that they are in a funk, and it's getting worse...trying to get into their psych to change some meds and trying to find a resolve, but sometimes I'm at a loss. 

I get that detaching and isolating is a symptom, but I don't know when to keep pushing or the retreating is on purpose. For people going through this, what do you want from your SO? I am extremely supportive, if anything I want to help too much always willing to go out of my way or whatever I can do, am I being annoying? Should I just give them some space?  

Thanks in advance. ",13Nov2018,1
59,[removed],13Nov2018,1
60,"I'm from the east coast of the states, and for years now I've been struggling mentally. I can't diagnose myself with anything because I haven't talked to a doctor about it yet, but I'm planning on doing so very soon. I'm just worried about how it goes and how to go about talking about concerns for depression. Do they just ask questions and diagnose you? I'm not sure how they go about it and what my experience will be like once I go check out what's going on. Can anyone that has talked to a doctor or nurse about their mental health provide me on some info? ",13Nov2018,1
61,"Are there good options for talking to someone if you can't pay for anything? Is it just wasting what little time and money you have if you don't have insurance? I've never been to therapy but my behavior is ruining my life and I don't know how to change no matter how hard I try and I would like to talk to someone but really don't know how to start. How do you find the right therapist? How do you trust someone off the bat and just tell them shit? Sorry if this is something that gets posted everyday just don't really know what options are for something like this. Any help or advice would be appreciated, thanks.",13Nov2018,1
62,Meds haven’t worked at all for me and I am extremely opposed to ECT. Does anyone know anything else I could try? I’m open to suggestions ,13Nov2018,1
