,text,time,score
0,"It probably stems from a severe lack of confidence (which I couldn’t tell you when that all went to shit).. but whether it’s for a family baby shower, a school concert, a date, or my friends want to just have a fun “photo shoot” there is a very high chance that you’ll find me  frantically pulling my clothes out of my closet on the verge of tears trying everything on and hating it until I break down and cry and end up showing up incredibly underdressed because I resort to wearing baggy clothing that clearly gives off the vibe that I don’t care... reality I do care I just panic while trying to get ready :(
I don’t know why because over the past year while I’ve really improved on my self confidence... anyone relate/ know why I might respond like that or how I can work through it? It really puts a damper on my day when I have something important going on.",13Nov2018,1
1,"Today, my sessions with my therapist, who I have been seeing for nearly two years, have ended. He told me he thought that I was done with therapy and believed I’d be fine without it. I strongly disagreed with him and still do. I’m now aware that many True CBT therapists do this. It is a time based type of therapy and it does not offer supportive care. In my eyes, it is a therapy based on getting themselves good results. Sure it can help in the short term and get people out of bad situations, but it is not designed for any form of relapse that might occur. 

My therapist has said I can return if another crisis occurs, but frankly, the trust has been broken and I’ll likely never see him again. He also had to drop this little info on how he’d normally drop a client who refused to do the homework assigned in CBT, like I did, but saw I needed help. Which also irritated me very much. 

So to sum it up, CBT is too rigid and designed to post good results from their patients as opposed to truly letting the patient dictate when therapy should end. I will not be going back to a therapist who uses those practices again. ",13Nov2018,1
2,Sitting here waiting for my appointment I came to a conclusion. Reality is like an iceburg. Normal people only see above the water line. The further below the surface you see into those warped areas man isn't supposed to see. The more severely I'll you are considered by society.,13Nov2018,1
3,"Hi guys, I know a lot of you are here for help and advice and I’m gonna try my best to give that to you, if anyone is wanting a chat, a rant, a friend or some advice then please don’t hesitate to send a message, I work in mental health so I’m quite experienced in dealing with people who need help and I promise you won’t be a burden, I see so many of the patients in my place who are alone and have no one to talk to and it breaks my heart. Lots of love to you all 💖",13Nov2018,1
4, I’ve been having nighttime panic. It happens most nights where my heart races at like 7 or 8 pm. I’ll notice that suddenly my heart rate is elevated (sometimes up to 100 bpm) and then the normal panic and worry kicks in. Often times I’ll be asleep and suddenly jolt awake with a racing heart and a tight chest. I have a history or anxiety related to bipolar disorder. Has anyone else experienced nighttime panic ? ,13Nov2018,1
5,"So, this is rather new to me. I’m 21 years old, and over the last few years this problem seems to be getting worse and worse. 

I was always annoyed at loud noises, and to my parent’s dismay I would always turn the t.v. down to low levels even when I wasn’t in the room. I guess noises have always annoyed me, especially certain kinds of dissonant (maybe?) noises. However,  now it’s becoming ridiculous. 

I’ve started to notice it whenever the letter s is used in conversation louder than normal level. Just an annoying sharp uncomfortable sound. Clapping in this auditorium today was just obnoxious and I found myself covering my ears without even thinking about it. Dropped dishes can stay in my ear for over a day with that gross ringing. I can’t seem to watch 80’s and early 90’s movies without getting bothered by the crazy sound effects even at a moderate level (forces me to cover my ears). Some people’s voices just annoy me in general, and also conversely I guess some voices are just heavenly to listen to. 

My housemate’s loud noises are really getting on my nerves so much. I’ve told him it annoys me, but it’s hard to explain how bothersome. I think I’ve started to subconsciously like him less and get annoyed at him more in general mostly just cause of this. 

Anyone have any ideas what’s causing this? Is this a mental thing? Is it possible it’s some spectrum of autism? Still, I’m quite sociable and have high empathy I think. I’m rather befuddled :3, and why is it getting worse??

TL;DR

Certain noises have always bothered me, but now it’s getting worse. Anyone know why or what I should do??

",13Nov2018,1
6,"Hey guys, my friend has been acting strange lately. They have been very reclusive, stand offish, and somewhat angry. They have always been somewhat withdrawn, but its been a lot worse lately. I have asked them a couple times if anything was wrong but they always said they were fine, but things got worse. The other night I found them outside in the cold huddled in the corner of our patio clutching a doll. I tried asking them if something was up but they said nothing was. It was kind of weird because they would kiss the doll and just huddle in the corner. Should I be concerned? Or am I over stepping my bounds and being nosy. Thank you. 

&amp;#x200B;

PS They have never displayed behavior like this before and have made remarks about deteriorating mental state, but when asked about it do not elaborate. ",13Nov2018,1
7,,13Nov2018,1
8,"I have mentioned it a few times in posts but I haven’t gotten responses and I’m kind of desperate now I just need someone to listen.

My girlfriend was murdered a year ago (I am a lesbian just for reference), and I had to witness that one. My friend was also murdered almost a year ago, it will be in December. And it is my dead girlfriend’s birthday in December as well. So needless to say, everything sucks and I don’t know what I am doing. I’ve been so depressed for the past couple weeks. I’ve barely been able to function. I didn’t go to any of my classes last week. I feel so lost. I’ve been having nonstop flashbacks as well. 

I don’t know what I’m doing. I’ve been dissociating all week. I was at work and just left the faucet on and it sprayed water all over me for about a solid 2 minutes before a coworker asked what I was doing. I don’t know what to do. I don’t know what I’m doing. I feel so stuck. 

",13Nov2018,1
9,"I worry.. a lot. I over think.. a lot. I can’t focus.. a lot. I’m guessing what I’m experiencing is anxiety but I wouldn’t know because I’m too scared to make an appointment with my primary care giver because I won’t know if they’ll believe me or not. 

Growing up I would worry about the slightest thing wrong with me and my mom would tell me to stop being a hypochondriac and that I’m fine. She wouldn’t ask me about why I was feeling what I was but instead of insisting that I was okay and nothing was wrong with me. And now I’m paranoid that people think I’m over reacting when I tell them of a symptom that I’m having. 

Lately I’ve been loosing clumps of hair, and losing weight without trying. I’ve been trying to remember to take multivitamins because I haven’t been eating healthy, or barely eating if that. My anxiety and worrying has been super high lately and last week I broke down in the bathroom at work.  

Im scared to notify my doctor of what I’m feeling and I don’t know how to go about it either. Do I just schedule an appointment and tell them I think I have anxiety? Do I try and go to a therapist? Do I have to go to a psychiatrist for this? I don’t know and each day I feel like I’m failing in life somehow. 

I’m not depressed, I was depressed a few months ago due to my birth control but I got off of it now and I don’t think my body is quite back to normal yet. Could that be the reason for my anxiety? 

I don’t know what to do and I can’t talk to anyone about it in person. Please leave me some advice.. I would greatly appreciate it. ",13Nov2018,1
10,"I have an appointment in a month to do untreated for a psychological evaluation specifically looking for depression, ADHD, and Autism Spectrum Disorder. I am very anxious about getting the testing done. I have dinner the normal battery of self administered autism tests that the web has to offer, and have always gotten likely to be in the Autism spectrum and to seek a professional diagnosis. The idea of being autistic has terrified me, I hate no idea what to expect at the three appointments I have prior to the results appointment. Should I expect mostly multiple choice questionnaires? Should I bring in self reports on where I believe my weaknesses are? Should I just cancel the appointment since there is minimal in the treatment for it? 

Cross posted in r/psychiatry

",13Nov2018,1
11,"
My boyfriend of 10 months and I broke up about 2 months ago, and ever since I’ve felt so sad and bored of life in general. It’s not like my relationship was the best thing ever, we became really toxic, but I don’t think I’ve ever really felt as happy as I did occasionally with my ex. I’ve had little flings since we’ve split, but it literally feels like I don’t know what it’s like to catch feelings for someone anymore. The worst part about this all? My ex has turned into some completely different human being, he’s a total a**hole. It’s like missing someone who doesn’t even exist anymore. He and I had been on and off and in between I’ve always felt like this, but now that I know for sure he’s not coming back.. I’m just so empty. And it’s not like I have a boring life. (I’m 15) I have the lead in the school musical, my grades are in the high honours, I’m always writing and reading and making music and singing and dancing, hell! I even made the senior dance team! I’ve also got a job! I also hang out with my friends all the time , so.. it could be my eating habits or sleeping habits but I’ve really improved on those things as of recent. It could also be the same routine , but I don’t know how I’d spice things up? I can’t enter a new relationship if I can’t fall for anyone else, I hate parties, I don’t have time to do anything new, I feel so broken. I’ve gone to counselling before as well due to a traumatic incident that occurred in the summer time, and that just doesn’t help. I wanna feel like I did while I was in love. I don’t want to keep trying to like people that I just don’t. I want to feel excited again.. also, my friends are dropping like flies and I just feel so alone no matter what. Everything’s just so out of whack. I need some advice? Has anyone felt like this before?",13Nov2018,1
12,"Found this book online today ""Dear Little Ones: A Book About Dissociative Identity Disorder for Young Alters""

&amp;#x200B;

What da...",13Nov2018,1
13,"I can't quite understand if the following situation can be considered abuse, even though it surely troubled me, maybe someone can help clear up my head.

One night my at-the-time boyfriend was at my dorm and we were sleeping. At some point he started playing with my boobs and that woke me up. I told him to please stop because I really needed sleep since I had an early lecture, but he didn't. I got mad and told him he wasn't respecting my boundaries and he lashed out at me saying I was making him feel like a pervert and a rapist and started acting offended. When he got mad he would give me the silence treatment, sometimes even for days, and suffering from generalized anxiety disorder that would exacerbate my condition and be unbearable. So I apologized to him and let him touch me. Was I wrong to ""make him feel like a pervert"", as he told me I did? He is not entitled to my body, regardless of our relationship.
",13Nov2018,1
14,"Hi Guys, I'm a mental health worker on an admissions ward where sectioned patients stay, and informal patients who are here voluntary because they require support.

I am on a mission to improve the quality of life on the ward for patients, and have come up with the idea of creating a Patient Leaflet for anyone that gets admitted, so I'm just putting some feelers out there and doing a bit of market research, so to say, if anyone has stayed in a similar environment, is there anything that you would've liked to know, which could go in the leaflet?

I've started off with the basics, such as what is/isn't allowed on the ward, and the times of breakfast/dinner/supper, but drawing a blank for others

Any advice would be much appreciated! ",13Nov2018,1
15,"I’m the summer time, I went over to a friends house to smoke some marijuana and this was about the fifth time I’ve done so, so I wasn’t expecting anything different to happen. We were outside in the dark in my friends yard and we were sitting at a cramped table with Christmas lights above us. My friend, (let’s call her D), and I had arrived late as she was dating the host. (Let’s call him K). It was kind of awkward because I hadn’t hung out with them since I was dating my ex so they offered me a hit to break the silence. They handed me the bubbler of which I had never used and told me to inhale. I did this wrong and inhaled everything inside the damn thing and took a HUGE hit. I then started coughing and literally couldn’t stop and then slipped into a weird state. Everything started to look further away from me. And that’s the last thing I remember. Telling them “I was scared”. So then I remember everything going black and I just saw like pixels and I tried to make shaped out of them but it was really scary it was like I had to make certain patterns to survive. Anyways, I can’t remember what order things went in and I’m not going to get in too deep because I’m already messed up thinking about this night.. but I remember feeling like someone was raping me and calling out for help and hearing little snippets of the outside world. I remember scratching at the ground because I thought if I stopped I would die and they’d all let me die. I remember everything going so fast and I couldn’t stop it and I kept hearing someone screaming. I remember seeing fractals and not even being able to comprehend what was happening, like the world I knew was a lie. And this was real. That scares me to this day. I remember saying nobody loved me and calling out for my parents and my ex. Anyways, eventually I slipped into an okay state and I remember D, who had not taken anything being the only sober one. She helped a bit by trying to bring me back.. but eventually I just slipped back into what was happening in my brain. They then took me inside where they gave me water and I remember feeling like I was building shit, it was weird. But then everything kind of faded away, but still, the feeling of like realization that I had felt plagued me the entire night. That night my entire world view had changed, the next day, I still felt high. Which wasn’t different for the last times I’d been high. But the feeling never really went away. And then I started thinking about it all the time and having weird questions pop up in my head everyday. And this still happens (this was 4-5 months ago? Anyways, later on I found out while all of this was happening in my brain, I was like jumping the ground and banging my head up against the fence and running backwards into the fence and screaming extremely loud, so much so that the police showed up and they hid me. So let me continue, the thoughts never went away they still happen, fast forward one month after the incident and I’m feeling like I’m high everyday and everything is pointless and fake. Until one night happens where I feel like I’m high again, like I’m reliving what happened and I get really scared in my friends car, everything feels like it’s the same night and everything in between was just part of the trip. I scare the shut out of my friends and my mom takes me to the hospital where they put me in adavan and tell me it’s just anxiety, anyways. The next day nothing changes and I’m at my boyfriends house at the time (we had gotten back together) and it happened all over again! Fast forward to much later and I’m still having panic attacks and flashbacks but this time weird shit starts happening, like feeling things that aren’t there and feeling like everything’s going super fast. Nd feeling like I’m vibrating. Anyways, and still these thoughts aren’t going away. So I start not being able to sleep in silence or everything starts to speed up and I hear things and I get scared of sleeping alone because of the dreams... so anyways now I’m here. Where still some of that stuff still affects me, like the thoughts and now the sadness and the no point in anything feeling but the panic attacks have kinda stopped..I’ve tried taking to a counsellor but it doesn’t help. I just feel sad and anxious and hopeless and empty and bored all the time now. Scared of randomly slipping into an attack or going back into my head like I did that night. Is anyone feeling the same? Am I just unormal and weird, what’s wrong with me?",13Nov2018,1
16,"Ive been to a new psychologist once and i like her, but honestly dont even think i can tell her everything she needs to know about me cuz im pretty ashamed about alot of it and cant even get the words put of my mouth. Would it be bad if i took a benzo before therapy to actually be able to talk about it or would she be upset i was under the influence?",13Nov2018,1
17,"I started using the PHQ9 depression screening questionnaire to monitor my mood and the effectiveness of my medication, but I don't really understand this question:

    Moving or speaking so slowly that other people could have noticed? Or the opposite - being so fidgety or restless that you have been moving around a lot more than usual.

Does the first part mean physically moving slow like a sloth? Or is it being slow completing tasks due to motivation/procrastination/distraction/etc?

Also, when I have changed my dosage of SSRI or SNRI meds I get ""the zaps"" and I always have trouble explaining what they are. It's a sort of tingling or electric feeling that sometimes seems like it's in my brain, and sometimes runs down one side of my body all the way to my toes. They seem to be caused by head and/or eye movement. I always get them when I walk around a corner. Is there a medical term for this?

Thanks!",13Nov2018,1
18,"My friend runs a psychologist practice in West Virginia, and she started her social media accounts the other day to bring awareness and end the stigma on mental health.

Please follow her on Twitter &amp; Instagram @TracyTLC_, and she’ll help you have a breakthrough! ",13Nov2018,1
19,"I recently realised how much the relationship with my father has impacted my life. I really want to learn more about myself in this aspect, since I feel like it has had a pretty negative effect. 
I've done a lot of self analysis and managed to somehow get most of my problems under control. But right now, I see I can't manage alone. I don't really feel like I can or want to talk to a friend about this. I want to some how understand and help myself alone. I also am not in a place where I can easily get therapy (money, stigma,time). 

So my question is, are there any books you can recomend about the effect of the father figure(or lack thereof) on early development? Any resource would be appreciated. ",13Nov2018,1
20,"So a couple of weeks ago I was walking home and nearly got run over by a car. I wasn’t too injured—just a bruised shoulder and lots of pain. However, it left me scared of walking across cross walks and i was workin on that in therapy. The other night, I was driving home and it was dark and I was on an interstate I’d never been on before, and suddenly the lane I was in became the other side of the road. An 18 wheeler ended up right in front of me and i realized and I swerved just in time. I quickly pulled over and cried. Now, I’m scared of driving. I’m even unnerved to be in a car. Twice in the span of about a month I’ve nearly died in a car related accident. I don’t have therapy for another month and in a week I have to drive for about 3 hours on a trip I’ve never made alone. I’m terrified. I’m terrified of driving again. I have nightmares of me getting killed by a car and i haven’t felt like myself since. I just don’t know what to do.  ",13Nov2018,1
21,How can I tell whether I care about people and have real empathy for them? Or whether I just believe I do?,13Nov2018,1
22,"Hi all,

I (24) am looking for advice on respectfully encouraging my significant other (21) to seek therapy.  

We’ve been together about 10 months and the subject of going to therapy has come up a couple of times.  I myself go to therapy and see a psychiatrist and take meds to deal with my mental illness.  She’s currently not on any medication or seeking any treatment but suffers from mental illness.  

Tonight she mentioned how she’s pretending to be okay all the time when she isn’t.  I asked if she was open to therapy, and she got mad at me.  She says she can’t afford it, which I understand, but I truly believe her family would help her out with the cost.  I’d also be more than willing to help with the cost, but I can’t offer or she’ll be offended.  Additionally, she hasn’t actually checked if any therapists in the area take her insurance, so it kind of feels like an excuse.  I of course did NOT say any of this to her, as it’s not my place to say, so we dropped it.  

Has anyone ever been in a similar position?  Is there a way to strongly encourage it without coming off as a preachy?  I care about her and just want her to be happy and healthy. 

Thanks in advance!


TL;DR: Need help encouraging my partner to go to therapy but in a respectful and kind way.",13Nov2018,1
23,"I can’t seem to focus for even the most simple things like watching a YouTube video, my mind just wanders off and I end up thinking about something random, I tell myself to stay focused and even sometimes when I say that I zone out again and think about something else. I have mood swings one day I’m super motivated to reach my goals and the next day I’m like I’m not talking to nobody I just wanna be alone. I say random things out loud and my family tells me I’m annoying and stuff but it’s like I can’t control it. I can’t sleep at night either because my mind is constantly racing and I’m thinking about something playing out scenarios in my head I’m constantly overthinking things and have anxiety. Another thing I’ve noticed is I talk so much, and that’s not much of a problem to me but others get annoyed by it. If someone asks me a question and I like the topic I’ll talk for an hour straight and not let them talk. I get bored super easily and I guess I have noticed my fidgeting for example I’ll keep clicking my phones mute and unmute button and won’t even realize it lol. But yea I thought I had bipolar or something but I’m not sure what I have my parents don’t want me to be checked out because they think that stuff is nonsense I will be turning 18 soon tho and might go talk to a doctor about this. So yea I’m not sure if this stuff is normal but it’s frustrating and I never get stuff done. I wanted to grow an Instagram page end up quitting, I tried doing YouTube said f*ck this, I’m looking into what to do as a career but idk like I think some type of entrepreneurship thing will be good for me, but maybe that’ll be like a good thing on the side. Maybe I could work in law enforcement and have an app developed on the side I’m not sure but I’m graduating in like 6 months or something. But yea I’m not sure like if I have anything wrong with me or is it just me being dumb lol. But seriously what should I do what is best if I do have some type of bipolar or whatever do medications work what works best and easiest who should I talk to. Thanks so much whether you help me or not ❤️",13Nov2018,1
24,"I’ve really struggled with anxiety and depression in the past. 2018 has actually been a pretty good year, but recently I’ve found that I don’t really feel human. I don’t know if I’m explaining this quite right. This is the first year I haven’t been surrounded by mentally toxic people, and I’m full of love for the people in my life. I no longer have any passions in my life and I just get bored with any hobbies I try to pick up. All I do is work and sleep, and when I do go out with friends all we do is get drunk (It’s not that often though). I feel like I don’t really have a personality, which is making me dissociate. I feel as if I don’t deserve a relationship or friends because I have nothing to bring to the table. Even my conversation skills have become lacking. I know I can’t be alone in this. How have you guys come out of this type of rut? What helped you come back to reality?",13Nov2018,1
25," It is true that whatever we have learned, we can not maintain or retain it, much is forgotten at the time. But sometimes we can not forget what we think, because due to lack of meditation, information has not been able to reach STM from the sense organs. It can also be due to insufficient encoding and rehearsal, otherwise, information cannot be transferred from STM to LTM. Read more  [Why do we forget things?: The Secret to Remembering Better](https://www.scientificworldinfo.com/2018/05/why-do-we-forget-things.html)",13Nov2018,1
