,text,time,score
115,"I don't know if this constitutes a ""promotional"" post or not, but I figured I'd try anyway. 

I'm a recent University grad who, like many of my friends, experienced a series of mental health-related setbacks in higher ed. After I graduated, myself and a couple of my friends decided to incorporate a non-profit organization as a side project that will sponsor (i.e. offer non-repayable grants) for mental health research projects by early career scholars in Canada. 

If you're wondering why I'm bothering to tell you guys about this, it's because I think our social media channels might be of interest to you. On our [Facebook](https://www.facebook.com/stratasfoundation/) and [Instagram](https://www.instagram.com/stratasfoundation/), we plan on summarizing a recent mental health research paper every other day (with citation). 

We're still in our very early stages (soft launched last month), but we hope to raise $40,000+ by next summer. Oh, and if you're put off by the amount of drug-centric research, we hope you still give us a shot. Due to popular interest, we decided to run a small research series on controlled substance use and mental health outcomes - but this is set to wrap up by next week.

If you're interested, give us a follow! If not, that's perfectly alright - any feedback or help would be appreciated beyond words.

Thank you, everyone. ",13Nov2018,1
116," 

I thought I'd finally share my story, yes I am an exhibitionist and I can say that now, but 6 months ago I would never have said that...

I had this problem ever since I entered puberty but never really thought about it, never really got in trouble with the police or anyone just a few slaps on the wrist and told to keep my clothes on.

Anyway so my wife and I had a really crappy year last year, 10,000x more stress that anyone needs or deserves in the world so to cut a long story short, I started posting nude photos online to help relieve my stress (and yes it did and still does but i am not here to write about that). Most of what I was posting was just selfies nothing crazy, but things got slightly out of hand and in the end my wife found out, and was crazy upset and angry at me (which is totally understandable).

It is a weird and difficult condition that I don't want to get out of control (as that could be realllllly bad)!

i still love being naked and being seen but i've been learning how to control myself, and it is way harder than you'd think...

&amp;#x200B;

&amp;#x200B;",13Nov2018,1
117,https://www.youtube.com/watch?v=XINcn1KZVzw,13Nov2018,1
118,I have 2 best friends I consider my brothers and I have a loving family. But yet I still feel so alone. I feel as if no one cares about me or my problems. If I go to my mom or dad their best advice is “you’re gonna have to get over it” or some stuff like that. And I don’t talk to my friends about feeling lonely because I don’t feel as if they can understand. They all talk to their sibling and parents but me and my mom only talk a twice maybe three times a day. I’ve never really sat down with my mom and had a conversation I feel as if she just can’t relate to my issues. I had a girlfriend who abandoned me for no reason and she made me feel great. She made me feel loved and cared for. But ever since then I’ve just been so alone. I’ve tried to get with new girls but I’ve never been interested in them enough to consider dating them. I just feel as if I’m all alone in the world. ,13Nov2018,1
119,"My fiance is VERY blue collar.  By that I mean she's a country music loving, no shoe wearing, redneck engineering make it work with duct tape.... beautiful but sometimes naive woman.  I'm a very white collar science loving technology geek.

&amp;#x200B;

Where this becomes an issue mostly is with parenting.  She believes in spanking and using fear to get the kids to behave.  She thinks it's a logical consequence.  I believe that modeling a calm response and using logical consequences that are a direct result of the behavior is much better.  I've looked at spanking studies and more often found it actually has a good chance of making things worse.

&amp;#x200B;

Am I wrong in insisting on no spanking and logical consequences?  If not, any thoughts on how to communicate this in a way to get past the ""I was spanked and I'm okay?"" mentality?",13Nov2018,1
120,"Good afternoon guys, I'm sorry if this is not the right place for this ... a friend of mine is very ill lately ... I do not understand much about psychology, but he has posted strange things on his blog ... someone could look and give some opinion, please? I really want to help him

The blog: http://queridodiario1988.blogspot.com/?m=1

Obs: my friend is Brazilian, You can use Google tradutor",13Nov2018,1
121,"Hi guys,

I have grant funding to work full-time on developing a website: [www.thewellnesssociety.org](https://www.thewellnesssociety.org).

It aims to help people improve their mental health through:

* Self-help information and tools
* Collating resources for addressing root causes: situational difficulties, trauma and meeting basic needs

I've recently finished writing and uploading a lot of information.

I wondered if anyone would be willing to give their feedback and suggestions?

Thank you ",13Nov2018,1
122,"I was talking with my group of friends (we live together in a university dormitory) last night and from all of sudden the topic turned about me not sharing my feelings and secrets with them, like ever. They said I am building a wall around myself and I don't let anyone close enough. They said I should talk to them in private sometimes, so they can get to know me better. I told them that I don't believe that once we move out of the dorm we would ever meet again, or even chat on the internet. I told them that I used to have some very good friends during high school and I was certain that we would keep our friendships after graduation but they all forgot me. I tried to keep connecting them, inviting them to have a drink or a meal and they nearly always declined, even that few events weren't special, just 1-2 hours of talking about old memories and that's it. 

I told them I don't believe in long lasting friendships like that anymore and I don't feel like investing more time into any of their companies because I don't want to feel that sadness again that someone doesn't care about me anymore who used to be very important in my life. They said that they want to be my friends for real, that they wouldn't forget me, I should break that wall and let them close. However they don't know me, that I'm socializing way more than I used to do it a few years ago. That it's a big step that I'm spending a few hours in the backyard talking with them almost every day. My ex-roommate who knows me for a longer time also confirmed it. I get easily tired from socializing and I don't feel myself well all the time when I am with them but I just realized that burying myself into video games is not any better either, it just makes the time fly without giving much satisfaction, and I'm already short on time. 

I would like to open myself more but I just don't want to feel that sadness again when people forget me. And I'm hella sure they would. I rarely talk, and once I gather my strength to open my mouth, when I'm sure this time I wouldn't say something stupid  that would haunt me at night, they just interrupt me, like they wouldn't even care. I'm just a listener most of the time. And when I'm talking I always think about what they think about me after gaining that piece of information. I hear how they talk in the back of each other and the only thing I can think about what they would say about me. I'd love to be myself in front of them, but I know that they want to see who I show, not who I am. Honestly I just want to run away, get out of this, forget them, let them forget me, meet new people, hope they would be better to me, hope they could love me for who I am, but it happened already so many times and it didn't get better. I'm so jealous of those who keep saying they still have their childhood friends. I just feel like I don't belong in a society, and it surprises me that they suddenly want to be my good friends. I don't know what to do. ",13Nov2018,1
123,https://www.youtube.com/watch?v=nIwLLg_jDp0,13Nov2018,1
124,"All I really do right now is go to school and work. I have 2 best friends that I hang out with but I only work enough to basically put gas in my car. I feel as if I want to go out I have to spend money, I don’t know what there is to do that doesn’t require money. Also I’m only 20 so I am not able to go to bars or anything like that. I also deal with social anxiety I get super nervous and anxious when I’m around a bunch of people who I don’t know. I used to be able to make friends pretty easily but for some reason over time it has slowly gotten harder for me. ",13Nov2018,1
125,"Hello All! My name is Lily and I am an undergraduate student at Lindenwood University. I am currently conducting a study in my psychological testing class and have developed a survey. This research study has been approved by Lindenwood University's Institutional Review Board (IRB). If you are interested in taking part in this study please read the description below and click on the link. 

Please consider taking part in my research project involving the stigmatization of trauma. It is a short survey that will take approximately 10 minutes of your time. To take this survey you must be at least 18 years or older and have experienced trauma at some point in your life. Please note that all traumatic experiences are unique to the individual and will not be evaluated on severity. I understand that everyone has their own ways of dealing with, and processing, trauma. Therefore, my goal is NOT to determine the severity but instead, learn about how individuals have coped with trauma. I believe more attention needs to be drawn to this subject and my hope for this research study is to do just that. This survey is 100% voluntary and if at any point you feel uncomfortable you may opt out of taking it. This survey is also completely anonymous so I will not be able to personally identify you nor your results. Thank you in advance for your contribution to my research.

THANK YOU. YOU ARE APPRECIATED. 

[https://lindenwood.az1.qualtrics.com/jfe/form/SV\_0uFukQzh6M0I741](https://lindenwood.az1.qualtrics.com/jfe/form/SV_0uFukQzh6M0I741)",13Nov2018,1
126,"I hadn’t got an oil change since June and my car was making some bad noises. Took it in and there’s no oil left. The dipstick was dry. 

I ignored it because that’s what I do with my problems. I ignore them until they explode and then I’m left scrambling to pick up the pieces. No one should have to put up with my ineptitude. I can’t change because I’ve tried many time and I’m just fucking like this. 


I think I’m going to end it. ",13Nov2018,1
127,"In the past few months I've been getting more and more fed up with things. Something that wouldn't have bothered me much before can now ruin my day. I dislike the people I'm around more and more. At the start of my school year I was ready to try my best and get into a good university. Now I've lost any motivation and don't see the point in anything. I don't know what's causing this, or how to fix it. I've tried telling my dad but he just told me finish school or I'd end up homeless. I don't feel like there's anyone I can tell. ",13Nov2018,1
128,"I am 24, smart and keen to details and understanding of people and situations. Lately, starting about one year ago, my mind is no longer following my commands. I can’t focus, sometimes I avoid people and my emotions are out of my control. As I wake up in the morning I feel drained and confused, and during my day I am often able to work just few hours before burning out. As I am extremely rational, I tried everything I could. I stopped drinking alcool or coffee, no drugs, healthy life and sports. I sleep 7 or 8 hours per night. Still everything has failed. Now I am starting a new professional commitment which will last for years and I am afraid I won’t be the best version of me. I used to be curious and sensitive, now I feel dry and cold as a stone. I tried meditations but my mind recently become so cluttered I am not even able to do that for 10 minutes. In turns my relationship with others are good, but almost never deep: I don’t want to explain to them this, I don’t want them to see. Not because I am ashamed, but because I can’t explain this even to myself. I tried many times regular blood tests and everything is fine, the only option left is that there’s something wrong in my head. In short, I feel completely out of equilibrium and essentially unhappy, and I am afraid it could be depression. I had no trauma, loss or big problem whatsoever, and from the outside my life is really a success. But inside I am slowly burning. To be clear I’ve never thought about self harming, but I feel like I am wasting everything beautiful I have, that I am missing opportunities and happiness.
This community seems so helpful that I wanted to ask for your advice. I can’t understand what is wrong with me and how to fix this. Any advice is welcome, thank you.",13Nov2018,1
129,,13Nov2018,1
130,"By 'stereotypical nerd' I am specifically talking about nerdy guys who look like the guy in this photo - https://imgur.com/a/nRfdlD8

I also like looking up weird ways people have died and one time I made a forum thread about weird ways people have died (just out of curiosity) and someone replied about how some years ago a stereotypical nerd was being harassed so one day the nerd locked this person in a bathroom and then the nerd got him to the ground, put him in a scissor hold and choked him until he died of asphyxiation.

Something about that turned me on so much I kind of became obsessed. Every few years I look at news cases to see if it's happened again and it has. In 2014 in Oregon a man was found dead in his car. The bruises on his neck suggested that he was strangled between a set of thighs, and the victim was last seen alive at a restaurant with three stereotypical looking skinny nerds. There was one in 2013 too and the nerdy guy had a Facebook profile. His victim too died of asphyxiation when he put his neck in a scissor hold after an argument - the nerd squeezed his neck for ten minutes. I remember seeing the description of the case and when I saw that he was choked via legs, my heart began to beat rapidly wondering if a nerdy guy did it, and then when I saw his photo it was like a dream come true for me.

I already liked stereotypical nerds before all of this but something about this makes me really love them for some reason. Like I act super nice to nerdy guys all the time because I respect how deceptively deadly their thighs can be and I feel somewhat jealous of the people who died. Like maybe not to death but just having a nerd jump on me and wrap his thighs across my neck and give it a squeeze.

I probably sound like an insane person but I semi hope that a nerd goes and constricts someone to death with his thighs again soon so it gets into the news. I managed to find 4-5 cases since the 80's but it's probably more considering a lot of murder cases never make it into the news. Also I managed to find like 10 cases of people strangling people with their thighs and 4-5 cases were fatal and the fatal ones were...you guessed it, the ones from nerds. (The other 5 weren't nerds/didn't look nerdy)

Can anyone explain why exactly this turns me on so much? Like I'm not complaining, I'm just genuinely curious.",13Nov2018,1
131,"It's just a quick google form. Shouldn't even take 5 minutes. Thanks!

[Physical vs Mental Disability](https://docs.google.com/forms/d/e/1FAIpQLSeUqTsj9BLDEfj4OBsLidlfPQmkjBXbfQ1POGWZViL8D015IQ/viewform?usp=sf_link)",13Nov2018,1
132,Anyone else obsess religiously with wanting to die before sleep every night with occasional bouts of suicidal ideation on every few months or so? Been doing this since I was very young.,13Nov2018,1
133,"About 5 years ago, following years of being unsuccessfully treated for depression and taking a lot of different drugs, I came to the conclusion I had borderline personality disorder. I won't bore you with the details but everything I read about BPD made sense to my situation. It felt strangely positive to have realised this. My psychiatrist at the time was dismissive of my self-diagnosis and suggested that I could be bipolar. I have never had a manic episode and disagreed strongly. I quit going to this psychiatrist and decided to see if I could manage myself. A year or so later I went to a different doctor who suggested CBT. I reluctantly had one session and decided it wasn't for me. I had read that BPD symptoms decline with age and at this stage I had developed my own coping mechanisms so I decided again to manage it myself.

I am now 32 and it doesn't seem to be getting better. I would never even consider harming myself but frankly I find just getting by to be hard work. I don't know if this makes sense but I feel exhausted just calming by brain. I know that my emotional overreactions to everything aren't real and will eventually calm down but I often find by the time they do my brain is overreacting to something else. If I go too long without down-time, I feel like my head is going to explode.

I have a beautiful spouse, a loving family, a lovely job and no financial issues. But I feel like I'm just going through the motions. The only emotions I feel are overreactions to perceived shame. I don't even know if I love anyone or have any real feelings.

Have any of you gone through something similar? Did it just get better? Would you advise me to go back for treatment? I know that I never gave CBT a fair shot but I find I have a very closed mindset toward it and get frustrated easily. I don't know if I have the energy or patience for it but I really don't want to start taking drugs again either.

Thanks for reading and any response is appreciated ",13Nov2018,1
134,"Obviously I'm not asking for actual medical advice but I've been off meds for a while and had a set back mental health wise and think I might try meds again to get out of it. The thing is I already tried lexapro, valdoxan, prozac and venlafaxine and they didn't go much. Just wondering if anyone has had any luck with other drugs (maybe I also didn't give then enough of a chance) or what people's opinions are cos I'm going to go to a doc but I've yet to meet a doc that actually knew what they were doing when it comes to anti depressants. (Can't afford psychiatrist so will just be going to a regular GP)",13Nov2018,1
135,"So, I am a 21(M) and I just want thoughts on emotions I guess. In that I feel like I have always had a very big emotional imbalance.

When I was a toddler my parents had me tested for autism because I was just really weird(I was not autistic). Yet until grade 8 I just had issues. For the first 3 years of elementary I would hide in closets(apparently) and on the first day of kindergarten I remember hiding under  something the entire class.

So I have always had social anxiety. It wasn't until grade 8 and highschool that I had good friends who normaled me out per say.

Yet from here on out certain emotions I could never control. I would cry for no reason as a kid. Or let's say I get called a name or one of my siblings punches me. I always remember being confused as to why I am crying because I wasn't really that upset.

This is similar to if I do something wrong at work of elsewhere. I guess I can't handle that because I get basically suicidally depressed if I get yelled at. I just can't control it. If I get angry at myself for something, or a couple weeks worth of procrastinating there is nothing I can do to stem the wave of emotions. 

This worries me.  As no matter how reasonable I try to be with myself it just takes complete control. I will be fine in the morning. But two weeks later or whenever I trigger (I guess) myself again it's the same.

This is the same for crushes I guess. I go on a coffee chat with someone. And even though it didnt lead anywhere I just can't stop thinking about them. It's again something I have tried to control.

I guess over the years I have just tried to shove all my emotions in. I hide them well. I am calm and collected at work, and at school and to family. 

But idk. I just feel like there is a darkness inside me. A voice when I was younger telling me to do things I definitely didn't want to do. Just thoughts that shocked me that I had no clue where they come from. 

It has slightly come back imo, but with a voice saying really racist things in my head. I don't feel like it's me thinking it. As it shocks me and I dont understand why. I am definitely not racist.

I don't know. I know I am not exactly mentally stable. I have basically had depression for a long, long time. I just don't know why I can't control my emotions. On one hand when I lose control I get consumed by darkness. Yet I also jump between new grand ideas for my life. To travel the world. Or to pursue this career or that. And I just jump around constantly.

I don't really know if this is the right sub for this or if anyone will read my long post. But I appreciate anyone who takes the time to give there thoughts...",13Nov2018,1
136,"I’m 16 years old, I am a male. You know that feeling you have when you just wake up? That few seconds where you are just realizing where you are and remembering who you are. It only lasts about 3 seconds. But who knows? Maybe this is just me.

But throughout my entire life I’ve gotten this feeling at random times. It only happened every now and then. Nothing to be concerned about. But as time has gone by, there have been certain times where this feeling keeps happening to me over and over again. Sometimes I have this feeling as much as once every 2-3 minutes. Other times it never stops, and I’m stuck in this loop until I fall asleep. But I’ve come to notice that the 2 experiences I just stated only happen when I am either pulling an all nighter, or am high off marijuana. I have only smoked about 3-4 times within the past 2 years, 

But throughout the past month, I’ve been getting this feeling every few minutes. It doesn’t matter what I’m doing. I could be playing video games, hanging out with friends, or even when I’m in school. It just keeps happening. It’s almost as if things don’t feel real. 

If this is a sleep problem, then I don’t know what to do. My sleep schedule is kind of odd. Some nights I’ll sleep as little as 3 hours. Then the next night I’ll sleep as much as 16 hours. It’s pretty random. I never know when I’ll wake up. 

But if anybody has any advice I’d appreciate it. 
",13Nov2018,1
137,"We're in a long distance relationship, so the information I've been getting the last few months have all been via text/messenger/calls. Essentially, his brother (who is 16) has anger issues as well as suicidal tendencies. He's gone out on their property with a rope and duct tape before, a few times iirc, but has always come back. So I believe there's some part of him that panics before he actually does it and then he stops the attempt. But the attempts still continue. More recently he had a rag stuffed in his jacket that he was going to use to attempt to choke or strangle himself. Luckily my boyfriend caught him as he was trying to leave and talked him into coming back inside. They sat down and had a conversation where his brother told him what he'd planned on doing. They talked it over for a while, then went to bed.

&amp;#x200B;

The help he has received - He was inpatient at a facility in Alabama for about three weeks. They adjusted his medications (I'm not entirely sure what he was taking; I can find out if it's important), involved him in group therapy and he had an assigned counselor. He hated it there. My boyfriend said he seemed a little more docile and definitely didn't lash out like he has done to them in the past, but as soon as he got home, he started right back up with his outbursts. It doesn't seem to have prepared him for coping or dealing with his issues outside of the facility. 

&amp;#x200B;

From what I've gathered, he has a very specific view of the world. He thinks things should be a certain way and the world needs to conform to his view instead of vice versa. He thinks he's going to be alone forever, he frequently tells his parents that they didn't raise him right and that's why he is the way he is, women hate him, he is disappointed with everyone in the world because they aren't conforming to his ideals. He does fine in high school as far as grades, but says he really dislikes the other students. His mother offered to get him into a different school and he brushed her off. He's particularly abrasive towards her as opposed to his brother and father.

&amp;#x200B;

They're kind of grasping at straws at this point. In my mind it's either going to come down to he's either going to succeed in taking his life, or they're going to have to book him more long-term in a facility. I don't know if anyone else has been in a situation or knows of a situation similar to this, or has any advice or suggestions as to what can be done. Thanks in advance.",13Nov2018,1
138,"My girlfriend starting to be reluctant of telling me when she is having anxiety attack as she says i dont know how to help her when she is having an attack and i only make it worse, i really want to help her, do you have any advice on ways to help her during her attacks and try to calm her down. (I dont live with her so we mainly talk by chat)",13Nov2018,1
