,text,time,score
64,"I don't know if anyone has had any similar experiences like this or not, I'm just looking to figure out how to get the old me back. As the title says I can't focus, at all. To exert the effort to write this is far more difficult than it should be. It's been like this for months, almost constantly. Some days I can't even get out of the house to go to class, I really want to, I just can't. I work on homework for hours and get next to nothing done. I feel hopeless and defeated. I wouldn't say depressed but I might not actually know what depression means, idk. I think it has to do with stress though. I've felt this way before, almost constantly, for 5 or 6 years from work. Now the stress is worse and the symptoms are worse, that's the correlation I came up with at least. Also, I may have some undiagnosed issue from when I was little. Here's a list of symptoms/behaviors ;

1. When I was little (like from 5 until I was about 10 or 11)I constantly thought everyone around me was watching me and when I'd leave the walls would flip down and they'd be running experiments and could see when I was coming with secret cameras and would flip the walls back and act normal before I could catch them. I'd leave the room and run back in to try to catch them, I never did. At a certain point it was really interfering with my life and I just decided if they were going to do whatever it was they were doing I couldn't stop them or it wasn't real then it didn't matter. Either way, I had to stop or I knew something bad was going to happen. I quit, and have never had a thought like that since. It took a year or two to fully accept but I did quit.
2. If I step on a crack I have to do it with the other foot in the same spot and then in 4 more places along my foot on each side to feel 'right'. If the crack was too small compared to how the first or last one felt I had to find another little crack to add to that spot. Still do. I also flex my calves or move my tongue from the roof to the floor to match up in between and on those yellow or white dotted lines in the road for lanes. Or the same with electrical poles.  Idk why.
3. Now current stuff, as mentioned before I have been drowning in stress for years. Not regular stress, the amount of problems that come my way are unproportionally and those around me have pointed it out as well. Simple things need followed up on, bad things happen at least every 6 months. But the last year has been an exponential growth. I was keeping up at first, then I started being late with paperwork, now I can't even get my wife's car to the shop to get a quote to submit to the insurance company and I'm just driving it without a mirror and a leaking door. I was the master of paperwork, state and federal forms were my expertise. Now I can barely read. I can still read, just anything longer than 15-20 words and I drift off and have to come back but can't find where I stopped and start over, rinse, repeat.
4. So physically and mentally (some are kind of interconnected so I'll just list them together), my head is swimming (like I'm drunk kinda), can't focus, no energy most of the time, hopelessness feeling (I'll sometimes press something sharp against me hard just so I can actually feel something, so I guess a void as well), anger is an emotion I can unleash though and sadness (maybe more like self pity, I've never cried as much as I have in the past 6 months), I had some paranoia constantly looking at our security cameras like someone was trying to get in or was in (that wasted too much time, I was more sleep deprived then), if it's quiet I can sometimes here an indistinguishable radio host (male) talking away about something I can't make out, I've heard a girl (around 14 or so) laugh but nothing was there, I heard a boy scream in pain downstairs but it was nothing, then a girl (20ish) scream like she was in agony with a whimper at the end. None of those were actually anyone and it was never in the same room as me except one time I heard two old ladies bickering about me being in the house and I needed to leave (just around the stairs railing 5 feet from me), this made me really upset because I live here and who are they so I ran over to approach them and tell them to shut up and I can be here if I want. I didn't think at the time that I should be telling them they need to leave because they don't live here, or why were there two noisy, bickering ladies so deep into my home. Those voices and screams are absolutely terrifying, the radio is kind of soothing though. I've also seen doors open and a dark figure of a person walk in and close the door and keep walking (I hear the floors crack even) and stop at a dark point and they just never emerge again. I tried to approach a couple but there is nothing there when I get a light to that point. And I've seen other dark masses or figures dart behind corners or they were 10 feet in front of me and slightly to the side but if I try to look directly then they are gone.

I do have a meeting next week with a counselor at the vet center but I've never had counseling before and I don't really see how talking to someone can make things better but I'm out of options now. I can't function. At all. And crap just keeps piling up. I'm assuming sleep deprivation makes me paranoid and after a certain point gives me auditory and visual hallucinations, that's not hard to believe. Same with the shapes, or it could have been my eyes adjusting to the light change. Swimming head and all that probably stress related somehow. And I've probably had compulsive behaviors my whole life, also obsessive but I know OCD is misused a lot and I'm not like Monk or something. E.g. if I start to research something or given a task I learn all the ins and outs, god forbid I be able to do that for homework, but it's kind of a family joke now. My brother is too hasty to do something and I take far too long even though I do know what I'm actually doing at that point. 

&amp;#x200B;

Anyways, this is much longer than I meant. I'm sure I'm forgetting some stuff but if anyone has any insights on how to cope or resolve these kinds of issues I'd appreciate your perspective. Thanks.

&amp;#x200B;

Tldr; Overly stressed for years, increased lately, mental and physical effects, scary sights and sounds, resolved childhood paranoia, any advice?",13Nov2018,1
65,"I'm really bad situation right now. I sometimes can sleep, sometimes can't. Sometimes super happy, sometimes bad. Sometimes i can eat something but also sometimes can't. Sometimes my memories came into front of my eyes. Sometimes everything remembers something to me. I'm afraid to death guys. I dont know what should i do? I have a really body pains hit me like a knife.",13Nov2018,1
66,"Background information: I have OCD, bordeline of diagnosis for autism, and some unknown anxiety problem. Typically I am not very anxious, but twice in life I have had very severe panic attack episodes, and the second instance caused severe anxiety for months afterwards, so I started medicine.

When I started the medicine I'm taking (citalopram hydrobromide [selexa]), I was really down for hours a day and anxious a lot. Then I started the medicine and regained a will to live. Also, time and medicine has largely eradicated my unknown anxiety problem, so now the only real anxiety I have is OCD related (what I mean is, not a large magnitude of anxiety; back to normal much lower level).

But for the past few weeks I've been pretty down again. And really irritable. Someone says/does something, I feel outraged, get depressed, and just stop doing what I need to do. I also get stressed out really easily and this causes me to get mad and also sad and stop doing things.... I was upset almost all day today.

A couple of friends thought it could be BPD, but I definitely don't meet all of the requirements.... so I really don't know what it is

I've been too unmotivated to go to bed on time and also get distracted like crazy studying. I really need to get myself help, but I don't know if I really want to. Frankly, I am butthurt that my parents (both medical professionals) hardly take my issues seriously, and only account for my obsessions so that I stop whining about it. My brother acted like it was my fault, and caused me a lot of anxiety, and my parents did almost nothing.

My boyfriend says that I'm worth it, but it feels almost impossible to imagine being worth it if even my own family hardly bats an eye at my suffering.

On top of that, there are two people I used to be good friends with. One (Friend1) with ADHD (*possible* autism but no one knows), the other (Friend2) with a slew of them including aspergers, depression, ADHD.

Friend1 is spoiled, inheriting a house debt-free, lives at home, and does not even have to work or do chores. Friend2 gets needed attention for her illnesses -- she gets medicine(s), doesn't have to work/school, lives at home, and her parents literally saved enough money and made family living arrangements for her entire natural life, because she may be too unstable to hold down a job. I also had Friend3 who lives at home, doesn't work/school, and just got government money for her disability (which I agree she needs, to be fair).

My parents let me suffer through untreated OCD for years without so much as getting me a therapist or even *telling me it's OCD.* And when my Mom stresses me and I tell her that she is stressing me, she gets crabby, and then stresses me more, or if not, still stresses me later.

I have a lot on my plate (school, part-time job) and just wish my parents would actually fucking acknowledge that hey, maybe it'd be nice if they gave me some help instead of being so apathetic and oblivious. I *know* that they know better, but they just don't care that much. Even when my brother stressed me to the point of having bad anxiety, cutting, and finally moving out for a month until he moved out for good (transfer to university), my parents still did not take my side -- apparently somehow both of us were at fault. Yeah, and it's a terminally ill cancer patient's fault that he's dying.

TL;DR I know I ought to get help, and I am starting to really struggle. I can't bring myself to, though, because I feel like if my own parents don't care, then why should I act so deserving.",13Nov2018,1
67,"So, like the title says, I’ve recently started suffering from disassociation or like the feeling that nothing is real. I noticed this was happening sometimes while I was driving late at night and thought it was just me being tired, but in the past 2 weeks or so it has gotten to the point where it’s scaring the shit out of me. 

I keep having moments where nothing feels real, or it does feel real, but it feels like it’s not happening *now*. For example, I’m in a long-distance relationship with my boyfriend and he just visited a week ago. I was lying next to him in bed and he was telling me a story about his family and I just kept staring at the ceiling and had to touch his face multiple times to try and feel some sort of attachment to reality, and nothing worked. I felt like that moment right then felt just as real as when I was lying in bed alone a week before, and I felt like there was no distinguishable differences between the two and like either one of them could just have easily been occurring at that moment. Even now, 2 weeks later, I’ll think back on that moment and still feel like it wasn’t real. 

The scary part is that it’s been happening almost every time I get in the car. It makes me not want to drive. I will feel like I could swerve into the canyons and nothing would happen because it’s not real, and during those moments I try SO hard to pull myself out, like rolling my windows down and feeling the air on my face but nothing works until I get home. The other night I got home around midnight and still felt like I wasn’t *here*, so I went and stood in the middle of the intersection by my house so my heart would start racing and I could be brought back to reality. 

I’m basically just looking for anyone to give me advice or tell me about any similar experience they’ve had. I know this post is long so thank you if you’ve read this far. I go to therapy but my therapist had to evacuate due to local wildfires and so I can’t see her for another week or so. These events seem to have come out of nowhere, although I have been more stressed lately and my grandmother died on October 4th. ",13Nov2018,1
68,"I recently made a list of things that are good for my mental health.

Cardio, longhand, typing, drawing, piano, guitar, beer, Rct, The departed, walkingAround, lifting, reciting, keto.

I have to do that shit everyday now. Its gona take so much time, man

",13Nov2018,1
69,"Recently I haven't been able to function as a human, in fact I feel an utter disconnect. As if I'm not even a part of the human race. I exist at work, then I'm on the couch. I haven't slept in a bed in months, I haven't really slept all that much in quite awhile either. It's like I'm saving all my energy to function at work, just to blend in with society and because I need the money to pay bills. I don't remember the last time I did anything hygienic, I can't bring myself to eat more than once a day, if that. I can't concentrate on anything, in an hour I'll watch 10 mins of some random Netflix show, read a few pages in three different books, and play three different games on my Xbox. I'm angry, constantly frustrated and consistently empty. It's just like a deep nothingness inside, but I wouldn't classify it as apathy. My mind is always racing, I can hardly track the tangents, or even the subjects of my thoughts. I'm having a hard time remembering things, I haven't been able to find my house keys in two weeks now. I've been paranoid, to the point of absurdity. I've been fighting the urge to carve words into my skin, not because I want to feel pain, but because words are beautiful, words are ideas, thoughts and concepts. Although, I know the pain would help, pain seems to center me.

That being said, I feel like I cannot be officially be diagnosed with anything, primarily because it would destroy my dreams, the career I've been pursuing for the last six years. However, I'm equally as terrified that I'm losing my mind

",13Nov2018,1
70,"While I may contemplate the concept of suicide once in a while, I have never felt compelled to do it. All the same, I have noticed that I am rather indifferent toward whether I live or die, in fact I am indifferent toward nearly all aspects of my life. It really hit me hard a few days ago when I was at the beach watching the sunset and standing at the edge of a cliff. I looked  down at the rock below and thought to myself, ""What if I just slipped and fell right now?"" What scares me now is that the concept of dying right there didn't frighten me, in fact it seemed almost like it would be a relief. I have been hit by a car because of this lack of interest in self preservation. I saw it coming, and instead of trying to move out of the way I just let it happen. Came out of that with some minor fractures in my arm and bruising. Sorry about the wall of text if anyone bothers to read this far, just wanted to write this out somewhere.",13Nov2018,1
71,"cw: Drowning, murder, dead bodies, abuse, suicide

When I was 5 years old, I ran away from my mother when she wasn't looking. I ran to the next door neighbor's and jumped in their 5 foot pool. I had no idea how to swim, I remember dipping my one leg in and then feeling as if I was being pulled in by some force, and the last thing I remember is seeing my big toe going deeper and deeper, pulling the rest of me. I wasn't afraid, in fact, I was curious. It was then that I drowned, that my mother realized I wasn't home and ran panicking to the neighbor's, and that the neighbor's son pulled my limp body out of the pool and began giving performing cpr on me. It only took a few moments to revive me, and I remember being extremely angry at this young man for taking me out of the pool, when I was just trying to have a swim. I had no idea that I had drowned or that I had needed cpr, they had to tell me. This is one of my first memories.  
5 was also the year that I first remember abuse occuring from my father. We came home from seeing a popular superhero movie at the theater, and my sister and I had been in the back seat pretending that we were superheroes and had our own abilities. My 'superpower' was that I had super strength. My sister insisted I prove it, so when we got home I was the last one in the door and I slammed it super hard with my 'super strength' and surprised my sister. I remember us both being excited until our father approached, began screaming at me about disrespecting his house, and then picked me off of the ground by my neck, choking me. I don't remember being choked as much as I remember seeing my feet lifting off the ground and being 'taller' than I ever had before, and then being dropped and crumpling on the ground.

Around this time or possibly a year or so later, my mother and sister and I were involved in a serious car accident on our street while leaving the house. Our road was a dead end but there was one street connected to it that had a stop sign that someone blew through and T-boned our car, pushing it into the ditch on the other side of the road. The airbags were deployed, my mother's door was broken not only on the outside but on the inside she ripped out the door handle trying to escape and scratching the interior, as we all thought the car was on fire since there was smoke everywhere. My mother broke her ribs but my sister and I were okay. The next thing I remember was the emts being there, and walking home with my sister to tell our other sister that mom was being taken to the hospital. 

Then there was the dead body incident. When I was in grade school, a body was found in a vehicle at my school. A teenage boy had murdered his father because he had been grounded and his phone taken away. I remember finding out the news on a Myspace chat room I frequented with my friends after school one day. My friend told me about the body, and I remember feeling extremely disturbed with the fact that I had been at school that day playing on the playground at recess only a few meters away from a dead man. I started tingling everywhere and breathing heavily. I explained from my friends that I needed to go, that I felt like I was having a heart attack and that I could feel this man's pain. They acted like I was crazy and gave me all the :rollingeye: emoticons that they could.

My teenager years were especially hard, being abused and struggling with an abusive custody situation that officials and lawyers continued to allow happen despite several attempts of intervention. I got caught in the act of attempting suicide by my father, whose immediate response was to take me to the police station where they would detain me for hours, lecture me about how good I had it and how ungrateful I was, and in general be treated like a criminal. I wanted to try again, until I was finally allowed to see my mother and she cried and held me in her arms for what seemed like forever and promised me she'd make everything better and fight for me. I was 13 then, she was finally successful of saving me from that house and those horrible, cruel people when I was 16.

When I was 19, a friend committed suicide by blowing his head off. Several of our friends in the group had all seen the signs and saw it coming up until a few hours before, but chose to ignore it. I could hardly look at them during the funeral, which, by the way, was open casket. I still can't fathom why in the hell his family chose to do so, especially since he ended up being cremated. I was unable to be up close and personal with the body due to the fact that the mortician had used a flesh colored clay to essentially sculpt him a new face that was eerie, waxy, and looked nothing like him. I felt nauseous and cold, I had to leave after that. I was truly shocked and disturbed by how okay these people were, not only with themselves, but with sitting and chatting and laughing amongst themselves so close to a dead person.

Fast forward to today. The recent death of a friend that I grew up with has traumatized me so much more than the previous one. It all boils down to one thing: he chose to die, she didn't. She had so many goals and aspirations for her future. She loved her life, her job, her family and her friends. This was something that he had thought about and contemplated for a long time, whereas she probably never thought that she'd die so young once. In fact, she thought she'd live to 100. She reminded me a lot of myself in that way and many others.  I also only knew him for a couple years, our adult years. He taught me how to drink and play beer pong, but she taught me how to love, laugh, and be unconditionally kind to others. I watched her grow from a small child into a blossoming young adult that was loved by many. 

I really want there to be hope for me. I want to finally heal from years of traumatic experiences and get over my current and constant fear of death. I should be spending my days doing things I love with the people I love, like she did. I should be making a difference, teaching people things, and helping others. But I can't help others if I can't help myself. I can't be making others happy when I myself am not happy. I want to move past all of this, but there's so many layers and things I don't remember, and I have a feeling that my time here is limited. I desperately *want* all of these things, I don't know what's stopping me.",13Nov2018,1
72,I can’t seem to get up and get things done i used to be so independent strong and slowly it’s all falling apart. i just feel broken. i’ve been in bed all week i wake up shower and get back in bed i haven’t been eating properly i’m so stressed too,13Nov2018,1
73,"I need serious help. I'm not sure what information matters, so I'm hoping whoever answers can help me by asking some questions? 

I have been to a few therapists, but nothing long term. I feel like counseling and therapy is so...basic. I feel like I've learned more researching on my own than I have from any therapist - even an expensive, reputable one. But I also am completely unsure of myself so maybe I'm just dumb. I can't afford it anyway. 

My mind is scattered, always all over the place, and paranoid. I'm worried people won't like me, like REALLLLY worried. It affects me every day, every single relationship.. I can never be enough, and at the same time, I am over the top. I am functioning, but barely. People, from the outside, see me as scattered brained. I have been called ditzy, inconsiderate, rude, goofy, flaky, flighty...etc.  But I have also been called classy, mature, intelligent., etc. 

But I do not identify with those at all. I feel like those describe my anxiety and the front I put on. It only make me more confused because I really want to be able to see myself clearly and not as this offensive monster I think I am. I know this makes me seem flaky, which I am.  I know they know I'm fake.. and I've been called htat many times. Because I am. 

I have a pretty weird family - diverse, crazy, eccentric, and not supportive. I have a weird history and I definitely have a weird perspective on life. 

I have always been curious about people, but lately, I have been obsessing about them and who they are and how they deal with things. I feel almost detached - like an alien looking at humans like I'm not one of them!

I just feel bizarre in all I am. I am also depressed, I'm sure of it. I'm sure I have been depressed for over 10 years. 

I can't seem to get help, because I feel like I do odd things in order to manipulate people into thinking I'm normal. If that makes sense. I have made such a habit out of pretending, that I come off as all over the place. I don't even know what's real anymore... or what is really me.

I just think people don't think it is as serious as I think it is. But, likke I said, I am so unsure of myself that I also think I could be being dramatic and stupid. I'm also angry at myself and other people for all of this. I want someone to blame, and I have so many people to blame, but it helps nothing.

&amp;#x200B;

I'm just so confused as to how to get help. I don't know anyone else that can relate to me. I feel like most of these problems manifest in my relationships with other people - which are getting fewer and fewer. People still seem to tolerate me, but because I have never seemed seriously mentally ill, people seem to be annoyed or mad at me all the time. I take it really hard when people get mad at me (or even irritated or annoyed) and it pushes me deeper and deeper into my bad image of myself. Every single person's opinion is valuable to me - and I am always at odds with myself.

ANY thoughts would be so appreciated! :( I'm drowning. Idk how else to say it, I feel like I'm losing my will to keep trying to figure it out. ",13Nov2018,1
74,I think I'm having another personality. I already searched google about it and idk if it is reliable or what. Please help me. im really scared that I might myself of worst my family.,13Nov2018,1
75,"Even when Im no5 depressed, when my OCD and anxiety gets bad and I cant stop the thoughts I will literally sometimes just repeat over and over in my head ""fuckkkk i wanna die i wanna die i wanna kill myself fuckkk!!!!"" For sometimes like a couple hours over and over again and its like it calms my ocd racing thoughts. I dont consider it suicidal ideation since i dont have intent and honestly don't really understand why this is what i think/say... Im just worried if i tell my psychologist she will think its worse than it is .... thoughts??",13Nov2018,1
