,text,time,score,subscribers
64,"I suffer from major depressive disorder, anxiety/panic and I was diagnosed with ADD as a kid, but was only on Ritalin for 2-3 years.  

I found some way to cope and I think I started taking a slide in the wrong direction in 2013 or 2014, where I ended up more depressed and felt like I couldn't focus as much.

In 2016, I left my employer, who I had been with for the previous 13 years to go work for a former boss.  I eventually was fired literally a year later in 2017 for ""performance.""  I had started the ball rolling with my PCP to get some of my issues addressed but I didn't get them all addressed in time, apparently.

I eventually had a breakdown this past December, because I got a job in August and was starting down a similar path of poor performance because of lack of focus and just generally being depressed/angry about where I was.

Long story short, I ended up checking myself into a local psych ER because I felt like I needed some serious help (i.e. PCP was limited help, and I just started seeing a therapist but weekly or bi weekly appointments weren't enough at the time).  I ended up going to a partial hospitalization program for 2 weeks which did me well - I'm not psychotic or anything and wasn't really a danger to anyone but needed more than weekly appointments with a therapist.  It ended up being a positive experience and I felt like a whole new person when I left.

I ended up getting an awesome job at the local community college and started last week.  When I left the other job, one lady said that she was sad to see me go because she saw a change in me and my work for the better.

But, something has been nagging me recently.  It seems like I feel a bit guilty that I let former colleagues down because I fell into some bad habits and then I felt like whatever issues I had going on in my head at the time compounded them.  I feel like I need to apologize or something and that I am getting treatment and its seems like I am on the right path for now.  I am not trying to make excuses or get hired back because where I am now is more in line with my career goals.  In other words, there was more at play than people might think and that it was nothing personal and I can understand why I got fired and eventually used that to get help I needed.

What do you guys think?  AM I obsessing over this a bit much?",14Mar2018,2,
65,"I have been seeing a therapist for the last 6 months now. I have a lot of difficulty opening up and talking about difficult subjects. Even though I am trying my best, therapy hasn't helped me at all. I avoid talking about things and start crying at the slightest uncomfortable subject. I hate the feeling of crying when there are people nearby. It makes me feel weak and vunerable.

Now last session my therapist basically told me that she thinks this  therapy isn't helping me and she wants to refer me to group therapy. I am very doubtful and scared of this. If I can't cry/open up to one person, I certainly can't do that to 10 people at once. I feel like apperantly I am way worse than I thought and therefore I get transferred to some heavy extreme 2 times a week group therapy. It makes me feel so sad and anxious. I am really trying my best to talk and get emotional, doing my best to get better. Her telling me that it isn't working kinda felt like a kick in the face, even though I know that I am not making progress. Felt like ranting",14Mar2018,0,
66,"It feels like a cognitive death of some kind. Like my brain does not want to live and thrive. Honestly, like my brain gets so fed up, that it shuts off repeatedly. Every time I try, I find myself tired over and over again. Like going backwards... thinking is now making me increasingly tired... I seem to be getting more and more lazy as time goes by... It's been getting worse every day for months now. It's like every day is worse and worse...I have a very hard time believing that this is how I'm being affected, but it is what it is! Like instead of thriving, my brain is shriveling up and going backwards...That's the best way I can describe it. (can someone help with this Cognitive Death??) Even to just write this post I am extremely exhausted. And I keep phanting and wanting to go lie down in bed... My friends in my age range are active and productive, and get so much done in a day. Same thing with the people on Reddit, or on other Boards... and I keep seeing that people are posting, being productive, etc. But for me I will read one sentence on the computer and I'm exhausted... Like actually start going out of breath. Like actually out of breath and my brain refuses to cooperate. Just so tired I want to close my eyes and rest. So, not so much a physical tiredness, but tired to BE, tired to actually THINK and be myself! (When I was on Vyvance, this was at its worst!! I'd get so Fatigued I could barely BE or think anymore. Thankfully I got switched to Adderall,  and it's less pronounced, but definitely still there...) This also happens if I try accessing Memories (of the day or otherwise), I immediately go out of breath, like that's too much information for me to handle. I eat and sleep fairly healthy, so that that shouldnt matter too much?? I don't think eating not very well should affect your actual COGNITIVE health like this. Unless it's chronic malnutrition... But what could this cognitive fatigue be?? What could this possibly be, to be tired of talking, thinking, remembering, processing? I got blood work done with my Dr. and everything came back fine. thyroid, magnesium, b12, and everything. All came back fine, what else could I run a test for, to check for this Cognitive Fatigue? but day to day, I am extremely fatigued, and have very low motivation as well (unless I'm on my Adderall...) but even then, I get so tired so easily. And also even just writing this post has got me extremely exhausted...Also my memory has been very very bad as well, and I don't really pay attention to anything in society when I'm outside...Like it's so weird and not normal at all to be this anemic and weak... Like I just want to know if it's normal for the human brain to start getting fatigued like this, like, do I need to run some Detox or something to get it started up again, literally every sentence I read/write gets me exhausted, why is my brain shriveling up like this, going backwards?? It's like that drive to live is gone...I need to know what condition this is, when the brain refuses to work and be itself, and it would rather just lay in bed all day...(because even to just finish one sentence in talking is impossible. I am so cognitively tired.)

I am just getting really fatigued of doing stuff, regular human stuff. Like, the brain is getting lazier and lazier... I also do HATE talking now. Talking on the phone is exhausting to me, talking to my Friends is very exhausting.. I literally can't talk for more than a few seconds without getting exhausted and I have to go lie down in bed. Just really really big fatigue for everything and right away... What is wrong with me???

It definitely shouldn't be normal to be going backwards in your Cognition. So what other tests could I run, heart/liver? What do I tell my GP? (btw this has been going on like this for as long as I can remember. At work as well, I can barely get through my shift. I get so exshausted...and I feel like I'm gonna die and I need to lie down, and then I'm exhausted for a few days afterward...or I am having trouble finishing a sentence when talking to someone...)

P.S I am also on 112mg of Effexor, and consider myself a fairly delicate individual. Could this be a side effect of Effexor, that's also harming the memory at the same time, and causing fatigue from how the anti-depressant acts? But what do I do, I am far too delicate to handle a taper. What do I do to combat it if it's the Anti-Depressant causing this??? Because it very well could be. It's a combination of things that the Anti-Depressant is acting on, that's bringing on lethargy and fatigue by making me happy?? Or what else?",14Mar2018,7,
67,,14Mar2018,2,
68,,14Mar2018,123,
69,[deleted],14Mar2018,1,
70,"Hello all,
No idea if I am going to keep this post on here or not, I just need to vent and possibly get some outside perspective (and perhaps validation) on what I am going through. 

I am a 27 year old female. Not sure if it matters but it could. Anyways:

3 years ago, I began taking SSRIs to help stabilize my moods. Most of my anxiety and depression cycles were triggered by attachment insecurities. I also went through a fairly emotionally abusive relationship, and needed extra help after coming out of that. I took Zoloft, and it worked great for a long time. I hated that I gained 30 lbs and lost my sex drive, however. Overall though, I would say the Zoloft was definitely helpful. I went back to school and got my masters in counseling, and started dating again and met my (now) fiancé! I'm not sure I ever would have been secure and anxiety-free enough to date in a healthy way if not for the help of medication. Fast forward to now: 7 months after gradually coming off the Zoloft. A brutal and dark winter in the Midwest. Wedding planning. The first few months after grad school. Boredom. Depression. Living in a new place with my fiancé.

This is the first winter without my meds. For a while working out and using the SAD light were really helping, but now they really aren't. I'm starting to think that more is going on than just some seasonal depression. I had thought all of my attachment anxieties were behind me, but recently they have been coming back. I've noticed that my fiancé and I are not in the honeymoon phase anymore, and it has really been bothering me. We generally have very good communication, and I know I could talk to him about this, but recently I have felt like he and I have not been connecting emotionally as much as I would like. I am not sure what is going on, and I am afraid he will not be honest with me. I have not liked the moods I have been in, and I am worried that they have really been wearing him out. I don't know if he is willing to admit this if it's true, or maybe I am just paranoid. I don't know how to make it better, or how to re-spark things. I keep thinking ""you should be blissfully happy, you're planning a wedding"". The truth is that I am grieving a number of losses all at once, and it's hard to be happy wedding planning when all of your money goes to it, and you've no money to date each other. I'm worried that maybe our connection was not all that strong in the first place, and that's the thing that has me in knots. 

I'd love to go to therapy to process all of this, but unfortunately I just don't have the funding. Any insight is helpful!",14Mar2018,1,
