,text,time,score,subscribers
34,"Just to preface, I am actively returning to therapy but I really need to inquire if anyone else dealt with a similar issue or may have some advice. Also, it is good to vent, but sadly this will be long.

When I was a younger lad within the ages of 18 to 25, I had an extremely short temper &amp; it usually occured with significant others, specifically significant others who didn't work &amp; appeared to expect me to be the provider of the situation, while at the same time not even doing anything at home. I, as well as they, were very fortunate that my anger never lead to physical abuse (but i am sure mental certainly happened), but it came so close many times. I know there was a lot of things I was angry about that I didn't realize at the time like feeling trapped in both relationships &amp; location, felt like i was going no where, etc. Finally at the age of 25 i decided that unless i changed my situation then everything would remain the same. So I packed up, moved to a location with much more opportunities, and spread my wings. It worked well. Got my own place, got into a new career, got into a good relationship, things were doing well. Life happened, relocations occured, relationships ended &amp; began, but for the most part, the anger that I felt before my move seemed dormant, perhaps eliminated. I was in control of my own life no matter where I went. The events in my life were of my own making, good or bad. And I was fine with that.

Eventually I came across my tribe, a group of people (about 9 to 11) living and working together to build a foundation for themselves to thrive individually &amp; and as a group. I loved everything they stood for, everything they did for eachother. And by their good graces they allowed me in and made me family. For the 1st time in my life a great weight was lifted off of my shoulders. No more did I have to fear that if I lost my job I could become homeless, I had a support system to help me get back on my feet. I paid my share to maintain the household &amp; from there I was able to research various interests of mine. For all intents &amp; purposes, I was home, safe, and secure for the 1st time since I was a child with my parents.

After a time we found out that the house we were living in was falling apart faster than we could repair it, and moving was an inevitability. Sadly, we could not find a place that would fit all of us in the timeframe we had, and a few of us had to split. I along w/ my now fiance volunteered to get a place of our own. We all keep contact &amp; i visit one weekend a month as well as have another tribe-peep come to my place who happens to be another partner (I am poly.) And sure, things were rough initially on my end, but we pulled through very handily. We were even able to thrive ourselves a bit. The two of us working together made the machine run smooth, and I was still happy. We added one more person to my apartment &amp; everything was still great. And then came time for us to look for a larger place, and this is where it went downhill for me.

In the situation of just my fiance and I, our financial agreement was I ensured our bills got paid &amp; outside of allowances, she would allocate funds for additional debt payoffs, and things we wanted to save for. A fantastic system for the both of us, espectially for her because she is low income &amp; giving her the power of where money goes after necessities gives her tons of confidence, and her decisions were sound at all times. Our 3rd pays us a solid 3rd of expences that are for the apartment, food, and gas money (we share 2 cars.) But what is happening is that during the process of finding a place, moving, and settling, it became very clear that I was the final say in anything. I did not want this at all, but nothing would get done w/o it. The two were relying on me, and that is fair for the context because these two had little experiencce with the whole afair. But a revelation occured that reinvoked the same flavor of anger &amp; temper from before I moved, and the revelation is that either or both of the others in our situation could lose their job and we'd surviive, but if I lost my job then it would be catastrophic. Once again, I am in a position of great responsibility that in truth solely relies on my ability to continue generating that income. And the result of that realization is that now I am becoming very irrational in anything that doesn't go my way or whenever I am confronted about something that I did in the apartment that is not to their liking, or even just a thing that respects the others in the home, the urge to just flip that person with two middile fingers and claim ""Oh just fucking deal with it, if it weren't for me you wouldn't be living as comfortable as you are in the first place."" is sickening to me. And then I become even more angry because this sickening sense of entitlement because of income and all the decisions i make is completely uncharacteristic of me...... but then i realized it is totally characteristic of me, just that I have been so far away from being the head of a household that it just never flared up again. My ego has finally woke up and is rearing its ugly face at everyone I love. It makes me believe that moving away all those years ago wasn't moving from a toxic situation, it was running away from my problems, problems I didn't understand. I think I understand them now, and now is the time for help. Thank you for reading.",14Mar2018,1,
35,[deleted],14Mar2018,0,
36,"(F/USA, East coast)

Please help. I can't figure out how to solve the following problem. 

Why is it so hard to just *find* a psychiatrist near me who takes my insurance?!?! This is *ridiculous*! I've called a ridiculous number of providers, found them through my health insurance's website, but there has been some sort of problem with every single provider I've called. If it's not at some dumb health center where you must have a PC in order to utilize their mental health services, it's that the provider doesn't actually take this ""network"" of insurance anymore, or whatever BS that really is, which means they *shouldn't even be coming up in the search on my health insurance's website*! One of the providers I called realized this and told me she would have to call them to tell them to take her off that network on their site!

I cannot focus at work now after yet another returned call from leaving a message, only to be told the provider doesn't take my insurance, I'm extremely anxious and feeling hopeless. Again. I can't even find a goddamn psychiatrist. Seems like I can't have anything at all these days. Not even my sanity. ",14Mar2018,3,
37,[deleted],14Mar2018,0,
38,"Once you deduct work, sleep, and obligatory bullshit, I might have 2-3 free hours a day. You can pry them from my cold dead hands. I can't be productive 24/24 hours 7/7 days a week.

Are people supposed to be 100% efficient with their time, all of the time? Am I the only person in a world of robots? ""Just make time"". Uh huh. The psychological and physical toll of eating into those few independent hours... is it just abnormally costly for me?

I get home, I get in the bare minimum, I retire for the night. Day after day after day after day. And I'm exhausted mentally and physically and emotionally. As if I'd never had any free time to recover at all.

Every fucking time I ask about this, I get a gatekeeping ""HA HA LUCKY YOU I ONLY GET 6 HRS SLEEP AND 1 HR FREE FOR THE REST OF MY LIFE (FUCK YOU, YOU'RE STILL A KID IF YOU HAVE A PROBLEM WITH THIS GET WITH THE PROGRAM)""

The fuck? Were humans ever even meant for this kind of thing?

I would kill to just up and travel, new scenery, new environment, different problems... but it's not like the USA has that kind of vacation time. Or any at all.

Going to school most of the day, and having homework that followed me home, somehow I actually had more free time than I do now. The fuck.",14Mar2018,7,
39,,14Mar2018,5,
40,"hi everyone, 20/f/US/college student here w/ bpd and I feel like my life is spiraling out of control. it's funny b/c moving out at 18 promised a lot of stability and for a while I was doing good on my own, but I always fall into self-sabotaging loops; I set goals for myself, fail to meet them in spite of myself and because a disgusting part of me revels in my failures, depress myself as a result of feeling like a failure to myself, etc. as my mental health declined as well, I noticed certain behaviors worsening or appearing such as the following, I'm basically just putting this out there because I am plain and simple scared of and scared for myself. It also doesn't help that I'm extremely insecure in my future and have so little faith in myself/my abilities and capabilities.

- I started dissociating a LOT more. the sensations got worse and started cropping up outside of exclusively my episodes as they previously were, just at random times where my reaction to something was so hyperemotional I had no other way of coping other than launching myself out of myself (if that makes sense). I feel so detached and alienated from my body most times and experience a numbness that feels intensely physical I live in an almost permanent sensation of numbness/tingliness; my extremities feel ice cold, my thoughts and everything disperse themselves in such a way that I feel like my existence is scattered all around the spaces I occupy. I've had experiences where I've looked in the mirror and felt like the individual I was seeing wasn't myself; the sensation that I am not me. And the feeling always lurking behind all of this is always just emptiness, like my body stops at my torso and then dips into a big hole; I'd even describe it at times as though my insides were sinking.

- I'm generally a sympathetic person if not empathetic, or so I perceive myself to be (maybe it's fake? sometimes I just feel empty and generally uncaring, maybe I've led myself to believe otherwise over a long time), but lately I've felt a disturbing lack of care/apathy for others and even myself. I just don't particularly care for anything or anyone and this is extremely unlike my character in my view; before when I was high-functioning I was a lot more of a forced extrovert, I cultivated good relationships with my friends; now I've grown apart from most of them or intentionally isolated myself one way or another. I probably don't get enough human reaction; maybe that's why I feel so much worse.

- I cannot stop sabotaging my own goals unless I plan out my day on a schedule basis and forcefully sit down and study or complete errands/work in segments with breaks in between. When everything is fine, I create situations for myself OUT OF THIN AIR and make things a living hell for myself. This has always more or less been an issue with me since early social life (middle school onward) but now it's almost out of control to the point where I can't really trust myself to accomplish things.

and most of all, it has put massive strain on my relationship. I actually may have just gotten broken up with, I'm not even sure. I don't want to assume my partner is nt; he is a child of divorce and I definitely see/understand why he has issues arising from that, including a lot of anger. seeing me decline has taken a large toll on him to the point where he regularly sends me to my parents' place just so he can feel less miserable (it's a mutual decision, I'm extremely unstable to the point where even I can recognize I can't always be a person worth being around). I want to get better for him, I don't want to give up on the relationship unless he decides he's done. but I have no idea where to start; he feels hurt by a lot of my behaviors and shitty residual defense mechanisms and I myself know they're shitty too; I do things like impulsively accuse (borne of my constant fear of him leaving me), lie about minor things that give me anxiety about telling him, impulsively make ""everything/nothing"" statements before reflecting and considering whether or not I actually mean it. I really have been a nightmare partner and I want to make things good if I can for both of us.

overall, these are my concerns and prevalent issues in my life, I feel like a chicken running around without a head; I'm at my wit's end, I started """"problem-solving"""" aka taking things out on myself through SH even though I know it's dangerous and reckless, I just have such a lack of care for myself most times that sometimes I can't even complete daily functions that other people do with ease. also, therapy isn't currently something I can afford or even look into unfortunately. all I really have are people or the void of the internet to vent to. so here you are, void of the internet. I just really needed to get this out of my head and somewhere, whether or not it gets any replies.",14Mar2018,1,
41,[deleted],14Mar2018,0,
42,,14Mar2018,25,
43,"If you have been following any of my previous posts you will know I have had a hell of a month with mental illness rearing up for some reason. 

Well, like the title says I smoked weed and it snapped me out of my depression and whatever else the hell was going on. I havent smoked weed in about 5 years so at my wifes urging I tried a couple puffs on her electronic vapor pen. I'm at day 3 of taking 2-6 puffs a day and I feel like the weed just swept all that depression and anxiety and stress and whatever right out of my head. I can physically feel my whole body relaxing. 

Idk you are the same as me but everytime I have an episode (lasting a week to this time a month and half) afterwards I feel like such a fucking fool. I feel like I let people down and mostly just embarassment at how I behaved. 

Well I have to give it up to this weed it literally is like a miracle cure. Wayyyyy better than all the various benzos and narcotics my dr's have prescribed me. Plus no horrendous withdrawal symptoms like friggin all psych meds have. 

Anyways I feel much better. I am up and doing chores and working around the house and property. I do feel a little guilty for smoking weed but it's legal here so what the hell it literally snapped me out of the deepest funk I've been in for a long time.",14Mar2018,2,
44,[deleted],14Mar2018,1,
45,"I ask this because i came to a self realization; In my past personal relationships, I always found myself with a person who also has their own mental illness. Is this healthy? ",14Mar2018,2,
46,I am stupid . But i do really want to get rid of this ptsd,14Mar2018,1,
47,,14Mar2018,2,
48,"I’m curious as to opinions on this regarding mental health.. (I’m in no way judging anyone for taking medications.) I’m from the US, 21 F.

My mom was addicted to 42 (not an exaggeration) prescription medications. She took her life five years ago when I was 16 years old.

My grandma took her life 10 years ago - she was also addicted to prescription medications.

Mental illness runs in the family in many forms, and it’s odd to think that if I reached that point, there’d be 3 generations of suicide in my family.

So - you can understand my aversion to anything stronger than Advil.. my question is - does anyone have experience with Cannabis and did it help with depression/anxiety? ",14Mar2018,2,
49,"When in the car, I tend to see things more frequently/vividly. I don't know exactly why this is. Could it just be because  I was already anxious, and then being behind the wheel puts me in a hyperaware mode? 

Twice I've seen pedestrians in the middle of the road where there were none. These two instances were very far apart, so I didn't think much of them and had no other issues.  Today, I saw a car at an intersection where there was no one. Almost slammed on the brakes, which is not good as there were people behind me. 

I'm just worried about getting into a crash or something because of it. I've never been diagnosed with anything that would account for seeing things, so I was wondering if this has happened to anyone else, if you've discovered the cause, and if so, if there's anything you've been able to do to remedy it.

I was well rested too, so lack of sleep isn't a part of it to my knowledge. 


",14Mar2018,5,
50,"The last week or so I've been taking my meds (15mg brintellix) in the middle of the day and I feel ok for a few hrs before getting extremely dizzy/nauseous, headaches, and mild brain zaps. 

Today I took the meds around 4pm and now (8pm) I feel like complete shit. I'm not sure if it's actually withdrawal or just generally being really unhealthy and dehydrated lately (getting up at like 3pm and pretty much just eating before going back to bed for a few hours more), but it feels very similar to Zoloft withdrawals.

Has anyone else experienced anything similar? What'd you do about it? I really struggle with bringing stuff up to my doctor.",14Mar2018,1,
51,I’ve been dealing with depressing and anxiety and have had little to no motivation to do anything productive. I think about all the things I could be doing to better myself but I can’t seem to actually get anything done. This just makes me more upset and it turns into this snowballing spiral. Does anyone have any tips to stay focused? ,14Mar2018,4,
52,"I need to hear a supportive voice. My job sucks and makes me feel incredibly unhappy, I've struggled with depression for almost my entire life but things are good now, apart from my job. I have a family and responsibilities so not working is not an option. Similarly there are no decent jobs where I live (by that I mean everything is minimum wage or zero hours contracts). I've been working full time for over 16 years but my experience is in a particular industry, in which there are no jobs locally. To change to a new industry would mean starting at the bottom, which I don't think I'm a particularly good candidate for. I'm really low on confidence, I dread going to work every day and I don't know what to do. ",14Mar2018,1,
53,Does anyone have any experience with this? I have been for close to two years and now all of a sudden I feel like medication is having the opposite affect. Has anyone come off meds after being on them for a period of time for good?,14Mar2018,1,
54,,14Mar2018,1,
55,"Hello, I am a young adult who's always suffered from ADHD and MDD. As well as social anxiety problems, and just general anxiety. Life has gotten to a point where it seems all my good days are in the past. Partying in high school, I met the love of my life and we were together five years, going to concerts, hopping bars, hooking up with chicks, playing in a band and just even making new friends. But now its all falling in on its self. I lost the majority of my friends when I was forced to move states, making new ones hasnt gone well. I dont see much of a future for myself or anything to look forward too and I stopped making music. I cant hook up with chicks cause the love of my life left me and every girl I touch reminds me of her... Its currently 2:27 PM and im chugging beers just for the purpose of getting drunk. If the best days of my life are behind me, why should I keep going forward....? I just want her back. Shes all I ever wanted and I fucked it up. I dont wanna hurt myself cause I cant have her. No thats not it. I wanna hurt myself because I hate myself. I hurt the one person I shouldn't ever hurt and everything I touch dies. Its all my fault and I cant live with it. Im the bad guy. Im the coward im the pussy im not a real man. I cant live with that. I always try to improve but I cant do it. I wanna improve I want help but I dont want anyone to help me. I hurt everyone. I love you so much Jax. I really hope you know that...

[Edit]
Sorry about the ending. I kinda broke down.",14Mar2018,1,
56,"I think I might be really extremely manipulative, only I'm often not aware of it.  It's like I'm pushing down my true feelings, and playing these little games to get what I want which I think might be affection and attention (mostly the latter).  I've never read the book ""games people play""..though I remember a psyc. prof mentioning it to the class.  I put on these personas, masks, whatever you want to call them, and I wear them to suit my needs, all the while hiding my intentions.  I've played many roles: the victim, the cute innocent boy, the cute innocent girl, the aloof cool guy, the teacher/scientist, the rational one, the comedian, so many (even now I know what I'm doing..just another mask)...I've noticed I do it sometimes or a lot, I don't know.  I wouldn't say always, though I may not be aware of it all the time.  I went to this mystic healer person yesterday, and I noticed that's exactly what I was doing when I first when in there...I think I was playing cute innocent little girl introvert... then I eventually went into the extrovert mode at a few points....I really didn't agree with some of the things he was saying.

I'm drowning in this. I want to be honest, but it seems I just can't help myself sometimes.  I'm not really upset though, I just want you to think I'm amazing and introspective or something, I don't know... I've said it before, I think I'm a narcissist, or at least a person who doesn't know who they are.",14Mar2018,4,
57,Or should you just wait it out when it happens? It doesn't seem as crippling as other mental ailments. Could it worsen over time if left unchecked? Can I treat this the same way one would treat depression?,14Mar2018,10,
58,"I feel like I’ve finally made a step in the right direction. I was so scared to talk to her about it because I’ve never talked to anyone about it out loud. I feel like a weight has been lifted off my shoulders! She’s reassured me and explained how resilient I am. I don’t really feel all that resilient but I’m finally making a step in the right direction. **Healing is a process.** I am so glad and so grateful to have a good therapist. 

If you trust your therapist yet you’re still afraid to disclose something with her/him, just work yourself up to it. Tell yourself that it’ll be okay. Because it will be! She/he will not judge you! This is what they are there for you. ***You are worthy.***",14Mar2018,28,
59,,14Mar2018,2,
60,"For almost a month now I have not been able to get a hold of my former psychologist, which I have taken as I need to find a new one. I found my previous one through my alma mater's health clinic but now that I am an adult I am on my own to find a new doc. Is there any suggestions/tips/ideas on how to find a new one besides going through the long list through my insurance company.

Stats
United States
Male
30's 
Depression, ADD, PTSD, Anxiety  

For more details she my previous post below
https://www.reddit.com/r/mentalhealth/comments/830w5s/cant_get_a_hold_of_my_old_psychologist_gah/",14Mar2018,1,
61,"Hey all, 
As many relate I could go on and on about how I feel. I am going to do my best to keep this short.

From what I know, I have a depression that runs in episodes. I am 16 and am experiencing my third episode of which I am 6 months deep in. This third episode is by far the most intense and I have found myself most close to suicide here. It was triggered by an intense family argumentave period with drama. This depression was also enhanced by ecstasy abuse. 

Currently doing much better! Trying to get better, stopped drugs besides weed from time to time, eating and going to the gym. I bounce back between lows and normals as my therapist said. 

But i am confused. I have realized that even when I get better, I am more disconncted from the intense motives and thoughts of suicide I get at my lows, but I still feel like I have no sense of self preservation. Like I have no care if I live or die. Like if I was given the option to end it and have no one remember even at my best now, I would pick to end it. 

This situation of ending it all and no one remembering me is a situation I replay alot in my head as well for some reason. 

Will this go away as I work on my depression? Or is this just me as a person? 

Thank you",14Mar2018,2,
62,,14Mar2018,1,
63,[deleted],14Mar2018,1,
