,text,time,score,subscribers
0,"I’ve got a God-awful depression that’s landed me in the hospital. I’ve already been in for two weeks and will be stuck here for at least another 3 weeks while I initiate MAOIs +/- ECT.  

Anybody have any hospital pro-tips? I.e. thoughts on how to survive, get through it, actually benefit even when it’s the same damn groups over and over?

On a related note, I’ve decided to send myself a care package via Amazon but can’t think of what to include other than fuzzy socks and snacks... anybody got any bright ideas?

?",14Mar2018,2,
1,,14Mar2018,2,
2,"I am 18 years old and I have been struggling with depression and anxiety for a few years after years of emotional/social isolation, bullying, family issues etc

Right now I actually started feeling guilty about it because I always make a big deal out of stuff. I overthink everything, if I read something that irritates I feel upset for hours or days and I think about it constantly etc

I also developed a crush for a guy I met online (read the other threads I posted if you want more info) and I feel kinda 'sad' about it because I know I have no chances with him and he considers me a friend only atm (he clearly said he doesn't want a relationship).

I feel like I am overanalyzing things and being overly sensitive at everything.

In poor words I think I am a crybaby and everything read 'women are more emotional than guys' I can't help but think I am a pathetical vagina owner ruled by hormones.

Sexism and misogyny piss me off a lot and everytime I read something that contains stereotypical bs I get mad.

For example I was searching for books on a booksite and I randomly found one called 'Why men want sex and women need love'. 

I opened the link out of curiosity and I realised it was full of sexist ideals about how men only want sex and women are soo emotional and want a relationship at all costs because it is 'defined by biology' (evolutionary psychology, actually).

Some people said it was crap but the majority gave it 3-5 stars. What the heck? It was mostly pseudo science with generalisation of all kind.

It made me feel stupid for wanting a close relationship with a guy instead of casual sex because apparently it is defined by biology. 
How cool, we are ruled by our monkey brain then. 

I know it is bullshit because it is just generalisation and the authors are pretty old so they still believe in old fashioned stuff but it still pissed me off.

Sorry, it was just a random vent btw",14Mar2018,2,
3,"Forgive my awful discription but I am not good at typing. 

I am a young adult male around 21 years old [from NI]. I am happy most of the time and like anyone experience intermittent stress. I have a form of autism amongst other learning difficulties, but they haven't hindered me too much. But heres my issue. 


I have irrational violent thoughts, at the smallest thing, i could be walking down the street, and someone brushes my shoulder, or drives to fast, and i have these ""fantasies"" or just thoughts, of brutally harming them, either killing them or maiming them, it makes my heart race and i tend to zone out from my surroundings normally leaving my partner confused. 

Recently it has been happening with some people i know, not ones i am friends with, but people who I either live with or socialise with sometimes. It happens with things like people being lazy, or killing the internet, or just generally being annoying. I imagine graphic things. 

An example is this (possibly NSFW) - Someone i know, not being a clean and coperative person, always complaining about how hard their life is etc (it isn't great but they milk their situation for attention) I had a thought whilst eating breakfast of driving a 8"" kitchen knife through their face and pushing it in whilst blood squrited everywhere, then just repeatedly stamping on them. 

What worries me more is it doesn't bother me. If anything these visions spur me on as opposed to scar me. 

I wouldn't ever hurt anyone in that mallicious way. But i know this is all connected to some form of rage or anger. I don't know if this is something or nothing or if anyone can help or reccommend actions? 

Thanks 

TL;DR  - I sometimes get aggressive violent thoughts of killing and hurting people for the tiniest thing. Some form of rage disorder?  ",14Mar2018,1,
4,,14Mar2018,25,
5,[deleted],14Mar2018,1,
6,[deleted],14Mar2018,1,
7,,14Mar2018,0,
8,"I've been dealing with mental illness for at least the last 8 years. It's gotten worse and worse despite my attempts at therapy. (I've now taken steps to get more intensive outpatient treatment, so hopefully my initial assessment goes well). 

Something I've really had trouble dealing with is my emotions. I feel like I have no control over them, especially when it comes to their intensity. When I feel something I REALLY feel it no matter the context. For example, one of my brothers may make a passing comment about me being bossy, and I feel so intensely angry I have to bite my lip and walk away to avoid screaming in his face or hitting him. Also minor inconveniences (such as traffic, an unexpected errand, or spilling something on my shirt) ruin my entire day and often make me want to cry or become violent out of frustration. 

I also have no idea how to express these strong emotions or deal with them appropriately. I usually do some form of self harm (no breaking of skin or leaving scars), or get extremely suicidal because I feel like I don't want to deal with how I feel or wake up the next day and have to feel so intensely all over again. I've tried taking up art (something I like to do!), playing video games, hiking, reading, etc., but they all only distract me for a bit and don't do anything to actually help me feel any better.

Because my emotions are so intense and unproportional to what's going on around me, I have trouble figuring out what's ""real"" and what's not. If I get into an argument with someone, I won't know if my angry or sadness or whatever is to be trusted and how I should proceed to act. I don't want to ignore how I feel because I can't make it go away, but what if it's not something I should really be feeling? This makes me want to isolate myself from everyone even more because I don't want to end up confused in this way.

I've had a lot of issues with my relationships because of my emotions. I always try explaining and apologizing (even though I always end up feeling short changed because I'm ignoring how I really feel), but it tends to do more harm than good sometimes because again I don't really know what happened to make me cause some kind of conflict. Because I've lost so many people to this, I feel extremely sad and suicidal and like I'm unlovable and immature because I have the emotional control of a small child. A lot of people tell me I need to take a ""chill pill"" or ""reel it in,"" but I really have no idea how to and it seems like nobody is accepting of my intense emotions. 

I've never been diagnosed with anything.",14Mar2018,3,
9,"Hello.
I have identified an issue with myself that I want to be found interesting by other people. Like I would catch myself thinking that if so-and-so knew this about me, they would think me interesting or cool. And fantasizing scenarios in which that happens. Like I want people to have a high opinion and high regard for me.
Is this narcissism and how do I fix it and be more sincere in my relationships? ",14Mar2018,1,
10,,14Mar2018,2,
11,"Going through a fairly stressful time in a fairly stressful year or so, trying to sleep and a metaphor popped into my head that I really appreciated.


I am an underinflated balloon. My shape changes temporarily as I am squeezed but I eventually return to my original state. Extended, repetitive squeezing may cause my surface to wrinkle. As I am underinflated, I am resistant to popping when confronted with a sharp object unless it strikes me with notable velocity. However, the more I am being squeezed and my internal pressure builds, the easier it is for sharp objects to pierce me.

Before anybody goes and worries too much about me, “a sharp object” would refer to a particularly major negative life event, “popping” would refer to having one’s resilience and ability (short term) to manage stressors breached - not any sort of permanent damage or outburst. ",14Mar2018,1,
12,"I’m so tired of my life.... every day I struggle with something. I have adhd, anxiety, and probably other things as well. I’m just so tired of constantly feeling like a failure because of my adhd. It controls so much of my life. I’m sick of always feeling sick. I have so many food intolerances that each day I just feel gross, it brings me down even more and causes me to feel anxious. Why can’t I just be normal? ",14Mar2018,1,
13,"I just want someone to talk to, i feel it getting worse, and my environment makes it so much worse, cracks in everything im starting to see. When does it end? ",14Mar2018,2,
14,[deleted],14Mar2018,1,
15,,14Mar2018,1,
16,"Hello Reddit. I have come to you with hopes that you could help me with something that has been bothering me for quite a while now. I am a 17 year old boy and about 1 month ago, I broke up with my girlfriend which I had been with for about 3 months. She's a very nice girl, I loved her and there really wasn't any reason for our breakup. I did it because I felt like it. The thing is that I enjoyed breaking up with her. I enjoyed seeing her with tears in her eyes and being heart broken and I keep thinking about it. Just thinking of doing the same with other girls gives me a tingling sensation all over my body. I know it is bad and I am now stopping myself from getting into any relationship because I dont want to do it again, even though I like to think about doing it. Is there something wrong with me? Do I have a mental illness and if so should I seek help with a psychologist or something? I feel lost and I just need some explanations and directions towards what I should do. Thanks in advance.",14Mar2018,1,
17,"Background : I have been diagnosed with borderline, ptsd, generalized anxiety disorder and depression. I have ptsd as a result of multiple sexual assaults, along with prolonged emotional abuse and being stalked and harassed. 

I dissociate very often. It's my survival mode, as it is many. And after so many traumas I find myself dissociated more often than not. Sometimes it's worse than others. It's sometimes can grasp it before it gets out of hand, realizing what's happening and trying to ground myself. Sometimes it just happens and I snap out of it suddenly, like at a traffic light I'll stop seeing myself at the light but from my perspective. It can be frustrating.
Any tips? But also what's dissociating like for you? I often feel floaty and dizzy watching myself. 

Tldr; I have various mental health issues and dissociate on the regular. What are your experiences? Do you have any helpful tips? 

",14Mar2018,5,
18,,14Mar2018,96,
19,"I won't say that cutting solves all of my problems but when I'm going through a lot of stress it feels so relieving just to cut, almost like having a cigarette after a long break",14Mar2018,4,
20,,14Mar2018,1,
21,"So the other night I was at the hospital mental health ward (rather not go into detail), and the psych that I spoke to recommended I ask my gp about medication for my anxiety. We both agreed that the catalyst of all my other mental health problems including my anger, is anxiety.
Anyway, do you guys have any recommendations for meds I should ask about? Or meds I should avoid? Or even just some advice. Thanks. ",14Mar2018,1,
22,"I had a bad day. Boss publicly humiliated me in front of the entire office. Basically screamed about how the top suits is pissed off at me and how my client dealing warrants it. Keeping in mind I live in a country that ranks quite highly on the power difference and respect criterias of workplace environment. And all my juniors were there.

I had just had a spate of bad relationship attempts. 4 in just 6 months. Including one who connected with me so much that in just 1 month of knowing her I was already thinking of marrying her. She strung me along for 2 months. Then said ""I don't even care about talking to you"".

I have had little friends in my uni. Lots of ""friends"", yes, but no actual friends. Only have less than half a dozen of those. Was driving with 2 of those to a engagement of a friend. They started discussing boys. Both are feminists. They were laughing about having 4 guys on the string at once. Neither raised a single protest at what basically amounts to two-timing and cheating. Both would've screamed bloody murder if a guy had been stringing along multiple girls.

I got more and more infuriated and furious and upset with both of them until I was seething. Drove them to the engagement without a word. When we got there. I began crashing.

Walked out of the house and started crashing and crashed hard and fast. Desperately tried to call a couple of people. See if anyone would listen. No one picked my call. Messaged my therapist. She said its not an emergency.

I finally accepted defeat. I let myself crash. Called both my friends. In absolute silence without a word, let them pick their stuff from my car. Drove away from them. I don't know if they realized how I was feeling. My closest friend didn't say anything. The other one just asked ""Are you leaving"". I brought myself to say a ""Yes.""

Left. Drove at a mere 25mph in the slow lane for miles. Heaving sighs and deep breaths all the time.

Got home. Crashed completely. Started disassociating. Talked to the only friend that would listen. She said she can't, she's going through stuff too. Tried talking to another friend. She said she can't do it, that it's unfair to dump this on her, and she ignored my messages.

Message arrived from one of the friends I'd left behind. It asked ""Did you get home just fine?"". I told her to fuck off. Then a few minutes later sent a message saying I'm sorry you deserve better but I can't do this anymore. No reply came back.

And then. For the next few hours. I alternatively cried. Laughed. Disassociated. Sat in silence. Seethed in fury and anger and resentment. 

Saw the friend who'd texted change her profile information. Immediately became worried. Sent her a few messages. Told her I'm sorry, that she shouldn't worry, that she can be fine. She ignored all my messages.

Texted other friends. Everyone's ignoring my messages.

Guys. I don't know what to do. I did everything I could not to let this happen. But the choice was becoming utterly utterly invalidating every single emotion and thought I was feeling and thinking. Versus letting myself express myself so destructively.

And now I'm sitting here at work. Alone. Humiliated. Grief-stricken. Alone. With no one to call or talk to.

What could I have done or not done guys? I think I just alienated my closest and only friends.",14Mar2018,4,
23,,14Mar2018,1,
24,,14Mar2018,0,
25,"I have strong empathy for everyone.
If anything happens for anyone I feel bad for them like 10 times worse than it actually is.
It sucks what should I do ",14Mar2018,1,
26,,14Mar2018,2,
27,I'm in the bus right now going to the city to stop my therapy. Kinda anxious because the last time I stopped my condition worsened after a month and getting back in was frustrating with all bureocratic shit they like to do.,14Mar2018,1,
28,,14Mar2018,0,
29,"So I've had depression for a couple of years with some ups and downs and now I'm taking anti-depressants for maybe 6 months. I was doing great, I started school again, got a job for the holidays and then since I'm back to school in the end of January, it has begun to go down again. I can't bring myself to attend classes. I can't get myself to do the homework. So I know I will fail this semester and I might be kicked out of the school. 

I don't know what to do. I'm lost, confused and especially angry at myself for not being able to act like a normal human being and go to my damn classes. 

Anyway. Thanks for reading me, I had to write and I need to be listened. (Well, read in this context!) Any advice and story will be welcomed. Thank you again. ",14Mar2018,1,
30,"Tomorrow it will be two years since my uncle took his own life, and although it's something I think about a lot, it's of course on my mind a great deal this week.
I'm having trouble finding closure with it, and to be honest I don't think I ever will, but I thought writing a letter might help me to vent and hopefully could help others that feel the same grief. 

(I went over and took out any of my families names, which is why it probably sounds a bit formal when I mention them)

Uncle,

I've spent a lot of time just looking at my keyboard, because where do you begin when trying to talk to a dead man. 
I went to your house the other week to see your wife and son for the afternoon. Your son decided to repeat the school year because his attendance is so bad, but he seems to be doing a little better which is good, probably because he's avoiding them dickhead bullies. Your other son's doing better as well, finally moved out of his first house and is focusing a lot on uni. It's frustrating because I know if you were still here, you would've have helped them out instantly, you just had a way of doing that. Although if you were still here they probably wouldn't be having these problems.

When I found out you killed yourself, I spent so long trying to be understanding of your decision. You're a smart man, probably the smartest I know, and you spent so long planning for it, so it was clearly what you felt was right. I tried to tell myself that was OK. 
But as the months went on, I started to hate you. Our family was already grieving, and already struggling- and you added to that. Granny is broken, your sons no longer have a father, and your wife now has to raise them alone. You left my mum and all your other siblings. You left us all, and that's not fair, because we don't leave each other. That's never been how this family has worked. You ruined our family fake Christmas at your house, which I loved better than actual Christmas day. In fact you ruined every family get together. When my cousin- your niece- died, it broke our hearts because she couldn't be with us at these events anymore. When you died, it broke our hearts because you chose not to be with us. 

I know these feelings are harsh, and unjust, because I understand what mental illness can do at the best of times, nevermind the worst. But I'd be lying if I said I didn't feel hate or anger. Maybe it would be a little less if I got to say goodbye.
On the lead up to my 21st birthday, I thought maybe, I'd get a card, or a letter from my Godfather. Of course a stupid thought, but I had hoped I might get some closure. I didn't. None of your godchildren did, so why should I be different. I really really hoped you would though. You know how much I adore you.

I don't really believe in an afterlife, or that you're 'with us' in some way. But sometimes I like to hope you are. I still feel anger, mostly because I wish I could've helped, I think we all feel that. You know how involved we like to be in every aspect of eachothers lives lol, especially granny. I want you to know though, I still think you're a fantastic person, and I still love every memory of you, particularly your snobbish rants and bad dress sense. I'm doing my best to look out for your sons, doing my best to look out for everyone to be honest, just like you did a lot. It's very exhausting, and I don't think I'll ever feel like I'm doing enough for them- but hopefully I am.

Do me a favour, if by some chance you actually are 'with us', please look out for my brother, he's really struggling at the moment and I feel absolutely useless. 

And on that note, I'll leave this here. I miss you.

Love your annoyingly sarcastic and obviously favourite godchild xx",14Mar2018,1,
31,I’ve been having trouble with my emotional health... I’ve been going to school and recently I realized that something was wrong... my friends have been joking around but I’m unable to laugh at genuinely funny things and I’m forcing my self to feel anything at all... it doesn’t help that my teacher is constantly embarrassing me front of my peers. When I wake up I feel nothing but dread because I have to go to school. There’s something wrong with me but I have no idea what it is.,14Mar2018,1,
32,[deleted],14Mar2018,0,
33,"So, i'm on brintellix (trintellix) and xanax, low dose. It had a rocky start, but i was feeling okay. I thought the meds work well. But then a friend of mine bought me a bottle of jd. I thought, ""just a little, what could possibly go wrong"". Well i fcked up. After half a glass, i was already drunk. Then i laid down and blacked out. Woke up in the morning, and started throwing up and had the worst hangover i've ever had. Never happened to me before over a half glass of whisky. 


It is now about 5 days after that. I'm feeling horribly depressed and suicidal. Did i fcked my meds? What's wrong with me? ",14Mar2018,4,
