,text,time,score
0,"So, I recently had a friend attempt suicide. Many people around me were sad. I completely faked all sad reactions. He is my closest friend, I have known him for four years. Is that weird that I felt absolutely nothing. That I just completely faked that I was sad. ",17Dec2018,1
1,"I've noticed that during random occurrences this small voice calls my name or tells me something. It is weird like for example when I was having a coughing voice it told me to cover my mouth but it wasn't my voice and I didn't think of it. 
I was diagnosed bipolar psychotic.
I also noticed shadow people at the corner of my eye sometimes too. 
This isn't frequent but it happens sometimes.
Thought it was interesting and wanted to share.",17Dec2018,1
2,"Im always so proud thinking ive conquered my disorder, my life seems to be running somewhat smoothly, then comes some huge fat hiccup in my life, a mistake, the type of big mistake that no one else is making... &amp;&amp; then im reminded of my disorder, how im different, how im the single handedly responsible for blowing up my life &amp; burning all those bridges years ago, and even still, now.",17Dec2018,1
3,"I don’t think so, even if I have terrible thoughts... they don’t mean anything right? I shouldn’t have to feel bad for them? I do honestly though... I have nasty intrusive thoughts and I’ve had intrusive thoughts regarding violence when I’ve been angry, but I ultimately believe in peace.

Sorry for the ramble.",17Dec2018,1
4,"Possible trigger warning? Graphic dreams with descriptions of deep cuts. 


So I’m not even sure what my point will be.. I just found it weird that these dreams have started again as if to show me that I am not doing well mentally at all. 

I was in a much worse place about 5-7 years ago. I was self harming every day, completely isolated myself and so on. I was diagnosed with BPD. I used to always have these absurd graphic dreams where I would hurt myself in some way and then see the inside of my body, but without blood. 

Anyway, I took a nap today (also have been sleeping an insane amount of hours per day, sometimes more than 12). Woke up and after a while remembered my dream which was horrible. I just have to write it down. 

So in the dream I had scraped my knee and it would not stop bleeding no matter what. Then someone else in my dream (unknown person) pointed out that I had other cuts on my legs. And we’re talking my legs sliced open from knee to ankle. In my dream I could basically open two flaps of skin and look inside my leg.  It just looked like I’m looking into a black hole. There was no blood. Just my entire leg sliced open, I could see all the layers of skin and fat but no bones or blood. It was so disturbing.

My dreams always give me an unsettling feeling when they’re like this. That’s why I felt maybe writing it down will just help me process it. 

Thankfully next week I have an appointment with a therapist for the first time in 5 years. Still I just wanted to share this. 

Maybe someone has similar experiences with weird dreams they get whenever they’re in a bad place?",17Dec2018,1
5,"I took my first dose of Wellbutrin 75mg around 10 this morning. By noon, I began feeling slightly lightheaded, not too bad, but noticeable. At some point I began sweating excessively. Around 4, both got worse and by 5 I began having intense nausea. I haven’t puked but it feels like if I bent over the toilet I would. My whole body has chills and I’m sweating profusely. I’ve been laying in bed since 5:30 (it’s 7:30 now) and it got a little better with a stomach pill and some Tums but when I got up to go to the bathroom 30 mins ago it all came back. 

Could all of this be from the Wellbutrin? It just seems like so much considering it’s my first dose and such a low mg. It came on so fast too. Maybe I have the flu? I want to give it a shot and I know most of the side effects don’t last but a week or so, but if it’s going to be this intense I don’t think I can handle it. 


",17Dec2018,1
6,"Do you guys find it difficult to talk to your friends and family about your mental health issues?
#mentalhealth ",17Dec2018,1
7,"I really don’t remember a time that I wasn’t depressed. I’m sure it wasn’t until I was a preteen that my depression really started, but everything before the age of ten is a blur. My older brother bullied me relentlessly when he lived with us (he either lived with us or with his dad), and by the age of eleven I had developed bald spots. The balding simply brought more bullying from other students. Since there wasn’t much I could do to cover it while it grew back I wore my hair in low ponytails. My classmates found anything to bully me about. I wanted to wear makeup? Let’s make fun of her! I wore oversized hoodies because I was always cold? Yup getting bullied! I held hands with my best friend? Going to get called a lesbian (jokes on them, I like girls now too)! I moved in grade 8 and made friends with the misfits. It was great I was so happy to finally have friends who liked me and wanted to hang out with me, but they even bullied me. Most people in town were a bit wealthier, and I lived in a ratty house right on the train tracks. I tried to separate myself from the girls that were the rudest, but they gravitated towards me to harass me. After a few months I managed to find a different group, and realized in high school they were a bunch of stoners. Fine by me, they weren’t treating me like shit. I never partook in smoking until much later in high school, but they were some of my best friends. After graduating my depression worsened, probably because I wasn’t seeing my friends on a daily basis, and wasn’t getting out much. I started dating my moms bosses son who quickly turned into an emotionally manipulative prick just like his mother. We broke up rather quickly, and I realized I was polyamorous. I started dating my friend Emma, shortly after I started sleeping with one of the guys I was friends with back in high school. I broke things off with both of them after I almost killed myself through alcohol poisoning. Found out that the friend who was hosting the party I was drinking at (while being underage) had said that it wasn’t her job to look out for me. It wasn’t her job to make sure I was fine. I never felt more unloved in those following months. I started using tinder to make fun of guys with a friend of mine, and stumbled upon this great guy. We hit it off right away and have been together for almost two years now. I’m feeling better. I’m still depressed. I’m still learning that some of the things the guy I was sleeping with were abuse. I’m still learning so much and still hurting over many things but I’m doing better. Seasonal depression is in full swing, and I can’t seem to get this weight off my chest, no matter what I do. The Christmas spirit hasn’t been present for so long I just want to be a little kid again. I want nothing more than to live a life unbothered by depression and anxiety, and I’m sure in time it will come, but for now. I’m simply trying. ",17Dec2018,1
8,I’ve been alone all day haven’t talked to a single person. My mind goes to very dark places when I’m by myself and I had an emotional breakdown. My friend was supposed to come say goodbye to me today before she left for Spain. But she didn’t call me or text me but she went to dinner with other people. People she claimed she hates. My other friends are hanging out together and “forgot” to invite me. Why am I not worth it? Honestly tho why?,17Dec2018,1
9,"I have have only been when it was at shoal creek and it was terrible. The lack of structure, age, food and how crowded it was. Obviously it's new but did it improve on the rest of the things? What is the environment like? ",17Dec2018,1
10,"At the end of October this year I was put in a situation were I was forced into treatment. I stayed inpatient for a week and then got diagnosed with mdd, ptsd, anorexia, and opioid use disorder (or some shit like that, I fr didn't know that was a thing). I've been on cymbalta (it did nothing) and lexapro (it made me worse) and now I'm on prozac. (I've been prescribed naltrexone for my drug use and self harm but I don't take it) Fuck I'm getting emotional typing this out but I guess I'll finish writing all of this. 

&amp;#x200B;

I don't want to get better. I don't want to change my ways. Fuck I feel like I'm about to have an anxiety attack just thinking about this shit. I'm in a situation where I'm too much of a pussy to speak up to my doctor and tell her I shouldn't be on medication. If I don't want to get better, what is medication gonna do? Isn't it up to me? Fuck I just want to slit my fucking wrists so bad right now. I don't want to kill myself, I've seen what that does to people, but do I really have much of a choice at this point? I'm loosing control of everything. I have goals I wish I could accomplish but they're too far out of my reach. I should honestly quit while I'm ahead. I wish I could od and just die peacefully. I never wanted this. Fuck now I'm crying. God I'm not stable at all right now. I DON'T WANT TO FIGHT THIS ANYMORE! I don't want to stop slicing myself up or getting high as fuck. If I'm not willing to change, there's no stopping me. God this is all fucked up.

&amp;#x200B;

I see my therapist tommorow but if I tell her how I feel I bet I'll get sent to the hospital or something. I don't want to go ip again. It was one of the worst experiences of my life and it made me worse. Sure, it made everyone around me know that I was struggling and that I needed help but I'm worse off now. I'm just rambling at this point. Fuck why do I even try? There's no fucking point to anything. Ip made me fucking worse and it was so expensive! I just want to fucking die. I want to go to sleep and never wake up, agh there are so many different stereotypical things I could say to describe how I'm feeling. I could write about this shit for hours and my mind will only spiral lower and lower. Nothing I do does anything. I try and try and nothing happens. I guess I'll be wearing long sleeves for a while",17Dec2018,1
11,"I've being on therapy for almost a year now, I went for it because I had a drinking problem, which I still have, and altough it's nice to talk about your problems I don't feel like therapy is making any change in my life, I still have low self-esteem, I still have the same self-sabotage habits and I don't see any progress on it. Does anyone else feels like it is just a huge waste of money and time?",17Dec2018,1
12,"last semester I failed every class. This one I passed one class. Failed the other two. I remember when I was 13 and my mom said I can't do anything right. I remember all the times my parents wondered how I'd get through life if I can't keep my room clean or seem to pass college. Now they're supportive but no matter how many times my mom tells me I will succeed I don't believe it. I have just one more chance at retaking these two classes before I can never take them again. I had a wonderful day then the reminder that I failed college comes back. I wonder what the hell I'm going to do with my life. I only have a few friends and don't have the energy to text people anymore. I lie to strangers asking me how college is going and it hurts. I am a loser and I've already failed life at 20. I am seeing a therapist but she's like a friend I pay to like me. My real friend is great but I feel like I can't talk to her. I feel like I push everyone away. I barely have enough money to get by, I'm living at home. 

I am afraid all the time. when I walk out the door it's like a game of survival. Make it past this cross walk, bike in the dark before the sunrise and watch out for animals, people, cars, just make it to work alive. I wonder if I will live past tomorrow. I am just used to it by now. 

What people think about me, I speak weirdly sometimes I think. I wonder if people think I'm slow. Maybe I am. I don't feel smart. I used to but now I feel uneducated, dimwitted. 

I can't function. And it sucks. I could have a beautiful day but come home depressed. I hate this. It's living in hell. But I think suicide is wrong so I won't go there. But each day I feel like I just am losing bits and pieces of myself. 

I have had a difficult life, I watched my dad almost die at 9 in a car accident, he barely survived and was in the hospital for an insane amount of time and my mom was taking care of him and the baby and I was left behind. My childhood ended. I watched my sister having a seizure twice and I thought she was dying. When this happens it's literally like a real life horror movie. It's horrific and terrifying. And in both of these cases no one was around to help me.

I am so screwed up. I hate it. This sucks. It just sucks and I want to be normal. I want to be average. I don't care if I'm not special or amazing I just want to be average. ",17Dec2018,1
13,"Hm where to start. 
I’m 16, 
I’m definitely depressed. 
I think about suicide, a lot. Never attempted it. 

The thing is people are usually depressed for a reason, right? Whether it be finical issues, family, education or something else, there’s always a reason. But I don’t really have a reason. If anything, I think living is just a waste of time. To me it seems pointless to go to college. Work a job for like 50 years and then die? And for what? A few good memories that will be outnumbered by bad ones. 

I’ve asked myself that question; Do you actually want to die or do you just want to not feel this way? And with all honestly. The only way for me not to feel this way is to not be, right?

 I don’t really have many people to talk to about this. I don’t want to make things worse and end up in some hospital. If anything Life is ok, I have good grades, I’m doing well physical but mentally I’m exhausted. I’m exhausted of putting on a fake smile everyday and walking around pretending like I care. 

Maybe another factor is religion. My parents raise me catholic. I guess I believed in it up to the point were I was constantly just asking for guidance and never received any. They don’t know I think it’s bullshit (no offense to anyone). I usually can get out of going to church by claiming to do school work but being forced to go there makes me feel sick. 

I’m not sure why I came to write today. 
I guess I’m just looking to see if there’s any advice anyone can give me.
I’m sorry for wasting your time though. Cause honestly I’m probably a lost cause and you have a better chance convincing someone else life is worth it.  ",17Dec2018,1
14,"I’m 17 and just now coming to terms that I am probably seriously mentally ill. I’ve been diagnosed with severe depression which was later rediagnosed as a branch of borderline personality disorder, severe anxiety, ADHD. I think I have gender dysphoria (undiagnosed because I’m in the south and in high school so if I came out as trans I’d be bullied. Will probably come out and transition in college, or switch to online school soon so I can do it sooner without the judgement) if that counts. But aside these, I still feel like there may be a bigger underlying issue. I’m being treated with lithium, zoloft, and vyvanse and while they have helped in some ways I still feel crazy. I also recently started using NuvaRings for heavy periods, I don’t know if that counteracts with anything I’m taking but just in case that is necessary to mention. 

I’ve experienced both visual and auditory hallucinations a few times in my life, mostly while I either had a fever or was under the influence. Recently I smoked weed while severely sleep deprived and heard music, laughing children, and tapping on my window, and saw a face through the blinds in the window.  I smoke a lot and have never had anything like that happen prior, but that can probably be explained by the sleep deprivation. Have smoked since and nothing of the sort has happened again... to my knowledge. But then again I didn’t realize the auditory hallucinations weren’t real for a few hours until I started hearing kids laughing, when I realized that there were no kids in my house and put together that it wasn’t real. I heard them like they were right there... who knows what else my mind has gotten away with convincing me. I have always had delusions, however, which have increasingly gotten more and more irrational and odd. To name some....
- I’ve always felt an unwarranted sense of superiority? It’s weird because I don’t like myself at all yet I have always considered my mind “superior” to others. In turn this makes me feel worse about myself, and it’s a weird cycle. It has made me terribly lazy because I don’t feel obligated to do anything for myself or anyone else. I still have a sense of morality and know how to act normally so I don’t come off as selfish, but if I didn’t have the people in my life who I have right now I’d have literally no one to continue acting “normal” for and gladly lock myself in a room with food and a computer for the rest of my life.
- I’ve had an on and off delusion about being a reincarnated archangel. On and off because part of me knows there’s no solid evidence to back that up and that it doesn’t make any sense considering I’m an atheist, and another part of me says “don’t fight it, everything points to you being Special and you know it. you have psychic and empathetic abilities, it must be true.”
- oh yeah I have believed I have psychic and empathetic abilities since eighth grade. The rational side of me knows that is a big red flag for delusions, but the horrible gremlin side of me... well... right now I think it‘s true despite that I know it doesn’t make sense. I predicted a lot of weird things relating to my friends and family and now my mind won’t let go of the idea. :(
- I can’t think of a way to accurately reword this so, try not to read this in the tune of the popular Michael Jackson song: I always feel like somebody’s watching me. I have a hard time being home alone because I feel someone will try to kill me. I always have to shut myself in my room when I’m alone, with my windows and door shut because if I don’t I will feel like someone is staring at me or following me. I have had a lot of nightmares about this concept starting in my early childhood... I would often refuse to sleep in case someone would break in and try to kill me in my sleep.
- Perceived past lives that are either delusions or real depending on your beliefs lol?? And lots of dreams about those too
- Not really a delusion I just have no sense of self whatsoever and it’s worth mentioning. Most likely from BPD but yeah I’m constantly dissociated as fuck. I don’t associate my mind with my vessel. My relationships are confusing and sometimes chaotic because of this.

I have mental illness on both sides of my family; most notably mom’s brother killed himself after experiencing severe agoraphobia and paranoid delusions keeping him locked in his own house since pretty much immediately after he graduated high school. He was a genius, I went with my mom to his house to collect his things before his house was cleaned up (the actual scene in his bedroom hadn’t been cleaned at all, besides his body being collected by the coroner the day before. I was unfazed and I feel really horrible about it, almost 3 years later) and he had a ton of video game platforms and multiple journals he’d kept for *years* loaded of tips and shortcuts for various games including Mortal Kombat, but obviously he was severely mentally ill. Unfortunately his agoraphobia kept him from going to get diagnosed with anything, and he refused to let a doctor come to his home because he thought they’d poison him through medications.

Sorry that was a lot of rambling. I am kind of manic right now, I took my medications late this morning and had espresso. I will probably delete this later. 

TLDR: I’m worried that I have psychosis because I’ve had auditory and visual hallucinations while sick or after using weed, and several delusions starting from childhood including an unwarranted sense of superiority, random delusions about being a reincarnated angel and a psychic, a lot of paranoia about being watched or killed while alone. Worried that BPD, anxiety, and ADHD might not explain this. Also have gender dysphoria but haven’t come out. Family history of psychosis.",17Dec2018,1
15,"So, I don’t really know how to start this, In 2016 I was told by my therapist that it was very clear i suffer from social anxiety, Self Harm, not willing to participate socially, and i still to this day think everyone lies about how much they care and need me, but even my therapist says their seems like alot of things she cant say that i’d have to see a doctor to talk about like the fact i talk to myself and uncontrollably laugh “maniacally” ,I Have dreams where i scrape my skin off but its never really bothered me, i always chalked it up to my psyche and my love of horror 

I don’t know, came here in hopes to be taken seriously so i’d care to hear others opinions 😅",17Dec2018,1
16,"I've had depression &amp; anxiety for a long time now and at this point I've just accepted that they'll always be a part of me &amp; will always control me. I've lost all motivation to try &amp; get help for it as I don't see any chance of it improving.

Have any of you guys ever reached a point where you gave up on trying to get help for your mental illness?

",17Dec2018,1
17,"I, for example, will do my best to get some kind of exercise. Even if it’s just a walk. I’m also not opposed to buying myself flowers now and then...",17Dec2018,1
18,"My boyfriend’s uncle passed away yesterday. My bf was devastated and I just wanted to be by his side to support him.
Two years ago I lost a very close and loved uncle and at the time I felt very lonely (I wasn’t with my current bf at the time), not even my mom was with me, I went through it alone. And six years prior I lost my dad.
Today I had a lot of memories and flashbacks. When I came home my mother started yelling at me telling me how ungrateful and selfish I am (because I spent the whole day out of the house), she also said she can’t count on her only daughter.
I feel confused and sad.
I know what it’s like to be lonely and horribly sad, I don’t wish that upon anybody.
",17Dec2018,1
19,"I’ve struggled with my depression and anxiety for years, but people are surprised to hear that cause I’m usually the friend who always makes jokes and tries constantly to get people to laugh. It also seem a lot of the funniest comedians and actors struggle with mental health (robin Williams, Pete Davidson, etc.) So is there a correlation, and do any of you feel the same way about your selves?",17Dec2018,1
20,"My mom is 57 years old and I think she has depression with psychosis. It’s either depression with psychosis or lingering effects of a UTI ( which I know sounds weird, but apparently it can legit mess with mental health). Ever since my mom went through menopause around age 50 I noticed that she was is more isolated and cries/sobs every single day which she never did before and up until age 50 I had only seen her cry twice in my life! Not only had she started to cry everyday, but she started to say that things in the house had started to go missing- little things such as clocks, cooking utensils, books, toys, little Knicknacks from the thrift store etc. At first she accused another family member of taking the things , but after awhile I would find the missing items around the house. 

After a few years, it then progressed to her “sorting” all of her items around the house which resulted in many mixed match items just being thrown around the house in boxes or just scattered around the house. She did this for some time while I was still living with her. Then she changed and out of nowhere she started to accuse me of taking her things and selling  them for drugs. Let me note that I have never taken drugs or took any of her items. When I would find the items that she accuses me of taking she simply stated that she had caught me just in time before i sold them to a drug dealer for drugs. She accused me of taking her baking pans, her pens, her travel bags to a drug dealer! It got so bad that she continued to pack all of her things and then when she couldn’t find it, she would automatically assume I sold them and would barge into my room in the middle of the night threatening to harm me. It got so bad that I had to move out even though at the time she wasn’t working and I had to support her.

Now it has gotten to the point where I haven’t seen my mom in a year and she won’t even let me in the house!! She constantly leaves me messages asking me to bring back her things ( I don’t have access to the house anymore) and is always crying and stated she’s even afraid to leave the house because she still believes I’m taking all of her items! I constantly tell her I haven’t taken anything, but she absolutely refuses to believe me and will go back to accusing me. When I try to prevent her with logic or facts she completely disregards it and goes back to yelling and crying. 

I don’t know what to do! My mom needs help, but now do I help her when she doesn’t think she’s the one who needs help?? Has anyone experienced this? I’m so lost and I don’t know what to do! To the best of my knowledge she doesn’t act this way at her new job or when she talks to people on the phone. How do I help her? My mom is suffering and extremely angry and distrustful of me at the same time.",17Dec2018,1
