,text,time,score
86,"I dont know if this is the right subreddit for this, but I didnt know where else to go to, and I know this post is very long but please read it, I think my mental health is at risk but im not for sure.

Okay so for context I am 18 years old, I have a girlfriend (1 year), and I am in the first year of the IB program (yes I go to a nice school, and yes I am a very privileged kid). I have ADHD/anxiety and dyslexia. For those of you who don’t know, IB stands for International Bachelorette. I might have fallen into depression several times (as you will see later on) but i cant trust myself to think I did because there is always the possibility that I want/like to think I fell into depression, but it’s impossible to tell (because it is subconscious, correct me if im wrong because I don’t genuinely know).

(I don’t know how else to structure this so I am going to divide it into sections as can be seen below)

My girlfriend:
I love girlfriend, and she loves me, but I have serious trust issues because before we actually started dating, she did somethings with other guys/girls (sexually) and it haunts me. She also said some pretty bad things. Around 4 months ago I found out that she had lied about some things, and did even more than what she said she did (I didn’t even know half of it). Every day since about a month into our relationship I have involuntary thought about what she did. These thoughts are typically uncontrollable (although sometimes if I efficiently distract my self in time they go away) and completely spontaneous. Also, since I found out she had kept things from me and lied to me, its gotten worse. She has also lied to me on several occasions. This mixed with my anxiety...you can imagine its not fun. I might have fallen into depression. My girlfriend also has anxiety and has had a very difficult childhood, and yet I burden her with guilt from the past even though I hate to. She is very sorry about it and I wish I could just forget because I love her. I am also very self conscious and am constantly doubting myself. At the very beginning of our romance I was overweight, but I wanted her more than anything and wanted to be the best for her, and so I lost a lot of weight over two months (for those of you that want to know how: All you have to do is eat healthy and run like hell). Then once my excess fat was gone I had fairly defined muscles. By the time we were dating I had was in good shape, and very handsome (Im not trying to be cocky/cool/etc, its just part of the story). This lasted up until school started and I started gaining weight again. I am now more overweight than I was originally. This has to do with my girlfriend because it makes me doubt myself even more. I feel like shit compared to other guys and I feel like she wants other guys and wants someone who’s is attractive. I sometimes cant even be with her because those thoughts get into my head. I dont know if these are anxiety attacks or not, but sometimes when I think of the things that happened spontaneously, I cry uncontrollably. Sometimes I hyperventilate very briefly then cry. I can merely prevent this by taking many consecutive deep breaths.  She once suggested I could have a form of PTSD, but that sounds pretty serious.

My ADHD/Anxiety/Dyslexia:
I was diagnosed with dyslexia when I was 7 years old, and when I moved my current school in Europe, I needed a new diagnosis to begin the IB program. So I went and got one and the results were fine and that was that. However, the diagnosis revealed evidence and symptoms of ADHD. We showed it to my school so I could get accommodations during exams and such because of the ADHD, but since I didn’t actually get a diagnosis for ADHD and only for dyslexia they didn’t allow it. Then the psychiatrist who originally gave me the new dyslexia diagnosis gave me a recipe for Concerta (methylphenidate) for the ADHD. So I went to the pharmacy and got it but the dosage was too low to have any effects, and to get a higher one and to prove to my school that I had ADHD, I had to go see “my own” psychiatrist. Correspondingly I went and got me a psychiatrist (don’t worry, he has high credibility) and he gave me a diagnosis. Turns out I do have ADHD and clearly show it and even stronger anxiety (he says its a dead giveaway). We meet for the second time with my parents and he said  that my anxiety must be treated first in order to treat my ADHD (he didnt say it had to be in this order but he said its the more effective). He also said that the treatment would last until next christmas (a year). So he gives me Sertraline (anti-depressants) and tells me to not change the Concerta dosage because taking the Sertraline and the Concerta at the same time is not recommended and overall not a good idea. I am in my second week of taking the Sertraline and I have been taking the Concerta for a month now, but still no effect from the Concerta apart from being less hungry throughout the day and less tired (as previously explained the dosage is too low have significant effects). The Concert also made me very very angry and frustrated. To put things into perspective: I almost broke up with my girlfriend three times. I fell into depression again. I had very intense arguments with my parents several times. (I live with my parents alone meanwhile my brother is in college abroad, and my parents and I have never understood each other and have always had conflict. I dont have an emotional relationship with them, so it was hard for them to believe I had ADHD and especially Anxiety.)

My IB so far:
I am one semester into my first IB year (out of two) and it is proving difficult and im pretty sure is adding stress. Sometimes I do good and get 5/7, 6/7, and sometimes even 7/7! But besides that I get 2/7 and 3/7 on most of my work. I think it is adding on to my stress and pushing me pretty far and im pretty sure the courses im taking are out of my league (two of my high level courses are Economics and History). Keep in mind that the IB is very difficult (SAT is a joke when compared to the IB).

My exposure to graphic content: 
As can be seen on my account, I am relatively new to Reddit, and so far I really really like it. I love how it works and the sense of community. So far everyone on this website seems to actually be functioning humans, meanwhile other platforms such as youtube and instagram typically offer pretty toxic/uncharming communities. One subreddit I somehow ended up on is one of those fucked up content subreddits (a lot of you now know where this is going). The content that I see is not so different from other videos/pictures ive seen on the internet, so I didn’t hesitate to watch any of the videos and now they dont even remotely bother me. On the contrary, I now watch more and more fucked up content and I in a sense want to find something that will scar me. Its like im testing myself to see how much I can handle, even though everything I see ends up having no impact on me. I wonder if this is turning into something else. (for those of you who are going to freak out in the comments, its out of curiosity, I dont get off to it). Although I have to admit, I dont feel like this is affecting my mental health, but you never know. Also, this all started around the time I got my anti-depressants and I have gradually been getting less and less sleep (last night I was up until 3 am trying to sleep, woke up at 5 am, then at 6 am, then at 7:30 to go to school).

And finally, my concern:
When I tie all of this together I feel like I could be seriously damaging my mental health. I dont know how to tell because at the same time I feel fine. With all of that being said, is my mental health at risk?
",17Dec2018,1
87,[removed],17Dec2018,1
88,"Hi, me and my friend are currently working on a scientific report about mental well being within the online world. It is about social anxiety and loneliness and how online games can help you.  
We would appreciate if you would answer our survey.

&amp;#x200B;

It would mean a great deal to us if you could help. We need to collect as many answers as possible from gamers around the world. Our research is completely anonymous and only read by the two of us to be able to establish whether or not this topic is relevant and our theories are supported by the public.

https://surveyhero.com/c/f195829e",17Dec2018,1
89,"So almost every time that I get ready to sleep at night I get this wild euphoria that makes me burst with happiness. It's happened ever since I can remember. I love it. Lasts just a couple minutes. Unfortunately, very often in the morning I wake up crushingly depressed for a time. Ruminating like crazy. lasts usually 15-30 mins and no longer then 2 hours. I have to get up for work or other obligations as early as possible just in case. I've even developed a kind of mantra to remind myself that it will pass and that it's just what my body/brain feels that it needs to do for some reason. So I let myself not feel bad about laying motionless , unblinkingly staring at the ceiling. Then eventually it's gone. This happens anywhere I sleep and I've not always even had a bed or room. Fortunately the euphoria is more common and the morning depression, along with most of my other mental quirks didn't start until I was about 14-15. 
I actually feel like I've got this one in check though. I'm getting really good at recognizing it for what it is and riding it out. But I wanted to share this with everyone in case you experience something similar. Also Ive always wondered what the pre sleep euphoria is from. 
",17Dec2018,1
90,"
In my younger self had some insecurities but now its unbearable.  To give cliff notes: I am overweight but always have been, I do have not like certain body parts but for a plus size gal I can easily rate myself a solid 7. 
Im married with 1 kid, i believe these issues steamed from my marriage as our sex life was stale and I felt he was refusing my advances because he didn't want me but he has stressed that isn't the case. To be blunt, my husband's sexual rejection made me feel unattractive and worthless and my thoughts turned seemed to very dark rather quickly.  I did find myself seeking attention/validation elsewhere which lead to an inappropriate online relationship with someone i met through a video game, which my husband discovered.  My husband and I are piecing together our marriage and sex life, however I'm feeling even worse than before. Before i would lust and longed for my husband, now I feel so ugly, empty, and anxious, I don't want him near even though he is clearly trying. 

Also my job is super stressful and my performance is for sure suffering.

I don't know what to do, where to begin, how to get these thoughts/feelings out of my head.  Please help.",17Dec2018,1
91,"We’ve been friends for half a year. Both early 20s male.

I have a friend who i have noticed have moods swings. Some days hes good and sociable and some days he doesnt want to talk..

Id ask if hes ok, and Id get the usual “im fine.”

Unfortunately, in november the latter has been more frequent. Hes been a bit snappy and just antisocial to the point where he himself has told me he doesnt want to talk anymore (through text-long story). I have never said anything offensive. This coldness started IMMEDIATELY after we had a good day together (absolutely no signs of him disliking me...especially considering how he was jolly and a lil touchy with me on that day)

I sent him a text about how i noticed the mood swings and how he can still talk to me if he needs someone - eventhough he said he doesnt want to talk anymore. And how if he doesnt want to talk to me, then talk to someone because bottling things are bad. Got no response.

He has mentioned before that his family has financial troubles. He also seems panicky about finding a job - its been two weeks since he finished college. 

Could he be going through something that makes him cold? Could he have stress/anxiety/depression due to the above reason? And probably some stuff I dont know?

I hate how i may have lost a good friend. I will give him some space...but im not hoping too much that he’ll come back :(



",17Dec2018,1
92,"So I was feeling really good (mental health wise) for a couple of months back in May and decided to try acid. Figured i Could handle whatever happened. The experience was very enjoyable, although I think it was stunted as I had been drinking before I took the acid and smoking during the trip. I stayed up all night and felt great the next day. But now, for months, I have not been feeling like myself. I feel like i lost part of myself during the trip and that my brain hasn't been functioning the same ever since. I am mentally exhausted most of the time and it is hard to keep up with life. I have grieved the shift but still have these symptoms. I got prescribed an antidepressant a few days ago but I am afraid that it will make things worse. Does anyone have any similar experience or advice? Does time heal all wounds?",17Dec2018,1
93,"Very long story but, I fit the symptoms.
In no way am I self diagnosing, this is just the closest thing to what I’m experiencing.
I am 17 btw

•I experience impulsive behaviour and problems controlling emotions
-I have incredibly sudden mood swings where I’ll be feeling excited and then absolutely nothing, this makes me rly irritable and I snap at my mum and my mates and it’s really uncalled for and so sudden.

•My relationships so far are intense, unstable and short, I obsess over the person and I’m terrified constantly of them cheating on me or leaving me and it ruins them every time.
I then blame it on them and then a week later I blame myself and I apologise, then I blame it on them. During this time I can’t describe it other than disassociation. I feel extremely jealous of them and when they say anything in person or in text I always overthink it and make the stupidest decisions and responses.

I’ve hurt people emotionally in my life that I promised I’d never hurt, all because I believed something I thought about or someone else told me and never backed up

When I’m passionate about things I’ll randomly just feel so bored and empty about it all and just wait days to feel good again.

I’ve been to therapy for my anxiety but it only helped a little bit, now everything feels like it’s falling apart again. I keep believing I’m a good person but I’ve hurt so many people for no reason and it feels justified until I’m told the reality, like today. I’ve said things about someone I believed cheated on me, they never did and they truly liked me and I’ve hurt them.

I feel like shit and I want this all to stop but I love it every day and I want help.

I’m not sure how to word it when speaking with my GP (doctor)
",17Dec2018,1
94,"[Mental Health]Speaking to a Schizophrenic Before and After Daily Medications

For this episode – in a controlled environment – our schizophrenic host records before taking her morning psychiatric medications so she can give the audience a small glimpse of how she feels when she first wakes up. 

[WEB](https://psychcentral.com/blog/podcast-speaking-to-a-schizophrenic-before-and-after-daily-medications/) | [iTunes](https://itunes.apple.com/us/podcast/a-bipolar-a-schizophrenic-and-a-podcast/id1360410451?) | [GooglePlay](https://play.google.com/music/listen?u=0#/ps/Iwwkxsmonivv5a7qp5gsas6k7s4) | [Spotify](https://open.spotify.com/show/4OpZjOVTcCyj7FBQB5LKKB)",17Dec2018,1
95,"My new medication is amazing. I started Prozac a week ago and my doctor told me it would take 6 weeks for me to fully feel the effects but I’m already starting to feel some of them! I spent three hours cleaning my apartment last night (or as I call it, my depression den) and I studied accounting for a bit!! ",17Dec2018,1
96,"To preface, I also posted this on the veterans subreddit but it was flagged for being related to suicide and mental health.


So a little backstory: I met my best friend in elementary school. Our friendship has survived numerous ups and downs, but he is ultimately an extra brother to me. I've even grown close to his younger brother over the years and consider him one of my closest friends as well. We've literally experienced everything together and he's usually the 1st person I share any important news with. We both ended up joining the military but took different paths. I enlisted active duty Marine Corps right after we graduated high school. Then a couple years later he went into the Army National Guard when college just wasn't doing it for him (I never let him live it down haha). Lo and behold, I never deployed overseas and he did.


When he returned from his deployment (Camp Buehring in Kuwait, he said he didn't see combat), he spent a lot of time alone and drank everday. I was stationed in NC at the time and only saw him when I'd come home on leave so I was unaware of the extent. I'd still talk to him everyday whether it was playing video games online together or just texting. After finishing my time, I went to college down there, found a good job back home, and moved back. So all in all I was away for 8 years total. I've been out of the Marine Corps for over 4 years and he's been out of the National Guard for about 2.


Last week he had a bit of mental break and he's currently in a behavioral health facility trying to figure this shit out. He lost it for a couple days and ended taking a significant number of pills with alcohol then called the suicide prevention hotline. PTSD, depression, anxiety, alcoholism are all words that are being thrown around right now. I'm no professional, but my suspicion is that it's a combination of the above. He's supposed to be released in a couple days.


Most of his family is moved away but he's got his fiancee, brother, myself, and my wife still here. We have other friends here, but he only wants select people to know. He's still close very close with all his family, but there's only so much they can do being half the country away. We all care about him deeply and want to help him get through this tough time.


How can we best help? How can his fiancee prepare their home (there is guns, pills, and alcohol in the home)? What's his best course of action as far as the VA? Should we not leave him alone for very long periods of time?


Any advice on how you have handled similar situations would be much appreciated. I want to be there for my brother during his time of need but need some guidance.",17Dec2018,1
97,"I'm writing this while sitting in the tram and actually I just wanna go home and curl up in bed and hide from the world, from all responsibilities and expectations. I don't care if I won't ever see my friends anymore. It's getting harder and harder to get out of bed or step outside of the house. And god, the weather is just so depressing :(

But I'm on my way to hand in my assignment, which was due last week. I hope my lecturer is nice enough and still accepts it. If she doesn't then I've failed this class as well and I'm royally screwed. 

Wish me luck 😌 (Actually inwardly I'm so panciking right now😱)",17Dec2018,1
98,"Let me start out by saying, I am not a hysterical mess. I am completely calm &amp; of sound mind. The hysterical crying and unable to get out of bed has subsided for now but I still am ready to end my life. Not in a dramatic, attention seeking way just came to the conclusion that I would like to no longer deal with my sadness any longer. Even when I’m happy, I’m sad and that’s no way to live. I was always scared of suicide until I started reading about the exit bag method and honestly, it seems like the most peaceful way to go that I can successfully accomplish. Previous thoughts were to crash my car or bullet in head but those seemed to violent and the potential to hurt others which I don’t want to do. This book has given me a great peace over all this and I’m grateful for that. I don’t want to be talked out of this, I’ve thought about this for a while. I just want advice on how to make things easier for my family (packing up my apartment in advanced, selling my things, etc). I’m not in a super rush but would like to have things wrapped up by New Years if possible. Thanks for your help! ",17Dec2018,1
99,"Everyone said ""Talk to somebody"". I did. I tried and I tried and I tried. And now thanks to this advice, I've fucking lost EVERYTHING. Every chance of being with the people I love and having a happy life. Lost their love and their respect. Lost every damn thing. Fucked everything up. And its my own damn fault.",17Dec2018,1
100,"Hello everyone. I'm kinda spinning my wheels at this point and seeking some advice. 

I am been taking Wellbutrin, Gabapentin, and Zanax with mixed results. My last visit he decided to change the Wellbutrin to Adderall. Ok neat. I've always responded well to amphetamines.  

The pharmacy would not fill the Adderall prescription for some legal reason, but did give me a 5 day supply. No big deal I'll just ring up the doctor. I left a voicemail and he called back within a few hours saying he would get it straightened out. This was surprising because he's always been hard to get a hold of.

Next day I sent an email and left another voicemail to see if he had an update for me. No response. After repeating this process for the next few days I went to his office. I didn't expect him to be there, but he shares office space with some other medical group. I ask around and two people agree to relay my contact info.

It's now day 9. While I'm aware that medication alone doesn't fix my issue, prescribed stimulants are a major part of my treatment. What are my options at this point? What would happen if I were to switch to a new psychiatrist? I don't have it in me to start over from scratch. 

Thanks in advance!",17Dec2018,1
101," 

Recently, suicidal thoughts have spread widely, especially among young people and adolescents, because of the loss of the purpose of life and the sense of irresponsibility, identity, and other psychosocial diseases. If these ideas are not controlled in time, the patient may be severely hurt and may even end his life.  In this article, we will try to help you to get rid of suicidal thoughts and stop thinking about suicide.[https://www.scientificworldinfo.com/2018/07/how-to-deal-with-suicidal-thoughts-and.html](https://www.scientificworldinfo.com/2018/07/how-to-deal-with-suicidal-thoughts-and.html)",17Dec2018,1
102,"TLDR: I have an overbearing mother that makes it difficult to get any help or meds without affecting her on the process. 

I honestly don't know where else to post this. 
I'm 19 year old female and feel like I need help. I'm currently taking a year off before college since I didn't get into any courses this year. Recently graduated high school and I don't know how to fix my life. I have depression and anxiety + undiagnosed adhd I'm pretty sure. I have tried to get help when I was 15 after my suicide attempt, but it didn't last. I was put on Zoloft but my mother quickly stopped giving me my meds after I showed progress. Later I was put on sleeping pills to help my insomnia but she took that away pretty quickly as well. 

Don't get me wrong, I love my mother more than anything in my life. But she's the pure definition of a ''helicopter parent'' and thus feels like anytime I muster up the courage to talk about my mental health, she tries to pin it onto a single problem. Like: ""It's just high school, it's not gonna last.'' ''You're just sad because you had a fight with a friend.'' And more recently: ''You're just sad because you didn't make it into college this year'' 

What I'm trying to say is, I WANT to get help, I WANT to feel better. But I have bad anxiety, plus my doctor is good friends with my mother, so if I went without telling her all hell would ensue. I'm trying to find the courage to help myself, but its hard. I'm asking, do you guys have any advice on how I should go about this? I'm hurting, but I feel hopeful. If you guys have any experience with parents like this. I would be grateful. Thank you for your time even if you've only read this.

Btw. Sorry if my english is weird, not my first language.",17Dec2018,1
103,"I used to be optimistic but when certain things in my life went for the worst or didn’t go as expected, over time I’ve become very pessimistic to avoid feeling overly disappointed and getting my hopes high. I’ve encountered people that have also gone through hell and are no where as negative as myself. Unless they’re lying to me. ",17Dec2018,1
104,[removed],17Dec2018,1
