,text,time,score
43,"Back on Augest I moved to BC from the east coast..short term plan to stay with the parents until Augest..get work together(Registered Nurse).

Work was slower going..as such still staying in a small bedroom at my parents.  

Not a friend or social connection of merit made since the move. Struggle more at work then I would of hope..

My energy level is just... Not there 

I don't know what to say. I don't know what to do to get away from this fog of feeling useless. Going to try to give up drinking..got a gym membership.



",17Dec2018,1
44,"Is The One who got away, and i havnt spoken with her in a long time. Knowing i can’t do anything to get her back, has me sitting at rock bottom and i don’t know what to do",17Dec2018,1
45,"Thursday night my mom's nine month old pup ran out the door when my sister opened the door to welcome me inside. This wasn't unusual, however, Jack (the pup) refused to listened to commands and roamed around the street. He was running all over, which was really uncharacteristic for him. We followed him and tried to command him/coax him to come to us, as it was dark and people were starting to come home from work, and the streets were getting busy. God fucking damnit. fuck. He eventually ran out of the neighborhood and ran into a busy intersection. My mom couldn't bear to watch, so it was only me and my step-dad left to try and get him. Eventually, luck ran out and he was hit by a fucking car. It was the single most horrifying fucking thing I've ever seen. He fucking flew into the air, and every fucking bone in his body broke, and he died instantly.

I can't fucking cope with this. He was nine months old, and he easily had the most personality out of any animal I have ever seen. I loved him so fucking much. Not only is he fucking gone, but I saw it with my own fucking eyes. God fucking Damnit.

I was already fucked up before this. My fucking Dad died when I was 13 (I'm now 20), I'm so fucking lonely, and I haven't seen the point of fucking living for a long time now(Not suicidal though).

Fuck I just can't cope. I really can't. I don't know what the fuck I'm doing anymore. Fuck

&amp;#x200B;",17Dec2018,1
46,"I find that the crux of many important decisions I make involves putting myself in my younger parents shoes and developing myself to fit their aspirations for me. Essentially im constantly figuring: What can i do to pay off as a person, because I interfered with their lives so much. I mean... I would have just aborted me.

At 20 years old, I cant tell if its an unhealthy or immature process. There are times where i certainly sacrifice my natural inclinations or happiness because of this.",17Dec2018,1
47,"I’m still reeling. I still feel like I’m going crazy. I still don’t know what’s wrong with me. 

I’ve been up and down today and I just keep crying. I’ll feel better for a little while avd then everything g falls to pieces again. 

My parents are concerned now and I have no clue what to tell them. I told them I was just upset about something. I don’t know how to tell them I had to call. I don’t know how to tell them that something is seriously broken ",17Dec2018,1
48,"So, we all have that little thinking ""voice"". Amd sometimes I cant control it, like it talks to me on its own. How can i make it stop? It is scaring me to not be in control of my thinking"" voice"". It isnt like intrusive thoughts though and idk how tk deal with it",17Dec2018,1
49,"I don’t really know how to start this. I don’t normally reach out to anyone, and I’ve never done anything like this. But I just feel so mentally broken, I don’t know what to do. I feel like my heart is racing a million miles an hour. I can’t focus, I can’t think. My memory is deteriorating, I can barely remember things that happened hours ago, and the last few months are practically blank. I just feel numb and cold, but also angry and violent. I feel like nothing has a point anymore. The world lost its magic. And I know it’s beyond chronic depression, I’ve been hearing this deep ringing, almost like a constant sine wave. I don’t know what to do. I’m shaky, alone, sick of being sober, and filled with distaste for everything. I’ve looked into depersonalization, schizophrenia, schizoaffective disorder, bipolar disorder, and pretty much everything out there. I just want to be normal, I want these thoughts to go away. I want to be able to focus. I haven’t been able to eat, I can’t sleep until 5:00 or 6:00 in the morning. I don’t know what to do. I don’t necessarily wanna die, but I don’t wanna be alive.",17Dec2018,1
50,"If so what could the disorder possibly be? I guess it's not trust in general, like i doubt the ice-cream man is going to try to poison me. But i have a hard time thinking people's intentions are good, and in turn think they would hate me if they knew mine, therefore i don't trust people enough to share much about myself. Is this a disorder? If so what could it be?",17Dec2018,1
51,"I want to be that person everyone enjoys being around. Since a kid I've grown up accepting peoples differences and never bullied/talked shit to people. I was always the kid who had something nice to say to the ""nerds"". Growing up though with depression and I'm sure a handful of other problems, I've turned into someone miserable to be around. Always walking around with my head down and a chip on my shoulder. Sometimes I think my own family doesn't enjoy my company so I isolate myself. So how can I be a better person?",17Dec2018,1
52,"I'm 25 years old, live with my mom. I dropped out of high school more than 9 years ago due to worsening mental health issues. I don't go outside due to how severe my anxiety is. I live with my mom and don't really have a family for financial support. I've tried endlessly to figure out how to make money online, but I couldn't find anything. I want to try therapy but I can't find anything. I feel stuck and hopeless. Does anyone know of any free online therapy? Actual therapy... not stupid waste of time websites like 7 cups...",17Dec2018,1
53,"Why?  Why do things just get to me like that? 
I don't know why but sometimes I feel like I can cry at any moment. I'm just holding back all the tears. ",17Dec2018,1
54,"An acquaintance of mine was recently hospitalized due to a major depressive event. Although we don’t know each other very well, can I write them a letter? I believe almost anyone can agree we would like to change the perception of and stigma behind mental illnesses. I have experienced the same in my own life and seen it in others. 

I do not fear confrontation. I am that friend that will look you in the eye and ask you “when was the last time you ate?” or “have you slept in the last month?” when we get the chance to talk one-on-one. 

I am also proud of openly saying, “I am a man of action.” Meaning that even at the risk of looking like a total idiot, or worse, figuratively stepping on my own dick- I would rather have done *something* rather than taking no action at all. I feel that inaction is too easy, and even if it’s harder to do it, often I hear a voice in my head cheering me, “Seize the moment!” 

Personally I can see a few outcomes to my actions, those being:

1) Feeling shame. (because people were “talking” about it)

2) Sincere appreciation. (because someone reached out and without judgement conveyed a message of community and understanding)

3) Feeling as if I’ve invalidated his emotions and experiences. ( YOU DON’T KNOW ME)

I just want to express in my letter that even though we are acquaintances- *that I’ve been there too. You’re not alone. It does get better, easier, and is worth it!!* 

Am I overstepping a limit that would be better if I don’t? 

Am I making a positive change in the world that I wish would have been there for me when I was surrounded by my darkest, most self-loathing thoughts?

Or am I figuratively putting my foot in my mouth and making a mistake that could possibly hurt a person I don’t really know?

Would this be considered helping to turn the tide of irrational stigma and depreciation felt by those who are suffering from a mental illness?

I would like to add that I have considered if they have been hospitalized it would be most obligatory to wait till they are not. 

Just wanna make the world a little better.
",17Dec2018,1
55,"I’d be completely happy one day and then boom I’ll be sad my my day will be all heavy. I used to be so happy and so carefree and now I just worry about stuff a lot. All I think about is doing better and making everyone proud but I think I lost myself in the process. No matter how hard I try or how good I do, they’re not satisfied. I just end up feeling shitty and sad in the end. Now I just cry the whole day for no reason. I’d be watching tv and I’ll start tearing up, I’ve cried doing my laundry. I’m so close to giving up on my life. The only thing holding me back rn is that I can’t make my mom go through all the suffering after I am gone. But I’m so close, I can’t deal with this anymore. This pressure, loneliness and overthinking has started getting to me. I don’t think anyone understands this anymore and I don’t even want to open up now, it makes me feel weak and I hate it. I hate living like this",17Dec2018,1
56,"What I’ve learned in my almost 20 years of life?
To jump right into it always start off making connections when your younger, you never know who that person will mean to you in the near future. I am currently 2nd year university studying trying to undergo my business degree. I must say it was an extreme jump for me getting into university from high school. It was a completely different scene with completely different people. I started off my first year thinking that I’m going to meets tons of people especially that I was living on residence... the outcome? I was wrong, I have never been lonelier in my life. I got to know all my floor mates, we would talk on a daily basis on basic stuff about life such as school and events happening nothing more. I became friends with a group of girls that were at first kind and very open minded but as time started to fly by, and they started meeting more people and more guys, and everyone around me started changing after gaining more experience from the “university life”. People started forming their own friendship groups and enjoying themselves, while I stayed in my room most of the day smoking pot and playing video games. At that point I have completely lost control of my life, I wasn’t interested in making new friends thinking that everyone has already created a connection with other people and we’re not open to meeting new ones. I eventually became depressed and didn't have any motivation to study or do anything other than lay on my bed and watch tv stoned. That’s when my marks started becoming worse and worse to a point where I got placed on academic probation. At first I was extremely terrified, only thinking of what my parents will think about how their son is a failure and not capable of achieving anything in life. Although my depression was still there and it didn’t make me care enough about the situation into seeking any guidance to the right track. I felt and still feel lost, here I am second year university taking 3 courses which I hope to get good marks on in order for my to improve my average and entering my program of choice. This year I feel that I have more control over my depression, I try to be as most outgoing as possible but still lacking. I have moved into a place with an acquaintance I have met first year. Notice I did not say friend because I wouldn’t categorize him under that since I didn’t know him that well at the time. We have now become closer, we have similar interests in career paths and we both share the hobby of blazing. I would say he is the closest thing I have to a friend in university. ",17Dec2018,1
57,"Background info. So, I'm 25. A single parent. Full time student. Part time worker. I have one little boy that is the light of my life. We live with my parents for now while I am going to school. Last year, I was admitted into in patient treatment for bipolar disorder symptoms. I completed my program and came back to my normal life. I did about 4 months of outpatient work after my 30 days. I had a therapist. Now I dont. 

Anyways......within the last 2 or 3 months I have started slipping back into a deep depression and things have slowly been falling apart. The part that is becoming the hardest is taking care of myself day to day after making sure my son is cared for. Slipping up on my self care has caused me to become more and more irritable. So, my parents step in from time to time when I need a quick break. Lately, my mother has been stepping in to help more and more. 

The more help I get from her, the worse of a parent I feel like. And I feel like my family is going to try to take my son from me because I feel like I'm doing such a terrible job. My son is well kept. Fed, cleaned, loved, and he goes to preschool during my work/school days. When I list things out, it looks like everything is ok, but I'm finding myself less and less capable of keeping it together when my son gets difficult to deal with.

Ar this point, I don't know if it's just the shitty depression voice in the back of my head or if I'm just actually a terrible mother. 

It's been about a half an hour since I've tried reaching out to the Crisis line and I've still gotten no response from a human being. I am so frustrated. ",17Dec2018,1
58,"So I work as a Consumer Specalist in a Crisis Unit, haven't been working here but 6 days and already have done more than anyone now by coworkers are falling asleep on the job and like I just wanna scream because if you are going to work this shift then get the proper sleep for it. Its unhealthy and exhausting and dangerous for me! I work with patients who have schizophrenia and other illnesses and if one went off and my coworker wasnt awake or aware I'd be fucked. 

I love my job and enjoy my coworkers but I'm honestly hoping my boss let's me do this by myself or makes an adjustment where my help comes in at 5 and works till whenever. I'm just glad that my patients love me. ",17Dec2018,1
59,"It usually involves a somehwhat yet not plausible that someone stole something ,or that people are out to get me. It only happens when I’m like ten drinks in and never when I’m sober. I’m very smart, articulate, and I’d say socially I’m either in the 10-1% of people. Yet when intoxicated I get paranoid and apparently have false memories, that blow way out of proportion. I’m not sure why this happens but it is kind of scary. I’ve recently quit alcohol for good as well as weed, as I’ve noticed that my reasoning is profoundly effected by marijuana and alcohol. I cannot control my thoughts or actions on these substances. I have had extreme paranoia many times on weed , and large amounts of alcohol in particular. I feel like I may be developing some type of schizophrenia and I’m worried about what will happen in the future, if these symptoms persist, yet they are only there while on weed and or alcohol. I think I may have had my drink spiked a few times and it may have contributed. I’d rather not get into details but maybe just sole more information. I’m in no way a danger as I’d surely be hiding under a bridge if this ever happened again. Fearing for my life more like. I’m thinking I may have some sort of delusional disorder. Yet it only comes out while I’m extremely intoxicated on alcohol, I’ve never experienced these symptoms while sober. ",17Dec2018,1
60,"Long story, but my mom has accountability issues and I’ve seen her deny reality, and be pretty overprotective or intruding. For instance, as a teen I remember she kept checking on us in the basement... I think I even remember her peeking down on her belly... from the top of the stairs?

My stepdad is probably a narcissist? He’s threatened me many times, even as an adult. He’s made off-the-wall comments and expressed sadistic behavior, mocking the teenagers who tragically ate tidepods and did other silly things.

I’m convinced my brother is a narcissist. He’s obviously never been diagnosed but apparently I’m a:

* Lazy piece of shit
* Too sensitive
* I don’t help the family out enough
* I’m depressed (as an insult)
* I sleep too much
* I have PTSD from my parents (he claimed, but I think it’s depression/anxiety associated with memories)
* My favorite, I make too many mistakes.

Now my brother and I have clashing personalities. I find he puts me down quite a bit. I can expand on my childhood too.

Long story short, he’s simply insensitive and blatant about it too. He’s even said:

&gt; I don’t really care about anyone really.

There have been times where he’s judging me, and I’ll get super angry and tell him to fuck off and it’s none of his business what I do, and he’s being insensitive. Other times he’ll judge and I’ll feel depressed and look for reassurance from my friends because I feel so bad.

I take pride in my empathy, and helping others gives me a warm fuzzy feeling. It honestly might be wrong of me to judge others who judge people? I know it sounds ironic... but I feel like people who judge others should be challenged in the truth of their statements... or they should just let people be.

Sometimes I’m condescending towards my family and express:

&gt; I mean that’s what family is for: to judge others and claim you know what’s best.

Anyway... I also have an anxiety disorder which causes me to ruminate, seek reassurance, ponder intrusive thoughts, etc. it’s not good... but it’s simply life. Sometimes my intrusive thoughts really worry me.

Anyway, sorry for the ramble.",17Dec2018,1
61,"Hi guys first time posting and I really don't know how to explain this that well.  Also sorry about the layout I'm posting on mobile. 

So I've dealt with depression in high school (I was bullied a lot) and that caused a serious dink to my self worth. It's been about six years, and a lot of positivity. 

I've just come home from university and I'm working as a host in a restaurant while taking some extra classes to supplement my degree and I've found myself going through insane mood swings. 
I can joke and laugh with the customers for my entire shift and then I come home and break down crying.  Today  was particularly bad and worrying to me. 

While lying down in bed I found myself fighting hard to resist a voice telling me to replace the mental pain with something physical. That voice has been getting louder and louder the last few weeks as well. 

I'm gonna talk to my parents about getting a therapist tomorrow. I really could use some advice on what to do when such a voice comes back. 
Thanks guys!",17Dec2018,1
62,"I’m a college student in the US, and I’ve been doing this for long enough that I know the end of the semester is always difficult for everybody. That being said, I feel like my mental illness makes the experience a thousand times worse every time.

In the past, I have been diagnosed with ADD, anxiety, depression, and very minor ASD. I also periodically suffer from insomnia. I see a really great therapist every week and I’m prescribed medications by my psychiatrist that help keep things in check. But during really stressful periods, like the end of an academic term, it feels like nothing works anymore. I become so overwhelmingly scared and so desperately unhappy that I just want to curl into a little ball and keep curling, tighter and tighter, shrinking myself down until I vanish into a single point.

This sort of thing always fucks me over. On the nights when I most need to get to bed on time, I can never fall asleep, and on the days when I most need to get up in the morning, I can barely pry myself out of bed. I rarely experience suicidal thoughts (and would never act on them anyways), but when I do get them, it’s almost always during this deadline-filled, end-of-semester rush. 

It’s so strange because I feel like I have my mental illness mostly under control during the rest of the semester. I have friends and I’m dating a really awesome guy. My professors seem to like me for the most part. Sure, things aren’t quite where I’d like them to be, but I’m definitely getting there. On paper, I’m doing much better than I was last year.

Or at least that’s what it feels like until the last few weeks of school hit me like a sledgehammer. At this point, there are only a few more days left, but it might as well be an eternity. I just hope I can pull it off.",17Dec2018,1
63,,17Dec2018,1
64,"I'm 15, with mental health issues but no diagnosis. I was put on Prozac for 5 months, with little help coming from it. I've been doing CBT ever since my dad died 11 years ago. I was told I have ""social anxiety"" and was also told I was  depressed for sometime. I feel the help I receive isn't benefitting me, but I feel if something was going to work after 2 years of trying, it already would've. I've kind of accepted that nothing is going to work for me and that I'll be stuck like this.",17Dec2018,1
65,"Ok, the title may be a bit missleading as a lot of activities are fun to me. I love anything and everything that provides an adrennaline rush. Motorcycles, cars any kind of competition. I used to box as that gave me a lot of pleasure, the feeling of going in the ring and not knowing whats gonna happen, winning, losing, all that rush. But I have never had any fun and dont even understand most of the stuff other people do. This came up during this wekend when me and my fiance went to my companies christmas party. We went to a concert, everybody was dancing, singing and looked happy and excited. It just doesnt do anything for me. I took out my phone to browse reddit and waited for it to be over. Then the party itself. Coworkers socialising, dancing, there was a proffesional photographer taking our pictures, a DJ. I just dont care about that and its actually annoying to me. This hasnt bothered me a tiny bit, I have been like this all of my life. I dont drink, dont smoke. I have allways hated loud music, clubs, concerts, large gatherings, parties. Well hate may not be the right word. I just dont care for them? I can be somewhere to the side, I like observing others. 

I have never been diagnosed with any mental dissorder. I have been in the military and gone through extensive tests, though I think they are overlooked mostly. 

All in all in order to feel happy I need a thrill, adrennaline and some serious stimulation. I feel best when Im closest to death if thats not over exagurating.

Whats wrong with me?

P.S. sorry for my spelling, English is not my first language.",17Dec2018,1
66,"First she was just angry all the time, now she's angry and mad(schizophrenic) all the time, it's frustrating to not get a proper father in the house and add to that not even a stable mother, unstable is not even half the things she is. My god. She thinks my father is cooking up dark magic portions all the time.  It's infuriating to have family like this, especially when half the things in my life doesn't seem to work properly or shit always happens with me. honestly fed up with always trying to improve my life, exercising, meditating, everything under the sun, and they definitely have effect but it's not satisfactory and I always wonder what'd happen if I just didn't have such a mother, and actually have a father in the house.",17Dec2018,1
67,"hello! about a year ago i went to the doctors and they prescribed me antidepressants(citalopram) and sent me to counselling. 

does this mean i am actually diagnosed with depression? thank you! ",17Dec2018,1
68,"God I don't know how many times I've posted something similar, but I guess this is just how I am. I'm tired after another all-nighter that I've wasted because I did nothing! My laptop was in front of my face, yet I did nothing! And I still wanted to hand in this assignment, fuck me! I'm beginning to feel like I can't do this anymore. And laugh at me all you want because I'm whining over an assignment, but seriously I wish I could just curl up in bed and and cry. 

I actually wanted to take up a side job, but if I can't even be a proper student and write 2 fucking pages, then I don't think I can hold down a job :( 

I'm tired. I don't think I wanna do this anymore. Yet I still have to drag my ass to uni today :'(

",17Dec2018,1
69,"I want to stop this unhealthy habit before it gets out of hand. I expose myself on Holla and to the housekeeper and I dont really want to do it but I get this urge that I cant stop. I even plan how I'm going to do it. 

Here is my thought process:
-""Its small""
-""lets have someone see it and judge it""
-""that feeling when she sees it!""
-""she has seen my penis! She knows its size! I feel embarrassed and exposed but in a good way!""
-""i can now masturbate about that!""

To clarify, it is not actually small. It average length and girthier than average. And this is the point. It's like I have small penis syndrome or something but its not actually small. I also cant not wonder about any dude's dick size. 
How do I get rid of this habit and this mindset??",17Dec2018,1
