,text,time,score
70,"At this point in my life I'm not really sure what to do, I've felt this way for the past 9 or so years, I'm 19 now and things are still the same as they've always been. It's really boring, not wanting to do anything at all, not feeling joy while doing things you used to like, worst part is there's almost no evidence or explanation as to why things are this way, I've tried everything for help and sure some things bring you temporary happiness but if it doesn't stick around for more than a few hours what's the point, I'm afraid to live life beyond this point and I have no idea what I'll do till it's over. ",17Dec2018,1
71,"I have always been the kind of person who is perceived as a ""weirdo"", for both behavioral and physical reasons. I have done research on many psychological illnesses but none of which that I found  seemed to suit my personality. Lets go through some of the many weird things that are going on with me..

* I lie on a daily basis and I don't even know why.
* I seem to lack emotions in some cases. A few days ago a somewhat close friend of mine passed away on a tragic car crash at a very young age. I am very surprised that this event has had no effect on me whatsoever. The same thing happened when my uncle, that I loved, passed away from cancer. However I think that I would be very sad if I lost my parents.
* I have hurt and tortured animals in my childhood, and I still occasionally do. It's an urge that comes out of nowhere for absolutely no reason, which I cannot control. 
* Other than animals I hurt myself too. I'm not talking about cutting myself with razor blades here. I rip off skin from my fingers on a daily basis, sometimes until I see red flesh. I've been doing it for at least 10 years and my fingers look like a mess. It is also an urge that comes out of nowhere like the previous case, but whats more interesting that I do it without noticing. Sometimes when I'm sitting and thinking while doing nothing else, I find myself ripping skin off of my fingers without even noticing it. Even when I do notice it its very hard for me to overcome this urge and stop doing it, despite the fact that it hurts.
* When I'm guilty, I blame others. If someone confronts me, I turn the tables around and make them feel guilty.

So after reading that you might be thinking to yourself that I might be a psychopath. I do in fact share lots of traits with a psychopath but there are a few very important reasons why I am not one. Firstly, I am not an arrogant person. I'm humble and do not like to brag. More importantly, I am very insecure. It is at a level where something as simple as a pimple on my face or a bad hair day can make me skip a day at university, even if I have very important classes that day.  

Secondly, I have high levels of anxiety and poor communication skills. When I'm anxious I cannot seem to be able to communicate at all. I start to forget and mispronounce words in my mother language. And the more mistakes I make while talking the more anxious I get. This continues until I feel so bad about myself that I end the conversation and leave immediately. Usually when this happens I start to avoid that person and never talk to him/her again. For instance if this happened while I was talking to a cashier at a supermarket, I would never go there again even if the next closest supermarket was miles away. 

So now that psychopathy is out of the way lets see a few more traits..

* I can spend days in my room without talking to anyone, including to my parents. I am most comfortable when I'm alone. I think the reason for which is the fact that there is nobody around to judge me if I do something wrong. And yes, I am afraid of judgement. This fear is so intense that I cannot stop thinking about what others think of me. However I do not mind being judged online by people I do not know and will never see. 
* I have sleeping issues. Even after a tiring day I find it very difficult to fall asleep.
* I have always had difficulties while describing my emotions, the same difficulty I am having right now while writing this. 
* I live far away from my parents but I never and ever miss them. Don't get me wrong, I love my parents. They have never treated me badly, there is nothing I can complain about them.
* I cannot easily concentrate.
* When I'm texting someone online, especially someone from the opposite sex, I tend to pretend to be someone else. That someone is usually the person I want to be.
* I never get offended and I rarely get angry.
* Matters that make other people angry or upset usually doesn't mean anything to me.
* I only have one friend, who is almost exactly like me. 
* My feelings can change at the blink of an eye. Currently I'm staying at a dorm room on my own, but before that I was at a rental house with a roommate. He has a really cute kitten, when I was staying there she was about 4-5 weeks old. I absolutely loved to pet her, but sometimes I hit, kick and punch her for absolutely no reason. It  wasn't something that I could control. At night when I failed to fall asleep I was thinking about how I could kill her and get away with it.

Finally I would like to state that the only things bothering me from the above are my insecurities and anxiety. I don't mind the rest.",17Dec2018,1
72,"So I'm sure this is fairly common. You're minding your business and suddenly you are ambushed by a horrible memory about a mistake you made or something you deeply regret or just anxiety starts bashing you about a scenario and how you totally screwed something up.... some times I just mumble something to my self like ""WHATEVER"" or even start singing to basically tell that thought to go away or drown it out by singing something positive. Sometimes it works, but sometimes it's not that easy. Sometimes these uncomfortable memories linger and I know the best thing to do is not worry about things I can't control that are in the past. I try and focus on how I can learn from those experiences, but sometimes this doesn't work either. It's like the memory is on repeat and every time it replays I see more things wrong with what I did/said or see more ways I might have royally messed everything up. It's the kind if feeling that can keep you up at night.

Any tips on how to deal with this?",17Dec2018,1
73,"I'm not talking about PMS or PMDD, I'm talking about full-on monthly psychotic episodes. How normal is it, and does anyone else experience it?

I don't really know what to do about it, but over the past year and a half it's manifested and has become an annoyingly regular fixture in my life.

It starts with the normal PMS symptoms. Very very slightly more emotional than usual, aches, etc.
But in the 46-78 hours leading up to it my mental state rapidly deteriorates into a pretty severe state.

It comes on quickly. One moment I'll feel perfectly fine, and the next I'm so disassociated I can barely stand up or recognise myself, I'm paranoid, I'm hallucinating, I'm having full-blown panic attacks, and I can hardly make sense of what's being said to me if I'm spoken to. I'm having a hard enough time even writing this. And the second my period comes? Gone. Poof. Back to normal. It resolves in under an hour or two.

I have a myriad of health issues that prevent me from taking psych meds or birth control, so that isn't an option. I just have to ride it out.


But please, tell me I'm not alone in this?
There must be other people that this also happens to, no?",17Dec2018,1
74,I think I’m gonna have a pyschotic episode. I’m in a city right now full of people.,17Dec2018,1
75," 

I think this was the worst year of my life

I thought I found something special.

So I held onto it for as long as I could. I cherished her, I pushed myself, I made myself a fool.

I cried so much. I cried more than I ever have before. Almost everyday for a few months. The person who made me cry so much was the one thing I cherished so I kept putting myself through that torture. It was to be happy. I made myself depressed, so I could be happy. Do I even need to say more.

My mom started becoming senile. She’s on the beginning of losing her mind. 

I don’t even know if she’s a person. Nothing she does makes sense.

I don’t know what’s going on anymore. Mentally I’m lost.

I’ve been on my own this life. There was no father. This mother had lost her mind. 

I’ve been desperately submitting myself to find love in that place. I don’t know how to love. 

I’ve got not real friends. I just had that one girl who used me like a bag of blood. I can’t tell anyone how I feel. They all have their own friends.

I’m here alone. I’m here suffering. I did it for that girl. It was for that girl. 

Crazy mother raises crazy son.

Who would have thought.

Where am I now?

Cats who I try to put my love onto. They’re just cats. I love them but they are just cats, they aren’t my lover.

A screwed up relationship with that girl. I will just let go. If I love myself then I will let go. If I don’t love myself then I will learn to love myself then let go.

I need some real friends. I need friends who I can tell anything to. Who I can always call, who I can trust with my heart even though I’m a broken man. 

I’m a mess right now. I can’t wake up at the same time everyday. 

My life revolves around league of legends and just cutting it off for a week has turned me into a mental retard

I cling to habits and distractions because it’s all that I feel like I have. Dopamine? Really? Well okay then! Everything is great for one moment.

I’m so lost in this world that’s all I ever feel. I’m so lonely. I’m so sad. I’m a 23 year old virgin. I’m so ashamed.

I’m so broken. I just want to be killed so my shame can end. So I can just say okay life you beat me that’s all I had now please let me quit. But it keeps going on.

Why do I have to be such a loser. Why did I have to not find love. How can I? What do I need to do?

Am I ready yet? Where do I meet people? Can I even meet people if I’m so desperate? It’s so unsightly.

I’m so unsightly everyone says. I want to fit in but I’m unsightly. In the eyes of the people who say reality is stupid were all freaks, I’m unsightly. I just want to not be alone anymore. I just want to be rescued, to be saved. 

But I’m disgusting, I’m unsightly. I need to recover. I’m so sad. I’m so crushed. I feel so weak.

I am going to have a job next semester. There is pressure from myself to be strong. But after feeling that girl again I’ve become hurt again. She makes my life hell. Attracting me with honey, saying that she’s helping me, but never giving me a thing. I’ve been clinging to the idea of a fruit I can never have. I’m so twisted now to the point where I probably wouldn’t even feel upset about seeing someone die in front of me.

I feel like I’m at the bottom of the ocean stuck to the floor like an urchin. what do I do now? 

Love fucking hurts the most. 

To everyone I know I’ve just been putting on a face pretending to be happy.

The truth is I’m not. 

I’m miserable because I’m the biggest idiot imaginable and I’m not proud of myself.

I’m just really lonely and desperately want love but I’m so damaged now that I can’t do anything.

I’ll find someone nice. I’ll give myself structure. I’ll buy clothes, I’ll get rid of this acne, I’ll get a diet, I’ll make it easy to do, I’ll find help, I’ll take it slow, I’ll go to the gym every morning, I can run if I don’t want to.

I guess writing and reading will be my hobby.",17Dec2018,1
76,"After a year of working 60+ hours per week in a very stressful job (I work for a Local Authority ensuring children/young people with Special Educational Needs get the support and care they need) I finally hit a mental wall at the start of December. Poor work/life balance, no time for my family, constant low mood, little sleep and constant feeling of anxiety everyday have led me to take a month away from work for the first time ever. 

This was probably one of the hardest decisions I’ve ever made, admitting to myself that I’m not as resilient as I thought I was, getting over my feelings of guilt at ‘not been ok’ and actually going to my GP to ask for help. 

I just wanted to encourage people to actually go and speak to someone if your feeling this way. My GP was amazing, she listened to me, made me feel comfortable and made me realise I’m allowed to take some time for myself. I’m still a long way off where I need to be but this first (major) step has put me in the direction I need to be on.

",17Dec2018,1
77,"Hi everyone! The title says it all, but let me elaborate further. I have been qualified in the my country's top university (which I have been dreaming of since high school) but got in a program that I don't like very much (i.e. I can't see myself practicing Pharmacy in the future) for scholarship and financial assistance. 

Four months into the semester, I became anxious and depressed to the point of quitting and not taking the finals. I was too weak to do the paperwork and luckily my parent was there to help me through the long process of talking to several offices to sign such-and-such documentations. I have also checked myself into therapy prior to this decision (they gave me an SSRI--escitalopram oxalate). 

Living away from my family was the easy part--I knew how to take care of myself and am responsible enough to live on my own and with others. However, forcing myself into the program gradually emptied me from within. I started having panic attacks when I wake up, thinking that this is another day I have to endure. Soon, my anxiety morphed into depression. I no longer knew what was fun/relaxing and my priorities are askew. Throughout all these, I remained functional and responsible, albeit with occasional bouts of crying and morning panic attacks...until I just gave up. One day, after a series of breakdowns the night before, I had a major mental breakdown which consisted of me crying for hours on end while my mind is on a constant loop of rewinding my stupidity and worthlessness. I was only relieved when I finally admitted that I don't want to pursue this degree and I just want to rest.

That was 3 weeks ago. Now, I am at home trying to get better. However, every day still feels like hell because now I'm depressed due to regrets and my giving up the program means I have no concrete career path to get back to. Although my dropping out is just a Leave of Absence for the second semester, I still feel like shit and overall a stupid human being. I don't know what to do exactly with my life and I still have anxious and depressing thoughts that revolve around what career I should take as well as my being ashamed to admit that I stopped going to school because I was too weak. 

Hope I made sense, any advice would be appreciated.

TL;DR: Freshman in dream school but not in the program I like, ended up anxious and depressed and dropped the 1st semester and filed a leave of absence for the 2nd. Now, I am depressed at home without a concrete plan for the future. 
",17Dec2018,1
78,"Hello r/mentalhealth

&amp;#x200B;

Today is my first time posting something on this subreddit. I don't know anyone to talk to, so I decided that maybe you guys have some useful advice for my situation.  


So today is my birthday and my parents gifted me a USB-Stick. I am a college student and they thought that I could use it for some college related stuff.  
Seriously, I don't know why it bothers me so much but I am somehow kinda sad that that was the only gift they gave me. I know I sound like an ungrateful person right now and actually I don't care how much my parents spend on my birthday present but somehow it makes me sad (a quick note on the side: my parents are neither rich, nor poor so the reason they gave me this present is not because they couldn't afford something more expensive). I really don't know why this makes me so sad and I want to understand why.  
I mean they got me something at least and like I said it's not about the money...it's better than nothing.  
But somehow a voice in my head tells me that didn't give me something more valuable or more personal because they don't love me. I know it sounds ridicolous but I just can't get that thought out of my head.  
Maybe some of you guys can explain to me how these thought processes work and why I get these very bad and awful feelings altough I know they are far from rational. It just feels so stupid to complain to someone about something so insignificant...there are enough people on this planet that have actual problems. And yet, here I am complaining that my parents gave me a cheap birthday present.   
If anyone could maybe give me some advice how to stop believing in these irrational emotions I would be very thankful. I dont't want to spend the rest of my birthday (which I will spend at the University) with the thought in my head that my parents don't love me.",17Dec2018,1
79,"There are conversation subjects I can't participate in if they illicit an emotional feeling in me.  I literally choke up and can't speak. When watching TV, reading, whatever, and come across something designed to get an emotional response, mine is difficult to control.  This is rarely a sad or negative input.  In fact, most sad issues have little effect on me. Other than seeing old people in love struggle, most of my responses are from things like lost dogs being found and reunited. Now I can see something like that affecting me but also minor things like a Nike ad will lock me up.  I may be starting to be seen as avoiding people, or kinda shut down and not participating. In fact I'm simply trying to avoid bursting into tears. 

Years ago when this problem first surfaced, I went to a couple shrinks and was eventually prescribed Lexapro.  It worked great but due to a broken mental health system here and not knowing how to get more meds, I was forced to ween myself from them.  Now, my attitude toward the mental health system won't allow me to deal with them again, and this problem seems to be getting a little worse.  My question is wth is this? I'm not depressed really, the 'sadness' is more like the feeling of intense pride, but overwhelming.  Will Lexapro work if I can get it again? I heard once you get off of it, it doesn't work when you try again.  Just a rumor.  I tried a couple other antidepressants before Lexapro and they were all too intense with too many side effects. 

Currently 57, first went on anti-depressants in late 40s if I remember right.  Only on them for about a year. Nothing since.

Thank you.",17Dec2018,1
80,"For a heads up; I am 14(M) And haven’t been diagnosed with anything yet(going to a counselor right now). But I am pretty sure I have depression and anxiety;

Anyway,I think I may have schizophrenia or something like it, I have looked at the symptoms and I have a lot of them;

Ex: Symptoms I have are; Social Isolation, I really only go out once a week, unless my family makes me, I don’t go to schooled cause I panic a lot, I got bullied, and I would start crying out of no where and my chest would heart, I think they were panic attacks; 

Another is aggression, if I get mad I start yelling and my dad starts yelling back and I start to threaten him;

Agitation; I get agitated easily, sometimes when someone’s talking loud or touches me not even for a long amount of time it just gets me really mad and I have to leave before I blow up at him;

Hallucinations; I have been having them for awhile, sometimes I see stuff in the corner of my eyes, like someone is watching me, sometimes I see things look around a door just starring at me, I see bugs on the floor around me (that ones kinda rare for me it’s mainly human looking shapes.

Delusions; I am paranoid almost 24/7 (I am alone everyday for about 11-12 hours cause of my dads work, I always have my door close cause I hear sounds that I don’t know are real or if my cats did something (the one I knew outside my door doesn’t jump up on stuff and sleeps a lot and rarely meows so I don’t it’s him, (this should go with hallucinations but here is another thing) I always feel a presence outside my window like someone is stalking me, and I heard something crash outside my window at night. It my dad didn’t hear anything;

Speech, when I talk sometimes without realizing it I start to just mumble and I ask if I made sense and my sister would say no and I’d be confused why cause she didn’t say anything, (realized this after I recorded myself ranting once) not sure if it’s  because I talk kinda fast or what,

Last thing; i think this is more depression than anything but I for the last year or two have had the worst time trying to sleep but it may be because of the paranoid part, not sure.

I know this needs to be a medical diagnosis but i just want your opinions on what you think and how or if I should bring up this stuff to my counselor because he asked if I heard stuff but I lied and said I didn’t and I shouldn’t of but it was my first time doing something like that and I was scared.

",17Dec2018,1
81,"After years of being scared to go to see a psychiatrist (at the suggestion of multiple doctors in the past) I did, and was prescribed 10 mg Lexapro and .5 mg Ativan (both the generic versions if that matters).

I started Lexapro two nights ago. Night one I felt like I was in a fog until I went to bed. Strangely quiet and it felt like I was moving slow but I wasnt. Night two, I had pretty bad insomnia (which I got regularly before Lexapro, but this felt worse). I also was grinding my teeth a lot, something I've never done before. Woke up today (day 3), and my emotions feel so out of wack, I want to cry. My insides feel like guitar strings pulled too tight and will break at any moment. 

The Ativan is supposed to be taken as needed, but honestly I'm afraid to take either. Ive read up on taking l theanine instead. Thoughts? I hate how Lexapro is making me feel and reading up on how dependent people can get scares me a lot. ",17Dec2018,1
82,"I've never been so alone. I have friends, even a long-term SO who I live with, but I'm so alone. I can't tell anyone about my depression or suicidal thoughts. I've tried and they don't understand. I've never been so alone and never felt I have no one to turn to. There is no point of living, and if I ever did anything there's no one I could even send a goodbye text to. There's no point anymore.",17Dec2018,1
83,"Hey guys. I’m currently at work sitting at my desk after freaking out at my boss. (This situation is a bit different. My job isn’t in jeopardy. She’s a bitch anyway. Don’t worry) But doing so has really put how I’ve been feeling lately into perspective. I am irrationally angry and sad lately. I barely want to be around my girlfriend (no fault of her own) and I don’t even want to do things I usually like doing. I feel worse than when I wasn’t using Dulexotine. 

I’d also like to add in that I just started back up on these as of about 6 months ago. My question is can they just stop working? 

Thanks! ",17Dec2018,1
84,"Hello everyone, I have just created a Discord group for those who want to talk to people. Feel free to post anything. Make friends, tell us all about your day. 

Sometimes it helps to have someone to talk to. 

The discord invite code is- discord.gg/kpDScZs
",17Dec2018,1
85,"I know so many people with similar issues, and they all had their share of lifelines and therapists. Some even dodged the army while I didn't. And I'm sick of masking. I'm sick of this front. I want to help. I achieved what I achieved with brute force and zero support, but it's killing me. I want to say that something IS wrong and be heard.",17Dec2018,1
