,text,time,score
26,"I don't know if this is the right sub but I know a lot of you guys also suffer from depression so I really need your advice on how to deal with this.

I\[26F\] have a sister\[28\] who is currently undergoing treatments for depression. She was diagnosed a few years back and basically relapsed a couple months ago. She hates her job and frequently skips work and has been put through disciplinary action, leading to her current treatment.

I live with her, miles away from our parents, and she doesn't have a lot of friends, so I'm the one she primarily talks to. She is also in a long distance relationship with a no-good boyfriend. Recently, she has been whining A LOT about her life, but she shots down every single suggestion I give about how to cope and make things better. I myself have been diagnosed with anxiety and depression about 8 years ago and have since learned how to deal with it, but apparently what works for me doesn't work for her.

I feel very, very frustrated. Every day she whines, she sleeps very late and wakes up late, and spends a lot of her time on her phone on social media, despite me and our parents repeatedly asking her otherwise. She complains a lot about how her life sucks, but she doesn't do anything to try and help herself.

Another thing is how needy she is lately. She does these very annoying things to get your attention the way a child does, and for god's sake she is 28. Just an hour ago she texted me (she was sitting just in front of me btw): ""you're all very busy. Nobody really cared for me.""

That text drove me nuts. Maybe because I feel guilty, but also because I thought seeking for attention like that is pathetic. I snapped at her and compared her to an attention whore common friend, and told her that she's pathetic.

That is not how I should have handled things. I feel like the longer this drags on the worse our relationship will be. I miss having a big sister. We were very close growing up but this sickness is driving a wedge between us and to be honest I don't know how to deal with it. I'm a terrible sister, and I don't want to be.

I honestly don't know what to do now.",28Oct2018,1
27,"I feel like I am drowning a little here...
I have had OCD since I was 7 years old. It went through different obsessions and patterns of obsessions, such a handwashing, making sure I had always said please and thank you to the point where I would have a meltdown thinking I didn't say thank you well enough to the cashier at the supermarket to worrying that my family members would die. 

Then when I was 18, I finished my year twelve exams, my mother was diagnosed with cancer, my beloved pet died of cancer, I graduated high school, got my licence and got into university where I moved 2 hours away from my family and friends to live with 8 strangers. All in the space of three months. Needless to say I was very stressed and my OCD became 10x worse. I couldn't drive without having to pull over 8 times to complete rituals and was constantly afraid that I was going to hit someone and ruin their life. 

At the start of last year I was put a low dose of an SSRI drug. At the time a lot of my rituals revolved around an obession that I might hit a cyclist and then I would ruin their life and their families and I could never forgive myself.  My therapist at the time said ""just don't do the rituals"". So I challenged myself and one day coming home from the gym I didn't do my ritual when I saw a cyclist. Nothing happened! It was such an anxious but exciting moment. Until... I slowed down for the roundabout near my house and a boy of about ten cut across me on his bike. I slammed my foot on the brakes just in time but I will never forget the look of horror on his face as he stared at me. And from there things spiralled...

The internal aftermath of this event was traumatic and it marked the first time I self-harmed. I was put up to a higher dose of the SSRI which I did not tolerate well at all. I was so incredibly depressed and things spiralled even further. I kept self-harming religiously, I would have severe panic attacks where I would completely dissociated for hours at a time and seriously considered ending my life to the point where I did begin to attempt it but luckily did not complete the attempt due to one of my housemates stepping in. Eventually my doctor took me off the higher dose and things settled for a while.

Fast forward to halfway through this year. Through working with a new therapist, I managed to reduce the number of compulsion I had significantly. Then uni became more and more stressful and I was struggling to cope. So I went back to my doctor and, for reasons still unknown to me, I was put back up to the higher dosage of the same SSRI. Lo and behold it went just as terrible as last time and things quickly spiralled out of control. I started self-harming again and I tried to take an overdose. Eventually enough was enough and I begged her to change my medication. She then tried me with a drug from  the SNRI class and gave me a referral to a psychiatrist. This drug has worked fantastically for my depression and anxiety! I finally felt happy and I could even drive properly without overwhelming anxiety.

But whilst waiting for my appointment with the psychiatrist, I started to notice that my driving rituals were coming back with a vengeance. I mentioned this to the psychiatrist who explained that even though the drug I am on is really helpful for depression and anxiety, it does nothing to inhibit obessive behaviours and thoughts. I can barely drive. I just want to close my eyes so I don't see the colours of the cars and then have to keep track of how many I have to tap my fingers so that I don't imagine hitting them but obviously I can't do this. Even when someone else is driving if I close my eyes I still see blue cars and green cars and yellow and red and the number of times I have to tap. I just want to stop obsessing. I just want it all to stop. I can't go back and see my therapist as she has moved and I haven't found anyone new yet.

What do I do???








 ",28Oct2018,1
28,"I'm not posting this in order to be diagnosed. I do plan on seeing a doctor---I already have, actually, and I go back for a follow up soon. 

I just need some advice. 

The thing is, it feels like my mental health and cognitive function have slowly declined over the last few years. It started my senior year of high school and keeps getting worse. I used to be an avid reader. I have been for as long as I can remember. Nowadays, it's hard for me to read even one paragraph. I often have to reread the same thing 2 or 3 times. I also loved to write and I think I was somewhat good at it but now I'm awful and the passion to write isn't there anymore anyway. I'm not really interested in anything. 

As you can imagine this has made college extremely difficult for me. I can't focus long enough to study and I don't have the motivation to do it either. I feel like it's harder for me to absorb information. I'm bad at thinking. All around, I feel like I'm getting dumber. 

My doctor DOES seem to think I have depression...she gave me a prescription for it but I quit taking those after a few days because it gave me anxiety and made my kidneys hurt. I don't plan on trying any other meds because I don't feel like wasting money on different kinds until I find the right one. 

But I wonder if it's something else that could be causing my issues? I do have tinnitus which definitely hasn't helped, but my mental decline started before I got that. 

I was also very recently diagnosed with low frequency hearing loss. I wonder if that could have damaged my cognitive function without me realizing it? I've read online that it can, if left untreated. 

In any case, I just don't know what's wrong with me. Maybe I don't actually have depression and my issues are all a symptom of something else. 
",28Oct2018,1
29,"I feel like I am drowning here...
I have had OCD since I was 7 years old. It went through different obsessions and patterns of obsessions, such a handwashing, making sure I had always said please and thank you to the point where I would have a meltdown thinking I didn't say thank you well enough to the cashier at the supermarket to worrying that my family members would die. 

Then when I was 18, I finished my year twelve exams, my mother was diagnosed with cancer, my beloved pet died of cancer, I graduated high school, got my licence and got into university where I moved 2 hours away from my family and friends to live with 8 strangers. All in the space of three months. Needless to say I was very stressed and my OCD became 10x worse. I couldn't drive without having to pull over 8 times to complete rituals and was constantly afraid that I was going to hit someone and ruin their life. 

At the start of last year I was put a low dose of an SSRI drug. At the time a lot of my rituals revolved around an obession that I might hit a cyclist and then I would ruin their life and their families and I could never forgive myself.  My therapist at the time said ""just don't do the rituals"". So I challenged myself and one day coming home from the gym I didn't do my ritual when I saw a cyclist. Nothing happened! It was such an anxious but exciting moment. Until... I slowed down for the roundabout near my house and a boy of about ten cut across me on his bike. I slammed my foot on the brakes just in time but I will never forget the look of horror on his face as he stared at me. And from there things spiralled...

The internal aftermath of this event was traumatic and it marked the first time I self-harmed. I was put up to a higher dose of the SSRI which I did not tolerate well at all. I was so incredibly depressed and things spiralled even further. I kept self-harming religiously, I would have severe panic attacks where I would completely dissociated for hours at a time and seriously considered ending my life to the point where I did begin to attempt it but luckily did not complete the attempt due to one of my housemates stepping in. Eventually my doctor took me off the higher dose and things settled for a while.

Fast forward to halfway through this year. Through working with a new therapist, I managed to reduce the number of compulsion I had significantly. Then uni became more and more stressful and I was struggling to cope. So I went back to my doctor and, for reasons still unknown to me, I was put back up to the higher dosage of the same SSRI. Lo and behold it went just as terrible as last time and things quickly spiralled out of control. I started self-harming again and I tried to take an overdose. Eventually enough was enough and I begged her to change my medication. She then tried me with a drug from  the SNRI class and gave me a referral to a psychiatrist. This drug has worked fantastically for my depression and anxiety! I finally felt happy and I could even drive properly without overwhelming anxiety.

But whilst waiting for my appointment with the psychiatrist, I started to notice that my driving rituals were coming back with a vengeance. I mentioned this to the psychiatrist who explained that even though the drug I am on is really helpful for depression and anxiety, it does nothing to inhibit obessive behaviours and thoughts. I can barely drive. I just want to close my eyes so I don't see the colours of the cars and then have to keep track of how many I have to tap my fingers so that I don't imagine hitting them but obviously I can't do this. Even when someone else is driving if I close my eyes I still see blue cars and green cars and yellow and red and the number of times I have to tap. I just want to stop obsessing. I just want it all to stop. I can't go back and see my therapist as she has moved and I haven't found anyone new yet.

What do I do???








 ",28Oct2018,1
30,"I realized just now, buzzed from drinking, that I only experience deep feeling while under the influence. I only experience enamour when high on opiates. I only experience joy after using cannabis. I only experience introspect when drinking. The only occasional emotions I experience whilst sober are sorrow and anger. The first time I remember feeling anything, which is my first actual deeply carved memory, is seeing my dad's mouth fill with blood as he lost consciousness- the moment he stopped telling me that he was okay after falling from so far. I felt loss in that moment. I ran for help as my older brothers left me in their trail of dust to do the same. I remember feeling lost as they left my sight and I had no idea where I was. I remember the confusion I felt after hearing he was alive after watching him die, after hearing the impact.

In the following 13 years, I have felt only brief moments of shallow existence. I feel warm when my girlfriend smiles at me. I feel upset when I see a lost dog post. I feel anxiety when in the presence of my company executives. I feel all of those things for, usually, less than a minute before returning to my state of living-dead. Days, sometimes weeks pass between feelings. Even longer between each ""good"" feeling. 

What scares me is that I only experience comfort and  hopefulness when I remember that I will one day die. I feel good when I think of the crazy driver in town veering into my car. I long for the chance to rush to save someone from a burning building. The idea of being help up at gunpoint brings me to almost laugh...

I have no plan of seeking help, only the occasional venting. Thanks for being that vent.",28Oct2018,1
31,"Well, this may be a long story. Recently I was told by a roommate that she just can't stand my temper, my words sometimes hurt her and we had almost broke up. I tried to fix up and confessed myself to her and we finally made peace. This got me thinking that am I really an annoying one？
In middle school, I was told by someone that I had a weird temper, I dunno maybe I looked friendly last second, and then I became somehow angry and aggressive easily.
In high school, during the last year, I had a really bad time. I remember I messed up an exam(only lasted few months to D-day) and I was in extreme grief. What's worse, I suddenly got pimples all around my face, then my wall totally broke down. I felt stress from both physically and mentally.
After the exam, I was having my summer vacation, and clearly I was not in a mood. I blocked myself and rarely made contact with others. This lasted till my first term ended at my college.
These things force me to look like a hedgehog, I sometimes hurt people to protect myself being hurt. I just feel no security.
And I do feel up&amp;down sometimes, I can't help it.
I really don't want to hurt my friends, I want to change it. Being suffered by it makes me hard, though.
I haven't meet the doctors, yet.
Any good advises？",28Oct2018,1
32,"I would like a name to what is wrong with me. I think I’m paranoid but I also just know I’m scared, like 24/7. In the back of my mind something will happen. When I run upstairs, I feel like someone is behind me about to grab my legs from underneath me. When I take the dog out, I feel like any second I will hear someone or hear footsteps or see someone along the trees. I have fear in the corner of my eye. I can numb it with daily life but at the end of the day, when I have nothing else to drown it out, I am afraid. I have loneliness issues which bring on depression, I feel like it is in part due to the fact that if I’m alone, I feel vulnerable. When walking on the road, I walk on the side facing away from cars; i have the idea that one day a driver will have enough and take it out on me... I don’t wanna see it coming. I have lots more to example from... but don’t to the point, I am scared. I sometimes wonder if it’s easier to just go. To escape this feeling. People laugh at me when I explain what I’m scared of. Nobody takes it serious other than my fiancé. She doesn’t understand but at least she has a worried look. I told my doctor all my problems but I guess there isn’t a pill to help me. ",28Oct2018,1
33,"Hello everyone, I made a new alternative account to stay anonymous and find help with what I believe has become a serious issue in my life and will only get worse. 

I don't want to sound ridiculous or make any assumptions but I want to detail symptoms and explain why I think I have a disorder. 

I've isolated almost everyone from my life, even my best friends. I legitimately believed everyone had a negative opinion of me and I felt guilty for ever sharing my life with anyone. I broke up with my ex girlfriend because I was constantly paranoid. I often get extremely frustrated and take it out on myself physically. My parents are going through a number of issues too, and I believe that some specific events have caused me to develop said disorder. Such events are personal but part of it. My family also has a history of violence in my household that scarred me as a child. Ever since the problems with my parents began I've been experiencing what some people have explained to me as ""depersonalization"". I feel out of touch with my life, my family, my surroundings. I feel like I'm living in a different environment than I used to but I'm in the same house with the same family and same bullshit as before, but ever since things got really bad this happens. 

I dont know I'm really worried and scared. I guess any time I've talked to anyone else about it they've denied the idea of me being ill. One close friend said ""if you're crazy you dont know it"" but so many factors have led to me being constantly suffering in my head. I really want to know my next best course of action from here. I would greatly appreciate any help at all, a dm would be helpful if you required more specific information or had any specific questions. Thank you all.",28Oct2018,1
34,"I'm having a hard time explaining to my husband that being mentally ill is part of who I am. He always says that I ""fall back on it a lot"" if I say I can't help if I'm mentally ill. Today for instance I had a really good day, and we were discussing how good our lives are, and it went like this, M for me H for husband.

M ""we have a pretty sweet life don't we?""

H ""we do. You just need to learn how to enjoy it.""

M ""I do. Just sometimes I don't enjoy anything, no matter how good our life is. I can't help it. I can't help if I'm mentally ill. 

H ""you fall back on that a lot don't you? Just enjoy it. It's not that hard.""

M ""being mentally ill is part of who I am. As much as my fingers and toes. It's part of my identity. It's part of who I am.""

H *eyeroll*

He doesn't seem to accept that it is me. That I can't control who I am. I can medicate all I want but at the end of the day I am bipolar. I get depressed. I have major anxiety. It is me. I am it. But is it really? I don't even know anymore.

Thanks for reading this far.

Peace ❤
",28Oct2018,1
35,"I have serious problems for which I need therapy. I don't know how to communicate well, and I can't do anything during the day. I don't have any insurance or money.",28Oct2018,1
36,"It makes me feel like I'm shopping for adventure holidays! I hate adventure holidays. They are just advertising their ""treatment methods"" and say how it's a progress and journey to change something, implying that you want to change something, to work on yourself, to get better, that you don't hate yourself. Honestly, if that was the case, I probably wouldn't need you, because I wouldn't be depressed. I just wish I was dead. That's all. No one advertises that.

And then I failed to set up or had to cancel appointments multiple times because they just wouldn't understand why it's so difficult for me to share my phone number or accept calls. They also don't understand that I am very uncomfortable about having to move the appointment multiple times before we had the first one. That I feel rejected and see that as a subtle message that they don't want to talk to me? How fucked up must I be when people don't want to talk to me even if I offer them money?

Maybe it's my fault that I'm just incompatible and immature. I don't see how I can keep up with the expectations that therapists put on me. All I have is a psychiatrist that I see four times a year. He lets me choose my medication and dose myself, which makes me feel guilty. I don't want to complain, he prescribes pretty good medication. But in the end I'm all on my own. Mental health treatment is a joke.",28Oct2018,1
37,"he got locked up there, he was mean to me but he is cute anyway. i miss him so much. being gay is so lonely, all the straight men left you for girls. i want to cry so hard right now. i am on 5 kinds of antidepressants. i cannot cry. i just want to cut myself into piecies ",28Oct2018,1
38,"About 2 years ago, I asked r/mentalhealth if it's possible to actively delete specific memories. The general consensus was ""no"". I'm starting to believe that is not true.

I have a set of specific memories which, for a long time, caused me panic attacks, and paranoia. At the time of asking about deleting memories, there was one comment that stuck with me. It was about the art of distraction. The commenter said that everytime a specific memory started creeping in, they just drowned it out with a buzzing sound in their mind.
I took this theory, and adapted it. Every time one of those memories started playing, I would try to focus only on what my eyes could see, rather than the image playing in my head.
At first the memories actually increased, because my brain knew I was actively trying to get rid of them. For the first few months, I would have to try to shut them out at least 5 times a day. But, I kept at it. After a while, I noticed they were slowing down, when I got better at catching them before they manifested. Now 2 years later, sometimes a week will go by, and I will think to myself ""oh yea, I haven't been thinking about it"".

I'm a much happier person now. I used to be really fucking grumpy. I was scared about who I had become. I was always quite a friendly guy, yet I was always shy, and introverted. 2 years ago, when I asked about deleting memories, I was at a point where I had become extremely angry. I was just a grumpy piece of shit.

Now 2 years on, I'm possibly the happiest I've ever been. I'm a lot more confident, funny, and for the first time in my life, I can say that I am no longer an introvert.

I will definitely continue to push these memories away, and hopefully one day actually forget them all together.",28Oct2018,1
39,"Hey there, i have been struggling with anxiety and depression for as long as i can remember, a couple years ago i was diagnosed with major depressive disorder and generalized anxiety disorder by a psychologist, however, all of the tests were basically off of my responses to questions and i don't feel that i was diagnosed completely accurately, i was prescribed antidepressants that didn't work so well and so after getting off them i find myself in the same boat i was in before, unsure which symptoms of mine are anx/dep and which are just general personality flaws like laziness or irritability, i wan't a complete and comprehensive accurate diagnosis so i can move forward with my life and treat my problems, what is the best way i can go about this? Are psychiatrists better at diagnosing than psychologists? what about MD's vs DO's? should i get second opinions? any advice would be appreciated, especially from medical health professionals.",28Oct2018,1
