,text,time,score
0,"We all know the theme of creative types suffering from mental illness (how many artists died of overdose/suicide this year???). Personally my creativity is something I'm most proud of, yet I've always felt like an outcast and struggle with mental health issues that are not quite defined yet. I am working on an electronic album and have a fairly well fleshed out fantasy novel outline, but for the life of me I can't get motivated to actually finish what I start. I remember trying my hand at songwriting and creative writing as early as middle school. It's like the very traits that make me constantly imagining stories and tunes in my head also prevent me from being productive. I'm in therapy, on prescription drugs, abuse alcohol, and frequently alienate myself from people. What gives?? I bet there are a lot of you folks who can relate- go ahead and vent. I mostly post here out of narcissistic intent: the introvert is always thinking about me myself and I.",28Oct2018,1
1,"In less than 48 hours, I find out if I was accepted by the residential treatment center that I need to go to. I am so anxious about being denied but also anxious about going...",28Oct2018,1
2,"I have anxiety and am taking antidepressants, which were working for a good few months but ever since starting second year I have felt so alone and afraid and I need a way out. I sit in lectures feeling like everyone hates me whilst me circle of friends is shrinking and shrinking. I feel so pathetic and unworthy of any attention. I want to cut myself from the moment I wake up until I try to get to sleep, but I have held off because i made a promise to my boyfriend. It’s affecting my uni attendance because I’m too scared to see people as I feel like they will judge me and laugh at me. I wish I could erase myself from all existence. I really don’t know what to do. I can’t kill myself but I feel like it’s the only way out of this, for me and everyone who is still around me. I think everyone else has moved on with their lives and just see me as a spare part. Help me please",28Oct2018,1
3,"Before anyone says go to a therapist. I have, Multiple times and multiple therapists. Everyone keeps giving me different responses. The most recent threw out the suggestion of bipolar 2, before I just stopped going (after I started being more honest with her). I will not take anything here as an absolute diagnosis, only as your opinions of what it could maybe be.

My issues are:

Intrusive thoughts (especially in a relationship).
Paranoia.
I have moments where I will feel very agitated and aggressive, like I'm jittering on the inside and need to go do something.
I go though depressive episodes that last up to a week, which involves me not leaving the house, not eating much, isolating myself, not talking to anyone, a mix of feeling numb and tearful, and feeling very mentally and physically slow. These happen multiple times a month.
Other times I feel ""active"" and impulsive, having sex with a few different people over a course of a couple weeks, or things like posting naked photos online, naked photos to a boss (who asked), etc. However, sometimes this is also a response to my depressive episodes.
Highly reactive, especially in romantic relationships.
I cant stand boredom. 
Love/relationship dependency (I cant stay single)
Issues connecting with/loving others.
Get random moods of neding to go on adventurous 
Anxiety.
Sometimes I just dont ""feel"" like sleeping, so I'll stay up until I only get like 2 hours of sleep before school/work.
Sometimes I'll start drinking/smoking pot more but generally my impulsivness/recklessness is of a sexual nature.
Trouble recognizing boundaries 
I feel like I feel everything minor, intensely.
I get lost in my own head a lot of times, like I'll be walking and I'll have a scene in my head I'm playing out, and be talking OUT loud along to it.
I get ""crazy"" when I am attached to people romantically. I'll be reading my test messages and be speaking out loud without knowledge of it (others bug me for it)
I also have obsessive tendencies

I am not suicidal, I do not self harm physically, and I do not generally abuse substances. Im 24F. I do have former trauma and family issues. I have no problem functioning in school or work. It is mostly my interpersonal relationships...


",28Oct2018,1
5,"I hate mental illness sometimes. I had a mini-breakdown (the reason isn't important or even noteworthy) and cried for a half hour straight. All the frustration and anger that has been building up came out. I feel strangely calm now AND I got something to eat. Our 11 year old made me some rice with butter and salt and it was the most delicious thing I've had in 2 days. Not only do I have my strength back but I can also concentrate better and my mood has improved a lot.  


As for the disorder itself, it is still there, kicking and clawing at its cage...but it hasn't escaped. I don't feel like talking about that part of me right now, so just know that I am doing better and feeling a little more like myself now.   


Sigh. It is going to be a LONG week.",28Oct2018,1
6," I know they dont treat shit like that but i dont really know where to turn. CAMHS stands for Child and Adolescent Mental Health Service, if anyone is confused. ",28Oct2018,1
7,"Literally anyone out there right now who knows a decent amount about mental health can help me. If you dont know anything about mental health id like to hear what you have to say regardless. 
 I think i have borderline personality disorder. I think i might have other things wrong with me too. But im not sure if this is just my minds way of trying to find an excuse for why my life is crumbling around me rather than taking ownership over my actions. 

(I know you will probably tell me to go to a therapist but i do not want that to conflict with my work. I am in the army so i dont want to lose my job)

My mind is a tricky person. He talks to me but not in words. Rather, in emotions. I wish there was a better way to describe this. Please dont think of me as a crazy person. I would come across as a relatively normal person if you were to meet me in real life. But i feel like multiple people make up my life. One is a cynical asshole. One is a generous, yet awkward individual and the other is a quiet, serious ""down to business"" type individual. I rarely stray from these personalities. 

I notice my values change with each person and even my apearance changes in the mirror just slightly. 

 I am having trouble figuring out who I am. I dont hang out with friends or family because i do not have either in my life. I only have work. I feel like my life is passing by. I will wake up one day and realize my life has amounted to nothing.  Ive never had a relationship and i dont think anyone could deal with being in a relationship with me. If you dont think that is true then just look at my comment history. Its a fucking mess of emotion. I consider myself an artist. I have been drawing crazy shit for years. It is the only thing I am truely proud of. 

Please someone help me. You dont understand how much your words mean to me. I dont talk to anyone outside of work. I feel like im losing my mind. Thank you",28Oct2018,1
8,I have anxiety and bipolar and sometimes I feel as if they ruin my life. I know I have to live with it and deal with it but it gets so frustrating. I feel like I can’t relate to others or I’m not “on the same level” whether it be socially or something else. ,28Oct2018,1
9,"About 6 years ago, I started to hear voices. The only way I can explain it was that it was like hundreds of people screaming at me to do different things or trying to get my attention. Nothing dark, no requests to hurt myself or others.
At the time, I was still struggling with loss from when I was about 12. Had never talked to anyone about it, ever. I told my best friend about it and he sat me down, said nothing, but let me just talk. Hours on end. He would never pass out, criticise me, judge, anything.
After about a month of doing this, I was better. As in no voices, no (excessive) pain from the loss, etc.  (I was still sad about the loss, but I felt I had dealt with it)

Flash forward to about 3 days ago. I was sitting in my living room when the voices began to come back. I don't understand why this time. It seemed like last time it ever happened I had a reason for it to be happening.
Not only were there voices, again no violent messages, but this time my heart rate went up and I began to panic.
I immediately put on some soothing EDM. Within minutes it was gone as I focused on the music.
I'm concerned as I don't know what I could be that is triggering it.
I don't think I'm crazy. I know there are some mental health issues in my family - mothers side - but that could have started mostly from substance abuse.

I feel vulnerable by posting this on the internet but I would hope for some sort of suggestion or guidance. Even if it's from strangers. ",28Oct2018,1
10,"I was genuinely happy 5 minutes ago and I literally feel like cutting my wrists open right now.   What causes these intense, severe and horiffic mood swings?",28Oct2018,1
11,"I apologise if this doesn’t make any sense, it’s currently 2am and I have a pounding headache from crying most of the night. 

So today emotions and events that happened years ago all cams flooding back to me today and I don’t know how to feel. 

I recently saw a therapist at my school for 10 minutes who Im considering visiting again because he said words that truly hit me. That I have been through a lot of shit and I haven’t even realised it because I don’t think it’s that bad. 

To back it up, I’ve just started antidepressants for anxiety. My dad was on antidepressants a few years back for depression and was suicidal. I was VERY aware he was suicidal as he often told me how he was going to commit suicide and I honestly have no clue if he did this to anyone else. 

At the same time, I was dealing with coming to terms with my sexuality (I’m very confident with it now luckily and have been to several prides). My dad of course was a raging homophobe talking about how gay people all deserve to be shot. So you can imagine how that felt and never came out to him and still haven’t. 

I then dealt with a toxic relationship with a girl who lied saying I made her feel suicidal and suffocated in the relationship and then when I confronted her about it she said it was because she loved me and wanted to stop loving me so lied about me so she could do that. Fucking fantastic. 

THEN, my friends all stopped being my friends saying that I spent too much time with said girlfriend (I actually only ever saw her at school) and then I had no friends. Yay. 


Fast forward 3 years and I had a new best friend (he’s great and we’re still friends) but that’s about it. I have no other friends and I’m currently at university but travelling from home. 


Then tonight my dad was being a dick to my mum, so I called him a dick. I understood that I swore at him but he was drunk and Im very defensive over my mum as it’s a wonder she never divorced him. Then he starts to shout at me about how he raised me and how I should “Fuck off back to ______” the blank space being where my university is. 
And then every fucking emotion of the past few years came flooding back and I’m laid here wondering if I really am an awful person to all these people or is there something just about me that makes it easy to abuse?

Have I been mentally and emotionally abused in the past and I haven’t realised it because it wasn’t serious? 
I really don’t know what is up. 

Right now all I can think about is just taking my dads advice and leaving. But of course I have no where to go. 

Maybe I’m just overly emotional lol. ",28Oct2018,1
12,"ok so I struggle with a very interesting but definitely not unique problem. I have trouble telling what thoughts are mine and what I’ve sub consciously stolen. It drives me crazy sometimes. Within the past year I’ve gone from wanting to spend time with my friends to staying home and watching tv. I have this thought process where I over think everything and it usually means my answer to everything is no if it’s a big decision. 


I’ve found that I don’t want to be in a relationship and I don’t really feel attracted to anyone around me. I really want to love someone and be loved but I don’t think commitment is my thing. When I’m with my friends I have to act a certain way or they won’t really laugh or pay attention to me. Ive considered taking drugs or coping in other unhealthy ways but I think about the consequences too much. Sometimes I can’t tell if I’m acting crazy because I’m bored and I’m just subconsciously entertaining myself or if I’m actually losing it. I enjoy self destructive behavior (I mean socially and safety wise not self harm). And when I get stressed even if it’s a little thing I feel so much physical pain. I often cross boundaries and make people uncomfortable without realizing it. Sometimes I think I see things or feel things that others don’t but it doesn’t happen more than once a day. I don’t usually feel sad or anything and I don’t want to trivialize mental illness because it is a serious problem. I was wondering if based off what I’ve told you if I should see someone and maybe some baseline ideas for what I might have (if anything) post questions in comments I’ll answer when I’m free",28Oct2018,1
13,I need to talk to somebody for a lil bit plz dm me if u don't mind,28Oct2018,1
14,"TLDR : I’m 32 Australian with no real work history and feel like a fuck up . Believe I have symptoms of adhd poor memory , can’t follow instructions, forgetful , doing processes in wrong order etc

I’m skeptical in posting here ..

Hey

I have been dx with depression, anxiety , alcoholism and bipolar. Got two degrees from a top uni but had to work super hard, my then gf got me over the line by doing my work for me .
2 I was diagnosed by a dodgy doctor with having adhd , which set off a manic episode caused by dex and or modafinil .

3 New doctor stopped adhd meds thought I didn’t have adhd , went in and out of hospital for 3 years. Until stabilised with lithium. I still have depression.

4 Since then had terrible work history, doing even menial jobs , my supervisor when I was in construction basically treated me nicely but differently because he ‘thought there was something wrong with me’ and I felt I couldn’t follow instructions. Would fuck things up a lot .

5 Professional jobs I pretty much can’t concentrate , got fired after 3 weeks in a law firm .

6 I believe that I have adhd still, (or it’s depression) I struggle to read things properly and my hobby is to skim read things on the internet. In the outdoors , when hiking mountaineering skiing I’m off with the fairies and despite telling myself will do things in the wrong order. I’m super lazy and it feels like lots of thoughts are flying through my brain. I have a terrible working memory and forgetfulness with placing things ...

7 I am 32 and pretty much been fired or quit my jobs . I feel pathetic but I’m living off my parents .

8 Everyone thinks I’m exaggerating, and I burden my dad and ex gf almost daily with my depressed shit. Everyone else I put on a facade",28Oct2018,1
15,"After I left high school, it just so happened I chose to live my life reclusively, choosing hobbies over friends. Being mentally ill meant I had an excuse to not work anywhere, so I just sat at home, played music, played video games, surfed the web. I basically had no contact with people. I'm 25 now and I just now realize how I was wrong. I myself made my life a living hell. Not talking to people, not having friends is the worst punishment there can be. So I started making friends again this summer. I have got to tell it's such a huge relief. To have ones to turn for advice. For support. Even just talking about some random stuff is such a blessing. I'm glad I have my friends. I won't ever let them down. Friends are the best currency.",28Oct2018,1
16,"Lately stuff is starting to seem meaningless. ""We're all gonna die so what's the point?"" type thing. I don't like the things I think about these days and I'd really like to go back to my old self. I'm not religious, so I can't look to any god for purpose. I wouldn't say I'm Nihilistic but I'm certainly moving toward it. I don't like it.

I work at a grocery store and everyone once in a while, if I'm doing some small tedious task, I have to fight the urge to just stop what I'm doing because I just don't care. That seems minute but when it's everything all day it's really tough to stay motivated to do anything.

What can I/people like me do to make life feel less redundant?",28Oct2018,1
17,As the title says,28Oct2018,1
18,Keeping something alive helps remind me to also stay alive,28Oct2018,1
19,"I was really excited to continue the game that I am working on and you know as a creator, in my mind it will be the most beautiful thing that people will see then you wake up and realize that it's gonna be a trash and I will just probably waste my time doing it.  


How do you deal with the sudden change of mood? Do I need to take some time off?",28Oct2018,1
20,"I'm so angry with the world. It's given me nothing but hardships and pain. ANd I hate how other people react to my sadness and anger. It just makes it worse. Why am I so different? Why do I hate people? I have thoughts of hurting others, but I don't want to. I just want the world to blow up and destroy us. Why do I feel this way? I've tried talking to people, doctors, but no one takes me seriously. I feel like I should be locked up because I bring nothing of use to anyone, and that's likely to be how it always will be. I'm happier being isolated from the absolute stupidity of todays humans. Can't fucking stand it.",28Oct2018,1
21,"I have had the toughest year and I think it might be turning around for the better. I noticed that it was is all up to me, not always, but crucial moments it is all up to me to make the difference. I will never end up in the hospital again, unless it is to counsel individuals. 


I also leaned that I will always live with this mental illness, and it does scare me. The toughest times are when I'm my by myself. Since I am getting my life back together, I do wish for a relationship now. ",28Oct2018,1
22,"I don't know where this perception of me came from, but it's so crazy to hear no one seeing things the way I see them. Like I have ideas that can help us. I got things to say. But all people care about is the number of followers. People are extremely shallow now and it is unbelievable. Like you could go out to meet new people but they would talk to you like you're there to kill them. I hate how we can't have a serious conversation one minute and joke the other. I wanna talk to people that make me feel good about me. I wanna go to a party where lets say there are 25 people and I should be able to fw any of them. I wanna have conversations where I listen but now it's just that if I don't flex on them with my bank account the conversation is not spicy for them. I got a fresh ass outfit I'd love to talk about but all they care about is ""how much did it cost? who do you know?"" Know what I'm saying. People are not fond of conversing no more. People are sorting other people by what they do. You could have the most amazing conversation with the cleaning lady but you don't do that. I love seeing people do what they love even if they're not good at it. If you love something, go do it. Don't get me wrong you'll have fun but look from the standpoint of other people. I would love to see people do things that they love. I was thinking to myself how I wanna make more money and more than that. Don't worry about that I will but I can't see myself fulfilling what I have win me deep down because the only thing I love more than making money is delivering the people a higher level of product. I wanna see a world where I see this dude wearing the rarest pair of Jordans because he loves them and they stayed on the shelf because only the people that genuinely wanted it bought it but now the people that wanna make money off stuff they didn't create sell those on stockx and it pains me to see that the little black kid whose being raised by his mother alone saved $200 to get those yeezys but misses out on them because some dude got hands on the and sold the shoes on stockx to the international asian student for whom the shoes don't mean anything. I don't wanna make generalizations so I apologize for this bit and that's it I don't apologize for anything else. Long story short niggas, do whatever you really want to fuck looking cool if you like fucking dudes and not bitches you do you you could be happy one second sad the other see that person you wanna ask out? do that man. Try to make this world a better place and by default make money off it. Don't sell yourself out to no one. The day you popped out this motherfucking telly-- the world is your telly boy-- got a fresh ass punk man you do you you're a lord you're a god nothing confines you nothing defines you you're one bound by the limits of your imagination. 

Drop mic I'm done",28Oct2018,1
23,"I literally just got done pretending like I was explaining my fucking problems to a therapist but I'm talking to a fucking door. It's like I don't even realize I start doing it and I snap myself out of it because I realize I start sounding crazy. I get so caught up in these fake talks it could last like 5-10 minutes, maybe longer. My mind just races with thoughts and I pretend to talk to no one, and I'm fully aware of it.

&amp;#x200B;

I do this so often I feel like it's not normal. Sometimes I feel depressed and I question whether or not I'm actually depressed because I start feeling fine after a couple minutes or hours. I feel like I'm FORCING myself to feel depressed. I've had suicide ideations and sometimes when I realize I haven't had one I feel like I NEED to think of one.

&amp;#x200B;

Obviously, I also feel normal at times. It's not like I'm like this 24/7, but I would say I do this at least once to three times a day.

&amp;#x200B;

I don't know if this helps, but my mom's twin was diagnosed with Bipolar Disorder a long time ago.",28Oct2018,1
24,"My friend has been having very bad mental issues. He told me that he always feels like he’s high/dreaming now and feels disconnected from reality. He also feels like his peripheral vision is worse and he can’t think at all anymore and can’t focus. He’s always had issues with OCD and Anxiety. The main issue is that when he’s in public, he has weird thoughts about the people that are with him and he is convinced that they can hear what he is thinking even though he’s knows logically that they can’t. This leads to very bad anxiety. My friend has been seeing a therapist for about 2 months and they’ve made 0 progress and the therapist does not understand how bad he feels. He doesn’t want to tell the therapist about his suicidal thoughts because he has to report it. His parents don’t understand and say he’s just tired. He wants to see a psychiatrist but his parents are worried about him getting hooked on meds but the truth is, he doesn’t give a shit anymore he just wants whatever is going on in his head to stop. My friend is 16 and already has a criminal record and feels like he has nothing left for him to do. Every other week one of his relatives is killed and he listens to his mom crying because of it. What should my friend do? Is there anything left to live for?",28Oct2018,1
25,"I’ve been working in law enforcement for a few years now. The area I work has caused me to see some gruesome situations, a lot of mental health issues, and I’ve been involved in a heavy share of violence. I don’t say that I have PTSD because I’m afraid of it. I don’t have the Hollywood version of flashbacks but whenever someone says something or I smell a familiar smell, I’m taken back to these situations that just suck so bad and it depresses me and I’m lost. My wife knows almost nothing of my work because I choose to shelter her from it. I feel like she can’t relate anyway so even if I did pour my heart out to her it wouldn’t resonate. I feel like a shell of myself around her and my friends. I’m not the same me. What do I do?",28Oct2018,1
