,text,time,score
40,"I just want to share my experience, which I think is a strange one. I feel like I belong to the 'mental health' community, as well as to the autistic community, because I was diagnosed with several disorders as a child. However, I haven't been impacted by these issues much since I became an adult. I am currently 25 years old.

I was a difficult child. VERY angry and very scared. I lashed out at people. Even at age 18 I was still throwing screaming fits at my parents, and at teachers. I went to a special needs school. I was even in a mental health hospital for a year when I was 15. Was diagnosed with McDD, ADHD, NLD and Aspergers at different points in my life.

MCDD is like BPD meets autism. It's a very controversial diagnosis. Some doctors don't believe that the disorder exists and almost no one has heard of it. 

When I was 16 I was horrible. I drank, did all kinds of drugs and slept around. I was so depressed and unhappy, and filled with anxiety. 

My whole childhood was a deep, dark, unhappy hole. I was bullied, I didn't have friends, and I had serious issues that caused me to lash out in anger and act out in various ways.

My autism made it difficult for me to connect to people. I often said very rude things that others of my age would know are not the right things to say at a given moment. 

I am now, however, a relatively well-adjusted adult. I moved in with my dad and my stepmom when I was 18. It was a big adjustment, cause my dad has some of the same issues that I had. He said that we were both 'emotionally immature' people, and I agree with that. I think we learned a lot from each other. 


Now I am 25. I am often praised for my politeness and sometimes my mom jokes that I am *too* polite. I think I overdo it a little, but I don't want to say the wrong things anymore. I now recognize which things are rude and which are not. I get a lot of my manners from period dramas and interacting with old people (not in a neckbeard way. I don't say 'm'lady' or take off my hat for people). Because those old etiquette rules seem easy to follow and seem to get a pleasant reaction out of people.


I don't get angry anymore, except when a device isn't working. Then I kind of freak out and get pissed. I never lash out at the people around me. I never manipulate people and I try to tell as few lies as possible (everyone lies sometimes, so I won't say that I never do). 


I do have some anxiety and depression issues, but it is more internalized. I don't abuse drugs, I am in a committed relationship. I have friends. 

I still see a psychiatrist and use Neurotonin (Gabapentin) for my anxiety, but I only see her once a month. 

I don't know what happened. I don't know where I fit in anymore. Like I said, I still feel like I am a member of the mental health community, but in the last 6 years or so I haven't had the issues related to all the diagnoses I got. Sometimes I worry that those issues will come back to haunt me. 



",28Oct2018,1
41,"I need help, I have no money, and I'm nocturnal because of my Non-24. I'm chronically suicidal with an addiction nobody will help me with.",28Oct2018,1
42,"Im didnt feel a thing when my grandparents(all 4 of them) died. It was like, ""Oh yeah, they're old and their time has come"". Is this sociopathy or just a Zen Buddhist look on life that I have?

I also have 0 fear of any loved ones dying. If anyone dies it really wouldnt matter to me, life just goes on. 

This doesnt mean I dont love them, I do love them, but their loss isnt important to me.",28Oct2018,1
43,"I'm turning 18 in a couple of months, and as far as I'm aware there's no history of mental illness in my family. I've always been physically healthy, excluding some food allergies I had when I was very young. I don't really want to bother any professionals with this, since it's not really a problem, as much as it's an inconvenience. But I would like to know if I'm just going through some normal teenage stuff, or if there's something more serious behind it.

This is not a new thing, but it has gotten significantly worse recently. I have some thoughts, that think I'm not supposed to have. I'm not going to describe all of them, only the ones that bother me the most. So here it goes:

I often get the overwhelming feeling, that I'm not home. I fear that I'm kidnapped, and a bunch of people are pretending to be my family members. I know that it can't possibly be true, but I can't help but run out for 2-3 hours whenever it happens. When I come back home, I make sure to check the mailbox, the trees in the yard, and our car's license plate, in order to make sure I'm at my own house. 

I can read something out loud, but unless I was pushing my left thumb, pointer, and middle finger together, I have to read it again to make sure I understood it. Usually I have to read everything multiple times, making this perhaps the most problematic of my thoughts, since it can become quite time consuming. 

I sometimes have trouble telling dreams and reality apart. I once had a dream in which I was raped, and it took me months to convince myself that it was just a dream, even though the rape started in a dark room, and was suddenly in the middle of Broadway. 

Even before that dream, I've always found everything sex related quite repulsive and really uncomfortable. This has led to irrational fears, such as people putting semen in my food. This usually leads to inability to enjoy that food, or I just simply can't eat it. Again, I know that it's no ones lacing my food with their sperm, but I can't help myself. 

Just like everyone else, I did some embarrassing things when I was 10 or 12 or whatever. I'm sure everyone looks back at their past mistakes and thinks: ""damn, I was dumb."" Whenever I look back at my mistakes, I get a nagging irrational fear about how literally every single person on this planet knows about those mistakes, and treat me differently because of that. 

I'm somewhat smart. I used to be really smart for my age when I was younger, but nowadays I'm pretty average. However, in school I feel like everyone is pretending to be dumb, to make me feel smarter. As if everyone in that school is part of a weird, useless conspiracy. 

Often when laying in bed, I feel bugs crawling on my skin, but there's never any bugs. This is quite common I'd imagine, but I'm throwing it in anyway. 

The list of weird thoughts goes on and on, but you get the point. I (as someone who knows next to nothing about mental health) have suspected OCD, or the scarier, but very unlikely option of schizophrenia. Someone who actually knows about this stuff could tell me if I have something to worry about, or if it's normal for teenagers. 

Also, I'm not a native English speaker, and I often worry about my redundant use of commas, (there it is again) so if I'm using it too much, let me know. 









 


",28Oct2018,1
44,"As a guy, this is incredibly embarassing for me to do. I hate opening up to people i find it incredibly selfish and rude. Putting this information online is really worrying for me.

Im 19 years old, University Student studying Computer Science. Whatever this is, its really not a new thing. I think I've been like this for a long time but recently its gotten worse. I doubt myself all the time and I don't feel like i can join in and enjoy myself because I'm an embarrassment and no one wants me to speak to them. I don't speak to people in uni, I'm afraid to make new friends and meet people and i cling on to people i already know, afraid that they'd slip away. Even when people spark a conversation its just awkward and I stutter.

It started a few years ago, i used to be very passionate about making music every single day but I stopped thing it was pathetic and futile to keep going. I've became incredibly sluggish, slow and lazy only doing things when they get in my way. Sometimes i just stay in bed until 4-5 in the afternoon and only get out when i feel hungry. I feel pathetic and annoying to other people so i don't like chasing them down or even speaking to them. I shouldnt be crying all over my girlfriend being really clingy and begging her to solve my problems but i do and it makes me cringe. I have had couple suicidal thought but it would just hurt the people close to me.

Last night me and my girlfriend went to a halloween party and i kept isolating myself because she speaks to her friends and i don't have any there. I do join in i just cringe and either walk away or dont speak because i didn't fit in. I got angry this morning because of last night and i thought my girlfriend didn't care. This is affecting my 3 year relationship in a HUGE way (this is mainly why i want to get help). Its making trust issues with me because she has a few friends that are boys and I get jealous. I feel like she doesn't care and that I don't mean anything to her anymore because she doesn't act as seriously when she does. I know she is happy but i always doubt it.

If anyone can point me in the right direction where i can get help privately so i can hopefully start living again. I'm afraid of speaking to people face to face about it. Its happened before and she said i had some form of social anxiety. Thanks for your time.
",28Oct2018,1
45,"I realized today that the last time I self harmed was on the 6th of September one year ago. I have had pretty severe cravings frequently but I haven't given in.  Just wanted to tell someone.

&amp;#x200B;

I would love to hear about some of your milestones",28Oct2018,1
46,You know society doesn’t know how to handle mental health issues when you post “I think I’m broken” and someone uses the laughing emoji like button on FB.  I guess that’s funny to someone that I’ve been depressed as hell for weeks to the point where I’m probably going to get fired from my new job.  Not funny to me though. ,28Oct2018,1
47,"Hello all! I will try to make this nice and short. I have been on lexapro 20mg for about 5 years with great success. However, I recently had been constantly tired, sleeping 10 hours at night, and 3 hours during the day. I got blood work and a sleep study, all negative, so i suspected my medication. This had made things difficult, so i decided to talk to my doctor, who recommended reducing the dose to 15mg. This had went well for the most part, but i began to feel foggy, so he recommended switching to prozac. Here is how he switched me:

Week 1: 15mg lexapro, 20 mg prozac

Week 2: 10mg lexapro, 20 mg prozac

Week 3: 5mg lexapro, 20 mg prozac

Week 4: 20 mg prozac only

I have been on 20mg prozac only for \~1 weeks, and it has been hell. I have had insomnia, increased depression/anxiety, but most severely, I have had intense brain fog. I have trouble remembering anything. I am in my final year of physical therapy school, in my final clinical rotation, and it has 100% affected my performance. I struggle with simply remembering what my patients have already done, remembering their names, remembering techniques I have learned, etc. 

I am thinking this intense brain fog is mostly due to coming off the lexapro so quickly after being on it for so long, combined with a small amount of prozac side effects. 

Sooo, my question is this: Do i stick it out with the prozac and hope my body gets used to it? Do i jump from 20mg of prozac to 40mg (my doctor said it is up to me?), Or do i go back to taking my 20mg of lexapro, and gradually tapering my medication properly using the 10% rule. I am leaning to doing this, but feel terrible, as its like I am addicted to these medications to simply function. But at the same time, this is the most important part of my young career, as succeeding in clinical rotation leads to job offers and is necessary to even graduate. I have called and left a message for my psychiatrist, but after he tapered me so fast, i do not necessarily want to blindly listen to him without researching myself. 

Any advice is greater appreciated!!",28Oct2018,1
48,"My friend who is diagnosed with major depression has to take antidepressdants everyday. She hates those pills because they have a lot of side effects, such as forgetfulness, be unable to focus,etc. But she  depends on them, if she forgets to take them, she will be spiraling in her own depression that I can't do anything to make her feel better. She's been taking them for years and her depression never gets better, just worse. I read somewhere that antidepressdants have a little effect on treating depression completely , (my friend also said that those pills aren't enough, she needs companion and therapist), and I also read that depression can be treated more effectively through micronutrion and healthy lifestyle.  It is said that antidepressdants balance the chemicals in the brain but from what I see they just manipulate the brain and make the patients depend on them. Did anyone recover completely from depression? How did you do that? And what is your opinion about this?",28Oct2018,1
49,"Its been roughly a month since my official diagnosis of HPPD, and im wondering...

Do all the perceptions you had while on the psychedelic continue?


The perception i had while on acid was basically telling me that this is all fake, and that in reality, im going completely psychotic, the other night, i was with my friends, and they were smoking weed, and i was not, i must've gotten a contact high or something, because afterwards, everyone had made the decision to go to the gas station to get snacks except for my friend, E, so they were joking like ""lets grab him"" as if we were gonna force him to go, lmao. anyways, my other friend M then says ""were gonna have to restrain him to get him in the car, hehe"" and during that phrase, i felt as though he was talking about me in the other reality, as if what he was saying was filtering through from that one into this one, and this wave of terror and fear washed over me. I felt like i had already gone crazy, and that this is the insane hallucination, i get that its not, but, why does that feel more real than this does? this life feels like a dream, kind of cartoony and vague, but, when those feelings pop up, they feel more authentic, and crisp, and real... My visual snow seems to be progressing as well, ive been on lamictal (25mg day and night) for about, 4 weeks now, and ive noticed some help, but not too much, my deja vus are decreasing in frequency, but picking up in intensity.",28Oct2018,1
50,"So I’m trying this new thing where I’m spending time being alone and doing more things by myself. I have this horrible habit of depending on friends and getting into relationships super fast and basically becoming co dependent. 

But now it’s basically been about a month since I’ve had sex. I’m terrified that if I’m intimate with anyone I’ll immediately have feelings for them and fall in my normal unhealthy cycle. 

Does anyone else struggle with this? I’m at a point where I’m trying to avoid people until I move out of the town I currently live in because I feel so crazy lol. 

Also the last relationship I was in ended so badly and I just got out of inpatient earlier in October. I feel like no one would want to be with someone like me.......",28Oct2018,1
51,"I should first mention I have been long diagnosed with and have been actively treating bipolar disorder and obsessive compulsive disorder. 

Whenever I hear sirens blaring down the street, or construction workers outside, or go to somewhere like walmart with a million differently colored and shaped objects I can get some kind of sensory overload. It isn’t every time and I have my support to calm me when I get tripped up, but I don’t know how to fix this. Sometimes just the amount of lights and colors and noises and any form of sensory input can really freak me out. 
Is this an anxiety thing? Just wondering if anyone else has this issue. ",28Oct2018,1
52,"Yesterday I had to move out if my room. Thank God because they became violent drunks while I was there, he threatening me with a knife and said he had guns underneath the couch and bed and was threatening to kill me. I had to go get my stuff scared out of mine. ",28Oct2018,1
53,"- I'm INFP, sensitive.

- Educated and 'talented' in a gifted child sort of way (now late 30s).

- I'm educated - but while just a handful of novels, artists and films have changed my life, I value only those, not the art in general.

- I rewatch the same things constantly, with no desire to switch and am annoyed by the quality of other options. 

- Most people / stimuli I find annoying or dumb. Overhearing a conversation in which the speakers think they're important, sexy or interesting can make very annoyed. 

- I have absolutely zero friends. 

- I obsess, control, dominate and over-nurture in relationships. Hence I have become a 'Dom', because there are people who seek exactly me. 

- I crave intimacy while rejecting most people, leaving me quite lonely. 

- Bouts of depression in youth but am very driven, which seems to fix me.

- No interest in others' authority or structure - run my own business. 

Any thoughts about what I am / am dealing with would be gratefully received. Thank-you. ",28Oct2018,1
54,"I am so SICK of people misusing the word triggered in EVERYDAY LIFE. If there's some sort of insensitive bullshit online, and someone calls them out for it,  the immeadeate response of the people is ""wow she's TRIGGERED!!!!!"". MILD DISCOMFORT OR OFFENSE IS NOT WHAT TRIGGERED MEANS. If I respond like this to them,  they accuse me of being ""triggered"". Triggered means when a stimulus of some sort,  a sound, taste, feeling,  sight etc. brings on (or triggers) memories or feelings of trauma. When people are being obnoxious about suicide(usually talking about it), that triggers me, usually causing me to have an anxiety attack. That's what being triggered is.  But if I said that to your average person they would immediately go off on one. Because it's a meme.  And no it's not having mental health be less stigmatized, it's making a crude overused joke of mental health,  and I'm sick of it.

Sorry if this is the wrong sub for this,  I just needed to get it out. ",28Oct2018,1
55,"i’m not sure what to do honestly. i’ve been with him for five years now. and every week or so he tells me how he’s going to kill himself, to come say my goodbyes because this is it. but it never is it.. but at the same time, every time he does this, i beg for him. i beg for him to stay, just for him
to do it again a few days later. i don’t know what to do. he’s not happy with his job or living situation but doesn’t make a move to change either one. i try so hard to be his crutch. but he has honestly made the anxiety i have much worse because i don’t know if this will be the day he does it or not. i can’t keep doing this.. ",28Oct2018,1
56,"I hope this is the correct place to post this.

I am a 20 year old boy, currently studying at a university. To be fair, I am doing very well for myself; no financial issues, good friends, a loving family and great hobbies and health. 

However, I am quite rarely satisfied, and struggle with looking at the bright side of things. I deal with a lot of regrets relating to stupid things I have done, even though the issues have been resolved and are not too bad in the first place. Additionally, I struggle with motivation. I absolutely love boxing, and it is a huge part of my life. Every time I train, I feel awesome and I love it. However, I still dread turning up to practices and make excuses for not coming. 

I am very prone to bad memories, and focus too much on them. For example, every time I drink, I almost never have good memories from it, even though I had a great time. 

I was in a relationship with a girl I hade no feelings for, and it ended up ruining our friendship (mostly because I found out I didn't like her too much anyways). We have made up, and all is forgiven, but I still struggle with things I've said and done. I don't know how to move on and get over it. 

My self confidence is generally good, but I care very much about how other people percieve me. This is the basis of most of my regrets. 

To be fair, I don't really know what I'm asking for. I want to improve myself, but I don't really know how. I know for a fact that I should drink less, I have started listening to self-improvement podcasts, but I still want to change how I percieve the past and get a more positive view on life. ",28Oct2018,1
57,"This was always the question for me - it's why I could never get along with CBT.  I've definitely had situations in my life where there was a lot of gaslighting going on, and a lot of reinforcement from people who were outside (is unonscious gaslighting even a thing?).  And I feel like the distortion examples I always got in CBT sound almost identical to the reasons I was given why the abuse was all in my head.  Things like:
 - They're not *always* like that, you're just making it out to be black and white.
 - You can't read their mind, so you can't know that they have negative motivations.
 - You're saying they ""should"" do this or that, and that's setting yourself up for failure because you can't control other people.

I could never get an explanation out of any therapist what the difference was.  The closest I got was that you could ask other people for feedback - but again, I've been in abusive situations with little contact with others outside of the situation, or where others were reflecting back that it can't be that bad or I must be misunderstanding somehow.",28Oct2018,1
58,"Hi! I am a 23F living in Ohio, United States.

I was never diagnosed with ADHD in my early years, but in talking with my psychologist recently, she says that I display many of the signs and symptoms that adult women with ADHD display. She also mentioned that there’s a very high chance I was never diagnosed because I didn’t display the hyperactivity symptoms that pediatricians often look for.

All of the diagnostic services in my area appear to be for children. Where should I begin to look for diagnostic help for adults? Are there services available for adults who may be suffering from ADHD? I believe it will help me significantly with my work life if I were to get some answers.

Thank you!",28Oct2018,1
59,"I’m a freshman in college and I feel myself loosing control. Waking up everyday is the worst feeling and I feel like a cloud is over my head at all times. I go to a military academy, which adds in to the stress. I struggle to socialize and my self esteem is very low. I have had a lot of stuff happen in the past that has caused this, but it is what it is I guess. I’m not happy at all, and I feel depressed. I’ve felt this way for a long time, but it has gotten a lot worse this year. I tried going to an on campus therapist, but I was told that I should be happy because I’m doing well at one of the best colleges in the nation and that I should try to change my perspective. 

I don’t feel that changing my perspective will help though. I don’t even think that I have a bad perspective as is. I realize that I’m lucky to be here and despite all that I have to put up with, I think it’s a great place (don’t get me wrong, there are definitely times where I wish I went to a civilian school, but I think that’s normal). However, there’s more to me than lolkek2020 the cadet. I had almost two decades of life before I went here and I think there’s more to happiness then being successful as a cadet. I really don’t know what to do anymore. Maybe I’m just an angsty teen,  but I feel that the issue is deeper. ",28Oct2018,1
60,"19 F here! When I was 14 15 I remember waking up one day and the whole world around me felt different. Everything seemed so unreal like I was in a dream-state reality. I been stuck like this until today nothing have gotten better. Somebody can be getting murdered in front of me and I wouldnt show any reaction because reality is so far away from me The only thing im very depressed about is my little siblings who are 8 months old, 3 years old and 5 years old i have never felt a deep connection with them because they were born after I got derealization/depersonalization 
 Everyday i cry in the toilet and sometimes i self harm because i just feel like lucid dreaming. I cant feel any connection with my family and they just look like some walking figures floating around the house I touch and hug my siblings so deeply to feel atleast that i am touching them. Either way this still feels so unreal. 
 I am moving to America this december and I wont be seeing my family for the next couple of years. This makes me just wanna commit suicide because i never been so close with my family always arguments and unstable conversations with them. My memories is all gone they feel they have never existed. ",28Oct2018,1
