,text,time,score
37,"I'll be over here taking deep breath after deep breath. Fear is normal. Tears are normal. 'the unknown' is a terrifying place to visit, but you have to stay there. Don't quit. If you need a moment, take it. If you think you're done, please shout out for help. Those moments where you want to quit will pass, even if it takes a long time, they pass. Just hang on, please. People will be feeling things they've never felt before while this takes over our lives in such an all-encompassing way, they may not know how to talk about it, may not understand why they can't talk aloud or get up out of bed. Be there, check up on everyone you know. If it's you, if you just can't anymore, please press pause on anything drastic and call me. 
Nothing is more important than your own mental health. It's OK not to be OK.
#mentalhealth #checkonyourfriends #thistooshallpass",02Nov2020,1
39,"I don't know what it is, but I am having a hard time eating my kids' Halloween candy. It all tastes like cleaning solutions we use to clean our house with. I figure, though, that if I eat it, it will be less poison in their bodies. It's a dirty job, but someone's gotta do it!",02Nov2020,1
41,"Title says it all. I have completely lost my ability to speak coherently to anyone including my friends and family. It’s something that has become more gradual over time but over the past few months it’s been difficult for me to say a single sentence that isn’t more than 5 words. When it comes to speaking in public I become self conscious of the way I talk and how others may hear my voice. It’s become so bad that recently when I went to visit my mother for the first time in over a year, I literally couldn’t get my words out. It doesn’t help that I’ve become socially isolated these past few months with limited human interaction. I’ve been overthinking so much that I’ve become super anxious. What should I do?",02Nov2020,1
42,"It was Halloween night, me and my friends including my boyfriend, we drove to downtown together to have some fun. Of course we took a lot of pictures, and when we reached home, I was bout to shower, so I was like just take a selfie with my Halloween makeup for fun. Then later that night, I wanted to send my bf the “nude ones” and the the normal ones to the group chat where my friends are. But my peanut head was not functioning, and I sent both in the group chat. I was not realizing it until the next morning, so I woke up and my boyfriend said “ what did u send in the group chat???” By the moment I know I fucked up, I know I sent something wrong, so I checked it was my Fcking BUTT CRACK, and I was like enjoying it in the picture. I literally wanna die at that moment. So I quickly deleted it, so basically WhatsApp has two delete features, one is “delete for everyone “, and the other is just delete, so again I’m too stupid to manage my brain, I deleted it only for MYSELF. I literally wanna die. Everyone in the group chat saw my butthole and my coochie. But thankfully they are friends, and it’s not a big group chat. So I asked them to delete the chat and moved on. IT WAS SO BAD. I can’t believe this can actually happen to me.",02Nov2020,1
43,My dad died when I was 21 and we were very close. Not a single person around me has acknowledged today or even sent me a message. My own Mum hasn’t messaged me as we got into a small argument 4 months ago and she hasn’t talked to me since. She did change her Facebook profile picture to someone sticking up their middle finger though. This years been hard for me and one where I’ve missed my Dad a lot. It just sucks.,02Nov2020,1
44,"Hi. I just found out why I've been losing friends all my life!
To my surprise, it's because I try to be honest with people, not telling them lies, not acting in front of them, trying to help them with anything when they need me and always being there for them! For respecting people's privacy and always being polite with them, even when we're having serious arguments!
It doesn't feel right, but I've decided to start telling lies people wanna hear and start acting not like what I am!",02Nov2020,1
46,"I got a very strong Christian conservative background. I know how to play the part. How to look, how to act, knowing more than the average person. Have worked and volunteer in Christian environments. But I’m not mentally conservative and here comes the other side of me. 

The other side of me absolutely goes against my Christian values. 

I used to be sexually active in my twenties and lost count how many guys I have been with. I was the nastiest, high libido girl. I think I am bisexual even though I still have a stronger preference for men.  I use profanity, into weird stuff, and totally liberal. It feels weird to me when my libido jacks up and I fantasize a room of men with me. 

I do not live a double life anymore as I did in my twenties but I feel this clash within me sometimes. 

Can anyone relate. My bad side just doesn’t feel like a normal bad side. It feels so demonic and crazy and having to accept that is hard.",02Nov2020,1
47,"When I put my pants on after I nut, it hurts, that I have to bend my posture down to make it less hurt",02Nov2020,1
48,My husband and I got married really young. I was a virgin at the time and after we got married we had a very good active sex life. We've been married almost 10 years now but the last 5 years we only had sex a few times. It's all my fault. I just never want to. I masturbate sometimes and that's enough for me. But I miss the intimacy and I miss pleasing him and I miss feeling sexy. But there's something wrong with me. I just can't get turned on by the thought of sex anymore. Please help. I don't want to be like this.,02Nov2020,1
49,"[click here to watch video](https://youtu.be/gIVyz5qBJmw)

Thanks :)",02Nov2020,1
50,Now almost every interview and guest-staring video podcast are done remotely. But it's so sickening that even high profile people use like the shitiest cams and mics for it.,02Nov2020,1
51,"For reference I work roughly 20 hours per week. I know I know, really low hours and it's barely a job, why am I complaining? I've always had a lot of trouble with learning work skills, being around people, and other ADHD/GAD Combos you can think of. I'm trying. 

I've hit a wall though, I can't will myself to work even harder to make a savings, even though I've gotten over the major anxiety of working again, this seems like a wall I can't get over. Every time I try to push myself, my mental tanks and I get really depressed and I might end up not working for a week or two, and I can't afford to have that happen. I feel like I'm balancing on a tight-rope and I'm stuck in the middle on the way to terrafirma (College and a job).

Any advice would be greatly appreciated :)",02Nov2020,1
52,"So my gf sent me a picture of herself of her face paint for Halloween. And it’s just an average picture y’know no obvious trying to look good just “oh here ya go” kind of thing. Thing is, I can’t stop looking at it. She’s just too beautiful (and yes I know that corny af but please shut). It’s like she looks amazingly good for just a simple photo and I can’t figure out why. She isn’t even smiling and yet in my eyes she’s absolutely gorgeous and I’m lying here at 1:20 in the morning looking at this and thinking “how did I end up with this angel of a girl”. It’s stupid and probably all you see are the ramblings of a love struck teen but for the one person who understands this like I just can’t stop. It’s incredibly un unique but yet I can’t stop looking. That’s all",02Nov2020,1
53,"Dude I’m not happy with my life I’m with a girl been with her for 3 years but lately I feel like I’m not ready to move on and get engage I really want to be single and travel, meet new people get pussy but my family wants me to stay and settle in get married have kids I’m 26 years old I’m having anxiety every single night because I don’t know what I want to do but also don’t want to lose the opportunity to lose a good girl because I’m afraid I won’t find a good girl like her ever again but I also want to live to the fullest I’m stuck and time is ticking.",02Nov2020,1
54,"The lockdown left me with a lot of time to think, and I started thinking about my past and I realized that I subconsciously hurt people.

In my childhood I never had to work hard for anything and I didnt go through any hardships, and left me with being lazy and low self esteem. (Im kind of blaming my circumstances for this, and I know its immature)

I was kind of a rat when it came to making friends, I always wanted to be friends with the cool kids, but was too scared to approach them, so I just was friends with people who I didnt like to not be lonely, and abandon them when I got the chance to be with the ""cooler"" group.

This behaviour left me with no close friends in middle school, so I just isolated a played video games, because it was easier than building friendships.

So now everytime someone gives me attention I get attatched to them, because Im really lonely and crave human attention without giving in any effort to get it.

And most of the time these people are girls who have an interest in me, and I pursue them in the rush of emotions, and it usually ends up with me breaking their heart.

Im so disgusted with myself, and I wish to change, how can I stop being like this?",02Nov2020,1
55,"I mean it wouldn’t hurt to know how to get the job done, if I really really reaaallly need to right? I won’t do it though. 

But yeeah if you can, tell me some heartwarming stories from your life to make me feel a little better :)",02Nov2020,1
56,"Taiwan number one

Free Tibet

Free Hong Kong

Democracy will always win

Xi Jinping NMSL

I will never use Huawei products because they are bad

Privacy matters

Human rights are important

Let Uyghurs be free",02Nov2020,1
57,"I probably will sound immature and stupid for what I’m about to say... but it’s true. 

I’ve been with a man who I’ve come to love more than anything only for about 4 months now. He is my other half. I will never find someone again that’s so good for me in my life. When he met me, I was addicted to fentanyl. He helped me get off, and really start my life. He taught me so many new things, helped me through so much. I have so much to thank this person for. He’s done more for me than anyone besides my father has in the short period of time I’ve known him in. I love this man with all my heart. I want to be with him for the rest of my life. I want to be his wife and the mother of his children. I don’t want anything else. 

But we keep fighting. Some would say he overreacts from time to time, but it’s only because it builds up. I just keep fucking up. I can’t help it. Fuck up after fuck up. I just keep saying things I shouldn’t. Like telling him what to do, giving him attitude, just being a bitch, having these junkie tendencies like liking drugs, etc. It sounds like not a very big deal but if you understood how frequently and how exactly it’s unraveled you would understand. He’s kicking me out tomorrow for the second time in a week. 

HELP ME PLEASE!!! What’s wrong with me??? Why can’t I keep my fucking mouth shut sometimes?! What can I do to remind myself to just think before I speak!? It’s so insane, I don’t know what’s fucking wrong with me 😭😭😭😭 all I know is that if I loose this man, I don’t know what I’ll do. I don’t know. And I feel like I have no more chances, like if I can’t fix this all right now I’ll loose everything. I don’t want to do this without him. I’m not strong enough. Please help me.

Has anyone ever had a similar problem... please help me. What should I do?? He’s not being unreasonable. I’m always negative.. sometimes I can’t help it. I don’t know what’s wrong with me.. 😭 I just hope and pray that I can fix this now and my relationship will be saved. He’s the love of my life. I hope everybody finds someone who matches them as good as my baby matches me. Cheers to those that believe in true love... hopefully it will get me through this. 

Please tell me what I should do to remind myself that if I say the wrong thing it will start a fight and I will loose, not just the fight but everything. Please help me. I can’t loose him. I feel like it’s going to end if I can’t fix this now.. he wants to give me a chance but I can see in his eyes he’s not sure if he can or should. I just need to prove to him I can stop these bad habits. Please
Help me",02Nov2020,1
58,Yes we do still exist.,02Nov2020,1
59,Making their names Mario Mario and Luigi Mario,02Nov2020,1
60,All this noise was made about Hillary Clinton being prosecuted after the election but she never was so whats to say that Trump will be?,02Nov2020,1
62,"this is nothing helpful i just need some help i guess?


i’m posting this because i can’t talk and laugh— i haven’t for a week!! i HATE BEING QUIET it has been always like this for i guess 3 years??? 5 years??? i have 3 right now because i accidentally bit both of my inside cheeks multiple times while eating PEACEFULLY but sometimes i get these shts without even doing anything. i usually rinse my mouth with salt when i have them and apply ointments from pharmacy. i don’t want to consult a doctor but i need help i don’t know how to deal with this anymore ㅠㅠ",02Nov2020,1
63,"I do not smoke  but if I was smoking 5 cigarettes per day for ONLY 1 month, and then, stopping it, am I risking getting cancer?

 I mean, if someone smokes only 1 cigarette? can he get cancer?",02Nov2020,1
64,"When I was 15 I started self harming for multiple reasons (trauma from parents, best friend dying when I was 12 ect ect) I'm 19 now and 8 months clean and organised my first appointment with a counsellor for next week.

I told my parents about four years ago that I wanted help but to no avail and I was always too scared to do it myself.

I'm just really happy that I finally managed to realise that my problems deserve addressing and that I've finally gotten the courage to do something about it.",02Nov2020,1
65,"I'm so fuckin tired. I haven't slept for more than 4 hours straight in 2 or 3 weeks. I have an appointment with my psychiatrist soon, so maybe she give me something to help, I don't know. I can't seem to stop these racing thoughts about random shit. It's hard recalling the all because they happen quickly and I'm groggy in the moment so it slips away. I know I worry about my relationship with my girlfriend, not that it's bad it's just I have some worries about things like everyone does. But it's stuff I don't feel like I can talk to her about, I think. Than I think about my dad and our relationship, and I've made posts before complaining about my dad but the reality is that I'm only mad at him because he hurts my feelings a lot. He's super inconsiderate and treats me like a small child sometimes. I work for the family business, with my brother and dad, I cook food for a marketing campaign we have going. He called me up friday night at 7:30 and he said, ""hey, what are you doing?"" I told him I was watching a movie with my girlfriend and he goes, ""Didn't I tell you to try the food you make before you film it?"" and I say, ""Yeah why? which one didn't you like?"" and he told me, but he told me the vegetables were so gross he couldn't even eat them and ""why is the stuffing so sweet? it's not good."" But I liked both of those recipes and in the video I'm not going to say to use honey cornbread (hence the sweet) but it's all I could find locally and I didn't have the time or the desire to make my own cornbread. He tells me this friday night, after I've spent the last two and a half days recording for a video that goes out this upcoming friday. My dad and I have a rough past, pretty usual story really, but basically what he means when he calls and tells me this kind of stuff is that I fucked up and I need to redo the whole thing. I'm a one man crew on this and that makes the mistakes increase and the stress increase dramatically, that I can handle, what I have trouble dealing with is when my dad is in a bad mood and calls me to take his frustration out on me, which used to happen all the time when I was a kid but as an adult I think it reminds me of being a kid and not having any control of my life. I'm 27, and I'm sure some people will read this and say something snarky, but it's hard when your dad is verbally and emotionally abusive to you for most of your life.

&amp;#x200B;

One particular memory I have is my dad asking me to find something when I was maybe 5 or 6, I couldn't find it, he comes downstairs and looks in the same drawer (it's a huge drawer btw, it's like a coffee table that is supposed to hold blankets but we used it for other random shit at the time) he looks in there and finds it right away and screams at me for not finding it. Fast forward to last week, we had some stressful shit happen at work and he wanted to sample a product in the middle of it, don't know why, so I cook it up in a pan and tell the guys to come try it. First thing he says is that I overcooked it so it's not going to be right. I didn't over cook it, it's turkey bacon, the shit gets crispy quick and that's also how I like it. Which I told him, and he ignored as per usual, and he told the guys that I overcooked it. Which is embarrassing considering my whole job at this company to cook and one of my passions outside of work is cooking. If I can make pasta from scratch, alfredo from scratch, and make my own Italian sausage (stuffed into casings as well) than I can cook a piece of fuckin bacon. So that was frustrating, then he tells me to microwave a couple pieces because he wants to try it. He tells me this as we're on the phone, I didn't hear what he had said and I asked ""how long?"" He starts talking to the guy on the phone, I stand there and wait a sec and he looks at me like ""what the fuck are you doing?"" I ask again, he says something but I can't here it because one of the guys is talking to the other guy on the phone. I ask him again, he ignores me, I think, ""I guess 1 minute then."" I cook it for 1 minute and it's too cooked for him. Again. The he gets pissed at me, in front of 2 of the employees, and he starts to yell like he did when I was a kid, but stops himself because there are people there, but he gets out, ""why'd you cook it for a minute, I didn't tell you to cook it for a minute, why don't you listen? You never listen to anything!"" Now, normally I would yell back and we'd get into a huge fight. But that isn't acceptable behavior for a business environment. So I grit my teeth and bare it, but I'm definitely pissed and everyone there, my brother included, can tell. So I stand in the breakroom for a couple minutes before I decide that I don't need to be there and I walk back to the office I share with my dad and brother. So I can't get away at all. Now, I get that we were having a problem at the office, and it was a big one, but that isn't an excuse.  Everyone was worried, but as the family who owns that company it isn't just my  dads ""ass on the line,"" as he so aptly said, it's ours. It's his and my brother's. And mine. This is just as much the business that I am included in. Just because I don't do sales or transportation or warehouse work anymore, and I more on the marketing side doesn't mean that I don't care about the shit that goes on there. Not to mention how he is about money, I once saved up, from working in our warehouse where he paid me below minimum wage and took half of each paycheck and put it into a bank account against my will at the age of 11, I had saved up to get an xbox 360. My friend came over and my mom took us to go get it. When we got back tot he house we had my friend sneak around the side of the house where there was a window and I ran down to the basement and opened the window, took it and then went and let him in the house. At the time we made it into a spy game type deal and it was fun, but the real reason my mom suggested it and I went with it is because we knew he'd scream at the two of us in front of my friend. So we acted out a game. So I could bring in something that \*I\* purchased with money I had earned. He would've screamed because he hates video games and thinks it's why I am fat (I wasn't overweight until my mid twenties, I look at pictures of myself then I wish I was still that skinny, but I am dieting and trying to work out now), he thinks video games are a waste of money. Once he got mad at me for spending money and told me that he got made because it's still like his money. The company paid me, and he \*is\* the company and I'm his son I guess, i don't fuckin know. By that metric every dollar that anyone ever makes ever isn't their money, it's the company's money, himself included. Anyway, I bring this up because I saved up for, and preordered, the ps5 and I guess my brother told him and then my dad told my mom he was disappointed in me or was upset that I was wasting money because he perceives me as either being too poor to spend money or wasting all my money all the time on frivolous things. Which I rarely do. Honestly, in today's climate, how many people in their 20's, or people in general, can say that they have almost 10 grand in their savings and 4 grand in their checking? Not Many. 4 thousand of my savings is left over college money, but it's still left over from what I didn't spend. So, since I started paying for all my own bills except phone bills because he loses a family plan if I go on my own plan, I've raised and saved almost 10,000 dollars of my own. And it's actually more because I've gone out to eat (which almost never does, like maybe 1 once a month, maybe), I've bought games, I've upgraded parts on my PC, I've bought online classes, I've bought other random things that I enjoy. And I've still managed to save up a lot of money, I've not fallen behind on any bills, I have no debts. I'm in a position where I can pay for rent and all my bills and my girlfriend doesn't have to chip in, and I still can put money in my savings, and believe me when I say that I am appreciative of my position to be able to do that. It is an expensive purchase, but that hobby of mine is far cheaper than his love of cars, I can tell you that shit for sure.

&amp;#x200B;

This has been a long self post. This has been a stressful 85 minutes of typing slowly while I wish I was sleeping. Work that I will be at in two and a half hours, is going to be stressful. all I want is to sleep. All I want is to be able to ignore my dad and not wake up at 4 oclock in the morning every night and think about him talking like that to me in front of the people at work. I don't want to think about how he makes me feel like an over weight piece of shit all the time. I don't want to think about how he doesn't treat me like his son that he's proud to have at the company but just another employee. I don't want to think about how he thinks I don't listen. I don't want to think about how he told my mom that she raised me wrong, which really gets to me because it implies there's something wrong with me. I don't want to think about how he wanted my mom to abort me when she was pregnant and how knowing that effects my entire outlook on how he treated me my entire life. I don't want to think about he's gotten mostly better, but sometimes he still cracks and freaks the fuck out at me (not at work, when I'm at his house or something). I don't want to think about how worthless he makes me feel. I don't want think about how unwanted and unloved I feel. I don't want to think that everything I do has to be seen as acceptable in his eyes. I don't want to think that he didn't want me to be born because my mom and him were different religions(she converted, it was incredibly difficult for her though because so many people treated her like shit). I don't want to think. I just want to sleep. I don't need to contemplate  all this shit, and much much more about my mom and my girlfriend and my relationship with my girlfriend at 4 O'clock in the morning. Or 6:09 in the morning. I just want to sleep.",02Nov2020,1
67,"My friend goes to a different school to me, and he has told me he is thinking about commuting suicide. I tried getting him to get professional help or therapy or something, but he doesn’t want to. We’re quite far apart and can only really talk through text, so I’m not in a very good position to help very much, and when I try he pushes me away. We share one of the same teacher (a distance learning thing) and I’m considering contacting him about my friend mental health, though I know my friend would not like it if I did this. I’m very worried though and I don’t know what else to do. So would this be an ok thing to do?",02Nov2020,1
