,text,time,score
0,"This is a throwaway account, I don't want to post it on my main one. tl;dr at the bottom.

Everything just culminated in a giant mess. 2020 was already a hard year for me(22m). My grandfather is stuck in the hospital and there are no signs for him getting better again, he might die. 

Now it got worse. My parents are getting divorced because of my dad. He is a manipulative, stalking, controlling sociopath who is making life for all of us hell. His behavior got worse since my mother started at her new job. She is doing amazing but he, of course, has to maltreat her for that being an egoistic and jealous idiot. My sister and I could not bear that anymore, so we tried to get some help from our family to calm things down or help somehow. It just made it worse. The only person living here with us in the same country was my grandmother from my father's side. But she just supported him for doing his things. This made it explode into a giant fight with the police and other things involved. He got a restraining order for 2 weeks and things calmed down. We got a new appartment and distanced us from him. His side from our family is practicly now dead for us. 

To make things even worse,my girlfriend of 3,5 years broke up through text after the escalation. Her reason is, that she has no feelings for me anymore. I do understand that and don't want to make her feel even more uncomfortable being stuck with someone she doesn't love. But it hurts so much. She was everything for me, I supported her in every way I could. She was my first girlfriend, I loved her from the bottom of my heart and still want only the best for her. And now, where I have it bad, she just made it worse. Doing it through text was horrible for me. Not even doing it just for me, leaving the easy exit for her just like that. I asked her at the beginning of our relationship, that if she ever wanted to break up, to do it the right way. Not like this. I guess she just didn't care anymore for me.

I feel so alone. I lose everyone close to me and have no one to be there for me. I try to be there the best I can for my sister and mother, they are really traumatized from all the recent events and can't expect them being there for me while dealing with all that shit. It's good that they also went ahead to get professional consouling since they were more the target from all that maltreat. But I don't know who to go forward. With another lockdown going live on tuesday, I feel like I am going to be even more isolated.

Sorry for lamenting here on reddit, I normally don't post about these things here, but I don't know how to deal with everything. Thank you kind redditor for reading!

tl;dr my grandfather is in the hospital, probably not going to make it; my parents are getting divorced after it escalating with violence and maltreat; my girlfriend of 3,5 years broke up a few days after over text messages; another lockdown is going live, I'm going to be isolated from friends; I feel so extremly alone and don't know how to go forward.",02Nov2020,1
1,"I'm an evil individual. I don't know what to do or who I am. I really liked you. I think you're...unique. Why can't you speak to me, You can't even let me know you're not interested. Can't let me know this isn't something you want to do. Why lead me on. I like you. Life isn't nice. Why did I forget that. I feel stupid and simple. To think I smiled at you. Tried to explain myself to you. At least the Makers Mark doesn't lie, omit or deceive on purpose or accident. I wish I could impress you.",02Nov2020,1
2,"My own mother just told me to leave America after I told her I think this country is a dumpster fire right now and I don’t want to vote because I don’t trust either candidate. (She asked me if I was going to vote, I said I don’t know if I want to, the conversation was sparked.)

Thinking negatively of America right now doesn’t mean you suddenly don’t appreciate the good things about America, it just means you are seeing the bad things and acknowledging them instead of pretending they don’t exist and pretending America is some type of utopia. The world is laughing at America right now for a reason.

This country is a steaming pile of hatred, unrest, violence, and pettiness right now, and it’s okay for you to acknowledge that. An American citizen with a negative opinion of the country right now isn’t unpatriotic. They’re honest.",02Nov2020,1
3,"The cases are different but the advice is the same  ie  leave the relationship, never anything else.",02Nov2020,1
4,"It’s really easy to become jaded by politics or embrace the idea that the choices are terrible or even think that your life won’t change either way. But I want the public record to show I participated, whatever the outcome.",02Nov2020,1
5,?????????,02Nov2020,1
6,"Have you noticed that if you say awww or something in a sad tone when a child hurts themselves, they cry harder? If you say something positive like “ oh you’re okay! Look how tough you are! Good job!” They tend to laugh and get over it more times then not. Random thing I wanted to point out.",02Nov2020,1
7," my cool likes i love being a autism super hero, i like mine craft, legos, star wars, i love swimming i can kayak, i like music , movies, Disney, paw patrol, nemo, vamprina and sofia and elsa Thomas the train hot wheels little mermaid, princesses blocks pj masks blaze and the monster machines my fav characters from paw patrol are marshal , i like too help others , bubbles chalk, singing coloring i love boating and fishing too i do have too wear a life jacket if the water is too deep im required too i love too collect old coins i like tractors and old houses too, i like Christmas Halloween Santa is real i have many special needs ok im just me",02Nov2020,1
8,I was chilling in my backyard scratching my ass and enjoying the scenery and I turn to the right and see either my neighbors friend or son looking at me through the fence. I just walked back inside and I heard a deep chuckle. I'm incredibly underage and this is fucking creepy. What do I do?,02Nov2020,1
9,Read the title dude,02Nov2020,1
10,"Why do I have to continuously analyze and reconfirm my belief system all the time? And ""meta-analyze"" my life. Questioning my choices. Questioning how I want my future to look. Is this a mental health issue?",02Nov2020,1
11,"Without weapons, I just want to know the best way to deal with toxic people in the workplace or on the street. Any help is appreciated.",02Nov2020,1
12,Just because you are some assholes’s gf doesn’t mean that all men must die,02Nov2020,1
13,"I don’t know what to with my life anymore. I feel like a college dropout. Parent hates me. Been used by guys twice now even though I always dreamed of waiting for marriage. Can’t even like fucking Kpop without people complaining about it every five seconds. 

Please someone help me, I really need to talk to someone and Idk what to do",02Nov2020,1
14, i don't have bedwetting or even bladder leaks anymore i did as a kid but my question even though im completely dry at night can i wear diapers are they needed im ok with cloth diapers too or a pad or plastic vinyl mattress covers too im completly dry at night but worry i have bad anxiety and night terrors and nightmares i want no mean comments i have autism and spiceal needs and many deplomental delays please be kind ok,02Nov2020,1
15,"Okay, some context - I'm a 14-year-old with Asperger's syndrome and above-average intelligence (I'm not lying, my IQ is 125). I can't stand what I see in the mirror each morning.

I'm a tall, hairy teenage body with long, curly brown hair, brown eyes, glasses, and a Sephardic Jewish skintone (because I'm of largely Sephardic Jewish ancestry.) My skull is large, and my face is small. My mouth is narrow, my nose is huge, and my hairline is far up on my scalp.

Every day I wake up and I loathe what I see. I don't want to be a werewolf - I want to be completely clean-shaven with smooth skin. I want an Asian skintone like this girl in my English class named Ali. I want a larger face, smaller nose, and larger mouth.

I want long, black hair partially dyed pink. I want breasts and a plump butt. I want way smaller hands and a more feminine face. I want a vagina more than anything in the world.

For the love of God I'm so sick of wearing puffy Nikes shoes, sweatpants, and t-shirts. I wanna wear dresses, tutus, thigh high stockings, leggings, Vans, skinny jeans, sweaters, makeup, boots, overalls, crop tops, cat ears, makeup, jewelry, etc.

Why can't I ever be satisfied with myself?",02Nov2020,1
16,"I miss last year when I had things to look forward to in my senior year of high school. But, the only thing I don’t have a pessimistic view about right now is my own life and I hate it. Yet I have no idea how to combat this with the tools I have been given this year. 

Before this year, I was working on injecting positivity in my life a little by little for myself emotionally and my mental state. But after everything that has happened this year the little optimism that I have built up as well as the stability that I have achieved in my mental state has been slowly chipped away at by stress and anxiety over the course of the last 10 months until I had a mental breakdown recently. Now I’m back to being my old depressed pessimistic self with a precarious mental state, that is reminiscent of my middle school years, also with a side of I feel like I have to cry all the time. 

But I think I will be okay. It’s gonna hardest thing I have had to do in really long time, but I think I can build my mental house again brick by brick, wall by wall still it’s as solid and stable as it was before.

I really hate everything happening this year and I hope nothing of the same scale happens next year.",02Nov2020,1
18,"“My boyfriend doesn’t want sex with me anymore, what should I do?”

“My boyfriend thought period sex was gross.”

“My boyfriend cheated on me but I forgave him.”

And meanwhile, in the friend zone...",02Nov2020,1
19,"About 11 months ago i would randomly have a sulpher belch, then throw up Everytime. It would happen maybe once a month. I went to the dr they prescribed omeprazole which has done nothing. Fast forward to now. Sometimes the vomiting happens twice a week almost always after a sulpher/feces smelling belch. My vomit does smell horrid. Not like vomit. I am making an appointment but i am at my wits end with this. Also when i vomit everything has to be out of my stomach and sometimes dry heave and always throw up bile. If anyone has any ideas please throw them my way.",02Nov2020,1
21,"I don’t have anyone to tell this to (because of coronavirus) so I am gonna put this on here.

My uncle is a good businessman, he owns a few companies and he is doing well for himself, but in the 90s he was at a convention, and a guy came in, he told the people there about his company, and a few people invested in it, my uncle was contemplating it but he thought it wouldn’t go anywhere.
A few years passed and he never heard from the guy, so he thought he made a good decision in not investing, but after a few months he was checking the stock market and saw Amazon was there, he did some research and he was amazed to see that the guy that he didn’t invest in was a multi millionaire, he regretted his decision of not investing, but he didn’t know how big Amazon would actually get.

So in a parallel universe my uncle is living at the top, but one choice had changed his life forever.

(My uncle told me this when i was little so he left out the finer details)",02Nov2020,1
22,"Due to Covid, every piece of work we do in school will now count towards estimated grades for what would have been our exams. 

I don't think I'm going to do well, and it's my own fault. I never study, I don't sleep well, I don't pay attention in class and I'm a huge procrastinator. 

I feel the last one is a bad excuse but sometimes I just get distracted with stuff and end up doing work for school at like 12am.

I'm worried I'm going to do badly in school, and go on to not get far. I'm hoping to be an animator/ something to do with art. Apart from art, I don't feel I have much going for me, and even then, I'm not the best at it. I know I still have time to learn new things and improve what I know and study, but still. 

My friends seem to be better at stuff than me and have it all planned out. 

Idk

Not really looking for advice, just ranting. :-)",02Nov2020,1
23,"I recently made a realisation, my best friend of many years for the longest time held some sort of resentment towards me and I only just saw it. My mum told me about it for years and yet, I was blind to it all. The signs were there but I just didn’t see them. The ‘wonky eyeliner’ incident because welp, atleast she’ll look better than me. The party where we were both drunk and she said “do you think you’re a hotspice” ( referring to British slang, meaning attractive) and as I’m walking away saying “coz you’re not”, this was all said in a video which I’ve had for years but never caught on. The time at the bus stop when a guy approached us and I responded to him and he said “I wasn’t talking to you” to which her response was to laugh. I feel like a bitter realisation has come to me and even though she doesn’t seem to be like this anymore, I can’t help but feel hurt it makes me feel like the bond that I thought we had was not real? I don’t even know if I have the right to feel like this anymore. There’s so many other things which I can refer to but I feel like if I continue connecting the dots I’m not going to be able to be the same towards her.",02Nov2020,1
24,"I'm a 2nd year University student living in Canada. I reside in a dorm, where I'm not allowed any visitors and know no one (people here don't talk to each other since COVID begun, especially since they closed or severely limited common areas). The COVID restrictions have been really tough on me since the beginning of this pandemic. My family lives abroad and I haven't seen them in a year now. 
Most of my friends were international students who left. I don't have any in-person classes until at least September 2021. I try to socialize as much as I can at the library, but it's not enough. All I do is study (and I am completely overwhelmed) and feel bad. I can't go to the gym anymore to channel my frustration since they've closed (and yeah, working out in my tiny room doesn't feel the same). I don't have a girlfriend. I don't have a lot of friends either.
I just feel completely forgotten by the Government and most people. I'm depressive and other than meds, I don't have any support as I can't afford therapy anymore. 

It's just so hard and I don't know what to do or make of it. I just feel so lonely and empty",02Nov2020,1
25,"They did something and it turns out that I have a trigger about that. I spent an entire month crying daily and trying to get on top of it. I just couldn't. I kept trying to act like things were OK but I got to the point where I was dreading every interaction with them.

So I gave up and destroyed the friendship. It was so obviously the wrong thing to do but since I did it I haven't cried even once. It's like a huge weight off my chest.

I'll almost surely bitterly regret it later. But right now I'm just so relieved to have one less thing to worry about.",02Nov2020,1
26,"Disclaimer: Not American. However, both the attacks and the hotline are so recurring in the general knowledge (zeitgeist? pop culture?) of our generation, so I feel pretty stupid that it hadn't occurred to me until recently.",02Nov2020,1
27,".......................**~~\_\_\_\_\_\_\_~~****....................... ssssss**

**...................///////..................sssss.........sssss**

**.................///////..........................sssss**

...............**///////................................ sssss**

**............///////.........................................sssss**

**..........///////........................sssss ............. sssss**

**......****~~\_\_\_\_\_\_\_~~****...............................ssssss.......sssss**",02Nov2020,1
28,"My credit card bill. 

That shit is the most horrifying thing on the planet, would rather be in a lions cage than to have to see that shit

Lmfao I’m dying. Randomly started thinking about this, had to share",02Nov2020,1
29,at least I’m not alone.,02Nov2020,1
31,"my high stress full time job had me quarantine for two weeks since i was exposed to someone who tested positive. i felt fine but was too anxious to go and get tested. obviously, i completely isolated and didn’t leave the house. i ordered groceries, binged tv. i  started feeling kind of peaceful. twelve days in, my work contacts me to check in and i say i’m fine. i set a time to come back in  two days. that night, i’m feeling cranky and stressed and fatigued for some reason. 

i go into work at six am and feel welcomed back, im gracious and admit to missing my co workers. but all day, i felt this drag. today was my second day and tomorrow is my third day back. i feel trapped in a surreal time loop of the same stressful interactions. i told management that they could give me more hours because i genuinely do need the money coming into the holidays and they were only too happy to oblige. i’m grateful for my job, i’m grateful for what i have but i’m really struggling and don’t want to burden my loved ones with my depression. thank you for reading.",02Nov2020,1
32,"If 600 years went by... then that means the milky way would have advanced 600 years in technology, expansion, population, etc. Militarily they should have evolved way past the technology the Andromeda exhibition had. They could have had ships at least 6 times more powerful. Assuming general advancements at least once per century.

It's a paradox and it's my opinion they could have had developed the technology to reinforce the Andromeda galaxy with a full scale task force.

Who knows, maybe this is explained later, I only just started today but.. That detail bugs me.",02Nov2020,1
33,"I know some people are interested in learning Spanish, and so I decided to post a video to help them [learn Spanish fast](https://youtu.be/arssWdCc3eg).",02Nov2020,1
34,"Hi Internet I need some opinions.... Basically I've been messaging a man along with any other guys who I either bare a resemblance to since about 2012 or fit into to the very little information my mother gave me to go on... I've had a few replies from some lovely people wishing me luck finding my dad but unfortunately not the person I was looking for.... Obviously there is only so many so my search has got thinner and thinner over the last few years, but there has been his one guy who ticks a few boxes that I've never received any acknowledgement from. (even though in the message I state I understand if I don't receive contact I'll understand as I don't want to disturb anyone's family life) I never thought of looking into the friend list to find if there was anyone else related I could possibly contact, so this evening I tried that and come across what I think is his daughter.... Now heres the problem.... It appears the man I've been messaging to contact regarding finding my father passed away in 2017.... Now obviously I would like closure and to find out but Im not sure I have the right to just walk into someone's life and possibly cause an issue.... I just would like to hear a few opinions so I can make up my mind what to do as I'm feeling little bit lost on the subject

Thanks in advance",02Nov2020,1
36,"


Tl;Dr: I think my dad kicked me out after constant arguing and him recently stopping his anti depressants. I hate living there and living with my mom isn’t an option (her and husband are emotionally abusive). I’m staying at my GF’s house right now and don’t know what to do. Idek if I was kicked out or not. 

I live in West Virginia if anybody has any help to offer (programs or anything) 

First, background. I dropped out of WVU a few weeks ago. I was majoring in Electrical Engineering. I withdrew and enrolled to start community college classes in the spring for EET. Recently, I’ve decided to just become an electrician and I know the process in order to do that and plan on starting soon. 

I got a job lined up at UPS and I’m waiting on them to call me to start anytime this month. I spend time at my girlfriend’s house when I’m not home, and that’s about it. 

My dad:

My dad owns a trucking business he is very busy with, he recently started tapering off his antidepressant he’s took for years. He tapered for two weeks and stopped yesterday. I’m facing the effects right now. 

I also can’t stay with my mom since I moved out there two years ago because her husband ignores me and they both are very emotionally abusive. My dad is too but it took time living there to realize it. 

Yesterday I hit the side of my truck’s wheel and broke it while driving (went off the road a little and just knicked the rim on the pavement) and broke it. Nothing major. But, since my dad decided to buy such a huge lifted truck the wheel cost $450. It happened right in front of GF’s house, and he showed up screaming at me and going crazy. We took the wheel off and went home. He threatened to take all my electronics and music instruments but I talked him out of it.

Last night after all this he started going off more and I told him he can’t stop taking his pills in two weeks. He did this when I was younger and broke my Xbox by punching it. He told me I was stupid and I’m not a doctor, and I can’t tell him what he can and can’t do. Even after I said I’m just looking out for your health. 

This morning he left and was real smart and angry when he asked for the car keys. He came back home and yelled at me angry to help him outside. I was carrying my phone and his checkbook back to the house and after my confusion from what he said (called the checkbook my laptop) he said he couldn’t see straight and told me to help him inside. Then said help me outside. I asked inside or outside. 

He yelled at me to leave and go away. I texted my gf and said it might be time to get me. Her parents are really supportive of me and treat me better than my mom or dad ever have. He saw I said that and threw a fit screaming and yelling. Called my mom (haven’t spoke since the divorce) to get me and asked if I wanted to live with her. I said no and he told me to call her to get me. That’s when he yanked the phone out of my hands and saw the texts. 

He got even hotter and started screaming more then called my mom. I grabbed my toothbrush and hairbrush and took off running up the highway. My neighbor saw me and picked me up. He took me to the store where I met my gf and her mom.

I walked around in my pajamas everywhere and have no clothes here. I ran down the highway and had cars honk at me. I called my mom to explain why he called her and she said I asked for it when I went to live with him. I don’t expect any help from her anymore but wow that was really mean. 

Me and my dad live with my grandparents and his sister and her husband. I got screamed at this morning by my grandma, since i broke the wheel in front of GF’s house. My entire family hates her and her family. 

My dad told my mom on the phone he’s tired of dealing with me since I don’t help (he treats me like a servant I cook and clean after him) I won’t get a job (waiting on ups to call me I can take the test for my electrician apprentice license in December) and honestly I can tell he doesn’t like me. 

We argue all the time and he gets on my last nerve. He treats me like a little kid and only speaks to me to tell me what to do. When he gets mad he screams and my therapist told me I’m better than that. So when I stand up for myself he gets even madder. My whole family sticks up for him since he has always had his way and is babied. 

I have a feeling they won’t get a hold of me and now I’m stuck here with my gf and her family. They are poor and don’t have a lot so I feel bad staying without being able to support myself.

My moms mom who lives in Tennessee also offered to drive up and get me and let me live with her. She said she can get me a job easily and I can start my life or career or whatever there.

I don’t really want to leave my gf and her family since i already know I have something here to support me.
I also don’t know how I can get any of my stuff out of my house, since my dad will claim none of it’s mine even tho I bought some music stuff. He will say it’s his cause he paid for it.

The first thing he said to me when he saw the truck wheel was “take that stupid s*** off) referring to the button up I had on since it was cold outside. The house behind us caught on fire with me inside our house and melted our siding. He rushed home from work to make sure everything was okay and our house didn’t burn down, and didn’t even stop to see me first he went to grab his computers and business stuff. He also took all the money off my debt card earlier before I could get it out at the ATM.

I feel like he hates me and he doesn’t care. I think this is it and now it’s time for me to start taking care of myself. Idk what to do and I’m sorry this post is so scattered I’ve had a crazy day and I have to get it all out.",02Nov2020,1
