,text,time,score
69,"I have an online friend whom I've known for 2 years, and they are in a relationship. I have had a crush on this friend for a long time, which for the most part plays in the background and can go unnoticed for the majority of the time. Not usually an issue, until recently. 

This friend has been struggling with their mental health for a while, and seems to especially be struggling over the last few months. It seems it's a combination of low self esteem, and discontent with the level of communication in their relationship. They have been confiding in me, and talking to me about what they are struggling with, which I can relate well to (it turns out we're very similar people and are often saying 'me too!' to almost everything). 

So, it's such a good feeling to be that person for someone, and to be understood in return on a deeper level. This is what's overwhelming me recently, and im feeling more intense feelings toward them which I cant seem to shake it off. I'm thinking about them all the time, even listening to music that reminds me of them. I have other things to be focusing on (school, work, real life stuff), so it's not like I dont have distraction from these feelings.. I just crave telling them how I feel - obviously that's a dick move which I know isnt a good idea as they're in a relationship (and they're in a different country to me so not very realistic overall). I also dont want to stop communicating with them as they're struggling right now, and I dont want to take away our friendship if I'm able to help them feel better/gain clarity with their personal problems. 

So, I'm wondering if anyone can give me some advice on how I can deal with my feelings without doing anything drastic (cut communication/tell them how I feel)? Is there something that can help me process my feelings in a healthy manner that wont impact our friendship? Or do I need to be harsh and take a break for a while? I really dont want to do the latter...",02Nov2020,1
70,"She wouldn't take no for an answer on paying me, so I said ""just give me a 20 and buy me dinner at some point"". I work out every day and am very clearly a mountain of a man, but I'm whats called a teddy bear lmao. In all serious though, ill have my gun and my baton just on case to be safe. Spending a couple years as freelance security has its perks. 

If you are crazy enough to attack a woman who's clearly going through her own issues, then I hope that woman has a friend like me who can put you in a tight hold and keep you there. Seriously. They see nothing wrong with attacking people for going against their beliefs, and see no similarities between them and the ""crazy muslims"" they love talking about.",02Nov2020,1
73,Power to the highest bidder,02Nov2020,1
74,"All of my life there has been conflict between my parents and I. One is a narcissist, the other an enabler and very passive aggressive.
It’s like being the adult child of emotional vampires.

The narcissistic parent is likely going to die within the next 12 months. Chemo has had minimal impact on the tumour, and it’s not a type of cancer that has any kind of success with treatment anyway.
I’m scared for this person, it will be a hideous way to die. 

I feel helpless, and guilty for not being the daughter they want me to be.
They make it so hard to want to be involved and available. He is rude, critical and exhausting, and she is on the edge of screaming and crying with distress at every moment.
Every word and gesture has to be measured when engaging with them.
I carry guilt for not being more loving, sweet, sympathetic. Instead I’m practical, officious and abrupt with them.
I feel like they deserve to be loved up and wrapped in bottomless kindness. They are going through such tragedy and grief and pain, but I can’t give that to them.",02Nov2020,1
75,Seriously. I'll make some molotov cocktails and help burn down the nearest building. If America's going to be destroyed anyways I might as well join in.,02Nov2020,1
76,"My anxiety level can skyrocket at littlest things. One time, my Childhood Idol on instagram posted and I made a nice comment. He like people's comments except mine and a few others. Even people who commented hours after me got liked by the man. This man has 30k followers and there were just 60 comments in the post. I deleted my comment.",02Nov2020,1
78,"Hey guys, The struggle of building healthy habits is very real, we all have experienced at some point. Would you like to help us understand the most difficult part?

We are trying to understand the triggers of human motivation so that habit building no longer remains reserved for the first week of January!

Quick background, I'm Amogh, currently an engineering undergraduate. My college-mate Shubham and I are always looking for interesting problems to study and unwind.

After a recent exploration into the topic of social psychology, we wanted to apply our learnings in a way that actually helped people. We decided to work on a product that actually works when nothing currently available made much difference to us.

This is not a company/startup at this point and we don't expect any monetary gain, we just want create a solution for a problem that is very personal to us.

The reason we want to reach out to people like you who have had past experiences is that you will help us get a better understanding of what problems are most common and what solution will be most effective for it.

Just book a slot on the calendly link below and join us for a quick hangout call! We understand that the struggle is very personal to everyone and won’t ask any PII.

Come on! Don’t stall on this! We’ll keep it fun. Promise! See ya 😃 Calendly Link: https://calendly.com/get-inhabit/30min",02Nov2020,1
79,"My mom wanted to go out today and i didnt, she ended uo getting pissed off and doesnt want to go out anymore with me, she said she wastes her life and that everyone home is selfish, i feel terrible once again im ruining everything, im so sorry mom, its all my fault, fuck why do i fuck up everything?? I cant do anything right",02Nov2020,1
80,Just a general rant about being an adult in your 20s and having no financial support and having to deal with big unexpected financial burdens that delay plans. Im so tired of living in capitalistic system where its a grind to get by everyday and not ever having enough time to actually fight for your rights because you are so focused on trying to just to afford to live,02Nov2020,2
81,"So I’m not sure where to post it, but since it’s about me, here is an appropriate place I guess. Around 6 years ago I’ve decided to change my life and switch careers. It was a tough decision, but a good one. A right one. I was scared as hell since I was leaving my dad’s place and he always wished that I continue what he does, but I wasn’t interested at all, more so I was constantly miserable working at that place. I took the leap, learned programming, got employed as a junior at some sketchy place first, then moved to a better one, but the thing is... 

Through almost 6 years working in IT I’ve lost my interest in it. I seriously don’t care about programming languages, frameworks, front end, backend, infrastructure, etc. I got to know people that work in the industry and I can’t find anything common with them, I don’t get them. 
But here’s the problem: all my life I wanted to get in, I love computers, I like working with a nice software and hardware, and I like tinkering with it, so maybe I’m just burned out or haven’t found my place yet? But after loosing my interest in this field I just can’t bring myself to look for a new job or learn a new toolset, even though I try to get back on track. I don’t have any friends with common interest and I dislike people from the industry that I know through the work, so I don’t really know to whom I can talk to about it. Because of that, recently I grew extremely anxious and socially awkward. 

For about a year or two now I’ve started to think about getting into truck driving. When I used to be a kid I’ve played a ton of games about hard trucks and enjoyed it, but then just kinda forgot about it while growing up. My dad used to own a few trucks, he haven’t driven himself, he was more of a business owner, but he’ve taken me a few times to some truck stops where I’ve had a chance to sit in a truck and pretend that I’m driving. And since he has some experience in this field I’ve decided to ask what he was thinking about this job and he said I was out of my mind. And I get it, we are not US or EU. Here in RU it’s considered a low paying, hard as fuck job, where plenty of asocial persons or ex-convicts work, where hours of service regulations are overlooked and cops try to bribe you at every chance. My girlfriend thinks the same. We build our relationship where I’m a perspective IT guy, not a truck driver that visits home a few days a month. Meanwhile I can’t stop watching videos about it, learning about life on the road and considering trying it.

So it all tears me apart, and I feel paralyzed. Sorry for any grammar errors.",02Nov2020,1
82,"This virus is completely putting my life on hd. Before all of this started happening, I was in a stable job, excelling in college, and learning to drive. I had my theory test booked for April, and my instructor had faith that I'd be ready to take my practical test as soon as I passed my theory.

Then came lockdown. I was put on furlough, college was closed down, and my test was cancelled. I was at home with nothing to do, getting extremely lonely, but I managed. As we started coming to the end of lockdown, my employer contacted me, to say that they needed to cut costs, and that I would be made redundant without pay. 

I went back to college with very little money, paying for bus tickets and food and things like that. I managed to rebook my theory test and pass ot first time. I then spent about a month trying to book my practical tests, stuck in queues of over 100,000 people, with the website closing down before I reached the booking stage. 

Eventually I booked my test, the earliest available slot being in November (which was about 3 months away). I kept waiting, spending obscene amounts of money on driving lessons to keep fresh. I also applied for a new job, and had a trial there. 

The job trial went well, and I was given a starting date. Then came the second lockdown. I was less than a week away from starting my new job, and less than 2 weeks from my driving test. The test has now been cancelled, and the place I was supposed to work at closed down. So now im back to no income, and facing another extremely long wait for my test, all because some selfish assholes refuse to follow all the government guidelines",02Nov2020,1
84,"TLTR: I am 22 years old and get migraines. I am writing this to share my experience dealing with this. and what it feels like.

How it started

I remember exactly were I was when I got my first migraine. I was 13 years old and a freshman in Highschool. I was sitting in my English class. I usually would seat near the back. The teacher was writing notes on the board and we were copying along. I remember at some point I look down at my paper then look back up and notice that the middle of the word on the board is missing. It was extremely strange. I keep trying to read the board and take notes but every word I look at is distorted. I couldn't really read the middle of the word something like this ""Som\*\*\*\*ng"". A little bit of time goes by and this get worse, my vision is now really hindered and I get scared and ask to go to the nurse. I need a class mate to help me walk there because I couldn't really see. The nurse asks me if I have hit my head or something which I didn't. She calls my mom to pick me up. In the mean time while my mom is heading to pick me up my head starts hurting extremely bad to the point were I start to basically projectile vomit into the toilet. It was horrible and very scary.

Fast forward almost 10 years and I still get migraines occasionally. It is very random and I have not been able to discern a trigger for them. I also very rarely have such intense ones were I start throwing up. I have gotten very nauseous but I cant remember the last time I threw up from one. I have gone a few months without getting one and sometimes I can have like 2 in one week. It happens randomly at random  times of the day. At first I thought it would occur if I haven't eaten for a while. Like if I didn't really eat the whole day and have a small meal, then proceed to not really eat good the next day because I'm busy or something and would get one. But that doesn't seem to be it. I also thought at some point that it was stress induced. But that as well doesn't seem correct as I get them completely randomly. At times when I am extremely relaxed, at work, during the day or night. even while I'm sleeping it doesn't matter. As I am writing this I woke up in the middle of the morning with a migraine in full swing. This shit sucks ass.

The symptoms

The only good thing about this is that there is a sequence of events that always happens, and I mean always! Every single time I have gotten a migraine it is the exact same process. like textbook these symptoms will occur in sequence so I always know when I'm getting a migraine and can try to act fast to take some medicine to at least reduce the pain or something. 

First my vision gets distorted. It starts small at first. Its like a little blurriness in the middle of your vision super small but noticeable. it slowly gets bigger and bigger till I'm basically half blind. The best way I can explain it is you know how if someone takes a picture of you with a bright flash and the light kinda sticks to your eye for a while. Like the flash is burned into your eye and you can see it where ever you look. Its kinda like that. This effect will last for a while 30-40 mins. and then it will go away gradually. Once my vision is cleared the pain begins. The pain is always mostly located in one of my eyes. Either the right or left I think its random Although I have a theory. The pain starts slightly and gradually grows to immense levels. My eye and its concurrent top half of my head will hurt like a bitch. I cant stress enough how much it hurts. The best way I can try to explain it is it feels as if someone reached into my skull and was squeezing the fuck out of my eye like a grape!!!!. Or if you are a male and have ever gotten kicked in the nuts really hard or something, imagine the testicle is my eye. That's how it feels. This pain will last a few hours anywhere from 3-5 on average. I think each migraine rotates the affected eye. Like one time ill have it in my left eye and the next it will be my right and so on but I am not completely sure. 

As of right now after all the research I have done I have not found anything to really help/stop migraines. The only thing that sort of works is some Exedrin migraine medication. Its basically a pill containing  **acetaminophen, aspirin** and **caffeine.** When I first notice the eye blurriness at the beginning of the process I try to take it to at least alleviate the pain that is coming. This does not stop the pain at all but I think it lightly reduces it. Either way once I see that blurriness I know I'm in for an ass swooping of epic proportions!!! I mean I'm clapped as fuck!!!! I have to lay in bed and just deal with it. It sounds weird but sometimes I like to take my pillow to the bathroom and lay on the floor with the lights off. The complete darkness helps as light bothers the fuck out of me when I'm in the thick of it. 

After a few hours the pain will gradually go away until it is completely gone but the migraine is not gone. The reason I say this is because some effects last around 24 hours. For example even after the migraine subsides and I no longer feel pain, If I make a sudden movement with my head like turning it to the side real fast or bending over to pick something up some pain will occur. Almost like my head and eye is really  sensitive. Honestly it ruins my whole day. I am out of it the rest of the day and just feel groggy and shitty. 

Its hard dealing with this because it feels like no one understands. Even when I tell my friends and family about it they look at me weird like I'm being a little bitch or something but they just don' get it. I don't think anyone will understand unless they feel it for themselves. Sometimes it can be a real hinderance. There have been times when my friends are throwing a party or we are supposed to do something and I have to bail because of a migraine and I cant be around people or loud noise or lights. 

I should mention that I pretty healthy for the most part. I only drink water and occasionally alcohol, normal college student shit. And my eating habits are not too bad either. I am not overweight and I seem perfectly healthy for the most part

I hope this can teach someone about migraines or help comfort people that are on the same boat as me. You are not alone! Even if your specific migraines are different (and they probably are since everyone feels symptoms differently), just now that you are not alone. All you can do is sit through it and deal with it and come out the other side you know. 

Also if anyone has any advise on dealing with this I am all ears. comment any medication or treatments or any thing really!

Thanks for reading if you did and have a great MIGRAINE FREE day! lmao",02Nov2020,1
85,"I want to die. But if i die i know im going to hell. I hate myself. The pain just never seems to stop, even after death. I wish i was never born. I wish god would have created someone else to fulfill a 'purpose' or whatever. An endless loop of self hatred and agony. I have been depressed since i was 12. I dont want to talk to anyone but at the same time i do. I wish i was better. I wish i was happy. I wish i wanted to live. Goodbye",02Nov2020,1
87," You don't need it to live. You can't eat it, you can't use it to build anything, all you can do is trade it in the Hope's that the other person finds value in it. 

And if a situation comes up where the economy collapses and money no longer has any value ( which it doesn't already) then no one will take it and you won't be able to attain any real essentials. 

On the other hand if you spend your time trying to live without it, help the poor, and share whatever wealth you have with other people, then you will no longer have to worry about where your next meal comes from. God himself will feed you!",02Nov2020,1
88,My gf and I just adopted her this week from shelter. She was 3 months old and she was so adorable. Then suddenly she got sick. We went clinic yesterday. Veterinary said something like “pan leukopenia” and this morning she died. Don’t know what to say. I am just crying . I hope she didn’t suffer :(,02Nov2020,1
89," About 10 years ago I was rushing to catch a ferry (boat) and I missed  it, I was waiting for the next one and had time to kill. It was a cold  February evening and getting to be kind of dark, I felt compelled to  drive down a particular road I had never been to and ended up at a  public park. It was absolutely deserted, and I got out of my car and  decided to walk down to the beach area. When I walked through the park I  noticed a pile of clothing and shoes piled up on a picnic table near  the beach, which was absolutely strange for a Canadian February. I saw a  man wading out into the water, and I felt my heart sink. Having  struggled with depression myself, I knew what this man was doing. I  called out to him but he ignored me and just kept looking out into the  water, he was in up to his chest and shaking. I called the police, there  was nothing else I could have done at that point. I kept trying to call  out to him and ask him to come out of the water, he clearly didn't want  an audience and exited the water and walked away from me, I followed  him at a great distance and he tried to circle back to the cliffs  overlooking the water and the police reached us just in time. They took  him away in an ambulance, and the police later contacted me and told me  he was trying to kill himself and he had been in the water so long that  hypothermia was setting in, if I hadn't found him he might have actually  died. I still think about how if I hadn't missed that boat, and then felt that strong compelling feeling to go to that place, that man could  have died. It felt like divine intervention.",02Nov2020,1
94,The title says it all.,02Nov2020,1
95,"Ok so yesterday I was supposed to go do groceries with my mother; or at least, that's what she thought. I didnt want to go, I had been at work all day and I just wanted to go for a run, take a shower and go to bed.

For some reason though, as we were discussing what we needed to buy, there was a miscommunication and she thought I wanted to go with her.

I didnt know this.

She knew I was about to go for a run, so I guess her plan was to let me go for a run before we did groceries, but theres no way I'm coming home sweaty and dizzy only to leave again for groceries, an activity that can be done by one person. 

So I went for my run, and since it was snowing, I felt the smart thing to do was to stay off the road and use forest trails; so that's what I did. I ran for 40 minutes in the woods, then took my time coming back because I was listening to an album I wanted to finish before I got home.

That's when my mom called me asking if I was almost home. I guess I misunderstood her concern, because usually I only run 5k which takes like 25 minutes, so I shouldve been home by then; however, these days I've been doing 8k and so i took around 40 minutes. I figured she was just scared that I got injured or something because again, it was the first snowfall of the year.

So I assured her I was ok, and kept taking my time coming home, not realizing that she was calling because she wanted to leave to do groceries soon.

So I get home tired and sweaty and head straight to the bathroom to take a shower. As I'm washing my face, and waiting for the water to warm up, I can clearly hear her and my step dad talking, one of the things I remember her saying specifically was ""I dont know- how do I address it?"". She then immediately knocked on the bathroom door so I figured they were talking about me. She asked me if I was ready to go to the store, I said I was gonna take a shower and that she could go without me (which I expected her to do anyway) and she responded with a disappointed ""oh... ok... if I knew that I would've left a long time ago"". 

Of course at this point I felt bad so I apologized and she assured me it was ok, but since then I feel like shes still upset with me; but I dont know why.

Theres two ways I've interpreted the situation.

1. She was looking forward to doing something together and was ultimately disappointed when I seemed to not want to go. This is unlikely as I've spent a lot fo time with her recently.

2. She thinks I didnt want to go because I was on drugs, and thus assumes that whenever I go for a run that means I'm going to the woods to do drugs. This would explain the ""I dont know-how do I address it?"" and her current behaviour toward me (this morning all shes talked about is how I need to save up more money, get a better job, move out and go back to school or she will continue to raise my rent. I'm 18 and currently taking a semester off to figure out what program I want to go into.)

I know if I mention it to her I'll come off as paranoid or neurotic, which is just another reason for her to assume I'm taking drugs. 

So how do you interpret the situation? Am I overreacting? Am I in the wrong? I've thought about this so much it barely makes sense to me anymore, I spent almost the entire night awake thinking about it but I cant tell if it's a severe enough situation for me to bring it up. What should I do?

Full disclosure, I smoke weed regularly, but not that much, the equivalent to drinking a beer after work (my lungs are really sensitive so even if i wanted to smoke more i wouldnt be able to get it down without vomitting)",02Nov2020,1
96,I was in bed thinking about all the bad decisions I’ve made in my life up until now because of which I couldn’t achieve anything worthwhile in my life and I just slapped myself really really hard 5-7 times. It felt kinda good . It hurt me a little physically but didn’t affect me at all emotionally. But if someone else were to slap me even with half the force I would cry for days out of emotional pain and embarrassment. This made me wonder why does it hurt so much more when someone else physically harms us . And so much less when we do it to ourselves even with twice the force . Why don’t our brains react the same when we self harm as the way it reacts when someone else harms us.,02Nov2020,1
97,I really want to quit college but I only have 7 classes left to graduate but I still have to take 2 state exams by January and pass them or i will not be able to take my classes next semester. I’m very stressed and tired. The love of my life is gone and I feel all alone in this world because I never have anyone to tell my problems to.,02Nov2020,1
