,text,time,score
99,"So the neighbours cat sometimes visits me at my window. He's a cute little gray-black tabby with fine short fur. He's usually quite friendly and eager to be petted when he comes to my window. But last night he came to my window and ran away when I came along like he was scared of me. Something else also looked odd about him. He looked more scruffy than he usually does. I know it's him because it's impossible for any other cat to get to my window being as high up as it is and only connected to my neighbours window.

I had suspicious paranoia that maybe they were harming the poor cat being as scruffy and fearful as he was. But then I might be worrying too much. Hope he's alright.",02Nov2020,1
100,"hey everyone, i just wanted to ask how  i can get through to my mom that i am in fact almost an adult and shouldnt be babied.  my mom seems to be adamant about a 9:45  limit for electronics, but i think its silly:

&amp;#x200B;

1. as said above, i am almost an adult, i have  been employed, i get good grades, i dont do drugs or drink alcohol. 
2. many of my friends are on discord chatting till much later, and i feel like i am missing out a lot by not being present.  we have alot of fun. 

3. at this point in my teenage years they should  loosen the reigns a bit and not really care about what time i go to bed at (within reason, lets say 11:30. 

&amp;#x200B;

its just really frustrating and i feel like i should be able to exercise good judgement and not have to bow to such a weird rule at 16.  i get that i am still technically a kid, but its frustrating and stops me from talking to my friends.

&amp;#x200B;

now my mom´s side is that i need to chill without electronics before bed and that  the screen colors effect how soon you are able to get to sleep. this is bullshit because phones and laptops now have a buit in setting that doesn't emit light harmful to   sleep cycle´s.

&amp;#x200B;

thoughts?",02Nov2020,1
101,I'm not American so can't vote in the election. I really want Biden to win but I placed a bet on Trump winning. This might sound odd but hear me out. The odds are thankfully quite low for me winning. I placed the bet because I'm super unlucky when gambling and I'm hoping somehow me placing a bet on Trump means that I won't win and Biden will become president and the world will be slightly better? I basically want to do something practical and I obviously can't vote so I feel like me placing a bet when I'm really unlucky is my own way of trying to change the path of the universe. Sounds stupid but does anyone else feel like sometimes they can change how the big things in the world turn out through tiny acts?,02Nov2020,1
102, [**I'm looking for a vintage collector (dresses)**](https://www.reddit.com/r/AskReddit/comments/jmseo0/im_looking_for_a_vintage_collector_dresses/),02Nov2020,1
103,"Aside from medications or health problems that would lead to weight gain of course.....

What’s your opinion of this? I always find it cringey when I see a couple on their wedding day...supposedly the highlight or best day of their lives, and they both look like fat slobs. Not even trying to be mean 🥶 I know it sounds harsh, but I just feel like....really? I mean especially two obese people. It just seems like they skipped the part where they’re suppose to take care of their health and appearance first. Not just for their partner, but more importantly for themself. How do they just give up on their health and appearance...and then parade around all happy on their special day? Because the majority of the time, you’re not going to look as good as you did on your wedding day after that. It’s usually all down hill from there...so if one cannot even muster up them motivation and energy to get in decent shape and health for their wedding day...? Then wtf man? When I see two obese people getting married...I can’t help but to feel like...damn...these people really just don’t give a fuck do they? Like..they are totally okay and accepting of the fact that they are both lazy, whales, who most likely have no plans to change or better themselves....yes I know, I know , I sound extreme lol but isn’t it kind of true?? If a persons wedding is usually one of the most important days in a persons life, and they show up at the alter a whopping 50-100lb more than they should be...don’t you think that’s a major red flag? It shows a few obvious things about this person...like the fact they don’t respect or honor the body they’ve been blessed with, and that they’re not motivated....so unmotivated that they couldn’t even put in some hard exercise and dieting to look somewhat fuckable on their big day. Or how about that they don’t respect or care enough about their partner to show up and look good for them and their visitors on a day that will be remembered forever, while being heavily photographed. Listen, I love the fact that they’re obviously showing acceptance, because that is a good thing. But I can’t help but to feel like their both accepting all negative things. Accepting laziness, lack of self control, complacency, future health problems, etc. I know a lot of people hold such heavy value in getting married to feel that acceptance and the feeling of being loved...but I personally think they are skipping a few steps in life and are searching for love that they are missing in themselves. I think if you genuinely love and care for yourself, you put your body and your health first. You honor the amazing gift you’ve been given and choose decent foods for your body. You exercise not just to feel good, but keep off extra body fat so that you don’t create imbalances and potential health problems. I just don’t see how a relationship between two fat/obese people can’t be toxic, if they are not working towards becoming healthy and better themselves, therefore bettering each other. Just me?",02Nov2020,1
104,"My parents come visit us for a day every two weeks and just hangout, eat good food, talk, etc..feeling so grateful for the relationship all four of us have. My mom and I stepped out to go shopping yesterday and my boyfriend and dad were comfortable enough to just stay home together and my dad even napped on the couch in front of him, LOL! We ended the night with a cheesy group hug, which is kind of embarrassing, but also very sweet. I feel surrounded by love.",02Nov2020,1
105,"If you’d quit treating me like I can’t do shit by myself then I wouldn’t be feeling this shitty. I’m NOT a child, let me do my fuckin work, every time I go down there you say “DID YOU DO YOUR WORK” You don’t even care enough to try and understand what it feels like because you’ve never had to take online school, you’ve never had to do everything that we do, fuck you. Just let me be",02Nov2020,1
106,Just super bored. Talk to me. :),02Nov2020,1
107,"I’ve been on and off with this girl for 3 years and she just cheated on me this weekend at a party that I WAS AT. She’s cheated on me before, too. She’s completely ruined my life. I used to have friends and everyone would tell me I was the happiest person they knew. I was genuinely so happy. Now I cry all the time and am depressed and anxious. I hate myself. I am trying to move on but it’s so hard. I have never felt so empty and low. I am trying to cut her out but it just makes me feel even more alone.",02Nov2020,1
108,"Hello friends. I discovered a YouTube channel, name : UCOFY.  this youtube channel provides tutorials on how to make money online I am also a viewer of this channel and thanks to the trainings provided by this channel, I started to earn between 30 - 50 dollars per day. I wanted to share this experience with you, maybe there are those who want to make money online. 

&amp;#x200B;

So what are your ideas about making money online?",02Nov2020,1
109,"Hey! I need around 500 comment karma to get into a go fund me sub Reddit. I desperately need to share my gofundme and Reddit seems like the best idea, the only issue is I can’t post there!",02Nov2020,1
110,"I really need a place to vent about this friend where I know she won't find out. Advice is ok, but not necessary.

I have a friend ""Jane"" that I've known since I was in high school (about ten years ago), and we've kept in contact pretty consistently since then. We were close but never really hung out a lot in person due to differing schedules: it didn't help that Jane and I had long stretches of time where we weren't in the same state or were too busy to talk. We were both appreciative of each other's presence in our lives, though, as we were both eccentric outcasts who were extremely nerdy.

Jane had lived a troubled life: her parents were abusive; she was severely bullied; her many mental illnesses negatively impacted her quality of life (she is bipolar, autistic, and ADHD); she didn't have many friends because of her mental illnesses that made her a prime target for bullies; her sister got cancer; and she had suffered long-time abuse from a boyfriend. Thankfully, she has overcome most of the trauma she faced (she moved out of her parents' house; she got a therapist to cope with the bulling and the mental illnesses she has; she is properly medicated; she is pursuing her passion in music and art; her current boyfriend is nurturing and supportive; and finally, her sister beat cancer and is currently in better health). 

However, the problem is this: Jane keeps bringing up her past trauma in graphic and intense detail during conversations where it's only tangentially related. I understand that this past trauma defined her and shaped her. I am deeply and intensely sympathetic, and I don't think anyone should have gone through what Jane did. She is now living a happier, more stable life that she so desperately longed for as vulnerable teen. My problem with Jane isn't that she's trusted me to vent, or that she's proud of what she's overcame, because I love that Jane has found enough peace to talk about her trauma more openly. I have a problem with how often, openly, and graphically she brings up her trauma. I don't know how to enforce boundaries with her and I feel like I can't stop Jane from talking about her trauma because, despite my discomfort and unhappiness, venting makes her happy. 

I wish I knew what to do.",02Nov2020,1
112,"My boyfriend and I want to have a three way, and he suggested one of my friends. How do I ask that and what is the least awkward way to do it??",02Nov2020,1
113,"When I find out that someone in the past died at a young age, i feel bad. What if that person didn't die? Would they be successful if that didn't happen? I don't really know if this something common. Feeling bad for deaths is usual, but thinking about a young person that died and feeling that guilt really hits me.

For example, if someone that wrote a book or made a company, instead of growing up, they died when they were kids, that would be a waste. That company or book wouldn't exist.",02Nov2020,1
115,"I've been wondering, why do some people log on discord to only have a 'do not disturb' status EVERY TIME they log in? I feel like calling them out by posting a random comment on the channel but they might get offended lol. what do you guys think? have you ever wondered the same?",02Nov2020,1
116,I feel like my voice is very high pitched. It can sound at times like helium or like there’s a veryyyy strong pinch in the background making this nasally baby sound. Sometimes I have nasal fry and I think that’s from embaressement of my voice. When I hear a video of how a four year old boy talks that’s how I naturally sound. It’s not very soothing and it’s honestly pretty disturbing to listen to. I’m a 20 year old female. I know I shouldn’t care what people think but I always have to be aware of my voice at least a little because it can really make someone wanna cover their ears- and who wants to sound like that. I’m genuinely not over exaggerating about the sound. What causes this,02Nov2020,1
118,I just feel like I’m sinking constantly,02Nov2020,1
119,"I literally considered him one of my best friends. We grew up playing video games, watching sports, helping each other cheat on homework, and just hanging out in general. I went to Mankato and he went to Augsburg, colleges that are a little under 2 hours away from each other. I have reached out to him via text many times since August, and I have no reply. I am worried/confused with what happened. Additionally, I’m thinking that the friendship wasn’t mutual. Gets me sad thinking about how I probably won’t see him again.",02Nov2020,1
121,"I feel much more confident in myself now but for some reason it feels weird. I'm so used to holding myself back because of insecurity, I'm not as scared of that as I was anymore, but still, it feels weird.",02Nov2020,1
122,"Recently, I've noticed something worrying. There was an incident where a close friend turned on me and spread things I told him as secrets that he mustn't reveal at any costs. When that happened, I went through a huge change of personality on the surface, but I remained the  same person internally. Acting to hide who I am is fatigueing and I am unsure of my ability to hold the façade any longer, but I fear betrayal and I never want this to happen again. I've worked hard to restore my reputation and my mental health has seen rapid improvement since the incident, yet I struggle to defeat this demon of mine. 

If you have any suggestions, tell me please.

Thank you in advance",02Nov2020,1
123,"Everything is incredibly hard for the moment.

I got fired from my dream job because of reforms in the team. I'm currently suffering from a back injury  which messes with my physical and mental health a lot. And now my long term partner wants so breakup with me. All this in a span of less than a month...

I've been trying my best to keep my head up but when the nights grow longer, it's very difficult to stay positive and productive... 

I feel lost and don't know what to do now...",02Nov2020,1
124,"I was hiking and all of a sudden recoiled when a fly dove straight into my tear duct and got stuck there.  It rolled around back behind my eye and I felt like ""Fly in my eye Johnson"" for a bit.  After 20 minutes and some eyedrops, the dead fly washed back out and stuck to my eyelashes.  I was very grossed out, but it felt representative of 2020 as a whole.",02Nov2020,1
125,"so i met this guy like a year ago on tinder. it wasn’t anything serious just casual. we met up once but i was super awkward bc it was my first time trying out a “hoe phase”. i asked if we could meet up again so that i could redeem myself LMFAO and he told me he was going back to his ex girlfriend. i got really angry bc he didn’t tell me that he was going through a breakup phase and that there was a lingering ex girlfriend. i was super upset and i didn’t contact him at all. i was angry at him for not telling me but i was also angry at myself for catching feelings when i shouldn’t have bc it was just a hoe phase. like 6 months ago he contacted me again saying that he broke up with his girlfriend officially and wasn’t going to go back to her. i was really angry at first and i told him off, but eventually calmed down. i told him he should’ve told me what was going on before we met up the first time around. i just wanted clear communication. we talked for a bit but then we kinda fell apart. just last week i made a new tinder account and i saw him around and i really wasn’t thinking and i swiped right. i didn’t expect him to swipe right too &amp; we started talking again. right now we’re just platonic but i know i should completely cut him off but for some reason i fucking can’t!! UGH why do i do this to myself",02Nov2020,1
126,"Okay to start, thank you so much for being amazing people and such nice wallflowers in a world of degradation. I know this site isn't perfect, but it's good enough for me and I think it's time to use it to the best of its ability.

I know this is a weird-ass question, but I've always dreamed of having a best friend or at least a close to me friend, and I've tried everything from best friend-making apps, message boards, chat rooms, discord and it's always failed. I'm not obsessed with finding a new friend, shit I wanted a best best friend since I was 2, but never got it, I'm just searching for a friend now. Just a friend who hopefully lives nearby or can talk on skype.

Because of me, unfortunately. But I'm getting better and just want a friend who will like me and I'll love them for them. 

I can be a great friend man, I can set up movie nights, meetups, send gifts, skype, etc. I can talk about anything with you and ramble a lot and send texts and emoticons to help you feel better.

A few things about me:

Live in North Carolina

&amp;#x200B;

I'm obsessed with tattoos

&amp;#x200B;

Questioning Christian

&amp;#x200B;

I'm female

&amp;#x200B;

I love writing, art, singing, reading, and using my cell phone

&amp;#x200B;

I'm not a tv watcher, but I am a streamer

&amp;#x200B;

My favorite food is chicken

&amp;#x200B;

I have bipolar 1 and depression (just laying that out there)

&amp;#x200B;

I'm a huge animation fan and love my little pony (yeah I'm a pegasister lol)

&amp;#x200B;

I love talking about anything, but also suck at it so if you want to spend time talking about you, go ahead, but sometimes I drown in my own sorrows, so give me a heads up if I veer into emo.

&amp;#x200B;

I'm emo as fuck sometimes lol, but also a huge nerd girl

&amp;#x200B;

I  love sleeping and napping

&amp;#x200B;

Spend most of my time at home

&amp;#x200B;

And I'm starting a youtube channel and need a voice artist, so if you can voice with me on my channel, whenever it's created that'll be great.

&amp;#x200B;

Okay think that's it, geez I hope this works and I don't come off as superficial, but I love reddit so far and think this is the best place to find a new friend especially in this subreddit.",02Nov2020,1
127,Would post in shower thoughts but hey I couldn't.,02Nov2020,1
129,"so i am 16 now, but two years ago i returned to the town i had spent elementary school in, and there was this girl. now i hope this doesnt come off as rly creppy, and i mean this in the most wholesome way possible: she looked adorable in hoodies. like, really frickin adorable. it was always the best part of my day when i saw her.  i would take the long route to class to go by her locker just to see her. she was really nice too, we just didn't talk much and i moved away at the end of 8th grade. 

&amp;#x200B;

but yeah, she is probably still adorable and i didn't and do not have a shot in hell. have a good night.",02Nov2020,1
130,"I try to keep busy with hobbies, but when I let myself relax, I have this sinking feeling that I’ll never actually be happy. 

I’m not sure why I feel this way. 

I have a good, well paying job. I find it very boring and purposeless, and it’s hard to stay motivated to be productive a lot of the time, but I’m glad to have a fairly stable job in light of this years events. I’ve been very lucky in that way. 

I have a relationship that’s really good. I do struggle with shame and feeling like I’m not good enough at points, but he’s reassuring and reliable and we are able to talk through it. 

I also have hobbies that I enjoy. 

But regardless of all this, my default mode is to feel very very hopeless &amp; empty. 

A few things about me - I’m 28, very introverted, ADHD, and pretty sure I have CPTSD from consistent emotional abuse as a kid (based on what past therapists have said).  I also don’t have a stable family. Everyone has split off and we havent had a family unit for almost 10 years now. I think some of my feelings comes from feeling very lonely, even when I’m with people. It often feels like there’s a glass wall between me and everyone else.  

Sometimes I think about quitting my job because that does contribute to my unhappiness, but I also feel that this won’t fix anything. I also worry that I wouldn’t be able to “pull it together” enough to find employment again. 

I also think world events have worsened things for sure. Things feel unstable, even as someone in a very lucky position like me. 

But ultimately, this all feels like a problem with me and how I see things. I’m in therapy again and sometimes I think it helps, but I also am struggling to see how things can get better. 


I worry because if it weren’t for my bf, my few friends, and my job stability, I really don’t know where I would be mentally rn. Even in my current mood, I have entertained the idea of ending things but ultimately I don’t won’t to give up just yet and I am also scared to do that.  I would also never want to put family and my bf through that. But if this nagging feeling we’re to get much worse or if circumstances got much worse, I’m not sure what I would do. 

I’m sorry, I know this was dark. I’m just struggling and don’t know what to do about it.",02Nov2020,1
131,Or it’s because my devices eavesdrop on my neighbors speaking Spanish,02Nov2020,1
132,"TL:DR; did 325 mg of DXM, read a poem, was awesome. Miss that feeling over a year and a half later.

I don't ""do drugs,"" I don't even drink alcohol. However, the summer before last I was feeling terribly apathetic. I had just started my first ""real"" job in the form of a corporate summer internship, and I was facing that existence for the next 40+ years. This fact depressed the hell out of me, I don't think I have ever been so numb.

Not even a month into this internship (which was pretty cushy in hindsight), an idea formed- I'd ""trip"" on DXM. I completely forget where I got this idea, but I remember thinking about it on a Wednesday and two days later I tripped. Because I like to think ahead, I decided I would buy it on Thursday, which I tried but the Walgreens cashier denied me since I wasn't 21... a day later I was at CVS and, despite this cashier eyeing me, I got the goods.

I won't go into specifics of the trip itself, other than I had no idea DXM lasts so long in the body (which resulted in me staying up late into the morning). However, one thing that I did find lasted after the trip was how great music sounded. I could hear all of the instruments, separately. This lasted like a week after the dose. It was awesome. I know the ""afterglow"" isn't supposed to last that long, but I was just at peace for this time. I easily beat back intrusive thoughts, and I was laid-back.

But the greatest, most memorable part of the one time I ""did drugs"" took place 4 days after I tripped. My parents were having a party so I decided to go on a walk to the library and listen to music or surf Reddit. I went up to the quiet floor and sat at one of the solo desks in the corner, but I decided to check out some of the books in a nearby stack, and I saw a book of haikus.

This book of haikus wasn't your standard ""haiku"" book, the entire point of it was to show that haikus don't have to follow the classic form of a haiku to be haikus. The first poem, where the author tried to illustrate his point, was a 2 line poem. The first line described a black crow, which might not sound like much but I could easily envision that crow. It had life, it was flying. I wasn't hallucinating, I could just imagine it very clearly. This line was pretty good to the after-glow-version of me. But the next line threw me for a loop- this line described two mountains, where the crow flew between. I could see these massive, snowy, mountains that were littered with bare trees. The scale between the huge mountains and tiny crow was awe-inspiring. I had never been so moved by a poem before.

Anyway, I rented the book and showed it to my friend, but they just weren't impressed, but I was reminded of the poem today. My science professor was trying to explain the beautiful intricacies of math, and compared it to how a poem might not seem like much, but that's only because you don't know what to look for- even a 2 line poem can convey meaning through structure and composition. The only other time where I could ""envision"" landscapes and whatnot in my mind so clearly as I did that day was a few months later when college had started back up, and that time coffee was to blame (something I also don't drink that often).

Remembering back to it, it makes me sad. I've always sort of struggled visualizing fiction in my head. I don't really intend on doing DXM again for other reasons, but that afterglow was something special. I felt motivated, and what's more, I finished that internship. I want to be a fiction writer some day, and it's hard for me to visualize things well. Hate to see it. I have considered trying mushrooms for this reason.",02Nov2020,1
133,I’m about to confirm a coffee date with a girl I’ve been texting for a week. We met at a party when we were both drunk so I feel like we’re meeting for the 1st time again. We both describe ourselves as shy so we agreed to get coffee as something low pressure. I was wondering if someone could give me some do’s and dont’s to leave a good impression (:,02Nov2020,1
