,text,time,score
30,"We had a death (not Covid related) in my extended family.  It was sudden and very unexpected. As expected everyone is quite devastated. 
Half of my immediate family will be traveling a few hundred miles to go to the funeral. I understand why they want to go and would never try to dissuade them from going. But what scares me is that a couple of those people live here with me and a baby. I don’t want to say their relationship to me because so many of us have reddit accounts but they’re close enough in relation to make it next to impossible to distance myself from them for two weeks when they return. I’m scared because I know at funerals people are emotional, they let their guards down and I’m worried Covid will be spread around to people and brought back here to me and the baby. I’ve thought about this and I can’t stop thinking about how people if they’re feeling ill may not go to a wedding or a birthday party, but most people won’t want to miss a funeral and there’s no restrictions on how many people can attend. I’ve been assured everyone will be careful and safe but what does that even mean at a funeral when people will be hugging and crying and noses will be running? 
I can’t just go and stay with a relative here for two weeks when they return because any one of them who I could stay with all have at least one person from their household also attending this funeral. I even considered getting a hotel room and moving into it for two weeks upon their return just to make sure no one gets sick when they get back but it’s just too expensive. 
Am I overreacting? Being too paranoid? Throughout this entire thing I’ve been of the mindset that I’d rather be overly cautious than under cautious. I don’t want to be insensitive to what’s going on and I 100% understand why they want to go, why they need to go. I’m just...scared.",20Aug2020,1
31,"We made this channel as a way to connect back to our hobbies like art and to also record our life experiences digitally. Please subscribe (if you would like to), it would be greatly appreciated! :)

[https://www.youtube.com/channel/UC8AOutIlsT\_iJLw9IRONehA](https://www.youtube.com/channel/UC8AOutIlsT_iJLw9IRONehA)",20Aug2020,1
32,"I don't drive because

1. I never got my license
2. anxiety
3. I have a hard time paying attention
4. my muscles jerk uncontrollably so it wouldn't be safe anyway

so please stop asking",20Aug2020,1
33,"I’m very introverted and naturally a very quiet women. Sometimes I feel like people take offense to this. I communicate when it’s necessary, or job related, but otherwise I don’t want to know about your life and I don’t want my coworkers knowing about mine. I don’t make small talk, or try to get to know people. I’m just there to work and get paid. What is so wrong with this?? This frustrates me when I feel like people dislike me for this reason. Simply bc I’m not friendly enough, or want to be their friend. I’m not angry or sad, I’m just very comfortable being quiet. Why is this a flaw? I’m completely okay with not being noticed by everyone else, but when I find out that people are talking negatively about me, I feel so confused. I may not be the friendliest person, but I treat everyone with respect. In the past I have tried to be fake and act like everyone else, but I can’t keep up the act for long. I’m finally at a point where I’m beginning to feel more comfortable being myself, even if people think I’m boring, a nerd, and a loner with no social skills. I have social anxiety and constantly battling depression. It’s just annoying that society holds certain expectations of me.",20Aug2020,1
34,"As the title states, I find that when I’m constantly browsing alongside watching the same live versions of songs instead of just the spotify or apple music perfect versions. Not to say that the music videos that aren’t live aren’t fun to watch and that I don’t! 

For example, even though it’s not flawless - I feel it adds more meaning but videos such as:
-Iris by Goo Goo Dolls in Buffalo, NY
-Broken by Seether ft Amy lee 
-The waiting - Eddie version w The Heartbreakers 

I could list more but just a few examples!",20Aug2020,1
35,Canonized Zombie Blacksmith,20Aug2020,1
36,"Ex girlfriend hasn’t seen me since we had to leave the office we work at when I was 350 pounds and single. She saw me today at 270 and a new girlfriend next to me. I’d have to say after the way she left me, this shit was a great feeling.",20Aug2020,1
37,"I think I will forever compare other men to him and the way he treated me. For so many years I had been disrespected and manipulated by someone who was angry, callous, and pessimistic.  Then he walked into my life and treated me better than I had ever been treated before. So kind, sweet, gentle, and sincere, but we were only friends. He’s a such a good man. I can’t tell him all of this yet. It’s killing me.",20Aug2020,1
38,"I have both social anxiety and depression. I can have a hard time socializing with friends, family and even my boyfriend. 


It only gets worse when I’m at school. I’ve been bullied for all of middle school and I feel as though everyone my age is out to get me or they hate my guts somehow. I can never function normally and I feel like every move I make will result in me being bullied or hated. 


I hate this. I hate myself. I strongly envy the happy kids I see at school who can easily socialize with their friends. I can’t relate. Not at all. It’s torture knowing you’re the oddball compared to everyone else. I’m the weirdo who can’t talk or socialize. I’m the weirdo who’s afraid of everybody. 


Because of my social anxiety, I got more and more suicidal. I just don’t have any hope. I’d blow my brains out if I could. I feel like this is my life now. I will always always be scared of everybody. I doubt I can even get a job one day.


And it doesn’t help that I have a hard time living in my house. I hate this. I want to die.",20Aug2020,1
39,"I’m pretty excited about it. I think it would be both challenging and rewarding. It pays better than my current job and is a lot closer to my house. I love some things about the job I have now (working with troubled teens), but it’s taking a toll on me emotionally and physically and I’m not supported by the management team at all. I’m extremely underpaid and it’s just not worth it anymore, unfortunately. But this new job is similar, in that I would be able to make a difference in people’s lives, and seems like a bit fit for me overall.  I would get to use all of the skills I’ve learned throughout my career in the medical field, which is really exciting too. They seemed to like me, but it’s hard to tell sometimes. Wish me luck?",20Aug2020,1
40,So women dont have testicles but they have breasts which can spit milk so dosent that mean we sucked off our moms?,20Aug2020,1
42,"My stepmom is very unconventional. In every way possible. I don’t know what it is or why. When my dad buys me and or sister anything, it’s an argument. She searches my room while I’m gone to see if there’s anything new. (Searched my room and saw I had a credit card, got mad because he didn’t put her daughter on his credit line and they argued). She’s a hoarder, will have shoes from 12 years ago she never wore and when my dad throws it out she has the most child like temper tantrum I’ve ever seen. She can’t manage money at all. (“Lost” 5000$ and got us kicked out of an apartment). I feel like she just is leeching off my dad, and because he has 2 kids with her he doesn’t want to leave. I wanna help and say something to him about how he should leave, but at the same time sometimes they really seem in love until it all goes bad. (Had to stop them from physically fighting because I needed the car to take my SAT and then come back home). I don’t know where or how to even begin. I just don’t want to see him at 60 or 70 years old miserable because she won’t let him be happy.",20Aug2020,1
43,"I know this seems so petty but damn it shit sucks. Everything I want to be good at, he is. Everything I’m good at he is. Like I know I’m my own man and whatever but every time I see him I’m just reminded of my shortcomings.",20Aug2020,1
44,"Hi,

Looking for participants to help with my thesis research by answering some questions about relationships and interpersonal support: [https://researchsurveys.deakin.edu.au/jfe/form/SV\_4YhOZzqRyygMGFf](https://researchsurveys.deakin.edu.au/jfe/form/SV_4YhOZzqRyygMGFf)

Generally, the study takes about 20-30 minutes.

The findings of this study will help identify and develop treatments for people who self-injure, or are at risk of self-injurious behaviour. Both participants with and without a history of self-harm are encouraged to participate. Responses are anonymous, and participants will not be able to be identified at any point. Data will be stored on a secure online server for 5 years.

Participants will be presented with the opportunity to enter the draw for 1 of 3 $50 VISA gift cards upon completion of the study. This will be provided through an anonymous link, so that the entry cannot be linked to the participant's responses and preserve anonymity.

Thank you. :)",20Aug2020,1
45,"Wecolor 50 Pcs Disposable 3 Ply Earloop Face Masks, Suitable for Home, School, Office and Outdoors (Blue",20Aug2020,1
47,"My sister and I have had these two cats since they were kittens, and I don't know how to handle the fact that they'll age and get sick and die. One of them, my cat, Galileo, has lost a lot of weight and pees a lot more recently. I've had these cats since I was in middle school and I don't really know how to process the fact that they will die sooner or later. Am I supposed to fill the void in me from my cats death with another animal that will eventually die and to repeat the cycle? Or am I to never have another pet and be mostly free from having these feelings of loss from death.",20Aug2020,1
48,"I know by the title, it doesn’t seem the most interesting, but I just wanted to put my good news out there.

For the last year or two, I had been wanting to go out with someone and I really wanted a girlfriend, because I kept associating having a girlfriend with having happiness. But in the last few month I realised I have to find happiness within my self, and I know that if I can’t love myself how would I expect anyone to love me. So I made the big decision to work on myself, and when I made that decision, not even 3 weeks later I got asked out by a girl, unfortunately I did have to decline as I wasn’t really in a good head space.

But this past week I had been seeing amazing improvements with myself and my mental health, and this other girl practically fell into my lap. I had ordered food last night, and found a note asking “how you been?” It had a name and number, so I decided to message it. Turns out it was meant for a different person because we shared the same first name and had the same last letter initial. I had explained to her I was the wrong person, but would be happy to be friends with her, which she agreed to. And we had been talking all day, and she had asked me if I would like to go out sometime. I was nervous, but I really wanna push myself out of my comfort zone, so I agreed. 

And now I guess now I’m going on a date? Or I’m just hanging out as friends with her, but I don’t even know. Still happy, but nervous",20Aug2020,1
50,I’m in y10 and my exams are coming up but I’m really dumb all i Do at home is lay down or play games and I want to know how can I get better grades in school and how can I pass my exams In time I’m depressed because I have Arab parents and I have a older brother who failed his exams and then became a road man and my parents keep saying I’m going to be like him which gives me depression and sometimes I just cry and say to my self if I fail my exams I kill my self so they don’t need to look after me I’m in the uk by the way,20Aug2020,1
52,"Type 1 Diabetes Fundraiser

I’ve been a Type 1 for almost 14 years and I’m always trying to get involved to raise money for JDRF, although my attempts to raise money in the past haven’t been too great.

I was wondering if anyone in this sub would be willing to donate to a good cause? (tax deductible of course) 

Just PM me for more information if you’re interested and I’d be happy to give you any information you require :)",20Aug2020,1
53,I really love being around people and in my head I want to make people happy and have lots of friends in my life. In reality it’s only a matter of time before I mistreat them. The sad part is that I know I’m doing it but I can’t stop. The best thing I’ve done for people is let them leave my life and watch from afar.   I’m very sad.,20Aug2020,1
55,"Yes my father is doing this rn and I don’t even feel uncomfortable, I might be dead in few minutes!",20Aug2020,1
56,What am I doing with my life?,20Aug2020,1
57,"Don't waste your youth on shitty people. That includes shitty family, friends, relationships. I wasted my late teens and early twenties by being insecure and pathetic, a Koopa Troopa walking back and forth looking for a Mario, getting stomped on and going into my shell every time. I ended up getting trafficked ffs.

What I'm saying is...for your early adulthood, don't hesitate to cut someone off if they treat you less than you deserve.",20Aug2020,1
58,"I had a long battle with the damn phone storage, I’m not sure if it was a last updates issue or if it was just my phone, the “Others” storage from my iPhone kept taking all the space from my storage, I only have 64gb phone and that bitch stole almost 40gb from it, not including the “System” which was 6gb.

I had to delete so many things from my phone and the “Others” kept stealing the storage all back, I could’ve freed a good 4gbs and less than an hour later it would all be gone &gt;:(

And today I finally found peace, I got an update notification for my phone. It was gonna update tonight but the storage didn’t let it, and after searching for options to free my storage, I found on the actual Apple website saying to update the phone to this current version and I was like “Why not, I have nothing to lose, maybe just a little more storage”

And I did it, and then I stayed 20-30 minutes just watching my storage finally having more space, I’ve never felt more satisfied.

My storage use before was usually 63gbs

Now it’s 28.4gbs

This was the most useless post ever, but I felt like I needed to share this.",20Aug2020,1
60,"The pandemic has changed a lot in all our lives. One thing it's done for me is really made me reflect on where I am in life, what I want from it, and largely how I'm not that happy with it.

On the face of things I should be happy, and I know some of my friends and acquaintances look at me in some form of envy. I'm in my early 30s, married to a beautiful and caring woman, have a well-paid job with a good level of disposable income, I have a nice car and a nice house and generally I should be happy. I'm not though, really. I spend far too much time looking back and thinking about what could have been. I have so many regrets about chances I didn't take that I'm left stuck with this heavy feeling in my heart that I've wasted so many opportunities in my life.

On the job front, I'm considered an expert in my field. I'm invited to speak at conferences, I've mentored a few people and helped them achieve what they need. My boss described my knowledge and expertise as ""unparalleled"" the other week. I'm paid pretty well for it too. The problem is I've essentially been doing the same job for the last 7-8 years, albeit it in 3 different organisations, but the crux of the job remains the same - it's just different people I'm dealing with. I've been thinking I need to find a new career, however I have no idea what I want that career to be. My plan since I started working after leaving uni has basically been to earn as much money as I can and ensure a comfortable life for me and my family. I'm at a level as well where if I was to start a new career I'd probably have to take a bit of a pay-cut to get it as my job is very niche, and other jobs at a similar level need specific experience in the role. I've applied to a few things in the last few months, but no luck so far. I'm jealous of my wife as her job is her vocation. She's constantly learning and improving and trying to be the best she can be, which sometimes I think is unhealthy because she never really switches off from it, but I'm jealous because she loves it and she's committed to it where as for me, I do my job but if I'm not working I don't want to think about it. 

I've thought about writing a book. I've had an idea for a novel in my head for a long time, so I started writing it in the early stages of lockdown but I just don't think I'm a good enough writer for it to be anything more than just a private hobby. I've written a chapter, or most of a chapter, and it feels cliche'd and poorly written. I know that if I practice writing more it should improve, but I'm so critical of my own work that I don't feel I can get past that, never mind daring to show it to anybody else to rip it apart.

There's the other issue that I'm not sure what my future holds now. Before getting married, my now-wife and I used to talk about having kids and we tried for a while with no success. She's now feels that she doesn't want any now, and I still do. Naturally, things can change and I'm going to see about getting tested to check I actually can have kids but if she doesn't change her mind I'm not sure what I'll do. I've always wanted a child and the thought of not experiencing that in my lifetime scares me as there's a pretty limited time-span on doing that.

I also feel that during lockdown my wife and I have actually drifted apart a bit, despite spending so much more time together. I know we love each other, but it feels like we're more like best friends now rather than husband and wife, and she said the same thing to me recently.

I feel like I'm in a mid-life crisis despite, hopefully, not being at mid-life yet. I look back at 30+ years gone by that I could have spent better and look to the future with no idea of what it entails, and it feels more and more like life is just passing me by. I don't know what my purpose is, I don't think there's any meaning to it, I'm just a passenger. Honestly, my mortality is now beginning to scare me. I'm very much an atheist and strongly believe that when I die that's it, but I wish I believed - or that there is, something more afterwards. Maybe a chance to live my life again, or live another life in another body.

TLDR; not sure where my life is heading nor what I want from it, but feel like I've wasted a lot of it and I'm running out of time to figure it out.",20Aug2020,1
61,"25 years ago I drove to rehab and told myself if shit wasn't better in a year, I could drink again. I guess shit got better because here I am.",20Aug2020,1
62,Or am I just a dramatic little bitch?,20Aug2020,1
63,"So, basically, I'm 15 and I've been having generalized anxiety for a few months now. This was probably caused by the Covid suddenly coming here in Italy giving me anxiety. Since I realized that I had anxiety, I immediately went to a therapist, because I knew that was the best thing to do. And therapy actually helped! My anxiety gradually got better and I was happier than before. But a week ago something changed. At first I started feeling less and less emphatic and generous, and lately I've started to lose interest in music, humor and video games. I wasn't an avid gamer before, but games were a great passion and distraction from my anxiety. The same thing with music. I think I lost the ""feel"" for music. I dunno how to describe it, but it just doesn't exite me anymore. This has also kind of happened with memes on the internet. I don't laugh at them anymore. No matter what the image/text is, I don't laugh at the anymore.

Now, if any of that happened separately, I would've thought that it was just my anxiety acting up, like it happened before. But all of these happening one after the other, it seems pretty weird.

I'm pretty scared about having severe depression. I always calmed myself by saying that my anxiety was pretty mild and that I wasn't like all of those people on the internet who had depression for years, but I'm scared that I'm becoming just like them. Like, my mild anxiety was pretty though to deal with for a few months, imagine me dealing with severe depression for years! I'm scared that I will become just like those depressed people who don't find enjoyment in anything anymore and want to kill themself.

It's also weird because my life hasn't gotten any worse lately. Quite the opposite really! I've started to get better with anxiety, the virus in Italy just started to go away, I started to see my friends again and I went on vacation a few times. And my friends and family are as healthy as they can be! So it's pretty irritating that just because my mind said so, I will now live a sad life and I wont be able to live happily like before all of this mess.

Other than depression though, I think I have some other reasons to all of this. Lately I've started to dream in my sleep more and I was also starting to rest more. I also started to always wake up with a dry mouth and a bit of a sore throat. I searched my symptoms online and I might have Sleep Apnea, which sometimes causes mood changes. Also, and I know this is embarassing and that's the reason I made a separate account for this, my libido is pretty down lately, and I read that this could be caused by this.

Also, talking with my family about this, they all said that this could be just caused by the hormones in my body acting a bit up. My cousin said for example that this is all Norman and she also went trough this during her teen years, and it all went back to normal after some weeks. They also said that this could be due to a lack of vitamins or minerals in my body.

This could also be my anxiety making me belive that I have severe depression to scare me. This could also be because I hit the back of my head slightly on the roof at my friend's house! I really don't know. Also, the reason I'm not going to therapy for this is because my therapist is on vacation until September 9, so I can't really talk about this to her.

I'm pretty desperate about this. I'm scared that this will also affect my relationships with my friends. I want those interests to come back. Is there any chance this will happen?",20Aug2020,1
