,text,time,score
125,"work at a bar and one day I walked in to the glass wash room next to the bar and a girl I work with thats kinda new who I haven’t talked to was sorting glasses and stopped and was staring at me smiling and then looked away to the glasses still smiling but I thought nothing of it. The next weekend I needed to ask her where this food was going to as I was going holding the plates and she put her hand on my arm (around my arm I think like holding and I was wearing a few shirts underneath a black buttoned shirt 👔 and my arm is stick skinny too so idk if she thought that) as she pointed the table out, when I walked back round to wrap cutlery and she stood in front of the cabinet with her hands on her hips tilting her head left and then right slightly while she looked at me as I was wrapping cutlery on the cabinet and said ‘you make me sweat, Graham’ and I said ‘what?’ then she come to the side of me and held her arms out for a hug and smiled to which I backed off because I was like thinking ‘wtf’ she then dropped her arms her face went sort of sad then walked off. The next night we were on a close the pub shift and in the staff room at the end of the night as s was putting her coat and scarf on she said ‘I haven’t got a boyfriend you know, Graham’ I was standing at the doorway on my phone and the other guy at work there with us laughed out loud as he was on his phone and I looked at him then at her and she was looking back at me smiling after saying it and then looked away to carry on putting her scarf on in to her coat.

I’m 6ft tall and thin and lanky and she’s very pretty tbh",20Aug2020,1
126,"Flying so high right now, Burna boy- Bank on it, I want to make it a religion...self love man, believe in yourself, always. If you are feeling depressed, I’m willing to lean a shoulder , I’m willing to listen, I got secrets in my closets too.. lol",20Aug2020,1
127,"Iam very attached to my crush who happens to be my best friend,she rejected me long time ago. i have so many memories with her and i love her for 5 years. but me being attached means im literally obsessed with her and i text her everyday and only wanna be with her. every time i see she is hanging out with sum other guys im going so angry and suicidal and unstable. i wanna deattach myself... please. how can i do this?",20Aug2020,1
131,"1 year 3 months and 20 days. I broke up with my ex. It was a hard decision and it emotionally broke me for a long time. I got a new apartment 1 year 4 months ago. It was meant for the both of us. I thought she was the one and was ready to commit, so I got a bigger place for us to share. Well when we went our separate ways I kept the apartment, but he presence stuck in the apartment. A ghost if you will. This ghost constantly taunted me. Doing things that I feel she would've done if she was there with me. Playing games, watching movies, the list goes on. But finally. I got home last night. And the thoughts, the ghost was no longer there. I have finally let her go.",20Aug2020,1
133,"I met this guy at the club. I actually initiated the conversation, because he was attractive and I was drunk lol. We eventually went on a date and I met his friends. One of his friends, happened to be the sister of my friend. 
The next day, my friend asks me how I feel about this guy having a baby on the way. I was shocked! This guy never mentioned having a baby on the way. Apparently he had just broken up with the baby momma. But I was out of that situation faster than you can say trashy. I ghosted him. 
I understand sometimes relationships don’t work out, but omitting the fact you have a child on the way, is shady. Also actively dating, while the mother of your child is carrying your first baby, is just cruel and disrespectful to her.",20Aug2020,1
134,"So my cat came home today with a baby bunny in his mouth. Saw me and started shaking it like crazy, I frantically tried to pry the bunny from him, managed to do so but my cat had ripped the ENTIRE back off, basically skinned it. And so I called wildlife rehab. And they told me to humanly euthanize it, but my mom is insistent on putting fresh aloe Vera on its back, claiming it will help the poor bunny. She used to have rabbits, so perhaps she’s speaking from experience but there’s also wildlife specialists who actually studied and majored in this line of work. 
What do I do??? Please help!",20Aug2020,1
135, [https://evilhyperion.tumblr.com/post/626992067200057344/how-to-find-peace-of-mind-arcane-lost](https://evilhyperion.tumblr.com/post/626992067200057344/how-to-find-peace-of-mind-arcane-lost),20Aug2020,1
136,"Basically the title.

I started my freshman year of college this past year (2019) and I ended up running into this girl every so often on campus. I'll call her Sally. Sally was clearly socially awkward and would get waaaay too excited to see me (like I was a celebrity or something), which made me kind of uncomfortable but I was nice to her because I had no reason not to be. To be clear, though--I was nice to her and that was it. I didn't feel like I had a serious connection with her and I had no intentions of being friends with Sally. I just sympathized with being socially awkward and not having many friends, because I've been in that position.

My university sent us home after Spring Break and I pretty much forgot about her. To me, Sally was someone I barely knew so she wasn't someone I thought about much. It sounds rude but it's just reality.

Then, after the school year wrapped up, Sally emailed me through my school email. This was alarming to me because *I never gave her any of my contact information*. It wasn't a purposeful choice--it just wasn't something that ever occurred to me. Regardless, it was creepy and I felt like an implied boundary had been violated.

I tried to be nice and engage in high-level conversation with her, hoping that eventually the conversation would trail off, but I noticed fairly early on that Sally was making references to her financial situation in such a way that seriously made me feel like she was either a) building up to asking me for money, or b) hoping to hint to me enough that I would offer and she wouldn't have to ask. Among other things, she point-blank asked me if I ""have enough money"" and followed up by making a very conspicuous reference to not having enough money to make a tuition payment. Don't get me wrong, I felt bad and sympathized, but she's not my friend, I didn't know her too well, and I was *not* about to give her money.

I also noticed that she did not seem to be emotionally/mentally stable. I was getting a bad feeling about talking to Sally to the point where every time my phone buzzed, I'd feel dread because I worried it was an email notification from her. There were a number of things that weirded me out beyond the money comments and I was starting to feel trapped.

Eventually I tried to politely excuse myself from the email thread by saying that it's been nice talking with her and that maybe I'd see her on campus later after summer. Sally clearly got upset and said that she was hoping we'd be friends ""if it's okay with you"" (even though I was getting the impression that how I felt about this whole situation was irrelevant to her) and that she wanted to text me.

I had to shut it down then. There was no way I could continue being nice to her without giving her my phone number and that was a boundary I wasn't willing to compromise. If I gave this girl my phone number, I wasn't going to be able to get rid of her. I knew this with certainty. Anyone who has dealt with a mentally unstable individual and has gotten ""vibes"" knows what I'm talking about.

I sent her an email--firm but not mean or hostile--basically telling Sally the things she had been doing that had made me uncomfortable, why they made me uncomfortable, and that I'm sorry things had gone as far as they had. I said I would be completely in the wrong if I let this go on any further (which is true--I don't want to make her think that we're going to be besties when that's simply not the case), and that even if she hadn't made me uncomfortable, there's simply not that connection between us that's necessary to be friends. I told Sally that I was sorry, and I wished her well.

No response.

I later on mentioned Sally to a few of my friends during a Zoom call, venting my frustration about people who don't respect boundaries and won't take a hint, and I complained about the fact that I didn't know anything about Sally but she was hinting that I should give her money. I learned immediately afterwards from my friends that she was well-known for harassing other students in a particular group. This group is a merit-based program that myself and the friends I was Zoom calling are part of. Apparently she harassed one of my friends on that call in particular about getting her into that group, even though he was just a student like her and obviously had no way to get her in even if he wanted to. You have to apply and be approved by the faculty, not another student. There had been a few things during my email thread with her that told me that she wasn't quite connected to reality, but hearing this from my friends really confirmed my suspicions.

So now I had evidence that she had a pattern of behavior of harassing students, particularly those in this merit-based group. At this point, I definitely felt like I'd made the right decision in telling her to leave me alone, and the last vestiges of guilt vanished. That was back in early July.

Then, last night... I'm one of two Vice Presidents of a particular club and I was on a Zoom call with the other members of the executive board of that club. I had long ago decided to let the Sally stuff go unless/until something with her came up again, but someone else on the call mentioned someone wanting to join the club. This person had the same first name as Sally. I asked for the person's last name, and it thankfully was different from Sally's so it wasn't her. But the other officers could sense that there was something up and they asked me what the problem was. I explained briefly and they immediately knew who I was talking about. Sally went by a different name back then so they didn't realize initially the person I was concerned about.

Apparently Sally is the only person who had ever been kicked out of that club. The other board members couldn't get into specifics but apparently there was a member of the club during the 2018-2019 school year--Sally is a year ahead of me--whom Sally targeted (who was part of the merit-based group as well). Sally harassed this member and followed them to our club meetings because this was their safe space, and evidently made sexually explicit comments to this member. Sally also followed this member to other places around campus. It escalated to the point where the board members that year, three of whom are still on the board, had to make the decision to kick someone out of the club permanently for the first time. She even needed to be moved to another dorm building because of incidents like that with people. (One of the other officers also confirmed that she had harassed him about getting her into that merit-based program, like what happened to my other friend.)

I'm still kind of in shock. Clearly I need to learn to distinguish ""socially awkward"" from ""unstable and giving off bad vibes"". I dodged a fucking bullet. What the fuck is wrong with people?!

TL;DR: ""socially awkward"" girl thinks she's friends with me, hunts down my email, and has an email conversation with me. I feel uncomfortable because she's doing stuff like hinting that she wants me to give her money. Try to end the conversation and she gets upset and says she wants to text me. I tell her firmly that she needs to leave me alone. Later find out from two separate groups of friends that she's clearly unbalanced and has a history of stalking and harassing people.",20Aug2020,1
137,"After 8 years of playing you, I'm out of time and simply can't anymore, so it appears being a professional gamer was not in my future, but before I go I want to tell the world the secrets of the oh-so-mysterious mmr ladder.

It's true people can climb solo, but it doesn't represent anything more than a level of selfishness because they just cap out somewhere higher. This is because when you get to the level where you're trying to solo 5 people as good as you, you'll never win, because it's truly 1v5, not 1v5 of tacky tricks and cheap thrills: It's 5 PLAYERS against your selfish being. So, sure you can climb exploiting low bracket holes, but you're not actually playing professional dota2, which is why you'll never be pros either and you're stuck in ancient or some other tier.

This is also why there are great players in the low brackets, because these great players in the lower brackets are not trying to solo win from the beginning, they're trying to play a team game, so they cap low because in their low bracket they get players that they can't rely on because they get people who are totally new, have no ambitions to play professionally and throw because they just want to do what they want to do, or are on personal vendetta sprees after being contaminated by the toxic environment and will throw for almost any reason. These people actually trying to play also cap low because the middle bracket is filled with these selfish people who just want to exploit the holes trying to solo climb and are not actually playing dota2, and total noobs who simply averaged high because they calibrated with a high level friend.

So these are the brackets: Immortal and Divine: Actual team players

Ancient, Legend: Selfish Exploiters who will never break the gap because they aren't team players

Archon, Crusader, High Guardian: Exploiters or noobs calibrated high

G3-H3: Team players not interested in exploiting holes to climb the ladder hoping the mm will be fixed eventually so that they can get consistently real games of dota2 not filled with crying throwers.

H1&amp;2: Noobs

&amp;#x200B;

I'm an electrical engineer—My analytics and logic are of the Immortal Tier. My dota2 experience was to be calibrated at archon as a noob from my high bracket friend, descend to herald 1 over an eternity of dealing with the selfish jerks who cap at a higher bracket but will never break it because they're toxic and it just catches up with them there, climb to guardian 4 when I decided I should just play carry since I was clearly the best in the low brackets because I played so long and real winners want the ball, fall to herald 4 when I got tired of playing the same heroes and watching my higher ranked teammates getting worse in skill and getting disheartened and not wanting to try so hard to win because it's not even a real game of dota2, because once again, when you're in the pro bracket, you're not winning solo, so why are you going to try and climb by doing something (practicing something) that's not going to work later on? Perfect practice makes perfect. Playing this little game with yourself is practicing imperfectly, so that's why you can't break the higher brackets even when you get there. Everybody knows your cheap tricks, and your only way out is to become a true team player, but you're selfish and toxic and so you never will, unless you read this post and it becomes your breakthrough, but because you're selfish and toxic and you can't give credit to anybody else, it would be a paradox that you listen to me. I would like to have a team from beginning I suppose and learn expensive tricks in the immortal bracket where real teams are trying expensive tricks on each other playing real dota2.

&amp;#x200B;

So, that's what 8 years of dota2 was like, but it's time to move on. Ice Frog I recommend you stop letting people calibrate with their higher bracket friends, and I also recommend you stop letting people practice in ranked. The solution to this would be: You can't play a hero unless you have so many games or even wins with them against bots and in normal mode. This will improve the game quality of Ranked mm, which is meant to be competitive, not a playground, which will improve the toxicity of the environment as well because people won't flame at people for practicing a new hero in ranked. You're welcome.

Good bye Dota2. ... It was less than fun.",20Aug2020,1
140,"I've actually heard quite a few things like pretty much screwing around with someone's life to keep them talking about it or coming ""back for more"" although this is just people in general, not directly related to those AA or NA groups.

Like a person finding a strong character to be the rock but make another person's life rocky. That kind of thing. There are some twisted little people in this world who hide behind a majestic image.",20Aug2020,1
142,"It's not fear to rejection, but missing the opportunity to know someone I'm interested in.

I don't usually talk to girls in a flirty way, maybe twice a year and I mostly meet them through dating apps.

It always start as something selfless, with no pressure, but as soon as I feel a connection with them I start involving feelings and paying too much attention to them.

Everything ends when it's obvious I'm much more interested than them and they ghost me.

After 1-2 months talking the next 6 months are a constant analysis of what I told them, thinking what I could have done in order to keep their intererst and auto-blaming for it.

Everytime it happens leaves a huge hole in me, making me realise how some apparently irrevelant factors made me lose an opportunity I'll never have again.",20Aug2020,1
143,I think about that.,20Aug2020,1
144,"Hi. I am both a teacher and a masters degree student. 

The Online Class Setup is really not as effective as face to face class. A lot of distractions. Poor connection, unneccesary noises,surroundings,etc.

I am a math teacher. And math is very difficult to teach online. Same case while I am a student in my masters degree. 

Hope everything will be back to normal.",20Aug2020,1
145,"/english isn't my first language, so sorry for the mistakes!/

Most of the times I feel like I hate everyone and everything and I'm just a grumpy cunt in general. I also believe that I have anger issues because sometimes I get REALLY angry for almost nothing and I can barely bottle up my anger. I try to be more positive and sometimes when I do something during the day that makes me happy, like cooking a delicious meal or baking something for example, I'm quite nice to people around me but then there's always something (or someone) that ruins my mood. Also people tell me all the time that I often tend to misundersand what they say to me and I'm offended by it, which I noticed as well. Very often when someone tells me something nice, a little voice in my head says it's just sarcasm/they only say it because they want me to believe it and be happy about it so they can laugh at how pathetic and naive I am.
I'd like to be a better and nicer person but I don't know how to achieve it.",20Aug2020,1
146,"I'm not saying necessarily that I'm ugly, I've had quite hot girlfriends so I don't think I am, but I hate my look. I'm a southern italian (Naples) and so in things like the shape of the head, the colour of the eyes and the features of the face this is clear. I don't think I'm racist but I really wish I looked like a northen european, germanic, the way they look like seems so clean and perfect.",20Aug2020,1
147,"I found out that all my friends and I passed our final exams and that I got my dream job!

I haven’t been this happy in a long time...I can’t remember the last time I felt happy without any looming stress!

I hope this feeling lingers for a while!",20Aug2020,1
148,"I’ll give some examples of what I’m talking about so maybe someone relates. Sometimes, when I see someone doing something as innocuous as enjoying an ice cream cone, I’ll feel this wave of sadness overtake me, because it makes me think about how stupid our lives can feel, enjoying our silly little pleasures like ice cream. Does this happen to anyone else? I’m a quite happy person usually, but this is a common reoccurring thought that gets me down",20Aug2020,1
149,"Title says it all. I’m doing well, don’t worry about me. Just after some reflection, it shows someone does care.",20Aug2020,1
150,"So I don't know what exactly to think, people kind of use me as a punching bag and do and say whatever they want to me. And I feel like one of those people is a friend of mine who was actually trying to help me with a situation she has no idea about and made it kind of worse. But I'm not sure and I'm kind of paranoid now that she's lying to me just so I wouldn't be mad at her knowing what she did. Maybe she thinks I'll stop being friends with her cause I was pretty upset about the situation I've been in for quite some time now. But would she seriously let me think I'm crazy rather than tell me what's been going on? I'm mad and hurt and I don't know who to be mad at cause everybody just does whatever the f_ck they want.

I mean whatever, I'm just a nobody, why the f_ck would you f_cking care, just say whatever the f_ck you want because heey I've had good intensions. Oh, f_ck off already, would you? And when you like someone and they think that they can do whatever they want because you Like them so the rules don't apply to them. Ugh! I'm allowed to be f_cking pissed off! The f_cking shit you keep on doing, and you have no idea how f_cked up I am so you kind of use my emotions against me and then don't do anything, but let me know that you care? F_ck you! I'd rather hook up with someone I kind of like and have a normal life than this whatever the f_ck this f_cked up situation is. Don't you see how f_cking f_cked up all this is and you have to f_ck it up further and I don't get to have a  say in it? I mean just because everyone's been acting like f_cking lunatics with absolutely no boundaries, that doesn't mean you can't stop behaving like a f_cking weirdo just because I've gotten used to it! I will not hate you because I am also a weirdo, but dear god stop it. The world has gone absolutely mad! I mean what the f_ck is happening to people? What the actual f_ck? You have no idea what the f_ck I've been going through. And no, I am not the f_cking problem, my mental health is not the problem which caused all this. F_cked up people are my problem! And I will be ok once ALL of them f_ck off! .... Ok, I think I'm good now.",20Aug2020,1
