,text,time,score
1,"I just love doing it, i started doing it whilst i was skipping school ( I know it's bad and i shouldn't do it but sometimes i just want to run away from everything) just to kill off some time and it slowly became one of my favorite things to do. I can observe the scenery and how people act and look like, i can read and read book peacefully and most of all it allows me to think in my own bubble wich i fine is very important for my own well being. I guess that those random bus adventure offer me a safe space from the busy life outside.

Anyway that was all, I wish you all a nice day",20Aug2020,1
2,"I miss when you didn’t try so hard. If i never have to see another selfie taken by you with you smiling without showing your teeth I’d be fine. I miss when you didn’t care so much about what people think. I miss the days when I thought you were the best honest person in the whole entire world. I miss when you had morals. I miss when it was just us before you involved other people and ruined everything. I miss being proud of you. Your still my love and my person but it’s not the same and it never will be. I wish I knew at the time that 2018 would be the last good year as I know it, the last year before you changed so dramatically. I see pictures from before and I want to just jump into them. You used to be such a guy, someone that protected me, my best friend, someone I’d do anything for. Now it’s just different.",20Aug2020,1
3,"You see all these posts about how Samuel E Jackson, Ricky Gervais, etc. People say popcorn pops at a different time and everyone pops at a different time. How do I know I've not already popped? 

I lived so much from 18-19 I'm 26 now. What if that was the pop? What if that's as good as it gets? Now what?",20Aug2020,1
4,"work at a bar and one day I walked in to the glass wash room next to the bar and a girl I work with thats kinda new who I haven’t talked to was sorting glasses and stopped and was staring at me smiling and then looked away to the glasses still smiling but I thought nothing of it. The next weekend I needed to ask her where this food was going to as I was going holding the plates and she put her hand on my arm (around my arm I think like holding and I was wearing a few shirts underneath a black buttoned shirt 👔 and my arm is stick skinny too so idk if she thought that) as she pointed the table out, when I walked back round to wrap cutlery and she stood in front of the cabinet with her hands on her hips tilting her head left and then right slightly while she looked at me as I was wrapping cutlery on the cabinet and said ‘you make me sweat, Graham’ and I said ‘what?’ then she come to the side of me and held her arms out for a hug and smiled to which I backed off because I was like thinking ‘wtf’ she then dropped her arms her face went sort of sad then walked off. The next night we were on a close the pub shift and in the staff room at the end of the night as s was putting her coat and scarf on she said ‘I haven’t got a boyfriend you know, Graham’ I was standing at the doorway on my phone and the other guy at work there with us laughed out loud as he was on his phone and I looked at him then at her and she was looking back at me smiling after saying it and then looked away to carry on putting her scarf on in to her coat.

I’m 6ft tall and thin and lanky and she’s very pretty tbh",20Aug2020,1
5,"I finally emailed her after about a month of not talking. I wrote what I thought was best and apologized... God I hope I did it right. I told her if she needed space she could do it and I’d be okay with it, but I won’t. I miss her as a friend and don’t want to lose her, but was a horrible friend and she deserves better. I need to fix myself before she can call me a good friend. 

Because I’ve been nothing but shit. That changed last week, but what if she doesn’t believe me? She already told me I’m incapable of changing.",20Aug2020,1
6,My Birthday is coming up in 4 days 🎉and I am putting my cash app here ($Ree23) to manifest monetary love on my special day!,20Aug2020,1
12,"

Hi I’m writing this post to ask for some quick help I’m 21 years old &amp; moved to Vegas from California about 2 months ago I stay in a weekly hotel &amp; due to Covid I’m on unemployment. My payments have been pending for almost 3 weeks now &amp; that was my only income. I applied for Nevada food stamps &amp; currently waiting for that to process &amp; will be donating plasma/blood to make extra money. I have no more food, I used the change I had left to wash some clothes that are now air drying because I didn’t have enough for the dryer &amp; I really needed clean clothes to wear. My rent is about $250 a week but I’m only asking for around $100 or whatever you can honestly just to pay for a few days because my hotel manger has been being lenient but I still need to pay something. If anyone could help me out, I know I will have the money by the end of the month to pay back as I’m actively looking for work &amp; quick jobs to get by thank you !",20Aug2020,1
13,"work at a bar and one day I walked in to the glass wash room next to the bar and a girl I work with thats kinda new who I haven’t talked to was sorting glasses and stopped and was staring at me smiling and then looked away to the glasses still smiling but I thought nothing of it. The next weekend I needed to ask her where this food was going to as I was going holding the plates and she put her hand on my arm (around my arm I think like holding and I was wearing a few shirts underneath a black buttoned shirt 👔 and my arm is stick skinny too so idk if she thought that) as she pointed the table out, when I walked back round to wrap cutlery and she stood in front of the cabinet with her hands on her hips tilting her head left and then right slightly while she looked at me as I was wrapping cutlery on the cabinet and said ‘you make me sweat, Graham’ and I said ‘what?’ then she come to the side of me and held her arms out for a hug and smiled to which I backed off because I was like thinking ‘wtf’ she then dropped her arms her face went sort of sad then walked off. The next night we were on a close the pub shift and in the staff room at the end of the night as s was putting her coat and scarf on she said ‘I haven’t got a boyfriend you know, Graham’ I was standing at the doorway on my phone and the other guy at work there with us laughed out loud as he was on his phone and I looked at him then at her and she was looking back at me smiling after saying it and then looked away to carry on putting her scarf on in to her coat.

I’m 6ft tall and thin and lanky and she’s very pretty tbh",20Aug2020,1
15,"I took a two year gap from school while working full time. I kept my job and decided to jump back into school, but online. What a jump. I completely forgot how much online courses are overloaded...I already dropped one class before the last drop/add day, because the work required was insane. The first week of the class I kept wasn’t too bad, but the second one requires 12~ hours of work, not counting the 100 question 1 hour quiz. This is insane. I have a job. I have responsibilities. I would have *maybe* an hour a day to myself, only because I stay up till 10 sometimes. (As a part time student! Half courses.) Do instructors think students do not work or have kids? Or anything else important? Fingers crossed I get an A in this class. Jesus...",20Aug2020,1
16,"  Im a 21 year old guy who’s normally very quiet and can look/be very nervous when I go to appointments with this lady job advisor who's about 32 years old and for example when I get up to go at  the end of an appointment she would say ‘awwww’ (like rrrrrrr) before saying bye (maybe as a gap filler) and I sometimes say thanks very much out of habit before she says it does so idk. 


Little things like when I say hello She blanks me and just says ‘how’s your job search going’ quietly and moodily. but when I Didn’t look up to her once at the start of an appointment to  say hello she got  really moody and looked  sad/mad about it so idk what to do. 

A few months later When I told her about the company I got the bar job interview for myself she looked a bit surprised (in an upbeat bubbly way) and asked me where the job was for (a  bar job) and then She said   ‘ohhhh....how did you apply for there then?’ When Just before she’d give me snotty looks when she first called me to her desk. 

And a bit later the same appointment I looked to my left to look at another advisor who had a short dress   on whilst she was facing on the computer in front of her and she laughed a bit and said ‘you looking at her there?’ in a smiley/giggly way, I didn’t Say anything. and  also said ‘we normally change your advisor at this stage...but erm...I’ll just keep you with me’ pleasantly when the week before she sent me somewhere else on the other side of the city  instead of her when I called in sick for an appointment but when I asked her is there anywhere else by email she replied  saying she’s referring me back to herself again and I didn’t want to but I said ‘ok thank you’ and she just replied with ‘see you next week’.  but I took her referring me elsewhere as that as her and nobody else wants to bother with me either because I’m ugly. She sometimes would look up at my hair  if I had it styled or just untouched and messy  is that a bad sign?

I got a job myself and she would say ‘well done’ and ‘very well done’ a lot on email replies and every single time  in person so she was probably surprised I did something because she assumes I’m thick and useless   :/ like when I finished the appointment and as I walked away after saying bye she went ‘awwwww ok......and well done’ as I was walking away. I felt talked to like a 5 year old. Also she said ‘let me know if you need any travel expenses/new job support etc’ often on email replies when I told her I got a job.


Edit: she started saying the ‘awwwww’ a few months before when saying bye ever since I failed an interview she chose me for for not having enough confidence :/ she was really annoyed at me for it even tho she filled out the application form for me for it too",20Aug2020,1
17,"She was legit dumb.  She wasn't mentally retarded or anything either just stupid.  I confused her like 10 times over normal shit.  It was mental draining our 3 minutes if interaction. Also she cancelled my CC payment and said I did something wrong even though the machine said to remove card, I know she fucked it up. This person was just a vapid stupid idiot.  I left feeling tired and a little sick.  

I've never left a place thinking ""they are gonna be cashing for the rest of their lives"" before.  Her brain cant do much else.  

Definitely a real life NPC.  Basically a pet rock come to life.",20Aug2020,1
18,"I realized that the majority of things I use social media for give very little back to my life. I’m not even one of those barfy people who espouse living in the moment and reducing screen time. Im a normal person who enjoys zoning out just like the rest of us. I just realized that i either used it scratch sort of schadenfreude itch when things go wrong for someone, frustrations with non-intellectual rhetoric from non-intellectual people, or just simply voyeurism of the mundane. All these things just make me either feel unhappy or dull but I still found myself craving social media. Why? Why? I don’t get it. So I deleted the apps. Not my accounts, bc that seems rash. Just the apps. It’s been six hours. I feel weird about it.  Honestly I’m still connected to my friends through other apps like snap and messenger, so I’m still connected to my far away pals- the weirdness isn’t from social isolation or disconnect. I don’t know. We’ll see how long this lasts I suppose. Thoughts?",20Aug2020,1
19,"This happened about 5 years ago. I was in an all girls high school and had 3 best friend at school(Mili, Daisy and Tammy). We were all 16 in this story.

I had a few guy friends and one of them, Mike , was my best friend. I had known him since I was 13 online and we met when I was 14/15 in tuition. and I had tuition together and we'd meet every week. He would walk me to the bus stop afterwards. We often had bets that would win me chocolate, like the first one to pinch the other's cheek wins type of bets.

Needless to say, I developed a crush on him. Now, I'm not a very pretty girl and he was a tall, buff, handsome guy.

When we were 15 in 2014, during the school holidays, we had a row and we stopped talking. It actually crushed me and I confided in my best friend Milli.

After the school holidays, we went back to school at the start of 2015 and Milli said she had a surprise for me. Her exact words. She said she'd been talking to Mike over the holidays and she felt we had a chance. It struck me as weird, my best friend talking to my crush. I did not voice my apprehension.

Mike and I started talking again. Mike would often send me pictures of girls that he found online. Some were our mutual acquaintances, others were girls who went to different high schools. He'd tell me he found them cute and if I approved or not. Sometimes, he'd ask me to approach a girl on his behalf. 

Looking back, it was just plain creepy that he'd spend so much time online looking up profiles of girls, and seeing if he found them cute. I did not see that however. I was just very hurt. I had no reason to be hurt given he did not even knew my feelings, but I still was. I guess despite my crush, I realised it's not a nice sign for someone to find girls online every week.

Anyway, my 16th birthday came up and he called me, saying he had feelings for me and would like to propose to me to be his girlfriend. I felt like it was a dream come true, but at the same time a few days before I was still getting pictures of potential girlfriends.

I said no. He pleaded. I maintained my ground. 

At the time, I had another guy friend, Sam. Sam and I had a mutual cousin and we met when we were 10 at her engagement, then her wedding. Sam knew Mike from their mutual high school friends and offered to act as my boyfriend when he met Mike so that to stop Mike from contacting me. His messages and calls were getting too much to the point of him harassing me.

I was 16, stupid and confused and I agreed. Sam and I were friends, but then in his messages he started saying he had feelings for me. My dumbass went along with it. About 1 month after that, I realised it was weird of me and Sam to act lovey dovey in messages. We met once for 5 minutes during our 'dating period' and we were both so very awkward.

He agreed because he realised it was super weird for us to pretend to love each other.

Back at school, I told Mili, Daisy and Tammy that I had feelings for Mike still, but would never act on them due to his past behaviour.

They were a bit weird about it, but never said anything.

In the meantime, Milli started dating someone. I asked about it and she reluctantly gave me details, a name, age, school etc. Tammy and Daisy would tease her about the guy too.

I'm not a nosy person. I would never go out of my way to ask questions or probe. If we're having a conversation and something strikes me, I might ask, but I don't go around interrogating people.

At the end of  2015, we had super important exams. We finished those and I started using my social media again.

There was a message from Mike. Joy, I guess.

We started talking. I was making plans to meet Milli during the holidays when I visited my cousin.

I don't remember the details of the conversation at the time, but Mike then sent me pictures. Pictures of him and Milli, holding hands, cuddling together. My first thought was this was photoshop. Milli would never do that to me. She knew I had liked Mike for a while, even though I refused to date him due to his actions.

I looked at the pictures. Milli would talk about her bf would always wear green to meet her because she loved green. Green shirts in most of the pictures.

I messaged Milli. She confessed. She said she did not want to tell me due to us having important exams. She was apparently trying to convince Mike to give me another chance as well as change his behaviour. She was doing that by meeting him, kissing him and more.

She never apologised. She's a proud and arrogant girl. 

I was hurt beyond belief. I cried my heart out that night. God the first thought I had was the block of knives in the kitchen, the knives with the green handle. I hated green at that time, me who loves all colours. 

Of course I didn't too anything. I'm too sensible to hurt myself for another person, much less a boy.

Anyway, I cut contact with them all, even Tammy and Daisy, because they knew and didn't tell me.

2016 and we go back to high school. Tammy and Daisy talk to me saying they urged Milli to come clean so many times, it never happened.

At the start Milli told Mike I'm not talking to her. I replied that conversation is two way, if she's not making an effort don't blame it on me. We started talking again, though I maintained my distance.

Mike would call Milli several times during the day. I kept away as much as I could. 

I started getting over my feelings for Mike and letting go of my resentment for Milli.

End of July of that year, I started dating another guy. We were very happy for a while, but then broke up at the end of the year. That's a story for another time. 

2017 comes along and I'm stressed due to personal problems.

Milli started being less and less on the phone. When we asked her, she said Mike did not text or call her as often.

We told her it might be because she never initiated contact. It was true. She would never text or call first until Mike did so. 

She started trying her best. She also discovered that he might be talking to other girls online.

End of 2017, important exams again.

I was struggling from my end due to stuff at home. Mike ghosted Milli in a way, he stopped responding. Milli blocked him everywhere to heal from everything. She told us she realised the relationship was over ages ago.

2020, Milli, Daisy and I are now best friends and super close. Tammy has drifted a bit apart but we still talk. I have never ever brought up what she did to me again and she has not done so either. She has never apologised for it, neither am I looking for an apology.

I just had to type this here. I'm not sure what I'm looking for. It was just a very hurtful and confusing experience of my life.",20Aug2020,1
21,"Coworker hates the idea of government programs being payed for by tax payers.  She says ""they are taking money from hard working americans!"" Simulfuckingtaniously she wants trump to hurry up and get this extra 400 dollars a week thing to pass so she can get her extra 400 dollars of taxpayer money.

What can you even expect from someone who gets all of their news from Fucker Carelson and Faux news.",20Aug2020,1
22,"I’ve known my friend for about 4 years now and we have lived together for 2-3 years now (in seperate rooms of course). We have absolutely no romantic feelings for each other and treat each other like siblings. A year ago, he met this girl and started dating. At first she seemed normal but after having her move in, I got to know her better and I think she’s crazy.

I’m not one to usually dislike someone this much but she really knows how to get on my nerves. She doesn’t clean or do her own dishes and expects me or her bf (a.k.a. My friend) to do it for her while she sits and watch TV. She’s controlling and abusive. She hits him and it left bruises sometimes. She’s rude and has no manners. Usually when you live with someone don’t you greet each other in the morning? I did a few times and she just ignored me. We have 3 cats at home and that bitch of a gf is quite fond of one of them. Cats usually are quite temperamental and doesn’t like to be carried but she doesn’t care and forces the cat to be carried for few hours a day. Yesterday as the cat was trying to hid from her under the recliner sofa, in order to get the cat, she reclined the sofa while the cat was there and it got injured. I told my friend and when he confronted her she acted all guilty and shit. 

My friend asked me about his gf a couple of times but whenever I tried to point out her crazy selfish personality, he finds an excuse or tries to justify her behaviour. He’s thinking of marrying her in 1-2 years time. I am just so frustrated. This is only the tip of the ice berg and she’s way worse. Do guys like to be tortured in a relationship? Do they like girls who have no manners and controlling? Girls who always throw a tantrum? Should I have an honest talk with him? What if he gets mad at me and ask me to move out? I don’t have the funds to move just yet. I’m sorry for this long post, I am just really frustrated.",20Aug2020,1
23,"I have come to realize that a fatal flaw in myself is I don't like/am not attracted to people with similar interests as me and it's in direct competition with my desire to make meaningful connections with people.

I used to think it's bc when I was little, adults would randomly take my things away without cause and I'd not react/pretend I didn't care so I could get it back faster. So wherever someone's like ""Oh I like that thing too!"" My initial reaction of being like ""Nvm"" was because I was scared they could somehow take it away? Taint it? That I'd mentally associate this person with that thing and they wouldn't be in my life forever and I didn't to think about them wherever I interacted with the thing?

Now I have,  ""personal"" interests that are for me only that I don't tell people about and ""public"" interests that aren't super personal and I'm okay talking all day about

I don't like this about myself and have to actively force myself not to dip away from people. But I also don't want to be only associated with my interests? Yes I like video games, but being a ""Gamer"" isn't a part of my identity. I like baking and staying in, but I also love going out and being in the world. 

I guess I'm just scared of coming off as something I'm not to people and so I come off as nothing.

Any thoughts on how to build relationships without sounding like a weirdo when it comes to shared interests?",20Aug2020,1
25,"The ball is as ball as a tire is. Just because it is filled with air and have rubber around it? You don't see an egg and say ""hey, nice balls you have, mate"". And if you do, you are not talking about the egg.

Also, I know they can kick the egg shaped ""ball"" during the game, but it is played",20Aug2020,1
26,It’s in my toes. The moment before something bad happens or someone risks their lives i can fell that it’s gonna happen in my toes. I’m not sure why. I’ve tested this with many different situations and it has 100% accuracy so far out of 6 tests. This just started recently. If I develop any mutations I’ll update you all the sensation I feel is like a sharp pain that lasts until the situation ends,20Aug2020,1
27,How does one actually become genuinely confident. Every time I try to act confident I feel like a phoney. It just doesn’t come naturally to me. At all.,20Aug2020,1
28,"Working out sort of fills the same urges as self-harm: it quiets the mind when it compares too much, leading to high anxiety.  However, it has the added benefit that you can share your workout experiences with others, and you’ll find camaraderie, support, and bonding.",20Aug2020,1
29,"Bout to turn 40 in September.   I am not a person to celebrate myself.  I have a husband and 3 youngish kids.  12, 7, 4.  The past year I have seriously changed so much about me for the better.  I want someone (husband) to treat me special.  He is and has never been that guy.  On mother's day he asks me what I want. Omg.  I want burnt breakfast in bed and a thought of love and appreciation.  I don't want to remind you it is mother's day  on the actual day.  Yes, I have told him this.  Many times.  No I will not leave him for this.   He could be way worse than adhd and the son of a mom who still babies him.  (Moms, stop babying your kids)  should I be the mom I complain about and book us a weekend or just let it ride and be disappointed as usual?    I just want to be happy and young and carefree (have adultish interaction without a child trying to open the door.)   
This is no way bashing my husband.  He works hard for us.  As I do.  I just want a day about me before I am dead.",20Aug2020,1
