,text,time,score
64,"Warning: this is long. Just need to write it out and remind myself when I have to read this again later. Or maybe someone else is in a similar position and needs to hear this.

I went through some things over the past few years including the sudden death of my father, then I was diagnosed with a chronic illness while trying to balance my home life with 2 small children. They were stressful events but I never considered them as something that crippled me. I’m pretty strong and resilient so I dealt with these issues and moved on with life. Just when I thought I was starting to heal and feeling happy again, my life slowly fell apart.

It all started when I thought a change in career would be good for my personal and professional development. I wasn’t unhappy with my job, just thought I wanted more. So I took the plunge and took a management position in the same company. It started out as a great challenge and exciting, but slowly fell into a trap of a poisoned work environment where I longed everyday to go back to my old job when I was happy. And when I expressed this to my employer I was guilt tripped into staying. I know I’m a good and valued worker so they don’t want me to leave. I felt a sense of responsibility, didn’t want to leave my boss hanging and didn’t want to admit I was a failure who couldn’t handle it. So I agreed to stay.

Then a few months later, without going into details my marriage was falling apart. So bad that it warranted a divorce but I agreed to stay due to financial reasons and for the children. And this was just before the pandemic and then covid happened. With the added stress from my toxic workplace, I’ve never felt more lonely and isolated.

I initiated individual counselling, trying to not allow work stress bother me, trying to keep telling myself to pull my big girl pants up, stop feeling sorry for myself and just deal with life. But the final straw was when I found out by chance, I am actually making less money than what I was making at my old job (hard to explain my pay scale so won’t get into it) So here I am, stressed, depressed, losing sleep, drinking daily to escape, working longer hours, and making less money. My marriage is suffering and I’m not spending quality time with my children. I’ve even missed my routines doctors appts for my medical condition. My friends tell me they’ve never seen me this unhappy. So I keep asking WHY AM I DOING THIS TO MYSELF? Why? Because I don’t want to burn bridges at work with my boss? I don’t want to appear weak? A failure in my colleagues eyes? Worried about gossips and what people will say? Then I realize, no one gives a shit. I can work myself to death tomorrow and I’ll get replaced and people will move on and forget about me in a few months. 

I have decided, I am taking some time off work to focus on bettering my physical and mental health before it gets worse. To mend my relationships with my family and friends and most importantly with myself. I need to stop putting on that act pretending everything is great and to stop internalizing everything. It’s okay to admit I need help. It’s okay to say no when you’ve had enough. It’s okay to admit this job is bit for me. 

When I return from my leave, I am requesting a transfer back to my old position so I can feel like myself again.",20Aug2020,1
65,"  Im a 21 year old guy who’s normally very quiet and can look/be very nervous when I go to appointments with this lady job advisor who's about 32 years old and for example when I get up to go at  the end of an appointment she would say ‘awwww’ (like rrrrrrr) before saying bye (maybe as a gap filler) and I sometimes say thanks very much out of habit before she says it does so idk. 


Little things like when I say hello She blanks me and just says ‘how’s your job search going’ quietly and moodily. but when I Didn’t look up to her once at the start of an appointment to  say hello she got  really moody and looked  sad/mad about it so idk what to do. 

A few months later When I told her about the company I got the bar job interview for myself she looked a bit surprised (in an upbeat bubbly way) and asked me where the job was for (a  bar job) and then She said   ‘ohhhh....how did you apply for there then?’ When Just before she’d give me snotty looks when she first called me to her desk. 

And a bit later the same appointment I looked to my left to look at another advisor who had a short dress   on whilst she was facing on the computer in front of her and she laughed a bit and said ‘you looking at her there?’ in a smiley/giggly way, I didn’t Say anything. and  also said ‘we normally change your advisor at this stage...but erm...I’ll just keep you with me’ pleasantly when the week before she sent me somewhere else on the other side of the city  instead of her when I called in sick for an appointment but when I asked her is there anywhere else by email she replied  saying she’s referring me back to herself again and I didn’t want to but I said ‘ok thank you’ and she just replied with ‘see you next week’.  but I took her referring me elsewhere as that as her and nobody else wants to bother with me either because I’m ugly. She sometimes would look up at my hair  if I had it styled or just untouched and messy  is that a bad sign?

I got a job myself and she would say ‘well done’ and ‘very well done’ a lot on email replies and every single time  in person so she was probably surprised I did something because she assumes I’m thick and useless   :/ like when I finished the appointment and as I walked away after saying bye she went ‘awwwww ok......and well done’ as I was walking away. I felt talked to like a 5 year old. Also she said ‘let me know if you need any travel expenses/new job support etc’ often on email replies when I told her I got a job.


Edit: she started saying the ‘awwwww’ a few months before when saying bye ever since I failed an interview she chose me for for not having enough confidence :/ she was really annoyed at me for it even tho she filled out the application form for me for it too",20Aug2020,1
66,"  Im a 21 year old guy who’s normally very quiet and can look/be very nervous when I go to appointments with this lady job advisor who's about 32 years old and for example when I get up to go at  the end of an appointment she would say ‘awwww’ (like rrrrrrr) before saying bye (maybe as a gap filler) and I sometimes say thanks very much out of habit before she says it does so idk. 


Little things like when I say hello She blanks me and just says ‘how’s your job search going’ quietly and moodily. but when I Didn’t look up to her once at the start of an appointment to  say hello she got  really moody and looked  sad/mad about it so idk what to do. 

A few months later When I told her about the company I got the bar job interview for myself she looked a bit surprised (in an upbeat bubbly way) and asked me where the job was for (a  bar job) and then She said   ‘ohhhh....how did you apply for there then?’ When Just before she’d give me snotty looks when she first called me to her desk. 

And a bit later the same appointment I looked to my left to look at another advisor who had a short dress   on whilst she was facing on the computer in front of her and she laughed a bit and said ‘you looking at her there?’ in a smiley/giggly way, I didn’t Say anything. and  also said ‘we normally change your advisor at this stage...but erm...I’ll just keep you with me’ pleasantly when the week before she sent me somewhere else on the other side of the city  instead of her when I called in sick for an appointment but when I asked her is there anywhere else by email she replied  saying she’s referring me back to herself again and I didn’t want to but I said ‘ok thank you’ and she just replied with ‘see you next week’.  but I took her referring me elsewhere as that as her and nobody else wants to bother with me either because I’m ugly. She sometimes would look up at my hair  if I had it styled or just untouched and messy  is that a bad sign?

I got a job myself and she would say ‘well done’ and ‘very well done’ a lot on email replies and every single time  in person so she was probably surprised I did something because she assumes I’m thick and useless   :/ like when I finished the appointment and as I walked away after saying bye she went ‘awwwww ok......and well done’ as I was walking away. I felt talked to like a 5 year old. Also she said ‘let me know if you need any travel expenses/new job support etc’ often on email replies when I told her I got a job.


Edit: she started saying the ‘awwwww’ a few months before when saying bye ever since I failed an interview she chose me for for not having enough confidence :/ she was really annoyed at me for it even tho she filled out the application form for me for it too",20Aug2020,1
69,"I am a 28yo man who needs some help to, like, open up. I am perceived as a robot, as someone out of this world, with almost no sense of humor, apparently no feelings whatsoever. And I know that it is somewhat the truth. How? Because when I was 21yo I wasn't like this. I would always emphatize with people, always show my feelings and I could interact with people so easily that I had many friends despite me being very shy. Now I have just those friends left from that time, and very few connections. Why? I know why. Because I couldn't take it any longer. Sometimes feelings were just too hurtful. Like when I hurt a person who was in love with me but I didn't really like and had to leave on the week of his birthday; when my mother threatened suicide through the phone; when my father was diagnosed brain cancer and after the surgery lost his mobility forever; and other events. Many things together that made me think it was easier just to bury my feelings in order to go on, as I had done for many years before my adulthood to face many challenges to difficult for a teenager. I just couldn't see any other way out, because before I would do my best to help people around me, but at that time it wasn't always up to me, there wasn't a real solution.

Now my life isn't happy nor the worst: it just is. But I don't want it this way. I want to live my life as a normal person, to make new friends and feel something real again. The problem is I don't know how, nor I have any real reason to do so to prefer feelings over this detachment, other than a desire to be a better person. Sometimes I'm even scared to get close to people, because I know how easily I might get hurt, especially lately considering my mother and sister decided to cut their bond and the same happened between two of my best friends.  
I'd like to get help from a psychologist, but I don't have the money for it.

Maybe just by reading my message you could suggest me a good book or movie, share your experience or some advices, do something to inspire, and maybe help me find the motivation to live as I'd like to.",20Aug2020,1
70,"
I have a contact in my phone named Crazy Dude and here’s why. 

Starting about 2 years ago I would get a phone call from this guy maybe once a month or so. At first it was this:

Me: hello?

CD: Aaaayyyyyyy!

Me: who’s this?

CD: ........huh?

Me: you’ve got the wrong number.

The guys sounds like he’s on hard drugs or severely mentally disabled. I’m sure it’s the former. After maybe the 3rd time I had to put his number in my phone and started playing along to try to get something else out of him. 

Me: hello?

CD: Aayyyy

Me: WUT UP BRUH???

CD: (gibberish)

Me: Fuck yeah, where at?

CD: uhhhh (gibberish) ..... (click)

Every. Time. 

Once I was able to talk to I’m guessing his friend and it went like this:

Me: hello?

CD: Aaaayyyy!

Me: YOOOOO!
CD: ... ... ...

(Unknown): who’s this?

Me: No, who the fuck is this?

(Unknown): uhhh... My buddy called you. 

Me: Alright, well tell your friend he’s got the wrong number. 

(Unknown): haha aight...(click)

It’s didn’t stop though. 

Anyways, Crazy Dude hadn’t called in months and I was thinking he’s either dead or in jail. 

Today he called me, and even though he gave me 4 seconds of slurred gibberish before hanging up, it made me smile to know he’s not dead or locked up. 

Even after dozens of calls I’ve never actually had a conversation with this guy, but he’s become somewhat of a friend of mine. 

Does anyone else have a Crazy Dude?",20Aug2020,1
71,"I’m a young guy and went to my job adviser of one month she had chose me forward for a job interview. and she asked me do I need interview clothes ( polite/bubbly tone of voice) i said ‘no thanks iv got all that’ and her response was ""oh, have you got all that? (Bubbly Tone of voice as I said) and then she said ‘ ok well do you know how to conduct yourself on an interview"" while looking at me pleasantly with furrows eyebrows , (see I’m very shy and quiet) I said ‘yes’ she went on to say (she used her hands as gestures in motion to what she was saying) ""ok, well don't forget, shirt, pants and shoes....make sure you get a shave. make sure you cut your nails. make sure you do you're hair up all nice and that"" (in a voice between a mix of bubbly and assertive) then she paused a bit looking at her computer and then said ""and make sure you put some aftershave on as well, for the girls make sure it's men's"" then she burst out laughing. I just smiled with it. She said it nicely judging by a laugh at the end but idk. i wasn't near clean shaven at the time of the appointment tbh) but always was previous appointments. she sent me an email the next day about it saying about what I need to take with me to the interview and at the bottom it had underlined ‘please dress smartly’ and ‘good luck’

◾️the next interview she chose me for I had the next week she never said anything like this at all again and she even filled out the whole application form for me for it and I didn’t ask",20Aug2020,1
72,"And I haven’t looked back since joining. Thank you for being such a wonderful community of individual, weird, helpful, hilarious people. You really are all one of a kind and have helped to brighten up a somewhat dark year for me.",20Aug2020,1
73,"I dont really know how to express my experience. 
It is hard to talk about; it cant be said correctly. Of the event,  Even now, after 20 years this is still very hard for me to talk about but i cant be the only one out there to feel  like that so if anyone needs to talk.",20Aug2020,1
74,"Iv had a job advisor for around 1 month. She chose me for this job interview that her company manages to get staff for the job etc.

Anyways she sent me an email a few days before saying:

‘Hi, 

Just to let you know I have filled out the application form for you and it will be taken to the employer on Friday this week. 

Best of luck with your interviews tomorrow.

Kind regards.

Then when I attended the guy walked over to me with that application form and he asked is it my handwriting I said no and he paused then said ‘ok full this new one out’ 

My signature was written on the back of the one she did. Bitch. Should I complain?",20Aug2020,1
76,"hello people of the internet, how the fuck do you make some of that blue shit? seriously, i just wanna get fucked up, so please tell me something simple that i can do in my garage or something. i don't have any chemicals or anything, so something like making it from salt and the shit inside car batteries would be pretty sweet. thanks!",20Aug2020,1
77,There are some major difference between being dumb and being indoctrinated into an extremist ideology it's honestly quite alarming to see some of this kind of talk i see in left wing circles it's honestly a defeatist message i find if their is. any critic i have of the left it's basically this kind of elitist thinking.,20Aug2020,1
78,"Not just any meat - one of my chickens.

I generally eat a vegetarian diet, mostly because meat is expensive and I don't like it enough to justify the cost. But yesterday one of my flock died and I feel like it's my responsibility to consume her as a way to respect her life.

If anyone wanted to place blame for her death, it's my fault. I let the chickens out of their hutch to free-range after breakfast with the dog outside to protect them from the hawks that live in our area. I went back upstairs and at some point heard some distressed chicken noises, so I looked out the window and saw the dog and chickens in the yard - nothing seemed amiss. I figured a bird or cat had approached them and the dog chased it away. I went back to bed.

Maybe 45 minutes later, I went outside and saw my favorite chicken, drowned in the kiddie pool my roommate got for her kid. The pool is under an awning so I couldn't see it when I looked out the window. 

My roommate attempted CPR on the chicken, god bless, but she was clearly gone. So she got to work prepping her as meat, drained the blood, plucked, and processed her. We're saving her wings and preserving them for a shadowbox. 

We let the meat cure for a day in the fridge, but today or tomorrow we need to eat her. I'm honestly not looking forward to it. I feel so guilty that I didn't go outside to check when I heard the chickens acting up. I know they're just chickens, and we'll need to cull them once they stop laying, but this is my first flock and the first time I'll be eating meat I raised myself. As their caretaker, I feel strongly obligated to take responsibility by eating the chicken that died in my care.

I hope we do her justice.",20Aug2020,1
79,"I got braces 3 years ago, but a year in my parents weren't able to keep up with payments. So my ortho stopped tightening them, but said that if I get them removed it will be more expensive to get them put on again plus my teeth will move back. So now they've been just sitting on my teeth doing nothing and my parents don't know when they can afford it again but won't let me get them removed. I might just have to wait until I'm 18 in two more years and make an appointment myself to get this shit out of my mouth. I have an [expander](https://i.ytimg.com/vi/oHLSENawTBc/maxresdefault.jpg) in there too which makes eating and talking a nightmare.

/rant",20Aug2020,1
80,"I am getting a doctorate, have many high paying job offers even in a pandemic and have great set of friends and a caring family. But I am divorced from an unhappy marriage and have gone through a recent breakup with a fine woman due to distance this pandemic has imposed . 
None of the first portions seem to matter at all in making me happy or feel accomplished . I am unhappy and depressed. I feel like a zombie and cannot see any future version of my life that makes me happy. How do I not give up?",20Aug2020,1
81,"When I was about 10-11 years old, My dad got mad at me for something so he got a belt of one of his jeans, and he tackled me on the ground and kept beating me up until my whole arms were dark red cause I was trying to block the hits with my arm, it got to the point that my sisters were standing and crying begging him to stop, anyways, by time he stopped doing it, until he completely stopped physically hurting me about 2 years ago, so ever since that happened, I've been feeling uncomfortable talking with him, I mean, every time he talks to me even in a friendly way I feel afraid for no reason, and I keep confusing my words and feel nervous, i feel like he's not even my father,it's almost 4 years since he beat me up and i still feel that way, should I go see someone? should I go do therapy? or should I just keep waiting and this feeling will go by itself?",20Aug2020,1
82,"""k""",20Aug2020,1
83, Why does the United States Of America does not have at least 20-25 days Vacation? similar to Europe and other develop countries. Please help our nation: Change.org/VacationPolicy,20Aug2020,1
84,"I have been trying to get back together with the woman that I want to build a future with. 

We were separated and she was with someone else and I had a lot of insecurities about it. I broke her trust and looked at her phone without her permission and got caught. We fought and through our texts, she said that I need to find myself and love myself. 

That line has stayed with me - how do you find and love yourself? I feel so lost and want not to be.",20Aug2020,1
86,You sure showed me!,20Aug2020,1
87,"I turn 30 soon and my mind is increasingly tending towards dark thoughts. I never had the wild carefree happy youth most other people did. I hated college, I've never slept around, I'm a loner, I'm in an unhappy relationship, I had a kid without planning to, I don't have a career.

Every day is filled with anger at myself and a lack of enjoyment in anything. I get up at 7am, try to exercise bit but end up quitting after 10 minutes because I hate it, i do a bit of freelancing work that I don't even enjoy, then I mind my 18-month-old for three to six hours while my partner works at her part time job. 

I spend most of my time browsing Reddit thinking I'll magically stumble upon the post that provides the answers I'm looking for in life. I read sometimes but it never feels truly enjoyable, just mildly interesting. If I have time to myself in the evening I just walk around my neighborhood alone because there's nothing else I'm interested in doing.

Sometimes I have a couple of beers in the evening but I end up feeling anxious or more depressed the next day so I try not to do it too much. But alcohol is the only thing that provides a somewhat pleasant holiday from my normal waking consciousness and its relentless dark, negative thinking.

I don't know where to go from here. I tried two therapy sessions recently but I stopped going because it felt useless and hopeless. I've already failed at making the most of my life when it's meant to be easy, the prospect of getting old and being even lonelier and more useless is starting to look nothing but depressing.",20Aug2020,1
89,"My life will go from caged in minimum wage, to not having to worry about bills, or where the money will come from.

First thing im going to do if i get the job, with my first pay packet is take my parents out for a meal taxi there, taxi back, startes mains sides desserts and bottles of wine, for the first time ever.

I dont want to count my chickens obviously, Im on a bus atm with a tear in my eye just thinking about doing that for them, because i will finally be able to show them that they raised a successful son that appreciates everything they have ever done, from raising me to helping me in my failed attempt at university and through the mess that made me mentally, and through my recovery from the depression and anxiety that has wrecked me for so many years.

Even if I dont get the position I know I can get a similair job elsewhere and its through them i feel this way, I couldn't be happier even if it is a pipe dream. Fingers crossed and may the universe work in my favour, I could be going from 0-100 real fucking QUICK!!",20Aug2020,1
90,"Ever since I could formulate sentences I always felt like the time period in which I was born was too early. I was born 1992, but feel I should’ve been born sometime in the future, 2300, 3000, maybe even year 4000. I was complaining yet another day about my life, and my friend says to me “some people aren’t meant to be happy” I said “what you mean” he says “some people aren’t meant to be happy, I feel like you’re born too early for the time period in which in you’re meant to be in so no matter what you do you’re not going to be happy because you’re not meant to be here, you are meant to be born in a time period where you can create your own genetic makeup” I disregarded his uncanny dig and told him to elaborate. He said something about something, how I don’t think like other people commonly do and so on. My question to the people reading this, does anyone else feel that they are born too early for this time period? How do you navigate? P.S. I believe in the universe, I don’t believe in god, I don’t follow a religion, but I do believe in the universe and I do believe that everything happens for a reason. I don’t think anything is a coincidence.",20Aug2020,1
