,text,time,score
35,"It's been well over a year since we went our separate ways and I haven't stopped thinking about my ex since then. We only went out for three weeks because we met about three weeks before her graduation. When she graduated, I was deeply inconsolable. But! I hid it from her and kept up appearances as she soon moved on and began texting me about a new gf she'd met a couple weeks after graduation. It was easily the worst pain I'd felt in my young life. Even then, we texted almost every day until March-ish, through two failed relationships of mine. March-ish was about the same time my ex had found yet another gf. Around then, I also got into another doomed relationship - with a guy, this time.

Do you know how much femme-induced pain a lesbian has to be in to try it on with a guy? Lots. And lots and lots and lots and lots. Though it was really my fault for going into those relationships when I wasn't ready to move on. 

Now I'm stuck in the boring, lezzie-bereft South and I still can't help wondering what things might have been like if I'd gotten into a law school near her or into a school in any major metropolitan full of actual people, instead of chattel. However, I did run into a dairy cow that was sending out some solid butch vibes...I haven't seen her on Bumble, so I can't be totally sure what team she plays for. 

Anyway. Something my ex said about her newest, March gf still sticks with me: ""Is it weird that she's strikingly similar to you?"" As a person who's always had the subtle feeling that my life is a like a superfluous bump on the universe's backside, I was thoroughly rattled. My feelings had been confirmed: a self-actualized, superior version of me already exists, making my existence kinda pointless.

The problem: As insecure people of my generation tend to do, I've spent too much time doing the least healthy thing possible: cyberstalking the shit out of both of them. Turns out, New GF seems exactly like me, interest-wise and personality-wise. Even music-taste-wise! All she's missing is my height, my blackness, my light mustache, my grad school debt and my impeccable, erudite wit. However, New GF actually has friends. Like, ""sign my yearbook"" ""omg we've been part of the same squad since high school"" friends. Something I could never offer a future partner. 

The constant social media stalking and random Googling is biting into my time and messing with my dreams - my actual, unconsciously-produced, night time, beddy-bye snooze theater, y'all! This 1L semester has been non-stop fantasizing and crying and intrusive thinking to the point where I can't even begin to remember what the hell I'm supposed to be learning half the time.

Make it stop?",13Nov2019,1
36,"I’ve had this feeling for a long time. 

I’ve been through therapy but I’ve always felt bad about how much it cost my mother since therapy is expensive.

I wish I didn’t exist and cost my loved ones money and worry them. 

I don’t feel like I’m worth anybody’s time, because no matter how much I’m helped I feel like I never get anything done, because I’m unmotivated. I feel that I’m always depressed and apathetic and that I don’t deserve any help because it will be a waste of time. 

But I want to be helped so bad. I want to be normal and work well and not be stressed. 

I really needed to vent and need an outlet that won’t affect my close ones and make them worry for me. Is that wrong? Should I let them know?",13Nov2019,1
37,So I feel really crazy posting this. It's like I'm screaming for attention. But I'm not. I just wanted to know what other people thought. And I just wanted to know if anyone else felt this way. I'm just going to repeat what I said. I said I deleted reddit off my phone. And I felt much better. Why? I wasn't fitting in. So is anyone out there. I'm open to thoughts and opinions.,13Nov2019,1
38,,13Nov2019,1
39,"Recently, she's been having motivation issues with academics and coursework. She's a close friend of mine, and she's had mental health issues for nearly 7-8 years. 

I feel helpless, because I wish I could do something/say something to help her feel better, and help her with her motivation. I try to be a shoulder for her to lean on and only come to her aid when/if she asks for it. She's used to being independent when it comes to mental health.

Suggestion?",13Nov2019,1
40,"Not looking to get diagnosed or anything, but I’m curious? Especially when someone goes through one relationship to another just for their partner to do the same thing the other one did. 

Is this is the wrong place to ask, let me know.",13Nov2019,1
41,My bf has been in a psychosis for 4 weeks now. He is getting better but he’s still in a hospital. There’s always hope but it’s getting tough y’all :(,13Nov2019,1
42,"For many years, since at least college, I've had this pattern. Reckless self-destructive behavior, followed by short periods of stability, and then back down the rabbit hole. I used to think I was bipolar but something about that diagnosis just doesn't feel right. Regardless of what it is, it's exhausting. 

When I was younger, I used to kind of enjoy it in a sick way. The drama of my mental health rollercoaster was kind of entertaining, even as it was painful. Now, I'm just really sick of it. 

I stay in this minor ebb and flow most of the time. The self-destructive periods don't get too out of hand and my external life stays intact, even if internally there's chaos. But every once in awhile, maybe every 1-3 years, it all really explodes and I am left picking up the pieces of something traumatic. This usually ends in a falling out with a close friend or a huge mental breakdown of some sort. Also, weirdly, I'm noticing that this often happens in November/December (but not always). No idea why. 

I've been in therapy for awhile. I feel like I am really trying, but I cant break out of this pattern. 

I can feel it coming on again. I've started using drugs or doing other self-destructive things. I'm angry at everyone. I'm anxious at everything. I'm panicking in my friendships and pushing people away. 

Here's the thing about it, though. I can very clearly see this pattern now. I don't want it. I don't want to be making the choices I'm making. I am putting every measure I possibly can in place to stop it - therapy and self care to the extreme. Yet, I still see myself spiraling. It's absolutely exhausting. I'm terrified of the wreckage of letting this happen again. But I can't seem to derail the train.",13Nov2019,1
43,"People are always worried that I'm lonely. I'm 15 and I'm the classic introvert. I dont mind interaction with other people but I never cause it myself. I'm very silent unless spoken to and I'm always found outside the edges of groups talking to 5 people in total only (even then my social interaction is scarce) . I am kind to most and will hold a nice one in one conversation well. That being said, I will talk if someone spoke to me first, but then they want to be my freind. The very next day I dont talk to them. They take this as me hating them but truth is I just don't talk much. They just stop talking to me in total soon.  I feel as if I let them down. My teachers see I have no freinds, and me being kind to them and giving them  small gifts and being a decent human being, they try to ""help"" me.  They will try to introduce me to someone, then the whole cycle of talking once, and then never again happens. My english teacher to be specific, will then scratch her head and keep talking to me about being social. The school then talks to my father. I moved in with him only a little while ago and he already sees my ""issue"". He then proceeds to do what my teachers do. He introduces me to someone and the cycle happens again. He gets way too stressed and worries. He always talked about me being the social little bee I used to be. A few year ago it all turned into minimal social interaction. 
 I have clinical depression, Anxiety, and possible Bipolar disorder. I do obviously isolate myself and have my issues but never have I felt lonely.  Everyone I know just keeps pushing me to pull myself out of my pit, but my isolation is the least of my issues. Looking back on my detailed journals and memories I've kept since age 8 I wonder.... Am I not lonely, or refusing to beleive I've been lonely all along?",13Nov2019,1
44,"I used to take Straterra and it was the only psych med had ever tried that made a difference. I felt normal for once. 

I want to get back on it but the clinic that diagnosed me with ADHD is a community health clinic and it takes months just to see a prescriber. Meanwhile, other psychiatrists I've visited have been wary of even diagnosing me with ADHD (mostly because I'm employed, nevermind I'm close to losing my job because I'm so incompetent and I'm picked on for being slow and dumb at work). 

Can I just go to Primary Care Provider and ask for it? Would they think I'm drug seeking? It's a non-stimulant and non-abusable. 

I'm so sick of living like this. I feel like I'm drowning at work and I know there is a med that will help me but it's so difficult to get prescribed.",13Nov2019,1
45,"Long story short I took 90 Xanax pills in 3 weeks. I cut cold turkey cause I ran out of my prescription. I was taking 5-6 pills a day. I had bad withdrawals and many symptoms the first 2 weeks. Only 2 weeks into my withdrawals I binge drank heavily 2 days in a row at my best friends wedding. The next day I woke up with my initial symptoms back like insomnia, night sweats, shaking, bad rebound anxiety, constant high heart palpitations, depression, poor concentration, and blurred vision.

It’s been 3 weeks and 3 days since the wedding and I still have symptoms. I feel very out of it and have like tunnel vision. Also I have bad anxiety still that comes in waves and also have constant light shaking, tremors, and muscle twitches. I’m freaking out it’s a neurological disease than withdrawals. 

Is this symptoms from withdrawals plus heavy binge drinking and possible kindling or relapse? I’m freaking out the shaking hasn’t gone away yet.",13Nov2019,1
46,"I used to be so optimistic about my future. Now as I type my essays for school it’s in the back of my mind that it doesn’t matter. I feel like nothing matters because I’m not going to be alive to grow up and get a job. I don’t want it to be this way but it is. I have thoughts that if I just end it it can be over once and for all. I don’t think I could go through with suicide, but if someone told me I would die tomorrow, I don’t think I would be opposed. Has anyone gone through the same thing. How can I get motivation back?",13Nov2019,1
47,"I am a final year engineering student in India and I feel like my life has been in darkness for so long that I can't remember the last time I was really happy. I keep away from a lot of college stuff and have made gaming as a coping mechanism. I feel addicted to games. I try to keep my mind occupied all the time so negative thoughts don't start popping up. 

My head is a mess. I can't focus on anything. I got anxiety. I can't connect with people because of my poor socializing skills. I never had a girl friend and I feel like no one will ever like me because of my low self esteem. I don't want to end my life but I am feeling it hard to imagine a future looking at myself right now. 

My only hope right now is that I find something that can change me.",13Nov2019,1
48,"I think I’ve had enough with life, it doesn’t seem to be getting better and I really can’t be fucked with it anymore, so for the people with evil thoughts like me, what’s the best way to kill yourself? And for the people with no intentions of telling me the answer, please talk to me, I really don’t care who, I just need someone to tell me that everything is gonna be okay",13Nov2019,1
49,"Is it just me, or does the voice in your head sometimes just start screaming instead of talking normally. Like i be taking a test, and as the voice in my head is reading it’s also screaming as it’s reading. she said fuck your test, I’m just gonna yell in your head so u can’t pass.",13Nov2019,1
50,"I feel like the only thing stopping me from killing myself is the pain and effort that comes with it. I come home, from working at a liquor store, overweight, ugly, get drunk, no friends and i do nothing but idealize suicide. There is a bridge so close to me but it would be so cold and drowning would hurt like a bitch so i cant get myself to jump. I just want my suffering to end and i just want to sleep, im so done, i just want this nightmare to be over",13Nov2019,1
51,"Something pretty traumatic happened to me a few months ago and I wasn’t able to deal with it emotionally, no support from family members etc.

But ever since that happened, when I cry, I’ll be feeling intense emotions but all of a sudden out of nowhere they’ll stop and I won’t feel anything at all. I’m not really sure what’s going on?
 
Do any of you guys have experience with this sort of thing?",13Nov2019,1
52,I am looking a way to help promote mental clarity. I have had a lot of changes take place in the last couple of months and feel stuck in the day to day. I miss seeing the big picture. How can I help clear my mind?,13Nov2019,1
53,"I have a processing disorder and an array of see-what-sticks diagnoses on my papers. Bipolar, ADHD, BPD, Agoraphobia, panic disorder, the works. In short, they’re not precisely sure what’s wrong with me just yet, so the answer right now is everything.

In short, my biggest issue is that I can’t tune out sound. In a busy room my mind strings sounds from all around the room together. When I’m trying to listen to someone, I’ll pick up sounds from all over the room. They blur together and my mind has trouble picking things apart and I’m left with overwhelming gibberish.

I work in the middle of a busy warehouse store.

Lately the gibberish is making me involuntary visualize things.

Like if I asked you to visualize a banana, I bet you could. In your minds eye you could ‘see’ the yellow, you could see the shape, the details the texture maybe even the lighting on it and the sound it makes when you peal it.

All it would take is someone saying ‘imagine a banana’.

For me, that sort of visualization happens normally.

A child randomly raptor screeching in the store is like a bright white light. A low grumble from a man is like a red, jagged scribble. A backwards shopping cart wheel making that loud nails on a chalkboard sound is a metal spear flying through the air. The general chatter are all sorts of things depending on what people say or how much my brain picks out of the conversation. Sometimes I see spiders or faceless dolls if I’m feeling anxious. Sometimes it’s sun beams. The AC and coolers are like TV static.

It’s maddening. This used to happen in school, and I think it started back up because my job is so repetitive and there’s not enough for my mind to do while I’m working, so it busts out the crayons and colors some pictures and sticks them all over my mind fridge.

Ya, I know I sound batshit. I feel batshit. What is wrong with me? Is this a disorder?

It started up again pretty recently, so I haven’t had the chance to tell my therapist. I’ve tried googling this to no avail.

Any ideas?",13Nov2019,1
54,"This is my first time I’ve used reddit but I’ll be  keeping this as a diary 
Writing notes
Thoughts and feelings everytime I go through my episodes
Hopefully I’ll learn something",13Nov2019,1
55,I can't comfortably maintain any relationships with anyone anymore and I spend a good 90% of my time by myself now. Is this bad? Should I see someone about this? I feel like I'm going to be okay but at the same time I'm really worried for what it could do to my mental health.,13Nov2019,1
56,"     When I was in 7th grade, I was stabbed in the back by my then best friend. Causing my whole school (small) to hate me. Same exact day my great grandmother died (we were very close). This caused anxiety, depression, BPD, anorexia, and suicidal thoughts and attempts. I can’t even tell you the amount of times I held a knife to my wrist or held pills in my hands. I went down 3 jean sizes in one month, and couldn’t leave the house for anything other than school. 
     3 1/2 years later, I still have anxiety, depression, BPD, and relapse on my eating disorder and thoughts. But I’m here. I beat the demons in my mind caused by a girl I thought would be there for me forever. Fuck you Jasmine. I win.",13Nov2019,1
57,"So the first time I remember feeling this way was when I moved across the country to start high school in a new state. I lost all my friends and didn’t fit in and quickly lost the new kid hype and became very lonely and self conscious for the first time in my life, and it’s stuck with me ever since. I’ve worked hard ever since to build up my self confidence and I’ve done well enough in sport/school/relationships/whatever to objectively look at myself from the outside and not feel shitty. So why do I still feel lonely in a room full of my closest friends? I’m 20 now and I’m just worried these feelings will never go away. Whenever I’m with friends I feel like I never know what to say and that I’m making a fool of myself or just feel completely alone even when I’m surrounded by my closest friends. From experience I’ve learned to ignore it because I get that it’s conceptually not true. But I can’t stop the feeling from just pressing in on me at all times. It goes away when I drink at social events, but I don’t want to use alcohol as a solution. I just want to feel confident on my own. Any tips?",13Nov2019,1
58,I have persecutory delusions and for a while I used to believe I was clairvoyant and could talk to spirits/angels. I also had this obsession with numerology. A couple of weeks ago I started seeing a specific number and pairing it with some future bad event. I  now know this wasn't true and that it was my delusion  but sometimes it's hard for me to come to terms with it. Anyone else experience this?,13Nov2019,1
59,"Hello! I hope your doing ok, whoever is reading this. I just wanted to say that everything is going to be ok, I promise.

For over a decade I've dealt with depression and suicide. I always thought that the universe was against me and just wanted me to struggle. I never thought I would get better, with myself or progress in my life.

But I wanted to say that it's going to get better, despite the constant days of struggle that seems so repetitive and never ending, I promise you that it WILL end.

Weeks ago, I was sobbing in my pillow, not eating, not showering, not having any motivation to do anything, isolating myself. But, I told myself that I could do better, I could become better and not let the shadows of my past linger over me, not to allow the anxiety and stress over power me, and to not allow the negativity corrupt me any longer.

A few days ago, I worked out for the first time in months and I did it again today. I started to gain my motivation back little by little, by doing the baby steps; eating a little bit more, not sleeping in past the early afternoon, taking the time out to check up on my friends and call my mother (small things that used to be a big struggle for me) and I have been feeling a lot better than I have before and I feel like I can kick my negative energy and depressions ass right out of me.

I am not trying to flaunt, but only to show that I am living proof that you will get better, that you will overcome what is holding you back, it takes time, but it also takes a lot of will power that I know that you still have in you to beat this. I hope you can rid of the things that hurt you, and destroy it so you can live the life you want without having anything holding you back. I'm still not fully out of it since its been a part of me for half of my life, but I just wanted to say that I am proud of the baby steps I am committing to myself, and I hope you can also make a promise to yourself that you can beat this thing and be the person who you were meant to become. 

""You have to train your mind to be stronger than your emotions or you'll loose yourself every time."" I tell myself this every morning.",13Nov2019,1
60,"What should I expect? 

Is there anything I should know before to make the process go smooth?",13Nov2019,1
61,"I don't understand. It's constant, everyday thinking about killing myself. Sometimes not even because i'm sad, it just plays in my mind. When i'm actually sad, it's so much worse. I know I could end the pain, it wouldn't be hard, wouldn't be painful. But I don't want my life to stop. I want to be with the one person that makes me happy, I want to enjoy meals, I want to watch funny TV shows. I just want to stop fighting my own mind, I feel like it's trying to kill me",13Nov2019,1
62,"I just finished an episode of crying for two hours; exhausting. I don’t really think deeply for things to tumble down to make another person cry but I do/did. It usually goes like this: I’m about to sleep, and whatever thing that comes up in my head that isn’t majorly something to cry about comes, I curl up into a ball with all three of my bedsheets around me, I get tired of not being able to truly let everything out (I imagine breathing or sniffing or sobbing loudly) since I share a room, I turn on music that I think makes me feel better but it’s probably actually sad, I think of every single thing that has made me think a lot about my life and how bad I feel in it, I end up lastly thinking about what I’ve done to myself in the past and how I might do something in the future, and I wake up in the morning reminded of those hours of crying with gross swollen eyes and my mom having to ask me if I’ve been crying and I always deny it. I always tell everyone that it’s okay to cry, it’s good to cry; this is true to an extent—people shouldn’t bottle things up but how much do I have to let out for it to never feel like it’s better the next day",13Nov2019,1
63,"So I've been on medication for anxiety depression etc for a bit now and it seems to have dulled my anxiety to the point where I could say I don't have it anymore, but I think I still do and just don't feel it because of the meditation, my legs twitch and move my heart still races, I still sweat and get overwhelmed etc but I just don't feel that deep feeling of anxiety in my chest anymore.

Is it possible I still have all the symptoms but Im just not as aware of them anymore due to the lack of me feeling the main give away of anxiety?

I'm on 150mg of venlafaxine and 100mg of quetiapine.",13Nov2019,1
64,"I recently decided it was time to fully commit to weekly therapy to heal from a very traumatic childhood, the suicide of my fiancée and the recent death of the grandmother that raised me. I’ve seen about two other therapist but always felt like they just wanted to hear themselves talk. 

I just had a third session with a therapist and I feel like she should’t be saying some of the things she has been saying. 

•Repeatedly asking if I am bipolar (she shouldn’t be diagnosing me).
•Saying I’m on the wrong dosage of my antidepressant and should be on a different one (she is not a medical doctor). 
•When I told her I met a great guy, she said that is for her to decide. 
•She has brought up God and projected her spiritual beliefs onto me. 

I was ready to just walk out tonight after she literally scoffed at a few things I value very highly. She would put her head back and say, “Oh nooooo! I’m not a fan of______. But that’s alright.” I try to use natural alternatives whenever possible in every aspect of my life. She compared the use of homeopathy to the use of heroin or arsenic. I’m a vegetarian and environment scientist and she said being a vegetarian is stupid and the negative effects on the environment caused by mass scale meat production is okay because we (the US) are feeding the world. They way she reacts to what I tell her makes me not want to tell her anything. How can I trust her to support me when she doesn’t support the things that make me who I am? 

She is obviously not the right fit for me but if this is normal for a therapist to behave this way, I don’t want to find a new one. I feel like she showed way too much bias and she made me feel small, damaged and stupid.",13Nov2019,1
65,"I don't know the rules here but I want to post to share. In the last week I have tried to commit suicide three times. The last couple months I have been trying to drink myself to sleep. Sometimes I sleep, and sometimes I wake up covered in sweat and in a panic from my nightmares. Or I don't sleep at all.

I was diagnosed with ptsd a year ago but I have been living with it for years. I haven't asked for help because I'm afraid to finally face it. Tomorrow that changes. I've lost alot of important things to me. I lost the person I love most. I've lost family and friends because of my fear to be close to anyone.

I can't go on like this anymore. I'm isolated and alone. I'm afraid all the time. I can barely sleep anymore and when I do I'm always reliving my pain.  I need to stop avoiding my trauma and finally ask for help. Hopefully anyone reading this and is in a similar situation will find the courage to ask for help.",13Nov2019,1
