,text,time,score
89,"(this survey has been approved by the [r/mentalhealth](https://www.reddit.com/r/mentalhealth/) moderators)

Dear Sir/Madam:

We are a team of academic researchers interested in early detection of signs of depression. The main purpose of our project is to instigate the development of automatic methods that try to learn how to link word usage to psychological problems (e.g. depression, eating disorders, self harm, etc).

We really believe that this kind of ""text mining"" research might be valuable as a complement to more traditional screening strategies. As a matter of fact, there are multiple studies that show that depression is often undetected or detected at a late stage. We think that these low ratios of early detection could be improved. At least, we think it is worth to try.

To meet this aim, we need some data from individuals who were diagnosed with depression. If you were recently diagnosed with depression, we would greatly appreciate if you could fill the questionnaire attached. It is a standard inventory of questions related to depression and used by psychologists at the earliest stages of detection of symptoms of depression. Note that the questionnaire contains a field in which the respondent has to provide his/her Reddit username. This would help us to link word use (as extracted from your Reddit's public submissions) with the level of depression (as estimated from your answers to the questionnaire).

Of course, we will treat the information you provide with the utmost confidentiality and privacy. All information we will extract from Reddit will be anonymised and we will be the only one capable of connecting your username with your postings and your questionnaire. Such information will be kept in an encrypted file and will not be disclosed to anybody.

The information you will provide through the questionnaires will enable us to properly weight each and every symptoms to enable their best identification in what people writes.

We really thank you for your time and consideration, and we hope that our activities help to gain insights into the development of depression and how it affects those who suffer from it.

Link to the questionnaire:

[https://forms.gle/xPcNxLdvFDxGQYrW6](https://forms.gle/xPcNxLdvFDxGQYrW6)

Best regards

David E. Losada, Univ. Santiago de Compostela, Spain ([david.losada@usc.es](mailto:david.losada@usc.es))

Fabio Crestani, Univ. della Svizzera Italiana, Switzerland ([fabio.crestani@usi.ch](mailto:fabio.crestani@usi.ch))

Javier Parapar, Univ. A Coruña, Spain ([javierparapar@udc.es](mailto:javierparapar@udc.es))",13Nov2019,1
90,"Hello. This is hard to convey the best way, but I am a college student who lives 45 minutes away from the school. I started to lose interest in going to school, skipping classes, and not showing up altogether. I don’t know why it’s like the lazy and overwhelmed feeling just takes over and tells my mind and body to just skip it. 

I tired to see a counselor to talk with at school to figure this out. 

A couple of things is that I know I am suffering with something but I don’t know what. I would get this strong sensation of feeling stress, sad, and anxiety all at once but it won’t take long for all of it to go away and I feel nothing, it’s like the emotions balance out and I just feel nothing. The rest of the day I can be productive and do what I need to do but I just feel nothing and maybe slightly annoyed. 

I’m also in Army ROTC to help me to get a career in the military. I know based on what I wrote above might seem like I shouldn’t go into the military but when it comes with work and school these emotions of feeling nothing just turn to focus and out of a social mask and I Do well at work. And the military will give me a good chance to get my life together and help me with a lot of things and it’s good for my major as well. 

I don’t want to see someone professional because I don’t want to blacklist myself from going to military. I know mental health is important but the military will help me career wise and just getting my life together. But I been dealing with this for a long time, it’s just now taking a large toll and I’m starting to lose interest in school because I want to complete my major (my major is in high demand and very profitable) and so I can be an officer and hopefully be a pilot in the military (also helps with my major) 

I tired to go to my schools counselor but at certain points i wasn’t able to make it due to situations that came up that day. 

This might be vague and that’s because I don’t know exactly what I am feeling. When I am feeling the overwhelm pressure I can express it but after that I don’t know and I just feel empty and numb. I can function especially for work and school but other then that I just feel empty. I don’t know where else I can really turn to but would like some advice if possible.",13Nov2019,1
91,"Hey people ! I posted in a different sub before but I'm hoping to have more anwsers here (also it can benefit to more people)

I'm thinking about moving to a foreigner country next fall for a year. Maybe Scotland. I live in EU, no idea how the brexit gonna affect us, but for now it's just an idea.
I'm on 3 different meds and already made micro ajustements 3/4 times this year, so I need a psychiatrist handy. I would have the financial means to pay for consults and everything whatever my job situation would be bc my parents back me up

Did you do that, how did you do?",13Nov2019,1
92,"As the title says I have very self destructive behaviors I tend to try and find a reason for everything. It usually just ends up driving me insane and the reason I come up with is always like worst possible scenario. I never speak my mind because I am afraid of judgement , being weird, or opening up and being drowned in Sympathy. As a result I’m very standoffish and have very few friends. I’ve never really learned how to get over the trauma I had as a child.
I have gone to numerous therapists over the years and feel as though I’ve gotten nothing out of it. Honestly I’ve gotten quite depressed and just need something positive , maybe suggestions on how to stop the negativity I bring into my life, or even just your way of calming down (I used to go to a place near where I lived and sat by a stream to think and now I live in the middle of no where.)",13Nov2019,1
93,"I think I'm on my journey to recovery. I haven't self harmed in months, suicidal thoughts still come and go but the frequency decreased. things just became somewhat of a joke and I'm living life as it comes. currently in the midst of university entry examinations and I think I've got gum infection. 

and suddenly, I feel infuriated at myself. at my younger self. that bitch. self harmed, and now I've got scars. bitch didn't take care of her teeth and I had to wear braces and might even have gum infection now. bitch kept pulling out her own hair and now I have very thin and few hair. scratched and peeled my wounds and now I have so many ugly patches of scars. didn't take care of her eyesight and now I have 700 degrees myopia. I am so angry. so infuriated. at my own self. 

I feel so disconnected with myself right now. I don't want to go back to depression and all. but I'm just so so mad. why did she want to ruin herself so badly? I'm only 18. how am I going to live on? especially after my examinations, I want to go out, live life and have fun. but now I have to take time off to heal from the self inflicted ""injuries"". 

I am proud of how far I came but I am embarassed that I had to go though such a phase. and I am angry that I have so many consequences to deal with right now. right now when I have hope to live.",13Nov2019,1
94,"I have been really sad and unmotivated lately and I have no idea why. I know that there does not have to be a reason all the time but I feel like I should not be feeling this sad.

My self harm has relapsed and im too scared to tell my mom or my doctor.",13Nov2019,1
95,"Lately I feel like I'm constantly angry or frustrated. One of the things I do when I get really angry is hit inanimate objects. Unhealthy I know. I've bruised and bloodied my knuckles way more times than is healthy and I've had to replace a lot of broken things, but I feel like if I dont take the anger out on something I could take it out on someone. I just punched the hell out of my locker at work after my boss did something that annoyed me (gave me two tasks that would take time and got mad that in the time it took to do one, the other wasn't magically completed). Now my hand hurts and my locker is dented and I still feel angry. I'm hiding in the break room trying to calm down by writing this post. 

I've just felt this way a lot lately. Getting snippy with my family when I don't mean to be, getting way more annoyed at little inconveniences, and any times where normally I'd be a little annoyed I get the overwhelming urge to hit something. And never anything soft...for some reason hitting something solid that could break the object or hurt me is the only way I get any kind of catharsis or feel like I'm getting the anger out of my system.

When I was a kid I remember my dad being the same way. Any time he was angry he'd kick the wall or throw something and break it. I remember when he was angry at me he'd pick up my toys and smash them on the wall then later feel bad and buy me a new one. I don't wanna be that way as I get older but I just dont know what to do with myself and am not thinking clearly when I feel that rage building.",13Nov2019,1
96,"Is it just me who feel that its hard to cope with modern life nowadays like you know buying every new products or watching the popular movies i always feel that life is just soo fast that i cant do everything in it and if i dont do that i became anxious for example i dont have enough money to buy the new game called Death stranding i see everyone is talking about it so i feel like im left behind for not buying it so im kinda depressed right know and anxious lol this is so weird to be honest like what if i dont buy or watch any movie or game or buying a new product? Will anyone care about me?

Update: do you guys have enough money to buy all the new things like jesus what is this place lol.",13Nov2019,1
97,Because idk if I'm just too sensitive or whatever but my doctor is kinda offensive or condescending. It was my first time meeting her btw.,13Nov2019,1
98,"I made new friends along the way. I trust them way more than the people around me.  At some point, I just want to cut all my own family and long time friends (Except my grandmother, she's amazing)... What do you do at this point?",13Nov2019,1
99,"I don’t know where to start.
I’ve lost everything in the last three years.
friends &amp; family I’ve just stopped speaking to in the last three months with no reason.

I’ve stopped looking after myself and now I’m underweight.
And I honestly don’t see the point anymore, and I can’t bring myself to call and get help.",13Nov2019,1
100,"Ever since I'm off my anti depressants (almost 4 months) I keep getting these weird flashback moments from when I was severely depressed between 2012 and 2015. I would have a lot of days where I tried to kill myself out of impulse in a place where I had no weapons or no option to do so. And then when I had the option there were always people to hold me to the floor. For example, when I was in my deepest depression I lived in this homeless shelter for youth (I was 19) and forced to go to this camping trip. It was either figuring out a place to stay or joining. Dont get mad, they meant well. Just stupidly organized. I had another one of those self-attacks there when we were done biking. There was a combination of smells in the air that day like burnt wood and wet mud, combined with the hot sun on a cold day. I was feeling exhausted and tired. So the other day I was biking to my friend on a cold but sunny day. Out of nowhere I smelled burnt wood, for some reason I still can't explain I smelled wet mud too. And even though I liked the combination, my heart broke down. I felt so sad. I stopped biking because I had to sit down. And I know it sounds like some PTSS, but I've never been diagnosed before with that. I have OCD, BPD, ADHD and dysthimia. But I never had these flashbacky-ish things happening until I got off my medication. I don't speak to a therapist anymore since a week or two officially because they were all too messy. But it's always a combination of a smell, the weather and sometimes food. But I see food as part of the smells. There's a lot of these examples but this is just the only one I wanted to share because I don't want to bore everyone with áaaalll the things. They're too much to explain.",13Nov2019,1
101,"I haven't seen a therapist, and I'm against auto-diagnosis but... I think that I some point, you just feel those shits.

I think I have a depression, but again, I'm not sure (to be clear, I'm not asking for you guys to diagnose me)
Sometimes, I just think that I'm exaggerating and I'm just feeling sad, but, like... I'm not sure that people with a good mental health are feeling the way I do.

Seriously, do everyone think about death ? Like, is it a normal thing ?
I'm sincerely surprise when I see some people with huge struggles, I just think ""... If it's so hard, why not just killing yourself ? It's so much easier !""

But, with nowadays culture of ""Omg death yas I wanna die lmao I'm depressed"" I'm not really sure if everyone actually feels that way, or others say it just as a joke and I should be worried.
If it's the second case, I don't understand how people can live without being depressed.

Am I normal ?",13Nov2019,1
102,"I'm 19, still live with my parents (who are both mentally ill, old and my dad is the only one supporting us) . We're poor, and have communication issues. I lost my only shitty job, and any motivation to look for another one. I used to dream about becoming an animator, to bring my stories to life, but I lost my chance and eventualy I just gave up. It's been half a year since I finished school and all I do is spend my days sleeping, eating, or browsing the internet. I just finished a survey to know what kind of pastry I am. (Banana bread, in case you were wondering). My point is: If I don't want to do anything anymore, what's the point of wasting resources and suffering? I'm sick of dissapointing people, of people with good intentions and empty promises. At this point I haven't commited suicide just because I want to catch up on Supernatural. That's how empty and worthless my life is. I guess I didn't reallt want to die and leave behind so this will have to do. behind,",13Nov2019,1
103,"I was recently furthering my education in my career only after a few months of starting. It was getting to a point where i was getting so anxious over the things i had to get done, that i could barely sleep anymore, was eating very minimal amounts of food,constantly crying on my lunch break and on my days off worried about what i had to come back to. Today i called my boss and told them it was too much for me and i needed to step down for a while. My boss was SUPER understanding which really helped me, but i cant help but to feel like a failure.. i didnt lose my job, and I got the offer that whenever i feel im ready, i can go and further my education, but that part of my mind wont let it go that i failed. I cant do anything in life right.. anyone else go through something similar or have any advice?..",13Nov2019,1
104,"I have a job that allows me 10 free counseling sessions Through Compyche?  (I think that is what it’s called.) I’m currently out of work and have no way of directly asking someone unless I go into the building. I would like to use those 10 counseling sessions to get a jump start on getting the therapy I need. I just don’t know where to start, and would like to seek counseling ASAP.",13Nov2019,1
105,"Forgive the profanity but Jesus fuck fuckity motherfucker fuck I am angry right now.

A little over a month ago got into a conversation with a cousin I don't know super well who lives in another country. Acknowledged that I wasn't doing OK and she asked why and said she'll listen and like an idiot and took the bait. 

Of course she had more talking than listening to do and insisted a book on the power of the subconscious mind (written in 1963 by a total quack) would cure me of my depression and a whole lot of other garbage and platitudes. I don't know why I even engaged but it took forever to just get her to fucking drop it. 

Well, it looks like she got my new address from a family member and decided to send the book my way and just messaged to let me know. The address is not correct, though it might still arrive here. It's going straight in the trash. But she's so fucking smug and feeling clever. I told her next time to send it to her dad because maybe it'll cure his alcoholism. And yes it was a dick thing to say but WTF. 

This woman fucking MOCKED me a month ago by talking about how active listening is for children and I guess we'd have a better conversation of she just said ""Mhm"" and ""aha"" and nothing else. YES we probably would have. 

I blocked her. I'm so angry.

Lots of people ostensibly want to help, but honestly they just want to prove that they're right, that they know better, that they have a solution, and if it doesn't work or apply it's because I'm too negative or uncooperative or whatever. I've spent so much of my life beating myself up for being depressed and things I have no control over. I don't need someone swooping in and thinking it's funny they got one over me because they'll force a stupid book into my hands. 

I was on the verge of being hospitalized a month ago. I don't need a fucking garbage book and someone just waiting eagerly to say ""I told you so"" or ""well you just don't want to be helped."" I battle this thing every day. No one can tell me I'm not trying. 

Can't wait to hear from my mom or whoever else she goes to about how rude and difficult I am. It would be nice for a change if someone defended my boundaries and dignity and tried to listen and understand instead of telling me what I need and how to act.",13Nov2019,1
106,"I often fantasize about tearing the voice box out of a newborn then shoving it down their throats. No more crying for you, pathetic rat.

Dont know why i think of this but there's mine, i know you have yours.",13Nov2019,1
107,"I was asked in class today to write a research paper on any topic i would like. Given my history and struggle with it I want to write on Mental Health in Teens. The schools database sucks tbh and i was wondering if anyone could point me towards any good books or papers written on the topic. 


Thanks a million in advance and hopefully this post doesnt get taken down.",13Nov2019,1
108,,13Nov2019,1
109,"I'm from Hong Kong. There has been a lot of shitty things happening, many were injured and arrested during protest. Many people had killed themselves at their homes. My family is starting to tear apart because of some bullshit political disagreements. Everyday i have to live in fear, to not be confronted by police or aggressive protesters. I'm currently in a really bad mental state and this social unrest is starting to make things worse, how do I cope this stress?",13Nov2019,1
110,"I’m a 20 year old female recently having a struggle with life. I feel so alone, because my mental health has completely taken a turn for the worse about 3 months ago. I recently started therapy just last week because I have become aware that something is not ok. 

I live an alright life- not with my parents- i live with my girlfriend and her family a state away from my home town. 

These past few months I have felt so detached from the world around me, and I feel like I am just existing inside of my own head. 

I have no attention span. someone could be talking to me, telling me a story and I will be paying attention to them as if I am listening but i really am not, which is the frustrating part I cannot help. someone will tell me a story; or at work I will be given directions and I will respond as if I heard them, but once the conversation is over I realize I do not retain any information that people say to me. I am very forgetful lately which is also so unlike me. Everything upsets me, has a toll on me, and i take everything in and just dwell on it until it eats me alive. 

I cannot express happiness. Sometimes I will feel it, but I cannot show that to other people- it feels impossible. I have no motivation, no will looking forward. Everything around me is becoming so unorganized and it’s my own fault but I can’t seem to snap out of it. It’s scary because I just feel exhausted, like every day is the same and i’m just pushing to the next day for no good outcome. 

I have the worst car anxiety. I have never been in an accident and I have always been a great driver. But lately, in the car I’ll be driving then all of a sudden I will get hot flashes and start to shake, my heart feels like it is beating out of my chest and I feel as though I am going to end up in an accident somehow. It’s terrifying because I don’t know why my body has this reaction all of a sudden. There is nothing to be triggered. 

I have woken up with extreme stomach pain, heavy chest, sweats, fast heart rate, all followed by instant vomiting AS SOON as i wake up. I can’t even lay in bed because my body forces everything out of itself. It has affected my work because my body is just in excruciating pain every morning before work. I have been losing weight fast- which is unlikely for me- i never lose weight even if i’m trying at the gym. 

I have no appetite. I even was going to see doctors for the longest time, but all my tests came back normal for diseases or any food allergies. That is when I finally convinced myself to go see a therapist because maybe it isn’t a stomach issue. 

I am scared because I am not like myself anymore. I am so negative, all I do is complain and I cannot seem to find an ounce of happiness in anything that used to make me happy. I have tried everything. I am physically and mentally exhausted inside of my own body but there is no escape. It has started to effect my relationship because my girlfriend says she feels as though she is not making me happy, which is not true I love her more than anything and want to be with her, my mind is just really messing me up. Nobody seems to understand around me, no matter how much I try and explain myself to them. I feel like I am just a bother to the people around me with the issues I have going on, so I stopped talking about it, but that just causes my thoughts to build up with nobody to express them to. 

I have only had my assessment for therapy so far, so that is why I am coming here to see if anyone has experienced anything like what I am? 
(My first therapy appointment is in 2 days).",13Nov2019,1
111,"Making playlists is my biggest and most helpful coping skill. Here are songs that represent and encompass different mental health situations.

https://open.spotify.com/playlist/77XsndAgy1ZWYxzhfXjuyx?si=HQlwaSSVRJSmXWouxAz1CA",13Nov2019,1
112,"i feel horrible. but i got out of bed and went to school on time today, a week ago i probably would’ve just stayed home.",13Nov2019,1
113,"I don’t know what to do, so I’m coming here in hopes of something, but I don’t know what.
I’m a mess, about a year ago I developed a pretty severe addiction, as a result I lost my wife, my kids, my home, and my license ( not a dui )
I started picking up the pieces over the summer, but just lost motivation/hope, I was working hard and advancing myself as a welder, I had a good job which required a high level of skill, this was a huge accomplishment for me, considering I have no schooling, I had been working toward this for the past 3 years, and i was making good money, but I was still depressed, I relapsed took a week off, went back for a day and never returned, my anxiety is through the roof.

I have been ignoring requests for interviews ever since, I feel I have no purpose in life at this point, my family as everything.
I can’t even make a call to get a family doctor so I can get my license re enstated, I’m scared of the leg work and terrified my efforts will lead to more work, I’m afraid that I will have to start over, everything scares me. I would rather not try the. Fail again, I’m tired of falling, I’m tired of living, I honestly cannot envision a better future for myself, thus every effort to move forward seems pointless, I live to give my ex money every month that she doesn’t even need.

Every single thing I need to do, I can’t I freeze up and either try to distract myself by something that doesn’t matter or sleep.
I’ve been talking to people about killing myself, I’ve never done this before, I’ve always kept Thea’s feelings privet, but seriously I can’t take this anymore, everyday is filled with thoughts of all the shit I have to do, followed by feelings of pointlessness, I should seek help, but I can’t, Ive let myself down too many times to trust myself not to do it again, I’m tired of feeling good just to loose it all again. 

I’ve given up on myself, I need help, but I don’t think their is any.",13Nov2019,1
114,"Just a thought. I think if you have depression congratulating yourself on small tasks is such an important thing. If you walk to the shop to buy milk, say well done to yourself. If you brush your teeth, say well done to yourself. See everything that isn't a symptom of your illness as making a small victory against it. Enough people will blame you for your depression, including yourself. So any moment you can to do the opposite, take it and run with it.",13Nov2019,1
