,text,time,score
147,"Ya so basically
A friend made me realize that my personality was the reason people didn't want to be around me, and since this summer I've been trying to change that. My high school social life has been a disaster, but I want to change myself until college.
I first managed to get rid of victimising myself &amp; drowning myself in self pity. I realised that people don't give a fuck about my suffering. They all have their own problems, so there's no need for me to shove my sorrows down their throats. Also, the world doesn't revolve around me. That was pretty easy.
Secondly, I started thinking twice (or more) before I speak. I am an impulsive person, so I used to say or do pretty cringy things before that. I shut up more now, think about whether what I'm going to say next is contributing in any way to the conversation, if it helps people perceive me better and so on. I still have outbreaks, but they are getting fewer and fewer.
I'm also trying to give off a positive vibe. Smile more, compliment friends, be kind.
All the things mentioned before went fine. I'm glad I did those things. But here comes the tough part... you know, I'm a weirdo. And I want to become a normal person. I want to be like the other girls, feminine, reserved, calm, confident, mature, blah blah. Maybe even superficial. Because this is what guys are attracted to haha. And I want to be loved.
But the fact that I have to get rid of that weird kid inside of me, kill him, or hide him behind some mask, it's tearing me apart. I feel so miserable. So bad. I've spent most of my life believing that I am worthy of love just the way I am, that I should be myself and other bullshit, and now I realise that was wrong. Because no dude wants to be around a weird, occasionally hyperactive, childish girl. Oopsie.
Most girls in my class have boyfriends. And friends to party with. I don't. And they are all so unlike me. Just nice and feminine. I want to be like that too, but also work on my other hobbies &amp; passions and develop myself (playing the guitar, art, going to metal gigs, reading, photography etc etc)
But I feel truly miserable because the 'true me' was unworthy of love. I just want to change, to become like the rest of the world, a bloody normal girl that leaves either no impression or a good impression (unlike now haha), but I don't have the power to do it. I don't have the power to do anything. I just feel sad and lay in bed most of the time.
Advice? Please? Pretty please?",13Nov2019,1
148,"I am back in my hometown having dropped out of college after a major depression diagnosis and the absolute prohibition from my psychiatrist to try and keep going or working until I improve. In many aspects I feel like I have improved, but for a while I have felt frozen and, specially, lonely. I need social interaction, to speak with someone, to hear someone's voice, but I feel like I can't really contact the people I know irl for most of the time because I don't want to be bothersome. I'm boring, and don't have a ton to talk about except my mental and physical health, from which I'm even tired about.
I have tried r/needafriend, but I can't really be consistent enough for a long term friendhip, and I tried r/casualconversation 's discord, but honestly I haven't really figured out the app (discord) and I get anxious. 
I'm kinda at a lost here. If someone has any advice or ideas, it would be greatly welcomed. 
Have a great day :)",13Nov2019,1
149,"She wants me to call her to confirm an appointment. I don't call anyone or take calls from anyone, even my own school counselor. I had severe anxiety. Anyways, she made me save her number on my phone (fuck that), and now she wants me calling her. This is too much. What do I do?

**Extra info: I do not need this appointment. I am only doing this for the greater good. I have made up my mind on what I'm going to do. This is just for my own sake to know that I did try. It might not make sense at all now, but it will, in time.**",13Nov2019,1
150,,13Nov2019,1
151,"Thank you for any advice or information but I cant sum it up easly so hopefuly some strangers on the internet help me.

It feels like I'm on auto-pilot, I don't usually think about anything before I do it stuff just happens. After a day if I think back I can't remember anything that's happened, I know that for example 'blank annoyed me' but I can't remember exactly what they said, where or what I was thinking. It never feels like time is passing I just watched a movie and there doesn't feel like any time has passed since I woke up this morning. When I think back I just remember the key points like: I liked that song, I thought that was funny, the animation of this character was cool'

Thank you for any advice or infomation",13Nov2019,1
152,"So all my friends know I have struggled with depression since the fifth grade and it’s gotten worse in the past few weeks. I no longer have a motivation to get up or tell people how I feel. The only thing I look forward to is my therapy session I have once every two weeks and that’s where I lie to my counselor for about an hour. I feel like if I tell people my feelings they’ll hate me forever or not care. But today I had courage and I messaged my friend about how I’ve been feeling, and all I got in return was “oof”. I wish there was someone I could vent to or just be friends with that wouldn’t get all awkward about my past of self harm or my anxiety attacks. It’s just getting to the point where it’s making me lose friends. So do any of y’all have tips.",13Nov2019,1
153,"I took my official first dosage. A lot of people complained about concentration problems but I feel totally fine! 

I am able to concentrate, if not I can concentrate even better! 

I know it's silly to say this because lexapro is a long acting medication but after the first dosage I felt a balance in my mood whereas my mood would usually be up and down 10 times in the morning - which consists of me fighting back negative thoughts.

I really feel like this medication paired with cognitive therapy will really set me on a better path!",13Nov2019,1
154,"When something gives me anxiety I can't relive it like it feels like it should. When I was a kid I could be anxious about something but could easily change my mood if I did something else almost immediatly. Like playing a video game, watching tv or reading something would give me a relife from what made me anxious or sad.


Now when I get into a anxious though I have to focus on something else for hours or sleep it off to feel like that feeling goes away. Is it cause im an adult now?",13Nov2019,1
155,"It's 3am where i live I'm using a throwaway because i feel so fucking pathetic to be trying to get this off my chest on the internet. I belittle myself everyday subconsciously i know i am worthless. Every second i'm out in public, my immediate thought will be to end myself. I'm on major depression and anxiety medication which i've tried to overdose on 3 times and end up hospitalised and put on my local suicide watch which i get calls every 12 hours by my therapist telling me if i'm okay and asking about my thoughts . I try to go out and have a normal life but i can't seem to get the shitty self-deprocating thoughts telling myself i am small and useless. I've been going to see my therapist and she's nice and all but i feel like i'm not opening as much as its abit useless for me to share my feelings to someone who doesn't genuinely care about me and not really listen to what i have to say. I just hope someone who reads this would understand what i feel and can get through this shithole of a life",13Nov2019,1
156,"I’m a 33yr old man. As I look back on my life I realise from I was 18 until I was 30 my life was a failure of regrets and lack of achieving anything. I’ve started to better myself and improve my life. What really tortures me is regret. Like how I used gel my hair terribly and cut it myself (like in strange ridiculous ways) and it bothers me that there’s still photos that exist of this. I used buy jeans that were too long for me and then cut them shorter destroying good jeans. I know most people regret things in life but my problem is I don’t understand why I lived this way and my mind won’t let me move on, it constantly says that these things define me still. It’s like I can’t move in my mind.",13Nov2019,1
157,"I'm sorry if this is the wrong subreddit. I just really wanted to get these things of my chest, and wasn't sure where to do so.

I feel like i have competently ruined my life. I just feel so ugly, and useless. It all started when I was in my late teens, and I seemed to be unlucky in getting various blemishes all over my body. Most of which aren't going away. It recently got worse when i got what i thought was a sinus infection. I went to the doctor and found out i had a infected tooth, and they recommended me to a dentist. I went to the dentist and they told me i had several infected teeth, and that they where going to pull all of my teeth. It was such a big shock to hear the dentist say that being I'm only 22 years old. 

I just recently went to the dentist to have it done, and ended up using all of my vacation time from work that i had planned on using for a vacation to recover. I found out when i woke up that they only ended up pulling half because i was physically shaking so bad from fear, and they had to put me out. I have been living entirely on pudding and soup, 

They gave me a temporary denture to wear, but i can't even get it in because i have such a bad gag reflex. I can't even eat soup with mushy crackers in it They want me to go back in several months to have the other half done, but I'm debating not following through with it. 

I'm just so tired of being me. I feel so useless, and i just hate my life. I just want to feel normal again",13Nov2019,1
158,"Hi r/mentalhealth,

I’m here to vent about my complicated relationship with my psychiatrist. For context I am 25, and I believe he is 35 years old. He is technically a physician’s assistant, but he prescribes me medication and is the only medical staff that I interact with at the clinic.

I had initially gone into the clinic 1.5 years ago to address my anxiety disorder and ADHD. I had chosen this particular PA because of his outstanding reviews online and close proximity; however, when the nurse introduced us, I was surprised by how handsome and young he was and immediately started to have a panic attack. I tried to keep it lowkey, but as he was doing the standard questioning, I could feel my face getting flushed and I could hear my voice shaking. It was very embarrassing. Also, he had to shake my gross sweaty hand as I was leaving. 

Fast forward a couple sessions, and we’ve found the perfect combination of medications to help me feel balanced. I can honestly say I feel better than I ever have, and because of one of my prescription’s schedule 2 classification, I have to go in for an appointment every month. For the past year or so, my medication has been so reliable that our appointments have gotten very casual. Unlike our previous appointments, we now talk about our personal lives and topics that we find interesting. It is at this point that I started to sense that he is interested in me.

Now that I’ve covered the background, I’ll get to the weird stuff. A year ago, I ran into this PA at a fancy cocktail bar in my neighborhood. He got up and left very soon after he saw me, but at our next appointment he brought up the encounter. At one point, he asked me what kind of alcohol I like to drink, and it came up that I don’t like tequila. Well, apparently, he is a tequila fanatic, and told me that if he ever runs into me at a bar again, he will buy me a shot of his favorite expensive tequila so he can change my mind. Not terrible, but vaguely inappropriate. Recognizing this, I started scheduling my monthly appointments at the same clinic, but with different PAs. This only lasted about 3 months, as I didn’t have good experiences during these appointments. 

&amp;#x200B;

About 3 sessions ago, I mentioned that I was experiencing heightened anxiety, and that my antidepressants weren’t working as effectively anymore. When he questioned why I was so stressed out, I disclosed that work had been tough, I’d gotten into a car accident, and that I had an ex-boyfriend who was trying to reconnect. This ex-boyfriend and I broke up due to long-distance issues. I was absolutely in love with him, but when I had to relocate for work, we decided to end things. I told my PA that my ex reached out and said he wanted to visit me and potentially work things out— that he would maybe relocate in order to make the relationship work. And the PA’s response was “what’s the point? You guys broke up for a reason. I’d advise against it”.

So my ex ended up visiting and it was nice, but we decided it’d be best to stay platonic. My PA also adjusted my medication very promptly and I regained control of my anxiety.

Today was my most recent appointment, and the weirdest by far. I don’t feel good or bad, just weird. This session also lasted a very long time—almost 50 minutes. Usually our sessions are 30ish minutes, but I think that they’re actually only supposed to be 15 as they’re check-ins? I could be wrong. This has never been clarified. I just get up and leave when I feel like it. Anyway, he asked about my ex again despite me telling him that we decided to remain friends during a previous session, and then we spent about 40 minutes talking about politics. I joked that I use a dating app as a tool to campaign for a candidate that I like, and he was like “hm I wonder why I never saw you on there. I’m also on that app”. He then showed me a picture of his friend who is also a PA, and asked if I was interested. I asked if it’d be weird setting up his friend with one of his patients, and he was like “I wouldn’t introduce you as my patient. I’d say I know someone very pretty and very smart.” And at that point I politely declined and left. 

So now I’m at work feeling confused. I’m attracted to him, but I also know it’s wrong.",13Nov2019,1
159,"Hi. Not really sure how to start this, and I'm probably going to delete this later. I'm 18 and from New York state. I was diagnosed with depression and anxiety in 2013-ish, and was hospitalized for a week and a half in 2014. I was on Zoloft and Seroquil for quite awhile, but I was weaned off of them once I started to manage my symptoms with therapy and healthy coping skills. I went to weekly therapy for probably a year and a half after I was hospitalized, and as far as most people in my life are concerned, got ""better."" I was doing really well up until June of this year- I'm not really sure what happened, but it's been downhill since then. I'm trying not to give too many details for the sake of brevity, but I just genuinely need some advice and second opinions right now.

On top of my mental health issues, I also have chronic migraines, PCOS, and a condition called MALS, which manifests in GI issues and pain in my right side. Both of these are being treated right now. I also have something going on with my Thyroid (undiagnosed at the moment) that probably isn't helping.

Right now, my depression has gotten bad enough that I can barely get out of bed, most days. Even though Theatre is usually what keeps my energy up and keeps me happy, I can barely enjoy it right now. I'm in three shows at once, and it's a good distraction sometimes (mostly when my energetic friends rope me into doing something) but if I'm not being distracted, even if I'm surrounded by what I love, I just feel alone. Every little thing that goes wrong will send me into a sobbing fit or panic attack because my self-esteem is so fucking fragile right now. I can barely function at work, if I even make it to work in the first place. I've genuinely been contemplating killing myself again for the first time in about a year- I'd never do it, but the thoughts are there. If I did it, I would hurt others even more than I already have, and I can't do that any more. Kind of in the ""wishing-I-was-never-born"" place right now, which is ironic, because one of the plays I'm in is 'It's a Wonderful Life.' I hear that message every single day at rehearsal, but all it fucking does is make it worse, because all my brain goes to is ""Your life hasn't touched that many others. You're not like him."" I'm trying to make time to go to therapy, if I can afford it, but even then, my therapist barely has appointment slots for me anymore and I can't hunt for a new one again. I'm trying to find a psychiatrist to get on medications again, but I don't know if that would even help, or if it would just make the fatigue and weight gain worse (I already have that from various conditions and that's all it felt like the meds did last time I was on them). I have time to take care of myself, but by time my day is over, I usually just go home and lie in bed, in my clothes, and cry until I go to sleep. 

**Point is. My coping skills are minimal at best, I'm so busy that I barely have time to get in to see a therapist or psychiatrist, I fall apart at the slightest thing that goes wrong, I'm so unstable I can barely take care of myself. I don't know what to do. I can't really drop out of any shows I'm in to make time, the hints of peace and distraction I can find in those (not nearly as much as usual) are the only reason I haven't just given up. Part of me thinks hospitalization might be the best idea, but I don't know if I'm ""bad enough"" for that to be an option, and if I was, I would have to check myself in, I would probably get fired from my job for missing a week straight, possibly more, and quite possibly get kicked out of the shows that I'm in because of it. I don't know if I'd be able to hold myself together if I was in therapy only once a week, it doesn't feel like enough. I feel like hospitalization, a week of just trying to get my mental health back on track, would be the best answer, but I'm so afraid of losing all of the opportunities I've worked for because of it. But then again, I can barely enjoy what I have right now.**

I'm sorry if this is a lot. I have virtually no one I can talk to about this, every person who's willing to listen, there's a reason I don't feel like I can talk to them. Some of them just stopped responding altogether, or I heard them calling me a burden behind my back, and I don't want to bother them more. I'm an actor. I'm great at hiding what I'm feeling, I'm used to bottling my emotions up, but I can't do this anymore. I feel so fucking alone in this, and lost, and I feel like I've worked so hard to get myself all of these opportunities, but now I'm stuck with my own thoughts and no time to try and take care of it. I don't know what to do. If anyone got to read this thing, I'm sorry it's all over the place, and so long, and barely said anything useful, can you just let me know? Even without advice, just knowing that someone heard me means the world. Sorry again for the length and nonsensical nature.",13Nov2019,1
160,"I'm beggining to feel like I can't remember reality correctly and it's starting to bother me. Apparently I keep confusing different parts of different days together, creating occasions that never happened. It happens frequently. And now I've been making up parts of the day that happened differently, but they never happened another day. I understand that everytime you remember something, your brain may change it just the slightest so it's not 100% accurate, but these memory changes seem too drastic to just be that. I don't know. I'm just frustrated I guess. Sorry. Just a vent.",13Nov2019,1
161,"I have been suffering with anxiety i think for a while on and off but recently much worst finding it difficult to go to work and everything feels like effort, just do not feel myself, also worrying that i am losing my mind literally for the last month i will sit for hours convincing myself i have lost my mind, another worry is psychosis recently i always notice my own shadow in certain types of light could this be heightend anxiety or am i losing it ?",13Nov2019,1
162,"So, I am an odd person. Was almost diagnosed with Asperger's, then all symptoms left over the course of 2 months during testing. Tests were never completed but I have a couple symptoms. Almost un noticable to others. Thats besides the point, you might just need to take that into concideration to this next part.

Also I didn't know what sub reddit to put this in so this is the best one I could find.

So I am 15 years of age. I am an extremely deep thinker and have been since I was 8. Back when I was 11 I started meditation (I was a woke ass kid lmao). I started meditation to help myself lucid dream. So I became very aware of everything. Peoples patterns was something I paid attention to, aswell as learning how things worked instead of just accepting that it exists. I can almost predict people and how the react to a situation. Along with this hyper awareness came a feeling that forced me to remember that I am conscious, and like hyper aware of my consciousness almost like I am viewing it from a 3rd person view. It happens at least 3 times a day and up to 10 on bad days. 

I do not understand what this is. Is it mental illness or is it something everyone has?

TL: DR I am hyper aware of everything around me and how I am concious quite often.",13Nov2019,1
163,"Honestly, I've had too many things happen over the past few weeks. My grandmother has passed away, I have moved school and my dog is presumely going to be put down or sent away soon.

I can't take it anymore, my mental health is shit and I feel terrible to let down two I of the most important peoole in my lifea and I'm currently shaking.",13Nov2019,1
164,I applied for another position at my job’s workplace I thought that this could be the beginning of a end of a job I hate that has been causing me depression since I don’t feel like I have a good relationship with my boss and don’t really feel appreciated. I went in the interview today and after it I was told that I had to tell my boss about getting the new position there since I’m in a two year probation period with 7 months to go. I wish I knew about this before hand and maybe some of it is my fault for not knowing but if I did I don’t think I would have applied. I’m thinking about maybe just saying I’m no longer interested so my boss doesn’t think I was just trying to get away from her as I did average at best during the interview. I just wish there was someone I could really talk to about this as I don’t want my friends or family worrying.,13Nov2019,1
165,[removed],13Nov2019,1
166,"Tw: sexual assault


I was sexually assaulted by this guy I’d been seeing casually for two months last week. Since then, I’ve had three or four anxiety attacks. I’ve never had this many in a row so obviously what happened destroyed the last of my mental health. I talked to him about what he did to me and he never responded. Idk what to do and I honestly just want to die. I can’t breathe.",13Nov2019,1
