,text,time,score
0,"2 years ago I decided that I finally wanted to get mental health help. I've been on medications since 2013 but have never sought to speak to anyone about my issues. I saw a counselor in January 2018. And the 4th session she put (or police I dunno how it works) a 5150 on me and called the police. It was because I told her that I fantasize about killing certain people sometimes. And in the past when some things were happening I almost [trigger warning] let's say went postal. When the cops got there they stormed into the counselor's office where I was and one had his gun and said, what's this about you wanting to kill someone!? I'm like gee I was just opening up. 
The beginning of this October I started going through a manic episode.  I had just came off a 2 month depressive episode in September. I was running my mouth a lot because of my racing thoughts to the counselor. And he grew concerned and wanted me to check In to the psych unit at veteran affairs. I said I would but I didnt. Becaise my last experience in January 2018 was terrible. I was put in a hallway for 12 hours with patients, doctors, nurses running back amd forth for *observation * it wasn't until I was like wtf! And I started flipping out that they out me in a room. There were no groups or anything. It was just a nurse checking in me twice a day for a couple mins while they tool vitals. AMD a doctors asking me questions for 5 mins since a day. Amd the weekend was nothing at all. I even ended up getting into a fight because this other patient came I to my room and attacked me.
The next time I see my current counselor I'm still bouncing off the walls amd telling him things. He did t put a hold in me but called a team that escorted me to the psych ward. Er first them got admitted.whem I got out I had a session and he said it was because what I was saying about slicing sim3ines butt cheeks off, painting them amd wearing like a joker mask.",13Nov2019,1
1,"I live with general anxiety disorder &amp; major depressive disorder &amp; I feel like these are the two big culprits when it comes to me making stupid mistakes and trusting the wrong people &amp; sabotaging good things for myself.

It’s like my brain does some chemical nonsense that MAKES me do stupid things. Today, for example, I burned my dinner. Don’t know why, don’t know how. It seemed like it was in the oven for 20 minutes and it was half an hour. I don’t know why my brain made me think it wasn’t that long. Stupid thing to think about but it’s a prime example. I’m constantly making stupid little mistakes and I can’t understand, in retrospect, why I do them. And it makes me feel useless, like someone normal wouldn’t do dumb throwaway things like that.

TL;DR: How do you stop your dumb brain from messing up the simplest of tasks that you really have no business messing up because you’re not an infant &amp; guilt tripping you for hours and hours, even days after?",13Nov2019,1
2,"I was diagnosed MDD last year, I was in such a bad place that I failed almost every class for two straight semesters. So I left school and everything I thought I knew behind , and spent the majority of 2019 doing simple things to rehabilitate my mind. It’s now November and my school dean is telling me that I can return next semester in January if I’m in a good mental space. I said I was, and I’m Definitely better than I was last year, just not 100%. The thing is, I have to take 4 classes and if I get anything below a C I will get academically dismissed for good. I feel like I need to go back to school and study but I’m scared shitless that I’m going to fail again. I still have problem with concentration. Should I go back?",13Nov2019,1
3,"Since depression has faded away it has just left me with other problems. Social anxiety, anhedonia, irritability and horrible anger. I am completely withdrawn at school and barely speak. Partly because of anxiety, partly because I just have no interest in talking to anyone. I’m still struggling to find anything I actually enjoy to do. I can’t feel happiness. The only thing I seem to care about are drugs. The smallest things can completely piss me off and ruin my day. When I get angry I feel an overwhelming desire to break something or hurt myself to feel relief. Not cutting just like punching or kicking something until my hand or foot hurts. Only then do I feel less angry. Just a little while ago I spilled water on some papers and I got so angry I had to tear a folder up and crush it to feel just a little bit better. I’m still pissed. My thoughts are still constantly negative. Anytime I see someone I manage to immediately think of something I don’t like about them. It makes me feel like a horrible person.

Fuck depression. It took my life from me and I’ll never get it back. Does anyone else feel this way. Can anyone else not get adjusted back to normal life after being depressed for so long. Fuck it’s hard.",13Nov2019,1
4,"It’s like a cloud that I can’t see through to the path ahead. As I further into my twenties, the cloud has been getting progressively thicker. I am told by friends and family that I am resilient, and strong because I keep fighting an uphill battle in life, but I started to wonder if all the obstacles I am fighting in life are only self produced. That I am self destructive enough that one day that cloud will become smoke, and I will soon suffocate from inhalation. 

Some background: medically, I am diagnosed with BPD and anxiety disorder. A fun cocktail I know. But who knows. 
I am now 20 years old, going on 21 and began official treatment first for depression when I was 14 due to a suicide attempt and hospitalization. My treatment would come to a abrupt stop after a year due to my fathers reluctance to accept that mental illness is actually real. He would exclaim, “it’s all in your head!” Which is hilarious because isn’t that the point? That I have something wrong in my head? 

I wasn’t always aware that there was something wrong with me. I was taken from my mother due to an abusive situation when I was 6 going on 7, relocated with my alcoholic father ordered by the state; in my childhood I witnessed alcoholism, violence, poverty, drugs, and homelessness. The verbal abuse (sometimes physical) and emotional neglect from my father and lack of stability molded me into a person I now understand to be a defensive, emotional, anxious, irresponsible, obsessive, disorganized, inclusive of many more qualities I am now understanding to be consuming my identity. I don’t know who I am, except for all of the things my father would tell me that I was: nasty, an asshole, disrespectful. And now all of my relationships such as coworkers, professors, friends, and romantic seem to fall apart in which I can only point to the one culprit, the one common denominator: me. 

With aging into adulthood, developed this self awareness that is transcending to a prediction of my inevitable demise. I’m starting to really consider giving up, because... well... what is the point? 

I now second guess every decision, word, or thought I produce: is it rational, is this true reality, or is my perception of myself and the world just misconstrued by my mental illness? Is it all my fault, like my father told me, or was I born in this world to have bad things constantly happen to me and given the disability of not being able to cope and overcome? 

How do I separate my illness from who I am? Maybe life creates the uphill, my father placed me on that hill, and my mental illness added all of the obstacles....",13Nov2019,1
5,"I'll explain my situation in the post, rather than the title since its fairly detailed.

I am effectively scared of the cold. Its winter here in the UK, and?d a cold one too. Everyday I go out, and the weather chills me quite literally to the bone. Im at the point of feeling lots of anxiety when I need to go near any kind of cold water, or outside into the chilly air.

I tried to start taking cold showers in order to negate this + the benefits you so often hear about as a way to manage the anxiety, however it has if anything made it worse.

Coming home after being cold also makes me extremely depressed, to the point of literally wanting to off myself.


A doctor won't help me, imo. Too much of a stupid question.

I've been very stressed with exams recently, too, if that has anything to do with it.

Sorry for this post being lack luster, im typing on my phone and my hands are very cold.",13Nov2019,1
6,"hey guys, how are y'all feeling? 

well, I don't know if someone will answer this, but I had to try it anyway. today I realized that I can't speak out loud among strangers or people that I don't have a really close relationship with. every time someone else asks me something I usually just nod, whisper or even mimic my answer. a lot of people already pointed out to me that I speak with a really low voice and I get really nervous answering other people (sometimes I even mess up with the words). any clues about what is my problem?",13Nov2019,1
7,"idk if this is the right sub at all but it’s like the only place i feel i can go right now and i’m freaking out and idk what to do.  also please for the love of god do not say some shit like “wow way to brag” after reading all of this because honestly it’s really fucking difficult for me to even put this out there, and if people just think i’m doing this for attention i’ll end up just deleting to post and not getting any help. 

okay so full story: 

i’m a male in my very early 20s. i do have mild social anxiety and i’m prescribed meds for it (Paxil, 25mg) but i haven’t taken them in a while so they don’t really have any impact on this story. Anyways, two nights ago was a big night of firsts for me (namely: first kiss and first time having sex). i was with a woman i find incredibly attractive, both physically and her personality. however, when things got going and we started to kiss, i noticed that i didn’t feel anything emotionally. nothing. no magical sparks that people talk about, not even a slight little tingle of joy. i pushed passed it because i thought that maybe i was just overhyping it since i waited so long before actually kissing someone. fast forward to us doing it, and i suddenly cannot get a fucking erection. this has literally never been a problem for me when i’m alone, so i played it off as i was nervous but honestly i didn’t feel anything. no nerves, no anxiety, but also no connection with her. i rarely watch porn when i masturbate, because i’ve heard that it can lead to things like this happening, so that’s not the issue. i ended up getting one eventually, and went about the deed. however, i still never felt anything emotionally. 

now, here is where things fucking terrify me. so, i had a date planned with another girl for last night. it had been in the works for a while, so i thought it would be unfair of me to cancel it because of the events of the night prior and everyone seemed fine so on the date i went. apparently it went well because we also ended up hooking up. however, this time i swear i felt even less emotionally. I had the same erection issue, but due to time constraints i didn’t have time to wait for “eventually”. all of the other problems continued to persist as well. no sparks during any part even tho i am incredibly attracted to all of her, no anxiety, just a whole lot of nothing. i had hoped that maybe just maybe all of those issues i had the first time were just a one time thing, but nope this confirms that it’s an actual issue i have. 

this isn’t just a issue i’ve noticed in my love life either. on friday my mom informed me that one of my great uncles passed away. i was really close to him as a kid, i stayed over at his house with him and my cousins at least weekly for years. and after reading her text, all i thought was “aww that sucks” and then i just moved on. no tears or real sadness, just what i can only assume was pure apathy. i had the same reaction when my grandfathers both passed away about 4 years ago, and when my great grandfather passed away about 7 years ago. all of whom i was fairly close with, i even lived with both of my grandpas for about 2/3 years each. 

all of this leads me to one conclusion about myself and it fucking SCARES me. i have been essentially laying in bed all day have intermittent fits of overwhelming fear where i just cry my eyes out because i don’t know if i’ll ever actually be able to actually love someone. for a minute i thought i might be a sociopath or something, but like i do experience genuine empathy (i can’t think of a really good example, but like i cry all the time at sad moments in movies and tv). i’m also never mean or anything, most of my friends say i’m the nicest person they know. idk, i just don’t know what’s wrong with me and mental health resources around my area are limited to say the least, so any help would be appreciated.",13Nov2019,1
8,"Hello, reader/inputer!

First off, this is my first reddit post. I have isolated myself entirely recently and well, I need the help of my fellow humans. 

My story: I am the youngest and only son of a family of 4, My parents raised me by letting me do what I want. I would play video games until i am bored, hold back on homework and finished it last minute. My parents would recommend me to do things but it was never truly enforced. I loved it, until i started struggling; thats when I craved guidance and discipline. This started to happen when my parents decided to move to a different city when i was 11, but my dad moved out to the new city to secure his job first, he spent about a year doing that. Before that I moved to a new catholic school that i had just found my place. Seriously, everyone in my class loved me. Anyways I moved to this public school in a new city and i was really struggling to make friends, cliques were a thing now, bullies, etc. I eventually found a place. Life was okay, I started getting into pot, still playing video games but atleast i had a friend group. My Dad lost his job after and it started creating tension. My Mother and him are having a serious talk and I eavesdrop and even catch a glimpse at something that was burned into my brain. Mom: ""I want a divorce"" my dad fakes a smile and he says he understands. They still love each other. My Mom decides to move out because she had never dated another man other than my Dad. She didnt know if she actually loved him was her reasoning. My sister and I understood. So at this point I'm like 13 drowning myself with whatever pleasure I can. Parents don't notice. Parents get back together when I'm 15, we go on a vacation as a family where I was complete sociopath. Sabotaging any moment i could, i dont know why. I say something that angers my dad, he runs towards me with his hands out like he is going to choke me. grabs my neck, pins me to a wall and says: ""RESPECT ME!!! RESPECT ME!!!"". Luckily my Uncle runs over and splits us apart. I will also never forget this. Anyways we come back. life as usual. my pot smoking worsens to nearly everyday multiple times a day. My dad moves BACK to city we originally left from to work. no father for another 2 years other than a phone call once and blue moon. I'm 18 he comes back, im inclined to spend time with him but he wants to do things only he enjoys. no middle ground. I end up spending the next 4 years barely doing anything with my family. I live with them but nothing. Im 22 today and I'm struggling with discipline and depression and loneliness. I dont feel any love. I've been missing work and playing video games and ordering uber eats, burning through all the hard earned money I made over the years. few more weeks left and I have nothing. I cant afford to miss my 1 meal a day im already too skinny. I've always been the cheerful happy guy that really cares about people and wants to make them happy. Now im sad all the time, and I have no friends left. I could have done some really great things for this world. I also was in an abusive relationship at 17 for 3 years. I feel like i am experiencing what Robin Williams felt and that I am doomed.",13Nov2019,1
9,"I started my first year of college in September. I have been struggling emotionally and am finding it extremely difficult to focus on my work. I like my roommate, but I haven't really made any friends other than her, and even with her I don't feel very close because we are both always really busy. We're also very different people, which makes it hard to connect. My mental health has gotten so bad that I cry all the time and can barely manage to get out of bed. I feel empty and apathetic and the only thing that makes me feel emotion is thinking about my parents back at home. I feel a sense of guilt and shame because I'm supposed to be an ""adult"" now, and moreover i am about an hour away from home so it's not as bad as other people have it. I still just hate LIVING anywhere else other than my home and miss the evenings I spent with my parents in high school everyday and our general routine. I am a complete wreck and recently came down with an awful cold and fever which has worsened my homesickness. My mental health is the worst it has ever been. I am looking for a therapist.

My question is, should I consider moving back home to be a commuter student? A very small percentage of students at my school commute. I also am required to have housing my first year. My plan would be to move out but have housing here. My parents have already said this is okay but I really need to consider the options. For one, I would feel awful for just leaving her like that in our first year. I am struggling to find a solution to this problem and I am a general mess who can't make decisions because my mental health is so bad right now. I miss being happy.",13Nov2019,1
10,"I thought I’d post about this as I wanted to kind of vent and also see what everyone else who struggles with maybe all or some of the symptoms of the above.

Before I go into depth I currently take Concerta, Sertraline and self medicate with CBD and have no therapy but looking into it. Concerta is a controlled drug, basically legal speed.

I recently was asked by my girlfriend to attend a christening with her side of the family (whom I literally know none of) and as a result didn’t take any of my medication including my Concerta which puts the brakes on my mind and stops me before I end up saying or doing something most of the time. I knew after the church event that they’d be drinking and that I’d be the only person not drinking at the event. I didn’t want to let my girlfriend down either!

I’m fine during the church service, smiled at a few people and had a chat with my girlfriend and then went to her families after party. Drank three beers and then one of her uncles side chicks said something, can’t remember what specifically about my appearance. It triggered me off and my anxiety had the fight or flight reaction. I went for flight and ran out of the venue being chased by my girlfriend.

There’s a small petrol station next door, ran in and got a coffee and called my parents to get me quickly. Think they arrived within a few minutes and then anger struck when I realised what she had actually said. I called my girlfriend and went sick, basically saying it’s a war between me and her family (chatting balls because alcohol had the better of me) and began insulting her over the phone. Hung up and tried mentally to calm down.

Got home, get messages off her and then have a sudden urge to self harm. Instead of self harming I choose anger, throwing my phone across the room and subsequently breaking it.

Moments later, I’ve got the home phone and called 999 stating I’ve got my parents hostage and that I’ve got a bomb and they’ll blow if they come near and want a negotiation. Truthfully at this point I didn’t expect the police to react as they have attended before when I’ve self harmed in the past. 

Hang up, call back a few times and they ask to speak to my parents (who don’t even know or actually being held hostage) to which my parents play along, again - no idea why and I hang up. Next thing you know I’ve calmed down on the phone to the 999 operator and she’s understanding what’s happened and why I’ve been triggered off by everything. 

She suddenly cuts me off and says, I’ve got to go, good luck. Hangs up and then seconds later the negotiator asks me to bring a “hostage out” (there were literally no hostages) so I asked my mum to come with me and went outside.

Took me a few moments to realise that there’s a group of armed TAU (tactical aid units) standing against a neighbours wall and staring into my soul. It was at this point I knew this was beyond repair. There was physically no way they’d let this go and just be like, no worries. This was the real shit and they meant business.

My anxiety kicked in and I tried to run back in, seconds later bang I’m on the floor and being choked and handcuffed on my front garden, neighbours out and being ushered away out of the street. I was instantly searched, arrested and taken to the police station as quickly as possible. 

Massive reality hit that I had really not been able to stop myself and how serious the situation was. The nurse assessed me and deemed me okay. Didn’t get sectioned and explained everything. Thrown back into my cell and had no communication, no change of clothes (covered in mud from being tackled) and nobody knew where I was.

I constantly pressed the buzzer in the cell but when I asked for a phone call and lawyer I was told they had no authorisation until they had figured out what they wanted to do. Decided the best thing to do was to sleep. 

Next morning, same cell and nothing changed. I pressed the buzzer and asked for an update and was told as it stands I’m going to court the next morning and to keep quiet and wait for them to speak to me. 

I will never be able to describe the feeling I had at that moment, the feeling of oh shit this is actually happening and this is it. This is my whole life over. I cried and said to myself there’s nothing I can do, no point being upset and asked for a coffee. Coffee came with a book and read. Door slams open after I fall asleep again and the custody sergeant calls me out, sit up and I’m told they’re going to interview me soon and that they’re not taking me to court currently.

I had the interview, parents said the truth and explained I never held them hostage and that it was me asking for help (which it was, I called to try and protect myself)

My lawyer and responsible adult arrives and slowly but surely I begin to admit to the charges and explain my story. They understood and as it stands they’re releasing me under investigation. 

I have never been in such a situation in my life, a situation where I now actually appriciate my freedom and where I have the comforts of my girlfriend and home. The decisions I made that night were not the right way to deal with the situation at hand but at the time, I felt I needed help and the only way in my head at the time was to make things up so they’d actually listen and help. Being in the system for anxiety and depression means nothing, the NHS do nothing but ask you to wait for months in order for help. 

Thanks to the officers and the team at the custody I’ve now got help and I am working towards recovering and resolving my mental health. I’m sharing this story in order to open the eyes that although it seems people don’t understand or care, in reality the police could’ve charged me and they should have done (they still can) for what I’ve done. I have that shame to carry around but I’ve learnt a valuable lesson.

Ultimately there isn’t enough resource for the amount of help that’s needed right now in the UK and it needs to change. 

I hope by sharing my story I can open the eyes to how all my symptoms can result in such a dire situation that I couldn’t control. 

If anyone else has similar experiences, feel free to share and I’d love to get some positivity towards improvement and self care as well as tips on how you are helping deal with your anxiety, depression or ADHD.",13Nov2019,1
11,"Stumbled across an old video of my past

And in response I became very emotional and distraught. I can’t help but sit here, in misery, watching a time where I felt genuinely happy and dreaming to go back. It just keeps getting harder, waking up and trying to move on with my life. Everyone around me seems to have no problem, yet here I am stuck, obsessed, crying and wanting nothing more to go to a time where I didn’t feel broken. I’ve considered suicide, then maybe I could relive my past for eternity without the pain and sadness. 

So here I am, thinking maybe another post will help me release pent up emotions. It probably won’t, but who knows. 

It’s definitely better than spending all day in my bed, watching videos of my old hometown, being on Reddit just to look for posts that mention my hometown, driving around (rarely) my hometown, looking at google maps at my old apartment and so on. Why does everything hurt, but feels numb at the same time?",13Nov2019,1
