,text,time,score
106,"So. I’ve been struggling with anxiety and depression for quite some time. Last year I had a full blown breakdown and I’m still recovering from it. Most days are ok but some days are almost unbearable. Today is one of those days. I have a much awaited interview at a job in a brand new town (in a brand new state) and while I’m not anxious about the interview, I’m anxious about my looks. (Or maybe both, who knows?)

One of the things that has been the hardest on my anxiety is my smile. My teeth to be exact. Long story short, not being able to go to the dentist for years has not done good things and it’s made me extremely insecure. I’m sitting in my car right now waiting to go in, obsessively smiling in the rear view mirror inspecting my teeth and every time I do it makes me anxious. But NOT looking makes me anxious as well. It’s almost silly because it’s not like anyone is examining my teeth (unless you’re neurotic like me) and it’s only the bottom teeth that really have the issues. So a smile would hide most of it anyway. But my anxiety would have me believe that everyone on earth is focused directly on my smile at all times and that my interviewer is going to somehow judge heir decision based off of my jacked up teeth. 

And anxious rant over. Apologies for clogging the feed with my nonsense. But I wanted to get this off my chest so I can remain calm during my interview. Thank you 🙏",19Aug2019,1
107,"I have a sister who is 5 years elder to me.

When she was in the 12th grade, my father got a stroke and this had a little bit of an effect on her studies, but not that much.

After this she dropped an year which was probably hard for her, and spent time in a hostel (dorm) while preparing to join college the next year.

During this period she got worms.

Later she had gall stones and had gotten a surgery done to remove her gall bladder.

Now 1 year after she finished school, she had a choice between MBBS in a slightly unsafe area and BDS in a very safe area, she wanted to choose MBBS but eventually chose BDS which is what everyone wanted, but she wasn't really *forced*.

Halfway through her second year, she stopped going to college and began getting super religious (we're Muslims).

After a few months, she dropped out, came home with me and my parents and is basically throwing away her life apart from being a huge bitch.

She sits in her room all day, she is mean to my mother, doesn't eat with anyone, sleeps as she wills and now she's began writing Islamic things and sticking them everywhere.

She's refusing to do anything unless everyone leaves with her, thus playing with my career.

It's gotten to the point where she's stuck paper on the bathroom mirrors because of something she read somewhere.

Can someone help me out here, is there anything i/my family  can do/say that will perhaps get her to behave like a normal human being?

Thanks.",19Aug2019,1
108,"1. I randomly get intense feelings of guilt for bad things that I have done in the past-nothing serious but it involved a prostitute. The fist time these attacks happened was when I decided to quit Zoloft cold turkey a few years ago and experienced the worst hell imaginable. The only thing that made me feel temporarily better was Xanex-which I refused to take during the day. Fast forward to today, and I am now on Citalopram. These guilty feelings do come up, although not as intense as the first time, but it still makes me feel like the worst person in the world., and that I am going to be punished somehow. At this point I feel like nobody really understands what I am going through so I created this post in an attempt to see if there are others who can relate.",19Aug2019,1
109,"Hi so a bit of backstory, I’m 24M and I used to have a lot of anxiety issues during my teenage years but thankfully I outgrew that. My problem is that the last year or two I’ve noticed my mental health really start to slip. I’d go as far as saying that I’m at the early stages of depression. Also, I’m very introverted so I don’t know where to turn or who to talk to; and I just feel like my life is starting to slip from my grasp.",19Aug2019,1
110,"We are looking for others who've been extremely courageous and amazing for sharing their personal stories to let others know that ""you are not alone"" and that it's ""okay to not be okay"". We've had a ton of support from people reaching out and submitting pieces from Reddit, so I wanted to share the most recent one and see if there is anyone else out there that has a story they would like to share.

It can be a previously posted blog or a new story, either way, we want to hear from YOU!

You can contact us at passthepear@gmail.com or by sending me a DM.

Thank you so much, and let's continue to talk and work towards ending stigmas and educating each other!",19Aug2019,2
111," 27 years old, can be super charming, fun and is a really smart dude.   Single and lives in a back house.  Hasn’t worked in years, prone to aggressive mood swings now and a worsening almost kind of paranoia.  These days leaves the house only to run errands or get food if he doesn’t feel like using uber eats.

&amp;#x200B;

Smokes weed all day (i smoke too, no judgement) and is now drinking throughout the day.  Thinks therapy and counseling is bullshit, is on no medication.  Gets (not physically) hostile if  my cousin and I ever bring this up.  His mood swings are like night and day.  You can tell it affects his ability to rationalize things.

&amp;#x200B;

I’m pretty close to him, we hang out, play games, but he doesn’t have any friends really.  I can’t remember the last time a friend of his came over that wasn’t one of my friends kind of checking up on him.  Like years. 

&amp;#x200B;

I don’t know what to do.

&amp;#x200B;

I’m very soft spoken and non-confrontational in general but even asking him if he’s ok can set him off.  Anti-city, anti-mainstream kind if rants and it’s not like “crazy” or anything-just concerning.  Even when it comes to his views on relationships.  Its just not grounded in reality and he goes off on tangents.  I don’t ever let it get argumentative anymore.  Our relationship has improved a lot since 3 years ago when I started taking a more hang-out and be supportive kind of approach.  But I can’t watch this.

&amp;#x200B;

I don’t know what to do.",19Aug2019,2
112,I feel like i'm digging myself into a hole that I don't know how to get out of. It's about my weight and I feel like i'm fat and in my eyes to fat. I weigh 86 kg and just am majorly insecure about myself to the point where I seriously consider just eating alltogether. I exersice a minimum of three times a week both strength and cardio but it just dosen't feel enough. I eat like a bag of crips on the weekend and this weekend I ate two and a half and i just feel so fucking gulty about it. My parents try to get me to exercise to loose weight but they don't seem to realise that i train so hard that i have trouble sleeping and when i'm no training i feel guilty for not training even though i don't have the energy. which leads to that i need to eat less apparently so i just want to stop eating altogether but i know thats bad and i just feel like crap i don't know what to do.,19Aug2019,1
113,"I've denied that I need to be diagnosed for too long. I know I need help. I'm sick of carrying around this facade of manliness. But I need practical next steps—I work for a fantastic organization where I have tons of friends, especially in our HR department, but I'm still scared of the implications of asking them for help. So I'm here. Where do I start? Who do I talk to? I'm worried that if I try a therapist or counselor, and I don't like them, I'll be too afraid to try someone new, or if I need medication, I wouldn't be able to afford it.

I know I'm not supposed to diagnose myself, but I feel depressed. The symptoms are starting to become more and more pronounced, and I can't fight it alone anymore. That's why I want to get help.",19Aug2019,1
114,"I've (M21) been with my girlfriend for 8 months (F19). She had a very rough upbringing, with extremely conservative, religious parents. She never conformed to the religious expectations placed upon her and therefore received a lot of very serious physical and mental abuse, leading to bouts of depression, for which she has been medicated in the past. I knew this going into the relationship and I still wouldn't change her for the world. She is an international student at my university and we are 9 weeks into our 13 week summer break, meaning I haven't seen her in person in a long time. We have both been missing each other very much and planning stuff for when we are once again together. 

She has been having a particularly rough time these past few days and mentioned last night that she was feeling uneasy and anxious for no reason. This morning, she essentially split up with me completely out of the blue, citing reasons like 'I don't think I want to date anyone right now'. I was obviously shocked and distraught and I asked about her motives but I knew that if that is what she wanted then I should let her go, so I essentially wrapped it up by saying that one day I hope we can be friends. She then replied maybe two hours later saying that she wants to be with me. I recommended that she take some time to clear her thoughts but she was pretty adamant. So I essentially said that I am willing to try and fix this but that it will take some time for us to get back to normal. At this point, I said I would give her space for the next few days (we usually text 24/7) and made sure that she knows I am always here for her and that she can message me at any time to discuss anything. 

Obviously, given the circumstances with her conservative parents, I can't visit her. I am looking for guidance on how I can help this situation from afar. I don't want to force myself on her at the moment, but I also don't want it to seem like I don't care about her when obviously I care very very much about her. My own mental health is sketchy at the best of times and I am no expert with long-term relationships and even less so dealing with people suffering from depression. 

Like I said, she means the world to me and I am willing to work through this if she is.",19Aug2019,3
115,"Couple of things before I start:

1. I probably have a personality disorder but nothing has really been set in stone. When I was just 18, I got diagnosed with bi polar disorder, however my family have told me that it was the wrong diagnosis and I was just suffering from grief from my fathers suicide. I know I have displayed BPD/HPD tendencies however my current therapists isn't into labels.

2. I have been with my husband for 5 years. He is one of the kindest people I have ever met. He is a mental health profession.

3. A few years ago I used to have addictions and a reckless lifestyle. I also moved around a lot because of jobs and education.

So here's the thing, all I want to do is run away and leave my life behind.

It's hard to explain, but I feel like wild animal trapped in a cage with a overwhelming urge to hunt. I just want to leave and start again somewhere new but I cant because I'm in a relationship, have a mortgage and I am financial reliant on my husband. I hate where I'm living which is a small and poor suburban town just outside a larger city. I feel lost because I don't really have many friends and I'm very much an outsider as it's a different country.

With my husband, I love him but I don't feel like I am in love with him anymore. Hes my best friend but I don't feel like I have any romantic feelings for him anymore. But he is very emotionally clingy with me, constantly wanting me to cuddle him and constantly touches me which I hate. He says this is because of him being an only child and he craves tactile feelings. I find it hard to have a physical relationship and our sex life is pretty non existent. 

I'm going to talk my husband about it but I don't know what else to do to get rid of this feeling. In all previous relationships I have ended because of  similar feelings but now it's not that simple because we are married and I'm not sure if it's what I really want.

I feel awful because I'm fighting with this feeling, and nothing is helping. I've been so unhappy with how my life has turned out and been self medicating with things like food (so badly that I cant look in the mirror) but I can't think of anything else to do without hurting anyone. I really just want to start again.

Has anyone else gone through? I feel like such a bad person at the moment.",19Aug2019,1
116,"I’m not going to get into all the details but basically I recently got out of an abusive relationship. I’ve been feeling suicidal recently and just fucking depressed. Like I can’t get out of bed, I don’t even smile or laugh. It’s awful. I asked some people in my family for support and broke down and told them (not my parents). They are kind of pushing me to tell my parents and I don’t really want to. The only reason I would is if I were too press charges. I think it should be my decision of who I want to tell and it honestly makes me want to end it all more. My sister is sort of telling me what to do in this situation when all I want rn is to be alone. I literally just want to sit in my bed all day alone and do whatever I want without interacting with anyone. She is yelling at me constantly and it honestly feels like she’s questioning why I even stayed so long. It’s hard for me to answer that question because I don’t know. It was abusive and horrible and I just am confused myself. I have told 2 friends. Honestly, it’s their choice to get involve or not. I don’t tell many people cause in the past I’ve seen when it’s about abuse they just end up leaving. One friend I told just said I’m sorry, and left it at that. Didn’t really ask if I was okay either. The other friend decided to investigate herself and confronted me later saying I was lying. I literally just want to kill myself. If someone tells me an easier and painless way to do it, I will.",19Aug2019,3
117,"I’ve been using a Korean hula hoop as a form of self harm (it sounds hilarious until you see how it’s designed) and it got me to thinking how so many people have complemented and congratulated me on not self harming even though I still am. It’s really not talked about enough but many of us continue to self harm for years after cutting or burning ourselves. It’s just not visible to most people so nobody seems to care. Even when I’ve come clean about it people brush it off (especially since my method of doing this, like I said earlier, sound pretty funny). It does become seriously painful though, almost as bad as cutting sometimes if I’m honest except it’s scarier because I have less control and can’t tell exactly how much damage I’m doing and where. Sure self harm methods like cutting or burning can be more alarming because they leave open wounds, I get that, but people only acknowledge the behaviour itself and not the reason someone has for doing it. The root of the problem tends to go neglected because of this and the issue is never resolved. The person is then free to continue what they were doing before as long as they are more inconspicuous this time.",19Aug2019,7
118,"It literally took me the whole day to take some notes so I can learn them, only because I immediately get paralysed during the course of studying/notetaking (because I think about this exam I will have/my future/etc.) and need a sh*tload of time to get something done. I really don't know how to calm myself down",19Aug2019,2
119,"Hi everyone,

I’m a therapist who specializes in anxiety and OCD. I’m super excited about this video. This is something everyone with OCD can do to help themselves teach their brain something positive and new. 

Video Link: [https://youtu.be/RK5fr9XpmtI](https://youtu.be/RK5fr9XpmtI)

I feel like most people can relate! We reach points in our life where we must make a choice. Is the choice I am making driven by anxiety or is it just something I want to do? Let us explore what to do when anxiety hits and how to make the best decision that will TEACH your brain that YOU ARE THE BOSS.",19Aug2019,4
120,"I have an appointment tomorrow with my doctor, I want to talk about my woresing mental health so I can get a referral for help, however (to cut a long story short) due to circumstances out of my control I had to move far away and haven't been able to find a new doctor in my town (all too full up), I haven't informed my doctor of my move because I'm scared I'll be taken off their paitent list since I no longer live in or near the area. I really need the help and idk what to do, I don't want to lose my doctor's and I also wouldn't be able to make frequent appointments in that area if I was referred to anything close by them. Any advice would help thanks.",19Aug2019,1
121,"To give some background, my husband is my best friend. We started dating in High School and got married a little over a year ago. In February, he was diagnosed with Bipolar Disorder, Anxiety, and Depression and it has been a major struggling point in our relationship.

When we were in high school, our youth pastor was fired from our church for unknown reasons. He obviously left and started his own church a few years later. Our entire youth group was a very tightly knit group and we were all angry that our pastor was gone. In turn, most of the youth group left to go where he went. We joined his church, it was just like being in our youth group. We felt like we were apart of something important, however it was intimidating. Our pastor had this weird ""aura"" about him that made you feel like you had to do what he said for fear of disappointing him. But you wanted to fit in and belong. You wanted to be on his good side, in his inner circle. He made me and my husband feel like he disapproved of our relationship. But we loved each other and we weren't going to let anyone tell us we couldn't be together. 

2 years ago, J's anxiety started to really bother him. He did a good job of keeping it to himself which is really unfortunate. He knew he had anxiety for sure, and it was at the point he couldn't control it. He had old friends that didn't go to our church or occasionally would, but they weren't involved. One of those guys had his own set of issues and would want to stay up all hours of the night with my husband and would offer him Adderall and alcohol to stay up with him (We were about 18-19 at the time). It got to the point where J stared to feel like he needed the Adderall to function and started to ask for it. At some point during this, this friend had a ""come to Jesus"" moment and decided to twist what he did to make my husband seem like he pressured his friend into giving him his medicine and buying alcohol (he did this with more than just my husband, he did it with another close friend of ours as well whose parents ended up kicking him out for it.) He went and told the pastor of our church, who my husband was really close with at the time. 

Our pastor went to J's house, told his parents, reprimanded him, and stopped talking to him altogether after this incident. J would call and text him asking for forgiveness, to get together, to talk about it. Nothing. Everyone in that church stopped talking to us. No one reached out, no one asked how we were or where we went when we stopped going. When they saw us in public, those people told us that they wanted to get together and talk about what happened. Our pastor had told others there about what J did and in effect they exiled us from their group. 

J lost every single friend he had except for two people and myself. I lost the majority of my friends as well. It was a very hard time for J. I think he has PTSD from the whole situation. It was a major turning point in his life. He won't talk about what happened, he refuses to go to public places for fear of seeing these people, he has panic attacks and angry outbursts whenever anything is brought up relating to them. In fact, two of the people refused to be in a mutual friends wedding because they didn't want anything to do with J or I. They told our mutual friend that they didn't want to associate with someone who disobeyed God's word and proceeded to quote many bible verses as to how J is a horrible person.

Everyone says that the first year of marriage is really hard. I went into it knowing this, nevertheless nothing could have possibly prepared me for it. It was really rough. J had a psychotic episode where he was convinced worms were coming out of his skin. Our car broke and I had to get a second job to make ends meet. I've been working 60-70 hours a week since November of last year trying to keep the ship from sinking. He doesn't want to work, so I alone have worked the past 3 months other than him mowing for his parents and grandmother.

In February, he was diagnosed with Bipolar Disorder, Anxiety, and Depression. I started going to mental health support groups and will be starting a class next month with NAMI on how to help your spouse with their mental disorders. He is unwilling at this point to take medication or see a therapist for this. Does anyone have advice?",19Aug2019,2
122,"I grew up in a physically and mentally abusive home situation where doing homework and asking for help, especially about math, was asking for trouble.

When my struggling started to reflect in my math grades, I remember being forced to sit at the dining room table after school every day and write out algebra problems 100 times each while my step-dad would scream at me for being too slow or making errors or even hit me.

I ended up chosing a major in college that didn't require high level math classes because whenever I would try to do a new math class the anxiety would be crippling and I'd end up dropping the course or failing it. Of the last six math courses I've taken, I only completed and passed one.

Now that I have a career, there's occasionally times where I need to do math and it causes me so much anxiety that I either have someone else do it or I get really anxious because I'm completely unsure of how to solve the problem at hand. And you know what? I'm sick of that!!

Math is a malleable skill. If I practice it, I can get better. I don't want to feel anxious about doing it anymore and I don't want the prospect of having to do math to deter me from pursuing the things that I want to accomplish in life.

So today, I bought a subscription to an app that organizes math lessons by grades and presents practice problems to solve. 

I'm going back to the third grade section to rebuild my foundation and I am going to conquer this.",19Aug2019,17
123,"Icreasingly I feel like an alien. I have little to no grasp or understanding of how people's minds and thought processes work. I observed enough to pretend a semblance of normalcy, but as i get closer and closer to adulthood (As in, real adulthood of having a job, not just age) it provess more and more insufficent.

I can empathise with emotions, but rarely with the logic (more often lack there of) of the acts of normal people. So yeah, some ""list of rule of thumbs"" would be very welcome.",19Aug2019,1
124,"It's hard to recognize that I have a mental illness, because I'm looking for it like a dog looking for it's tail, failing to realize that I should be looking at eyes I am using to look at the tail with not the tail.

The mental illness is part of the eyes (analogously), at least for me, so noticing my illness is very hard, because I can't really look at my own eyes, I can only imagine the eyes.  

Trying to perceive and notice my mental illness, is very difficult, because my mental illness is the state of my being it's self. I need look no further than my looking itself. The eyes are what the mental illness is, and I'm trying to use the eyes to notice it.",19Aug2019,1
125,"Hey guys hope you doing well.

To be honest with you guys I'm really searching for a solution, I'm 26 years old my field of work is biomedical engineering, I'm an engineer. My life is good. 

But, I'm not. I'm lost, everything week I have this problem of waking up finding my self talking to someone or a thing in my room but I'm not aware of my self like if I have another person in me and during this all I see and hear just noise and darkness. And to be honest I've had this since I was a kid but I used to see who I'm talking to and just stop it immediately. But now I can't I just wake up very tired and feeling really overheated like I'm burning and dizziness. 

I just want it to stop it really kills my day I become a bad and moody person. Otherwise I'm really humble and nice with people. 

And FYI I currently have no relationship ""single"" and friends. As of friends I disappeared by my own choice. I only have co-workers. 

I can explain myself more if you can help me just ask me to complete your equation.",19Aug2019,2
126,"Earlier this summer, I voluntarily went to a mental hospital because i was in a really bad place. The police were involved but i was not transported by them to the hospital, only escorted. Now a few months later, I recently got offered a job at a store that sells firearms, and the next step is a background check. I know that most medical information is protected, but I’m worried that because there are firearms involved I won’t pass the background check due to my hospitalization. Does anybody know more of the details on this? I feel a little lost. 

Also, I know it sounds weird to be saying I’m going to work in a store with guns right after being hospitalized but that won’t really be a trigger or problem for me and I don’t foresee actually having to handle them.",19Aug2019,1
