,text,time,score
35," 

Everything in this explanation is in chronological order. Pay attention.

I'm currently going into sophomore year of college studying Aerospace Engineering. Towards the end of high school I started having these crazy panic attacks that would nearly put me in the hospital. Doctors did blood work and a bunch of tests on my heart to make sure it wasn't a physical ailment. Was referred to a therapist (not psychiatric) for treatment. Didn't do a single thing to help me. I just decided to power through and make it my new norm to freak out for no reason until my social radius got smaller and smaller.

Fast forward to start of college. A month in I was literally not able to leave my dorm. My parents were freaked out so they called emergency services to help me get medical attention. I was taken to a psychiatrist and was put on Lexapro for extreme panic disorder. I would be a liar if I said things didn't get better for a short bit, but Lexapro slowly started to fade and I came down from the SSRI boost. I ended up getting into a fist fight with one of my roomates over the air conditioning, and it got to the point where I ended up smashing the thermostat with a hairbrush and had to pay $400, not to mention the police were involved because of the fist fight. I had noticed a huge change in behavior because of these fucking meds. It started to scare me.

Fast Forward 9 months, just after summer semester move in. HUGE panic attack that actually put me in the hospital for real this time. Caused me to lose consciousness and faint, was taken to the ER. Once my psych found out about it, she gave me Klonopin to used ONLY when i absolutely needed it. I never really used it. She also upped my dose to 20mg of Lexapro from 10mg, where I had stabilized.

4 days later I was in a psych ward. I hadn't eaten in 3 days, was talking to my kitchen appliances, was convinced the birds outside my dorm were spying on me, and convinced the garbage truck was killing people and wouldn't come out of the shower. Needless to say my entire family was scared shitless. Since then I had been medically dropped from summer semester and taken home to receive treatment for an acute psychotic episode or psychosis otherwise unspecified. The new psychiatrist has me on Ablilify 10mg. More fucking meds.

Here is where things get interesting. I am fully aware I am fucking psychotic.

Somehow I knew as soon as these panic attacks started happening it would spiral into something major. I knew it. Nobody would listen to me. Doctors just brushed me off and said "" ya got anxiety kid, it happens to everyone"". NO IT FUCKING DOESNT. My life has quite literally spiraled into complete lunacy these past two years. I used to be a smart, healthy, interesting kid. Now I cant come out of the house or drive or do anything. I have not been taking my medication for fear of mind control and fear it will make me sick. I am fully aware that isn't the case, but im scared regardless. Some days are better than others in the sense that I don't feel completely depersonalized and dissociated from everything and everyone, including my parents and brothers. I think this is all just a simulation. None of it is real. Its all just visuals. I haven't gone outside besides doctors appointments, Im always paranoid of getting sick or dying, and nobody being around to help me. And they say the answer to these problems is medication. Sometimes I feel like one day the medication is just gonna fucking kill me and its gonna be over. I sleep until whenever and am still always dead tired no matter how much sleep I get.

So what do I do? Because it's gonna continue to get worse until one day something bad happens and I end up in another hospital somewhere. Its just a big cycle, a continuous loop I am stuck in. It's inescapable and my life has fallen apart. I graduated top of my class in high school and was well on my way to becoming a successful engineer. All that hard work I had put in is gone now, because of my own fucking brain. Its like I look in the mirror and don't even recognize myself anymore, I feel like i've been hexed or a demon is just following me around fucking everything up for me.

So now what? Because I'm about ready to just throw my hands up and let whatever this is take its course.

The magnitude of change within the span of two years in unbelievable.",19Aug2019,1
36,"I feel kind of like a brat saying this but im literally in a place called paradise island. Im so fortunate to be able to afford to come here and see the sights and swim and all of that. But when im not drunk here, it just kind of feels empty still. Like that shitiness i tried to outrun followed me. Fuck this",19Aug2019,3
37," Hello Hello!  
This is something I have been putting off, for a good. . . long while. Though self-diagnosed, I'm fairly certain I have Anxiety and “mild” depression. Debating whether or not to die in middle school doesn't exactly scream “depression free.” Especially if you decided not to was because A. It would hurt, and B. The consequences to what would happen if I did. Now, my depression has gotten significantly better, I don't think dark thoughts and such. But . . . what would happen if I picked up the shovel and dig myself back into that hole I tried so hard to fill up and covered with flowers?

Not only that, but my mom. My mother is great! She never abused me, she has mostly supported me, she's fine with my sexuality, and she's the one suggesting I go to therapy(clearly I declined, saying I don't need it.) That doesn't exclude her flaws. My mom's judgmental. To people in our family, to strangers just walking on the street. I have tried so, so hard to not judge people, even if they really deserve it. Having your mom judge everyone, well it obviously means she judges you, too. One thing she does, is when I disagree with her “too much” within a week or something. She calls me Connie, Connie Contrary. She thinks it's just some funny, inside joke. . . but it's not. She's done it for so long and I know she won't stop. It takes her a good while to go “Oh. I fucked up.” But she has her own problems, too. Depression and other such things. It's the reason why I don't vent about my problems to her. She thinks it's all her fault and it isn't! I don't want her to think all my problems are from her. It isn't fair. But she's overprotective, so guess who has no friends to talk to!

And my dad . . . Mom made sure he stayed out of my life. No matter what, there wasn't gonna be a happy ending there. It was the best option. 	My mom is out of town to support a family friend, and I am here. Alone. And I feel my body freaking out. I feel myself disorienting itself. I feel my mind rushing back to all of my worries about my self. Like this – What if I'm a sociopath? I'm freaking out about it, so I'm not! . . .Unless??? –  So that happens every couple of weeks. Yippy. I always felt that every major choice wasn't mine to have a say in. Move to Pennsylvania? K. Move back to Florida? Sure.

  So going to therapy, is a choice I'm suppose to decide myself. Which is why I think it's something I can't wrap my head around. I can't even write in a personal journal about all my problems, what makes me think I can just. . .t a l k to someone about it?

Throughout this. . .essay, I've tried not to cry. I've walked away from the computer quite a bit to calm my nerves. I don't know what to do. I have a job that I love, the house we rent is more that grand! I have what is almost everything for someone who's poor(which I am.) I'm just not. . .Happy. And I feel like I should be. It's just, the 'what ifs' keep wrapping itself around me and I don't know what will happen. I just. . .need some advice on what to do. I feel like I do, but I also don't. 

I tried so much to have the most positive mindset. I mean, look how I started this, “Hello Hello!” Sounds chirpy to me. But I don't think staying positive is solving anything. It's just putting pretty flowers by weeds and saying it's perfect. 

&amp;#x200B;

&amp;#x200B;

TL;DR 	

Got (mild, no longer feel like I should die) depression and anxiety, I have things that should make me happy but I'm not, I have literally no friends to ask for advice and such cause of overprotective mom. I don't know what to do. I've always felt like big choices weren't mine to make. But this is big, and my mom isn't going to make it for me. It's only me, and it's too much for me to grasp.   
    
    
 Should I go to therapy?",19Aug2019,1
38,"This whole thing is gonna sound very melodramatic. I’m a 17 year old, about to start the butt end of my high school career, and I don’t even know how to defend myself. I need serious help. I’m going to split this into 4ish parts. 

The relationship:
Recently my girlfriend of a year broke up with me. We’ll call her...Sarah. She left me because she has issues of her own that got between us so I have absolutely no harsh feelings towards her. I understood. Now here’s the issue. I put more trust in her than anyone I ever have, I trusted her with things I wouldn’t let my own father know, and my dad is my everything. I was relying on her for a lot more of my self love than I thought I was. I was using our relationship as an uncanny resolve to be happy. Which I know is unhealthy but I didn’t even know I was doing it. I was using our relationship (which really wasn’t a healthy one to begin with) as sort of a wall between me and the self loathing issues I have. This situation is so much more complicated but I don’t even know how to write half of it without writing a book so we’ll leave me and her at that. 

The best friend:
So, we still hang out. Everyday. She’s still my best friend and we do everything together. But recently the person I called my brother tried getting with her. She didn’t reciprocate at all, she kindly ignored his statements (him trying to hook up with her without actually saying it). Even after telling him it would end our friendship he continued. Not long after that, he stopped talking to me, and continues to try for her. Call me closed minded but best friends going after your ex is (and bare with me here) against every guy code. (Oh and btw he also stole money from me after doing all that, yeah I don’t know either.)

The reason:
Now that you have the basis of the sh@t fest the last two months have been, here’s the reason it all sucks so bad. Now, of course I have a lot of issues behind all this, I have depression, anxiety, a whole slew of mental issues. My main issue is how damn willing I am to throw myself in crossfire just to get into a relationship. It gets me hurt every time. But this break up was different. It’s like the whole situation is slowly poisoning me and changing me. I’ve had thoughts of getting in fights, getting with someone just to cheat on them, telling people I love, to piss off. Anyone who knows me would read that last sentence and say I didn’t write that about myself. Usually when people say “it feels like there’s a hole in my chest” I think to myself oh, that’s just how they describe the feeling of the emotion they’re feeling. My god was I wrong to even try to understand what they meant until it happened to me. I woke up at 11AM with a hole, so wide it felt like I might fall into myself. I started my day off by crying into a blanket trying not to let Sarah hear me. I don’t cry. Usually I’m dumb enough to internalize the feeling and let it soak for a second and cool down. Usually I wake up and go on Instagram and laugh at some meme pages and watch stupid videos of doggos doing flips. I tried that and nothing even made me smile. Not even a spark of joy. Which is the polar opposite of me. I may be sad and terribly shakey from my anxiety but I’ve found out how to make myself feel happy and be a little ball of boiling joy (lol). But nothing was working. I tried watching my favorite video game on YouTube to get interested in something. Nothing. Nothing was working. Then the fear that I had lost myself set in and made me start to feel powerless. I cried again. (The second time in one day, the first time crying in over 3 years). Since then, it hasn’t gone away. My dad said it could just be a bad day and he would help me get through it. It’s been a week now. And nothing. I haven’t felt anything. 

I don’t know how to muster up. I want to be able to tell people kindly that I don’t want them in my life anymore. I want to be able to tell someone they’re in the wrong without fearing them getting mad at me or not liking me anymore. I just want to stop being so sentimental of everyone else. I’m not Jesus, I don’t need to spend my life sacrificing myself for the well being of others. There’s ways to defend yourself without being a bad person. I just don’t know how to find it. It’s so bad I almost apologize for apologizing sometimes. I just deleted a whole paragraph on this post of me apologizing for it being so long. I don’t need to apologize and I don’t need to be submissive to other people’s bad decisions. This post was a last ditch effort for finding anyone who knows how to help. I know so so much about mental health and I plan on becoming a musical therapist as a career after college, so why the hell cant I listen to my own advice? 

Much love ❤️
Justin",19Aug2019,1
39,"My sister's university (UNI henceforth) just ended the option to forward emails from her official email address to personal email addresses, allegedly to comply with EU's General Data Protection Regulation (""GDPR"" henceforth) and intercept extremism and terrorism. They will continue email forwarding only on  exceptional  grounds.

She also has a job, and monitoring another email account will exasperate her. She doesn't want to get diagnosed for Chronic Fatigue Syndrome (""CFS"") - diagnosis will hinder her later in life, e.g. from buying insurance or skyrocket her insurance premiums later in life.

UNI's IT Director replied that her job and symptoms of CFS don't constitute an exceptional ground, as she can still physically check email, and that his decision was final. 

Thus what other reason can she give?",19Aug2019,1
40,"[No war is greater than the war of within.](https://theadultingcouple.wordpress.com/2019/08/19/no-war-is-greater-than-the-war-of-within/)

To anyone reading my release,

You are loved. Your emotions and feelings are valid. Life is confusing but it doesn't have to be that way. I've keep on trying to do my best for my own benefit, for my own happiness. Someone told me that [NO! No you do not get to do that. I am so tired of seeing this. You are undermining your feelings, your pain, and your experiences. I don't care if the worst you have been through is getting yelled at once. All feelings matter. All feelings are valid.](https://www.reddit.com/r/CasualConversation/comments/cr2khk/how_do_you_cope/?utm_source=share&amp;utm_medium=web2x) 

&amp;#x200B;

I'm grateful for those who reached out even if I'm too unbearable; grateful for those who lent me their ears and their heart with no judgment. I'm thankful at myself for trying.

I'm still on the edge of giving up. I'm very thankful for my boyfriend for trying his best to be there for me, for my family as well. 

I could only cry and cry and cry and cry each day with hopes that someday I get to finally understand what happiness means. **Words is just as powerful,** so I hope we all try to not to convince ourselves ending our lives or tell ourselves that someday we would be better. I want to witness how true the phrase **what comes after a storm is a rainbow,** I hope that we all witness what others had witnessed. We're may not be there yet but I believe that we will, someday.",19Aug2019,1
41,"I have a friend who is going down a very dark and destructive path which will 100% kill her in a year max. She has pushed majority of her friends away and no one can get through to her. She’s 18 and her mother is aware of the situation but basically does nothing. She says she doesn’t want help and just wants to die. I’ve tried every approach and the only way she can be 302’d is if she actively has a plan to commit suicide. What do I do?

Tl;DR :  Friend is abusing every substance she can get her hands on and rarely ever eats",19Aug2019,1
42,"I recently got discharged from my outpatient psychiatrist as I have been stable on my medications and have not had suicidal thoughts, and have been feeling fine generally... but I still have thoughts like “if it weren’t for my cats and my boyfriend I wouldn’t be here.” My psychiatrist gave me 6 weeks worth of medication instead of only 2 weeks at a time (because I was suicidal before and he thought I would try to OD) and I cracked a joke about how I now have enough to actually die. I recently got rejected from my dream job because of prior drug use as a teen, and feel as if I’m hopeless. I try and act like everything is ok, like I tell my psychiatrist but I still have these feelings in the back of my mind. 

I’m not sure if this is the process of getting better, or I’m trying to pretend I’m better. Generally I feel okay, but still have bad thoughts from time to time. 

I was a sexual assault victim when I was 15 and have lots of situational anxiety when it comes to men, but no longer have any panic attacks. I have not received any counselling but I feel like I should. 

So my question is, should I just leave it because my psychiatrist did in fact discharge me. I’ve come a long way in my mental health journey, but it’s still really confusing to me and I no longer know how I am really supposed to feel because I’ve been dealing with these issues for so, so long. I am just confused.",19Aug2019,2
43,Feel like everyone else is pulling the strings in my life. How can i gain back control of it?,19Aug2019,1
44,"Hello, please call me Scin, he/him and they/them pronouns y'all.

I'm 15, trans male (ftm, dunno if that's important but felt like it may be) and I've never once seen a therapist for any of my issues but I feel like this may be one. I would also like to apologize for spelling errors, grammar, and things of the like; I'm tired.

Is it normal to feel like theres multiple people stuck in my body?

Hopefully that doesn't sound too odd, but what I mean by this is that it feels like I have multiple people in my head, almost like I have multiple brains. Each ""brain"" feels like a different person, turns on randomly, and behaves in their own separate way.

I tend to call my main personality ""Normal Brain"" since, well, it's my normal personality. 

However theres other brains like ""Angel Brain"", a person/brain that genuinely believes their an angel, cast out from Heaven, desperate to return, and forced into a mortal body that they know is going to kill them when it finally stops. Angel Brain, which I'll call Angel for sort, when in control will just seem desperate for praise, or desire the feeling of holiness and will often scream to the skys in poetic tongue with tears in their eyes screaming about how they're still holy and the feeling of being in Heaven, or the feeling on their fall, etc. The funniest thing about this brain is that I'm not even Christian, sure I believe in the idea of gods, but I don't really believe in ""God"" or Heaven. I was also about to hit POST when I feel like I should also mention this brain uses plural pronouns for themself, or refers to themself like several people, saying ""we"", ""our"", ""us"", and stuff like that in reference to themself.

There's also Carrion Brain, Carrion for short. A wild, bleeding hound left scared and alone and hostile to everyone, left laying on the side of the road with two broken hind legs in the hot sun. Honestly I don't know how to describe this one except that anytime it's active I feel trapped, angry, and almost feral in a way (not the haha I've got rabies joke feral that's been going about the internet but almost like a feral cat)

And this brain, I don't know what to name them and I hate when their active since they make me fear for both my life and anyone around me. This brain, I guess I'll just refer to as Knife for this, is just a homicidal maniac with a developing god complex (I would like to state that I, ""Normal Brain"" don't have a god complex, I barely even see myself as a good person, let alone a god of all things, oh also small warning cause the rest of the paragraph gonna sound a lil gruesome and I know some folks aren't cozy with gore and stuff) believing that they're the most powerful thing to ever exist, and thus they're the only person worthy of killing them and refuses to die unless it's by their own hands on their own terms. They'll also gladly kill others for the smallest of reasons. Hatred, general disliking, they did something annoying, just for the fun of it, etc. and they'll gladly tear themself apart for anyone that they care about. Not only this but they want to tear themself apart in general, often writing in depth paragraphs about veins wanting to be torn out and skin crawling, covered in the insects they feel on their rotten flesh. They're violent towards themself, others, and just everything in general and anytime they're active I get scared I'll lose control and kill someone I love or ruin a perfectly good relationship by them screaming their throat out at the person. They haven't done anything major yet but theres small things that make me scared of them.

Theres also a lot of other brains but I just thought I should list off three of the most common ones, I don't really know exactly what to add to this (its 2 am cut me some slack) so if you want to ask a question about this and maybe help me figure out if this is therapy worthy, go ahead and I'll answer to the best of my ability!",19Aug2019,1
45," 

If you have ever felt that your partner feels **superior to others,** or **more entitled to things than others**, then this may mean that he or she may have more than their fair share of Narcissistic tendencies. Perhaps he/she finds a host of ways to **devalue you** or **ignore you, or perhaps try** to **control** you?

Or perhaps, if you are honest with yourself, it might be **you** who has many of these characteristics?

Learn more here:  [https://www.thehartcentre.com.au/what-is-narcissism-and-what-is-narcissistic-behaviour/](https://www.thehartcentre.com.au/what-is-narcissism-and-what-is-narcissistic-behaviour/)",19Aug2019,1
46,"Hey guys,

For years now I've been suffering from very disordered thinking. I honest to god feel like someone might be in control of my brain and is messing with me. I know I don't actually think that's true, and that mental illnesses are chemical imbalances of the brain. But my symptoms are just completely strange and have always had me confused as to what it is I'm suffering with.

I do see a psychiatrist, he diagnosed me with OCD and cylothymia (a lesser serious version of bipolar), I was given lithium to calm my mind down. But it hasn't really gotten rid of the disordered thinking. I also haven't told my psychiatrist all my symptoms for fear that I'll sound completely fucking insane. He just knows about my emotions being high and low sometimes and my compulsive thinking (which is just one part of my disordered thinking).

In terms of the rest, and I'm completely aware how weird this sounds:

Pretty much I feel like my mind gets worse when I jack off, no i'm not trolling. But I feel like when I do, my compulsive thinking gets worse, and my ability to be social gets worse. As in I can go from being able to hold conversations forever to having trouble forming clear thoughts in conversations. I also feel like I ""lose touch"" with other parts of my mind, like my ability to enjoy music, and sometimes I have some delusional thinking. It's weird as it's not some depressive episode but it's almost as if the parts of my mind that are suppose to control these things aren't as effective....idk how else to word it. 

This whole process also works as a cycle, the more I do it my mind gets worse and then eventually ""resets"", after that I can be very social again, have less intrusive/compulsive thoughts, less depersonalization like moments. God as I'm typing this I really do sound like I've lost it -\_-...however lately my mind hasn't ""reset"" and I'm still having trouble socializing and am dealing with issues with sleep. 

I've tried to ""break free"" before as i like to call it, when I ignore all my symptoms and think what I want to think and do what I want to do. Beforehand I'd have a lot of pure OCD like thinking but if I start ignoring everything it tends to causes my symptoms listed above to get worse.

This is why I mentioned that it feels as if someone is control of my brain, like someone is aware of what I do and knows to make me worse after masturbation, or after I try different cognitive behavioral techniques.

All of this is going on all in my head, outside of my head I'm a functional human being. I work a good job and have a good social life (although sometimes my friends may think I'm occasionally more withdrawn). I try to approach this situation logically, but I'm scared. I don't know what's going on in my head. I haven't told my psychiatrist about this side of my mental illness because it's embarrassing and would be extremely uncomfortable...

Has anyone else dealt with weird mental illness symptoms like this????? Is this some form of schizophrenia or psychosis???",19Aug2019,2
