,text,time,score
70,"tldr; Is there a place where you can go where someone comforts you somehow?

\----

I am a very unhappy 30 year old woman. I don't have a great outlook for my future. I work in a high paying medical field and have good health insurance, but I am so stressed and busy at my job that I have to take an Uber to work every day to not waste more than 15 minutes away from my computer instead of my usual 45 minute route on the train. My job is high paying, but I can't afford to do this commute longterm ---- even though I've been doing this for about 8 months now after I broke my nose and face in an accident and lost a lot of confidence and efficiency. My father is disinterested in talking to me as a rule and my mother has pushed me away as disappointing physically and needy emotionally. When bad things happen to me, like car accidents or getting my face broken or being taken advantage of sexually or floods ruining my things, my parents called me pitiful. I want to be better at my job so I don't have to work 18 hour days and I can focus on maintaining my wellness and maybe finding a boyfriend, buying a house, and having a family. I've had two boyfriends in my past. One started doing cocaine and left me because I told him to stop. He pushed me sometimes and yelled at me for bothering him for physical intimacy. The other boyfriend pushed me down when I gave him the wrong kind of look for biting his nails, and I had learned my lesson and told him we were done. I tried to date for a while after that, but I am suffering and not my best self. I have been told I'm a 5-7 out of 10, and that I would need to have a very happy and attractive personality to attract a significant other.

I have some sick days saved up and want to take some time off work to do something that will help me be a better person, but I can't figure out what that is.

I have a therapist that I see once every two weeks, but I don't find it helpful at that interval. I tried antidepressants, but they made me less effective at my job, which adds to my stress level. My therapist is currently recommending reframing via CBT to help me, but I can't find relief from this. 

I do wish I was dead, but I don't want to hurt myself. Is there a place where you can go where someone comforts you somehow for like a week straight? I have a lot of pain inside of me emotionally and in my physical body. I took a class on meditation, but I can't manage to comfort myself through it. I am silent on the outside and try my best to appear professional and efficient, but I am screaming and crying silently inside of myself all of the time.",19Aug2019,1
71,"So, the title is pretty self explanatory, but here's some back story. This will be long. 
I (25f) have three younger brothers, each spaced ~2 years apart. My brother (23m) born after me has been having suicidal thoughts and severe depression for years and our family has tried to help him but he thinks we are all against him. We had a rough upbringing to say the least, parents had a toxic relationship, our dad is a narcissist, mom is suspected to be bipolar, probably brought on by being with my dad for so many years. Her mood would change at the drop of a hat. My dad was abusive, mentally, physically, and emotionally. He still wont admit to that but it is what it is. 
My brother got a LOT of hell from my dad. He was very hard on him. None of us kids learned healthy coping skills for life as kids. I myself am just now getting to a point where I feel like i am finally coming out of the crazy fucked up mind cycle that I was taught as a child, so I know how fucking hard it is to save your own self after being raised like that. 
My grandpa passed away in 2014, and he was like the father my brother never had. Taught him everything he knows pretty much, but losing him fucked my brother up and he hasn't been able to cope. Losing my grandpa is what triggered my brothers debilitating depression. He got married to his high school sweetheart at 19 I believe, but they were toxic and she couldn't figure out how to help my brother and they ended up divorced after like 3 months, tops. This put him in serious debt. He had bought them a home and he was left with the debt for that. After his divorce, he sunk even deeper and started drinking more. He would get drunk and his ""true feelings"" would come out. He would cry like hes just lost everything all over again, every time he drank. He would say that he always feels that way, but hes too much of a pussy to admit it while sober (his words.) He would try to get his gun, he would say he just wants someone to help him but he wont listen while drunk, and wont talk while sober. My husband and I moved into where he was living to try to help him, which is my grandma's place. We couldn't help him because he wouldn't let us.  He thought if he could find a woman to love him, she could save him. 
So he met his current fiance. They were living together within a month (she moved into our grandma's place with us, with her two kids) and she soon saw how severe my brother was. She tried to help him, but he blamed her for everything now. Hes in a bad mood? Her fault. Hes depressed? Her fault. He doesnt get sex? Her fault. He isnt happy? Everything is her fault and he treats her like shit but she stays because she sees the potential and doesnt want to leave him like this. 
So my brother decided maybe having a child would save him. Him and gf try to conceive, they have miscarriages but on the 3rd try she gets successfully pregnant and now he has a 4 months old baby girl! Shes perfect. 
But it didnt save him.
He often dumps all the kids off with my mom or anyone really so him and his fiance can go do whatever. Fiance HATES this but goes with it bc it's what he wants. 
Hes still drinking. 
Hes still suicidal. 
He wants help but wont admit he even has a problem. Of course, drinking is part of the problem but the main problem is his ability to cope with life. 
This came to a head saturday night. He invited my family over. We have two kids, 4yo girl, 5 month old boy. 
My daughter decided she wanted to stay the night and play with her cousins. We decide that's fine, nobody is drinking. So we leave her there. 
Around 1 am, my mom comes beating on our door waking us up saying shit is going down at my brother house. He got drunk, heard the wrong song, and started acting crazy. Tried to get his gun to shoot himself, tried to leave in his truck. His fiance told the older kids to take the little ones inside and lock the door, then she went and tackled him in the yard to prevent him from leaving. This is NOT the first incident like this, there have been a LOT the past few years but it was the first my daughter was involved in. The cops were called, he was taken to the hospital and mental health services were called but they just chalked it up to alcohol and sent him home the next day after he sobered up. 
I wasnt mad, I know he is sick. Obviously its unacceptable that our daughter was involved but that's on us for leaving her there. 
How do I help him, if he wont admit he has a problem? 
Every day, I'm waiting for the call. One day he will be successful in hurting himself and I CANNOT accept that theres nothing his family can do. There HAS to be something. Please someone give us advice. He needs help. He has a family now. He has a good heart but he cant beat this. He cant see it as us trying to help him, he just thinks everyone is against him and laughs it off.  

I know he has potential. He is NOT a lost cause. I know he wants to be better, he tries so fucking hard to have the stuff he thinks can make him successful. House, kids, a woman. He has it all, although he cant really afford the stuff he does have. It's like he wants everything now, and not have to work for it.  

I know this was a long post, so. 

TLDR- brother is suicidal, depressed, probably manic. He is suffering. Our family is suffering. We HAVE to find out how to get to him before it's too late. We need help.",19Aug2019,1
72,"I wish people would preface their prying questions into my mental state with this  


Every time I actually open up about something I am given dirty looks and treated like I just farted in an elevator. People who try to make it out like they care, like they want to help, they are the problem, and they just make me want to kill myself more.

Im sorry I struggle to talk to you and hold conversation,   
Im sorry that Im suicidal,  
Im sorry that I exist in your presence even though my depression told me to stay home,   
AND I AM SO FUCKING SORRY THAT I KEEP FUCKING APOLOGISING, BUT I HAVE ANXIETY AND YOU ARE GIVING ME THE FUCKING STINK EYE AND JUST LETTING DEAD AIR SIT BETWEEN US!  


IF YOU DONT WANT TO KNOW, DONT FUCKING ASK ASSHOLES!",19Aug2019,11
73,"So this all started suddenly about a week and a half ago... I dont think there was a specific reason why, but I started having these homosexual thoughts, they kept popping in my head, I had this doubt that maybe I was homosexual, but Im sure im not. So this thoughts kept popping for about 5-6 days, like everytime i saw an attractive man, this doubt would fill my head with these thoughts... But keep in mind, I am straight and I even accepted that maybe I was curious, but then it got worse... I started having these thoughts about suicide, NO NOT SUICIDAL THOUGHTS, but about the topic suicide like, “No I would never do something like that” and these thoughts kept popping in my head, and contrary to the homosexual ones there were no apparent triggers, these thoughts happened for 2 days which were like hell to me, I think I had 2 panic attacks (first time ever in my life) and 2 days later these thoughts vanished, however during all this time i was searching for answers in the internet and saw that what i was feeling was similar to OCD. Now after having those thoughts about suicide, they have gone away and have been replaced with a fear that I suffer from ocd. For the last 3 days i have been struggling with thoughts that I suffer from OCD, like I can think about other things by distracting myself by doing some things I enjoy, but when i am left alone with nothing else than my mind (like right after i wake up for example) I start thinking that maybe I have OCD.

Another thing I would like to share is that I have no apparent physical compulsions.

I would like to know if my situation to you seems like I really suffer from OCD. 

Like a lot of the symptons I ve been struggling with are comparable to OCD, but my obsession doesnt stick too much time, and this is the first time i am ever struggling mentally and maybe the shock is the reason why i am thinking so much about it. It is also the first time I am been under so much anxiety in my life.

I would like to get your opinions and to know if medical help is needed in your opinion, due to the fact i have been only struggling with this for a week and a half.",19Aug2019,1
74,"Apologies as this will be a lengthy post, as a lot has happened in the last few days. There will be a TL;DR at the end. 

To start some background. We live in the US (GA), I am her SO, not a family member. However her family does not speak English, so I’ve been a translator of sorts. The SO in question is an adult which makes this a degree more difficult. Another hurdle is the fact that she is a Trans (MtF) Woman.

My SO of three years did not have a great schedule and was suffering from a lack of sleep for an extended period of time. She suffers from a history of anxiety and depression, which she was already seeking care for and was being watched by a medical professional. Along with this, as well as the lack of sleep, she had issues at work regarding a manager that seemed to kick off her problems.

She was displaying symptoms of a manic episode, her parents eventually brought her to care and I personally talked to the therapist regarding things as I was an emergency contact. This is where she got the prospective diagnosis of a manic episode and the therapist recommended lots of rest and continued visits to the therapist to continue treatment. I will note that this is the first and only time she’s shown these symptoms according to her family.

The other night (8-17-19) according to her mother, she had a ‘crisis’. From her sister the next day I learned that she had an anger episode and from her words “Was made worse by her parents yelling at her.” Police were called and held her down and sedated her, and she was promptly taken to the hospital. Personally I’ve spoken to her parents to explain how this is NOT the way to handle a person during a manic episode. I know that famously the Latino community turns a blind eye to mental health and I’ve only recently been able to explain how this isn’t the work of the devil. 

I learned the next day that she got transferred to a behavioral health hospital over an hour away. She does not have her phone, no way to contact us. I looked up the hospital and the reviews are a stellar 2.2 out of 400+ reviewers. What scares me the most are the reviews of Trans people being mistreated, forced to room with males, having their genitals inspected and harassed... generally making me beyond sick to my stomach. 

I’ve called and we don’t have a patient number, they’ve said they would give her my phone number and let her call if she needs to. Honestly I don’t even trust them to do that much. I’ve been calling about once a day to make sure she’s at least there. Her parents haven’t had any luck either. My main worries with this are that she could have signed off on treatment, she could be drugged, she may not have access to a phone... I know HIPPA laws are in effect but in my experience you could at least visit a patient in hospitals should you be family.

I’ve read about a 72 hour hold... though I’m not too sure how the laws are in the US for mental hospitals. The best case is to get her out of there and get her to therapy, as I’ve already spoken to her therapist about the situation. I just don’t know how or when.

I guess what I’m asking is what are some resources we can contact, how can we get her out of there ASAP. Just generally asking for advice as a scared loved one. 

As always thank you, and apologies for any typos. If needed I can answer questions in the comments. As well as crosspost this somewhere else if needed.

TL;DR: SO going through manic episode, got in fight with parents, they called authorities who sedated and took her to hospital, got admitted to behavioral hospital, currently seeking advice on what to do.",19Aug2019,2
75,"I'm worried for myself. Last night I had what seemed like it should have been a nightmare but I woke up with tears of joy and a smile from ear to ear, in the dream it was a repeat of what my days have been these past couple of weeks. Wake up, go to work, come home, argue with the family. Now this is where things changed from being just a normal day to a dream,  because normally here I would either be just trying to go to sleep and get on to the next day, or just thinking about what I can do to prevent the arguing tomorrow. But in the dream, I went to my room, grabbed a shotgun, and blew my head off. End of dream. I wake up with tears of joy. I just want to know if this is something that I should concern myself with or if I'm just being extra about the whole situation.",19Aug2019,1
76," ***Now you are presented with an opportunity to see life in all its dimensions, from the depths to the heights. They exist together, and when we come to know from experience that the dark and the difficult are needed as much as the light and easy, then we begin to have a very different perspective on the world. By allowing all of life’s colors to penetrate us, we become more integrated*****.** \~ OSHO

Many moons ago…maybe 8-9 years, I was very much into positive thinking but to the absence of negative thinking. I believed after following teachers like Abraham Hicks and other Law of Attraction methods that I should focus solely on the positive. One of these instructions was to avoid the news, to not get involved in the horrors that were happening in the world, to surround myself in essence with only ‘Love and Light’.

I was wrong.",19Aug2019,1
77," Schizophrenia is a mental illness that affects how the [brain](https://www.jerasp.com/2019/07/how-does-depression-affect-brain.html) works.  People with schizophrenia may experience some of the following symptoms:  
**.** hallucinations

**.** a lack of interest in things  
**.** feeling disconnected from your feelings  
**.** hearing voices  
**.** delusions  
**.** feeling like you need to be protected.  
**.** difficulty concentrating  
**.** wanting to avoid people  
A person with schizophrenia typically experiences changes in behaviour and perception, and disordered thinking that can distort their sense of reality. This is referred to as psychosis. Delusions, hearing voices and hallucinations are all types of psychosis.  
MORE  [https://www.jerasp.com/2019/08/schizophrenia-meaning-symptoms-causes.html](https://www.jerasp.com/2019/08/schizophrenia-meaning-symptoms-causes.html)",19Aug2019,1
78,[https://youtu.be/9rFTPeKwzr0](https://youtu.be/9rFTPeKwzr0),19Aug2019,1
79,Trying to get back into working out as I know it will help with my depression and anxiety and I’m low at the minute. But can’t seem to get myself moving at the minute!! I tell myself I’m doing it then don’t with the usual excuses. I’m so annoyed with myself I just feel like I’m goin round in circles 😣,19Aug2019,1
80,"I was fighting 6 dudes with my friend yesterday because they were trying to rob us, we beat the shit out of one and fucked up 2 more but decided to run for it when the other 3 started comin. During and after the fight I felt nothing, no anger, fear, stress, or anything. Its happened before, even now that I got a scratch on my face I dont feel angry. I have very few emotions already. But idk what in the fuck is happening to me.",19Aug2019,1
81,"I tried killing myself a couple of times already (at the end of last year and at the beginning of this year) and I think that may be the cause of these symptoms. I tried to overdose on advil, allergy medicine, and idk what else, but ended up vomiting most of it up. I obviously felt like crap the next day but not much changed after that. These symptoms could just be part of my mental illness but it could have been started by my overdose as well. I’m going to the doctors to see a neurologist anyway because of my tics. These problems started after the second attempt so that’s what concerns me but it could just the incredible amount of stress I was going through as well. Idk. I’m just nervous about going to the doctors. I don’t mind hospitals but my social anxiety increases ten fold while I’m there.",19Aug2019,3
82,"I know my family loves me, but i still can't get enough, I don't have any real friends, a girl invited me to smoke pot and i accepted, I was at her house high and hell, It was the best Day in years, not bc i got high, but bc i could finally talk to someone about my life like she was a long time friend, I really needed to just talk, but i moved Out of the City and now i feel empty, feels like i have no one, feels like everyone ignores me, even tho my family always ask how my Day was and stuff, but i think that Just isnt enough, I dont know how to make friends, not even sure where to start or just any excuse to talk to anyone, im New here in this school, I Just feel really empty, talking about it helps me get it off my chest a little. Why cant i Just be whole with the love my family gives me? Am i wrong for wanting it all?",19Aug2019,1
