,text,time,score
0,"I'm a 24 year old Male and I have problems. You couldn't tell from a glance; I've done daily personal development for over 5 years. I went from anorexic (45kg/173cm) to very athletic (68kg/173cm/no body fat), and I have advanced social skills for someone with high-functioning Autism. 

&amp;#x200B;

I'm actually pretty 'normal' but I still have a lot of baggage around relationships. I can pickup Women quite easily, but I really struggle to develop it into a relationship. I've had a previous relationship of 4 years and it was pretty good all things considered. I struggle with negative self-talk and I'm overly critical of my behaviour and of myself. 

&amp;#x200B;

I'm always seeking to improve, and to improve I need self-awareness so that I can assess the effect of my behaviour on those around me. I meditate 20m everyday, I exercise \~8 hours a week, I have a very good job and I have a good support network of Friends and Family. Yet, I still feel sad and I feel like I'm not enough and that I'm not worthy of love.

&amp;#x200B;

1) I wasn't given enough love as a child

2) I was abandoned as a child

3) I suffered/suffer from severe anxiety from a very young age

4) I've struggled with depression all my life, also from a very young age

5) Because of my asperger's I wasn't socialised properly as a child and a teen, and I've only learned to socialise as an adult. Because of this I find it hard to relate to regular people and it has negative consequences on my life. 

&amp;#x200B;

Would this be classified as childhood/developmental trauma?

&amp;#x200B;

Can anybody recommend a book that could help with my situation please?

&amp;#x200B;

Thank you.",19Aug2019,2
1,Everyone have a good day 🙂,19Aug2019,21
2," I'm multicultural and do not look Caucasian, but am half Caucasian I live the North East of the USA

I have been thinking a lot lately how mental health is not just biological and psychological, but also social. I think the society in which we live plays a huge role in the thoughts that play through our head all day. Our society is heavily influenced by the media as well. The current state of the media also appears to be very extreme with how it presents info. I think its fare to say that the media is very negative. I also think it is fare to say that if precaution is not taken with how we interpret the media, our thoughts may become skewed about the society in which we live. In my mind, the media has an agenda and quotas that have to be met. Negativity helps meet that quota. This is not in anyway supporting the idea of fake news! That is a whole other ball field that is not being discussed here. Furthermore, I realize that this is not the only factor that is contributing to the current social climate, it is just one factor.

For the purpose of this post, I will discuss some thoughts that I have a lot. Often times when I'm in a public place that is predominantly Caucasian, I begin to think that the people there are racist and do not want me there.  There are actually times when I get afraid that someone will confront me about my skin color, and how I do not belong in America. (this has never happened). I'm also bilingual, and sometimes I even get embarrassed to speak my second language. This obviously hampers my social skills. Before the current social climate in America, I never felt this way.

It is becoming increasingly obvious that these thoughts are mental distortions. Sure there are racists out there who probably don't like me by how I look, but this does not mean that everyone out there is that way.  Since I did not have these thoughts before the current social climate in America, I cannot think of any other reason why this would have happened besides excessively looking at the news, and the news presenting information that is very negative in nature. Sure people do stuff that influences what the news presents, but It is hard to think how I would have been presented with negative stories if it were not for the media presenting it to me. At least not the magnitude that it is.

I have decided to block all news out of my life. I want to converse with people and get to know them for who they are, not what the media wants me think that they are. What does everyone think of this?",19Aug2019,1
3,"I’m almost finished with “Turtles All The Way Down” by John Green. It’s insane how much that book opened my eyes. Let me start by saying I’m a straight, male in my late 30’s so I know it seems weird that I’d pick that book to read in the first place, my soon-to-be wife recommended John Green and that’s the one I picked up.
I knew it had something to do with mental health, but it was insanely accurate as to how the mind works for someone with an anxiety problem, along with OCD. The “Thought Spiral” is the truest description I’ve heard vocalized about what it’s like to be in my head.
It made me feel like there was other people out there that has the same problems that I have which is somehow gratifying and scary at the same time.
Not gonna lie though, it was a bit triggering to read.
No one in my life knows the extent of my illness. Mostly they just think it’s weird that I do quirky shit like wash the top of my soda cans before I drink them and double, sometimes triple check the safety seal when open a water bottle, throw the peanut butter away if no one in the house can remember if they’ve opened it or not when I go to get some and it’s already been opened. I tell them it’s because I don’t trust people, which is true, but the whole truth is that I have an overwhelming fear that someone will poison my food or drinks . Not just my food or drinks, but anyone’s food or drinks.
I’ve had this fear since I was in my middle-teenage years. I know it’s not real but can’t control it. Sometimes the fear isn’t that prevalent, other times it’s pretty bad. When I don’t think about it for a while, the habits of poison prevention are still there.
That’s all I got for now. I don’t expect anyone to read this.",19Aug2019,2
4,"Everything just feels like it's getting darker and darker in my mind every day. I've completely lost all hope of getting better, having a life etc, and now I'm spiraling because nothing matters anymore and there's just this one tiny voice left in the back of my head saying ""don't give up, what if you're wrong, what if there is a way"" but I'm SO TIRED of living on what-ifs. I can't live off of that anymore, I can't live off false hope, it feels like breathing without oxygen. 
I feel like I'm being dragged towards completely falling apart and letting myself just be a mess and the only things keeping me from accepting that is that tiny little voice (that's getting quieter every day), and not wanting to do that to my mom. I know how much she's affected and has to deal with my shit even when I'm making an effort and if I'm not it's even more, but I'm just so tired. I'm so tired and I'm so sad and I'm so alone.",19Aug2019,2
5,I sometimes get a feeling that I am not real and that I live in a simulation and whenever I feel like I hear the same exact sound twice it makes me panic and think I’m losing my shit. I mostly just feel like I was doing something else before I started living and I want to believe that I am real and myself without doubting it.,19Aug2019,1
6,"I have felt so shitty lately. I haven’t had an appetite at all and all I’ve done for the past couple of weeks is mope around. I feel like I’m a burden in my relationship, my friends, and my family. I am not sad I just feel empty. I’ve never felt this for such a long period of time and I need to get out of this funk. I can’t live like this forever",19Aug2019,2
7, I am  slightly clingy without realizing it until now ?To start off  I used to always be  private about my mental health until recently .going back to it. I am  the helpful quirk friend that just gives on giving  and the return is   non-existent for 99.9% of the so called friends I have.  I am always the first one to start the convos 99.9%. So recently the past year  my mental health  obviously took a  massive noise dive so I started to open little by little then massively based off  some advice  off one of the friends advice. Being the friendly friend as always and trying to be supportive  of others. At the time I just revealed too much and left myself exposed. Of course failed as a friend to support  one of them  as I was in a group with her  for a project  and may of  crossed some boundaries as talked to friend's girlfriend although she was just being supportive. however now the situation is no one is up front and of course they act fake.  I did  distant myself then try to reach out. I did suggest ending the friendships with one of them by asking if its over  its okay I understand but I  am being still being pulled a long with passive aggressiveness. I am okay with ending the friendships now because I have realized my mistakes of course its  fault to both parties me included and of course its just exhausting . I can easier make friends just suck at finding good ones to keep. I am my own supportive which is I have realized based off what's happended  and not going to open to people unless its the equal is given. Of course now I have  decided  to   distant myself and just move on as its just exhausting. I wasn't  always asking to hang out  but I would sometimes of course because going out a lot if just  how I am working on myself and trying to enjoy things while they last of course I just want to make the friends stronger.,19Aug2019,1
8,"I understand that some see ""commit"" as indicating a crime. In no way do I understand that word that way. I see it along the lines of ""amor fati,"" where you accept you have to let go at a certain point and just accept fate. Now, I can understand that using ""commit"" in this sense actually has a slightly positive connotation to it. Along the lines of ""bite the bullet,"" where it's something undesirable, but you just grin and bear it. To the most extreme this phrasing reaches the Asian cultures, where historically they saw suicide as a means of atoning for wrong doing, by completely accepting the consequences of your actions, through becoming your own executioner.

Personally, as someone who has gone right to the precipice of committing suicide, (won't call it an attempt, as no harm was inflicted) I feel that ""commit"" more accurately describes the mental state required to complete the act. (I could not bring myself to defenestrate off of a high place) There's a certain amount of courage and fearlessness you need to overrule all of your body's attempts to get you to stop. I've even seen studies done on suicidality that confirms in males who successfully complete the act they have a lower fear response to stress in general. Why is there such a push against phrases like ""he committed suicide."" when it more accurately expresses the experience than the neutral, ambiguous, and sanitized ""died by suicide""? How do we find a balance between polite language and meaningful language? If ""commit"" is too tainted through associations with criminal acts what is another way of describing the act while including ""accepting what comes,"" as a piece of the sentence?",19Aug2019,1
9,"People who haven’t really dealt with mental health problems assume that it is black and white. That is not the case. It’s not even black, white and grey. 
Mental health is more of a colour spectrum and different colours are different things. 
I think some people assume that mental illnesses affect people in the same way when it’s not true. 
Some people who are anxious have panic attacks.
Some people who are anxious are more extroverted. 
Some people who are anxious completely avoid people and events. 
Mental health is a colour spectrum.",19Aug2019,11
10,"I was diagnosed with only anxiety and depression. I do think i was misdiagnosed, because i was diagnosed in conversion therapy, and they gave me anti depressants wrongly. 
That was about 2 years ago.  Im off the antidepressants. Almost a year now. 

For the most part, im alright, but sometimes i remember things. I remember being trapped. 
I remember my mom screaming at me. I remember my dad being to ashamed to look at me. 

I know rationally that its all over, but its as if im watching it play out again in the real world. Ill be at a walmart, turn the corner and see the room that i sat in. Im there and so is the therapist. But its not tthere.i know its not actually there. 

I used to ride horses, and today i went to visit mine, but i mentally heard my mom screaming, horrified how she used to get when i rode horses. I heard my old trainer screaming at me for not hitting my horse. Neither of them were there. I was only with my dad, and he wasnt even near me. 
My trainer's screaming, and my moms fear overwhelmed me and I wanted to kill my horse to make it stop. I couldnt believe i thought this. I never hit my horses. I clicker train. The very thought of killing one of my horses made me physically ill and induced a panic attack. 


To be clear it wasnt audible, but it all happened mentally. 

Im selling all my horses immediately i dont want anything to happen to them they are my joy.

Sometimes just being out with my parents stressses me and i want to ram my head into walls. I wanted to so badly today but i dont want them to think i have demons again. I dont want another exorcism.

Im so tired i just want the thoughts to stop.",19Aug2019,4
11,"This book has opened my mind to harmful thoughts that were lurking throughout my head.

I still struggle with social anxiety, but at least now I have healthier perspective on the matter.

Just thought I should share it here.",19Aug2019,4
12,This always makes me feel better on a rough day. xx -Sky,19Aug2019,1
13,How do you psyche yourself up enough to go through with searching and getting one?,19Aug2019,1
14,"I fucked up...

Im a drum major for a hbhs band and if you knew me youd know i could get tempermental. One of our dancers was milling about and talking and joking so i told her to shut up and get in line. I wish i could take it back, i want her to know i didnt mean it.

I just found out she was murdered over the weekend by her father. I feel guilty that the last thing i said to her was so negative. I wish i could see her again to say im sorry. What do i do?",19Aug2019,1
15,"I’d like some advice, if possible. Please bear with me - I’ve kept it as short as I can. 

Back in May, I collapsed in a high street. Luckily, I came around pretty quickly &amp; my boyfriend decided we didn’t need to call an ambulance. Miraculously, I had no bruises or serious injuries. I had to take 3 weeks off work as I kept fainting. My eyes would be the first to go. Everything would become blurry &amp; then I’d feel my legs go. I never got any answers as there’s a 23-week waiting list for a 24-hour heart monitor &amp; a cardiology appointment. As you can imagine, this is worrying me. I never felt ready to go back to work but I pushed myself to. I just missed out on an extension on my contract because of my sickness absence from work so, as of 31st August, I will be officially unemployed. The thought terrifies me. 

Yesterday, completely out of the blue, my whole body started shaking. I just felt weird. As I was at home, I made sure to get myself a drink &amp; something to eat (just in case) but it was at least an hour before I felt somewhat normal. I still have moments where I have no energy whatsoever &amp; I’m exhausted. Some days, I skip meals as I haven’t got the energy to slave away over a cooker or even stab a ready meal with a fork &amp; shove it in a microwave. 

I’m really struggling at the moment &amp; finding it practically impossible to cope. I’m waiting for my first psychology appointment so I can’t stop thinking about what to say. I’m worried about the consequences of what I tell them. I know they have to remain confidential but I can’t help thinking that whatever I say could be used against others &amp; cause them lots of unhappiness. 

Growing up, my parents often told me I was a hypochondriac so I try to avoid going to the doctors as much as I can. I’ve been a lot recently (for various tests &amp; check-ups on my mental health as I’ve been feeling suicidal every other day) which has resulted in insults &amp; name-calling. If I say I’m tired, they’ll make a comment such as “you should go to the doctors.” This is making everything worse. I am constantly walking on eggshells. 

I don’t know what to do. I have (undiagnosed) IBS &amp; it has been flaring up on &amp; off for 3 weeks. I’m in a lot of pain but nobody seems to believe me or have any idea how much discomfort I’m experiencing. They seem to invalidate everything. 

I know there must be an underlying issue &amp; I believe it’s connected to my GAD and depression. What I’d like to know is how can I ensure the doctor takes me seriously? I have a tendency to just nod &amp; agree &amp; I don’t fight for answers but I’m really struggling. 

It’s obvious to me that there is still a problem as I experienced the same symptoms yesterday as I did before. I really don’t know what to do. I’ve been told in the past to exaggerate how I’m feeling as that’s what others do (apparently). Is this something you’d do? 

I’m lying in bed, at 2:30am, wondering what to do about everything. I’m not able to go to sleep for worrying. I’m shattered. I just wish I could have half the energy I used to have &amp; not be so weak.",19Aug2019,4
16,just wondering if anyone else has days they just feel numb? i’ve been depressed before so i know this isn’t that... but i can’t process emotion as well as i want to during days like these. everything feels muted or irritates me more than i should. it feels like i want to cry but i can’t so i just end up distracting myself on twitter. i’m normally pretty happy these days only happen once a month maybe.,19Aug2019,2
17,"We went to the doctors for a checkup and she did some tests on me, later said that I lost 4 kilos in a year (which is apparently a lot?) and that I’m very close to malnutrition. 
I haven’t been having a healthy relationship with food lately because whenever I eat I feel physically sick (nauseous and with a stomachache) but ever since the doctor mentioned my weight loss, my mom thinks that I’m making it up.
I overheard her talking to my dad about it and said something about how I look so skinny I’m a skeleton (which I don’t think I am).
Now, I don’t really have any severe issues with my appearance, I’ve always been a relatively skinny girl, but I have been concerned about my eating habits and forcing foods out of my diet to maintain the body I have, I’ve also regulated the amount of food I eat for years now, but I don’t think that I have a disorder.
I’ve had urges about eating less/stop eating completely for years but I just don’t have the will to actually do it, and I’m glad I haven’t; but is there a way I’m doing it subconsciously? Do I have a disorder but don’t really know it?",19Aug2019,1
18,I don’t know if I’m depressed or this is just a phase in my teenage angst. I’ve been thinking about suicide and scared to go around guns because I think I’ll just point it to my head and pull the trigger. My mom has told me multiple times that she doesn’t love me and I feel like she’s just faking all the kisses and I loves you which hurts worse. My dad loves me but I have constant pressure from him and I’m scared to do anything around anyone for fear that i will mess up and get punished. I keep everything balled up inside and I know I shouldn’t do that because one day it’s gonna explode but if I let it out I fear something worse will come. Thought about killing myself multiple times and don’t know what to do. I feel as if I don’t deserve anything I get and that I deserve worse. Help what do I do.,19Aug2019,1
19,"I have no job. I can't drive. I live with my mother. I'm barely 18.  I tried to take a placement test for college, but i messed up signing up and embarassed myself in front of other people last weekend and had to leave early. I was supposed to try again yesterday but I couldn't. I didn't want to see that lady at the desk again. She'd recognize me as the idiot who couldn't read.

I locked myself in my room the entire day yesterday. On and off crying and trying to distract myself. The only main thoughts I had yesterday was ""i want to die"" ""i want to disappear"" ""Why didn't I die then?"" ""Why do people like me?"" ""People don't know who I really am they don't even like me."" I was and am a complete mess. 

 It hurts to know that even if I did kill myself that people I barely know would be affected. ""Why would she do that?"" ""She had so much ahead of her!"" 'So much' my ass. I don't know anything. I don't want anything. I don't even feel like I desserve anything. I just want to go away. I prayed to a God I don't even believe in to die in a plane crash when I went on vacation. I did it multiple times, too. I didn't want to be put to blame for my own selfish thoughts, which in itself is also selfish.

I can't shop for clothes when there are people my age around - I get a pit in my stomach and I have to leave or avoid them. (Honestly, shopping in general is always hard for me. I feel like no matter what someone is judging me. Even if I am alone ot with someone.) I have purposefully gotten sick to avoid presentations. I almost never talk about my inner problems to my friends because I don't want to bother them. I almost cried multiple times just for getting called on for an answer in class. When I had an internship, whenever I was talking to my coach I was ready to cry because I was scared to say the wrong answer. When I didn't have any friends in a class I never spoke once - to the detriment of my grade. I honestly don't go to social events at all, but that might just be because Im introverted. Some of these things are normal, though. 

Im not proud, but I don't think I can do anything like this and I dont know what to do. I can't get a therapist, my insurance is shit and my mother wouldn't let me anyway. She doesn't think i need it. I don't know what to do. I can't even kill myself because I don't know how. How fucking pitiful is that? 


Im sorry",19Aug2019,1
20,I have ban anxiety and depression i constantly have the urge to grab a knife and cut my self to feel something or just see what it feels like but i know i shouldnt and i know it will hurt but i have a urge and it gets very hard to resist sometimes im worried that one time ill do it and then again and again i want this urge to go away any tips?,19Aug2019,2
21,I live alone and am very scared what may happen as I get off of them. As a child I was put on many strong medications by my mom who thought I was bipolar but it wasn’t until I was a teen and had my sister (for me) and I spoke up in treatment that the doctor realized it was depression and anxiety. I want to do this and have a doctors assistance because I’ve done better and I’ve been on this medication for years so I have no idea what I am like without them. Could it have just been bad teenage and youth years perhaps? Or is this something I’ll forever be struggling with? Any input would be great. Should I be concerned? I have always felt weird and self conscious about all of it.,19Aug2019,1
22,"I feel like I don't have a real personality, and I'll imagine myself throughout my day as other people, living and even taking up their mannerisms. It's like I'm holding onto somebody else's personality.",19Aug2019,1
