,text,time,score
0,"So, I (17) have a very nice friend of many years. Recently (passed couple of months) he has being struggling with his mental health. He has opened up to me a few times, when it's noticeable that he isn't right, he explains that his 'mental health is in the gutter' and he's 'really struggling now'. He feels like he is losing some friends and has mentioned having experienced the fear of missing out alot.

This, obviously, is worrying. He has a very strong relationship with his girlfriend who is trying to help out all she can. He has mentioned to me that they are looking into some form of therapy for him, which I have heavily pushed for. 

However, he hasn't started yet. In the mean time id just like your thoughts on what to do/say to support him as much as possible. I want him to get better and be his best self but I'm not too sure what to say to him. 

Thanks for your help",08Aug2020,1
1,I feel like whenever people get angry at me I feel like I’m about to cry or lash out at them. I always feel really horrible for doing whatever they’re criticizing me for and my mood goes super sour. I just don’t know how to take criticism. I don’t want to feel like I’m about to break down or get super pissed and yell at them every time someone says something I needed to work on - whether it’s an insult or with good intentions.,08Aug2020,1
2,"My younger sister is 23. Her health issues began her second semester of college when her anemia caused her to be tired to the point of needing to crawl to and from the bathroom. She received the help she needed and served an 18 month religious mission in Chile where she regularly walked miles a day and interacted with people.
After her mission she resumed college and, for a time, she seemed okay. But, at some point she stopped going to classes and she was diagnosed with depression. She received therapy and is on medication. 
But, she still struggles to do literally anything aside from sleeping and eating. Currently, she has been home with my parents since Covid19 began in March. I'm also visiting my parent's from college as I'm worried about my sister. She's getting all the treatment she should need, but seems unwilling to be helped. She regularly doesn't take her pills and becomes resigned or angry when we try to encourage the most basic activities like going on a walk or watching a movie.

What can I do?",08Aug2020,1
3,"Any response is greatly appreciated, I don’t really have anyone I can ask.

After she confessed to me, I tried my best to say the right words but I wasn’t sure what the right words were. I asked her if she rather not be alive than go to school to reconfirm, and she hesitated at first but then said she told me that she thought she rather kill herself than go to school. I said that “we can’t afford therapy right now even though I know you want to see a therapist”, I told her I will try my best to arrange something for her. I myself have considered suicide and I told my sister words that would have reassured me. I said that what I do is sort my feelings so that I can comprehend them better. I didn’t want to say that this will solve her problem, as I myself don’t like to hear false guarantees like that, but I said that it’s better than letting the problem sit there. I also said that I meditate in silence to focus more on myself more but now I realize that she might prefer to listen to music (she listens to music very loudly) to fill any silence. I feel bad because I know that everyone has different ways improving their mental health and her way and my way are most likely different from each other.  I explained to her that suicide and going to school might seem like the only options but they aren’t. There’s also the option to do independent study or the option to go to another school where she can finish high school early, I also said that if she doesn’t like those options we can make a new one. I also tried to explain the positives of maybe going to school, as she is transitioning from middle school to high school and they are different. I said that when it’s hard for me keep going I try to appreciate small things, like how she doesn’t like people but I said that people also have a good side, which I know was very poorly said of me. I expressed to her that I wish she could have the good feeling of excitement before the first day of school to show that I want the best for her. I don’t know what to else I should say. I am aware that I am not good with my words, that is why I am asking for help. What would be the best thing(s) I can do for my sister?

FYI: My sister is not being bullied and she has a good group of friends (not close but they can exchange homework help and eat lunch together and have hung out twice and sing songs together but they don’t text outside of school, strictly school friends as her at-home personality varies greatly), but rather she finds school terrible and unpleasant...from the fake/toxic/annoying peers around her to the staff that don’t do their job the best.

I also believe the pressure of high school and onwards adds to her negative feelings towards school. my sister has also mentioned multiple times before that she is unsure what she wants to be when she grows up/she doesn’t what she can be good at when she grows up, I have told her many times that it’s normal to not know at that age and even at age 20 people are still exploring.",08Aug2020,1
4,"I fought (diagnosed) depression for 2 brutal and terrible years and made it out alive, but recently I’ve been feeling uncertain in life. I moved away from my parents and got a job about 5 months ago and felt GREAT but recently I’ve felt odd, not in a depression way but still bad. I feel like I’m going to spend my life working a manual labour job and I’m just not sure how to handle it.
I no longer feel depressed or suicidal but I also don’t feel happy I officially graduated my school and feel NOTHING. I’m not at risk or anything but I’m starting to worry about my mental health and possibly slipping back into my “slump” has anyone felt the same?",08Aug2020,1
5,"Basically the premise of the dream was that I was hanging out woth some friends who I do put to a high standard and genuinely appreciate. Now these friends in the dream tended to go off and do their own thing with each other, often times saying “oh i forgot to tell you we were going [somewhere]” or “we lost you in the mall or in the street” stuff like that. So in real life this would’ve fucked with me hard I would’ve been beating on myself that they obv don’t want to hang out with me and that I was annoying, etcetera. But instead in the dream I thought, oh well this is an opportunity to explore the mall or explore the city, things like that. And the lesson you could say of the dream was that solitude can be extremely rewarding, that there are things you can do alone that will have been extremely fun. It was a strange thing to experience since I’m very people centered and put my value in how others see me, but I think I could align myself with the lesson :).",08Aug2020,1
6,I’ve had a mental illness for 4 years now. I’ve finally decided I can’t deal with it by myself. Can anyone give me advice about how to tell my boyfriend I have a mental illness? I want him to know I’m serious but I don’t wanna scare him either. Plz help.,08Aug2020,1
7,"And I mean ""often"", not ""always"".

Like say somebody comes up to you, punches you in the face, tells you you're ugly and stupid and unworthy of love.

Upset? That's your fault! Because only YOU decide how you feel. Feeling bad is a choice and if you don't stop feeling that way it's nobody's fault but your own.

So yeah, victim blaming.",08Aug2020,1
8,[removed],08Aug2020,1
9,"Ever since I remembered I wanted to have my own business. I had a massive backing from my family, who made it possible for me to study abroad, fully supporting me. 

Now I’m sitting on 3 degrees in management, while scanning items in a discount supermarket. I feel disgusted by myself as I am miles away from what I dreamt for myself and thrown away a background, others would kill for. 

I have had jobs in my field, established a company, but just cannot force myself to work on it. I have fully planned what I need to do to build the business, but cannot make myself to walk the talk. Every now and then I do some work and then feel happy that I did, but for some reason I do not have the drive to make myself happy by working on my dream, as if I did not wish myself to be happy. I always just say “fuck it” and have some reason why what I am doing won’t work or I’m incompetent to do it, even though I have proof I’m fully capable of competence. 

I just don’t know what I should do to make myself do, what I know I want to do. This feeling is leading me to dark places, where I feel in a vicious cycle. Please give some advice how I could help myself.",08Aug2020,1
10,"I love to read but in the past few years my symptoms (either from meds or just my diagnoses) have not allowed me to concentrate as well as I need to. I have found that I can’t read a book unless I have the audio version. Then I either just listen or listen while looking at the text in a physical copy. The only problem...I can’t afford to buy an audiobook (AND possibly physical) version of every book I would like to read. 

I’ve stopped reading a lot because of this but I’ve found some very interesting titles and want to keep up the habit. Does anyone know of any cheap (and legal) ways of getting audiobooks without having to break the bank?",08Aug2020,1
11,"It’s like people keep saying “who knows your life could easily change tomorrow or in a week or even a year” but it’s like I’ve been stuck in tbis place for 3 years and it won’t change, and I’ve tried to change myself, I’ve tried to excersise, to be positive etc but it still won’t change, it feels like I’m sitting here waiting for things to get better and trying so hard to keep going and living and trying to make things okay but I always feel empty no matter what I do, it’s like the problem is me, my family has had no idea I’ve ever felt like tbis and I’ll never tell them because they’ve been through too much already, it feels like my time is being wasted with sadness and it feels like even if I do someday feel okay I’ll still constantly wish I was happier for tbis period of my life, I’m 17 and tbis is the time where you’re supposed to “make the most” and I do everything I can, I have fun but as soon as I’m alone I’m empty again, I can’t fucking take it, and now I just feel like an asshole because I’m not even mentally ill but I’m complaining in a subreddit of people with worse issues than me,  I cut my leg yesterday on purpose and it was a strange sense of relaxation, like I had control, the pain felt good, I know it’s fucked up and I’ll regret even making this post but I don’t know when things will be okay",08Aug2020,1
12,"I doubt there will be much coherence here, my mind is pretty much a cluster fuck of fucked up things.
Like anyone it feels like a lot has gone on in my life. I’ve gone through so many stages and transitions of who i am and what i think and it’s hard to know who i am sometimes but i feel like i’m getting far away from the toxic versions of myself that i despise and see now as a product of things i never saw before, things i’d just blame on myself. 
When i look at things at a mental standpoint i always view myself as insignificant figure in terms of how ‘bad’ i was. I don’t ever think i had any conditions yet i have these lines all over my arms and legs. What are they i ask myself sometimes, are these proof or are they just what happens when someone is sad? I don’t think i had anxiety or depression but i spent years void of any real emotions, not understanding what to feel in different situations because feeling doesn’t feel natural anymore. A pessimistic view of everything life could possibly bring me, letting things go downhill because what does it matter in the end? Going to school and interacting with people like i don’t wish the cars i don’t look up to on the way there hit me, like my arms and legs arent in pain from the cuts i give myself to see something that at least makes me feel alive. Like i don’t have storms of thoughts that freeze me in place unable to do a thing, frozen in place like the dread is physically holding me by the throat. Like it doesn’t feel like there’s people inside my head that want me to sit by and just watch life happen and just accept what comes to me. Like i don’t feel like i’m completely insane, my head telling me the worst things possible, telling me i’m someone i’m not, telling me the pain feels good, telling me my end will be a simple blip in the grand scheme of things for anyone who knows me. What does it matter? Why does it matter if i’m gone, in the complete darkness there won’t be any of the pain, it won’t by scary, it won’t be riddled with self hatred and mental scars i wished i confronted earlier. 
Have i tried to end it? I ask myself that quite a lot, i guess i have. But i have this thing about questioning my worth as someone with mental issues, did i do enough to say i attempted? Was doing something i thought could kill me one? Was everytime i tried my best to push down the razor just that much more just so the tears could stop one? Another thing i question. Are my scars valid? I see people with much deeper scars and it makes me think if mine are just what ‘normal’ people do and i’m not really that bad. But in reality some part of me wants to cling on, so everytime i tried to go that bit deeper that part would fight so hard, my chest would go tight and my hands would shake, the tears would come but i never remembered feeling like crying. But once again i question this as well. I still think i’m just a bitch and i should just pick up the blades again and prove i’m not okay, and i never was ‘solved’. I’m a ticking time bomb that never got solved. I’m over a year clean and the battle of that thought is winning me over more and more everyday. It scares me. This ‘competitive’ nature around mental health i seem to have is a outcome of being introduced to self harm by toxic friendships who showed me their cuts and talked about how many they had like it was a competition and fake friends who ruined my confidence and made me lose any childhood innocence i had. Forcing myself to be with them to feel like i wasn’t alone, while i was their laughing stock. The fact my mind was innocent once is depressing, knowing at some point these thoughts weren’t here. And now that time will never happen again. 

I wish i could tell myself i have friends who really do care about me, people i can tell i’m not okay, people who i know care, people i don’t feel like i burden, people i can feel safe with. I don’t think i would ever ask more from this world then to just have people like that. 

I’m the black sheep out of the family, the one who just has to be fucking insane. It makes it hard for them to understand and i can’t blame them i just wish they could. But that feels like asking for too much at this point.

God i wish i could just get all of these thoughts and feelings out, everything i say just feels like the surface of everything and saying just that doesn’t feel like enough. I wish i could get help i do. But the mental health care system here feels useless and i’ve never felt comfortable talking to a therapist like they won’t take me seriously, like i have to make them happy by lying to them while my mind screams at me to just say the truth. To have someone who can help me and i can feel comfortable saying this too, someone i won’t be terrified to cry in front of. 
I just don’t know what to do anymore. I’m at a boiling point and i’ve got so good at pushing it all down and being ‘fine’ that it’s so hard to confront all of this again. 

I’m scared of myself and i don’t want to, i don’t want to feel like a disgusting mess, i don’t want to hate how i look, i don’t want to feel terrified by social interaction, i want to feel comfort not be horrified by people’s touch. I want to feel like i know who i am, and i don’t. I don’t know what i am and i don’t know how to change it. I always feel like i have to make things better but i can’t even solve myself. I just want to be who i want to be. I don’t want this to be me. I don’t want to feel like this anymore. 


But what does it matter anyway, this world is so fucked and stress filled is it even worth it in the end. I’m trying so hard but my old habits feel like they could happen at any point and i know they’ll be deeper than ever, it’s all i’ve ever fantasied about for 2 years. That maybe someone will hear my silent screams when my body has deep carvings in them. I’m trying so hard to avoid that, but it’s getting so hard 

I’m just so tired",08Aug2020,1
13,"She has a semicolon tat. She's been suicidal before. She's never killed herself... but we've never lived through an isolating pandemic before, either. She lives alone. I'm fortunate enough to be married and have someone to isolate with. She has 5 cats, 0 people, and recently posted online that she hasn't had physical contact with another human being in over 130 days.

Well... *fuck.*

Our childhood sucked. Even if we'd been kidnapped by superheroes or gods and raised in idyllic surroundings by people non-blood-relations, genetics and brain chemistry would probably have worked against us in the end. 

I'm not in a position to intervene physically, and that's not the kind of person I am regardless.We live half a country away from each other. A 24 hour drive. I dunno. What would you do?",08Aug2020,1
14,"Do you ever feel a feeling that you can't describe? That's how I've been feeling the past few days. I try to blame in on a couple different things, but when I look deeper it's not actually those things. All I know is it's left me feeling icky and just, uneasy. I can't really describe how it feels, and I can't find the trigger, so I can't figure out how to stop it. It just makes life feel gloomy, and just, idk, off I guess. Is there a name for this feeling? How do I combat it?",08Aug2020,1
15,"Hello, i’m sorry this is my first post on reddit so it might be off but i just need some kind of help. A couple days ago i turned 16 and for the past 4 years my dad has had a breakdown which resorted in him having a bunch of mental challenges some of which now add up to depression, anxiety and being bipolar.

Some times he is fine and normal and other days everything just goes to shit. we’ve been with mental health teams since the breakdown but all they do is change or give medicine once in a while and say how he needs therapy but just leaves him on the waiting list for it never giving him it

for the past month it’s been really tense and every other day its resorted in him getting angry at night trying to start a fight and just yelling at my mum about things mainly things i could’ve of done say months ago and every time slamming doors and breaking things. It’s been a horrible month and we really need help but when my mums been calling they say that he’s on the urgent list but he has been for 3 months. Whenever he gets angry and yelling and punching i end up going upstairs in my room because that’s what my mum tells me to do but i just feel terrible

I don’t know if there’s any ways to help or cope and i was just wondering how to go around this. me and my mum are just really struggling because of how it’s been but i can’t tell her because she has her hands way too full looking after him, meaning my way of coping is crying most nights doing voice recordings to myself as a way to let atleast everything out because i feel like a burden if i let anyone else know.

i’m sorry this went on longer than i thought but i’ve googled around and never really found any ways to help my situation. i don’t honestly know what i’m expecting from this but if anyone has any advise of growing up around this cause it fucking sucks being mentally put down for 4 years by a man who i can’t be mad at because it’s his mental health",08Aug2020,1
16,"I think I might have schizophrenia

Sorry for my bad English. It's 2 am and I can't check any grammar or anything It will be separated into different parts about different experiences, im new to posting on reddit so I don't know how to properly format everything :3 lol
During the last few months I've realised that I might have 

schizophrenia. I never hear voices like someone talking to you. It's more of someone putting something directly into my brain. Like someone typing a command like some nights ago when I started crying and taught about jumping out my window.

Sometimes I feel like I'm being watched. Like my parents (my abusive mom) is watching me or monitoring my computer and social media. When I was 11 or 12 I had to sleep in the first floor of my house and I couldn't sleep if I could be seen from outside the house. Now my bed is to the side of my window so I don't encounter this problem but I sometimes feel like someone is walking over and looking trough the keyhole or opening my door. I sometimes see lights shining into my room that disappear quickly (i live 20km from the closest big city and the only houses around my house are small and wouldn't be able to creat such lights)

I have a plushie that I've had since birth and It has its own personality I've never names it but I talk to it and it helps me in important life decisions.
I sometimes feel like people are talking about me or commenting or laughing at me but when I look for them there are no one around.

I can't take showers(I still clean myself when I take baths) cuz the sound and pain I get form the water hitting me. I can't stand the sound for more than 10 seconds and it feels like I'm being burner or like fire is hitting me. I know it's not the temperature Of the water or the water I have cuz I take baths with the same temperature and water. Idk how to explain more becomes in tired (24\7) and I should sleep but I can't .

I'll answer comments for a while but I'll probably forget about posting this tomorrow :3",08Aug2020,1
17,[removed],08Aug2020,1
18,"Hello. I am 19 y/o right now. Something about myself have bothered me for a long time. It's my weird, day dreaming.

Okay, so for some description on background, I like programming and Maths. Despite spending last years of highschool into games, family problems (and my mental state) I regained hope and dive into them again for now. I was not bullied much tbh, despite being nerdy. My father was a criminal and we left him, but my mom never let me feel I don't have father, so I doubt it has an affect on me. I was decently popular, though I kinda gave it all up, when I was starting to get addicted to games, neither I liked classmates and all much ever. Yeah, I never fit in. That's only thing odd with me. I tried, but I always felt something off, about myself, about others. And I see it relating to what I wanna say further. So now about what made me write this?

It's morning right now, I will sleep soon. Which reminds me of something happened last time when I woke up. I had a very good dream. And I instead of waking up, slept again to continue it. It happens a lot.
Now that's not serious. But it binds up to another real issue. That is, daydreaming of past actions, and what I could have done to alter them. Thinking too much ahead of what can happen in future, too.
Yes, I am a 3rd worlder, and broke. It made me devoid of many opportunities. Family problems got me into many issues myself. And when I was 13-14, porn addiction, and after it some game addiction too made me ruin many opportunities. Then the rumination came when I gave up hopes on all hobbies
But I regained it all. I have some plans. Just daydreaming seems to hamper me sometimes, when I struggle with a problem , I space out making up scenarios. It's a real issue for me,and yeah I think it has to do a bit with loneliness. I don't really have desire for luxuries and such, but just having a guy do something with me kinda motivates me way too much and I forget dreaming. It's just a guess. 
I want some genuine help to increase my productivity, after all the precious time I wasted. I'd really appreciate suggestions and help from everyone here",08Aug2020,1
19,"My ex boyfriend is going through some shit. 
He is hearing the voice of Hekete in his head,
He is saying things that just ain't possible. Like he is a god. 
I left with our daughter and we are staying at his parents. 
I miss him so much, we've been together for 6 years. 
I just want to help him I've tried calling crissis hotline, I've done a wellness check on him but they all tell me they can't do anything without him wanting help. 
And he don't want it. 

What else can I do? 
I went over there yesterday, and he told me he hasn't been eating, he looks bad. I don't think he has taken a shower in 5 days. 
I can't stay there anymore and risk our baby. But unless I have proof he is a danger to himself or anybody else i can't do anything.",08Aug2020,1
20,"This is one of my last ideas, manifesting shit and putting shit into the universe is something a lot of people believe in, so I’m gonna try it, tbis post is just me putting this shit out into the universe, - I will be okay, and I will soon realise how to be happy and I’ll be able to help the people around me and everything’s gonna work out, everything’s gonna be alright and I’ll realise why I’m here and I’ll help everyone else who I’ve relied on so much, I’ll be okay",08Aug2020,1
