,text,time,score
129,"Everything about my life is perfect, and yet my past is still at the back of my head stopping me from being happy.

I can't take it anymore when everything good I have in life I feel like I ruin since I cling so hard to it that it gets obsessive of me, and it leaves.. 

I feel like I'm still going to be the 8 year old girl sitting at the back of class crying because both my parents are having their divorce fights through me. 

I've been mentally abused and manipulated that I don't fucking have a personality anymore and I'm frankly so scared of growing up. I'm 21 and I'm scared of life.",08Aug2020,1
130,"TW: Sexual abuse, ptsd 

I have ptsd from an abusive relationship and am really tired of random rape memes in the middle of videos. Anyone have any suggestions for channels with safe memes or channels with cw/TW?

Thanks!!",08Aug2020,1
131,"
So for the past few months I’ve had very bad anxiety, mood swings and lack of motivation and generally struggling to put a smile on my face everyday without thoughts of worry, dread and sadness with increased substance abuse (weed, alcohol). Now there is one thing that triggers a lot of this which is my ex stressing me out so much. I can’t get her out my head. Constantly going back and forth from anger, sadness and sometimes content. Is this normal whilst I’m trying to move on? If feels a lot worse then it should but I’ve never gone through something like this",08Aug2020,1
132,"https://youtu.be/2M1RRtO5B7g

Are you ever so fearful of going to certain places or being in certain situations 💁🏽‍♀️ Could you have Agoraphobia 🥴?

👆🏾👆🏾 Watch my latest video to learn more 💕

Wild thoughts store👇🏾👇🏾:
Visit the link below to stay updated with out upcoming aromatherapy products🍃

 https://www.instagram.com/p/CDJhaPUJ4jh/?igshid=1mpyu4c8vc15s",08Aug2020,1
133,[removed],08Aug2020,1
134,"While battling depression and depersonalization, I feel like I woke up today feeling like I did in highs school, except even more depressed and without even my high school interests. Like all the growth I’ve made as a person in college has disappeared. I don’t feel like the outgoing person I became in college anymore. 

Every day it seems like I wake up with a different mindset. I just want to go back to how I was feeling a month ago, before all this depersonalization happened",08Aug2020,1
135,"I have no hope things will get better at this point. I have been fighting myself the last 7 years to get better and only gotten worse. No one would ever hire me over basically anyone at that this point. I need professional help but with no job and no insurance I can't afford it. My parents say they refuse to get me help because they don't have the money either, but there's evidence they actually just don't believe anything is wrong with me.

I've been posting everywhere, hoping someone, anyone, has some idea to fix this but nothing. There is no way things get better.

I don't know what to do.",08Aug2020,1
136,[removed],08Aug2020,1
137,"I feel like I accidentally made sex and violence a trigger for myself. Ever since I was younger, I’ve been aroused by some pretty messed up stuff, but it never really bothered me since I had the rest of my life. I wasn’t constantly thinking about things like that all the time. I spent most of my time obsessing over other things. One day recently, I decided to cut back on the amount of porn I watched because of an article about how too much porn can lower your libido and it seemed I could only get it up to the really messed up stuff. Which is unfortunate because I had other fantasies like one about falling in love. After I stopped watching the messed up porn, I think I was going through a withdrawal. I could still fantasize and obsess over the usual non-sexual stuff, but I was feeling... off. I called my therapist and told him about how messed up the porn I watched was, which made me think about it even more. He said it was perfectly normal to be aroused by those things. But talking about it only made me realize just how messed up I was. It made me reevaluate my interests and see how much of myself was defined by sex and/or violence. Even violent things that had nothing to do do with my fetish started to concern me. And sex in general made me uncomfortable. An old intrusive thought/ irrational fear washed over me: “what if I’m a serial killer?” At first I was awash with anxiety and began to dissociate, but now I’m almost numb to the feeling of anxiety. I started to have depersonalization and it feels like it’s getting worse. I don’t feel like ‘me’ anymore. I lost interest in basically everything I used to like because I keep thinking about how almost everything I was interested in had some sort of violent/sexual component. I want to go back to playing cards against humanity with my friends or ranting about videogames or reading romance comics or enjoying movies or playing DND.I feel like I’m overthinking everything and it ruined my life. God I wish I could go back to a month ago when I was comfortable with my own sexuality and didn’t question everything I was interested in.",08Aug2020,1
138,[removed],08Aug2020,1
139,"I am currently in my Junior year of college. Soon, I will be starting my placement training and all the preparations for life after Graduation.

I have been dealing with Depressive stages and loneliness for the last year. I think it's primarily because of my mother's passing 2 years ago. I didn't take my Mental state too seriously initially (first year) but lately, it has started affecting my motivation and interest in the preparation process.

Should I get help soon? Should I wait until graduation and job placement?",08Aug2020,1
140,"I spend most of my free time in video games. However almost every night I become extremely upset about how unproductive I was that day, caused me to try to distract myself with my phone and causes me to stay up extremely late. This cycle has been on repeat for months now and I don't know what to do. I feel so bad about wasting my time yet I still do everyday. I don't know what to do.",08Aug2020,1
141,[removed],08Aug2020,1
142,"Fuck you
Fuck you
Why do I have to pay for some cunt to tell my brain is shit when I can get a fracture fixed in 20 minutes for free.
Thats a 140£ a month fuck you

Fuck you 
Fuck you
Fuck you
I could buy a bottle of henny and go climb some buildings you fat cunts, would be cheaper",08Aug2020,1
143,"Hi All, 

Somewhat long post. Basically wondering if anyone else has experienced this. 

If you’ve seen Memento (great movie), you’ll get it immediately. If not - I recommend Memento! - I’ve written stuff below.

Any thoughts would be appreciated! 

—

I have been living like this for a long time, as long as I can remember.

Basically it feels like I have to restart, every day. I do not feel continuity between days/weeks/years. I’m 34 at this point.

it’s very difficult to plan ahead - which also means that I don’t really have expectations (and so don’t really experience that much enjoyment either). 

I dont really seem to reflect on the past that much either.

I’m sort of in an in-the-moment, maybe fight or flight, as a constant state.

Part of this is that I don’t let my “true personality” come out (maybe I’m too scared). Maybe because I had to sort of fend for myself emotionally growing up (family issues). 

I have felt like I’m pragmatically managing my whole life, based on what’s in front of me, not really “going for” something.

It’s depressing to think about, but it has sort of been a constant state for me.

On the medical side, I see a therapist, for depression/anxiety, and I have been treating obstructive sleep apnea since October - I honestly think that only because I’m treating that, and get real sleep, can I examine these thoughts. 

I also was diagnosed with an auditory processing disorder a few years ago - pre CPAP - , but, that’s in a pretty gray area scientifically. 

I’m resolved to think about this as a problem to solve though, because, it’s pretty draining and I feel has prevented me from developing real relationships or fulfillment in my life.

Most critically, it does not seem to be the way that people I know live their life.

Sure maybe they have other issues, but I’m focused on this one, because despite whatever happens in life, the feeling constantly starting over (and to that end, having accomplished nothing) makes life draining and more about relief from tension than achievement and fulfillment.",08Aug2020,1
144,I had this idea for a device that you attach to yourself on one end and attach to your therapist/psychiatrist on the other end so that they know how you feel and you don’t leave anything out that might be important. Or maybe a game like psychonauts where you and your therapist/psychiatrist could go inside your own mind and fix the things that are bothering you.,08Aug2020,1
145,"
I have not finished my college I was bullied in my college (not just my fellow students but the professors as well) years that I don't want to associate myself to any schools because I am afraid that experience might happen again. I just wanted a restart but the idea of going back to school is uncomfortable to me. My confidence was drained in my college days. I was once a dreamer to be a successful person someday but it looks impossible for me now. I cannot share my experience to my parents because ofcourse they won't believe me. Well the day I said to them I want to quit school and have a break I was in tears begging for them to accept my decision. Though they accept what I asked I can see in their body language  that they are disappointed to me. I am aware that until this day that im writing this letter I am still a big burden in my family. I wanted a restart, or a job maybe, something that changes the environment around me. dying is also one of my options now. I just can’t describe exactly my situation rn but its like everything around me is too late - falling down. Thank you and sorry for interrupting your time.",08Aug2020,1
146,"Feeling a lack of purpose has been the biggest struggle for me and my mental health. It’s given a big blow to my self esteem. It makes me feel not worthy or good enough. 
I guess I thought I had a purpose. Always working toward that goal made me feel great about myself. In a way it made me feel more real? I was apart of the world? I felt like I belonged to something. But covid and my anxiety changed that. Now I don’t feel like I could actually accomplish my purpose bc I suck.
It’s really only myself stopping me bc I’ve been stuck in this cycle of no motivation &amp; not believing in myself for so long. 

“How will I ever get out of this labyrinth?”",08Aug2020,1
147,[removed],08Aug2020,1
148,"My sister, A, has always seemed a bit mature for her age. When she was about 11/12, we found out she was having cybersex with a stranger (middle-age, M) she met from FB. This repeated again last year. A was only 13 when we discovered that she was manipulated and groomed by her gym instructor (M30+) into giving him a blowjob.

In both instances, my other sister (F17), J, was the one who found out about it through snooping through her messages (without A's consent) and I was the one who 'snitched' to mom about it. I don't regret snitching in these cases because A had no idea what kind of grave danger she was in. My mom was a progressive woman who understood A's actions and helped with her recovery. Unfortunately, she was also in complete denial of the fact that our family dynamics played a huge role in A's reckless behavior. So while she doesn't really demonize A for her actions, she still believes that A is to be held solely accountable for her flawed decisions (which IMO is just wrong).

I've always felt that A had a lot of issues with our family. My parents always compared my sisters to me, telling them 'why couldn't you be more like your sister' etc. Of the two, A, who was smart academically like I was, took these comparisons to heart. A's accomplishments were always dismissed in contrast to mine (my dad once joked that while I was artistic, A was autistic). I only noticed signs of A's pain when I became mentally ill and saw eerily familiar behavior. These signs were further confirmed when J found a diary containing entries detailing A's wish to die for she will never be enough anyway. Again, my mom's position on the family factor doesn't help at all. The constant dismissal of our parents, unreasonable pressure to be 'more talented', and numerous violations of her privacy, I feel, eventually led to A's reckless search for the acknowledgment and affection she could not find in our family. 

Jump back to now. J tells me that A personally confided to her that A was no longer a virgin. A didn't tell J who she lost her virginity to, but it seemed like it was a recent development (something that happened during quarantine). J had her suspicions that it was her and A's mutual friend (M18; groped J when she was sleeping; currently still flirting with A). J also told me that A verbatim said: ""It wasn't something that I wanted to happen."" 

Given that A trusted J to keep this secret, we agreed to keep this to ourselves and to wait for A to tell me. However, I can't help but have second thoughts. Although I know that it's great that A finally feels secure enough to share a secret with us, keeping mum about this only delays A from getting the support she needs (esp if she was raped + past trauma unearthed). As sisters, it goes without saying that we keep and cover for each other's secrets from our parents (for reasons mentioned above) but there are always few and rare exceptions. 

Should this be one of those exceptions?

TLDR: My youngest sister, who has mental health issues, trust issues, family issues, and a history of past sexual abuse, has confided to our other sister that she has lost her virginity, saying ""it wasn't something she wanted to happen."" Should I tell our mother that she may have been possibly manipulated and raped so that she can receive help immediately, even though we risk losing her trust in us in the process?",08Aug2020,1
149,"I feel like I am setting myself up for failure. I want to be happy and normal, but I also like the misery, the addictions, the pain? I know it's messed up, but I feel like even when I'm trying to get better, help myself, I'm still not? I feel like I'm not trying hard enough, trying to keep myself in this pit of despair? I don't know. I don't sleep anymore, I either way everything or nothing at all, and I definitely over do it with over the counter medication... Just to see what happens? I don't know. I guess I'm just wondering if anyone else feels/felt this way, and maybe how to stop?",08Aug2020,1
150,"Whew this is tough for me to write. On Thursday, my younger sister, my puppy and I were going to go shopping for my college apartment. When we left our apartment, I checked to make sure the coast was clear and got into the third right lane. Suddenly a car from behind us hit us on the driver side where I was and we swerved into the middle lane. By the grace of God my sister and puppy were fine. As for me, I felt a blow on my head. Getting into a car accident has always been my biggest fear and I'm still shook it actually happened to me. The cop on the scene was super nice to me and made it clear he believed my account of the story and my sister keeps insisting I did nothing wrong. But I still can't help to feel it was my fault. I keep thinking about how I could've been dead or my sister or puppy could've been dead. I've been wanting to cry all day the past two days. I already did cry and my siblings and dog gave me confort. Despite all that, I still feel incredibly shitty. In addition, I keep thinking about it. I keep trying to relax and get it off my mind but every time I do I just have a random flashback of the moment I realized I got hit. I keep hearing my sister yelling and asking if I was okay. I also keep feeling the blow to my head. I'm ready to get my car fixed (it wasn't that bad) but really I don't know how I'm gonna drive again. I was thinking about it this morning and I started shaking thinking about getting on the road again. I haven't felt good the past two days and I won't get into details but my grandmother and dad didn't make it any better (but hey that's black families for you.) I just need all the support right now. Crying didn't make me feel better and I just feel like lounging around the house and not doing anything. I'm not even looking forward to college anymore",08Aug2020,1
151,"First time posting so dont really know what to expect but here goes.
A good few years ago little naive me decided to help a friend out. She was struggling to make ends meet, single mum and needed to pay her sons nursery fees off. She asked me in desperation if I could be her guarantor. Yes, I'm stupid. Yes, I should've said no. Yes, I regret it. She topped the loan up and before I knew it she had asked for 6k with a ridiculous interest rate. Eventually after about a year we agreed that she wasnt paying it off but just paying the interest so it was decreasing very quickly. I was worried that I would have to step in and pay this loan off along with the ridiculous interest. So I posed the idea that I would get a loan out myself to pay it off, low interest rate and draw up a legal document with her to pay me back. It was literally half what she was paying a month so she was really excited. So all that was put in motion and she started to pay me etc.. after just over a year she finally crushed me and told me she could not pay it, I found out that she had around 19 grand worth of debt to 9 different creditors. I immediately issued a money claim, courts, CCJ, went all legal etc. She is currently on a debt relief order and I am also currently waiting for her old employer to go to court as they failed to reply to an attachment of earnings order (September). Few years later I am still paying it off..
I have tried to be fairly positive through all of this to push it a side and say 'shit happens' it was just my learning curve in life. But recently I have been struggling bad with my anxiety so I have been filling in a journal this has come up to be a thing in life that has annoyed me. I want to get over it or at least deal with it but I dont know how. I think it has effected my mental health more than i realise. 
On top of that, I found out last week she went on holiday to Greece with her OH. My blood has officially boiled over.",08Aug2020,1
152,"I have a history of mental illness where they keep changing my diagnosis but as I understand it I’m bipolar, might have ptsd, I have body dysmorphia and an eating disorder, recently developed an alcohol issue.

I’ve called in sick twice in a row because I was hungover. I asked the manager to schedule me for today but because he didn’t ask the last, more important thing I asked him to do over the phone I’m not going to bother going in. He asked me to go in for my usual 9-5 shift even tho the store doesn’t even open until 9:30. I doubt they’ll be missing my absence.
I’m a cashier. This is after I was basically forced to self isolate after a fucking COLD. And they reduced my hours over it, so I thought fuck it and got way too drunk twice. Fuck covid, fuck this whole year. Fuck everything. I don’t have anywhere to go if I get fired but thinking about this..

I haven’t gone into school more than 30% of the time and my parents kept asking me how I could expect to hold a job and I just thought I would kill myself before I was 18. All my past employers had scaled my hours back after I called in sick too many times and I ended up barely surviving multiple stints of being unemployed for months at a time. I moved out at 19 and I’m 23 now and have struggled to keep my hours at work for the last two years.
I’m royally fucked as it is over a cold and now with two days hungover to add to that, now I can’t even be assed to go in and beg for the hours.

I could end up homeless and I can’t even care.
I’ll go in today if I get a call, but I doubt I’m even scheduled and can’t be bothered to check even just walking over there is too much for me and I’m sick of not being able to visit anyone because I’m either at work or busy. I was supposed to visit my mom today so I’m going to do that. Maybe they’ll fire me eventually, I’ll deal with it later.",08Aug2020,1
153,"When I was 12, I befriended this older boy was around 18 at the time. And our friendship continued for two to three years. The older boy was popular in our local area, and he had a relatively large following on social media, too. He was acutely aware of his popularity among others and used it to his advantage. He retained this distinct aura that made others become infatuated with him. And I, too, idolised him. I would periodically frequent his house alongside others minors. The sexual abuse was apparent from the start; however, we never perceived it as abuse. It started off as subtle, flirtatious touching. But, eventually, he would coercive the others into sexual acts like fellatio and cunnilingus. And many — if not all — lost their virginity to him. It should also be noted that were a great many times when others would naively throw themselves at him due to stated reasons above. He would also expose us to more subtle forms of sexual abuse; for example, he repeatedly showed me videos of him masturbating and others masturbating — all of whom were underage. Additionally, he would emotionally abuse by disclosing his past and mental health. I recall several incidents in which he showed me pictures of him self-harming — or the aftermath. And because of this, we all felt emotionally obliged to continue our friendship. Around this time, I would drink excessively and partake in other self-destructive activities. I just wanted to fit in; I wanted nothing but for him to like me. Presently, I can’t recall many instances of direct sexual abuse towards me. But there was this one time when I very inebriated, staggering round the house. He took me into the bathroom and laid me atop him in the bathtub. And I vaguely recall him fondling me. However, because of my state, it is quite possible I am merely imagining things. All of this went on till his arrest. For years after, I never reflected on my past. In some sense, I suppressed my past; but it unconsciously channeled into all other aspects of my life. And only now am I looking back retrospective and considering the possible trauma it all caused? I have a very skewered perception of sex, which I think is due to being prematurely exposed to sexual behaviour/abuse. A power imbalance was normal to me. Coercing others into sexual acts was normal to me. I was a mess — and I still am. Over the past four years, I have been dealing with depression, anxiety and OCD. It first took the form of intrusive thoughts: abhorrent images of me hurting others inappropriately would randomly conjure up in my mind. At first, they caused intense hurt. Which was not merely due to the images per se, but because I had no understanding of where they came from, or how I could even think of things so heinous. Eventually, I could refrain my entertaining most of the intrusive thoughts. However, the ones which caused me the most distress, I could not refrain from entertaining. And, consequently, they would manifest into ‘false memories.’ And now, I can’t distinguish between reality and figments of my imagination. Everything is a blur; plus, I feel completely detached from my former self. I’m lost — so, so lost. Everything in my life seems to be inextricably linked to the older boy. I can’t have sexual relations with someone without fearing I have molested them. I can’t look at children without fearing I’m a paedophile. The voices in my head continuously tell me that I have molested loved ones in the past, like family members and friends. I have spoken to girls online, and now I fear that they were underage, and due to this, I am a predator — just like the older boy. The worst part is, I live in constant uncertainty; and uncertainty fuels OCD. I don’t want to be like this; I want to be happy and pursue my dreams. But I don’t deserve that; for I am a bad person. A bad person who may have done unforgivable and inexcusable things. I tried therapy and counselling for the past there years now, and I’ve also been and medication. This all temporarily subdues the hurt, but in the end, I am inundated with regret, shame and disgust. I desperately want to die so badly, but I’m scared. I long for this all to be over. I don’t know why I am writing this. I’m sorry mum.",08Aug2020,1
154,,08Aug2020,1
155,"I’m 15 years old and I’ve just realised I have maladaptive daydreaming, I went to tell my parents and grandparents but they say “you’re just really imaginative/stop worrying!/it’s no big deal/it’s not a bad thing!/stop self diagnosing” how do I make them understand how bad this is? Please help! I don’t want to live in my day dreams!",08Aug2020,1
156,"So I got into therapy a few months ago, started working out and eating more healthier. I’m also being more kind to myself than I used to.

Ex: baths, giving myself rest days. 

Its going super well so far, few bad days here and there but I’m making it through",08Aug2020,1
157,"Hey guys, I’ve been feeling pretty down and unmotivated lately. I usually just watch youtube as a distraction but im pretty sure that’s unhealthy and not helpful. Any suggestions on what I can do to busy myself off-screen?",08Aug2020,1
