,text,time,score
185,I think its so hard to be positive in the world we live in. People be nice to your face and yet could start rumours or talk shit behind your back even if youve always been nice to them. You'd think this shit would stop after school when people mature and grow up but it looks just as bad atm. Anyone any advice on this? I know its something Im gonna have to live with forever because theres always gonna be them sort of people out there and for some fucked up reason it seems to be majority of us. I wish there was an easy way to find genuine people,08Aug2020,1
186,"My 3 week old baby was up crying all of last night and the night before, so this morning I was absolutely exhausted. My mum said she'd come and take the baby for a few hours so I could get some sleep, so whilst I was waiting for her I made up his bottles and sterilised the breastfeeding equipment on the stove, then went to bed when she left. 

My fiance and I woke up a few hours later to a really strange smell. Turns out I had left the stove on, melted all of the equipment to liquid and the house was filled with smoke. My fiance really panicked because apparently plastic is toxic when melted. 

Thank god the baby wasn't home, all I can think about is how it could have started a fire and killed my family. I feel absolutely awful and keep crying. I was just so exhausted I completely forgot the stove was on and I even left all the bottles on the side so they aren't safe for him to drink now. 
We left all of the windows open and went to my mum's house for a few hours to let our house air out, so hopefully it's safe now. But things could have gone so differently and it would have been all my fault. The thought of something happening to my baby makes me feel sick.",08Aug2020,1
187,"I feel like these past couple years i’ve really been trying to grasp onto any little thing that can make me happy but those things never last. If I make a friend, give it some time and we aren’t really friends anymore. I feel alone. It’s hard for me to make friends because i’m a super shy person and I feel like even when I do put myself out there people don’t really understand me. I literally have people who just tell me to just be okay, just relax. I can’t fully explain how I feel cus truthfully I don’t even understand and people always get mad at me because I struggle with that. I feel i’ve really been pushing myself to find people who I can be friends with but I’m so exhausted because I can’t find anyone who I connect with and that understands me. I’ve literally been sitting in my room all day just thinking what is even the point. I feel like i’ll never find a true happiness and it always just falls back to being me, here, by myself. I feel I need to try and reach out to feel better, so, this is me doing that I guess. Even though I’ll probably delete this soon.",08Aug2020,1
188,"Im under the mental health act due to mental health issues and i live in a Housing association flat in a block. Ive been in the flat over 5 years im a good tenant never had a complaint but where i live has made my mental health a lot worse. Which the mental health people and the housing association people know about. In the block theres fighting arguments drugs loud music partying etc etc you name it happens. So my question is what are the chances me being put in a flat else where??.
Thank you",08Aug2020,1
189,Hey I’m not tryna complain just always thought this was curious.  I find it nearly impossible to cry around close loved ones particularly but also just in general and it’s so annoying.   I like to cry and have only done it around my mom like twice and my ex once I can remember.   But when I cried around my ex I just kept sobbing for 1-2 hours and it was so therapeutic and I felt extremely better afterwords like I never felt before.   Now for a while even when I’m sad and alone I can barely shed a couple tears and I hate it.   Anyone know if I can induce crying I just wanna do it so bad even though I’m not sad rn I forgot what it feels like.,08Aug2020,1
190,"I work as a project manager in a notoriously high stress industry. I started out at this company 1.5 years ago in a lower position, and worked my way up to project manager at the beginning of this year. Things were going great; made more money, new title, great experience, and feeling like I was moving up.

My issues started with our weekly meetings with upper management. I already have a deep fear of public speaking to begin with, which makes these meetings very difficult for me. I get so nervous that the night before I won’t hardly sleep, my stomach gets upset, and have an intense feeling of dread and anxiety. As my turn to speak gets closer, the symptoms intensify; my heart races, my palms sweat, I start thinking I need to run out the room, etc.

If these were nice, non-confrontational meetings, maybe I could survive it. Instead, they are just brutal. They attack me for everything I’m doing, question my every move, and if it’s a really bad one, they’ll yell and scream. Because I get so nervous, I have a very hard time defending myself or my ideas. No matter what kind of preparation I do, the only thing I seem to be able to do is sit there and take it, or just babble aimlessly. 

It’s been taking a toll on me. It used to be that these meetings would only really put me out for a day. For the rest of the day, I would just be in this weird mental state, where I couldn’t think straight, couldn’t get anything done, along with intense feelings of sadness, frustration, and self loathing for not doing well in the meeting.

The last few weeks, it’s gotten to the point where I’m in a worse state than usual, and it’s all the time now. I started having moments where I was unsure if I what I was doing was real. I’d come home and talk to my girlfriend, and wonder if I was actually having a conversation with her. I started sleeping more than usual. On weekends, it seems all I can do is lounge the entire time. In conversations with friends and family, I often feel blank and can’t have a full back and forth conversation. 

At this point, I don’t feel that I have completely lost control, but I’m afraid of what’s going to happen if nothing changes. I was close to finding a new job, but my boss seemed to figure out that I’ve been unhappy/off lately and sat down with me to talk about it. It was a good talk, and he ended up bumping my salary up $10K. I’m very thankful for this, but now I feel even more pressure to just stick this out. I don’t know what to do, maybe I still try to find a new job, maybe I need to do therapy, maybe I should quit and just rest for a few months while I find a new job. Let me know what you think i should do.",08Aug2020,1
191,"Hey, I'm 22 and I am diagnosed with ptsd, bpd as well as multiple anxiety and depressive disorders. I've been in and out of mental health services since I was 12. I've had at least 5 suicide attempts tried lots of medication and if I'm not coping I will reach out. I was sexually abused when I was younger, between the ages of 6 and 8 roughly. My father is a drug addict and mostly absent and I'm starting to realise that my mother was physically abusive towards me and would manipulate and control me and still tries to now. Their relationship was violent and I witnessed a lot of that.

As a teen/adult I have struggled with no motivation and just a complete sense of apathy, I have bouts of mania, I never made plans for the future and couldn't leave my house alone. I wouldn't wash, I would drink, I'd over eat, I was not functioning. Through hard work, medication and intervention I've managed to get myself to a place where I'm a (mostly) normal person. I can keep myself and my house clean, I go shopping alone, I got my drivers license and I've even held a part time job for a couple years now! I've got a pretty good grasp on the anxiety and the depression but I feel like there's more to it but I want to know what other people think because I'm really lost and things are happening that are scaring me.

So I don't remember any of the sexual abuse that's happened to me, I remember the before and sometimes the after but I don't remember the actual acts of abuse. I don't remember HUGE chunks of my childhood, in fact probably most of it, I don't remember big events like my sister being born, birthdays or my dog dying ect. I just thought I was forgetful, it's worked in my favour not remembering the abuse so suppose you win some you lose some. But its not just my childhood where there's chunks missing, I have patches all throughout my life where I don't remember it, I don't remember my grandads funeral but I remember the wake, I don't remember most of highschool, I don't remember what I did for most of yesterday.

Over the past year or two I've been suffering so much worse with what I assume is dissociation, I haven't seen anybody about it but its probably the best way to describe how I'm feeling. It's like I'm the passenger in my own body and I'm just watching myself go about my day to day life. I lose hours where time just goes super quick and I zone out and whole hours have gone by and I've not noticed, I've just been staring at a wall. I have times where I feel like a robot and nothing feels right and its all a bit wavy and my head becomes all whispery and I can't tell which thoughts are my own and it's like I'm trying to pick out my own voice in a crowd. I really struggle to string a sentence together most of the time, my friends joke and like to say that I need to load and that I'm just running on Internet explorer but it's because I lose what I'm saying all the time or have to put a lot of effort in at times for my thoughts not to get lost. I have times where I feel like I'm in a bubble that needs to pop or like I'm underwater. I have times where I will be doing something and then just suddenly come round and I'm somewhere else doing something random. It's happened a few times where I've driven out to the house where the abuse happened, in the middle of the night and I have no recollection of how I got there. I started smoking again without realising, just felt horribly irritable for a few days without realising what was wrong and then found a pouch of tobacco in my bag. 

I was wondering what people think it could be, I've been dealing with this by myself for a while and nobodys noticed anything, I'm still functioning but I'm terrified, I'm so embarrassed and I've been working so so hard to be functional and I feel like I've just gotten to a place where I can finally enjoy my life, I don't want to speak up and end up getting sectioned, I don't want to tell my friends or my boyfriend bc it just sounds so wrong. Driving out to my abusers old house is a new thing and so is the smoking, it's scared me. I feel like depression and anxiety and ptsd and mood swings are something people can understand but this feels so alien and I'm getting to the point where I'm ready to reach out and get some help for it, I know you guys aren't medical professionals but I wanted some opinions and encouragement and maybe somebodys who's been through something similar who can tell me what to expect x",08Aug2020,1
192,"I don’t quite understand why I do this. Whenever I feel a negative emotion, sadness, anger, loneliness etc I will hit my head repeatedly until it bruises and leaves a bump. It is instinctive and there is nothing in between the emotion and hitting myself that allows me to process it, I cannot seem to help it. I also starve myself when people are mean to me. Was I dropped on my head lmao why can’t I seem to process my emotions properly",08Aug2020,1
193,"A little context: 

We moved one year ago. My two brothers ran away and she doesn't understand why (long story, no abuse involved) my grandmother died a month ago, my dad's always away and my sisters are a big source of stress (10 and 13, respectively). She cries a lot, she's touchy, she's losing a lot of hair due to stress, she worries so much about my brothers, and she doesn't want me to move out since it would remind her too much of my brothers. (18M). How can I help her recover? She also mentioned she's been depressed for the past four years and suffers from insomnia.",08Aug2020,1
194,"I am 20 years old and suffer from depression and social anxiety. There are times when my symptoms are better and times when they are worse. 

Right now it is returning to the point where my cognition and body don‘t function. When I lay in bed to sleep my mind doesn‘t find anything to think about, I can‘t be creative at all, I can‘t think, also in social situations and conversations I‘m not finding anything to talk about.

Then there is the physiological part that every little move even moving my hand and the smallest tasks, showering, brushing teeth, making food, waking up are just a huge torture. I don‘t have any drive at the moment, nothing interests or stimulates me. Nothing makes me smile, laugh or happy.

I don‘t know what to do. I‘m on 600mg moclobemide right now and hoping for the best improvement but now nothing changed except that I‘m more emotionally numb. I tried all SS(N)RIs, that‘s why now we started my first MAOI. I also had 3 depth psychological therapies and they didn‘t do anything or even worsened my symptoms. Next month I‘m going to start a behavioral therapy.

What can I do? I abused alcohol, nicotine, kratom and phenibut for getting off this depression, anxiety and this „boredness“ and negative thoughts in life. But I want to stay off substances except for maybe one prescribed pharmaceutical including therapy.

What else would be your suggestions? I want to increase sports (gym, jogging, tennis), quit porn consumption and decrease smart phone and social media use.",08Aug2020,1
195,"Im constantly demotivated and spend most of my time playing video games, on my phone or daydreaming. Also im not often sad but im also rarely happy for more than short brief moments, and I have suicidal thoughts at least 4 times a week (though i'll probably never act on them).  Im not sure if its worth talking to my parents or seeking help (considering the problems that other people face). Im sorry for the poorly written post.",08Aug2020,1
196,"I believe I am Bipolar type 2 (no Manic, only depression) I Hear voices, see things and have suicidal thoughts occasionally. I go from normal to extremely depressed and just putting myself down no matter what people say.  Also Possible Autism but not too sure.",08Aug2020,1
197,"Tl;dr: too depressed to write a paper and now that i'm on antidepressants it's like my brain doesn't work anymore. Did people experience this too??

I don't know if anyone will read this but I just need to vent.

So I have been going through a lot since a year and this ended up in me getting severely depressed and suicidal to the point where I stayed at the hospital for 10 days. I started taking medication there. It's planned that I go to another mental institution (kinda like rehab for depressed people) for three weeks starting from tuesday and there will be no wifi there.

Mind you, part of the fact i'm depressed is that I was supposed to go to Australia for an internship and it was canceled because of covid and in place of it, our teachers gave us some paper to write. The paper is due on August 20th.

I'm usually top of my class and it's really easy for me to write papers but this time, I wrote just two paragraphs and my sentences didn't make sense and I started having a huge headache. And I have to finish writing these 25 pages by tuesday.

Is that common for antidepressants to make you think less good?

Anyway, now I'm thinking about not writing the paper at all and explaining the situation to my teachers but i'm not sure they'll understand. And if they don't, it might set me a year back just because of this...

I'm usually kind of lazy and procrastinate a lot but this is not it... I can legitimately not form coherent thoughts. It's stressing me out a lot and I don't know what to do.

(Sorry if there are mistakes, english isn't my mother tongue)",08Aug2020,1
198,"Just a question lingering through my head. I’m receiving therapy, learning stoic philosophy, incorporating DBT skills, journaling and taking medication but that hasn’t stopped me from slipping up and losing someone. To be fair, I put them through a lot but now I can’t help but wonder if they left because they thought I was never going to change.

Like, I guess it’s up to us whether or not we want to and some people have their own things to make decisions of, such as what’s healthy for them to allow into their lives.",08Aug2020,1
199,"Back story. I’m 27. I Lived with my grandparents until 12th grade. They thought I was a good kid but I was secretly taking my grandma Oxycodone and cash little by little.I totaled my truck graduation night  from taking too many Xanax. So they basically found out what Iv actually been doing to them and kicked me out ( rightfully so). 

I moved to my aunts house in 2011 after all that in a different state. I joined the army in 2012 and got out in 2015. Moved back to my aunts house and still have been here working shit jobs ( currently a manager at chick fil a) since.  Iv feel Iv been mentally Broken beyond repair. 

I have 0 energy to do anything. For some reason I’m starting to cry typing this sentence right now. Iv never been this person to cry all of a sudden. Iv always felt Iv been mentally strong and tough and the thought process of “it is what it is.” This line of thinking worked until it didn’t. I think it stopped working a year ago.

Recently I’m been struggling to breathe or feel like I’m hungry for air. My mind is racing constantly. I can’t stay on track to do fucking anything. I don’t want to “go out” anymore. I don’t want to play video games after I just built myself a $1500 PC to play on. 

I don’t like listening to music anymore ( I can’t believe this) I don’t like doing anything anymore. I just want to go to my bed right now and no leave for work in 30min. My job makes me want to cry with rage because I’m such a fuck up that I’m back at the same job ( different location) that I was working in high school. It’s like my life cane full circle already and I’m not even 30.

I’m always so tired like I’m fed up with life or something. My friends were left behind in my home state. Luckily I have 1 of them that I’ve known since I was little. Everything sounds boring to me. “Hey Tyler you want to ride jet ski’s?” *Me “no that’s boring.” ( just an example) 

I’m currently supposed to hit “apply student aid” before this Tuesday to go to school for Programming that Iv been trying to do for 2 in a half years. Now I don’t even want it anymore because I have no energy to drive 35 min to school 4 times a week then go to work full time. 

I’m not sure what to do. I have no insurance. My jobs insurance is fucked and not enrolling people until October. I’m had thoughts of not necessarily Suicide but just feeling like I don’t want to do this shit anymore. I’m tired of working these shit jobs. I’m tired of not having my own apartment. I’m tired feeling like I’m hungry for air. 

I don’t wish these feelings on anyone and I’m sorry for my ignorance back in the day making fun of people with mental health issues and saying they are just a cry for attention (not to someone who said they had issues but to friends n such or the internet)",08Aug2020,1
200,"I feel lost, I have suffered with mental health all my life from abuse to bullying to a suicide attempt and even now at the age of 18 I feel much better than I did a few years ago but I still feel like I'm suffering from the things around me like people, thoughts, and the way I look at things on life if I ever accomplish something it feels like it's not an accomplishment or i hate myself for doing something good in my life and nobody seeing it around me, I have got a wonderful relationship but I feel like I can't talk to her about how I feel inside because I've always been a very private person it just feels like I take a step forward but it moves me 2 steps back I feel like there is no progression in my life and I can't look forward I'm just very confused and would love to have someone tell me what to do.",08Aug2020,1
201,"I'll just get straight to the point, since I'm not really sure if my issue is something that belongs here or not. More than anything I'm really just trying to understand why I am the way that I am, and if there is anything I can do about it. So here it goes. 

I have this problem where I can't do anything simply for enjoyment. Every hobby I attempt to have ends up burning me out because I can't just let it be a hobby and be a leisure activity. I used to read all the time when I was younger, but now I feel like I only read so I can record the books on Goodreads and make my reading goal for the year. I stopped using Goodreads and I stopped reading because I felt like I wasn't accomplishing anything.

I don't really enjoy playing video games, as inevitably it becomes about collecting every achievement so they'll show up on my Steam or PSN profile. If I watch a movie I feel like I have to record it on Letterboxd and write a review, or those hours I spent will be wasted because I have nothing to show for the time I spent watching it. 

I love music, always have. I love listening to music. But recently I have felt like I need to do something to tell others about the music I love, or what music I'm listening to, or otherwise just sitting here listening to music will be a waste of time.

Why do I feel this way? I don't want to feel this way, I want to be able to enjoy things without the ever-present need to validate the time I spent doing said things. 

I'm sorry if this is a dumb question, or if it's ignorant, but honestly I'm just exhausted emotionally because this inevitably ends with me getting burned out. Thanks for taking time to read my ramblings, and of course if anyone has any insight or advice I will greatly appreciate it.",08Aug2020,1
202,"TW: s*xual abuse 

I will start this out by saying that I have an appointment booked for a psychiatric evaluation and hopefully extensive therapy. But that’s not until October so I’m posting here. I’m also on mobile so excuse any cruddy formatting. 


I think I’m having flashbacks. I recently became aware that I had been suppressing memories, and many events from my teens came flooding back. I don’t know if they are what’s causing this because they seem easy enough to handle. I had a lose grasp of what happened to me already, it has been details and gaps coming back in bursts. I can now recall various assaults and grooming I was put through and while that obviously bothers me and causes stress and pain, it’s the newer version of the flashes that worry me. The ones I can’t work through because I can’t grasp what is happening. 


I have absolutely no idea why this is happening. Everything else has been linked to at least a fragment of a memory, but this is coming out of nowhere. Yesterday at night I touched myself and it felt like I was knocked out of my body into a bright room with a stranger (I don’t know, everything was very abstract and much too bright) and when I regained control I was immediately crying and launched into a panic attack. I have issues with disassociating and feeling like I’m not present in my body and these flashes crank those issues up to the max.  


I don’t know why I’m typing this out, or if I have an actual concrete question to ask but I feel so lost and overwhelmed. I’m questioning everything, I’m suspicious of everyone and I feel like there is something wrong with me. I can’t remember what it is I’m remembering so it feels fake and I undermine myself, but when the terror sets in I know something isn’t right. There has been so many red flags in my childhood that I’m baffled no one realized what happened to me, that *I* didn’t realize. 


This feels pointless and I guess it might be. But I just wanted to get it out right now because it’s eating away at me. 

Thanks for reading!",08Aug2020,1
203,"I am not feeling OK. I experience mood swings by small things which just set something off. I am not very emotionally mature. I feel like jo body likes me. I feel I am in capable of achieve ing anything in my life. I, acting on my emotions, comes out as a jerk. I am weird. I cannot have small talks. I have never been in a relationship. I just donot feel OK. I am screaming in my mind. What should I do ?",08Aug2020,1
