,text,time,score
72,"So, just a few days ago I found out my Dad was diagnosed with cancer and he's quite a stubborn guy and refused to checked out for months. Finally convinced him and its probably too late to do something as the cancer has already spread so much and its not looking good. 

Less than a month ago my grandfather passed away from covid as well, and my dog of 13 years passed away a month before that. 

I'm only like 18 years old so I'm also trying to take classes, manage internships, help my family and im dealing with all this hardship and I feel like I'm going to explode. 

Covid doesn't help either as classes are so poorly managed and I'm also trying to make a career and do internships and it's extremely stressful. All things considered, I feel like I'm dealing with it decently, but I just don't want to lose my dad. I feel like I didn't get to spend as much time with him as I wanted and I'm just sad he's most likely going to miss out and all the things I want him to be in my life.

He had a stroke five years ago and his life and health has been generally miserable. I mostly feel bad for him more than anything else. He just lost his dad less than a month ago and now his health is rapidly declining. 

I don't really know what the point of posting this was for exactly other than to vent. I have friends, but I just am unsure to open up about this stuff bc I don't want to burden anyone or act like I'm seeking attention. Anyway, congrats if you actually read all this lol. I really appreciate it and I really just wanted to get this off my chest",08Aug2020,1
73,"I (18f) have been struggling alot with my self esteem lately to the point where its almost making me suicidal.. tbh the only thing thats keeping me going are my parents.
I dont feel comfortable talking to anyone about this in real life so i guess i just want to rant and maybe ask for any advice.
So basically i view myself as disgusting and really ugly and a loser. I have my positive moments but they are getting more and more rare as time goes. I never really struggled with self esteem or thought of myself as ugly until like a year ago, and ever since then its only getting worse. I feel guilty asking for help because other people go through so much shit in life and compared to that, my issue seems dumb, like im just ugly? So many people are? But its a big issue for me because it’s affecting my confidence alot. 

The main issue is that i kind of have an asymmetric face (e.g some septum deviation etc) which people around me seem to not notice? But it looks so visible in pictures. I talk to my mum about this and she tells me that im blind because my face is normal (and shes very honest with me always ) she says that if that was the case, she would be more worried about it and would want to fix it but there is no issue. Like i know shes not lying because i know her very well, but at the same time, i cant believe her because what i see in the mirror and in pictures tells me other wise.. 

I know 100% that my face is fucked. I’ll admit im not in the best shape and im on a weight loss journey rn (im not obese just a bit overweight) and i know my appearance will improve after that but idc about that. I hate the way my face looks, thats something I can’t change. No one seems to be interested in me and im 90% sure its because of my face and not me being a bit overweight. 

The asymmetricness of my face is what bothers me the most and its making me really really depressed and suicidal.. im not motivated to do anything and i just feel so gross and weird. It feels unfair that most people don’t have to worry about that. I dont give a fuck if im pretty or ugly etc, I literally just want my face to not be asymmetric. It makes me so uncomfortable. Thats all i want, give me a big fat nose and a face full of acne but just make my features a bit more normal. 

I know no one is ever going to find me attractive lol but im ok with that its not my biggest concern. I just want to like what i see for my own self, i have other goals in life, but this issue makes me so depressed that i feel so unmotivated to do anything. 
I know i can get surgery for my nose issue, but thats just one thing, even my cupids bow is uneven and tbh everything on my face looks fucked to me, so whats the point of fixing that? 

I just want to hang out with my friends like i used to without worrying so much about my face and study hard like i used to and be excited about the future and post pictures like i used to but i cant.. i feel my mental health deteriorating and my self image being shattered into pieces.. I can’t put into words how gross how i feel about myself but tbh I really dont see this ever going away.

It really feels like im stuck with this.. unless miraculously my face changes, I highly doubt i will ever stop being so insecure.. idk what happened to me.

I doubt anyones going to read this and i know I probably come off as ungrateful and annoying but i just wanted to rant and i hope someone can advice me because I still have 1 cm of hope left but overall i have given up",08Aug2020,1
74,This dude has been verbally and emotionally harassing and manipulating me for MONTHS. And as punishments for talking too much or whatever he blocks me for like a day and then just readds me and we just go on as normal since I never unadd him as a friend. Now this time he blocked me for saying if he humiliated me again I will not hesitate to do the same and he then left my friends’ group chat. When the people on the chat wondered why he left I told them about what’s he’s done for me and now they won’t add him back and when he went to go readd me as a friend I hope he had a pleasant surprise not seeing my name show up because I’m done with his manipulative bullshit! Because the he’s treated me has fueled my negative feelings ab myself and validated my depressive thoughts and now I’m just done with it!,08Aug2020,1
75,"Things went great for me today. 

I don't know who needs to hear this but, hey, things will eventually get better. 

You got this!

Just take it one day at a time and remember to be kind to yourself :)",08Aug2020,1
76,My (F14) anxiety is so bad right now. My brain is moving so slow. I feel so hopeless and afraid. I feel so alone. I woke up from a nap 3 hours ago and not long after waking up my anxiety and other possible mental illnesses kicked in. Even the smallest noises or images are triggering me. My own room looks scary in the dark. This is the second night I’ve had to sleep with my led lights on so that I could go to sleep. I’m so afraid of having nightmares. I can’t even vent to my friends because i don’t want to bum everyone out. They wouldn’t even know what to do. I have things to do today. Its 12 am and i don’t want to do anything anymore. I don’t know why I feel like this. It just happened out of nowhere. I feel no physical symptoms besides being out of touch with reality when I get out of my bed and do things. I don’t know whats wrong with me. I don’t feel comfortable telling anyone i know personally. I feel so alone.,08Aug2020,1
77,"So, recently my mom and I have been through the progress of moving, plus my parents are also getting a divorce so that doesn't help. But anyway, recently I've been realizing that I'm better at my friends' house more than my own, but my mom won't allow that, and it really hurts. She got mad at me today, saying that I'll never go live there unless she died. And- I don't know... it's ugh, I also kinda wanna give up on the relationship with my mom but she won't care. She also said some things that just, made me a little numb.. I guess.",08Aug2020,1
78,"Covid isn't doing anyone any good. Especially people with mental issues. I currently work at a hospital and I have to ask anyone that enters questions before they can enter. Well I supposedly have major depression and anxiety from what a source told me. And I just feel like this added stress of passing people off everyday is going to make my problems worse. And I feel like telling my boss about the waves of shitty feelings I get from time to time won't be any good. But I don't want to work labor jobs at the moment . I'm not wealthy, my car is old as hell and I don't have anywhere to go. I just feel stuck. In my depression and in my living area. I'd what to do. I just wanted to write incase someone does rea this.",08Aug2020,1
79,"As days pass my mental health is getting worse, I believe I am having problems with anxiety, and I hit rock bottom. I am alone, with no friends and after a few recent attempts I am currently unable to make any. No one is in my life to support me, I'm all on my own.

I have been talking to myself and trying to calm down during my breakdowns, it is a hard process but I work through it and after some thinking, talking, and a lot of crying I can come out on top at the other end of it. I feel good that I have been strong enough to pull myself through, although I have no reason to believe it I have good hope that I can keep myself afloat.

I am without insurance and I struggle financially, but this job I'm working will give me benefits in only a few more months now. The plan is to stay strong, I just have to power through my struggles because I know I can finally beat it. Once I get the ability I will be seeking therapy and hopefully finally getting help from the hell I've been sitting in for so long now. I'm just glad I have the light at the end of the tunnel now, I hadn't had a full grasp of what was wrong with me for so long and now I feel like I have the knowledge to find myself through to the end.

I have no one to tell this to so I thought I'd post here, I am on the road to healing and I have never felt so hopeful. Wish me luck everyone, and I hope if anyone else is struggling with mental health problems they may not, have addressed, you can seek help. I hope this post can be your sign to start thinking about it.",08Aug2020,1
80,"I've been contemplating whether to post this or not for a while because it seems completely minor, but I just decided to get on with it. 

I [22 F] have problems when things don't go according to plan. Even on small ones like, not getting out of the house by my scheduled time or someone not showing up on a meeting/ event. I get anxious, angry, then I feel super exhausted and just lay in bed, not getting anything done. 

This is usually a problem since my line of professions includes people fitting on a schedule given and most of them show up late or don't show up at all. 

My mind usually overthinks and goes suicidal, I have self harmed for 7 years, the usual cutting stopped 2 years ago, many thanks to the people who helped me, but I still tend to self harm when things go really really bad. It feels like I am on edge then I suddenly breakdown. 

Quarantine has taken a toll on me, i was supposed to graduate this year and take my licensure exam but all of it was delayed, i felt like my dreams were taken away from me. I was paralyzed for 2 months, barely getting out of bed,  and then, binge eating. I got really fat, felt ugly, and depressed. I had just only got back on my feet last June, and slowly starting to accept things. 

I feel like i'm doing really good and coping really well for the last 2 months, i started working out and self- studying. 

Anyway, last night, my bf [22 M] mentioned a job offer 5 hours away from me. We live separately but he works just an hour away and when he has free time, we spend most times on our apartment. 

Our plan was, he starts law school this year again, while I review for my exam, and after passing, i move in with him. He'd been adjusting to me since I was the one in uni so I'll be adjusting to him once I pass. 

The job he mentioned was well paying, it would solve the problems we have for bills and tuition fees. He said he could delay law school or just enroll units and study on the weekends. It will only be for 6 months or a year. Then we'd get back to our original plan. 

Thing is, my mental state is not really in a good condition and i feel like the pressure from review and the upcoming exam will make matters worse. I need him by my side when shit goes down and he can't be on my side if he is 5 hours away. 

So, yep, i shut down again last night, first i got angry, lashed out on him, took some sleeping pills and slept till noon today. I felt like a bomb was dropped all over me and he suddenly has plans without me. 

He only just realized what happened and he says he's sorry. Assured me that whatever I was thinking isn't true and he was just asking for my insight and opinion, and the plan he proposed is just in case he accepts the job. He's always been very loving and supportive, took me to therapy and took away my insecurities. 

I don't know what to do. I want to support him, I want to cope on my own, but just thinking about what will happen, and its not according to my plan, makes it literally difficult for me to breathe. I feel like i'm holding him back from such an opportunity, but he understands that my mental health is at stake here. 

I guess I'm just asking, what should I do? Do I allow him? Can i cope with this? Will i get over this? I'm considering breaking up with him because I'm taking so much from him . I don't know. I hate myself because i'm too needy and too dependent.",08Aug2020,1
81,"I have always been a very closed off person, which has resulted in me having absolutely no friends or romantic relationships, past or present. It is so bad I don't feel comfortable or capable of showing emotion or affection towards my own family.

Is there a way that I can help myself become more open with other people or at least more comfortable with the idea of being more open with people? I've tried using apps as a means to meet people, but any time someone messages me I panic and delete the app completely. I just don't know how to get past the fear or anxiety or whatever that keeps me from talking to people, but the constant loneliness and isolation (even pre-covid) has been waring on me. I've been lying to myself since I was a teenager thinking I'll just grow out of it and I'm reaching a point where that just doesn't work anymore.

Advice would be hugely appreciated though I'll probably panic and delete this before anyone actually sees it.",08Aug2020,1
82,"I (19F) have been struggling with anxiety for a while and started therapy about a month ago. So far it seems odd to me. She will only let me schedule appointments three weeks apart even though I’m not stable and feel like I need therapy once a week. I told her about how I felt like a burden to my boyfriend due to my anxiety and she agreed with me. She also says that the only way I can deal with anxiety is to learn distractions/ignore it. I understand distractions to a point and in certain circumstances but she is not guiding me through overcoming anything. Instead I’m supposed to distract myself when I’m anxious which is most of the time. I feel the majority of our sessions are me venting and her responding with generic responses. 

I just need to know if this is normal/good therapy. I opened up to my boyfriend about it and he thinks I should find a different therapist. I want to and need to better my mental health so please give me advice.",08Aug2020,1
83,[removed],08Aug2020,1
84,"So my grandparent (my dad’s dad) died a week ago after 7 terrible months of being ill. I’ll give more context on it because I believe is important: 


My grandpa was put into a retirement home in November 2019 because he was getting too aggressive with my grandma due to Alzheimer’s. 3 days in the home, he stopped responding at all, he couldn’t speak, eat or walk (after all this time we still believe he was heavily drugged in the home with high dosis). We got him hospitalized and we discovered he had pneumonia. He was was piped so he could breathe, and they put him a food supplier through his stomach. He then was given home hospitalization at my grandmas’. He got worse, he could move at all, could speak a single word, could eat any solid food. My dad and my grandma were there all the time trying to make his life a little better and give comfort. They changed his diapers and moved him around the day and night so he wouldn’t get rushes in his skin of being laying down in a bed all day. 

Worst of all, my grandad was conscious all the time. Looking at the ceiling, feeling pain and without the ability to move or speak. 

Now to the problem: since my grandad died, every night my dad goes to sleep he wakes up suddenly and starts wondering around the house. He goes to bed normally (slowly, with all time in the world) but then he wakes up abruptly, jumps out of the bed and go downstairs. This may repeat several times in a night. 

A very important thing to note that might be relevant (this is something that I assume is connected?) is that my grandad died at night, perhaps sleeping, and that my dad relates the dark room and sleeping with his dad or own death? 

But this is the most important thing in what I need help the most. My dad is not a very communicative person, nor touchy, and does not like talking about his feeling. He usually gets angry.

Now that he needs to talk about this, he gets even more angry, even to the slightest advice that he should get help from professionals or take some calming pills to sleep. When my mom tells him to take some pills he gets strangely angry at the idea, mumbles that they will not work and will make him stay awake all night (it doesn’t make sense, I think it’s a deflection tactic) 


I don’t know how could I  convince him to seek professional help. Surely I can not make him go unwillingly.",08Aug2020,1
85,"As a preface, I’m not suicidal, though it’ll probably seem like it.

Like the title says, I simply don’t care about myself or anything relating to me.  It’s like I somehow turned off my emotions to most things years ago and have just been coasting since then. Something related to my job? Great, I’ll do what I need to do to make sure it’s working properly. Someone needs help with something? I’m there ready to help. Something having to do with myself? Nothing. I can’t sum up any kind of caring or urgency. No motivation to do anything, and not even caring about what happens. I’ve just been trying to get into a position where I can hold steady without support from anyone and...that’s it. No plans after that except trying to extract what temporary joy I can out of any particular moment. I’ll sometimes sleep just to make the day go by faster, only to stay up at night goofing around in a game or staring at a video. If I really start to think about why or what I’m doing, I get a crushing feeling of anxiety about all the things I haven’t done or the opportunities I’ve missed. About how (ignoring COVID) I could be in a full-time college right now. I also feel selfish for worrying about any of this when there are people around me with their own issues and when I’m taking up their time with my stuff. Despite that I have fantasies of someone realizing my “plight” and magically showing me a way to fix it. I even have a therapist at this point but whenever I’m talking with them I blank on anything I wanted to talk about and end up just wasting time until the session is over. I’ve considered looking into if I might need some kind of medication but feel like I’d just be running away from the issue or be less of a person for using something to feel better instead or just willing myself to feel better.

I’m sorry for the wall of text. No direction when writing this and honestly no idea if this even reads properly or the right place to put this. Thanks for reading anyway.",08Aug2020,1
86,"Hey, this is my first reddit post. I'm in an awful mental state at this moment in my life. I find it incredibly hard to talk to anybody in my personal life about my mental health.

If anyone sees this post, and if anyone can help me, please send me a DM. I would really, really appreciate it.

&amp;#x200B;

Thanks if you read this",08Aug2020,1
87,"I (m18) often feel like I dont deserve to be around people or have anyone's attention. I feel like I dont deserve relationships and opportunities and I dont want to pursue them because I stay feeling this pit feeling of guilt or something I hate it so much. I stay away from being in pics and events. I avoid people on my birthday because I do not feel like I deserve the ""happy birthday"". I often fantasize about being murdered so that 0",08Aug2020,1
88,,08Aug2020,1
89,"My mother just told me it would have been better If I was in my college dorms instead of being home cause I got into a fight w my sister who's getting divorced. I am 22 years old and half of the times my parents try to shun me down when I voice my opinion about anything related to the matter. My sister treats me like shit on account of her divorce and whenever I speak up my mother starts yelling at me cause my sister starts crying. My mother compares with me her maybe to make her feel better but why does she not think how it will affect me? I understand you're in pain, but I cry myself to sleep almost every other night, I might sound selfish but I have been dealing w mental health issues myself and this just makes me want to kill myself. Why do I have to go through a trauma for my parents to be considerate towards my feeling? And why have we started comparing our difficulties too?",08Aug2020,1
90,"So let me give you a senario. You were just at the grocery store, you got what you needed and went home, you start to think, ""what if im still at the grocery store and everything that i'm doing right now in my home is what im doing in the grocery store? What if I'm embarrassing myself and don't even know it? What if whatever words im listening to is what im saying at the grocery store?"" Those thoughts creep into your mind until you forget about it. However, the cycle might continue another day. Does that senario sound weird to you? Well what if I told you that this has been happening to me for nearly all of my life? You wouldn't believe me, but its true. Ever since kindergarten I have felt these emotions. Just imagine the senario but instead of the grocery store its someplace else like school, someones house, or even worse, maybe that place could have been a funeral or a wedding. It has been screwing with my mind since I was 5 and I need you guys's help to figure out what the fuck is wrong with me.",08Aug2020,1
91,Ive lived my life very depressed. I'm bipolar and go through long phases of depression. I got with my boyfriend 9 months ago and I finally felt happy and content with life but it seems short lived because its only when I'm with him.. I try to focus on myself on days im not with him but its just like before we got together I cant seem to do anything I used to love to do.. He says I depend on him to much and he doesnt like it. I felt particularly worse one day and just wanted to see him... I asked and he said that I already saw him yesterday and thats it too much. That really hurt me when I needed the support but he said no and made me feel worse.. Anywayd I just want to find a way to be happy on my own and do things and be more productive..im already on medication.. What more can i do to make myself happy and not depend of my boyfriend who doesnt understand what I'm going through.,08Aug2020,1
92,"So I just started my first week doing online therapy with [betterhelp.com](https://betterhelp.com).  All of the plans include once a week video sessions with your therapist on top of unlimited messaging with your therapist. But I was matched to a therapist who is deaf so she is unable to do the video sessions. She sent me a thing that explains that she will respond once a day and that usually with all the messaging we will do it will end up being about equivalent to a video session in the amount we will cover. 

Overall I like the things she has said so far and she seems really smart. But I am not sure how I feel about not being able to do the video sessions. Especially if I am investing lots of money into this it seems kind of unfair to pay for video sessions+ written messages and only get to do written messages. And she says she can only message a-synchronously not at the same time. So it seems like it will be me messaging her a long message and then once a day she will respond with some comments and questions. It won't be as interactive.

I am debating whether to keep going with her and see how it goes or if I should just outright try to switch to someone else. On the positive side, I do seem to feel more comfortable discussing some things via writing vs face to face so it could have a positives. 

Any advice or input? Has anyone tried therapy through just written messages? Should I switch therapists?",08Aug2020,1
93,I sort of wish there was nobody who cared about me enough so I can off myself without guilt,08Aug2020,1
