,text,time,score,subscribers
0,[deleted],30Jul2017,1,
1,"Smoking weed doesn't increase my appetite anymore. All food makes me want to be sick (and a lot of times I end up throwing it up anyway), so I try and at least fill my stomach up with crackers and green juice. Which is obviously not a great solution. I've lost about 20 pounds in the past few months and I've always been skinny, so this is alarming. Not to mention the weakness and dizzy spells that come along with it. Sometimes I manage one or two small meals a day, but other times I go days without remembering to eat which definitely comes at a physical price (and a monetary one, I got sent home from my serving job today because I looked too weak to work). To be clear: I am NOT anorexic or bulimic. At least not on purpose. I don't want this. I don't want to lose weight. But anxiety makes me throw up and eating does, too, unless I can lie down right after. 

So, please, if you've ever gone through this, I would love any advice you can give. Thank you.",30Jul2017,1,
2,,30Jul2017,0,
3,,30Jul2017,2,
4,[deleted],30Jul2017,1,
5,,30Jul2017,3,
6,[EDIT] is memory loss permanent? Or will I have to remind her about things she use to know? ,30Jul2017,2,
7,"Tell me about your day or your favorite book or how you feel about animal rights.. I'm not in a good place right now and I don't necessarily want to talk about my problems but I don't want to be alone either. I just need some friendly conversation... 

EDIT for rules: Im currently in the US",30Jul2017,1,
8,"So I was dealing with a ton of health things at once and I ended up clogging my ear and cause myself to be potassium deficient in one week, this was extremely stressful because as I tend to be quite the hypochondriac (I am healthy now) I started experiencing some visual perception issues. I was stressing everyday extremely (to the point where i thought I wasn't going to wake up the next day.)  It started off as being hard to read because when I would look at a word, the half the word would tend to shit up and down. I went to the eye doctor and they said it would be more of a perception problem than an eye problem. So now I am curious, what types of things can cause visual perception issues? It's getting hard to read and things seem to get kinda almost washy and wavy (almost like a form of vertigo). Could ear blockage cause it? If its just stress, will this go away with time? I could use some direction and any knowledge I would appreciate.",30Jul2017,1,
9,"Hey, guys...I'm wondering if you could give me some advice. This is kind of long, so I apologize in advance.

I've been in a relationship with my boyfriend going on 4 years now. We both have some mental health issues (I suffer from a lot of trauma-related stuff, he has more general anxiety and depression) and, while he's able to help me when I'm not feeling my best, I've always found it hard to support him and help him in a way that actually works.

A recent example of this is that we both went to a wedding. Before we arrived, my boyfriend had a few ""I'm not really a wedding reception/party person"" comments, I didn't really think anything of them because he's not really too into dancing or drinking and I thought that was why. However, once the reception kicked off, I noticed he was increasingly looking more and more distant as the night went on until he just looked incredibly tired and sad. I tried to pull him aside a few times and check in with him, and he told me that for some reason, he felt anxious. I asked him if he wanted to talk about it and he said that ""there's nothing really to say about it."" I tried asking him if there's anything I could do to help, and he said no.

Further on in the night, he told me he felt like he had been having a few panic attacks, so I offered to walk with him to get away from the crowd and the noise. We did, and he was just dead silent and distant. He tends to really, really pull away when he's anxious, and I can't really do anything to snap him out of it. I try to: I goof around a little, smile, try to talk about other things, but eventually he goes back to being distant. I tried to talk to him about the situation and he became a bit impatient/standoffish, again saying he has nothing to say about it and my attempts at talking to him about things made him feel like I was treating him like a child. 

At this point, the wedding had been going on for around 5 hours, and I had seen my boyfriend pull more and more away. He'd been standoffish a few times earlier, I was sad and frustrated with myself for not being able to substantially help him, and I was hurt that he took my attempts to ground him as a way to infantilize him. I said (and immediately regretted) ""Maybe this is a sign that you should be on medication."" I felt like shit, but a part of me believes that medication will help him feel much better. I know I can't make him choose to take medication, though, so I apologized and didn't bring it up again.

We eventually talked things out on the drive home, but I still feel like I'm no better at being able to help him. He's always able to ground me and make me feel safe and I hate that I can't do it for him. I don't want to coddle him (or make him feel coddled), but I feel incredibly hurt when I see him hurting. I don't want to leave him by himself to have panic attacks while I try to dance and have fun. 

I'm so lost and I feel so heartbroken that I can't help the person I deeply, deeply love. Does anyone have any advice on helping loved ones with anxiety? ",30Jul2017,4,
10,"It happens every year at this time. She starts acting weird and saying things that don't make sense. It's getting worse every year. This year she keeps running away when we try to help her. She's been to countless psych hospitals and she always resists treatment. If you try to talk to her about it she cracks and has another episode. I do not know what to do she will not take medication or seek treatment or even admit that anything is wrong with her. She refuses evaluation, hospitals, medicatoon, and even talking about it. She flew to California and was roaming the streets of LA losing her mind. We are out of options she is a danger to herself but even if we took her to a psych hospital it wouldn't be useful because she would just stop taking the medication as soon as she is out. And I want to emphasise that trying to help her makes her worse. Me and my family do not know what to do anymore",30Jul2017,1,
11,[deleted],30Jul2017,1,
12,,30Jul2017,6,
13,I'm sitting on the floor of my room crying my eyes out and feeling so suicidal. I feel so helpless and don't know what to do. I haven't had such a strong urge to hurt myself and kill myself in a while and I need help and I tried to call my brother but he hung up the phone on me and isn't responding please help me ,30Jul2017,2,
14,,30Jul2017,0,
15,"I'm posting this because of my brother, he is 16 and I am 18 (girl). My brother has some kind of issue with woman i think. He doesn't really like them? He thinks they don't deserve anything and just hates them in general. I read online about the Madonna-whore complex and It PERFECTLY explains him. But I also read that it has something to do with ones mother. Our mom was caring for most of our lives up until 2015 when she left my dad and began seeing her boyfriend. When that started, she would constantly leave us alone, go to work and from there to his house, and sometimes not even come home. She always says how she just wants to run away from us and always tells us shes tired of us. In a way I think my brother hates her for that. Is this misogyny??",30Jul2017,2,
16,,30Jul2017,30,
17,"So it's like 5am and I haven't been able to fall asleep even though I'm so exhausted. And I just feel empty, like really empty, it's hard to describe. And I don't mean to be dramatic but I really just want to feel anything at this point.

I think I'm developing an urge to self-harm and I realize that's not healthy. I don't think I would cut myself I'm too afraid of that but I just feel like repeatedly punching a wall or something. Just to feel the pain.

My depression hasn't been this bad in awhile and I'm not sure what triggered it. And I'm not sure if there are other things on top of the depression I typically deal with that are just making this unbearable right now.

I don't know why I'm posting, I just felt like I needed to say something to somebody even if it's through an online social media site. I guess I just needed to get this feeling and put it into words. ",30Jul2017,5,
18,[deleted],30Jul2017,1,
19,[deleted],30Jul2017,1,
20,"For the past 2 or 3 weeks I just have been sitting at home. I barely go out , feel down , low self esteem  can't seem to enjoy things and activities I used to. Basically depressive Symptoms except I don't think about killing myself or self hurt. 

I did experience the same symptoms with Suicidal ideation before , 
I'm waiting on my Appointment to see a psychiatrist and get full diagnosis as I suspect I might have Bipolar or BPD. 

So can I be having a depressive Episode Even though I'm not suicidal? 

Also another question , sometimes I wake up with headache ( maybe Migraine) in the morning. Can be caused by Depression? 

",30Jul2017,6,
21,"Finally got the courage and decided to go to therapy. And I started researching all the recommendations that I got from my friends and ended up being buried in a mountain of information about all the types of therapy there are out there: CBT, Psychodynamic, Adler, humanistic, integrative, etc.
How did you make a pick? How do you know it's the right kind? What do you look for in a therapist? What would be some red flags?",30Jul2017,0,
22,"I live with my girlfriend and we've been together for a good while now, but I feel that every day I become more and more anxious because I'm going into therapy for anxiety and now I think I might have anger management issues. I feel very anxious because I'm afraid of my future because she also suffers from multiple mental disorders and thus she does not have the capacity to help me as much as she wants to.

I also feel this incredible guilt for having (or even thinking about having) mental health issues; that I somehow worsen her and her mental health (I would like to point out that she does not do this to me, it's me and only me that have this guilt). I'm also afraid of leaving her because of our mental health, because I think she might commit suicide (she've had several suicidal episodes in the past). I feel so much guilt for so many things and it feels like my therapy session (which is in Sept) is light years away. It also feels like I don't deserve help in any way, shape or form; I'm afraid that they'll say there's nothing wrong with me and that I have to live this way for the rest of my life.

I'm also afraid that they won't take me seriously because I'm not good at explaining what I mean and that I think I might be an hypochondriac. I feel like a failure at many places in life because I just can't understand what I want to understand and that tears very much at my mental health.

I say likely anger management issues because when I'm stressed and hear unnecassary sounds (our landlords children running upstairs etc), I can feel my blood boil. Or when someone disagrees with me or is stressed themselves, I feel the need to punch something (though I've never hurt anyone physically, only due to great constraint)

I feel a little lost, life didn't go the way I had planned for so many years and I feel guilt for wanting to study in another city/country (which I could never do because of guilt). I feel guilt just for hanging out with other people, because she is struggling with doing that because of her social anxiety and she seems very sad about it all.

Does anyone have any tips? Thanks",30Jul2017,1,
23,"Hi there,

I'm a 35 y/o male who has experienced being an ""outcast"" and being bullied for most of my life to some degree. It's still happening now in the job I've been at for more than 7 years. I'm working at turning my life around in other ways (addiction, mental health issues, debt, lots of bad habits in how I think, speak act) but this bullying stuff is one major impediment to progress. 

I am hyper sensitive and have very low self esteem. It's so easy for me to undermine myself and talk poorly of myself just as a reflex and this attitude and ""frequency"" is like blood in the water to bullies. Add to this the fact that I am often forgetful and depressed and seem to screw up and make a fool of myself even when I'm trying my hardest and just simply ""doing my best and not being bothered by the bullies"" is insanely difficult because I am giving fuel to the fire. Even good people react to my screw ups in ways that trigger my low self esteem and so I constantly feel wounded, on edge, not good enough, and as a result of my constantly frustrated efforts, very, very angry.

The main point of this post is that I want the bullying at my main job to stop. I can't leave because I'm trying to pay off debt and to leave this job in this economy would be the dumbest thing I could do. I'll only be there another year or so until I'm in a better financial situation, but still need to put up with the a**holes there in the meantime. 

I try to focus on my goals as much as possible when the bullying gets me down. I try to stand up for myself whenever possible as well. I've actually ""bared my teeth"" (figuratively speaking of course!) and gotten ""them"" off my back at times. But the thing is, my default state is kinda bumbling, people pleasing, timid, and loose lipped. I tend to get nervous around the bully types and lose control of my tongue and say stupid things. I know that this is no excuse and I'm trying to force myself to create a habit of always being mindful of what I say, and I would say I'm making some progress, but it's a tough nut to crack. 

The bullying comes from a few main people, one of whom is above me in terms of their authority and position, but the other two are in the same role as me. Their are a couple more but they are more like ""flying monkeys"" and don't bother me as much. 
But some of the bullying has given me PTSD symptoms. Whenever I think about the abuse, about specific incidents, my heart rate is jacked up, I get viciously angry and scared, and thoughts of how defective and weak and weird I am fill my head and a sense of hopelessness overcomes me about the world and my ability to thrive in it. It's insane how I can let a couple people who I have no respect for and who I know are really just sad, scared, ignorant d-bags affect me so much. I've been ""sick of it"" for years but never took action for some reason. But I've had enough. I'm uprooting the weeds in my life and this is one of them.

I recently told my direct supervisor about this because he is a good man and is good to me. He sounded very supportive and offered to talk to them each individually to make sure it stops.

I was hesitant to go this route because of the reaction it might provoke in the aggressors and because I figured that they would just continue their tactics but be more covert about it than usual. Also I've been hesitant because I don't want to rock the boat since I already feel like a burden for having utilized my companies support for addiction treatment and counselling twice.
Also, I have been hesitant to create this conflict because it means that I have to be 100% aware of how I comport myself around them at all times. No more thoughtless, self sabotaging ""nice guy"" reactions when I see them (even though they've hurt me deeply and I hate them, when I see them I revert back to my submissive, people pleasing role and act friendly to them, which usually gives them some kind of ammo.). I've really been working at being mindful of my reactions to them so that I don't give them ammo and so they know we are not friends, but it's so exhausting and difficult to always have to be ""on guard"" like this.

Luckily I don't have to see them for very long each day, and not even necessarily every day (except one who I see briefly almost every day).

Anyway, I am sick of being retraumatized by my own thoughts when I'm not at work, I'm sick of feeling unsafe and unwelcome at my job, I'm sick of giving up my power to people who are too stupid, too sick, too pathetic to see that they are really just jealous of me and uncomfortable with the thoughts and feelings that I inspire in them. They really are pathetic, sad little humans and it drives me nuts to think I validate their childish bullshit behavior. 

What should I do? I'm not willing to sacrifice my mental health any longer.",30Jul2017,5,
24,,30Jul2017,19,
25,,30Jul2017,0,
26,,30Jul2017,1,
27,[deleted],30Jul2017,1,
28,[deleted],30Jul2017,1,
29,"Basically, I'm looking for your opinions on how a good social worker helped you in the past and what are the most do and don't do during an intervention that had helped you (or not) a lot.

Basically, my crisis deals with depression, anxiety, suicidal thoughts, etc.",30Jul2017,4,
30,,30Jul2017,1,
31,[deleted],30Jul2017,1,
32,,30Jul2017,0,
