,text,time,score,subscribers
33,"So just a little bit of background info. I have severe trauma because I was sexually abused/molested hundreds of times from early childhood to my sophomore year of high school. The vast majority of it occurred during 7-9th grade. 
I have abusive parents but it's not something I can get out of. Most of the abuse is emotional and any sort of physical abuse is rare, mild, and would be something that CPS would 100% gloss over. However, there is a fair deal of neglect. My family also enabled my sexual abuse to occur and refuses to allow me to report it which means that there are several sexual predators that are my age wandering around my town taking advantage of other girls. And I have 100% confirmation that they have sexually abused other girls. I've talked to several other victims. 
I regularly interact with the people who hurt me. Trust me, I wish this was as simple as reporting the sexual perpetrators and my parents but it is not. I've looked into it and I wish I could. 
Countless other issues have spawned out of this. So bad to the point where I am unable to recount even the least of it so I won't even try because it would be as long as a novel. Just know that it is terrifying to live the life I do. 
I don't have access to therapy, but after doing research, i can safely say that I AT THE VERY LEAST demonstrate symptoms (I'm not saying I have these disorders but my god if I don't at least have a few of them I would be shocked) of people with borderline personality disorder, ptsd, depression, panic disorder, paranoia, binge eating disorder. 
Ever since I found out that suicide and self harm existed in middle school, I wanted to take part in both of those behaviors. I didn't know why back then though. 
It wasn't until my sophomore year when I realized that I was being abused in and outside of the home.
I somehow survived high school and graduated this June, thank god. I am strong. I am a fighter. 
I turn 18 in October and I leave for college this August. I don't know if I want to go to college but it's a long story and I don't really have a choice. Trust me, I've explored alternative options but at the very least I'll be away from this town full of psychopaths and manipulators. But for now, I'm still here. And don't get me wrong, I have a few friends that care. Not every single person is evil in this town, but there's enough in my close social circle that it's overbearing and terrifying. As of last year, I found people who care for me and ever since then I am rich in companionship. But that can't fix everything. 
I haven't told anyone that after years of resisting the urge to self harm, I succumbed. I mean there's one friend that knows I get urges but I don't count that because she doesn't know how bad it actually is. 
Strangely, my life is the best it's ever been but for some reason my will power ran out and now, lashing out on myself is addicting, especially when I have no control over a situation. 
What I want to do is pull my hair out, bang my head against the wall really hard so it causes brain damage, and scratch my arms. Thankfully, I've stopped pulling my hair and banging my head. I know that scratching up your arms and legs is still horrible, but it is mild compared to other types of self harm. I have only broken skin twice, the most recent having been a few weeks ago and I think I'll have that scar for the rest of my life. And honestly, as horrible as this is to say, if scratching up my arms prevents me from banging my head and damaging my brain forever, I rather this option. That's not to say I'm settling for this, but it is saying it's much safer than banging my head and won't cause permanent damage. When I want to self harm, I lose control. I want to self harm and kill myself multiple times a day, nearly every day. Sometimes it doesn't go away for the entire day and it's almost all I think about. 
2 days ago, while hanging out with a new friend who is easily one of the most caring and considerate people I've ever had in my life, I had a sudden mood swing (ones that are like the one I have are common amongst people with borderline personality disorder) in mid conversation. Because he's so amazing, he brought me joy and laughter just by being himself 30 minutes after the depression hit.  He's an absolutely remarkable human being and I don't think anyone has ever been able to demonstrate this level of understanding and compassion in such a short time, or ever really. We have only been friends for two weeks and already he's changed me. I mentioned that I felt weird and he asked why with concern in his voice, but I wouldn't tell him the specifics. He doesn't know about my history with trauma and abuse yet. I'm not ready to tell him. He knows I have had a hard time and get scared and paranoid and anxious very often, but that's it. If he did know, he would not look at me different and he would actually know just what to say. He would not run away because he cares and I cannot stress how thankful I am to have someone like him in my life as well as other amazing people as well. But I'm not ready to talk to him about this. He respects my decision to be vague, which is wonderful. Anyway, this isn't about him, I digress. I'm just very thankful to have the life that I do.  
I've never told anybody about my self harm problem because it's likely that a well-intentioned friend will report it because they would fail to understand that if my family finds out about how horrible my mental state truly is, everything will get worse. As much as I have love for this friend of mine and my other friends, I'm not ready to tell him. And ever since that sudden mood change 2 days ago, i have had the urge to hurt and kill myself almost nonstop. The depression I'm feeling is unreal. I am struggling to combat this pain and though I have good friends, few of them live near me and most are unavailable. Ive looked it up, and severe depressive mood swings like this are very common in people with borderline personality disorder, and they last anywhere from a few minutes to a few days. I'm on day 3 of it now. 
I have resisted the urge to self harm all but one time aside from today. My parents were being horrible immediately after I woke up and I failed to resist the urge twice. And after I hurt myself both times, I didn't lose the urge to do it again and feel sad apologetic towards myself like I usually do. Usually, I cry a little bit and kiss the place I hurt and show myself love the best that I can. 
Instead, I just wanted to keep going. Since then, I went to an event with family friends who are also bad people. I mean, they are friends with my parents, so...
I am there currently and I have resisted the urge to hurt myself countless times but I've also given in about several times, not sure how many since I've lost count. It's not bad , my legs and arms are just a bit scratched up and sting but it is terrifying. I want to stop. I am doing my best to actively combat this problem but I'm struggling and I worry that I'm losing. I'm also emotionally eating and I'm finding it nearly impossible to stop doing it today and the last few days. My stomach feels bad but I'm still holding myself back from shoveling more potato chips in my mouth. 
Don't get me wrong, I'm going to make it through this dark period of my life. For crying out loud, the worst is over. I don't get physically and sexually assaulted on the regular and I somehow made it through high school without killing myself or getting killed. I am a lot better with binging than I've ever been and I'm 25 pounds down from my heaviest weight with the weight of the muscle I've gained added on in that time. Sometimes I go days without wanting to hurt or kill myself, and it feels like a dream. One time a while back, I went a whole 2 months. I want to get back to that point again. Or at least to the point where half of my day is not infested with me doing everything I can to prevent myself from ending my own life. 
I have the opportunity to pursue my passions so much more than I used to and because of this there are a few times a week where I do what I love and I forget about all of the pain and suffering for 1-2 hours. I have a job so I'm making money, albeit I'm making next to nothing but at least it's something. And Jesus fuck, I am performing at Madison square garden with some of my best friends in a few weeks. I'm so lucky!
If I survive this, a few years from now, I have big opportunities waiting for me that I don't want to delve into, maybe even bigger than the performance I have coming up at Madison square garden, and god knows how many more will pop up during the four years I'm away at college. I will never kill myself, no matter how much I want to. I've resisted the urge so many times where I had so much more of a reason to end my life than I do now. But that does not discount the fact that even though comparatively, life is good, my existence is still infested with pain and agony. 
I've experienced the highest highs and the lowest lows. One day I'm going to somehow get my life story out there, but in this moment, im still in the middle of it. 
This very second, I am trying to stop hurting myself and it's not working. I wish it would, but it's not. The only thing that has distracted me is taking the time to write this out. And it's actually helped a lot. 
Some friendly encouragement and advice would be appreciated. Even if it's just ""I believe in you!"" I'm not expecting you to completely fix everything through a comment. I just need some help tiding myself over until life gets more bearable. 
Maybe it will help me through the day, week, month, year, or even just the moment. 
Much love, and thank you for hearing my story. 
Edit: I just finished writing this post and it's kind of funny because one of the family's friends just walked in the room and began to rant to me about how selfish and cowardly people who kill themselves are. She doesn't know about my situation, but it's just a funny coincidence. Don't worry, it didn't hurt my feelings. I have a good sense of humor about this stuff. It's just funny because she has no idea who she is talking to. It weirdly cheered me up a bit. ",30Jul2017,1,
34,,30Jul2017,3,
35,It's like I'm just lying to myself. I don't think I'm ever going to change. It always comes back and it feels ten times worse and erases any false progress I've made.  ,30Jul2017,1,
36,"This is urgent. I have a trans friend who is disabled mentally, and cannot get on assistance by himself. I have done everything I can to help him. He is 19. His parents have kicked him out and are abusive; he doesn't have transportation and neither do I. There are no buses today. The people he was staying with drugged him and he ended up having to go back with his parents momentarily. He has told me just now he thinks he's going to kill himself. He has a history of suicidal thoughts and cutting. His parents are threatening to throw him out and obviously he can't go back to the people who drugged him. He has a dog over there too and I don't even know if she's alright. Anyway- I don't think he has insurance and he says if he goes back to the hospital he will be on the streets immediately after. He was very rude while messaging me today which tells me something is seriously up. I need to call the police, i think. I don't know what they will do in this situation or if he will hate me afterwards, but I do believe it to be a necessity. Please tell me what i should do; I'm at my wit's end here

http://imgur.com/a/7HZdZ edit: READ FROM THE BOTTOM UP. I DONT HAVE TIME TO EDIT THE ALBUM.  screenshot of the messages. He isn't usually like this. I didn't send that last message. I may come off as cold and uncaring but I'm trying to be logical and I dont know what to do. I don't even know his address from the top of my head so if i call the police where do I send them?",30Jul2017,4,
37,,30Jul2017,28,
38,"EDIT: Should probably add I'm in the UK.

I started (and ended) CBT some months ago. I was only allotted a block of 3 hours in total, split into 30 minute sessions.
I don't think either of these limits were helpful, as they added pressure and anxiety to the whole situation.

The therapist did a lot to let me take the lead and decide on my own treatment, and while I appreciated that, I was only there because I didn't know what to do. While I don't think he should have just dragged me where he thought was best, I would have appreciated a guiding hand (or at least a couple of fingers).

In particular, when asked to define what I considered to be my main problem, I simply spewed out every issue I could think of.
Depression, anxiety, insecurity, social ineptitude, low self-esteem and probably several things more. I didn't know, nor did I receive any indication, if this was a an appropriate problem-scope for only 3 hours of therapy. In hindsight, I can say with confidence that it was too much and too broad, and could well have been better had I been more specific.

In general, in fact, I found myself rambling a lot, I tried to make notes to help me but it was difficult to plan what to talk about before sessions.

The therapist gave me exercises to do, mostly written exercises and recording my thoughts and behaviours. I think a lot of these were good and some of them really helped (others didn't more on that shortly). What I thought less of was the stream of published self-help material that came my way. I tried that sort of thing before coming to therapy and it didn't do much, I got a therapist because I felt that doing things by myself wasn't helping.

The plurality (possibly even majority) of the 3 hours was given over to anxiety, and I saw a reasonable improvement in that area.
It was the anxiety related exercises that worked the best because we had time to practise them together and iterate (analyse my work and point out ways to improve in subsequent sessions). I think having more 1-1 time in general would have helped.

Being honest, though, I feel I could have tried harder with the exercises that we didn't have time to go through together (mostly focused on depression, low self-esteem and other delightful members of that family). I felt a little out of my depth, but I could have kept them up for longer even without feedback. I feel it is likely that I went to therapy for someone to talk to, rather than the exercises.

I feel I've focused a lot on the negative here, so I should also say that I feel it was helpful overall, especially with anxiety and that I do not regret going. I want to know, though, if these are typical experiences and if I can find better ones... or at least, a paradigm that suits me better.

Thanks if you got this far :)

TLDR: Went to CBT, felt there wasn't enough time and that I didn't get enough done. Also felt that there wasn't enough of a 1-1 process.",30Jul2017,3,
39,"I have been struggling with mental health for countless years, this is me wanting to reach out to others and show them that they are not alone. I may not be an expert in mental health, but do not be scared to reach out and have a talk with me I will always be here to talk. I have created a blog for others to read about my struggle, and would love others stories and issues. I would love to build a community where everyone feels open to talk. Check it out and leave your thoughts https://freethought33.wordpress.com/.",30Jul2017,10,
40,"I need help. I need to find a family therapist, but my family's situation is very specific. Are there any search tools I can use to find therapists in my area based on certain specific criteria? Also, will we actually have to pay for a first session to get a sense of what each therapist is like, or is it possible to ask them a few questions (via email or over the phone) as a sort of vetting process beforehand? Like I said, I have a very specific type of clinician in mind that we need. ",30Jul2017,3,
41,,30Jul2017,6,
42,"I posted something similar on r/sociopath (even phrased it as a discussion rather than advice post) but it got deleted.

I believe my ex is a sociopath. Yesterday he threatened me and then I threatened him back and he got very bad. He is now threatening the wellbeing of me and my family (primarily in the form of revenge porn, he believes it will ruin my life and disgrace them). 

My question is, do sociopaths usually follow up on their threats or is he just trying to scare me so I'll fuck off?

I'm reluctant to get authorities involved because I think any contact or intervention would just aggravate him more. ",30Jul2017,2,
43,"I'm really struggling lately. I can't tell if the voice in my head is just my self-talk or if it is ""voices"". It just gets really distracting and I can't focus on anything and it's exhausting. I feel like I have to constantly argue with it in my head. ""No, I'm not a terrible person,"" ""no, I don't suck at my job"" ""no, I don't actually wanna bash my head against a wall"" and on and on and on. It's relentless and I don't feel like I am in control of it any more.",30Jul2017,3,
44,My girlfriend forgot everything about me and our past after she hit the left side of her head last night. Does anyone know if this will be permanent? ,30Jul2017,12,
45,"I have been living in a small house with my mom,dad,little brother. I am a 15 year old boy. Throughout our time living here me and my family have been noticing strange things. Our neighbors have been freaking us out to put it softly. The woman and man next door both live together it looks like but somethings off. Whenever their garage is open and the man is there all he does is stare and never says hi or anything. Meanwhile the woman has shown more ""aggresive signs"". The woman never says hi or anything as well. She just stares . Me and my little went to her house for halloween and she seemed fine. But she sometimes blasts her music at night for hours and its the same song over and over again. And just today I thought id ask for help. My parents came home from the grocery store and the lady came out from here garage and started recording my parents and their car. My parents would say ""hello"", ""hi"", ""what are you doing"" and she didnt respond. She went around the car and just recorded a video without saying anything and and then ran inside. I really need help and dont now what subreddit to put this on. This is freaking my family out and we fear that it may get worse. Please and thank you.",30Jul2017,1,
46,[deleted],30Jul2017,1,
47,,30Jul2017,3,
48,,30Jul2017,2,
49,,30Jul2017,1,
50,"(Trigger warning for sexual abuse) 
Hello all, so bear with me here

About 6 months ago I had a sexual innaporporiate intrusive thought involving my younger brother. I went into a panic and started obbsessing over it trying to remeber what really happened. 
A few days later I finally told my bf and stsrted sobbing/panicking again. I smoked some weed hoping it would help (now I realize it probably mad it worse) 

Now on the daily I think everything has to do with me touching or molesting my younger brother. Anything he does or says i find a way to relate. 

I feel conviced its part of some repressed memory, and that he may have some repressed memories too of it.  

Hes had issues going to the bathroom/soiling himself for a long time now and Im horrified its my fault. Although hes alwaus trying to hang out with me/os affectionate. 

My bf says theres no way I would of done anything bad or stupid like that when I was younger but I just dont know. 

Is this a delusion?? I also get anxious/paranoid that people are looking at me and it causes me to feeze up. 

Is this anxiety, delusions, could I really have done something innaporporiate  (it often feels like I did even though I have no clear memory) ",30Jul2017,2,
