,text,time,score
0,"[https://www.youtube.com/watch?v=9X\_o\_BAUJ-c](https://www.youtube.com/watch?v=9X_o_BAUJ-c) Just thought I'd share a song that has helped me through some tough times, in the hopes that it will help someone else.",20Mar2019,1
1,"Hey guys, so this post is me mainly looking for some words of encouragement. I’ve rescheduled this appointment like 3 times because I’ve been so nervous about it, but tomorrow is the day I just suck it up and go in to talk to a doctor about the option of starting depression meds. 

I’m excited to take this step for myself, but I guess I’m just nervous about talking to someone outside of my therapist about my depression. I’m worried I’ll be judged or they won’t believe me. I’d like to believe the inherent good in everyone but this just makes me feel really vulnerable. I’d really appreciate any support or encouragement! ",20Mar2019,6
2,"I’m a sophomore in college and I just got dumped on Valentine’s Day. Not kidding. She said she needs to focus on school which I understand but I feel lost without her. We dated for almost a year and I literally never had a negative experience with her. Ever. It was literally perfect and now I feel like everything is crashing down on me again. I guess I didn’t realize how fragile my happiness was until the source of most of it was taken away. I know time heals breakups but this isn’t even about that. I can feel the darkness in my head creeping back in and I’m starting to revert back to old habits and moods. 

I guess I’m just asking how to stay ahead of the wave and use myself for happiness instead of relying on the love of others. ",20Mar2019,17
3,Please help me Vaun? Please...? I want to ask you but I can’t. I never can. I come so close like typing messages like these and I can never send them. I can never tell anyone. It’s like no one feels the pressure of being squeezed by two walls (depression and anxiety) like I do. And they can’t hear me. They see me screaming but they don’t care or maybe my smile is so good that they really can’t see me screaming. I’m scared Vaun. Please.... see me screaming. Please see me drowning. Please... see me..... I’m not okay. I’m not me. I’m not the happy girl you met. I’m the way I should’ve been while I was being beaten. Why now depression? Why strike me AFTER the trauma is over? I don’t know!!! But it makes me not like myself.... I hate myself. I want to be happy. I want to be loved and actually feel it. But I can’t feel anything Vaun. I just wanna kill myself. Please help me Vaun. Hold me all night every night.... please help me...,20Mar2019,1
4,"I'm not gonna lie, the last two years have been the worst of my life, Im so lost. I don't want my parents to worry about me. I make jokes about my insecurities and I act like they don't bother me, but in reality they cut deep. I want to talk to my friends but they might not think much of it because I've hidden it with jokes for so long. I just want somewhere to vent all my frustration. ",20Mar2019,1
5,"I'm not gonna lie, these last two years have been my worst. I don't want to talk to my parents about it because I don't want them to worry. Ive tried to hide it from my friends by making jokes about my insecurities and my low self esteem. I want to talk to them about it but they might not take it seriously because I've joked so much about it. I just want someone to vent all my frustration to and someone who can be there to talk to me when I need them but I'm to scared to say anything about it because I don't want people to feel bad or worry about me. ",20Mar2019,11
6,"Hello everyone! These past few days have been really tough for me because my gf hides a lot of her feelings from me, and it’s getting worse. I tried to provide a safe environment to talk about them many times but after she does tell them, she feels a little happy, but the anxiety is a lot worse. This was caused because of her ex in the past, and we’ve been working together to help for over 6 months. She’s definitely been getting better, but I can’t help with this because she just lies, and when I try to tell her, she shuts me down worrying it will hurt me. And I just don’t know what to do. She refuses therapy because of past situations, and I don’t know how to approach this. Any help and experiences are greatly appreciated. I just don’t want this to start affecting my levels of anxiety when she hides things from me...",20Mar2019,1
7,"I am not diagnosed with depression, despite seeing a psychiatrist. So there's that.  


But every day, I wake up, struggle to go to work, and when I come home, I go to bed as early as possible. On days off or on vacations, sometimes I just don't leave the house at all. Sometimes I don't leave my bed.   


Today is my 6th day of staying home, alone, mainly in bed. I don't feel sad. Not at all. I don't feel happy either. I don't feel anything except occasionally rage.   


When I do make myself go out, when I am in this headspace (as it comes and goes), it feels like a chore, and I can't wait to come home again. At home, I do repetitive tasks because my focus is horrible; I read online. I answer work email. I make excel spreadsheets about random things. I do deep research into things of nominal interest to me.   


When I wake up when I'm not working, all I can think about is ""When can I fall asleep again? What do I do to fill this day?""  


I feel slowed down AND unconcerned/apathetic. I don't care what I eat so I just eat anything around, and not much of it. I can't always sleep, so I lie in bed with my eyes shut. Talking to anyone annoys the Hell out of me. Driving the car, being out, doing errands, taking a shower, cleaning the house, they feel stupid and irritating and pointless. Seeing friends feels utterly horrible as I have nothing at all to say and am usually an entertaining person.   


There are next to no psychiatrists where I live. I am lucky to have one who runs the hospital here, seems like an alright person. I asked him if I could try an antidepressant. He said only if I went to therapy as well, which would cost $1,200 a month, so no thanks. I have panic disorder but it's under control right now, for a long time, decades.

&amp;#x200B;

I'm not suicidal, but I wish I would just die. At the same time, I am afraid of dying and ruminate about it all the time.   


I don't care about anything. I was speaking to my mother (who lives 3,500 miles away) on the phone, and she said, ""Happiness is a choice."" I hung up on her and turned the ringer off so I didn't have to listen to her blather on about some happy horseshit that I don't identify with.  


I am female, in my mid-40's, gainfully employed as a Professor, a world's expert in my field, in fact, and yet right now, I can't focus on Soul Caliber IV or a stupid comedy or the dishes or taking a shower or reading a book, and it just comes and goes like this. I have zero social support network and in the past, when things have gotten bad, I've lost so much weight from not eating that I've had to be hospitalized (I'm not anorexic; I was malnourished). It's happening again. And really hard and long this time. I feel confused and lost and without any help at all. There is no one to turn to for support. Even my therapist/psychiatrist annoys me to talk with. I just want a pill, any pill, or some treatment, to fix this, which has been diagnosed as ""anhedonia."" It feels like that, but worse.",20Mar2019,64
8,"I woke to a thud, the thud of my house shaking beneath me like something had smashed into it something hard, heavy. Adrenaline already in my veins, my body shook uncontrollably mostly my hips side to side, like a charmer’s snake dancing to his flute. I peaked through the curtains to see what it was, it wasn’t long before I saw the red break lights of a car. Its inside my house, I mean the front of it not fully. I peak at more an angle to get a better view, it’s our car? Why is our car in our house? I lie there staring with a patient I’ve never seen in my self like I was content but fearful all at the same time. I opened the window and fly screen and stuck my head out in the shadows.

God, I hope it was mum in that car if it was dad, I know what mood he would be in. The car starts to reverse, screeching louder then the regular gunshots around here, schools going to know about this. The car loosens from the grip of the metal and flies out backwards skidding a little in the autumn leaves, I could see his face the same drunken face that I see every night. he doesn’t notice that I’m watching him, he looked down in confusion fuddling around, maybe looking for something. The sliding door swings open shaking house making me jump again. It was my mum in tears, confused I’m not sure whether she was crying because of the house or because she knows what’s going to happen. He looks up locking his head towards her like he found what he was looking for my Mum.

Usually I only hear yelling and sometimes screaming but I avoid seeing it start, my Mums’ tone from firm to begging when she realizes that it was only going to make things worse. I feel powerless and I can’t call the 000, Mum told me not to I don’t want to disappoint her. Voices are raising I can see it coming. I stalk the conversation hoping it resolves itself but most of the time she isn’t so lucky.

He paces his way to her, reaching past her arms to her hair, pulling her with it like a leash toward the car almost dragging her, her squeals echo through the paddock waking everyone in the house I can hear my younger sisters whispering, and moping dads name even they get the picture at there age.

I watch in hatred thinking of all the ways I can hurt him, all the ways he can suffer, it isn’t my first time. My rampaged thoughts were quickly interrupted, he punched her closed fist flat in the nose. It looked hard real hard, I’ve seen some of their fight but never that hard. She fell onto her face blowing dust and spit on the dirt, I can’t look I can’t bear it, I thought of grabbing the rifle but I was frozen, I wanted to kill him so bad. I clenched my teeth ignoring the sound of scraping in my head.  I’m useless",20Mar2019,2
9,"Idk if i should put a trigger warning on this, and tbh I'm not really sure how too. So uh....

!TRIGGER WARNING! 

If you struggles with eating disorders and suicidal ideation, uhm, this might be hard to read. Uhm. Idk if that's good or not. If not I'm sorry. Truth be told if i don't get this off my chest now im afraid of what I'll do
 
I cried so hard i threw up tonight. TBH it felt good. In a scary way. Due to depression and mental and emotional abuse, a few years ago I was severely malnourished. My hair was falling out. I had growths on the back of my tongue. My nails flaked a part. I stopped eating almost completely. 

I'm now clinically obese. Not excessively so, but jumping from 130 to 230 in 3 months was a fucking wild ride. I dont want to go back to that place. Im gonna talk to my therapist about it in a few days, but I couldn't hold it in anymore. 

I'm scared. Im scared of what I'll do to feel better, to hate myself less. 

I'm also afraid of what I'll do if i don't stop hating myself. 

I'm caught up in this cycle of oh itll get better, then it doesnt. And i spiral again. 

Please don't come back with comments like, ""get a gym member ship"" etc. I tried. It didnt work because I don't have the energy all the time, and then I beat myself up even more for not going. Im ending that cycle of self abuse before it can continue. 

I just dont know what to do anymore. ",20Mar2019,7
10,"I've been struggling with depression for a couple years now and in general have been doing well. I have a therapist and am taking medicine. However, this last month (and especially this week) has just been really rough for me. 

Granted, there is a lot going on. I just moved to a new country with my boyfriend for my new job. My boyfriend, through a slightly unfortunate series of events, realizes he is polyamorous. That's not a deal breaker for me, but it will take some time and effort for us to figure out what will work for both of us. I haven't been focusing on making friends so far, so I've been getting lonely and I don't have a support structure here. I'm feeling lost and unsure of what I want for my future.

I'm noticing this week that my confidence is shot. I'm doubting everything I do or say. Everyone has a better way to do the things I've done. I keep wanting to just stay in bed or disappear for a little bit and not have to worry about anything so I can come back refreshed. 

Luckily I'm still going to work, getting things done, making sure I eat even with no appetite, and spending time with people (co-workers or events). 

At this point I just feel drained even after taking some weekend days just to focus on myself. I know this isn't the worst I've been and maybe things aren't so bad but I just feel awful and I don't know what would help right now.",20Mar2019,1
11,"Hello. I have this problem from a long time. I stutter a lot and even can't pronounce words right that most people doesn't even understand what I'm saying which makes me worried about myself.
 
I know that talking is very important to communicate but I still struggle with talking with people. 

Some advice will be appreciated.",20Mar2019,1
12,"I recently found out my 32 year old brother was diagnosed with depression and anxiety. I found this out because his girlfriend of 15 years told me and my younger brother she’s thinking of breaking up with him and has been for years. We’ve never been that close but we’re closer to him than anyone else in his life. he’s so isolated socially (he has no friends) and geographically (he doesn’t live close to anyone in our family)— i don’t know how to help or what to do. I feel so powerless. I’ve had a bunch of mental health treatment myself, i don’t understand why he didn’t tell me about it. ",20Mar2019,1
13,,20Mar2019,1
14,"I have probably an generalized anxiety disorder and in everything what I do I only feel sadness, anger, disappointment and pointlessness. I honestly don't know what to do I feel like that every day and every minute. I just can't take it anymore!!!! What should I do!!!!!!!!!!!! ",20Mar2019,2
15,"I've been on a few meds but not an SSRI until this week (I start on Friday, had to flush my system out of all the other meds as taking Celexa with them caused mild serotonin syndrome). My most pressing issues are all OCD-type although my main suspected dx is depression--lack of motivation, compulsive spending and eating.

Do meds help? Will I actually be able to stick to a budget and eat decently/not buy vending machine food? I feel pretty hopeless about it all.",20Mar2019,1
16,I’ve been crying out fir help fir so long don’t think I have much fight left in me every day becomes harder and harder to deal every night I want to cut drink until I pass out and just self destruct I know it will help to get out more but literally no one wants to spend any time with me no one talks to me and all my texts are ignored there I’m a failure at everything Abs I hate everything about myself I’ve been putting straight up suicide posts fir months and they are always ignored can’t go to actual professionals cause I refuse to go on the adult ward i was abused enough in adolescents ward I just need to be with a friend I’m so lonely but who would ever want to spend time with me? I guess I’ll just keep fading away and cutting and drinking myself to oblivion ,20Mar2019,6
17,"So I had my first Dr's appointment to address my increasing anxiety and depression yesterday, and found some things a bit...odd. I'd like some feedback on a few things (just need to know whether some of the stuff I'm about to post is common, or not)

&amp;#x200B;

1.) A lot of the stuff was ""up to me"" and I was given questions I had no idea how to prepare for or answer. I went into this with a ""I have no idea what the hell is going on in my head, but it's bad, and I need to address it"" mentality. I have no idea why I'm depressed or anxious so much, only that I did NOT used to be like this.

*-  ""Do you think your Anxiety is caused by your Depression, or your Depression is caused by your Anxiety?""* 

*The answer? I honestly have no idea, I'm coming in with my own mind being a total mystery to me. I didn't know it had to be either one of these.*

*- I was asked what ""kind"" of medication I think I should be on (given a choice between Wellbutrin or another unnamed medication that attacks both Anxiety and Depression together)* 

*- I had no idea how to answer this either, I don't know. When I made this decision I was only 30 minutes into discussing this with a medical professional for the first time in my life, I have absolutely no clue.* 

&amp;#x200B;

2.) After this short 45-minute single appointment with a Psychiatrist, I walked out with prescriptions for Wellbutrin XL and Vistaril. I haven't taken either yet, because I'm not sure that's right for me. I just feel like 45-minutes wasn't even close to enough time for me to ""explain me"" and give enough information that a Doctor could make a decision on the right medication for me. And I **know** that antidepressants and medications of this sort are a total crapshoot, but even given that, I don't feel confident that I'd even be taking a **good** crapshoot from a single 45-minute appointment with a brand new doctor.

*- Is that notion true? Are antidepressants and medications like this still a total crapshoot? Can't doctors to prior testing to figure out how a particular medication will affect an individual? It just feels odd...coming from a world I'd previous known (getting diagnosed and treated for migranes) where everything was ""testing testing testing! MRI and Cat Scans and Blood tests and this and that!!!"" before being able to figure out something that works for migraines. But now with my mental health it's just ""idk, we'll throw this against the wall and see if it sticks."" Makes me incredibly uncomfortable.* 

&amp;#x200B;

3.) When taking my first steps to address my issues a few weeks ago (and making this appointment with a psychiatrist), I had **absolutely no idea** what kind of doctor I'm supposed to see, what is recommended, or who even ""diagnoses you"" with depression or anxiety. I don't want to self-diagnose, it just doesn't feel right. (After this appointment I still didn't feel like I was ""formally diagnosed"", just given medication).

*So I chose this Psychiatrists office because they had decent reviews of any I could find. I made an appointment before I understood that the ""Psychiatrist"" is the one that mainly focuses on drugs and medication, NOT therapy.*

*- Does ""formal diagnosis"" happen? What kind of doctor does that? Or is that a totally false preconceived notion I have.*

*- What kind of doctor is it most common to see first? A psychologist, CBT, psychiatrist, therapist? I just don't know all the terminology.* 

&amp;#x200B;

The path I've currently chosen: I've not taken my medication (not started), cancelled appointments with this psychiatrist, and gotten an appointment for CBT with a therapist first, which feels like a ""safer"" path for me.  As much as I want to address my issues NOW (I'm impatient), going straight to medication just didnt feel right...

&amp;#x200B;

I could go on a rant about just how difficult it has been for someone with no prior experience trying to deal with this new situation in American Healthcare, but I won't. I don't know how we're even supposed to know where to start, who to go to, etc etc...",20Mar2019,5
18,,20Mar2019,10
19,"Ive always failed. Whenever i think i do better i just fail. I think im making things better, but apperently im just making things worse. Why keep trying? No ones benefiting from me, not even me. Im tired",20Mar2019,2
20,"I suffer from bouts of depression where I go a long time feeling like any normal person then one day I just wake up and bam, there it is, it can like days, weeks or months and after going so long feeling so much better I'm back at square one, feelings of self harm and suicide run through my mind all the while I feel only anger and apathy at everything, I just want to fucking end this shit my head is my worst enemy but I know it would hurt someone very special to me and that destroys me even more, people at work are starting to ask why I've gone so quiet I don't k ow what to do, I don't like the meds they make me feel worse in different ways, panic attacks too and I feel like the whole world is watching me with a scope ready to fuck me over for fun. ",20Mar2019,1
21,,20Mar2019,59
22,,20Mar2019,1
23,[removed],20Mar2019,1
24,,20Mar2019,2
25,[removed],20Mar2019,1
26,"I feel like my depression will never get any better. I can't get out of bed, yet I feel guilty for not working. I've barely eaten - the idea of food makes me feel ill - but I feel bad for not eating. I'm failing my exams and have no long-term goals, because even as an ""adult"" at 19 I don't know what I want to do with my life. I've spent most of the last couple of days staring at the ceiling feeling terrible in every way.

I don't enjoy anything anymore. And my parents don't think that my disorder/disability ([Tourette's syndrome](https://tourette.org/about-tourette/overview/what-is-tourette/#1461071540054-f0944fbc-3f2b)) exists, so I get told off regularly for something I physically cannot control.

Thoughts of wanting to self-harm have come back after a few months of not harming, and I just feel like I want to die. Just this morning I was looking through the medications we have at home to see what sort of thing could kill me with an overdose. The flair is ""requesting support"", but I only put that because it needs a flair. Just ignore this, it doesn't matter. ",20Mar2019,12
27,I know that crying can help in a way to feel better but I can't cry honestly maybe just for some seconds but not so much that I can somehow feel better in a way.... ,20Mar2019,9
28,,20Mar2019,3
29,"I have no power to do things. I cry a lot with no reason. I don't know what to do with that, how to repair myself. I don't know why but one year ago all my friends left me and I've been lonely sinse that. I don't know where to find people. ",20Mar2019,0
