,text,time,score
0,"Hi y’all. I went to my psychiatrist today and she pretty much said I needed to do inpatient treatment. I’ve never been treated for depression or anxiety, but I know it’s probably for the best. I had made a plan to kill myself and it’s been very dark lately. I’m still freaked out to actually go in though. I’m dealing with trauma from a sexual assault on top of just so much anxiety a depression. First, work is kind of super busy and I don’t feel comfortable leaving during a time like this, second I have a dog and I’m afraid to tell my roommate the situation. I’m just really scared. For those of you who have checked in how was it? Are these feelings normal?",26Feb2019,1
1,"How do i make myself not feel like shit all the time? How do i fall asleep without not wanting to wake up?
",26Feb2019,7
2,"I'm not looking for help, this isn't going to ruin me, I just really want to share this. For awhile I've always wanted to live in a world were movies, tv shows, and video games were real. I would always get sad when I realize that that will never happen. First it was Pokemon. Then Adventure Time. Also, I always wanted to go back in time and live in the mediaeval times, with knights, dragons, no internet or anything, inventions to be made. Recently I saw How to Train Your Dragon 3, and it was very good, but after the movie. I became really sad, more than ever, because I very much would love to live in a world like that, vikings, dragons, battles. I'm a big animal lover and seeing Hiccup's relationship with Toothless was adorable. But I know I will always live in this gray and boring world. Thanks God, couldn't given us anything cooler? That is what drove me to post this, and this kind of helped. Thanks for listening.",26Feb2019,7
3,"I was in high school as a younger boy. She was an older girl. She inserted herself into my life slowly like laughing at my jokes butting into conversations responding to stuff to talk to me or laughing. Asking me to repeat stuff to her then wait for me after class to scare me after we talk. I met her because she laughed long and hard at a bad joke I made then asked me to repeat it to her then after I talked to her waited after class for me to pop out say boo.She began finding any way to talk to me. While talking got red made no eye contact and smiled while hiding her face. Blushed around me. We’d joke around and tease each other a game between us. Her friends acted funny. Her friend pushed me to her. Her friend would ask me to be around them and find any excuse for me to, when her friend sat between us and talked to me and flirted with me she didn't seem to happy had an attitude. She wanted to be next to me and didn't want her friend between us in pictures. We started taking selfies and she'd want me to get close to her for all. She sent me the picture so I could post she would like it then tell me in person. She would approach me with her friend and her friend would just push me to her, if I ignored them or walked away they would follow me and just continue trying to talk to me. She got dressed up and her friend came and got me for a selfie with her. She found any way to talk to me and compliment me. Hover around me and try to talk to me, approaching me with her friends help.When I was minding my own business she would giggle say my name. Do it when I looked at her. Blush when I say hi. She liked a picture with my dad tagged in it to then tell me she likes it, so she can show up on both our notifications. While talking held never ending eye contact and smiled not stopping in silence. I'd break eye contact and she continues standing in front of me staring at me. She found out info about me to tell me. When I talked to her tried to scare me or take a selfie with me. Stare at me every chance. She showered me with so much flattery and attention. But the thing is, she never left me alone. She began butting in intensely when I talk to other people, especially girls and she would just start laughing loudly, butt in respond ask questions. I made a joke about moving out of town and she had some issue with me she stopped talking to me. Her friend told me I hurt her feelings. She continued staring at me and stuff but not anywhere near as happy. Then when I was talking to another guy she started screaming at me out of nowhere and calling me names attacking me. Her best friend would look at her and say her name when I enter a room. The thing is she never stopped, when I ignored her she would continue giggle and say my name when I said something bad. Say my name when I talked about something bad. Continue trying to butt into my conversations. She just never left me alone and didnt stop flirting with me. Say my name like bossing me around when I talk about something bad. I would just talk about height and weight to someone else and she said ""Nobody else is as big as you"". Her Friend would go around finding information about me then tell her and she told me everything she heard. She just never stops flirting and just so aggressive and when I ignore or just don't do anything she continues. Its like she would reward me if I talk to her by flirting with me, waiting for me after class to scare me or selfies and all her compliments.

As I got older and saw her around she went to a place with a clear view staring at me. I saw her at her work and she did that. I went to her work once and she saw me said hi, was in one spot then moved to another that was a clear view she could see me in and I could see her and she stayed there the whole time and stared. Then I saw her in a car. I stared at her not knowing it was her because she was laughing loudly. She looked over at me she held eye contact and stared back at me, when I broke eye contact didn't stop and watched me leave. She did this when my mom was right next to me. I broke eye contact and didn't look back. She didn't like that. Months later her and her mom go back on my fb to remove their likes on a pic dedicated to my dads death. Her mom liked my dad and she obviously talked about me to them because she found out that my dad bought a motorcycle from hers. After that she had an attitude, I worked with her, she stared at me while putting on a jacket and didn't stop when caught and the supervisor said something and she was shocked.

Well now we go to the same college she saw me when shes walking into her class and I was leaving that class she was showing up on time and sat down stared at me when I wasn't looking for a few seconds. Now after seeing me shows up 30 minutes early walks by looking in at me then walks by many times like 4+ times stands in the doorway then waits outside. Nobody does this and everyone else in her class is not there. Everyone else waits in their car between classes. Her friend acts like I don't exist when she sees me around and only went up to talk to me once. Her friend got a boyfriend and he lived right next door to me, she never said hi or anything.

I am just frustrated and upset in general because she never stops flirting with me in general and does it aggressively and when I ignore just persists and then eventually lashes out at me and does bad stuff. Then has some issue over stuff then lashes out at me. She never stops and just perists, she lashes out has an attitude over something stupid and starts up again. I get uncomfortable and ignore, she gets upset, angry and lashes me out. She showered me with so much attention, flattery and compliments. Selfies but I just can't get space or a break and when I get uncomfortable and ignore her or show negative body language/ response she just throws a fit and lashes out doing bad stuff. She acted like a supporting friend and shows support for stuff but then gets mad and take it away lashing out over that stuff. She just feels like a flirty big sister and using that dynamic to her advantage pushing me around and in a way bullying me. I just feel discouraged because I feel like she is the only female friend I really ever had. Her and her friend. Her friend would find any excuse to be around me and offered me a ride when it's unnecessary. She might know I am autistic because she is known for having a short fuse blowing up at people and she doesn't treat me that way and been extra patient wouldn't care if I interrupted her, ask questions on topics I am fixated with, instantly believe stuff I say take my side on stories when she was upset with me. Gets upset with me and then gets over it. I am just heartbroken because she feels like the best female friend i ever had and will never have someone like her again. The best female friend I had but she bossed me around and kind've abused me and has been for years. I have been hurting for years. I want to be friends but the way she acts makes me not want anything to do with her but I do care about her and love her platonically.

TL;DR

I met a girl when I was younger she did stuff that's impossible to ignore to get my attention. She continued this stuff for years and flirts to the point it is uncomfortable and doesn't stop then has an issue when I get mad or uncomfortable and ignore her and she lashes out. She does things that are impossible to ignore and continues this into college. Showing up 30 minutes early to her class when I am in the class before, and walking by a lot and standing in the door, waiting outside. I have not felt comfortable by how she acts and have been ignoring her.

PS: I am autistic but on the high functioning end of the spectrum and not everyone knows",26Feb2019,5
4,"So where to begin. 30/M, healthcare professional, only child, 3.8 GPA student in school, and for at least 10 years I've been taking 5-HTP ever since discovering it ""fixed"" my issues. This is the only form of self-medicating that I do. I usually take 100 mg at night with B-vitamins.

Not sure if this is depression, anxiety, or bipolar, but I get into these mood swings / ruts where I don't really want to do anything except for sit there. Here's one example: My wife and I are discussing where we want to eat dinner, we can't choose and I get into this ""mood"" internally where I just decide I don't want to pick where we are going, and I think it's better off to just sit at home in the dark, or by myself looking at my phone. Eventually internally I feel bad about what I did, but then I feel too proud to change my answer and pick something until it's too late, or we're talking an hour or two later. This does not happen every time, but lets say once every month. 

Another example. When I go home to visit my parents on the weekend, my mom or dad could say one thing to set me off, and I just get internally conflicted and my mood just snaps from good to bad. I just want to leave. I can't really explain it, but I just want to stop talking to them and just leave and go back home. I never act on this mood with anger or physical abuse ever, but it comes off as depressed or sad on the outside. I feel more withdrawn lately. This weather in the Midwest has been very depressing. I just switched my hours recently to 4 x 10 hour days and at the end of the day I just want to be alone. 

Lately its been harder and harder for me to make a decision when it comes to my own life. I can gladly make decisions for others, quick ones if that (working in acute healthcare), but even something as simple as picking a white or black iPhone has become challenging for me. Something like living with those consequences. What will hold up better over time? I got black last time, do I want to change or get the same thing again? etc etc... simple meaningless things like this give me anxiety.

Big decisions, healthcare, financial decisions, etc are completely fine for me. These small insignificant things are torturous. 

I guess my biggest concern are these mood swings though. I don't know how to stop them from happening, and not emotionally self-harm. Is it as easy as ""I just need to forgive and forget"" and start over, and everything will be better? Is there something deeper that I need medication for? There are so many questions that I have about this, I'm surprised it took me almost 10 years to actually post about this on a message board. ",26Feb2019,3
5,"Ive been passively suicidal for quite a while but for example at school everybody jokes about depression and suicide and I laugh it off but I don’t know what to do I score well in school but I feel empty and worthless and it doesn’t help that I am always made fun of for being overweight. I have also lost interest im many things I used to find fun I used to love theme parks and waterparks but with all the fat jokes I feel like every time I do something I will be made fun of. I don’t like my appearance so I never take off my jacket at school because it I think it makes me look normal, there is also the constant talk about relationships and I feel like I might be gay or bisexual but everyone makes fun of anybody that isn’t straight. Whenever there is a presentation or speech that I have to give I get anxious and feel like everybody is judging me and that they are saying the worst things possible. Im sorry if this was long but I really needed to tell someone.",26Feb2019,3
6,I'm honestly too tired too keep dealing with all the shit and I'm just writing this to let y'all know I'm done. Smoking dirty cig jumping off the roof,26Feb2019,1
7,"I'm a senior in high school right now, and as far as I can tell, I have a bleak future, and an even bleaker present. I'm too lazy to get grades better than C's, and my social life is worse than an 80 year old retiree with a dead spouse and estranged children. I feel as if my default state is depressed, with small bouts of happiness, then back into the trenches for me. I keep thinking I've found happiness in the love of someone else, only for it to be stomped out and kicked until I taste the blood. I can make people laugh and they seem as if they like me, but when the school day ends and everyone goes home, no one calls, no one texts, I doubt anyone thinks of me. I know this story has been told a thousand times by thousands of people before me, and thousands of people after me. I just want to escape all of this. I'm not suicidal yet, but I fear what comes next. I just want to know if anyone else has experienced this, and what you did. Or at-least, something I could do to help myself. I will now check my phone every ten seconds hoping for a reply. What a life.",26Feb2019,1
8," I'm a senior in high school right now, and as far as I can tell, I have a bleak future, and an even bleaker present. I'm too lazy to get grades better than C's, and my social life is worse than an 80 year old retiree with a dead spouse and estranged children. I feel as if my default state is depressed, with small bouts of happiness, then back into the trenches for me. I keep thinking I've found happiness in the love of someone else, only for it to be stomped out and kicked until I taste the blood. I can make people laugh and they seem as if they like me, but when the school day ends and everyone goes home, no one calls, no one texts, and I doubt anyone thinks of me. It's gotten so bad, I don't even like to listen to music anymore, something I used to look forward to a little while ago, now it just seems like unnecessary noise. Every time someone asks what college I'm going to and I reply with \[X\] Community College, I see the disappointment in their eyes. It seems as if everyone else has these nice lives, and the perfect SO. Don't get me wrong, I've had girlfriends, but they never lasted long and ultimately didn't mean much to either person. I know they say having an SO just causes more strife and pain, but I just want to see what a proper relationship is like and experience the life everyone else talks about. I know this story has been told before by countless people before me, and will be told by countless people after me. I just want to escape all of this. I'm not suicidal yet, but I fear what comes next. Wow, I sound like a pretentious asshole reading this back. I just want to know if anyone else has experienced this, and what you did. Or at-least, something I could do to help myself. I will now check my phone every ten seconds hoping for a reply. What a life. ",26Feb2019,3
9,"Yesterday someone emotionally scarred and hurt me with his words. I think I cried for almost 12 hours. I managed to sleep for 1 hour before classes and  I kept going to the toilet due to this crying. Right now, I am crying for almost 1 hour something. I didn't eat yet since last night. I know it is self destructing. I just wanted this crying to stop. I don't have any medications as I am always afraid of the clinics. I have the urge to go but this crying.... Stopping me from going anywhere. It would be nice and appreciated to get some supports from you guys here.  ",26Feb2019,21
10,"I've never posted here before so I don't really know how to word this, but I just want to feel something again.  Does that make sense? I've been so mentally exhausted for so long I've forgotten what it feels like to be happy or excited for things.  I've kinda run out of solutions. I have been playing video games all my life and it's getting to that point to where I just feel nothing when playing with friends.  I don't really feel anything other than sad.  What do I do. ",26Feb2019,7
11,"So as the flair thing says I'm seeking advice. I have depression/suicide have had 5 suicide attempts in the past now the part I need I need advice on is this. I recently started watching irl death vids and I don't know why, I think it's something like people with food problems watching other people eat keeps them calm idk just trying to find out why I'm doing this and if it's something I should tell my counselor like should I be worried or no ",26Feb2019,4
12,"So last year I had a crush on this person. For months I put myself down because of my depression and anxiety. I thought that they would never like me, why would I even try, I'm a depressed piece of garbage, all that and more. But months later I told them because it was suffocating me, it turns out they like me too. 
So for all of you dealing with depression and putting yourselves down, stop for a second and think ""aw heck why not"" and just go for it, whatever it is. You might be missing some good moments ",26Feb2019,19
13,"I had a procedure done incorrectly a couple of years ago, it deformed part of my body and I became very depressed. I finally forced myself to see a plastic surgeon a few months ago and they are telling me that they can improve the area with a fat graft. The problem is I am very thin and they would have to take fat from my thighs. I’m really scared and having trouble trusting that this procedure will turn out ok given that the last doctor performed a procedure recklessly and lied to me about the risks before it started. I’m so terrified that it won’t fix the problem and will cause a new defect on my thighs. I don’t have many support people because I lost most of my friends over the last couple of years and I am too embarrassed to tell most people what happened. I have a high stress demanding job that I am trying to keep. I also have been facing a permanent injury that causes frequent discomfort and loss of ability to easily stay active over the last 6 or so years. I’m still kind of young (28), but this has robbed me of so much. I’m so exhausted and scared. I don’t want to have this surgery but I don’t really have another option. I don’t wanna lose my job but I don’t know if I can keep working with all this stress. If I didn’t work I’m worried I would be really suicidal because I don’t have much else in my life anymore and I have worked so hard to keep my job throughout all these stressful events. Sometimes I am so tired and overwhelmed, and feel like I’ve lost so much already, that I just want to die. ",26Feb2019,8
14,"uhhhhmm okay disclaimer: I'm sorry if I wasted your time if you read but I feel that this is probably my fault.... um so sorry in advanced but I just need like others to re-evaluate my thoughts so that I don't overthink things like I am rn.

So, I am kind of confused on what to do / think because this was my first therapy session and you know hearing the words ""you're not depressed"" really hurt me in some way especially since I feel like I am and have been for many years now. Most of which I was unaware because I'm still young-ish / ignorant (I'm 16)and this is new information I'm receiving / learning all by myself. uhh anyways, less than a week ago i saw a therapist / psychiatrist (can't quite remember their specific profession)  for the first time and i told him about how i hate myself, how i hate my body, told him how i hate my life, i hate the way i talk, i hate the way i act, i hate everything about myself, told him about minor family issues, told him about social and family pressures, told him about issues regarding friends, school stress, how i'm always negative and expect the worst out of things. BUT he says I'm not depressed. He seemed to excuse things as ""i'm a teenager and all teens go through this phase of feeling sad"". he excused my self-hatred as being self-conscious and that its an easy thing to fix. And idk, I just think that doesn't feel right. and I feel like for the most part, this is my fault. maybe I didn't provide enough information or didn't open myself up that much to really ""diagnose"" me with anything. I must admit, I wasn't too comfortable in regard of speaking with a stranger, so I guess thats why I didn't go too much in depth in regards of how I really feel. I also maybe sugar-coated or lied about some serious things that may have been better to actually talk about but I feel like my problem is that I don't want others to worry, especially my parents. And I felt this way because the psychiatrist I saw was a work colleague for both my parents (they are all from the same work place) and I feel like my parents would've discussed things that i'm not ready for them to know about. (I'm aware all things said are confidential and what not and that he needs my permission to speak to them) but there was just this feeling of uncertainty and doubt. Um yeah, so I must agree that lying to him wasn't an ideal thing to do. but yeah, this has been on my mind all week and I just feel stupid. It makes me think that i'm being too sensitive and that i'm stupid or dumb for being sad and feeling lonely all the time for nothing especially when a trained professional says that i'm not depressed. I just hate myself even more. ",26Feb2019,1
15,"Nothing happened to me yet but this morning I've been feeling pretty depressed, and not able to get out of bed. I had homework that I couldn't get myself to do. So, how do i get myself to get up or do work when I'm depressed? ",26Feb2019,3
16,"So yeah we've only been together for 6 months but it's kinda hard for me to see my girlfriend suffer from depression, this clings to her almost every night after we got home from school/date, she tells me that she feels empty, and wanted to be alone,  and to my part i really wanna help her at least lessen her negative emotions but no matter what i do i just get pushed back , i know she doesn't mean it and this is in fact the symptoms of a depressed person, she often shut herself out from everyone and this gets me worried because i'm scared that she might end up taking her own life. this is making me frustrated, i love her and i'd do anything to make her feel at least a little better, i always make sure that i show her i care every single moment, but there are times that she just can't deal with anyone or anything at all and just disappears for a day or too, and for a person like me that has anxiety it makes me terrified not hearing from her, i get paranoid and stressed to the point i cant eat or sleep and just constantly think about her every second.",26Feb2019,6
17,"So this is another of my accounts as I'd like nobody I know to know but I just don't want to be here at all (female/teen) it just doesn't feel right being here I have no purpose and serve no use to anyone but when I want to end it I'm also really tired and just too lazy to actually do it, I wish I could be uthanized thank you for ready about my pathetic ass ",26Feb2019,44
18,"Joie Henney, 65, said his registered emotional support animal named Wally likes to snuggle and give hugs, despite being a freaking 5-foot-long alligator. The man said he received approval from his doctor to use Wally as his emotional support animal after not wanting to go on medication for depression.

&amp;#x200B;

**This is what was lacking in my life, I'll go get an alligator and feel better now** ( if he bites my head off i won't feel pain anymore after all ) 

&amp;#x200B;

This made me laugh quite a bit, support animals have been proven to help reduce anxiety and depression, especially in patients suffering from PTSD, but this one takes the cake

&amp;#x200B;

The news article is easily findable, the story was posted in the ""Detroit News""",26Feb2019,5
19,"So today is my birthday.  I'm 39 and have struggled with depression and suicidal thoughts for as long as I can remember.  I just found this group yesterday and I'm hoping to find some support online to partner with seeing a therapist both individually, and with my wife for couples counseling.  I'm physically healthier than I've ever been.  I'm hoping that with the help I am FINALLY seeking out that I'll be not just physically even healthier at 40, but emotionally and mentally healthier than I've ever been next year.  That's right.  I'm making plans to be around next year.  And the year after.  And the year after.  I am worth it.  My wife is worth it.  My 2 1/2 year old son is worth it.  So are you.",26Feb2019,1
