,text,time,score
20,"I’ve had depression since I was 13 (28F). I’m on an antidepressant that is pretty successful at regulating my moods, but my memory is all messed up. I can’t remember some conversations we’ve had, and she gets very frustrated with me. I don’t blame her, as I have an easy time seeing all my faults. This morning she saw that I forgot to get gas on my way home last night. She said to me “what will you do at a job if you can’t problem solve or critically think?” This really hurt, guys. But I see her point. Despite the fact that I have a college degree, have been successful at many jobs in my adult life, and am constantly trying to work on myself. I go to school full time studying robotics, which is a whole new language in itself. I work part-time at night cleaning a bank. 

I'm stressed out. I know that she is stressed out too. I'm not trying to make excuses for myself, but I feel like my explanation is reasonable. 

My go-to action when my depression kicks up is crying. I've been called a Cry Baby my entire life, ever since preschool. This is something I have tried to change, to no avail. My wife doesn't cry, hardly ever. Her go-to reaction when she gets frustrated is yelling.

The yelling makes me cry, the crying frustrates her more, because then she feels like she can't vent to me. This leads to her shutting down with the words ”well I guess I just have to keep my mouth shut and keep everything to myself then”

This is not my goal. Of course, I want an open, honest relationship. I just don't know how not to be so sensitive.",26Feb2019,1
21,"I guess I’m just looking for some kind of insight here, I don’t know. I’ll try to make sense. 
I have struggled with depression my whole life, even when I didn’t know what depression was. I’m diagnosed with manic depression, as well as dysthymia. My boyfriend is aware of this, but doesn’t seem to understand, I guess you could say. Or maybe he does, and I just think he doesn’t? Idk. ANYWAYS, two years ago I moved very far from my hometown in fl to a big city with him, so he could be closer to his family. Not only does the weather have a huge impact on my mental health, but the fact that I have really no close friends here and nothing to do really. I’ve recently finished school and have a lot of free time now, which is also making things worse because I don’t have a lot of structure. I’m a server and don’t work a whole lot of hours and they’re never the same hours. Lately I’m having a terrible time even getting out of bed. Taking a shower is like moving mountains. I don’t want to be intimate often at all because a- I feel gross and b-I have no energy. It’s taking a huge toll on my relationship. I just know he’s had it with me “being lazy and doing nothing”- is how he views it. I don’t know how to I guess “fix” this? Maybe I am just being lazy? I don’t know. I just feel as though I’m a burden to him more than anything, and he is getting nothing from the relationship. Any word of advice? ",26Feb2019,2
22,"i feel small and empty? I feel like the me in my head is small, and the 'everything else' is bigger and louder. I feel weak and hollow, like even if i had the initiative to fight i would get knocked over right away.  i've had anxiety attacks in the past this isn't that. this is an emptiness, i feel separate from everything. i have an appointment scheduled for next monday. i currently take 5mg of apo-escitilapram daily.  things in my head have been getting worse over the past few weeks. outside stressors, and then not eating well or sleeping right, the big cycle has just churned and here is where i am right now.  has anyone else felt like this?  can you give me some suggestions. today is the first day in three that i have felt able to do anything proactive. ",26Feb2019,2
23,"As a mom I always felt a person's birthday was the most important day of the year. Unfortunately I for me no one feels that way back. For 5 years I've received  1 card on my birthday. It would be nice to get a few. To know someone other than myself thinks I'm important. Perhaps you'd enjoy sending me birthday greetings. My birthday is March 17.
Denise
4645 Crestone Peak St
Brighton, Co 80601
",26Feb2019,1
24, This is my journey with depression [https://notokayisalsookay.wordpress.com](https://notokayisalsookay.wordpress.com/) ,26Feb2019,1
25,Not posting this from my main account for obvious reasons,26Feb2019,1
26,"I'm writing this because I need help to understand what i'm suffering of. And I guess that u will ask why I don't go to some kuind of therapist, its because I can't since everytime I try to engage a conversation about it, I either get to stressed to actually talk about it or someone in my familly comes around and say how stupid I am to think I have depression.

Im now gonna try to describe wat I feel (or more what a have to go through ) :

Im 18,male and lives in eu

Ive never been the social type of guy, when I was young ( kindergarden and all )I didnt had any friends till the end of elemntary school. At this point I began to stay with the nerdy kids and it was pretty sweet( when we didnt got bullied). When I got into secondary school i began to exercice heavelly to be more popular ( yes I was stupid), and I never stopped ,going from Jiu-Jitsu to bodybuilding/powerlifting. 

I've never been able to open my self to anyone even when I had the occasion ( causing major anger problem and violence rage when I was being really stressed), thats why in my familly nobody really knows anything about me appart from me being an iron addict and an ""artist"" (I dont know how to call myself, I just love drawing and art in general). They dont know anything about my love life and if I ever had a girlfriend( wich I haven't).

I woudnt describe myself as ugly but I never had the occasion to have any kind of relationship since everytime I get near to get a girl I get unintrested and remember I dont really feel anything for the girl( I only feel exitment when I flirt and thats all).I dream of finding someone who's gonna make me finally fell something.

 And I dont know why but Im really good at understanding what the others feel ( Im not like feeling pitty when theyr sad or anything tho, I just see really fast the way someone feel.

As I said before I do exercice a lot , like at least 2-3 hour a day even if Im over trainning because its the only thing that make me feel something. And when I dont train I mostly think about it ( like all day) and if I wasn't living in the familly house I would be thinkikg about what I would be going to cook to reach maximum protein intake. I suffer from biggorexia , or at least im pretty sure i do since I never feel big enough and always feel small compared to others ( Im 1m83 {72 inch} and 90 kilos{198 pounds}). Ive become addicted to the feeling of pressure and the pain of the weight , and soreness is a feeling Im dreaming of getting (since I train so much my muscles dont really get sore anymore ).

When Im with a group I mostly hide my ""sadness"" ( if I may call it like that , I dont even know it is ,its just like emptyness all the time). And most of the time I seem really happy but I aint. I never stay happy or sad , It can change a thosen time a day but its only on the inside ( since Im a fucking Iceblock, and cannot express any real emotions with my face appart from all the acting). Oh, also I can't cry , no mater how hard I try.

I mostly really feel the ""primals"" emotions only, like anger or thing like that.

Also when ever I try to express my feelings, I dont know why I seem angry to the others (I mean that they think I am) so my parents always get mad at me for being ""rude"" to the other family members.

&amp;#x200B;

That's all I can think of, sorry if I made any grammatical errors and if its a bit unorganised but its my first time writing down my feelings and all that shit. If u have any questions or precisions u need, feel free to ask in the comments( I may be realy in a bad stat but Im a pretty sweet guy). Also if u think u know what is my problem tell me please...",26Feb2019,1
27,"Hey everyone, I'm depressed for 5 months now (ups &amp; downs), last 8 days have been severe. what's worth living for anymore? idk anymore",26Feb2019,10
28,"Posting this from another account for obvious reasons. I know this is against rule 3 but I really don’t know what else to do
As the headline says I’ve contemplated suicide in one form or another since I was very young. I’m now 37 and the feeling is stronger than ever. 
I’ve never felt I belong anywhere and I seem to always self sabotage my life to the point where I throw away perfectly good opportunities to improve my situation. I don’t know what wrong with me.
I grew up in Egypt, the son of mixed parents, my mum was Greek/Egyptian and my dad is Danish/Egyptian. I went to an American school where all the American expats in Egypt sent their kids so I never really fit in or was accepted as I wasn’t American. I also didn’t fit in with other Egyptians as my Arabic isn’t great (English was my first language) and I can’t read or write Arabic, only speak it. 
I got into some trouble in Egypt when I was a teenager during the old Mubarak regime ( because I looked and behaved like a westerner, the police would arrest me and beat me till my dad would come and pay a bribe to get me out ) so I left when I was 16 and came to the UK and sought asylum. 
That was granted to me after 10 years, but as you can imagine, being an immigrant means you will never really be accepted as part of that country by a lot of people. Don’t get me wrong, I’ve met some loving people here but I’ve also met some horrid people who only judge you by the fact that you’re a foreigner and an immigrant. 
To cut a long story short, I’ve never felt accepted. Not by my ‘own’ people. Not by people here. 
I feel I’ve carried that with me all my life and it’s affected every relationship I’ve ever been in. 
I use to want acceptance so badly. I learnt to play guitar and sing so people would accept me. I started a band and thought that would fix me and make me happy, but again, at every turn or opportunity I would self sabotage myself in some way or another and needless to say, it never amounted to anything. 
I had a daughter at 27 and she’s now 9. Me and her mother have long since split up but my daughter is literally the only thing that’s stopping me from ending this shit. 
I’ve fucked every job I’ve ever had, every opportunity to make something of myself, everything. 
I’m now in a relationship that I thought would be the one that would see me through till the end but even this one is starting to fall apart.

I’m so sorry I’m rambling. I don’t know where to begin. I’ve never written out any of this before and it’s just flooding out. 
I always thought that I should just shut up and stop being such a pussy and get on with it. Man up and lose myself in work or some other distraction until the feeling passes. That’s always worked in the past, but it’s not working anymore. 
I can’t find the motivation to do anything. I’m overweight, my job doesn’t pay enough for me to survive on. I live at my partners house and I’m well aware that she holds all the cards when it comes to whether I have a roof over my head or not.
I know there’s a lot I need to sort out but it’s so overwhelming sometimes I just freeze up and do nothing.

So now I’m here. I don’t know what I’m expecting from writing all this out. Probably nothing will come of it, but I thought I’d give it a try. 
I really don’t know what else to do.",26Feb2019,12
29,Last year I lost an extremely close friend to suicide. He had struggled with a Keaton addiction for three years before he died. When he died last year I didn’t think about it. Pushed it out of my mind and kept on throughout the day. Recently near the anniversary or his death I got in contact with his mom and started reminiscing. Maybe to much because I like started having shitty thoughts. It’s literally the worst I have to pretend to be happy around my friends and shit I don’t know wtf is wrong with me man. It’s literally fucked I can’t function in social scenarios anymore I just put my head down and walk past. I push like all my friends away and it’s just what is going on. ,26Feb2019,1
30,"I really just wanted some answers, maybe someone have them. Im a 24 year old guy and pretty much got what i wanted in life, but why do i feel so empty ?? i dont understand why i do what i do, and i feel like im faking being ""happy/okey, and im not. im not alone but it feels like it.",26Feb2019,1
32,"Hi, i am 16 right now and i am playing rugby in high school, I have been a position called scrum half for the past 2 years in the school. Today someone told me that there is a kid from grade 10 who played rugby last year in junior high is really good and insane, he might be taking over my position. I am a bit nervous that i will lost my play time because of it. But the coach told me last year that he won't change the scrum half and the fly half since we are a great combo, but still......... i am really nervous about that kid, i love this position and i enjoy it a lot, help?",26Feb2019,1
33,"I’m terrified of death and not knowing what comes after it, but I don’t see life as something precious or valuable. All I see is suffering and endless hopelessness. I am losing interest in everything and I can feel myself slipping away. It’s been like this for so long I don’t know what happiness feels like and I spend my days drifting in a mixture of self loathing and numbness. I’m so tired and find sleep to be my only escape. School on top of my struggling really exhausts me mentally and physically. I’m scared to die, but falling asleep for a really long time just sounds so nice. Even then though, I’d have to wake up and face the cruel reality that there really isn’t anything to be happy about. And it hurts because I can’t escape it. No matter how many nights I spend trying to cry the pain away it’s still there. I have no motivation to really change my life either though, I physically can’t force myself no matter how much I want to, to do anything productive. I don’t know how much longer I can do this, does anybody know what to do? I’m overflowed with these feelings and I can’t help but feel the only way to get some release besides sleep is to harm myself, even if I know it’s not going to help in the end. I’m just done and I can’t keep up with school or my relationships anymore. I need some advice on what to do :(",26Feb2019,47
