,text,time,score
18,"Hey all, I'm new to this sub. 

I recently removed a person from my life. It seemed like they were really important but in reality they were definitely a distraction for my real problems. My social anxiety, my depression, my dissatisfaction with my professional/monetary status, my frustration with not being able to move out even though I have a full time job (33k a year is so not enough). Not to mention I havent had the desire to do anything but drag myself to work for... probably years at this point. I have random spurts of motivation but the depression always comes back and nothing brings me real joy. I used to draw and write and play games. Now I can barely do anything but scroll through reddit.
I'm planning on going back to school in the fall (which my job will pay for entirely yay.) I've joined meet up, and I have plans to get put on a med for my depression. I've already been in talk therapy for close to a year now as well.
What I'm wanting to know is how long did it take you to adjust to a huge life change? Did a med help you? I guess I'm just feeling really mixed up. I find myself randomly bursting into tears all the time looking at my life, looking at how I can't maintain hobbies or build friendships without being massively flakey because my mood is so unpredictable. 
Hopefully that wasnt TOO all over the place.
I just need a little support/advice and maybe some encouragement? 

Thanks for reading",26Mar2019,1
19,"I'm considering in quit college. 
I'm a freshman but I start to have anxiety attacks like drop out classes or even I cut my hair when I feel so bad. I can't stand stay in much classes (I can't concentrate) and think about future get me a lot of pain. 
Currently I have stomach hurts, and I don't assist in more than a half of my subjects. I feel insecure about myself in take a decision: I have a good scholarship and my parents are happy with it. They remind me that is a good support for financial state of the family and I'm crying a lot because I have low school performance than I used to be in high school.
I was a good student with good grades (the third excellent student in the generation of my high school) but now I feel like it was a fake. 

The school was an emotional stability. I don't have more, so if I fail in it, I fail in everything. 

I see in me more bad things than good things. If I do a alternative route I will make the same. At this point I see useless my life. I don't have a goal (I enter to college only for don't work) and If I have I will fail in that. I feel like someone else would do better than me: like daughter, student or human. 
I started to think in kill me, since the past year. I give me a opportunity to reconsidered but I fail. I'm only wait for watch the last chapter of a novel and with that I ended my life or a least cause me  an accident. 
I hope that my choice will be before April. ",26Mar2019,2
20,"I don't know anymore. I think I'm depressed. But something is always telling me that I just want attention. It's not even other people, it's just.. Me. I'm telling that to myself, in a way. I'm so alone. I feel like it. I always act so happy... Yet I'm actually screaming for help. I noticed that I use a lot of words associated with sadness when we're supposed to come up with some random words and stuff at school. I noticed that I tell myself that I want to die and that I don't care anymore, but I know I do. I just feel like I don't. I feel like I'm worthless. I just want to stay in bed forever. I want time to stop. I want to be the only person on Earth, so I can cry in peace. That's the thing. I need help, I want help. But I'm afraid to get it. I oh so many times chatted with a friend online, wanting to just type in all caps that I need help. I looked at my mom so many types, pleading for her to help me, but she never notices. Because I never say it out loud. I want to talk to someone about what I'm feeling. But
It's so difficult to explain what I need to explain. I don't like discussing my problems. I just want peace. But

I want to scream so much. Please. I'm begging, anyone. Please. I can't talk to anyone. Even now I just want to delete everything I just wrote. It feels so detailless. It feels like you won't even be able to understand what I need you to understand. I'm so lost. I've been crying for over an hour. I can't stop. When I do, I start again soon after. I want to sleep. I'm so tired. This is so long, but I don't want to stop typing. It's like life in a way. It's so long and so sad and meaningless, but I need to hold onto it, for whatever reason. ",26Mar2019,2
21,"I hate my face and my body type ,I'm so ugly ,I have problem with acne and my body looks horrible , I cant help it but that makes me depressed.I feel urge to vomit when I see myself in the mirror . When I say that to someone and they compliment me I even feel worse . I'm 22 and I never been in relationship , I feel so anxious and lonely .
I was bullied a lot when I was younger because of my appearance one dude literally cried on prom when they told him that he should go with me . I feel super low.
",26Mar2019,2
22,"Ive had really bad issues of recently with my family, friends, and myself. For the past 2 weeks ive been depressed (im 99% sure i have depression bc my mom has been clinically diagnosed with severe depression, and i have alot of the same symptoms) im not suicidal by any means, i just get really sad and stuck in this hole i cant climb out of and stuck in my mind until something happens that pulls me out of it. The past 2 weeks ive had a ""episode"" and i was happy today and yesterday but im not so sure now",26Mar2019,2
23,"I’ve been really struggling these past few weeks to do anything at all, I get out of bed, sit around all day, sometimes eat some sugary snacks, and go back to sleep as soon as I can.. it’s just making me angry at myself at this point but I don’t know how to break the cycle/get motivation to do anything at all

(I’m 20 and a full time student (not a very good one at all) if anyone wants context)",26Mar2019,40
24,"Hello,

   So, I have been trying to change as a person. I am trying to be more positive and trying to like myself more. However, nothing works.



I go to the Gym, I do my make up now, I dress in clothes that are cute, I shower every single day now. Nope. Doesn't matter. I think what feeds me not liking myself is how people talk to me. I get talked to like I am complete garbage and I beg for people to be nice to me and they don't stop. They will never be nice to me. They make fun of the noise I make when I am doing exercises, which I haven't done in years, so it hurts so bad. If I post a selfie on my Facebook trying to be positive, internet trolls come in and let me know they hate me. I just feel like trash to everyone. Everyone just takes out their anger and issues on me.

  
 
 I just have been crying and crying. I just cannot be happy. I feel like happiness is not an option. I always talk about how I wish to not live anymore, and it's getting worse. It's getting worse and worse. I have no self worth.



  I am just going to say I am too sick to go to the gym now and not post pictures anymore. I wanted to do cosplay modelling someday when I get my body the way I want it, but I know I will get so much backlash to where I cannot handle it. 


",26Mar2019,2
25,,26Mar2019,13
